id,conversation_id,created_at,date,time,timezone,user_id,username,name,place,tweet,language,mentions,urls,photos,replies_count,retweets_count,likes_count,hashtags,cashtags,link,retweet,quote_url,video,thumbnail,near,geo,source,user_rt_id,user_rt,retweet_id,reply_to,retweet_date,translate,trans_src,trans_dest
1319803429762588674,1319800775355322369,2020-10-23 21:50:33 -03,2020-10-23,21:50:33,-0300,1251625471659425792,xeulebot,Xeulê,,@Arthur02493036 Estadão: (3 min) Precisamos apresentar melhores resultados” diz Mourão sobre desmatamento na Amazônia  https://t.co/fEazI0psWw,pt,[],"['http://outline.com/https://sustentabilidade.estadao.com.br/noticias/geral,precisamos-apresentar-melhores-resultados-diz-mourao-sobre-desmatamento-na-amazonia,70003486972?utm_source=twitter:newsfeed&utm_medium=social-organic&utm_campaign=redes-sociais:102020:e&utm_content=:::&utm_term=']",[],0,0,0,[],[],https://twitter.com/XeuleBot/status/1319803429762588674,False,,0,,,,,,,,"[{'screen_name': 'Arthur02493036', 'name': 'Uma simples pessoa', 'id': '1306195080663961601'}]",,,,
1319800920297832448,1319800920297832448,2020-10-23 21:40:34 -03,2020-10-23,21:40:34,-0300,978030180584316929,pedromottab,PedroMottadeBarros,,Delegado da PF diz que principais causas de desmatamento na Amazônia são grilagem e madeira ilegal  https://t.co/qmNDFzAIJu,pt,[],['https://br.reuters.com/article/ambiente-delgado-amazonia-grileiros-idBRKBN2772XO-OBRDN'],[],0,5,3,[],[],https://twitter.com/PedroMottaB/status/1319800920297832448,False,,0,,,,,,,,[],,,,
1319800775355322369,1319800775355322369,2020-10-23 21:40:00 -03,2020-10-23,21:40:00,-0300,9317502,estadao,Estadão,,Precisamos apresentar melhores resultados” diz Mourão sobre desmatamento na Amazônia  https://t.co/UMK9HMvwUw,pt,[],['https://bit.ly/3jlnLz7'],[],15,3,93,[],[],https://twitter.com/Estadao/status/1319800775355322369,False,,0,,,,,,,,[],,,,
1319798459524853767,1319798459524853767,2020-10-23 21:30:48 -03,2020-10-23,21:30:48,-0300,83294591,contilnet,ContilNet Notícias,,Mourão apresenta a europeus meta de reduzir desmatamento na Amazônia em 50% até 2023  https://t.co/69Pj4nDL38,pt,[],['https://contilnetnoticias.com.br/2020/10/mourao-apresenta-a-europeus-meta-de-reduzir-desmatamento-na-amazonia-em-50-ate-2023/'],[],0,0,0,[],[],https://twitter.com/ContilNet/status/1319798459524853767,False,,0,,,,,,,,[],,,,
1319789969767092224,1319789969767092224,2020-10-23 20:57:03 -03,2020-10-23,20:57:03,-0300,1260341308570337280,carolinagomesa6,Carolina Gomes Araujo,,"A embaixadores, Mourão fala em reduzir desmatamento na Amazônia em 50% até 2023  https://t.co/EjtBcnArvP",pt,[],['https://carolinagoma.tumblr.com/post/632809021714399232'],[],0,0,0,[],[],https://twitter.com/CarolinaGomesA6/status/1319789969767092224,False,,0,,,,,,,,[],,,,
1319788530026106882,1319783017573994497,2020-10-23 20:51:20 -03,2020-10-23,20:51:20,-0300,1309246346394828800,fmalacof,fmalacoFREE,,"@BlogdoNoblat Aos fatos: ✔R$ 30 milhões em insumos para produzir cloroquina.Dinheiro gasto na lorota do vermífugo.Não curam virus ✔ Faltaram sedativos e anestésicos para intubados ✔Desmatamento da Amazônia sibiu 34%,em 1 ano ✔20.360 km2 devastados no Pantanal ✔156.528 mortos por Covid-19  https://t.co/SO1mEcqqKJ",pt,[],[],['https://pbs.twimg.com/media/ElDTI8BXUAEIr3m.jpg'],0,0,0,[],[],https://twitter.com/FmalacoF/status/1319788530026106882,False,,1,https://pbs.twimg.com/media/ElDTI8BXUAEIr3m.jpg,,,,,,,"[{'screen_name': 'BlogdoNoblat', 'name': 'Blog do Noblat', 'id': '16794066'}]",,,,
1319785192698056705,1319785192698056705,2020-10-23 20:38:05 -03,2020-10-23,20:38:05,-0300,1250959017121366018,isabell72883960,Isabella Barros Pereira,,"A embaixadores, Mourão fala em reduzir desmatamento na Amazônia em 50% até 2023  https://t.co/hkmJAvh6LB",pt,[],['https://blogdabellap.blogspot.com/2020/10/a-embaixadores-mourao-fala-em-reduzir.html'],[],0,0,0,[],[],https://twitter.com/Isabell72883960/status/1319785192698056705,False,,0,,,,,,,,[],,,,
1319779781085417472,1319773093099864064,2020-10-23 20:16:34 -03,2020-10-23,20:16:34,-0300,736019078008176640,zero_momento,momento.zero,,"@g1 @VilminhaBarret1 ""A embaixadores, Mourão fala em reduzir desmatamento na Amazônia em 50% ""  Tradução:   podem desmatar à vontade, pois o 50% da meta é muito grande. Só este ano, o trio Mourão-bozo-Salles permitiu a queimada e o desmatamento de mais de 2.000.000 de ha, apenas no Pantanal",pt,[],[],[],0,0,0,[],[],https://twitter.com/zero_momento/status/1319779781085417472,False,,0,,,,,,,,"[{'screen_name': 'g1', 'name': 'G1', 'id': '8802752'}, {'screen_name': 'VilminhaBarret1', 'name': 'Vilma Barreto🚩', 'id': '1048588259415220225'}]",,,,
1319773959957741574,1319773093099864064,2020-10-23 19:53:26 -03,2020-10-23,19:53:26,-0300,2820009808,serbretas,sergio bretas,,"@g1 ""Reduzir desmatamento na Amazônia em 50% até 2023"" A cara de pau do marcha-lenta @GeneralMourao",pt,"[{'screen_name': 'generalmourao', 'name': 'general hamilton mourão', 'id': '1058819604741525510'}]",[],[],0,0,9,[],[],https://twitter.com/serbretas/status/1319773959957741574,False,,0,,,,,,,,"[{'screen_name': 'g1', 'name': 'G1', 'id': '8802752'}]",,,,
1319773093099864064,1319773093099864064,2020-10-23 19:50:00 -03,2020-10-23,19:50:00,-0300,8802752,g1,G1,,"A embaixadores, Mourão fala em reduzir desmatamento na Amazônia em 50% até 2023  https://t.co/Tfy15aBBtU #G1  https://t.co/cXykFdKkNS",pt,[],['https://glo.bo/3jpXOOX'],['https://pbs.twimg.com/media/ElDBHVzW0AEX7Q6.jpg'],52,6,186,['g1'],[],https://twitter.com/g1/status/1319773093099864064,False,,1,https://pbs.twimg.com/media/ElDBHVzW0AEX7Q6.jpg,,,,,,,[],,,,
1319767067927760897,1319767067927760897,2020-10-23 19:26:03 -03,2020-10-23,19:26:03,-0300,1302946004728250369,mangueiraabilio,Lourdilene Abílio Mangueira Cabral,,"A embaixadores, Mourão fala em reduzir desmatamento na Amazônia em 50% até 2023  https://t.co/SnVbsX8KKr",pt,[],['https://paraibaempauta.com.br/noticia/3156/a-embaixadores-mourao-fala-em-reduzir-desmatamento-na-amazonia-em-50-ate-2023.amp'],[],0,0,0,[],[],https://twitter.com/MangueiraAbilio/status/1319767067927760897,False,,0,,,,,,,,[],,,,
1319764406645985280,1319764406645985280,2020-10-23 19:15:29 -03,2020-10-23,19:15:29,-0300,1108824446347984897,bandnewsmanaus,BandNews Difusora,,"Criado em 2008, o fundo recebe doações de instituições e governos internacionais para financiar ações de prevenção e combate ao desmatamento na Amazônia Legal. Veja:  https://t.co/u40tCgPloC",pt,[],['http://www.bandnewsdifusora.com.br/2020/10/23/ricardo-salles-volta-a-defender-reformulacao-do-fundo-amazonia/'],[],0,0,0,[],[],https://twitter.com/BandNewsManaus/status/1319764406645985280,False,,0,,,,,,,,[],,,,
1319761758656090117,1319761758656090117,2020-10-23 19:04:57 -03,2020-10-23,19:04:57,-0300,29913589,revistaistoe,Revista ISTOÉ,,"Criado em 2008, o fundo recebe doações de instituições e governos internacionais para financiar ações de prevenção e combate ao desmatamento na Amazônia Legal   https://t.co/E7I86WWsof",pt,[],['https://istoe.com.br/no-stf-ricardo-salles-defende-reformulacao-do-fundo-amazonia/'],[],2,0,7,[],[],https://twitter.com/RevistaISTOE/status/1319761758656090117,False,,0,,,,,,,,[],,,,
1319759943038324738,1319759943038324738,2020-10-23 18:57:45 -03,2020-10-23,18:57:45,-0300,1094259165072101376,lfhsluiz,Luiz Fernando,,"Com queimadas e desmatamento quebrando todos os recordes, o Salles tem a desfaçatez de falar em fundo da Amazônia com recursos internacionais. Ele tem é que prestar contas dos bilhões que havia no fundo. Não foram aplicados a favor da Amazônia, visto que aumentou a destruição.",pt,[],[],[],0,0,0,[],[],https://twitter.com/LFHSluiz/status/1319759943038324738,False,,0,,,,,,,,[],,,,
1319755331833036800,1319755331833036800,2020-10-23 18:39:25 -03,2020-10-23,18:39:25,-0300,1255625577228316672,antidoido,#lavaJATO e #SomosTodosMORO,,PAPINHO AMADOR PRA INGLÊS VER?   Mourão apresenta a europeus meta de reduzir desmatamento na Amazônia em 50% até 2023  https://t.co/OCyenPOcco,pt,[],['https://oglobo.globo.com/sociedade/mourao-apresenta-europeus-meta-de-reduzir-desmatamento-na-amazonia-em-50-ate-2023-1-24709543?utm_source=Twitter&utm_medium=Social&utm_campaign=compartilhar'],[],9,4,41,[],[],https://twitter.com/AntiDoido/status/1319755331833036800,False,,0,,,,,,,,[],,,,
1319750055012827136,1319750055012827136,2020-10-23 18:18:27 -03,2020-10-23,18:18:27,-0300,1163901505252057088,resistenciaja1,🚩SouResistência#LulaLá 🇧🇷🇨🇺🇻🇪🇦🇷,,"Isso @rsallesmma Governo Perfeito ,não existe desmatamento ,grilagem ,invasao de  Terras indígenas, garimpos ilegais ,Perseguição a Quilombolas,Fogo na Amazônia e Pantanal e a Cloroquina cura o COVID !",pt,"[{'screen_name': 'rsallesmma', 'name': 'ricardo salles', 'id': '971822131024748545'}]",[],[],0,0,0,[],[],https://twitter.com/resistenciaja1/status/1319750055012827136,False,https://twitter.com/UOLNoticias/status/1319738186772500492,0,,,,,,,,[],,,,
1319747277456592897,1319747277456592897,2020-10-23 18:07:25 -03,2020-10-23,18:07:25,-0300,46761117,mppaoficial,MP do Pará,,"Reunião debate estratégias de combate ao desmatamento na Amazônia  GT do desmatamento, formado por promotores de justiça de várias regiões do Estado, elaborou plano estratégico emergencial contra o desmatamento  Leia em:  https://t.co/sVWblHQsc5  https://t.co/Kn1FPdOfk9",pt,[],['https://bit.ly/2TnnzVH'],['https://pbs.twimg.com/media/ElCvJfpWAAAuw5O.jpg'],0,0,3,[],[],https://twitter.com/MPPAoficial/status/1319747277456592897,False,,1,https://pbs.twimg.com/media/ElCvJfpWAAAuw5O.jpg,,,,,,,[],,,,
1319745504507559941,1319745504507559941,2020-10-23 18:00:22 -03,2020-10-23,18:00:22,-0300,138492825,proindio,Comissão Pró-Índio,,"Principal do desmatamento na Amazônia é a grilagem de terra e a extração ilegal de madeira, afirmou o Superintende da Polícia Federal no Amazonas, nessa quinta (22). Via @Terra  https://t.co/XH2aKMFlga",pt,"[{'screen_name': 'terra', 'name': 'terra', 'id': '80937256'}]","['https://www.terra.com.br/noticias/brasil/delegado-da-pf-diz-que-principais-causas-de-desmatamento-na-amazonia-sao-grilagem-e-madeira-ilegal,0d379bcd43d8ad31a1b43f18e08c1f7bgjc1g1w7.html?utm_source=NEWSSTAND&utm_medium=rss']",[],3,4,18,[],[],https://twitter.com/proindio/status/1319745504507559941,False,,0,,,,,,,,[],,,,
1319741001037193220,1319735687382523906,2020-10-23 17:42:28 -03,2020-10-23,17:42:28,-0300,188049724,beto_toscani,Beto Toscani,,@meASKme2 @MarxSimpsons @Zenobre1 @Ree_Lucci @volhovade Esses dias estava corrigindo dever da escola da minha filha e fiquei abismado com a doutrinação: texto de português dizendo que a pecuária causa desmatamento na Amazônia e uma questão de geografia deixando bem claro que a Terra é REDONDA. Comunistas...,pt,[],[],[],3,0,2,[],[],https://twitter.com/beto_toscani/status/1319741001037193220,False,,0,,,,,,,,"[{'screen_name': 'meASKme2', 'name': 'VOTE BOULOS 50✌🏽 / PerguntarNãoOfende II 💁🏾\u200d♀️', 'id': '1102955161952178179'}, {'screen_name': 'MarxSimpsons', 'name': 'Marx Simpson - IMPEACHMENT JÁ! 🇧🇷🇨🇺🇵🇹🏴', 'id': '233552085'}, {'screen_name': 'Zenobre1', 'name': 'Zenobre', 'id': '1077928171'}, {'screen_name': 'Ree_Lucci', 'name': 'Renata Lucci', 'id': '61318235'}]",,,,
1319737276805632003,1319737276805632003,2020-10-23 17:27:40 -03,2020-10-23,17:27:40,-0300,47754867,congressoemfoco,Congresso em Foco,,O dinheiro será destinado ao @brasil_IBAMA para o combate às queimadas e ao #desmatamento ilegal. #MeioAmbiente #Amazônia #Pantanal  https://t.co/iHx8eVgIC4,pt,"[{'screen_name': 'brasil_ibama', 'name': 'ibama', 'id': '38790549'}]",['https://bit.ly/3ofS5ix'],[],1,0,3,"['desmatamento', 'meioambiente', 'amazônia', 'pantanal']",[],https://twitter.com/congressoemfoco/status/1319737276805632003,False,,0,,,,,,,,[],,,,
1319735560001490945,1319735560001490945,2020-10-23 17:20:51 -03,2020-10-23,17:20:51,-0300,33582597,crismorelo,CrisLulaHaddad13⛳ #HaddadLula2022,,#ManausQuerZe13  Não ao desmatamento da Amazônia!!,pt,[],[],[],0,1,5,['manausquerze13'],[],https://twitter.com/Crismorelo/status/1319735560001490945,False,https://twitter.com/Calladoproject/status/1319732531424624643,0,,,,,,,,[],,,,
1319734808176676865,1319734808176676865,2020-10-23 17:17:52 -03,2020-10-23,17:17:52,-0300,435712677,drpablospinola,Pablo Spinola,,Já falhou ! Com este presidente e ministro de relações exteriores ... “O acordo com o Mercosul pode falhar se o Brasil não se comprometer contra o desmatamento da Amazônia”  https://t.co/AT5B5VSRXq via @elpais_brasil,pt,"[{'screen_name': 'elpais_brasil', 'name': 'el país brasil', 'id': '2174537102'}]",['https://brasil.elpais.com/internacional/2020-10-22/o-acordo-com-o-mercosul-pode-falhar-se-o-brasil-nao-se-comprometer-contra-o-desmatamento-da-amazonia.html?ssm=TW_CC'],[],0,0,1,[],[],https://twitter.com/drpablospinola/status/1319734808176676865,False,,0,,,,,,,,[],,,,
1319732216403009542,1319675046269419525,2020-10-23 17:07:34 -03,2020-10-23,17:07:34,-0300,1288311912275607555,politicainteiro,Política Por Inteiro,,"O representante do Amapá acredita que é importante adotar uma visão que valorize o patrimônio natural da Amazônia, com o fortalecimento das instituições ambientais federais e combate ao desmatamento através de planejamento",pt,[],[],[],1,0,0,[],[],https://twitter.com/PoliticaInteiro/status/1319732216403009542,False,,0,,,,,,,,[],,,,
1319732012283006978,1319726682975121408,2020-10-23 17:06:45 -03,2020-10-23,17:06:45,-0300,240837501,leandro_cx,Leandro Cordeiro⚡️🇪🇪🇧🇷,,"@Fasalles Engraçado ver na lista empresas que até pouco tempo se beneficiavam de desmatamento, agora são defensores da Amazônia, derrubaram o que puderam em outros locais do país e agora querem se passar por mocinhos, enfim Brasil 🇧🇷",pt,[],[],[],0,0,0,[],[],https://twitter.com/leandro_cx/status/1319732012283006978,False,,0,,,,,,,,"[{'screen_name': 'Fasalles', 'name': 'Fabricia Salles', 'id': '47251304'}]",,,,
1319714435448135681,1319714435448135681,2020-10-23 15:56:55 -03,2020-10-23,15:56:55,-0300,126138484,gesner_oliveira,Gesner Oliveira,,Os impactos do desmatamento e a importância de um monitoramento constante são os assuntos tratados pelo Superintendente geral da Fundação Amazônia Sustentável Virgílio Viana.  https://t.co/C6RYbYMHLt,pt,[],[],['https://pbs.twimg.com/media/ElCRBZaXYAIAhqU.jpg'],0,0,1,[],[],https://twitter.com/gesner_oliveira/status/1319714435448135681,False,,1,https://pbs.twimg.com/media/ElCRBZaXYAIAhqU.jpg,,,,,,,[],,,,
1319706526794321922,1319706526794321922,2020-10-23 15:25:29 -03,2020-10-23,15:25:29,-0300,176859552,trudaoceans,"José Truda Palazzo, Jr. 🇫🇲🇫🇲🇫🇲☘️",,"Rondônia tem alta de 42% nos alertas de desmatamento em setembro, revela Imazon | Amazônia | G1  https://t.co/t2QWitwhHa",pt,[],['https://g1.globo.com/ro/rondonia/natureza/amazonia/noticia/2020/10/21/rondonia-tem-alta-de-42percent-nos-alertas-de-desmatamento-em-setembro-revela-imazon.ghtml'],[],0,0,1,[],[],https://twitter.com/TrudaOceans/status/1319706526794321922,False,,0,,,,,,,,[],,,,
1319705803205546004,1319705803205546004,2020-10-23 15:22:37 -03,2020-10-23,15:22:37,-0300,176859552,trudaoceans,"José Truda Palazzo, Jr. 🇫🇲🇫🇲🇫🇲☘️",,Bozo e Salles a serviço do crime: Delegado da PF diz que principais causas de desmatamento na Amazônia são grilagem e madeira ilegal  https://t.co/DfPCgBXKeP,pt,[],['https://br.reuters.com/article/ambiente-delgado-amazonia-grileiros-idBRKBN2772XO-OBRDN'],[],0,0,1,[],[],https://twitter.com/TrudaOceans/status/1319705803205546004,False,,0,,,,,,,,[],,,,
1319704432318230529,1319704432318230529,2020-10-23 15:17:10 -03,2020-10-23,15:17:10,-0300,1278153745969426432,maiconkusterlol,𝒖𝒎 𝒑𝒆𝒔𝒔𝒊𝒎𝒊𝒔𝒕𝒂 𝒂𝒏𝒕𝒊 𝒔𝒐𝒄𝒊𝒂𝒍 ッ,,"Me acho uma pessoa relativamente jovem, mas essa cultura que tu posta ""o presidente fez tal coisa"", ""que parada triste no desmatamento na Amazônia"" e a meninada comenta ""pois é"" com um vídeo de 10MIN de algum artista coreano com o cabelo loiro, EU NUNCA VOU ENTENDER.",pt,[],[],[],1,0,2,[],[],https://twitter.com/Maiconkusterlol/status/1319704432318230529,False,,0,,,,,,,,[],,,,
1319703170797502467,1319703170797502467,2020-10-23 15:12:09 -03,2020-10-23,15:12:09,-0300,2674564802,niltotatto,🇧🇷 Nilto Tatto - #ForaBolsonaro 🍀,,"Delegado da PF diz que principais causas de desmatamento na Amazônia são grilagem e madeira ilegal  O superintende da PF no Amazonas, Alexandre Saraiva, aponta a grilagem de terras e exttração de madeira como causa do desmatamento @ReutersBrasil  https://t.co/W71V1uMcmF  https://t.co/DYqGsqr7am",pt,"[{'screen_name': 'reutersbrasil', 'name': 'reuters brasil', 'id': '17711232'}]",['https://cutt.ly/ggbrwD6'],['https://pbs.twimg.com/media/ElCHA7xWkAI71I3.png'],1,8,14,[],[],https://twitter.com/NiltoTatto/status/1319703170797502467,False,,1,https://pbs.twimg.com/media/ElCHA7xWkAI71I3.png,,,,,,,[],,,,
1319688538804334594,1319688538804334594,2020-10-23 14:14:00 -03,2020-10-23,14:14:00,-0300,726076381910687744,lou_beldi,Lou Beldi,,Delegado da PF diz que principais causas de desmatamento na Amazônia são grilagem e madeira ilegal  https://t.co/calhQ4xQLw,pt,[],['https://br.reuters.com/article/ambiente-delgado-amazonia-grileiros-idBRKBN2772XO-OBRDN'],[],0,0,0,[],[],https://twitter.com/lou_beldi/status/1319688538804334594,False,,0,,,,,,,,[],,,,
1319683086892867593,1319683086892867593,2020-10-23 13:52:21 -03,2020-10-23,13:52:21,-0300,1282781396881281024,lavidiann,kelly jener ☽︎☾︎,,O boi vivo x o desmatamento da Amazônia ejdnsnsn,pt,[],[],[],2,1,12,[],[],https://twitter.com/lavidiann/status/1319683086892867593,False,https://twitter.com/luquinha/status/1319459810656591873,0,,,,,,,,[],,,,
1319677739440504837,1319677739440504837,2020-10-23 13:31:06 -03,2020-10-23,13:31:06,-0300,568463685,cidinhaday,Maria  Aparecida da,,“O acordo com o Mercosul pode falhar se o Brasil não se comprometer contra o desmatamento da Amazônia” - EL PAÍS Brasil  https://t.co/gbK5aRBE74 via @GoogleNews,pt,"[{'screen_name': 'googlenews', 'name': 'google news', 'id': '33584794'}]",['https://brasil.elpais.com/internacional/2020-10-22/o-acordo-com-o-mercosul-pode-falhar-se-o-brasil-nao-se-comprometer-contra-o-desmatamento-da-amazonia.html'],[],0,0,0,[],[],https://twitter.com/Cidinhaday/status/1319677739440504837,False,,0,,,,,,,,[],,,,
1319677248983736323,1319677248983736323,2020-10-23 13:29:09 -03,2020-10-23,13:29:09,-0300,1452610518,uea_parintins,UEA Parintins,,"Professor de Parintins entre os VENCEDORES do IX Prêmio José Bonifácio de Andrada e Silva.  MSc. Brychtn Vasconcelos venceu na categoria ESTUDANTE DE DOUTORADO, com o tema ""Reflexões sobre desmatamento e fogo na Amazônia nos anos recentes e os desafios futuros"".  https://t.co/TMrR8zBS69",pt,[],[],['https://pbs.twimg.com/media/ElBvRzpWAAENSwk.jpg'],0,1,3,[],[],https://twitter.com/UEA_Parintins/status/1319677248983736323,False,,1,https://pbs.twimg.com/media/ElBvRzpWAAENSwk.jpg,,,,,,,[],,,,
1319675897465679874,1319675897465679874,2020-10-23 13:23:47 -03,2020-10-23,13:23:47,-0300,2782559733,rodrigues_jadh,"Preta, Jadh",,Eu amei que ligaram para me agradecer por participar das petições contra a exploração e o desmatamento da Amazônia... Sendo que é o mínimo e não faz mais que minha obrigação,pt,[],[],[],0,0,5,[],[],https://twitter.com/rodrigues_jadh/status/1319675897465679874,False,,0,,,,,,,,[],,,,
1319658942839033857,1319658942839033857,2020-10-23 12:16:24 -03,2020-10-23,12:16:24,-0300,1288317212302938112,marcosv38297656,Marcos venicio S de Carvalho Santos,,"Parabéns sempre à PF que com a independência necessária desenvolve um trabalho essencial para a população brasileira, temos que acabar com o desmatamento na Amazônia e em todo o território brasileiro, chega de trambiques, malfeitos e desinformação, necessitamos de políticas forte",pt,[],[],[],0,0,0,[],[],https://twitter.com/Marcosv38297656/status/1319658942839033857,False,https://twitter.com/policiafederal/status/1319632452168634368,0,,,,,,,,[],,,,
1319645525847773184,1319645525847773184,2020-10-23 11:23:05 -03,2020-10-23,11:23:05,-0300,1138450723883147265,lmodelli,Laís Modelli,,"1 nova epidemia acontece no mundo a cada 5 anos. O motivo? Entre outros, o desmatamento das florestas tropicais. Entrevistei as principais autoridades no assunto no mundo e conta a história aqui. #coronavirus #amazonia   https://t.co/WUV2J8YoIn",pt,[],['https://g1.globo.com/ciencia-e-saude/noticia/2020/10/23/75percent-das-doencas-infecciosas-emergentes-que-afetam-o-homem-vieram-de-animais-diz-brasileira-que-estuda-relacao-entre-epidemias-e-desmatamento-das-florestas.ghtml'],[],0,1,0,"['coronavirus', 'amazonia']",[],https://twitter.com/LModelli/status/1319645525847773184,False,,0,,,,,,,,[],,,,
1319643861619232769,1319643861619232769,2020-10-23 11:16:29 -03,2020-10-23,11:16:29,-0300,22281158,carla55,Carla Borgers,,"Assine a petição para proibir o desmatamento na Amazônia, por pelo menos 5 anos!  https://t.co/bQrfPxGwcE",pt,[],['https://secure.avaaz.org/community_petitions/en/congresso_naciona_assine_a_peticao_para_proibir_o_desmatamento_na_amazonia_por_pelo_menos_5_anos_2/?wceUqdb&utm_source=sharetools&utm_medium=twitter&utm_campaign=petition-1127710-assine_a_peticao_para_proibir_o_desmatamento_na_amazonia_por_pelo_menos_5_anos&utm_term=ceUqdb%2Ben'],[],0,0,0,[],[],https://twitter.com/Carla55/status/1319643861619232769,False,,0,,,,,,,,[],,,,
1319642024929316864,1319642024929316864,2020-10-23 11:09:11 -03,2020-10-23,11:09:11,-0300,113410319,jornalistavitor,Vitor Santos,,PF: Grilagem e extração ilegal de madeira são as principais causas do desmatamento na Amazônia.   @VigaRodrigo   https://t.co/BQuF80CG9P,pt,"[{'screen_name': 'vigarodrigo', 'name': 'vigarodrigo', 'id': '2707674328'}]",['https://buff.ly/3joulFl'],[],0,0,0,[],[],https://twitter.com/jornalistavitor/status/1319642024929316864,False,,0,,,,,,,,[],,,,
1319639342860673024,1319477201729998848,2020-10-23 10:58:31 -03,2020-10-23,10:58:31,-0300,1137719700643864576,anacvasot,･⋆ ｡✰⋆ ｡𝗔𝕟𝗮･*☽:ﾟ･⋆,,"@Ttcomentando @guaamarals @Koyyyy_ @Jinniloves @jajapsi @felipeneto Com certeza. Mas ele é quem tem mais representatividade, mas tá ignorando completamente isso. Ele é quem pode criar leis rigorosas para desmatamento, ele é quem tem dinheiro e poder pra ajudar o Pantanal e a Amazônia, ele que consegue fazer esse tipo de coisa",pt,[],[],[],0,0,1,[],[],https://twitter.com/Anacvasot/status/1319639342860673024,False,,0,,,,,,,,"[{'screen_name': 'Koyyyy_', 'name': 'kentang', 'id': '1325804515321282565'}, {'screen_name': 'Jinniloves', 'name': '✦ Jenni៹⁷ 👅MEGTAN & COLDTAN🌌', 'id': '1093691537232461825'}, {'screen_name': 'jajapsi', 'name': '♈️ Jaja ♓️', 'id': '239705226'}, {'screen_name': 'felipeneto', 'name': 'Felipe Neto', 'id': '14128609'}]",,,,
1319630272854446082,1319479813783064582,2020-10-23 10:22:29 -03,2020-10-23,10:22:29,-0300,3425159116,lucas_delamore,Lucas Del’ Amore ⓟ,,"@_paulogabriel07 Isso aí é alguma foto de desmatamento na Amazônia, isso sim. Parece uma teco de madeira hahaha.",pt,[],[],[],0,0,0,[],[],https://twitter.com/lucas_delamore/status/1319630272854446082,False,,0,,,,,,,,"[{'screen_name': '_paulogabriel07', 'name': 'Paulo', 'id': '1234476774723026945'}]",,,,
1319629943324741632,1319629943324741632,2020-10-23 10:21:10 -03,2020-10-23,10:21:10,-0300,228111907,jornalistadeba,Aderbal Machado,,PF: Grilagem e extração ilegal de madeira são as principais causas do desmatamento na Amazônia. (Jovem Pan),pt,[],[],[],0,1,0,[],[],https://twitter.com/jornalistadeba/status/1319629943324741632,False,,0,,,,,,,,[],,,,
1319629677821034498,1319629677821034498,2020-10-23 10:20:07 -03,2020-10-23,10:20:07,-0300,106175018,jovempannews,Jovem Pan News,,PF: Grilagem e extração ilegal de madeira são as principais causas do desmatamento na Amazônia. | @VigaRodrigo    https://t.co/VK8uJBwhsj  https://t.co/bVzFV35A2U,pt,"[{'screen_name': 'vigarodrigo', 'name': 'vigarodrigo', 'id': '2707674328'}]",['https://buff.ly/3joulFl'],['https://pbs.twimg.com/media/ElBEMvRWAAEEQaP.jpg'],4,2,24,[],[],https://twitter.com/JovemPanNews/status/1319629677821034498,False,,1,https://pbs.twimg.com/media/ElBEMvRWAAEEQaP.jpg,,,,,,,[],,,,
1319627389983481856,1319627389983481856,2020-10-23 10:11:01 -03,2020-10-23,10:11:01,-0300,58811453,greenpeacerj,Grupo de Voluntários,,"Os alertas de desmatamento na Amazônia nos primeiros 16 dias de outubro de 2020 já estão 15% maiores do que TODO O MÊS de outubro de 2019 e caminham rumo ao recorde histórico da série para o mês. Parabéns, governo Bolsonaro.  https://t.co/w8ZCwkEXuJ",pt,[],[],['https://pbs.twimg.com/media/ElA2uluXIAEFfdH.png'],0,0,2,[],[],https://twitter.com/GreenpeaceRJ/status/1319627389983481856,False,,1,https://pbs.twimg.com/media/ElA2uluXIAEFfdH.png,,,,,,,[],,,,
