id,conversation_id,created_at,date,time,timezone,user_id,username,name,place,tweet,language,mentions,urls,photos,replies_count,retweets_count,likes_count,hashtags,cashtags,link,retweet,quote_url,video,thumbnail,near,geo,source,user_rt_id,user_rt,retweet_id,reply_to,retweet_date,translate,trans_src,trans_dest
1368702229537034240,1367147189865230346,2021-03-07 20:16:55 SA Eastern Standard Time,2021-03-07,20:16:55,-0300,1356003359233363977,feldmann_luiz,LUIZ OSCAR FELDMANN MORALES,,"@Helenic93752169 @silviogrimaldo Sem comprovação científica,  como as queimadas da Amazônia,  registradas pelo Inpe.",pt,[],[],[],1,0,0,[],[],https://twitter.com/feldmann_luiz/status/1368702229537034240,False,,0,,,,,,,,"[{'screen_name': 'Helenic93752169', 'name': 'Helenice Cristina', 'id': '1336430716712853514'}, {'screen_name': 'silviogrimaldo', 'name': 'Silvio Grimaldo', 'id': '15918946'}]",,,,
1368666079845888002,1367606747792293892,2021-03-07 17:53:16 SA Eastern Standard Time,2021-03-07,17:53:16,-0300,1103342827621310466,nayaragsg,Pronta para votar no Lula🚩,,"@keillaj @BruMarquezine Ele e sinistro Ricardo Sales desmontou o Ibama, incentivou as queimadas ao acabar com a viabilidade das fiscalizações. Atua constantemente para acabar com as reservas existentes na Amazônia. É uma vergonha internacional quando a assunto é aquecimento global.",pt,[],[],[],1,0,0,[],[],https://twitter.com/nayaragsg/status/1368666079845888002,False,,0,,,,,,,,"[{'screen_name': 'keillaj', 'name': 'Fernandes', 'id': '263944240'}, {'screen_name': 'BruMarquezine', 'name': 'Bruna Marquezine', 'id': '58603510'}]",,,,
1368621480062431234,1368621480062431234,2021-03-07 14:56:03 SA Eastern Standard Time,2021-03-07,14:56:03,-0300,1295422496200630274,pyrodream_,"Dream, o Pyronita mais brabo do que nunca🎟️🍥",,"Bem, o canditado a presidencia do multiverso @thdgang , esta divulgando mentiras a minha pessoa, dizendo que sou a favor das queimadas a amazônia, TOTALMENTE FALSO!  Eu jamais queimaria nossas florestas, além de que o canditado ja foi flagrado assediando arvores do territorio",pt,"[{'screen_name': 'thdgang', 'name': 'sas: za warudo!', 'id': '1363008468756664321'}]",[],[],0,0,4,[],[],https://twitter.com/PyroDream_/status/1368621480062431234,False,,0,,,,,,,,[],,,,
1368607482097119240,1368579067419721730,2021-03-07 14:00:25 SA Eastern Standard Time,2021-03-07,14:00:25,-0300,2784622197,ferdinand0104,Daniel Fernandes,,"@KimKataguiri O Min da Çaude descobriu que o CO² das queimadas da Amazonia destroem o corona que tá no ar, por isso não precisa usar máscara no Brasil... O Bolsocaro tá levando a ideia pra Israel",pt,[],[],[],0,0,2,[],[],https://twitter.com/ferdinand0104/status/1368607482097119240,False,,0,,,,,,,,"[{'screen_name': 'KimKataguiri', 'name': 'Kim Kataguiri 🇧🇷 ☘️', 'id': '1494658207'}]",,,,
1368600968452071430,1368382402750472192,2021-03-07 13:34:32 SA Eastern Standard Time,2021-03-07,13:34:32,-0300,1166812929137790982,carmilatirenato,Renato Valente 🇧🇷 💚 💛💙,,"@pdro_gabriel @Fa1ryNight @jairbolsonaro Bora falar de queimadas? Dados do Inpe, o único, disse ÚNICO bioma em que 2020 e apenas em 2020, pois 2019, primeiro ano deste governo, foi na média, houve um aumento maior dos focos foi o Pantanal. Agora, ô funcional, dá uma olhadinha nos outros biomas em especial a Amazônia,++  https://t.co/Cc4PXKCPTy",pt,[],[],"['https://pbs.twimg.com/media/Ev47-uMXYAEopvw.png', 'https://pbs.twimg.com/media/Ev48ZiHXIAQbg__.png', 'https://pbs.twimg.com/media/Ev48mWkXYAEwiy_.png', 'https://pbs.twimg.com/media/Ev4806QWYAgcDYO.png']",1,2,7,[],[],https://twitter.com/CarmilatiRenato/status/1368600968452071430,False,,1,https://pbs.twimg.com/media/Ev47-uMXYAEopvw.png,,,,,,,"[{'screen_name': 'pdro_gabriel', 'name': 'Desempregado Funcional', 'id': '374566350'}, {'screen_name': 'Fa1ryNight', 'name': 'Tsuki - 🥂 2021 Energiza🥂', 'id': '1094606431968362497'}, {'screen_name': 'jairbolsonaro', 'name': 'Jair M. Bolsonaro', 'id': '128372940'}]",,,,
1368590628964208640,1367606747792293892,2021-03-07 12:53:27 SA Eastern Standard Time,2021-03-07,12:53:27,-0300,263944240,keillaj,Fernandes,,"@nayaragsg @BruMarquezine +to a céu aberto Ele é tão ""ruim"", que lançou o primeiro satélite brasileiro para.monitorar os desmatamentos e queimadas na Amazônia  Ele é tão ""ruim"" que tem atuado com bastante eficácia em tratamento de pessoas com doenças raras Ele é tão ""ruim"" que tem desenvolvido programas",pt,[],[],[],2,0,0,[],[],https://twitter.com/keillaj/status/1368590628964208640,False,,0,,,,,,,,"[{'screen_name': 'nayaragsg', 'name': 'Pronta para votar no Lula🚩', 'id': '1103342827621310466'}, {'screen_name': 'BruMarquezine', 'name': 'Bruna Marquezine', 'id': '58603510'}]",,,,
1368561886636224512,1368519971328978945,2021-03-07 10:59:15 SA Eastern Standard Time,2021-03-07,10:59:15,-0300,1256598392081387520,flvioevangelis3,Flávio Evangelista🇩🇪🇧🇷🇪🇺,,"Der Spiegel:""A Amazônia há tempos não queimava assim""(31/08) – sobre queimadas- O governo brasileiro disse que iria trabalhar para proteger a floresta tropical. Mas aparentemente foi apenas da boca para fora.Dados de satélite mostram que o número de incêndios continua a aumentar",pt,[],[],[],0,0,0,[],[],https://twitter.com/FlvioEVANGELIS3/status/1368561886636224512,False,,0,,,,,,,,[],,,,
1368532203999789058,1368532203999789058,2021-03-07 09:01:18 SA Eastern Standard Time,2021-03-07,09:01:18,-0300,65725706,ubesoficial,União Brasileira dos Estudantes Secundaristas,,"Os acontecimentos: 📋  - Bolsonaro presidente - MEC ineficiente  - Mais de 260 mil mortes pela ""gripezinha"" - PIB lá embaixo  - Cortes na educação  - Ataques ao SUS -Queimadas na Amazônia e Pantanal  Completa a lista... ✏  https://t.co/KrLlJpjAW6",pt,[],[],['https://pbs.twimg.com/media/Ev4AyY4XIAkOxYN.jpg'],0,8,52,[],[],https://twitter.com/ubesoficial/status/1368532203999789058,False,,1,https://pbs.twimg.com/media/Ev4AyY4XIAkOxYN.jpg,,,,,,,[],,,,
1368525377715470337,1368525377715470337,2021-03-07 08:34:10 SA Eastern Standard Time,2021-03-07,08:34:10,-0300,60749584,mariosor,Mario.sor,,"Globo Lixo, onde estão as centenas de ONGs espalhadas pela Amazônia? Onde estão as queimadas da Amazônia? Tudo jogo de cena...contratados para falar mal do governo, durante um período, depois, como num passe de mágica, desaparecem. A globo lixo vive disso, fake news, e somem!",pt,[],[],[],1,8,33,[],[],https://twitter.com/mariosor/status/1368525377715470337,False,,0,,,,,,,,[],,,,
1368522287968817152,1368522287968817152,2021-03-07 08:21:54 SA Eastern Standard Time,2021-03-07,08:21:54,-0300,1272669392472543232,themarineplayer,Foca🐧 twitch.tv/themarineplayer 🌈💚,,"Ontem mesmo eu e a Day vimos eles mostrando parques pra galera visitar NUMA PANDEMIA. Sem contar a amazônia que já tá 100% recuperada das queimadas nada ilegais que sofreu, né?  Agora tão pulando fora do barco Bolsonarista, só resta passar a mesma mensagem no JR deles e em 24/7.",pt,[],[],[],0,0,0,[],[],https://twitter.com/themarineplayer/status/1368522287968817152,False,https://twitter.com/antoniotabet/status/1368324805859115009,0,,,,,,,,[],,,,
1368405543711371269,1368204226220994562,2021-03-07 00:38:00 SA Eastern Standard Time,2021-03-07,00:38:00,-0300,1358196520428965888,psciences1,psciences,,@RibeiroWiller @MarceloFreixo O vírus do aquecimento global amazônico das queimadas exigem que a ONU tome a Amazônia do Brasil e entregue pros bilionários europeus explorarem as riquezas da colonia Brasil.,pt,[],[],[],0,0,0,[],[],https://twitter.com/psciences1/status/1368405543711371269,False,,0,,,,,,,,"[{'screen_name': 'RibeiroWiller', 'name': 'Willer da Costa Ribeiro', 'id': '1212810271904763904'}, {'screen_name': 'MarceloFreixo', 'name': 'Marcelo Freixo', 'id': '45870897'}]",,,,
1368313659907334144,1368313659907334144,2021-03-06 18:32:53 SA Eastern Standard Time,2021-03-06,18:32:53,-0300,1080339368055840768,leandrothomaz20,Leandro Thomaz,,"Autoritário são vcs tiveram 16 anos porque não hospitais em vez de elefantes brancos ( estádios) em 2014, reforma da previdência,política, redução dos impostos para imposto único, conclusão da pavimentação da 163,controlar as queimadas na Amazônia redução de gás e combustíveis",pt,[],[],[],0,0,0,[],[],https://twitter.com/LeandroThomaz20/status/1368313659907334144,False,https://twitter.com/MarceloFreixo/status/1367986129593630725,0,,,,,,,,[],,,,
1368302598869180425,1368080647043092482,2021-03-06 17:48:56 SA Eastern Standard Time,2021-03-06,17:48:56,-0300,77847804,andregoth,Andre Gotha 🇧🇷🌹,,"@anitablian @LeonardoBoff Sim foi o que eu disse: estão arrumando o motivo: primeiro as queimadas, lembra? Agora a cepa surgida, ‘coincidentemente’ n Amazônia...e o que nosso PR, que prometeu a Amazônia pros EEUU faz? Provoca a afronta, dá motivos, da guarida a esse discurso...ao invés de desmentir",pt,[],[],[],0,0,1,[],[],https://twitter.com/andregoth/status/1368302598869180425,False,,0,,,,,,,,"[{'screen_name': 'anitablian', 'name': 'Rogério Anitablian🇧🇷 🇦🇲', 'id': '33426514'}, {'screen_name': 'LeonardoBoff', 'name': 'Leonardo Boff', 'id': '74626513'}]",,,,
1368283937882202119,1368283937882202119,2021-03-06 16:34:46 SA Eastern Standard Time,2021-03-06,16:34:46,-0300,899010935519629312,niniciassy,lala,,"“gosto do bayern""    gosta do que mais?  do governo bolsonaro? queimadas da amazônia? agredir animais? vai fazer oq depois que sair daqui? bater em idoso?",pt,[],[],[],0,2,3,[],[],https://twitter.com/ninicIassy/status/1368283937882202119,False,,0,,,,,,,,[],,,,
1368266859628408832,1368181233449136134,2021-03-06 15:26:55 SA Eastern Standard Time,2021-03-06,15:26:55,-0300,328184262,mwllaw,Milla,,"@ollivasd @19918227hshs @adele_lispector @Agatthatriste Pra esse acordo Bolsonaro deve tomar novas medidas ambientais, a Amazônia teve aumento de 60% no desmatamento, esse que influência as queimadas. Claro que o único escândalo é a interferência na PF, como vão descobrir algo se ele interferiu?pq interferiu se não tem nd a esconder?",pt,[],[],[],1,0,0,[],[],https://twitter.com/mwllaw/status/1368266859628408832,False,,0,,,,,,,,"[{'screen_name': 'ollivasd', 'name': 'matheus🍻🤠🎱', 'id': '1229636340649799682'}, {'screen_name': 'adele_lispector', 'name': 'Adéle Lispector👣🐊🌻', 'id': '1156946536045174785'}, {'screen_name': 'Agatthatriste', 'name': 'Agatha Triste 🌵', 'id': '1355490147899494401'}]",,,,
1368262416614764550,1367921930804813827,2021-03-06 15:09:15 SA Eastern Standard Time,2021-03-06,15:09:15,-0300,3827264674,marcelievskytw,Marcelievsky (MR) ☣🌹мрия,,"@vitorfars @DanaButlerr @padilhando KAKAKA claro claro, o país HOJE é um pária internacional culpa do LULA. Bolsonaro ofende líderes da UE e chineses e a culpa é de 2006. Queimadas da Amazônia visando a exploração internacional (palavras do genocida) e a culpa é da ""esquerda"". Guedes é um incapaz e a culpa é do PT",pt,[],[],[],2,0,0,[],[],https://twitter.com/MarcelievskyTw/status/1368262416614764550,False,,0,,,,,,,,"[{'screen_name': 'vitorfars', 'name': 'Vitor Fars', 'id': '72562642'}, {'screen_name': 'DanaButlerr', 'name': 'Dana Butler - USTRAPALOOZA EU FUI!!', 'id': '2866132068'}, {'screen_name': 'padilhando', 'name': 'Alexandre Padilha', 'id': '58065771'}]",,,,
1368223596611567616,1368223596611567616,2021-03-06 12:35:00 SA Eastern Standard Time,2021-03-06,12:35:00,-0300,1214920540626010114,likeambition,Diego,,"Madonna postou foto com ""EleNão!"" e se posicionou contra o fascismo, comeu o c* do Bolsonaro sobre as queimadas na Amazônia, divulgou o vídeo de um panelaço contra o governo dele, além desse momento icônico na Madame X Tour. A rainha mesmo!  https://t.co/xpmyW9bANq",pt,[],[],[],3,14,59,[],[],https://twitter.com/likeambition/status/1368223596611567616,False,,1,https://pbs.twimg.com/ext_tw_video_thumb/1368223467598921734/pu/img/hi_GyO5ulfkDJJNK.jpg,,,,,,,[],,,,
1368198048648663042,1367965342606233607,2021-03-06 10:53:29 SA Eastern Standard Time,2021-03-06,10:53:29,-0300,1342675071257759745,prussian242647,,,@prussian242647's account is temporarily unavailable because it violates the Twitter Media Policy. Learn more.,pt,[],['https://support.twitter.com/articles/20169199'],[],1,0,0,[],[],https://twitter.com/prussian242647/status/1368198048648663042,False,,0,,,,,,,,[],,,,
1368194874214916096,1368186333995368450,2021-03-06 10:40:52 SA Eastern Standard Time,2021-03-06,10:40:52,-0300,1272608752244600833,tamaki_lol,Tamaki_LoL #Tamaki_LoL100k,,@artturer Uma vez eu assinei uma petição contra queimadas na Amazônia e agora eles não param de me mandar emails sobre as crianças da Malásia que tão morrendo de fome,pt,[],[],[],0,0,1,[],[],https://twitter.com/tamaki_lol/status/1368194874214916096,False,,0,,,,,,,,"[{'screen_name': 'Artturer', 'name': 'Arttur', 'id': '1429167272048963589'}]",,,,
1368161050491826176,1368161050491826176,2021-03-06 08:26:28 SA Eastern Standard Time,2021-03-06,08:26:28,-0300,46576649,joaovillaverde,João Villaverde,,"Os ministros de Bolsonaro compactuam com o horror. Sabem que a vacinação é sabotada pelo presidente, que combate até o uso de máscaras. Sabem do estímulo à queimadas na Amazônia e Pantanal. Do descaso com educação. Da inépcia econômica.  A mancha na reputação deve ser perene.  👇🏻  https://t.co/80v7Qqu4dg",pt,[],[],['https://pbs.twimg.com/media/EvyvOPmXAAcEN_N.jpg'],14,23,110,[],[],https://twitter.com/joaovillaverde/status/1368161050491826176,False,,1,https://pbs.twimg.com/media/EvyvOPmXAAcEN_N.jpg,,,,,,,[],,,,
1368134770933133317,1368134770933133317,2021-03-06 06:42:02 SA Eastern Standard Time,2021-03-06,06:42:02,-0300,1028076527081189376,culturarubra,Leonel Gomes,,Queimadas e desmatamento na Amazônia puxam aumento das emissões brasileiras  https://t.co/zVLLaXZ7zk,pt,[],['http://dlvr.it/Rv4r31'],[],0,0,0,[],[],https://twitter.com/culturarubra/status/1368134770933133317,False,,0,,,,,,,,[],,,,
1368050815060041734,1368050815060041734,2021-03-06 01:08:26 SA Eastern Standard Time,2021-03-06,01:08:26,-0300,65544120,marlyspf,MARLY,,"Roberto Jefferson Não vi a Greta  falar nada sobre o satélite brasileiro que vai monitorar o desmatamento e as queimadas na Amazônia. Nem o Leonardo DiCaprio Nem como ONGs. Não era para estarem celebrando uma conquista que vai ajudar a impedir queimadas, derrubada de árvores etc?",pt,[],[],[],0,0,2,[],[],https://twitter.com/MARLYSPF/status/1368050815060041734,False,,0,,,,,,,,[],,,,
1367981770231197705,1367821451521384448,2021-03-05 20:34:04 SA Eastern Standard Time,2021-03-05,20:34:04,-0300,738873823,ferdinandoperre,Ferdinando Perrella,,"@RitaOli36702816 Mourão deve trocar GPS por Waze. Luciano precisa convidar Mourão para participar das  suas Lives, escolhe a dedo,  proposição, apoio, debates de nível zero, crítica pela crítica muitas. Vamos ver a performance Mourão agora na época das queimadas na Amazônia, imprensa preparada.",pt,[],[],[],0,0,0,[],[],https://twitter.com/FerdinandoPerre/status/1367981770231197705,False,,0,,,,,,,,"[{'screen_name': 'RitaOli36702816', 'name': '🔰Rita Oliveira🔰🗣️📢VemPraRua 🔰☘️', 'id': '748271046231490560'}]",,,,
1367950544602599427,1367862418764881920,2021-03-05 18:29:59 SA Eastern Standard Time,2021-03-05,18:29:59,-0300,2215751618,lude7l,Maria,,@SaBolsonaro @reclamadoria Não vi a turma das girafas queimadas e nem dos elefantes na Amazônia agradeceram por essa ferramenta para monitorar a Amazônia. Por que será?,pt,[],[],[],1,0,3,[],[],https://twitter.com/Lude7L/status/1367950544602599427,False,,0,,,,,,,,"[{'screen_name': 'SaBolsonaro', 'name': 'Sabrina 🇧🇷😎', 'id': '1101680527709483008'}, {'screen_name': 'reclamadoria', 'name': '🇧🇷AliciaMay#Liberdade🇧🇷', 'id': '204494751'}]",,,,
1367932824565788675,1367929951769477121,2021-03-05 17:19:34 SA Eastern Standard Time,2021-03-05,17:19:34,-0300,69731114,pclage,Paulo Lage,,"@BelinhaPoodleBR Aí eles choram mesmo , agora temos um satélite 100% BRASILEIRO , observando 2 vezes por dia a NOSSA AMAZÔNIA , quero ver agora a cambada que fica falando sem saber de nada , quando questionarem , vão ter fotos e dados concretos sobre as “queimadas” e o “desmatamento” .",pt,[],[],[],0,6,11,[],[],https://twitter.com/Pclage/status/1367932824565788675,False,,0,,,,,,,,"[{'screen_name': 'BelinhaPoodleBR', 'name': 'Canal da Belinha opressora🐩🇧🇷', 'id': '3207380655'}]",,,,
1367923250492235780,1367918221752475655,2021-03-05 16:41:32 SA Eastern Standard Time,2021-03-05,16:41:32,-0300,75705669,amauripanissa,Amauri Panissa,,@Rconstantino Mas o mais importante para imprensa suja são as queimadas na Amazônia.,pt,[],[],[],0,0,3,[],[],https://twitter.com/AmauriPanissa/status/1367923250492235780,False,,0,,,,,,,,"[{'screen_name': 'Rconstantino', 'name': 'Rodrigo Constantino', 'id': '33520195'}]",,,,
1367898314440646658,1367873134800539650,2021-03-05 15:02:27 SA Eastern Standard Time,2021-03-05,15:02:27,-0300,1339613732134121474,luizaug23250304,Luiz Augusto,,"@BobjeffHD Monitoramento da Amazônia é o que mais tem,mas quem faz denúncia de queimadas é exonerado.",pt,[],[],[],0,0,0,[],[],https://twitter.com/LuizAug23250304/status/1367898314440646658,False,,0,,,,,,,,[],,,,
1367891696550297609,1367891696550297609,2021-03-05 14:36:09 SA Eastern Standard Time,2021-03-05,14:36:09,-0300,1510477088,sandrac90905570,Sandra Costa,,"Não vi a Greta Thumberg falar nada sobre o satélite brasileiro que vai monitorar o desmatamento e as queimadas na Amazônia. Nem o Leonardo DiCaprio. Nem as ONGs. Não era para estarem celebrando uma conquista q vai ajudar a impedir queimadas, derrubada de árvores etc? @BobjeffHD",pt,[],[],[],0,1,2,[],[],https://twitter.com/SandraC90905570/status/1367891696550297609,False,,0,,,,,,,,[],,,,
1367888816850280455,1367873134800539650,2021-03-05 14:24:42 SA Eastern Standard Time,2021-03-05,14:24:42,-0300,1356447641043955715,milaela10,milaela,,"@BobjeffHD Vai NÃO. Eles vivem das queimadas, das mentiras, dos assaltos ao solo amazônico. Agora vamos saber quem põe fogo, quem  entrae madeira ilegal, quem destroe a Amazônia.",pt,[],[],[],1,1,5,[],[],https://twitter.com/milaela10/status/1367888816850280455,False,,0,,,,,,,,[],,,,
1367881056343457794,1367881056343457794,2021-03-05 13:53:52 SA Eastern Standard Time,2021-03-05,13:53:52,-0300,143296945,mclguitarhero,Marcelo,,Maldito Bolsonaro e isso tem a ver com as queimadas na Amazônia...,pt,[],[],[],0,0,1,[],[],https://twitter.com/mclguitarhero/status/1367881056343457794,False,https://twitter.com/Rconstantino/status/1367843733111271433,0,,,,,,,,[],,,,
1367876424338714626,1367876424338714626,2021-03-05 13:35:28 SA Eastern Standard Time,2021-03-05,13:35:28,-0300,208880538,bellevox,"Belle Vox ❤️🖤 Si vis pacem, para bellum 🖤❤️",,"Novas cepas se justificam no caso de corte indiscriminado de árvores, matança de animais, queimadas. Mas é preciso lembrar que Bolsonaro trabalha junto com os EUA para entregar tbm a Amazônia. Lascou.",pt,[],[],[],0,0,0,[],[],https://twitter.com/BelleVox/status/1367876424338714626,False,https://twitter.com/anitablian/status/1367674542919942148,0,,,,,,,,[],,,,
1367873134800539650,1367873134800539650,2021-03-05 13:22:23 SA Eastern Standard Time,2021-03-05,13:22:23,-0300,1290259240494432256,graciptb14,Graciela PTB 14,,"Não vi a Greta Thumberg falar nada sobre o satélite brasileiro que vai monitorar o desmatamento e as queimadas na Amazônia. Nem o Leonardo DiCaprio. Nem as ONGs. Não era para estarem celebrando uma conquista que vai ajudar a impedir queimadas, derrubada de árvores etc?",pt,[],[],[],214,1805,7993,[],[],https://twitter.com/graciptb14/status/1367873134800539650,False,,0,,,,,,,,[],,,,
1367862573413072898,1367862573413072898,2021-03-05 12:40:25 SA Eastern Standard Time,2021-03-05,12:40:25,-0300,24876034,scienceblogsbr,ScienceBlogs Brasil,,"A percepção do Brasileiro sobre crise climática, queimadas, meio ambiente, preservação da Amazônia... No Ecodesenvolvimento da @clauchow  https://t.co/ulYe25VX5o  https://t.co/HQMK10kois",pt,"[{'screen_name': 'clauchow', 'name': 'claudia chow vemvacina! 🌎💉', 'id': '13512582'}]",['https://bit.ly/3rhApUE'],['https://pbs.twimg.com/media/EvufHlQXIAU07yF.jpg'],0,7,16,[],[],https://twitter.com/scienceblogsbr/status/1367862573413072898,False,,1,https://pbs.twimg.com/media/EvufHlQXIAU07yF.jpg,,,,,,,[],,,,
1367849643518947330,1367848200116244484,2021-03-05 11:49:03 SA Eastern Standard Time,2021-03-05,11:49:03,-0300,27908930,grazielatanaka,Graziela Tanaka | #LutaPelaVida #MarcoTemporalNão,,7 das 10 cidades que mais emitem estão na Amazônia. Os dados comprovam o que já sabíamos: a pegada de carbono do Brasil é predominantemente do desmatamento e das queimadas. A conta é do agronegócio mas também dos varejistas que continuam vendendo carne de desmatamento.,pt,[],[],[],1,4,10,[],[],https://twitter.com/grazielatanaka/status/1367849643518947330,False,,0,,,,,,,,[],,,,
1367848200934133763,1367814469951324163,2021-03-05 11:43:19 SA Eastern Standard Time,2021-03-05,11:43:19,-0300,1112009792460083201,joafigueiredon1,Joa@FigueiredoNT,,@rsallesmma @jairbolsonaro SALES @rsallesmma já está pensando ou SE ANTECIPANDO ÀS FRENTES DE COMBATE ÀS QUEIMADAS DO SERRADO E DA SECA NA AMAZÔNIA??? Se ANTECIPA MINISTRO!!! @rsallesmma,pt,"[{'screen_name': 'rsallesmma', 'name': 'ricardo salles', 'id': '971822131024748545'}, {'screen_name': 'rsallesmma', 'name': 'ricardo salles', 'id': '971822131024748545'}]",[],[],0,0,4,[],[],https://twitter.com/JoaFigueiredoN1/status/1367848200934133763,False,,0,,,,,,,,"[{'screen_name': 'rsallesmma', 'name': 'Ricardo Salles', 'id': '971822131024748545'}, {'screen_name': 'jairbolsonaro', 'name': 'Jair M. Bolsonaro', 'id': '128372940'}]",,,,
1367831426402574341,1367831426402574341,2021-03-05 10:36:39 SA Eastern Standard Time,2021-03-05,10:36:39,-0300,912347512320733187,leilabittar,LEILA 💚💛,,Sete das dez cidades brasileiras que mais emitem gases do efeito estufa ficam na Amazônia.  A principal causa é o desmatamento por queimadas.  https://t.co/x08HgA4iw3,pt,[],['http://r7.com/jrqF'],[],0,0,0,[],[],https://twitter.com/LeilaBittar/status/1367831426402574341,False,,0,,,,,,,,[],,,,
1367817132399095809,1367813669493563396,2021-03-05 09:39:51 SA Eastern Standard Time,2021-03-05,09:39:51,-0300,17345486,ectro_,⬛️ Democrata Corinthiano ⬛️,,@fernandoPaiva28 @amandacedrazz @eurenesilva Me explica como vou respeitar alguém que apoia: - 260 mil mortes - Falta de vacinas - uso de cloroquina - queimadas na amazonia e pantanal - politica economica horrível - inflação nas alturas - dolar e gasolina a 6 reais - familia miliciana e cheia de laranjas  Me explica?,pt,[],[],[],2,0,96,[],[],https://twitter.com/ectro_/status/1367817132399095809,False,,0,,,,,,,,"[{'screen_name': 'fernandoPaiva28', 'name': 'Fernando Paiva', 'id': '87448762'}, {'screen_name': 'amandacedrazz', 'name': 'Amanda #usePFF2', 'id': '918869176801951744'}, {'screen_name': 'eurenesilva', 'name': 'Rene Silva', 'id': '55118656'}]",,,,
1367769416939810817,1367520969330458628,2021-03-05 06:30:15 SA Eastern Standard Time,2021-03-05,06:30:15,-0300,915384142250041344,andreassq1,andrea simone,,"@GladysCastanho @xicograziano @rsallesmma Mas por qual motivo ele tocaria fogo na Amazônia? Isso não tem a menor lógica. E se ele é tão a favor do desmatamento, pq o governo brasileiro enviou um satélite só pra vigiar áreas de desmatamento e queimadas na Amazônia?",pt,[],[],[],0,0,0,[],[],https://twitter.com/andreassq1/status/1367769416939810817,False,,0,,,,,,,,"[{'screen_name': 'GladysCastanho', 'name': 'Gladys Castanho', 'id': '3107981920'}, {'screen_name': 'xicograziano', 'name': 'Xico Graziano', 'id': '41881267'}, {'screen_name': 'rsallesmma', 'name': 'Ricardo Salles', 'id': '971822131024748545'}]",,,,
1367672853877960704,1367588058468548610,2021-03-05 00:06:33 SA Eastern Standard Time,2021-03-05,00:06:33,-0300,739982839614177281,guinnebullying,guilhermeshiba 🇧🇷,,"@Stonks999 @esquerdaBBB21 @Trezera @spfc__math @monark pra dar um exemplo, o assunto das queimadas, negar elas enquanto elas estavam obviamente visíveis não trouxe nenhum lucro de curto prazo, e a destruição da Amazônia também não traz nenhum lucro a longo prazo, além de formar uma imagem exterior dele de filho da puta",pt,[],[],[],1,0,0,[],[],https://twitter.com/guinneBullying/status/1367672853877960704,False,,0,,,,,,,,"[{'screen_name': 'Stonks999', 'name': 'Stonks', 'id': '1267870830807187457'}, {'screen_name': 'Trezera', 'name': 'trezera', 'id': '22099822'}, {'screen_name': 'monark', 'name': '♔ Monark', 'id': '242967720'}]",,,,
1367624598758580229,1367624598758580229,2021-03-04 20:54:48 SA Eastern Standard Time,2021-03-04,20:54:48,-0300,291926260,jornaldarecord,Jornal da Record,,Sete das dez cidades brasileiras que mais emitem gases do efeito estufa ficam na Amazônia. A principal causa é o desmatamento por queimadas. Essa é a primeira vez que um estudo desse tipo é feito no país #JornalDaRecord #JR24H  https://t.co/nzDgxBvRTD,pt,[],[],[],6,2,22,"['jornaldarecord', 'jr24h']",[],https://twitter.com/jornaldarecord/status/1367624598758580229,False,,1,https://pbs.twimg.com/amplify_video_thumb/1367624405988220930/img/eRg6jjOM2PLzU0PJ.jpg,,,,,,,[],,,,
1367611049873199110,1367611047163678724,2021-03-04 20:00:57 SA Eastern Standard Time,2021-03-04,20:00:57,-0300,919993667850555393,call_suporte,Carlos Alberto,,"...presidente francês, com fotos falsas sobre queimadas, incendiários financiados por ONGs da Amazônia e estrangeiras. Bem estamos precisando acordar, ou vão nos roubar. Gostem ou não, o PR é a PEDRA NO CAMINHO deste roubo. Não tem a ver com política, e sim com PATRIOTISMO!",pt,[],[],[],2,1,11,[],[],https://twitter.com/call_suporte/status/1367611049873199110,False,,0,,,,,,,,[],,,,
