id,conversation_id,created_at,date,time,timezone,user_id,username,name,place,tweet,language,mentions,urls,photos,replies_count,retweets_count,likes_count,hashtags,cashtags,link,retweet,quote_url,video,thumbnail,near,geo,source,user_rt_id,user_rt,retweet_id,reply_to,retweet_date,translate,trans_src,trans_dest
1411020725683732481,1411020725683732481,2021-07-02 14:55:31 SA Eastern Standard Time,2021-07-02,14:55:31,-0300,108623752,raulmarcelo_,Raul Marcelo,,"Sob a gestão de Bolsonaro, a Amazônia teve 2.308 focos de calor no mês passado, segundo dados do Instituto Nacional de Pesquisa Espaciais (Inpe). É o maior registro de queimadas em junho desde 2007. Às ruas dia #3J.  Vídeo completo:  https://t.co/9YhQGGXQOI  https://t.co/4cXQdoN2zu",pt,[],['http://bit.ly/3AptiyD'],[],0,1,5,['3j'],[],https://twitter.com/raulmarcelo_/status/1411020725683732481,False,,1,https://pbs.twimg.com/ext_tw_video_thumb/1411020572717457413/pu/img/FTezMQwhwRsQnXsT.jpg,,,,,,,[],,,,
1411016822988607490,1411016822988607490,2021-07-02 14:40:00 SA Eastern Standard Time,2021-07-02,14:40:00,-0300,1186295321942515712,bramagora,Brasil Amazônia Agora - Por Alfredo Lopes,,"Números tão elevados aproximam 2021 a cenários da década dos anos 2000, nos quais a Amazônia passava por grandes devastações e números recordes de queimadas.  Confira:  https://t.co/v8xLLHil1M",pt,[],['https://brasilamazoniaagora.com.br/amazonia-tem-junho-com-maior-numero-de-queimadas-desde-2007/'],[],0,0,0,[],[],https://twitter.com/BrAmAgora/status/1411016822988607490,False,,0,,,,,,,,[],,,,
1411015084168691717,1411015084168691717,2021-07-02 14:33:06 SA Eastern Standard Time,2021-07-02,14:33:06,-0300,43201524,edkallenn,Prof. Ed - ED1rac - OCTA!,,"""Desde 2007 não eram registrados em junho tantos focos de queimadas na Amazônia quanto neste ano. Segundo dados do Instituto Nacional de Pesquisa Espaciais (Inpe) divulgados ontem, foram identificados no mês passado 2.308 pontos de incêndio na floresta. Isso representa um au…  https://t.co/TYUZogddkG",pt,[],[],['https://pbs.twimg.com/media/E5TuvgIX0AEy_T8.png'],0,0,0,[],[],https://twitter.com/edkallenn/status/1411015084168691717,False,,1,https://pbs.twimg.com/media/E5TuvgIX0AEy_T8.png,,,,,,,[],,,,
1411015079051550721,1411015079051550721,2021-07-02 14:33:04 SA Eastern Standard Time,2021-07-02,14:33:04,-0300,43201524,edkallenn,Prof. Ed - ED1rac - OCTA!,,"""Desde 2007 não eram registrados em junho tantos focos de queimadas na Amazônia quanto neste ano. Segundo dados do Instituto Nacional de Pesquisa Espaciais (Inpe) divulgados ontem, foram identificados no mês passado 2.308 pontos de incêndio na floresta. Isso representa um au…",pt,[],[],[],0,0,0,[],[],https://twitter.com/edkallenn/status/1411015079051550721,False,,0,,,,,,,,[],,,,
1411011536253079557,1411011536253079557,2021-07-02 14:19:00 SA Eastern Standard Time,2021-07-02,14:19:00,-0300,34271853,cartamaior,Carta Maior,,"Assim como na Amazônia, o nº de focos de incêndio registrados no Cerrado em junho também bateu recorde: 4.181, 20% a mais do que em junho/2020 e o maior valor para esse mês desde 2010. Com o início da estação seca e o desmonte das políticas ambientais, as queimadas se agravam.",pt,[],[],[],0,1,15,[],[],https://twitter.com/cartamaior/status/1411011536253079557,False,,0,,,,,,,,[],,,,
1411009020543045637,1411009020543045637,2021-07-02 14:09:00 SA Eastern Standard Time,2021-07-02,14:09:00,-0300,1400453039463440392,mazarelloc,Mazarello Cardoso.,,"Acabou o mimimi com queimadas na amazônia, brincou é bala.",pt,[],[],[],0,0,0,[],[],https://twitter.com/MazarelloC/status/1411009020543045637,False,https://twitter.com/JornalDaCidadeO/status/1410999089668530176,0,,,,,,,,[],,,,
1411001520619986944,1410998537576386572,2021-07-02 13:39:12 SA Eastern Standard Time,2021-07-02,13:39:12,-0300,52493343,galvaohp,Paulo Galvão,,"@RicardinhoAnd13 pois agora pronto, o Godzilla vem aqui pelo litoral do meu Piauí enquanto o King Kong deve sair pra escapar das queimadas da Amazônia, os dois se encontram no planalto central e a briga vai ser feia",pt,[],[],[],0,0,0,[],[],https://twitter.com/Galvaohp/status/1411001520619986944,False,,0,,,,,,,,"[{'screen_name': 'RicardinhoAnd13', 'name': 'ZÉRicardoAnd13', 'id': '203065132'}]",,,,
1410988761211707395,1410988761211707395,2021-07-02 12:48:30 SA Eastern Standard Time,2021-07-02,12:48:30,-0300,2850568264,vitornunes_sl,Tito🚩🍥,,Amazônia registra o maior número de queimadas desde 2007 – Jovem Pan   https://t.co/rK4IlmIYQ5,pt,[],['https://flip.it/7_5nrf'],[],0,0,1,[],[],https://twitter.com/vitornunes_sl/status/1410988761211707395,False,,0,,,,,,,,[],,,,
1410975308900093961,1410975308900093961,2021-07-02 11:55:02 SA Eastern Standard Time,2021-07-02,11:55:02,-0300,26932840,blogdomiro,Blog do Miro,,"O Instituto Nacional de Pesquisas Espaciais informa que a Amazônia registrou 2.308 focos de incêndio em junho, o maior número para o mês desde 2007. Maio também já havia batido recorde de queimadas. O quadro é grave, já que os incêndios precederem a ""temporada do fogo"" de agosto",pt,[],[],[],0,7,8,[],[],https://twitter.com/BlogdoMiro/status/1410975308900093961,False,,0,,,,,,,,[],,,,
1410969008237592577,1410969008237592577,2021-07-02 11:30:00 SA Eastern Standard Time,2021-07-02,11:30:00,-0300,16632084,cartacapital,CartaCapital,,Queimadas na Amazônia batem recorde de 12 anos para o mês de junho  https://t.co/h0sGXt00Ks,pt,[],['https://bit.ly/3Am9sUR'],[],2,11,37,[],[],https://twitter.com/cartacapital/status/1410969008237592577,False,,0,,,,,,,,[],,,,
1410964914986962951,1410964914986962951,2021-07-02 11:13:44 SA Eastern Standard Time,2021-07-02,11:13:44,-0300,1146107423511461890,sgpresidencia,Secretaria-Geral da Presidência da República,,"O presidente @jairbolsonaro assinou decreto que proíbe queimadas controladas por 120 dias. A medida autoriza a prática em áreas fora da Amazônia e do Pantanal, desde que haja autorização e seja essencial para a agricultura. @mmeioambiente   https://t.co/4BN5kcjL1A",pt,"[{'screen_name': 'jairbolsonaro', 'name': 'jair m. bolsonaro', 'id': '128372940'}, {'screen_name': 'mmeioambiente', 'name': 'ministério do meio ambiente', 'id': '193003734'}]",['https://bityli.com/Gsxf5'],[],0,15,36,[],[],https://twitter.com/SGPresidencia/status/1410964914986962951,False,,0,,,,,,,,[],,,,
1410962448077701123,1410962448077701123,2021-07-02 11:03:56 SA Eastern Standard Time,2021-07-02,11:03:56,-0300,53139647,al24h,Alagoas24Horas,,"Queimadas na Amazônia são objeto de criminalidade, diz presidente do Proam  https://t.co/XTGa2fFY0D",pt,[],['https://www.alagoas24horas.com.br/1368885/queimadas-na-amazonia-sao-objeto-de-criminalidade-diz-presidente-do-proam/'],[],0,0,0,[],[],https://twitter.com/al24h/status/1410962448077701123,False,,0,,,,,,,,[],,,,
1410960283405783043,1410960283405783043,2021-07-02 10:55:20 SA Eastern Standard Time,2021-07-02,10:55:20,-0300,165735282,tarcis,Tárcis ☀️,,pra quem acha que as queimadas da amazonia não interfere em nada,pt,[],[],[],0,2,12,[],[],https://twitter.com/tarcis/status/1410960283405783043,False,https://twitter.com/fiscaldoibama/status/1410927172483702791,0,,,,,,,,[],,,,
1410960197154185220,1410960197154185220,2021-07-02 10:55:00 SA Eastern Standard Time,2021-07-02,10:55:00,-0300,256493925,sou_ecologico,Revista Ecológico,,Temporada de desmatamento e queimadas começa com alerta para fogo na Amazônia  https://t.co/RstvzrTceQ,pt,[],['http://souecologico.com/sou-ecologico/temporada-de-desmatamento-e-queimadas-comeca-com-alerta-para-fogo-na-amazonia/'],[],0,0,1,[],[],https://twitter.com/sou_ecologico/status/1410960197154185220,False,,0,,,,,,,,[],,,,
1410958950573477891,1410958950573477891,2021-07-02 10:50:02 SA Eastern Standard Time,2021-07-02,10:50:02,-0300,106175018,jovempannews,Jovem Pan News,,Amazônia registra o maior número de queimadas desde 2007.   https://t.co/teMsPjfLtU  https://t.co/ahTdjBuMOS,pt,[],['https://buff.ly/3jzQDaP'],['https://pbs.twimg.com/media/E5S7sAlXoAM19o9.jpg'],25,2,17,[],[],https://twitter.com/JovemPanNews/status/1410958950573477891,False,,1,https://pbs.twimg.com/media/E5S7sAlXoAM19o9.jpg,,,,,,,[],,,,
1410958461601566721,1410958461601566721,2021-07-02 10:48:06 SA Eastern Standard Time,2021-07-02,10:48:06,-0300,2486816818,lubashivayaluiz,Fernando Romano 🇧🇷🇺🇸🇲🇽🇵🇹🇫🇷🇮🇹🇬🇷🇮🇳,,"""#Amazônia tem o maior número de focos de #queimadas dos últimos 14 anos para mês de junho | Amazônia | G1"" 🔥🔥🔥  https://t.co/gdG6cF1oZn",pt,[],['https://g1-globo-com.cdn.ampproject.org/v/s/g1.globo.com/google/amp/natureza/amazonia/noticia/2021/07/01/amazonia-tem-o-maior-numero-de-focos-de-queimadas-dos-ultimos-14-anos-para-mes-de-junho.ghtml?amp_gsa=1&amp_js_v=a6&usqp=mq331AQIKAGwASCAAgM%3D#amp_tf=De%20%251%24s&aoh=16252328491908&csi=0&referrer=https%3A%2F%2Fwww.google.com&ampshare=https%3A%2F%2Fg1.globo.com%2Fnatureza%2Famazonia%2Fnoticia%2F2021%2F07%2F01%2Famazonia-tem-o-maior-numero-de-focos-de-queimadas-dos-ultimos-14-anos-para-mes-de-junho.ghtml'],[],0,0,0,"['amazônia', 'queimadas']",[],https://twitter.com/LubashivayaLuiz/status/1410958461601566721,False,,0,,,,,,,,[],,,,
1410957009747333121,1410957009747333121,2021-07-02 10:42:20 SA Eastern Standard Time,2021-07-02,10:42:20,-0300,59255260,rondoniaovivo,Rondoniaovivo,,RO está entre os estados da Amazônia que mais promoveram queimadas   https://t.co/gADZXCl24J,pt,[],['https://rondoniaovivo.com/noticia/geral/2021/07/02/triste-titulo-ro-esta-entre-os-estados-da-amazonia-que-mais-promoveram-queimadas.html'],[],0,0,1,[],[],https://twitter.com/Rondoniaovivo/status/1410957009747333121,False,,0,,,,,,,,[],,,,
1410953757077258241,1410892753249132544,2021-07-02 10:29:24 SA Eastern Standard Time,2021-07-02,10:29:24,-0300,1406377012302864391,2luismar,Luismar Borges 2,,@lordivan22 A zara não é uma daquelas marcas que não iam comprar mais matéria prima do Brasil por conta das queimadas na Amazônia???,pt,[],[],[],0,0,1,[],[],https://twitter.com/2Luismar/status/1410953757077258241,False,,0,,,,,,,,"[{'screen_name': 'lordivan22', 'name': 'ivan kleber', 'id': '1028015731'}]",,,,
1410947629631090688,1410947629631090688,2021-07-02 10:05:03 SA Eastern Standard Time,2021-07-02,10:05:03,-0300,3356178363,ssilviacassa,Silvia Cassa 🌵😷🏳🆘️ AMAZÔNIA E SERRADO,,"Não adianta o galinheiro na mão das raposas. Alguém tem que parar estas queimadas, invasão de terras indígenas, desmatamento da Serra da mantiqueira da Amazônia, morte aos animais.  PM virou polícia miliciano, 560.000 mil mortes brasileiros. #ForaBolsonaroCorrupto",pt,[],[],[],0,0,0,['forabolsonarocorrupto'],[],https://twitter.com/SSilviacassa/status/1410947629631090688,False,https://twitter.com/obsclima/status/1410944686949289985,0,,,,,,,,[],,,,
1410946654795186176,1410946654795186176,2021-07-02 10:01:11 SA Eastern Standard Time,2021-07-02,10:01:11,-0300,314338244,canaldorisso,@canaldorisso,,O Ricardo Salles contribuía tanto pro aquecimento global que foi só ele sair do governo que começou a esfriar. #ricardosalles #aquecimentoglobal #queimadas #Amazonia #Brasil #meioambiente #piada #humor #comedia #natureza #sextou #ForaBolsonaro,pt,[],[],[],0,0,0,"['ricardosalles', 'aquecimentoglobal', 'queimadas', 'amazonia', 'brasil', 'meioambiente', 'piada', 'humor', 'comedia', 'natureza', 'sextou', 'forabolsonaro']",[],https://twitter.com/canaldorisso/status/1410946654795186176,False,,0,,,,,,,,[],,,,
1410941864002326530,1410941864002326530,2021-07-02 09:42:09 SA Eastern Standard Time,2021-07-02,09:42:09,-0300,1394521867990491137,douglasimprio3,Douglas Império,,A narrativa da #Covaxin já morreu? Podemos voltar para às queimadas que causam mortes de girafas na Amazônia?  kkkkkk... Forte abraço! @OmarAzizSenador  #BolsonaroIncorruptivel 🇧🇷  https://t.co/Q6q0CzFcLE,pt,"[{'screen_name': 'omarazizsenador', 'name': 'omar aziz', 'id': '2445921702'}]",[],['https://pbs.twimg.com/tweet_video_thumb/E5SsJGBXMAEtWcO.jpg'],0,0,0,"['covaxin', 'bolsonaroincorruptivel']",[],https://twitter.com/DouglasImprio3/status/1410941864002326530,False,,1,https://pbs.twimg.com/tweet_video_thumb/E5SsJGBXMAEtWcO.jpg,,,,,,,[],,,,
1410939327660580865,1410931269014224910,2021-07-02 09:32:04 SA Eastern Standard Time,2021-07-02,09:32:04,-0300,2737364638,elismarssilva,CACHO GRULHA,,@CNNBrasil Os próximos terrores da mídia queimadas na Amazônia e crise hídrica,pt,[],[],[],0,0,0,[],[],https://twitter.com/ElismarSsilva/status/1410939327660580865,False,,0,,,,,,,,"[{'screen_name': 'CNNBrasil', 'name': 'CNN Brasil', 'id': '809124436880322561'}]",,,,
1410934991819882499,1410934991819882499,2021-07-02 09:14:50 SA Eastern Standard Time,2021-07-02,09:14:50,-0300,1155814448063553537,jeduardocs,José Eduardo🇧🇷🚩🏴🐊,,Amazônia tem o maior número de focos de queimadas dos últimos 14 anos para mês de junho:  https://t.co/8f8T8OoDab,pt,[],['https://noticias.ambientebrasil.com.br/clipping/2021/07/01/171690-amazonia-tem-o-maior-numero-de-focos-de-queimadas-dos-ultimos-14-anos-para-mes-de-junho.html'],[],0,0,1,[],[],https://twitter.com/jeduardocs/status/1410934991819882499,False,,0,,,,,,,,[],,,,
1410933243453583361,1410933243453583361,2021-07-02 09:07:53 SA Eastern Standard Time,2021-07-02,09:07:53,-0300,809124436880322561,cnnbrasil,CNN Brasil,,"Em entrevista à CNN nesta sexta-feira (2), Carlos Bocuhy, presidente do Instituto Brasileiro de Proteção Ambiental (Proam), afirmou que as queimadas na Amazônia são “objeto de criminalidade”  https://t.co/F457DfLWL4",pt,[],[],[],8,8,57,[],[],https://twitter.com/CNNBrasil/status/1410933243453583361,False,,1,https://pbs.twimg.com/media/E5SkAZZXMAUbb9S.jpg,,,,,,,[],,,,
1410932029169016834,1410932029169016834,2021-07-02 09:03:04 SA Eastern Standard Time,2021-07-02,09:03:04,-0300,157090205,alesuri_,Ale Suri,,"Tentei assistir o Jornal da Manhã da @JovemPanNews. Em 35 minutos ouvi sobre o repasse da vacina pela gestão João Doria, a abstração do nome da vacina para um estudo sobre terceira dose no Rio e as maiores queimadas na Amazônia nos últimos 14 anos.  Restaram Pânico e Pingos!",pt,"[{'screen_name': 'jovempannews', 'name': 'jovem pan news', 'id': '106175018'}]",[],[],1,0,1,[],[],https://twitter.com/AleSuri_/status/1410932029169016834,False,,0,,,,,,,,[],,,,
1410931269014224910,1410931269014224910,2021-07-02 09:00:03 SA Eastern Standard Time,2021-07-02,09:00:03,-0300,809124436880322561,cnnbrasil,CNN Brasil,,"Em entrevista à CNN, Carlos Bocuhy, presidente do Proam, afirmou que as queimadas na Amazônia são “objeto de criminalidade”  https://t.co/uLdeoYju0h",pt,[],['https://www.cnnbrasil.com.br/nacional/2021/07/02/queimadas-na-amazonia-sao-objeto-de-criminalidade-diz-presidente-do-proam?utm_source=social&utm_medium=twitter-link&utm_campaign=nacional--cnn-brasil&utm_content=link'],[],6,6,38,[],[],https://twitter.com/CNNBrasil/status/1410931269014224910,False,,0,,,,,,,,[],,,,
1410923710526132225,1410923710526132225,2021-07-02 08:30:00 SA Eastern Standard Time,2021-07-02,08:30:00,-0300,967071755687866369,social_criativo,Socialismo Criativo,,"O pedido do ex-ministro do Meio Ambiente Ricardo Salles – de “ir passando a boiada” na área ambiental durante a pandemia – se tornou uma realidade na Amazônia. Pelo segundo ano consecutivo, a floresta teve junho com o maior número de queimadas desde 2007.   https://t.co/eE8wulm4Ef",pt,[],['https://www.socialismocriativo.com.br/passando-a-boiada-taxa-de-queimadas-na-amazonia-e-a-maior-desde-2007/'],[],0,0,1,[],[],https://twitter.com/social_criativo/status/1410923710526132225,False,,0,,,,,,,,[],,,,
1410923546969260033,1410923546969260033,2021-07-02 08:29:21 SA Eastern Standard Time,2021-07-02,08:29:21,-0300,11016942,edsonhajr,🇪 🇩 🇸 🇴 🇳 🇯 🇷 .,,"Já reparam uma coisa? O @jairbolsonaro criticou todas as vacinas exceto a AstraZeneca, a Inglaterra é o único país da UE que não tem restrições diante aos desmandos do DESgoverno até nas queimadas da Amazônia. Muito estranho isso. Dominguettti é real, será? 🤔",pt,"[{'screen_name': 'jairbolsonaro', 'name': 'jair m. bolsonaro', 'id': '128372940'}]",[],[],0,0,5,[],[],https://twitter.com/edsonhajr/status/1410923546969260033,False,,0,,,,,,,,[],,,,
1410922827713241091,1410922827713241091,2021-07-02 08:26:30 SA Eastern Standard Time,2021-07-02,08:26:30,-0300,67150902,correio,Correio Braziliense,,"Queimadas na Amazônia são as piores desde junho de 2007.  Maior parte da devastação aconteceu no Mato Grosso, no Pará e em Rondônia. Nas terras indígenas, foram 110 ocorrências; nas áreas de conservação federais, 30 focos.  https://t.co/Yv9gSNvIaV  https://t.co/i3EOJQC3Sw",pt,[],['https://bit.ly/3xcCvIl'],['https://pbs.twimg.com/media/E5Sa1IBX0AAOVSq.jpg'],1,4,17,[],[],https://twitter.com/correio/status/1410922827713241091,False,,1,https://pbs.twimg.com/media/E5Sa1IBX0AAOVSq.jpg,,,,,,,[],,,,
1410888257924059139,1410888257924059139,2021-07-02 06:09:08 SA Eastern Standard Time,2021-07-02,06:09:08,-0300,10710422,vonivar,vonivar,,Queimadas na Amazônia são as piores desde junho de 2007  https://t.co/C7Pa9hXHLb,pt,[],['http://dlvr.it/S2vcxF'],[],0,0,0,[],[],https://twitter.com/vonivar/status/1410888257924059139,False,,0,,,,,,,,[],,,,
1410872899611906050,1410283624365166594,2021-07-02 05:08:06 SA Eastern Standard Time,2021-07-02,05:08:06,-0300,1393542059009748998,alucynaradopt,AluCynara,,@RamalhoPimentel @RachelFlag @CarlosBolsonaro Ah é sabichão?  Sabe as queimadas na Amazônia e no Pantanal?  São essas regiões que formam as chuvas que abastecem os reservatórios.,pt,[],[],[],1,0,1,[],[],https://twitter.com/AluCynaraDoPT/status/1410872899611906050,False,,0,,,,,,,,"[{'screen_name': 'RamalhoPimentel', 'name': 'Anderson P', 'id': '1249559568042033152'}, {'screen_name': 'RachelFlag', 'name': 'Rachel Cardoso', 'id': '84424807'}, {'screen_name': 'CarlosBolsonaro', 'name': 'Carlos Bolsonaro', 'id': '68712576'}]",,,,
1410820747652734978,1410820747652734978,2021-07-02 01:40:52 SA Eastern Standard Time,2021-07-02,01:40:52,-0300,34839736,aloisiolisboa,Aloisio Lisboa,,AMAZÔNIA TEM MAIOR Nº DE QUEIMADAS DESDE 2007 Satélites registraram 2.038 focos de calor em junho #SBTBrasil,pt,[],[],[],0,0,0,['sbtbrasil'],[],https://twitter.com/aloisiolisboa/status/1410820747652734978,False,,0,,,,,,,,[],,,,
1410803405094850567,1410803405094850567,2021-07-02 00:31:57 SA Eastern Standard Time,2021-07-02,00:31:57,-0300,1385357384,verabrilhante1,Vera Lucia Brilhante do vale,,"Levantamento aponta maior número de queimadas em junho na Amazônia desde 2007 Focos de incêndio em junho de 2021 foram 2,6% maiores do que os registrados no mesmo mês de 2020 Carolina Queiroz, da CNN, em Manaus 01 de julho de 2021 às 23:34   https://t.co/hD0NALPFV6",pt,[],['https://youtu.be/3fA3TLkD90U'],[],0,0,0,[],[],https://twitter.com/verabrilhante1/status/1410803405094850567,False,,0,,,,,,,,[],,,,
1410796080929857541,1410556551614586880,2021-07-02 00:02:51 SA Eastern Standard Time,2021-07-02,00:02:51,-0300,4484337196,piquerafael_,rafael,,"@LeoSant87961116 @Taci83252347 @rodlimo @folha logo, se notícia mais. Mas tens razão, o mundo todo está contra o Bolsonaro porque são tendenciosos, a Amazônia não teve um grande crescimento em número de queimadas e desmatamento... tudo mentira!",pt,[],[],[],2,0,0,[],[],https://twitter.com/piquerafael_/status/1410796080929857541,False,,0,,,,,,,,"[{'screen_name': 'LeoSant87961116', 'name': 'Leo Santos🇧🇷', 'id': '1394193840798642176'}, {'screen_name': 'rodlimo', 'name': 'memes de baixa qualidade', 'id': '991320161264250882'}, {'screen_name': 'folha', 'name': 'Folha de S.Paulo', 'id': '14594813'}]",,,,
1410794384203956225,1410794384203956225,2021-07-01 23:56:07 SA Eastern Standard Time,2021-07-01,23:56:07,-0300,809124436880322561,cnnbrasil,CNN Brasil,,O Instituto Nacional de Pesquisas Espaciais (Inpe) divulgou nesta quinta-feira (1º) que a Amazônia teve 2.308 focos de incêndio em junho. É o maior número de queimadas para o mês desde 2007   https://t.co/MqE3gfllWr,pt,[],['https://www.cnnbrasil.com.br/nacional/2021/07/01/levantamento-aponta-maior-numero-de-queimadas-em-junho-na-amazonia-desde-2007?utm_source=social&utm_medium=twitter-&utm_campaign=--cnn-brasil&utm_content='],[],2,11,71,[],[],https://twitter.com/CNNBrasil/status/1410794384203956225,False,,0,,,,,,,,[],,,,
1410791463781343236,1410791463781343236,2021-07-01 23:44:30 SA Eastern Standard Time,2021-07-01,23:44:30,-0300,2634663505,salomedeiros,Salomão Medeiros,,Amazônia tem junho com maior número de queimadas desde 2007  https://t.co/OYfoV3CHbf @minc_rj @P_Eduardo_Silva,pt,"[{'screen_name': 'minc_rj', 'name': 'carlos minc', 'id': '131286287'}, {'screen_name': 'p_eduardo_silva', 'name': 'paulo eduardo', 'id': '420788725'}]",['https://www.salomaomedeiros.com.br/2021/07/amazonia-tem-junho-com-maior-numero-de.html'],[],0,1,1,[],[],https://twitter.com/salomedeiros/status/1410791463781343236,False,,0,,,,,,,,[],,,,
1410786119696912387,1410786119696912387,2021-07-01 23:23:16 SA Eastern Standard Time,2021-07-01,23:23:16,-0300,23883610,d4n1el77,D4N 🐙,,"Bicha, vc apoiou a homofobia, e digo mais, deu o aval ao racismo, machismo, as queimadas na Amazônia, aos mais de 500 mil mortos por covid. Eduardo Leite, teu apoio ao genocida Bolsonaro segue maltratando, humilhando, matando...  https://t.co/A9G8GgTTY0",pt,[],[],"['https://pbs.twimg.com/media/E5Qee_yXIAEfoAt.jpg', 'https://pbs.twimg.com/media/E5QefQmWUAAUo2a.jpg', 'https://pbs.twimg.com/media/E5Qefy1XIAUTxji.jpg', 'https://pbs.twimg.com/media/E5Qef-GXwA0mBLv.jpg']",0,0,5,[],[],https://twitter.com/D4N1EL77/status/1410786119696912387,False,,1,https://pbs.twimg.com/media/E5Qee_yXIAEfoAt.jpg,,,,,,,[],,,,
1410784548816932864,1410784548816932864,2021-07-01 23:17:02 SA Eastern Standard Time,2021-07-01,23:17:02,-0300,86521713,ottobrito,Otto Leal de Brito,,@CarlosBolsonaro Vale a pena assistir esse documentário para saber e denunciar que a indústria da pesca (legal e pirata) nos oceanos provoca muito mais danos do que as queimadas na Amazônia. Como tem bilhões de dólares envolvidos nessa atividade ela está sendo acobertada pelos,pt,[],[],[],0,0,0,[],[],https://twitter.com/ottobrito/status/1410784548816932864,False,,0,,,,,,,,[],,,,
1410781271429681155,1410781271429681155,2021-07-01 23:04:00 SA Eastern Standard Time,2021-07-01,23:04:00,-0300,967114194121297920,denismauroelias,DENIS MAURO ELIAS,,Amazônia tem em junho maior número de queimadas desde 2007 | JORNAL DA CNN  https://t.co/cc3lNHk19t via @YouTube,pt,"[{'screen_name': 'youtube', 'name': 'youtube', 'id': '10228272'}]",['https://youtu.be/3fA3TLkD90U'],[],0,0,0,[],[],https://twitter.com/DenismauroElias/status/1410781271429681155,False,,0,,,,,,,,[],,,,
1410781164655218690,1410781164655218690,2021-07-01 23:03:35 SA Eastern Standard Time,2021-07-01,23:03:35,-0300,121257965,rosemarywarde,"Petista , Lulista e Dilmista 🚩🚩🗣️🗣️🗣️🚩🚩",,"Será que o diretor da CIA veio ajudar no combate as queimadas na Amazônia ,o garimpo ilegal , os madeireiros, a fome e o desemprego no Brasil,as ameaças antidemocráticas do presidente da República ,será que veio ajudar os povos indígenas ,ou ajudar a combater as fakes news ? 🤔🤔",pt,[],[],[],1,0,3,[],[],https://twitter.com/rosemarywarde/status/1410781164655218690,False,,0,,,,,,,,[],,,,
1410758443552718851,1410758443552718851,2021-07-01 21:33:18 SA Eastern Standard Time,2021-07-01,21:33:18,-0300,2774967697,rebzlerer,rebeca lerer,,"Número de focos de queimadas em junho/2021 é o mais alto dos últimos 14 anos na Amazônia. Governo da morte, em todos os sentidos. #ForaBolsonaro #EmergênciaClimática",pt,[],[],[],0,0,10,"['forabolsonaro', 'emergênciaclimática']",[],https://twitter.com/RebzLerer/status/1410758443552718851,False,,0,,,,,,,,[],,,,
1410758348908212225,1410758348908212225,2021-07-01 21:32:55 SA Eastern Standard Time,2021-07-01,21:32:55,-0300,72163475,morenoconsult,Joao Carlos Moreno,,"Globosta, uma TV contra o Brasil. Agora, no JN, manchetes: ""Recorde de exportações do Brasil"" Mas a Globolixo não deixa barato, e emenda em seguida: ""Recorde de queimadas na Amazônia"" Queira Deus que esse câncer de TV não consiga renovar a concessão em 2022.",pt,[],[],[],0,0,0,[],[],https://twitter.com/morenoconsult/status/1410758348908212225,False,,0,,,,,,,,[],,,,
1410757138570432515,1410757138570432515,2021-07-01 21:28:07 SA Eastern Standard Time,2021-07-01,21:28:07,-0300,1263954364986785793,aselmadom,Selma,,Jornal Nacional: Recorde nas exportações do Brasil!! Masss tem  recordes nas queimadas da Amazônia 😒 sempre tem um masss...,pt,[],[],[],29,44,322,[],[],https://twitter.com/ASelmadom/status/1410757138570432515,False,,0,,,,,,,,[],,,,
1410757042034425857,1410757042034425857,2021-07-01 21:27:44 SA Eastern Standard Time,2021-07-01,21:27:44,-0300,560609424,paulo_robe1,Paulo Roberto Cunha,,Agora no Jornal Nacional da Globolixo… “recorde nas exportações do Brasil” aí o outro âncora entra dizendo logo após “recorde nas queimadas da Amazônia “  aí eu te pergunto : recorde de queimadas em pleno inverno chuvoso ?!?!?!?!?  https://t.co/jBUbeDq9FG,pt,[],[],['https://pbs.twimg.com/media/E5QEDKOWQAMetVO.jpg'],0,0,0,[],[],https://twitter.com/paulo_robe1/status/1410757042034425857,False,,1,https://pbs.twimg.com/media/E5QEDKOWQAMetVO.jpg,,,,,,,[],,,,
1410756598755115009,1410756598755115009,2021-07-01 21:25:58 SA Eastern Standard Time,2021-07-01,21:25:58,-0300,733465115710783490,folettocassiano,Cassiano Foletto,,"Recorde das queimadas na Amazônia, parabéns 🇧🇷💩",pt,[],[],[],0,0,1,[],[],https://twitter.com/FolettoCassiano/status/1410756598755115009,False,,0,,,,,,,,[],,,,
