id,conversation_id,created_at,date,time,timezone,user_id,username,name,place,tweet,language,mentions,urls,photos,replies_count,retweets_count,likes_count,hashtags,cashtags,link,retweet,quote_url,video,thumbnail,near,geo,source,user_rt_id,user_rt,retweet_id,reply_to,retweet_date,translate,trans_src,trans_dest
1372689972671741954,1372689972671741954,2021-03-18 20:22:47 -03,2021-03-18,20:22:47,-0300,1081247423547297792,dissebolsonaro,Bolsonaro Disse,,. Auxílio-emergencial ( detalhes com o Presidente da @Caixa sobre o maior projeto social do mundo; . Ação Direta de Inconstitucionalidade no STF (toque de recolher e defesa da Constituição); . Combate de fraudes do auxílio-emergencial; . Diminuição do desmatamento da Amazônia;,pt,"[{'screen_name': 'caixa', 'name': 'caixa', 'id': '229191436'}]",[],[],0,0,0,[],[],https://twitter.com/DisseBolsonaro/status/1372689972671741954,False,,0,,,,,,,,[],,,,
1372687250731982853,1372687250731982853,2021-03-18 20:11:58 -03,2021-03-18,20:11:58,-0300,1077241698990858240,desbloqueandojb,Desbloqueando Jair Bolsonaro,,. Auxílio-emergencial ( detalhes com o Presidente da @Caixa sobre o maior projeto social do mundo; . Ação Direta de Inconstitucionalidade no STF (toque de recolher e defesa da Constituição); . Combate de fraudes do auxílio-emergencial; . Diminuição do desmatamento da Amazônia;,pt,"[{'screen_name': 'caixa', 'name': 'caixa', 'id': '229191436'}]",[],[],0,0,1,[],[],https://twitter.com/DesbloqueandoJB/status/1372687250731982853,False,,0,,,,,,,,[],,,,
1372685629570564097,1372508671247331329,2021-03-18 20:05:32 -03,2021-03-18,20:05:32,-0300,128372940,jairbolsonaro,Jair M. Bolsonaro,,. Auxílio-emergencial ( detalhes com o Presidente da @Caixa sobre o maior projeto social do mundo; . Ação Direta de Inconstitucionalidade no STF (toque de recolher e defesa da Constituição); . Combate de fraudes do auxílio-emergencial; . Diminuição do desmatamento da Amazônia;,pt,"[{'screen_name': 'caixa', 'name': 'caixa', 'id': '229191436'}]",[],[],1140,1638,9469,[],[],https://twitter.com/jairbolsonaro/status/1372685629570564097,False,,0,,,,,,,,[],,,,
1372684241754976259,1372684241754976259,2021-03-18 20:00:01 -03,2021-03-18,20:00:01,-0300,80378191,radioagenciaebc,Radioagência Nacional,,Banco Interamericano de Desenvolvimento #BID libera R$ 500 milhões para ações de combate ao desmatamento e de desenvolvimento sustentável na Amazônia. Saiba mais:  https://t.co/6uGEb9Dghl. 📷 Marcelo Camargo/ Agência Brasil  https://t.co/FrL2d8PuLd,pt,[],['https://bit.ly/30VoSPh'],['https://pbs.twimg.com/media/EwybFYNXEAEJH2b.jpg'],0,0,2,['bid'],[],https://twitter.com/RadioagenciaEBC/status/1372684241754976259,False,,1,https://pbs.twimg.com/media/EwybFYNXEAEJH2b.jpg,,,,,,,[],,,,
1372681807011975169,1372681807011975169,2021-03-18 19:50:20 -03,2021-03-18,19:50:20,-0300,58324963,dariglik,darkangel,,"Você sabia que o desmatamento é de grande risco para os animais e o meio ambiente?  A Amazônia brasileira sofreu desmatamento em grande escala nas últimas décadas, principalmente para gado de corte e soja . Devido a pressão internacional, as leis de proteção foram …  https://t.co/rP1GjjT286",pt,[],[],['https://pbs.twimg.com/media/Ewy-06-WYAApy5o.jpg'],0,0,0,[],[],https://twitter.com/dariGliK/status/1372681807011975169,False,,1,https://pbs.twimg.com/media/Ewy-06-WYAApy5o.jpg,,,,,,,[],,,,
1372678515234066433,1372678515234066433,2021-03-18 19:37:15 -03,2021-03-18,19:37:15,-0300,2147700098,amazonia_real,Amazônia Real,,"Em novo artigo, Philip Fearnside frisa que ""o atual sistema de regularização fundiária, baseado no desmatamento, deve acabar"". O autor também fala sobre a nova ""lei da grilagem"", uma ameaça à floresta que terá prioridade de aprovação no Congresso Nacional.  https://t.co/HVAjS8fXPz  https://t.co/lwv8wLtKgv",pt,[],['http://bit.ly/2P3Cplo'],['https://pbs.twimg.com/media/Ewy71XbWgBEUike.jpg'],0,8,21,[],[],https://twitter.com/amazonia_real/status/1372678515234066433,False,,1,https://pbs.twimg.com/media/Ewy71XbWgBEUike.jpg,,,,,,,[],,,,
1372675927575031820,1372675927575031820,2021-03-18 19:26:58 -03,2021-03-18,19:26:58,-0300,250927428,rodriguesrsr,Rogério🇧🇷 Rodrigues🇧🇷,,Desmatamento na Amazônia cai 34% em fevereiro  https://t.co/CNFejAudyz,pt,[],['https://gazetabrasil.com.br/brasil/2021/03/18/desmatamento-na-amazonia-cai-34-em-fevereiro/'],[],0,1,1,[],[],https://twitter.com/rodriguesrsr/status/1372675927575031820,False,,0,,,,,,,,[],,,,
1372672031536381956,1372667252202471426,2021-03-18 19:11:29 -03,2021-03-18,19:11:29,-0300,1205149960364318725,danielhmacedo,Daniel Macedo,,"@PATRlOTAS Pois é, mas não duvide da criatividade da mídia. Por exemplo, poderiam fazer uma matéria assim: Devido isolamento social, lojas de machados de Bolsonaro fica fechada e amazônia recua em desmatamento.  https://t.co/Z6sWE0JQVw",pt,[],[],['https://pbs.twimg.com/tweet_video_thumb/Ewy17pEWQAARM5Q.jpg'],0,0,0,[],[],https://twitter.com/DanielHMacedo/status/1372672031536381956,False,,1,https://pbs.twimg.com/tweet_video_thumb/Ewy17pEWQAARM5Q.jpg,,,,,,,"[{'screen_name': 'PATRlOTAS', 'name': 'Patriotas', 'id': '955586323452219393'}]",,,,
1372663299372941319,1372653085848403976,2021-03-18 18:36:48 -03,2021-03-18,18:36:48,-0300,1217131140739469313,tiagoreisb,3,,"@andrearoeirap @camanpour puts, tristeza resposta nível sobrevoar a amazônia com os líderes europeus pra verem que não tem desmatamento",pt,[],[],[],0,0,4,[],[],https://twitter.com/tiagoreisb/status/1372663299372941319,False,,0,,,,,,,,"[{'screen_name': 'andrearoeirap', 'name': 'Aroeira 🌿 #MarcoTemporalNão', 'id': '875485027177553921'}, {'screen_name': 'camanpour', 'name': 'Christiane Amanpour', 'id': '69181624'}]",,,,
1372646360676249605,1372646360676249605,2021-03-18 17:29:29 -03,2021-03-18,17:29:29,-0300,2147700098,amazonia_real,Amazônia Real,,"A La Niña, que é um fenômeno natural, foi dramaticamente potencializada por causa do desmatamento em 2020. Leia a matéria de Fabio Pontes e saiba mais:  https://t.co/6HGAWxc0g9",pt,[],['http://bit.ly/2NHpS6V'],[],0,2,7,[],[],https://twitter.com/amazonia_real/status/1372646360676249605,False,https://twitter.com/CanalReload/status/1372548349740654592,0,,,,,,,,[],,,,
1372644536095227905,1372644536095227905,2021-03-18 17:22:14 -03,2021-03-18,17:22:14,-0300,29913589,revistaistoe,Revista ISTOÉ,,"""Nos temos grandes patrimônios como o Pantanal, a Amazônia, mas também temos aventureiros que promovem desmatamento e ilegalidades""  Estamos ao vivo com o professor e ex-ministro da Agricultura, Roberto Rodrigues   https://t.co/767F3Z0RRi",pt,[],['https://www.pscp.tv/w/cyJXSDY3NzUxNDN8MUJSS2pCTGpZVnZLd6WNbog8FlNCN0oCfq4CUOlzs5CwE3nnZwj1J9EF9Bbw'],[],0,3,9,[],[],https://twitter.com/RevistaISTOE/status/1372644536095227905,False,,0,,,,,,,,[],,,,
1372635793517379587,1372635793517379587,2021-03-18 16:47:30 -03,2021-03-18,16:47:30,-0300,58007416,thaisvianello,Thais Vianello 🇧🇷,,Desmatamento na Amazônia cai 34% em fevereiro  https://t.co/7HtlAHc2gx,pt,[],['https://gazetabrasil.com.br/brasil/2021/03/18/desmatamento-na-amazonia-cai-34-em-fevereiro/'],[],2,10,32,[],[],https://twitter.com/THAISVIANELLO/status/1372635793517379587,False,,0,,,,,,,,[],,,,
1372631542879694848,1372631542879694848,2021-03-18 16:30:36 -03,2021-03-18,16:30:36,-0300,1148318806303027205,marcosquezado1,Delegado M Quezado,,"Bolsonaro defende política contra desmatamento, em reunião do BID. Ele afirmou que houve redução de 20% na área desmatada da Amazônia nos últimos 6 meses, em comparação com ano anterior.  https://t.co/URsNYK0iBz",pt,[],['https://noticias.r7.com/brasil/bolsonaro-defende-politica-contra-desmatamento-em-reuniao-do-bid-18032021'],[],0,18,63,[],[],https://twitter.com/MarcosQuezado1/status/1372631542879694848,False,,0,,,,,,,,[],,,,
1372608743523950593,1372608743523950593,2021-03-18 15:00:00 -03,2021-03-18,15:00:00,-0300,66451963,oglobo_economia,O Globo_Economia,,"Em reunião do BID, o ministro Paulo Guedes disse que o país trabalha para combater a mineração e o desmatamento ilegais na Amazônia. Acrescentou que a agenda de desenvolvimento sustentável da região é uma prioridade para o Brasil.   https://t.co/d10u72skPU",pt,[],['http://glo.bo/30ZmDKI'],[],2,0,2,[],[],https://twitter.com/OGlobo_Economia/status/1372608743523950593,False,,0,,,,,,,,[],,,,
1372603194111635463,1372601789191761923,2021-03-18 14:37:57 -03,2021-03-18,14:37:57,-0300,60945827,tharcisio7,Tharcísio,,"@exame Ele quis dizer ""Amazônia deve ser pensada como oportunidade de desmatamento""",pt,[],[],[],0,0,2,[],[],https://twitter.com/THARCISIO7/status/1372603194111635463,False,,0,,,,,,,,"[{'screen_name': 'exame', 'name': 'exame', 'id': '30070288'}]",,,,
1372600572344426497,1372600572344426497,2021-03-18 14:27:32 -03,2021-03-18,14:27:32,-0300,1178035369985658880,nobrejorge2,Nobre Jorge,,Metrópoles: Bolsonaro e Guedes defendem medidas contra desmatamento na Amazônia.  https://t.co/I1FFuZ99fA  através do @GoogleNews,pt,"[{'screen_name': 'googlenews', 'name': 'google news', 'id': '33584794'}]",['https://www.metropoles.com/brasil/economia-br/bolsonaro-e-guedes-defendem-medidas-contra-desmatamento-na-amazonia'],[],1,0,0,[],[],https://twitter.com/NobreJorge2/status/1372600572344426497,False,,0,,,,,,,,[],,,,
1372599990393126912,1372599990393126912,2021-03-18 14:25:14 -03,2021-03-18,14:25:14,-0300,1361319723389120515,blogtrendbr,Blog Trend,,Jair Bolsonaro (Sem Partido)  defendeu o “desenvolvimento sustentável e o fim do desmatamento ilegal” da Amazônia.  https://t.co/yfXOBek26o  https://t.co/gaTSnUe7Ks,pt,[],['https://brasilpe.com.br/em-discurso-bolsonaro-defende-o-desenvolvimento-sustentavel-da-amazonia/'],['https://pbs.twimg.com/media/Ewx0aqWWQAAnB8N.jpg'],0,0,1,[],[],https://twitter.com/BlogTrendbr/status/1372599990393126912,False,,1,https://pbs.twimg.com/media/Ewx0aqWWQAAnB8N.jpg,,,,,,,[],,,,
1372593996187496450,1372593996187496450,2021-03-18 14:01:24 -03,2021-03-18,14:01:24,-0300,3024436931,p_prefeitura,Portal de Prefeitura,,Desmatamento na Amazônia cai 34% em fevereiro  https://t.co/AtULONoRFc,pt,[],['https://portaldeprefeitura.com.br/2021/03/18/desmatamento-na-amazonia-cai-34-em-fevereiro/'],[],0,0,0,[],[],https://twitter.com/p_prefeitura/status/1372593996187496450,False,,0,,,,,,,,[],,,,
1372584303692021766,1372584303692021766,2021-03-18 13:22:54 -03,2021-03-18,13:22:54,-0300,1390513748,whateconomy,What Economy,,Bolsonaro: Fim do desmatamento depende de economia na Amazônia... ( https://t.co/gY8Z8Elt6A),pt,[],['https://noticias.uol.com.br/meio-ambiente/ultimas-noticias/redacao/2021/03/18/fim-do-desmatamento-depende-de-economia-na-amazonia-diz-bolsonaro.htm'],[],0,0,0,[],[],https://twitter.com/whateconomy/status/1372584303692021766,False,,0,,,,,,,,[],,,,
1372574678129156096,1372574678129156096,2021-03-18 12:44:39 -03,2021-03-18,12:44:39,-0300,363248419,fonte_tradenews,Trade News,,++TN: Bolsonaro comemora queda em desmatamento nos últimos 6 meses e diz que continuará trabalho - Link  🔗 na Bio!   #Amazônia #BID #Brasil #JairBolsonaro #MeioAmbiente #Política #Reuters  https://t.co/rGdcBRAxeo,pt,[],[],['https://pbs.twimg.com/media/EwxdZRcVEAEOWFc.jpg'],0,0,0,"['amazônia', 'bid', 'brasil', 'jairbolsonaro', 'meioambiente', 'política', 'reuters']",[],https://twitter.com/Fonte_TradeNews/status/1372574678129156096,False,,1,https://pbs.twimg.com/media/EwxdZRcVEAEOWFc.jpg,,,,,,,[],,,,
1372574673045708805,1372574673045708805,2021-03-18 12:44:37 -03,2021-03-18,12:44:37,-0300,1264190912978182147,alessan95946028,Alessandro Familia Eu Valorizo,,Brasil o país que mais preserva o meio ambiente isso é fato!!  Desmatamento na Amazônia cai 34% em fevereiro  https://t.co/kzYo7vbA80 via @Gazeta Brasil - O que está acontecendo no Brasil e no Mundo agora.,pt,"[{'screen_name': 'gazeta', 'name': 'gazeta', 'id': '14184115'}]",['https://gazetabrasil.com.br/brasil/2021/03/18/desmatamento-na-amazonia-cai-34-em-fevereiro/'],[],0,1,1,[],[],https://twitter.com/Alessan95946028/status/1372574673045708805,False,,0,,,,,,,,[],,,,
1372574594486444037,1372573853659103236,2021-03-18 12:44:19 -03,2021-03-18,12:44:19,-0300,280755999,ocirfbr,RbF,,@BlogdoNoblat @UOLNoticias @UOL Fim do desmatamento da Amazônia depende de a gente abrir o caminho pra acabar pra desmatar tudo.,pt,[],[],[],0,0,0,[],[],https://twitter.com/ocirfbr/status/1372574594486444037,False,,0,,,,,,,,"[{'screen_name': 'BlogdoNoblat', 'name': 'Blog do Noblat', 'id': '16794066'}, {'screen_name': 'UOLNoticias', 'name': 'UOL Notícias', 'id': '14594698'}, {'screen_name': 'UOL', 'name': 'UOL', 'id': '70799317'}]",,,,
1372574216680263681,1372574216680263681,2021-03-18 12:42:49 -03,2021-03-18,12:42:49,-0300,51150679,leiamoneytimes,Money Times,,Bolsonaro comemora queda em desmatamento nos últimos 6 meses e diz que continuará trabalho  https://t.co/0JGHq5PowA  #política #jairbolsonaro #amazônia #brasil,pt,[],['https://www.moneytimes.com.br/bolsonaro-comemora-queda-em-desmatamento-nos-ultimos-6-meses-e-diz-que-continuara-trabalho/'],[],0,3,27,"['política', 'jairbolsonaro', 'amazônia', 'brasil']",[],https://twitter.com/leiamoneytimes/status/1372574216680263681,False,,0,,,,,,,,[],,,,
1372573853659103236,1372573853659103236,2021-03-18 12:41:22 -03,2021-03-18,12:41:22,-0300,16794066,blogdonoblat,Blog do Noblat,,"[Se pudesse, botava fogo em toda floresta]  Fim do desmatamento depende de economia na Amazônia, diz Bolsonaro  https://t.co/pLJhQ1ybCs via @UOLNoticias @UOL",pt,"[{'screen_name': 'uolnoticias', 'name': 'uol notícias', 'id': '14594698'}, {'screen_name': 'uol', 'name': 'uol', 'id': '70799317'}]",['https://noticias.uol.com.br/meio-ambiente/ultimas-noticias/redacao/2021/03/18/fim-do-desmatamento-depende-de-economia-na-amazonia-diz-bolsonaro.htm?utm_source=twitter&utm_medium=social-media&utm_content=geral&utm_campaign=noticias'],[],8,3,35,[],[],https://twitter.com/BlogdoNoblat/status/1372573853659103236,False,,0,,,,,,,,[],,,,
1372572109986271238,1372572109986271238,2021-03-18 12:34:26 -03,2021-03-18,12:34:26,-0300,70799317,uol,UOL,,"Fim do desmatamento depende de economia na Amazônia, diz Bolsonaro  https://t.co/CyQqLm9WBe",pt,[],['https://zpr.io/RZD3k'],[],8,1,14,[],[],https://twitter.com/UOL/status/1372572109986271238,False,,0,,,,,,,,[],,,,
1372571869270974464,1372571869270974464,2021-03-18 12:33:29 -03,2021-03-18,12:33:29,-0300,14594698,uolnoticias,UOL Notícias,,"Fim do desmatamento depende de economia na Amazônia, diz Bolsonaro  https://t.co/fnHM9QPcmt",pt,[],['https://zpr.io/RZD3N'],[],10,2,17,[],[],https://twitter.com/UOLNoticias/status/1372571869270974464,False,,0,,,,,,,,[],,,,
1372571776916541440,1372571776916541440,2021-03-18 12:33:07 -03,2021-03-18,12:33:07,-0300,1090291692744466433,sigagazetabr,Gazeta Brasil,,"Desmatamento na Amazônia cai 34% em fevereiro. Nos últimos sete meses, a redução acumulada chegou a 21%  https://t.co/ce4sZ1AIX5",pt,[],['https://gazetabrasil.com.br/brasil/2021/03/18/desmatamento-na-amazonia-cai-34-em-fevereiro/'],[],3,93,375,[],[],https://twitter.com/SigaGazetaBR/status/1372571776916541440,False,,0,,,,,,,,[],,,,
1372569760957931521,1372569338520162315,2021-03-18 12:25:06 -03,2021-03-18,12:25:06,-0300,69940960,detrindade,D. Trindade 🇧🇷,,@CNNBrasil E Bolsonaro acabou de falar que o desmatamento ilegal na Amazônia só acabará de acordo com o desenvolvimento da economia na região.   Pqp.,pt,[],[],[],3,0,5,[],[],https://twitter.com/DeTrindade/status/1372569760957931521,False,,0,,,,,,,,"[{'screen_name': 'CNNBrasil', 'name': 'CNN Brasil', 'id': '809124436880322561'}]",,,,
1372569061826162689,1372569061826162689,2021-03-18 12:22:20 -03,2021-03-18,12:22:20,-0300,14594698,uolnoticias,UOL Notícias,,Gisele Bündchen cobra governo por desmatamento e preservação da Amazônia  https://t.co/I1jpwwuWe3,pt,[],['https://www.uol.com.br/splash/reportagens-especiais/gisele-bundchen-em-defesa-da-amazonia/index.htm?utm_source=twitter&utm_medium=social-media&utm_campaign=noticias&utm_content=geral'],[],15,11,106,[],[],https://twitter.com/UOLNoticias/status/1372569061826162689,False,,0,,,,,,,,[],,,,
1372568908541100035,1372568908541100035,2021-03-18 12:21:43 -03,2021-03-18,12:21:43,-0300,14594895,splash_uol,Splash UOL,,Gisele Bündchen cobra governo por desmatamento e preservação da Amazônia  https://t.co/hb5DTw24gz,pt,[],['https://www.uol.com.br/splash/reportagens-especiais/gisele-bundchen-em-defesa-da-amazonia/index.htm?utm_source=twitter&utm_medium=social-media&utm_campaign=splash&utm_content=geral'],[],0,0,5,[],[],https://twitter.com/Splash_UOL/status/1372568908541100035,False,,0,,,,,,,,[],,,,
1372568795525619713,1372568795525619713,2021-03-18 12:21:16 -03,2021-03-18,12:21:16,-0300,70799317,uol,UOL,,Gisele Bündchen cobra governo por desmatamento e preservação da Amazônia  https://t.co/d1HwhwUHWl,pt,[],['https://www.uol.com.br/splash/reportagens-especiais/gisele-bundchen-em-defesa-da-amazonia/index.htm?utm_source=twitter&utm_medium=social-media&utm_campaign=uol&utm_content=geral'],[],35,30,370,[],[],https://twitter.com/UOL/status/1372568795525619713,False,,0,,,,,,,,[],,,,
1372563814785372168,1372563814785372168,2021-03-18 12:01:29 -03,2021-03-18,12:01:29,-0300,4149248867,reportermaceio,Repórter Maceió,,Desmatamento na Amazônia cai 34% em fevereiro  https://t.co/s4KtNmMB9V,pt,[],['https://www.reportermaceio.com.br/desmatamento-na-amazonia-cai-34-em-fevereiro/?feed_id=10802&_unique_id=60536b43bd6b1'],[],0,0,0,[],[],https://twitter.com/reportermaceio/status/1372563814785372168,False,,0,,,,,,,,[],,,,
1372548617064562696,1372288928837931011,2021-03-18 11:01:05 -03,2021-03-18,11:01:05,-0300,131286287,minc_rj,Carlos Minc,,"Gostei do discurso do Lula. Mas senti muito a falta da Sustentabilidade! Energia limpa, Amazônia, Clima, Povos indígenas, saneamento.  Eu e Marina fomos os ministros de Meio ambiente: reduzimos desmatamento em 50%, Brasil foi 1o país em desenvolvimento com metas de redução de CO2",pt,[],[],[],20,7,172,[],[],https://twitter.com/minc_rj/status/1372548617064562696,False,,0,,,,,,,,[],,,,
1372548349740654592,1372548349740654592,2021-03-18 11:00:01 -03,2021-03-18,11:00:01,-0300,1285978765907111936,canalreload,Canal Reload,,"Com infos da @amazonia_real, nossa apresentadora @sam_sateremawe, descomplica o rolê das enchentes que estão inundando o Acre e ameaçando o Amazonas este ano.  A La Niña, que é um fenômeno natural, foi dramaticamente potencializada por causa do desmatamento de 2020.  #DáUmReload!  https://t.co/O7JvffURVN",pt,"[{'screen_name': 'amazonia_real', 'name': 'amazônia real', 'id': '2147700098'}, {'screen_name': 'sam_sateremawe', 'name': 'samela awiá 🐝', 'id': '1043586563526012928'}]",[],[],0,8,21,['dáumreload'],[],https://twitter.com/CanalReload/status/1372548349740654592,False,,1,https://pbs.twimg.com/media/EwtodFGWEAAxFjF.jpg,,,,,,,[],,,,
1372545569483337728,1372545569483337728,2021-03-18 10:48:59 -03,2021-03-18,10:48:59,-0300,73024459,caiosborges,Caio Borges 🌵 包凯越,,"Vem aí estudo de quem mais entende da situação fundiária na Amazônia. Sem políticas que tratem a questão fundiária e ambiental juntas, não haverá solução definitiva para os principais problemas da Amazônia, como o desmatamento e grilagem. Parabéns @brenda_brito!",pt,"[{'screen_name': 'brenda_brito', 'name': 'brenda brito', 'id': '35568011'}]",[],[],0,0,4,[],[],https://twitter.com/caiosborges/status/1372545569483337728,False,https://twitter.com/brenda_brito/status/1372543747481726978,0,,,,,,,,[],,,,
1372522669325828100,1372515186712707072,2021-03-18 09:17:59 -03,2021-03-18,09:17:59,-0300,77349643,ricardomlpotter,Ricardo,,"@hoje_no Eles vão conseguir vender a ideia de que o vírus surgiu no Brasil por causa do desmatamento na Amazônia e virão com uma solução mágica onde poderão intervir e sancionar regras sobre a Amazônia, violando a soberania brasileira.",pt,[],[],[],0,0,2,[],[],https://twitter.com/ricardomlpotter/status/1372522669325828100,False,,0,,,,,,,,"[{'screen_name': 'hoje_no', 'name': 'Hoje no Mundo Militar', 'id': '799915069186469888'}]",,,,
1372489449158946819,1372373035475468290,2021-03-18 07:05:58 -03,2021-03-18,07:05:58,-0300,1241015353444089856,avancinironi,O velho punk rabugento 🇻🇳🇺🇾🇵🇸,,"@zehdeabreu Devem estar usando a madeira do desmatamento da Amazônia, para fazer caixão",pt,[],[],[],0,0,0,[],[],https://twitter.com/AvanciniRoni/status/1372489449158946819,False,,0,,,,,,,,"[{'screen_name': 'zehdeabreu', 'name': 'José de Abreu', 'id': '206222507'}]",,,,
1372478129940410368,1372478129940410368,2021-03-18 06:21:00 -03,2021-03-18,06:21:00,-0300,15518054,observatorio,Observatório da Imprensa,,"O Observatório se juntou ao @climaesociedade para entender de que maneira os moradores da Amazônia Legal se informam. Na edição #OI1129, analisamos como os jornais do Acre cobrem temas relacionados ao desmatamento e às mudanças climáticas.  https://t.co/NAIeJdX3HW  https://t.co/m8bTe8uuAh",pt,"[{'screen_name': 'climaesociedade', 'name': 'instituto clima e sociedade (ics)', 'id': '1117057083709579264'}]",['https://bit.ly/2QceiRT'],['https://pbs.twimg.com/media/Ewt32RGWYAA5hYx.jpg'],0,11,26,['oi1129'],[],https://twitter.com/observatorio/status/1372478129940410368,False,,1,https://pbs.twimg.com/media/Ewt32RGWYAA5hYx.jpg,,,,,,,[],,,,
1372403665366102018,1372403665366102018,2021-03-18 01:25:06 -03,2021-03-18,01:25:06,-0300,1230980299007328257,silvioleal7,silvio leal,,Desmatamento da Amazônia dispara de novo em 2020  https://t.co/MDPYDZZMwW via @usponline,pt,"[{'screen_name': 'usponline', 'name': 'usp', 'id': '24241923'}]",['https://jornal.usp.br/ciencias/desmatamento-da-amazonia-dispara-de-novo-em-2020/'],[],0,0,0,[],[],https://twitter.com/silvioleal7/status/1372403665366102018,False,,0,,,,,,,,[],,,,
1372368690755276803,1372368690755276803,2021-03-17 23:06:07 -03,2021-03-17,23:06:07,-0300,62601015,fernandoguida,Fernando Guida,,Dois terços do desmatamento na Amazônia e no Cerrado vêm de apenas 2% das fazendas de gado e soja  https://t.co/bEjrKiv6rp via @fernandoGuida,pt,"[{'screen_name': 'fernandoguida', 'name': 'fernando guida', 'id': '62601015'}]",['https://blogdoguida.wordpress.com/2021/03/02/dois-tercos-do-desmatamento-na-amazonia-e-no-cerrado-vem-de-apenas-2-das-fazendas-de-gado-e-soja/'],[],0,5,6,[],[],https://twitter.com/FernandoGuida/status/1372368690755276803,False,,0,,,,,,,,[],,,,
1372356125656420354,1372285577882705920,2021-03-17 22:16:12 -03,2021-03-17,22:16:12,-0300,594111922,eldybarreto,Eldy Barreto 🇧🇷🇦🇪,,@ricardi09184316 @CortKiki A culpa é de Bolsonaro! Macro já vem avisando a muito tempo sobre o desmatamento na Amazônia. #Macronpresidentedobrasil,pt,[],[],[],0,0,0,['macronpresidentedobrasil'],[],https://twitter.com/EldyBarreto/status/1372356125656420354,False,,0,,,,,,,,"[{'screen_name': 'ricardi09184316', 'name': 'ricardinho', 'id': '1274735913759838208'}, {'screen_name': 'CortKiki', 'name': 'Kiki💖Deus acima de todos!', 'id': '428546950'}]",,,,
1372347843869040643,1372312132428124160,2021-03-17 21:43:17 -03,2021-03-17,21:43:17,-0300,1216867998587346950,novo_regime,Nova memória 🌈🌊🌴🍃🌵🌱,,@sinistramemes A Amazônia só será salva quando os fãs da Anitta lançarem uma hashtag contra o desmatamento!,pt,[],[],[],0,0,1,[],[],https://twitter.com/novo_regime/status/1372347843869040643,False,,0,,,,,,,,"[{'screen_name': 'sinistramemes', 'name': 'Sinistra', 'id': '1173398642922799104'}]",,,,
1372336400281051145,1372319185494282245,2021-03-17 20:57:49 -03,2021-03-17,20:57:49,-0300,25144141,taeezeh,Taise,,"@advogato Pois então, o tempo tá mudando muito e isso não é nada bom. E não falam mais como anda o desmatamento da Amazônia, a situação no Pantanal...",pt,[],[],[],0,0,1,[],[],https://twitter.com/Taeezeh/status/1372336400281051145,False,,0,,,,,,,,"[{'screen_name': 'advogato', 'name': '⟦advogato⟧ 🇺🇳', 'id': '15600774'}]",,,,
1372325376609898499,1372243344907198464,2021-03-17 20:14:01 -03,2021-03-17,20:14:01,-0300,1106769977762332672,_guivideira_,$SCCP | perlon apenas,,@thehmg_ vai apoiar desmatamento na Amazônia vai,pt,[],[],[],0,0,0,[],[],https://twitter.com/_guivideira_/status/1372325376609898499,False,,0,,,,,,,,"[{'screen_name': 'thehmg_', 'name': 'princesa da torre', 'id': '1103475260396048384'}]",,,,
1372320964218871809,1372315051844104192,2021-03-17 19:56:29 -03,2021-03-17,19:56:29,-0300,2431597169,manulouize,Manu,,@Exquerdopata avisa q quem acaba com a amazônia na vdd eh o desmatamento causado pela atividade pecuária em massa para alimentar o gado q alimenta essa gay desinformada,pt,[],[],[],1,0,3,[],[],https://twitter.com/manulouize/status/1372320964218871809,False,,0,,,,,,,,"[{'screen_name': 'Exquerdopata', 'name': 'Pangloss', 'id': '1088047650'}]",,,,
1372307914891874324,1372307914891874324,2021-03-17 19:04:37 -03,2021-03-17,19:04:37,-0300,76015842,carolmph,Carol,,"🇧🇷 A Operação Verde Brasil 2 segue apresentando resultados expressivos no combate ao desmatamento na Amazônia. Em fevereiro, os avisos na região apresentaram queda de 34% em comparação com o mesmo mês do ano passado. Nos últimos sete meses, a redução acumulada chegou a 21%.  https://t.co/jjU5UthuIH",pt,[],[],['https://pbs.twimg.com/media/EwtqxOwXAAEQXdd.jpg'],0,8,22,[],[],https://twitter.com/Carolmph/status/1372307914891874324,False,,1,https://pbs.twimg.com/media/EwtqxOwXAAEQXdd.jpg,,,,,,,[],,,,
