id,conversation_id,created_at,date,time,timezone,user_id,username,name,place,tweet,language,mentions,urls,photos,replies_count,retweets_count,likes_count,hashtags,cashtags,link,retweet,quote_url,video,thumbnail,near,geo,source,user_rt_id,user_rt,retweet_id,reply_to,retweet_date,translate,trans_src,trans_dest
1358509895243489282,1358489093781540870,2021-02-07 17:16:13 SA Eastern Standard Time,2021-02-07,17:16:13,-0300,1357093928298758145,xerecahater,Jong,,@NSuspenso @pardopostagem3 Assim iniciou-se as queimadas na Amazônia 😔 Triste demais,pt,[],[],[],0,0,10,[],[],https://twitter.com/XerecaHater/status/1358509895243489282,False,,0,,,,,,,,"[{'screen_name': 'Nsuspenso', 'name': '• Nero Nichols •', 'id': '1319843104950714369'}, {'screen_name': 'pardopostagem3', 'name': 'pardopostagem supremacy', 'id': '1330978404062142464'}]",,,,
1358453414661914632,1358453414661914632,2021-02-07 13:31:47 SA Eastern Standard Time,2021-02-07,13:31:47,-0300,1355748653839872000,ms_of_disaster,Micha /unblock calva /block,,"Gente, é vdd que a Sarah é uma super espiã treinada no projeto MK-Ultra da CIA para espionar o DiCaprio e obter informações sobre as queimadas na Amazônia? #BBBB21",pt,[],[],[],0,0,0,['bbbb21'],[],https://twitter.com/ms_of_disaster/status/1358453414661914632,False,,0,,,,,,,,[],,,,
1358257909411569667,1358257909411569667,2021-02-07 00:34:55 SA Eastern Standard Time,2021-02-07,00:34:55,-0300,1243980033854779393,pauloleeee,sanbenito🤍 GFR,,Cidade invisível era pra ter sido gravada aqui no norte.  Ai os produtores podiam falar sobre as queimadas na Amazônia e os babados dos índios e afins. Envolvendo ritual ia ser top. Mas Deus não da asas as cobras #CidadeInvisivel  #CidadeInvisivel,pt,[],[],[],0,0,0,"['cidadeinvisivel', 'cidadeinvisivel']",[],https://twitter.com/pauloleeee/status/1358257909411569667,False,,0,,,,,,,,[],,,,
1358188727642828802,1358188727642828802,2021-02-06 20:00:01 SA Eastern Standard Time,2021-02-06,20:00:01,-0300,1312880599070314502,infovegbr,Infovegbr,,"Para 84% dos brasileiros, queimadas na Amazônia prejudicam imagem do país  https://t.co/8H7Hbk2gxK  https://t.co/8T9rCTj6Mj",pt,[],['https://bit.ly/3aFg58z'],['https://pbs.twimg.com/media/Etk6qZpWgAUr5Og.png'],0,0,0,[],[],https://twitter.com/infovegbr/status/1358188727642828802,False,,1,https://pbs.twimg.com/media/Etk6qZpWgAUr5Og.png,,,,,,,[],,,,
1358142402964447233,1358142402964447233,2021-02-06 16:55:56 SA Eastern Standard Time,2021-02-06,16:55:56,-0300,851858450091057152,amartins1960,Adilson Martins 🇧🇷38,,@mmeioambiente gostaria de saber se as areas das queimadas na AMAZÔNIA e Mato Grosso seram reflorestada???,pt,[],[],[],1,0,0,[],[],https://twitter.com/amartins1960/status/1358142402964447233,False,,0,,,,,,,,[],,,,
1358139394495021058,1357704311950761989,2021-02-06 16:43:59 SA Eastern Standard Time,2021-02-06,16:43:59,-0300,1242122089328492553,frontnacaobr,@FrontNacionalista,,"@Gabriel501SA @crisstorress @Renata01314529 @heldermaldonado Queimadas não!  Mas assentamentos agroflorestais , cidades planejadas, industrias farmacêuticas e de novas tecnologias,  e infra estatura básica como estradas, pontes que permitam a integração real entre a Amazônia e resto do Brasil !  Coisas básicas que todo lugar merece!",pt,[],[],[],1,0,0,[],[],https://twitter.com/FrontNacaoBR/status/1358139394495021058,False,,0,,,,,,,,"[{'screen_name': 'Gabriel501SA', 'name': 'Gabriel Eduardo', 'id': '1331610745918939136'}, {'screen_name': 'crisstorress', 'name': 'Cris Torres 🇧🇷', 'id': '228935607'}, {'screen_name': 'Renata01314529', 'name': 'Renatah 🐶🇧🇷', 'id': '1155211963032580099'}, {'screen_name': 'heldermaldonado', 'name': 'Helder Maldonado', 'id': '128619303'}]",,,,
1358137205080915970,1357704311950761989,2021-02-06 16:35:17 SA Eastern Standard Time,2021-02-06,16:35:17,-0300,1331610745918939136,gabriel501sa,Gabriel Eduardo,,@jakechanbr @crisstorress @Renata01314529 @heldermaldonado E quais seriam realmente o benefícios que eles teriam com as queimadas na Amazônia?,pt,[],[],[],1,0,1,[],[],https://twitter.com/Gabriel501SA/status/1358137205080915970,False,,0,,,,,,,,"[{'screen_name': 'crisstorress', 'name': 'Cris Torres 🇧🇷', 'id': '228935607'}, {'screen_name': 'Renata01314529', 'name': 'Renatah 🐶🇧🇷', 'id': '1155211963032580099'}, {'screen_name': 'heldermaldonado', 'name': 'Helder Maldonado', 'id': '128619303'}]",,,,
1358135004065394688,1358087308558426113,2021-02-06 16:26:32 SA Eastern Standard Time,2021-02-06,16:26:32,-0300,1268016610218061825,quesejodx,me dicen loca,,@laismermaid @LeviKaique - Levar oxigênio pro Amazonas - acabar com o desmatamento e as queimadas da Amazônia - tirar a saude pública e a economia do buraco - subir o piso salarial do professor pra 7 mil reais,pt,[],[],[],1,1,128,[],[],https://twitter.com/quesejodx/status/1358135004065394688,False,,0,,,,,,,,"[{'screen_name': 'laismermaid', 'name': 'Laís Emília | ❾¾', 'id': '1520789888'}, {'screen_name': 'LeviKaique', 'name': 'Leví Kaique Ferreira', 'id': '553658110'}]",,,,
1358086058697711618,1358086058697711618,2021-02-06 13:12:03 SA Eastern Standard Time,2021-02-06,13:12:03,-0300,1280292437798371329,ceododudismo,Dudão,,"Lembre-se: Na visão de todo gringo, você é um macaco que vai na Amazônia iniciar queimadas por nada.",pt,[],[],[],0,1,3,[],[],https://twitter.com/Ceododudismo/status/1358086058697711618,False,,0,,,,,,,,[],,,,
1358083240863670279,1358083240863670279,2021-02-06 13:00:51 SA Eastern Standard Time,2021-02-06,13:00:51,-0300,35524446,ecodebate,Portal EcoDebate,,Quatro em cada cinco brasileiros acham que as queimadas na Amazônia prejudicam a imagem do Brasil no exterior e 78% entendem que elas podem prejudicar também as relações comerciais com outros países.   https://t.co/z2snNAOog1,pt,[],['https://www.ecodebate.com.br/2021/02/05/a-populacao-brasileira-se-preocupa-com-o-meio-ambiente/'],[],0,2,5,[],[],https://twitter.com/ecodebate/status/1358083240863670279,False,,0,,,,,,,,[],,,,
1358068230867271680,1358068230867271680,2021-02-06 12:01:12 SA Eastern Standard Time,2021-02-06,12:01:12,-0300,341265743,josejuniorbel,🇧🇷 José Júnior 11k 🇧🇷,,"Com o calor recorde, queimadas no Estado do Rio de Janeiro cresceu 5x. Quando isso ocorre na Amazônia, a culpa é do Bolsonaro. Tem método.",pt,[],[],[],1,8,40,[],[],https://twitter.com/josejuniorbel/status/1358068230867271680,False,,0,,,,,,,,[],,,,
1358046205968871424,1358044699521654784,2021-02-06 10:33:41 SA Eastern Standard Time,2021-02-06,10:33:41,-0300,280284702,muttley33,JD,,"@camposmello E lá vem mais narrativa. Vcs já tem até pauta fixa no ano: Queiróz, Mariele, Amazônia, Queimadas, etc",pt,[],[],[],2,0,0,[],[],https://twitter.com/Muttley33/status/1358046205968871424,False,,0,,,,,,,,"[{'screen_name': 'camposmello', 'name': 'Patricia Campos Mello', 'id': '36714704'}]",,,,
1358035531901337603,1358020874444689413,2021-02-06 09:51:16 SA Eastern Standard Time,2021-02-06,09:51:16,-0300,68548900,frseven,Fabio N 🇧🇷🙏,,@luanella22 Pergunta na fila se alguém tá pensando nas girafas da Amazônia morendo queimadas.,pt,[],[],[],0,0,1,[],[],https://twitter.com/frseven/status/1358035531901337603,False,,0,,,,,,,,"[{'screen_name': 'luanella22', 'name': 'Luana Barbosa 🇧🇷 🌍', 'id': '1251615144750301187'}]",,,,
1358021676856995840,1357094252501688320,2021-02-06 08:56:13 SA Eastern Standard Time,2021-02-06,08:56:13,-0300,521189262,anamariaavlis,Ⓜ️🔰⚖Ana😷⚖🔰Ⓜ️♊,,"@jairbolsonaro CAPITÃO CLOROQUINA OS RECURSOS NATURAIS? ECPLIQUE SOBRE AS QUEIMADAS? A MATANCA DE ANIMAIS  NA AMAZÔNIA...SR.CLOROQUINA já tomou a vacina do Dória?  DORIA FOI AYRAS DESSA VACINA É CONSEGUIU,  VC JÁ O PARABENIZOU PELA VACINADORIA ?",pt,[],[],[],0,0,0,[],[],https://twitter.com/ANAMARIAAVLIS/status/1358021676856995840,False,,0,,,,,,,,"[{'screen_name': 'jairbolsonaro', 'name': 'Jair M. Bolsonaro', 'id': '128372940'}]",,,,
1358004260764540930,1358004260764540930,2021-02-06 07:47:00 SA Eastern Standard Time,2021-02-06,07:47:00,-0300,1204301854433316866,domingosnoguei7,🚩🚩Domingos Nogueira🚩🚩,,Extra: Nove a cada dez brasileiros temem o efeito das queimadas na Amazônia.  https://t.co/2NjbODyepQ  via @GoogleNews,pt,"[{'screen_name': 'googlenews', 'name': 'google news', 'id': '33584794'}]",['https://extra.globo.com/noticias/um-so-planeta/nove-cada-dez-brasileiros-temem-efeito-das-queimadas-na-amazonia-24870090.html'],[],0,0,0,[],[],https://twitter.com/DomingosNoguei7/status/1358004260764540930,False,,0,,,,,,,,[],,,,
1357970193847353346,1357970193847353346,2021-02-06 05:31:38 SA Eastern Standard Time,2021-02-06,05:31:38,-0300,1092378916650659840,dpaulodavi,#2OutForaBolsonaro - 🚩🇧🇷🚩,,Efeito da cumplicidade de Bolsonaro com as queimadas na Amazônia. O agro negócio não pode reclamar dos prejuízos.  É o patrão de Bolsonaro e da bancada ruralista. Política de  prejuízo para o Brasil.  https://t.co/12dZeVbtXo,pt,[],[],['https://pbs.twimg.com/media/Eth6sc_XcAEB8ew.jpg'],0,0,0,[],[],https://twitter.com/DPaulodavi/status/1357970193847353346,False,,1,https://pbs.twimg.com/media/Eth6sc_XcAEB8ew.jpg,,,,,,,[],,,,
1357951802709331968,1357951802709331968,2021-02-06 04:18:33 SA Eastern Standard Time,2021-02-06,04:18:33,-0300,539215802,magneto1976,Magneto1976 🇧🇷,,"A verdade sobre as queimadas na Amazônia...enfiem essa gravação na bunda de vocês.  @JoeBiden  @EmmanuelMacron , @GretaThunberg  @MarinaSilva  e outros idiotas",pt,"[{'screen_name': 'joebiden', 'name': 'joe biden', 'id': '939091'}, {'screen_name': 'emmanuelmacron', 'name': 'emmanuel macron', 'id': '1976143068'}, {'screen_name': 'gretathunberg', 'name': 'greta thunberg', 'id': '1006419421244678144'}, {'screen_name': 'marinasilva', 'name': 'marina silva', 'id': '105155795'}]",[],[],1,0,0,[],[],https://twitter.com/magneto1976/status/1357951802709331968,False,https://twitter.com/magneto1976/status/1357950158475063297,0,,,,,,,,[],,,,
1357946545023442945,1357876378977329152,2021-02-06 03:57:40 SA Eastern Standard Time,2021-02-06,03:57:40,-0300,58253288,diegoelloko,Diego Momoa,,@UOLEconomia Por não suspender as queimadas na Amazônia? Da vergonha de morar no Brasil.,pt,[],[],[],0,0,0,[],[],https://twitter.com/diegoelloko/status/1357946545023442945,False,,0,,,,,,,,"[{'screen_name': 'UOLEconomia', 'name': 'UOL Economia', 'id': '14594760'}]",,,,
1357877559728480259,1357877559728480259,2021-02-05 23:23:33 SA Eastern Standard Time,2021-02-05,23:23:33,-0300,4127430443,eolisch,Vento,,queimadas da amazônia no ano passado,pt,[],[],[],0,0,0,[],[],https://twitter.com/eolisch/status/1357877559728480259,False,,0,,,,,,,,[],,,,
1357838836253007874,1357838836253007874,2021-02-05 20:49:40 SA Eastern Standard Time,2021-02-05,20:49:40,-0300,834126495740203009,deputadobobo,Bobô,,Bom ver os brasileiros atentos ao meio ambiente. Pesquisa Ibope revela isso: 78% dos entrevistados consideram prioridade a preservação ambiental; 72% entendem que o aquecimento global é nocivo e 80% consideram que as queimadas na Amazônia prejudicam a imagem do Brasil. #Amazonia,pt,[],[],[],0,0,10,['amazonia'],[],https://twitter.com/DeputadoBobo/status/1357838836253007874,False,,0,,,,,,,,[],,,,
1357831292159688704,1357701595681738753,2021-02-05 20:19:41 SA Eastern Standard Time,2021-02-05,20:19:41,-0300,3374431912,mendesam305,Anderson Mendes👮,,"@MarcosVLdL @CharlinhoLelec @gabs_stef Que nada, iriam ficar até o meio dia falando do Bolsonaro queimadas na Amazônia, Tereza Cristina destruindo a agricultura Ernesto Araújo sabendo com as negociações exteriores.",pt,[],[],[],0,0,1,[],[],https://twitter.com/MendesAm305/status/1357831292159688704,False,,0,,,,,,,,"[{'screen_name': 'MarcosVLdL', 'name': ""Marco's (MIRASSOL NA C 2022!!!)"", 'id': '1074597063290183680'}, {'screen_name': 'CharlinhoLelec', 'name': 'dυdυΓ 𓅃', 'id': '1235204982816870401'}, {'screen_name': 'gabs_stef', 'name': 'Gabi 🏁📚', 'id': '630502490'}]",,,,
1357820056567074816,1357820056567074816,2021-02-05 19:35:03 SA Eastern Standard Time,2021-02-05,19:35:03,-0300,888375470147989504,djangase,DJAnga,,"Para 84% dos brasileiros, queimadas na Amazônia prejudicam imagem do país  https://t.co/K1T9odGpN2  https://t.co/J7nHVkDMce",pt,[],['http://dlvr.it/Rs6DJc'],['https://pbs.twimg.com/media/EtfyJWYVgAEZVPm.jpg'],0,0,0,[],[],https://twitter.com/DJAngaSE/status/1357820056567074816,False,,1,https://pbs.twimg.com/media/EtfyJWYVgAEZVPm.jpg,,,,,,,[],,,,
1357744420930670601,1357129373481066496,2021-02-05 14:34:30 SA Eastern Standard Time,2021-02-05,14:34:30,-0300,52076129,carlagastal,carla gastal 🌵💜,,@DilmaResiste @Sgt_Pimenta2 ...extermínio de povos indígenas - invasão da amazônia com negócios espúrios - queimadas no pantanal para expansão de um agronegócio letal...,pt,[],[],[],0,1,2,[],[],https://twitter.com/carlagastal/status/1357744420930670601,False,,0,,,,,,,,"[{'screen_name': 'DilmaResiste', 'name': '🎗Dilma Resistente', 'id': '4550317786'}, {'screen_name': 'Sgt_Pimenta2', 'name': 'Sgt Pepper da URSAL - e cBozo para Haia 🚩🇧🇴🇨🇺', 'id': '924962573090508800'}]",,,,
1357741438713417729,1357741438713417729,2021-02-05 14:22:39 SA Eastern Standard Time,2021-02-05,14:22:39,-0300,92741652,institutomais,IMAIS/BISA: Benchmarking Inteligência Sustentável,,Nove a cada dez brasileiros temem o efeito das queimadas na Amazônia  https://t.co/WydWECvtiT via @JornalExtra,pt,"[{'screen_name': 'jornalextra', 'name': 'jornal extra', 'id': '24802340'}]",['https://extra.globo.com/noticias/um-so-planeta/nove-cada-dez-brasileiros-temem-efeito-das-queimadas-na-amazonia-24870090.html'],[],0,0,0,[],[],https://twitter.com/InstitutoMAIS/status/1357741438713417729,False,,0,,,,,,,,[],,,,
1357739613473935362,1357739613473935362,2021-02-05 14:15:24 SA Eastern Standard Time,2021-02-05,14:15:24,-0300,2674564802,niltotatto,🇧🇷 Nilto Tatto - #ForaBolsonaro 🍀,,"Para 77% dos brasileiros, proteger meio ambiente é urgente  Pesquisa aponta que grande maioria vê questão climática como prioritária, mesmo que isso signifique um crescimento econômico mais tímido. Para 84%, queimadas na Amazônia prejudicam   @dw_brasil  https://t.co/cCsxoGTRUK  https://t.co/mggABFUhK1",pt,"[{'screen_name': 'dw_brasil', 'name': 'dw brasil', 'id': '6135602'}]",['https://cutt.ly/rkxtmST'],['https://pbs.twimg.com/media/EteotRJXIAI5pH9.png'],1,2,9,[],[],https://twitter.com/NiltoTatto/status/1357739613473935362,False,,1,https://pbs.twimg.com/media/EteotRJXIAI5pH9.png,,,,,,,[],,,,
1357717668317581312,1357717658670686208,2021-02-05 12:48:11 SA Eastern Standard Time,2021-02-05,12:48:11,-0300,15808945,hackbarth,Tiago Hackbarth,,"Veja bem, politicamente a grande maioria da população está pouco se fodendo para o que acontece com os outros. Desmatamento da Amazônia, Garimpo Ilegal, Queimadas, Fome, Seca, Doenças Endêmicas... Tudo não importa por que NÃO É COM A PESSOA.  É problema de quem você nem conhece",pt,[],[],[],1,1,4,[],[],https://twitter.com/hackbarth/status/1357717668317581312,False,,0,,,,,,,,[],,,,
1357697687647383557,1357697069583134724,2021-02-05 11:28:48 SA Eastern Standard Time,2021-02-05,11:28:48,-0300,46135645,gatafrida,Onça Fiscal do ICMBio,,"No levantamento, 78% afirmaram concordar que as queimadas na Amazônia podem prejudicar as relações comerciais do Brasil com outros países; 74% discordaram que as queimadas são necessárias para o crescimento da economia.",pt,[],[],[],1,1,2,[],[],https://twitter.com/GataFrida/status/1357697687647383557,False,,0,,,,,,,,[],,,,
1357670722886377473,1357670704217534470,2021-02-05 09:41:39 SA Eastern Standard Time,2021-02-05,09:41:39,-0300,1141315501,ecochatices,beca,,"77% dos brasileiros consideram proteger o meio ambiente prioridade, e 72% consideram que o aquecimento global pode prejudicar a si e as suas famílias. Também é a acachapante a maioria que entende que as queimadas na Amazônia são prejudiciais para a população e para aeconomia.",pt,[],[],[],1,0,2,[],[],https://twitter.com/ecochatices/status/1357670722886377473,False,,0,,,,,,,,[],,,,
1357638406268936194,1357634585383866370,2021-02-05 07:33:14 SA Eastern Standard Time,2021-02-05,07:33:14,-0300,382103278,toni_nhoadv,Antonio S Nunes Neto,,@ultimosegundo Cara a mulher diz que queimadas da Amazônia vem de um laser do espaço e vocês querem comparar com a bia kics uma procurada de estado de carreira...  isto se chama desonestidade...,pt,[],[],[],2,0,2,[],[],https://twitter.com/toni_nhoadv/status/1357638406268936194,False,,0,,,,,,,,"[{'screen_name': 'ultimosegundo', 'name': 'iG Último Segundo', 'id': '8110402'}]",,,,
1357627194634366976,1357627194634366976,2021-02-05 06:48:41 SA Eastern Standard Time,2021-02-05,06:48:41,-0300,22958648,daniellimas,Daniel Lima,,Animação mostra como pandemia e queimadas afetaram a Amazônia   https://t.co/DvQUfFfGGI via @agenciapublica,pt,"[{'screen_name': 'agenciapublica', 'name': 'agência pública', 'id': '310497473'}]",['https://apublica.org/2021/02/animacao-mostra-como-pandemia-e-queimadas-afetaram-a-amazonia/#.YB0UYf7Z-g8.twitter'],[],0,1,1,[],[],https://twitter.com/daniellimas/status/1357627194634366976,False,,0,,,,,,,,[],,,,
1357617817617653760,1357617817617653760,2021-02-05 06:11:25 SA Eastern Standard Time,2021-02-05,06:11:25,-0300,70747217,fabiomarcal,Fábio Marçal,,"@Poder360 . Só o governo não vê. Meio ambiente Brasileiros preocupados A cada 5 brasileiros, 4 acham que as queimadas na Amazônia prejudicam a imagem do Brasil no mundo. E 77% acreditam ser importante proteger o meio ambiente, mesmo que afete o crescimento econômico. @JoeBiden",pt,"[{'screen_name': 'joebiden', 'name': 'joe biden', 'id': '939091'}]",[],[],0,0,0,[],[],https://twitter.com/FabioMarcal/status/1357617817617653760,False,,0,,,,,,,,[],,,,
1357535388081004547,1357535388081004547,2021-02-05 00:43:52 SA Eastern Standard Time,2021-02-05,00:43:52,-0300,2282789789,verroque,Roque,,Divulgaram as espécies extintas nas queimadas da Amazônia no ano passado causadas pelo @jairmessiasbolsonaro ...  https://t.co/OdRMIuqVN6,pt,[],['https://www.instagram.com/p/CK5VemJgxzyTDleajmkZeeQq6zb-DEXYX6DJco0/?igshid=wnp4jwtxxn9g'],[],0,0,0,[],[],https://twitter.com/verroque/status/1357535388081004547,False,,0,,,,,,,,[],,,,
1357530230534111232,1357529403580948483,2021-02-05 00:23:23 SA Eastern Standard Time,2021-02-05,00:23:23,-0300,1291916043305332738,megfobic,dinho,,@aaliyahfobic era decorrência das queimadas na amazônia,pt,[],[],[],0,0,0,[],[],https://twitter.com/megfobic/status/1357530230534111232,False,,0,,,,,,,,"[{'screen_name': 'aaliyahfobic', 'name': 'maia', 'id': '1292513145966284807'}]",,,,
1357468695380058112,1357468695380058112,2021-02-04 20:18:52 SA Eastern Standard Time,2021-02-04,20:18:52,-0300,35797226,emanuel_alencar,Emanuel Alencar,,*Pesquisa Ibope: brasileiros se preocupam muito com a questão ambiental*. 90% concordam que as queimadas na Amazônia são uma ameaça para o clima e o meio ambiente do planeta e 92% acreditam que elas prejudicam a qualidade de vida da população.,pt,[],[],[],0,0,12,[],[],https://twitter.com/Emanuel_Alencar/status/1357468695380058112,False,,0,,,,,,,,[],,,,
1357460803553787904,1357368718720917504,2021-02-04 19:47:30 SA Eastern Standard Time,2021-02-04,19:47:30,-0300,1163901505252057088,resistenciaja1,🚩SouResistência#LulaLá 🇧🇷🇨🇺🇻🇪🇦🇷,,"@Rconstantino hi hi hi hi O Dep. Estadual do Agronegócio por São Paulo  amiguinho do Salles @rsallesmma defensor de queimadas na Amazônia ,de madeireiros ilegais , de garimpo e invasores em terras indígenas ,Admirador incondicional de Pinochet está com raiva do Doria pq eim @DAVILAFREDERICO ??  https://t.co/RIbFbL90WS",pt,"[{'screen_name': 'rsallesmma', 'name': 'ricardo salles', 'id': '971822131024748545'}, {'screen_name': 'davilafrederico', 'name': ""deputado frederico d'avila"", 'id': '74944989'}]",[],"['https://pbs.twimg.com/media/Etaq50-WQAAhGn3.jpg', 'https://pbs.twimg.com/media/EtarZQ0XEAA64Mg.jpg']",0,0,0,[],[],https://twitter.com/resistenciaja1/status/1357460803553787904,False,,1,https://pbs.twimg.com/media/Etaq50-WQAAhGn3.jpg,,,,,,,"[{'screen_name': 'Rconstantino', 'name': 'Rodrigo Constantino', 'id': '33520195'}]",,,,
1357451370312384512,1357449119137169419,2021-02-04 19:10:01 SA Eastern Standard Time,2021-02-04,19:10:01,-0300,2614982482,luizcar81121668,Luiz Carlos da Silva,,@VEJA Culpa das queimadas na Amazônia,pt,[],[],[],0,0,0,[],[],https://twitter.com/LuizCar81121668/status/1357451370312384512,False,,0,,,,,,,,"[{'screen_name': 'VEJA', 'name': 'VEJA', 'id': '17715048'}]",,,,
1357441138442047490,1357441138442047490,2021-02-04 18:29:22 SA Eastern Standard Time,2021-02-04,18:29:22,-0300,980216034815827968,portalrbn,portalrbn,,Animação mostra como pandemia e queimadas afetaram a Amazônia  https://t.co/IzochtqKzt,pt,[],['https://portalrbn.com.br/animacao-mostra-como-pandemia-e-queimadas-afetaram-a-amazonia/?feed_id=22300&_unique_id=601c673207aea'],[],0,0,0,[],[],https://twitter.com/portalrbn/status/1357441138442047490,False,,0,,,,,,,,[],,,,
1357441041708830720,1357441041708830720,2021-02-04 18:28:59 SA Eastern Standard Time,2021-02-04,18:28:59,-0300,1027607751474794496,lauromiller3,Lauro Miller,,Animação mostra como pandemia e queimadas afetaram a Amazônia  https://t.co/rtRkzDWXrn,pt,[],['https://portalrbn.com.br/animacao-mostra-como-pandemia-e-queimadas-afetaram-a-amazonia/?feed_id=22294&_unique_id=601c671aedce9'],[],0,0,0,[],[],https://twitter.com/LauroMiller3/status/1357441041708830720,False,,0,,,,,,,,[],,,,
1357430703395332103,1357430579432685575,2021-02-04 17:47:54 SA Eastern Standard Time,2021-02-04,17:47:54,-0300,3589345337,vanecosta10,A Eng. Florestal do YouTube 🌳,,"Pesquisa aponta que grande maioria vê questão climática como prioritária, mesmo que isso signifique um crescimento econômico mais tímido. Para 84%, queimadas na Amazônia prejudicam a imagem do Brasil no exterior.",pt,[],[],[],1,4,31,[],[],https://twitter.com/vanecosta10/status/1357430703395332103,False,,0,,,,,,,,[],,,,
1357412657180127232,1357412657180127232,2021-02-04 16:36:11 SA Eastern Standard Time,2021-02-04,16:36:11,-0300,1050905622483480576,luizcardillo,Jorge Luiz Ponce Cardillo,, https://t.co/BQfy4IhMir Ameaça iminente. É possível que o Biden nos coloque barreiras com a subterfúgio queimadas da Amazônia. Precisa de um inimigo externo para desviar a atenção dos problemas internos. É necessário demonstrar-lhe que as queimadas estão sob controle.,pt,[],['https://www.bolsonaro.com.br/'],[],0,0,0,[],[],https://twitter.com/LuizCardillo/status/1357412657180127232,False,,0,,,,,,,,[],,,,
1357412357920591872,1357404808257372167,2021-02-04 16:35:00 SA Eastern Standard Time,2021-02-04,16:35:00,-0300,138492825,proindio,Comissão Pró-Índio,,"@obsclima A preocupação com a #Amazônia também foi medida na pesquisa. A maioria (87%) disse já ter ouvido falar bastante sobre as #queimadas que acontecem na região. Em 2020, o número de focos de incêndios foi um dos maiores da última década segundo dados do Inpe.  https://t.co/FKbta9vjNE",pt,[],['https://www.dw.com/pt-br/para-77-dos-brasileiros-proteger-meio-ambiente-%C3%A9-urgente/a-56459171'],[],0,3,8,"['amazônia', 'queimadas']",[],https://twitter.com/proindio/status/1357412357920591872,False,,0,,,,,,,,"[{'screen_name': 'obsclima', 'name': 'Observatório do Clima, 19 anos', 'id': '36336107'}]",,,,
1357392127945228288,1357392127945228288,2021-02-04 15:14:37 SA Eastern Standard Time,2021-02-04,15:14:37,-0300,6135602,dw_brasil,DW Brasil,,"Pesquisa aponta que grande maioria dos brasileiros vê proteção climática como prioritária, mesmo que acarrete crescimento econômico mais tímido. Para 84%, queimadas na Amazônia prejudicam a imagem do Brasil no exterior.  https://t.co/cYxwjZ37L5",pt,[],['https://p.dw.com/p/3otbn'],[],10,53,198,[],[],https://twitter.com/dw_brasil/status/1357392127945228288,False,,0,,,,,,,,[],,,,
1357387415296430080,1357387396283736065,2021-02-04 14:55:53 SA Eastern Standard Time,2021-02-04,14:55:53,-0300,2341048110,itsriodejaneiro,ITS Rio,,🧐🔎 98% dos brasileiros já ouviram falar sobre as queimadas na Amazônia.  https://t.co/wvd0WwnItU,pt,[],[],['https://pbs.twimg.com/media/EtZnR1BXUAAjcR2.jpg'],1,0,1,[],[],https://twitter.com/ITSriodejaneiro/status/1357387415296430080,False,,1,https://pbs.twimg.com/media/EtZnR1BXUAAjcR2.jpg,,,,,,,[],,,,
1357387410280124418,1357387396283736065,2021-02-04 14:55:52 SA Eastern Standard Time,2021-02-04,14:55:52,-0300,2341048110,itsriodejaneiro,ITS Rio,,🔥 84% concordam que as queimadas na Amazônia prejudicam a imagem do 🇧🇷 no exterior. 74% discordam que elas sejam necessárias para a economia.    👀 Veja mais dados:  https://t.co/3WAW1KICiD  https://t.co/b6IN59PDA8,pt,[],['http://www.percepcaoclimatica.com.br/'],['https://pbs.twimg.com/media/EtZnK7cWgAACOeS.jpg'],1,0,3,[],[],https://twitter.com/ITSriodejaneiro/status/1357387410280124418,False,,1,https://pbs.twimg.com/media/EtZnK7cWgAACOeS.jpg,,,,,,,[],,,,
1357387396283736065,1357387396283736065,2021-02-04 14:55:48 SA Eastern Standard Time,2021-02-04,14:55:48,-0300,2341048110,itsriodejaneiro,ITS Rio,,"Pesquisa inédita 💡 | Como a população brasileira percebe as mudanças climáticas? Para a população, quem pode contribuir mais para resolver o problema? E quem são os principais responsáveis pelas queimadas na Amazônia?    Veja os principais dados! 👀  https://t.co/kaq0kVG2AB",pt,[],[],['https://pbs.twimg.com/media/EtZg8O9WYAEczzO.jpg'],2,2,9,[],[],https://twitter.com/ITSriodejaneiro/status/1357387396283736065,False,,1,https://pbs.twimg.com/media/EtZg8O9WYAEczzO.jpg,,,,,,,[],,,,
