id,conversation_id,created_at,date,time,timezone,user_id,username,name,place,tweet,language,mentions,urls,photos,replies_count,retweets_count,likes_count,hashtags,cashtags,link,retweet,quote_url,video,thumbnail,near,geo,source,user_rt_id,user_rt,retweet_id,reply_to,retweet_date,translate,trans_src,trans_dest
1321617264542699522,1321617264542699522,2020-10-28 21:58:04 -03,2020-10-28,21:58:04,-0300,790680,bbcbrasil,BBC News Brasil,,"#BBCCurtas Imagens de satélite mostram o desmatamento ""sistemático"" da Amazônia brasileira durante um período de mais de três anos, de maio de 2017 a setembro de 2020. Dados fazem parte de nova iniciativa de monitoramento de florestas em 64 países  https://t.co/Jyqamk4whq  https://t.co/yKlZnQojWg",pt,[],['https://bbc.in/2TxTkLL'],[],6,76,236,['bbccurtas'],[],https://twitter.com/bbcbrasil/status/1321617264542699522,False,,1,https://pbs.twimg.com/media/EldT5DnWMAASIY-.jpg,,,,,,,[],,,,
1321615914186477569,1321615914186477569,2020-10-28 21:52:43 -03,2020-10-28,21:52:43,-0300,1285226176953360384,depchrisostomo,Coronel Chrisóstomo,,🇧🇷 O POVO BRASILEIRO PODE SEMPRE CONTAR COM AS FORÇAS ARMADAS! O Governo Federal vai prorrogar até abril de 2021 a atuação das Forças Armadas na Amazônia Legal. Os militares vão atuar nas operações de fiscalização e repressão de atividades ilegais de desmatamento e queimadas. 🇧🇷  https://t.co/J2pVXrGAmF,pt,[],[],['https://pbs.twimg.com/media/EldSkwGWMAARoBw.jpg'],1,0,2,[],[],https://twitter.com/DepChrisostomo/status/1321615914186477569,False,,1,https://pbs.twimg.com/media/EldSkwGWMAARoBw.jpg,,,,,,,[],,,,
1321613316477853696,1321613316477853696,2020-10-28 21:42:23 -03,2020-10-28,21:42:23,-0300,110284662,lem4sk,Alexandre Mask #foraBolsonaro,,"“As áreas que tiveram o maior salto do desmatamento, entre 2018 e 2019, foram exatamente as áreas, os municípios da Amazônia que tiveram a maior redução do comando e controle, maior redução dos autos de infração”   https://t.co/xRubzV8FKx",pt,[],['https://www.socioambiental.org/pt-br/noticias-socioambientais/orgaos-de-governo-contradizem-bolsonaro-e-salles-sobre-fundo-amazonia-e-desmatamento'],[],0,0,0,[],[],https://twitter.com/lem4sk/status/1321613316477853696,False,,0,,,,,,,,[],,,,
1321610565383524364,1321610565383524364,2020-10-28 21:31:27 -03,2020-10-28,21:31:27,-0300,985243221491109890,imsciencecat,☕,,9.216 km² de área de desmatamento na Amazônia SÓ EM 2019-2020 #impeachmentDeBolsonaro #ForaBolsonaro,pt,[],[],[],0,0,1,"['impeachmentdebolsonaro', 'forabolsonaro']",[],https://twitter.com/ImScienceCat/status/1321610565383524364,False,,0,,,,,,,,[],,,,
1321610415718227968,1321610415718227968,2020-10-28 21:30:52 -03,2020-10-28,21:30:52,-0300,1116477198947504128,manucaaaa,manu,,"Governo Lula: prometo reduzir em 37% as emissões de gases de efeito estufa no Br (meta ambiciosa dms e meio fora da realidade, mas ta la. virou ate lei) Projeto contra desmatamento (sdds 2012, ne, amazonia?)   Governo atual: n pq o PT ta tocando fogo na amazonia pArA mE AfEtAaaR",pt,[],[],[],0,0,1,[],[],https://twitter.com/manucaaaa/status/1321610415718227968,False,,0,,,,,,,,[],,,,
1321602864712720384,1321602864712720384,2020-10-28 21:00:51 -03,2020-10-28,21:00:51,-0300,6715112,hugobbezerra,Hugo Batista Bezerra 🚩,,"Órgãos de desgoverno contradizem Bolsonaro e Ricardo ""Passa Boiada"" Salles sobre Fundo Amazônia e desmatamento  https://t.co/NhwHFSe7wx * #ForaBolsonaroEseuBandoDeCriminosos",pt,[],['https://jornalggn.com.br/meio-ambiente/orgaos-de-governo-contradizem-bolsonaro-e-salles-sobre-fundo-amazonia-e-desmatamento/'],[],0,0,1,['forabolsonaroeseubandodecriminosos'],[],https://twitter.com/hugobbezerra/status/1321602864712720384,False,,0,,,,,,,,[],,,,
1321602158408527872,1321602158408527872,2020-10-28 20:58:03 -03,2020-10-28,20:58:03,-0300,3299396185,rusotrompeta,Ruso Trompeta,,"Assine a petição para proibir o desmatamento na Amazônia, por pelo menos 5 anos!  https://t.co/One3a1a8BO",pt,[],['https://secure.avaaz.org/community_petitions/es/congresso_naciona_assine_a_peticao_para_proibir_o_desmatamento_na_amazonia_por_pelo_menos_5_anos_2/?wNHLDrb&utm_source=sharetools&utm_medium=twitter&utm_campaign=petition-1127710-assine_a_peticao_para_proibir_o_desmatamento_na_amazonia_por_pelo_menos_5_anos&utm_term=NHLDrb%2Bes'],[],0,0,1,[],[],https://twitter.com/rusotrompeta/status/1321602158408527872,False,,0,,,,,,,,[],,,,
1321597386309992449,1321597386309992449,2020-10-28 20:39:05 -03,2020-10-28,20:39:05,-0300,1968829813,deolhonoagro,De Olho Nos Ruralistas,,Quase metade do rebanho fica na Amazônia; pelo menos 33 mil animais pertencem a pecuaristas multados pelo Ibama por desmatamento do bioma  Por Alceu Luís Castilho (@alceucastilho) e Luís Indriunas   https://t.co/wp9OhUBozb  Ajude a manter este observatório:  https://t.co/7eN8uGOdut,pt,"[{'screen_name': 'alceucastilho', 'name': 'alceu castilho', 'id': '35185475'}]","['https://bit.ly/2TytffA', 'https://bit.ly/2fDBVBd']",[],0,13,29,[],[],https://twitter.com/deolhonoagro/status/1321597386309992449,False,,0,,,,,,,,[],,,,
1321574402010583041,1321574402010583041,2020-10-28 19:07:45 -03,2020-10-28,19:07:45,-0300,1267065992112492545,simonevissotto,Monefpolis72,,"Já estou fazendo isso faz tempo! Boicotando o Agro de qq região de desmatamento, queimadas e Pantanal e Amazônia! Um governo sem empatia com vidas de animais plantas e pessoas não merece credibilidade e confiança! Fora Canalhas! #FerradoComBolsonaro",pt,[],[],[],1,1,1,['ferradocombolsonaro'],[],https://twitter.com/SimoneVissotto/status/1321574402010583041,False,https://twitter.com/ivanaastrosol/status/1321563627711770626,0,,,,,,,,[],,,,
1321571248879636484,1321571248879636484,2020-10-28 18:55:13 -03,2020-10-28,18:55:13,-0300,1101542556729528320,foissotteh,Foissotte Hervé,,Para o despertar de uma consciência cidadã global contra o desmatamento da Amazônia e das florestas primárias  https://t.co/8rXxNlo4rf,pt,[],['http://tiradentes-geographie.com/2020/10/28/para-o-despertar-de-uma-consciencia-cidada-global-contra-o-desmatamento-da-amazonia-e-das-florestas-primarias/'],[],0,0,0,[],[],https://twitter.com/FoissotteH/status/1321571248879636484,False,,0,,,,,,,,[],,,,
1321566960514224131,1321566960514224131,2020-10-28 18:38:11 -03,2020-10-28,18:38:11,-0300,74527029,smabc,Sindicato dos Metalúrgicos do ABC,,"🔥SEM MENÇÃO À AMAZÔNIA E PANTANAL  Em documento publicado dia 27, “Estratégia Federal de Desenvolvimento para o Brasil”, o governo ignora metas de combate ao desmatamento.  https://t.co/IqNiGsbQQJ",pt,[],[],['https://pbs.twimg.com/media/ElcmI_IXgAU7GPN.jpg'],0,1,4,[],[],https://twitter.com/smabc/status/1321566960514224131,False,,1,https://pbs.twimg.com/media/ElcmI_IXgAU7GPN.jpg,,,,,,,[],,,,
1321562227720204289,1321562227720204289,2020-10-28 18:19:23 -03,2020-10-28,18:19:23,-0300,1260816828760195072,anapatr92635628,Ana Patrícia,,"Maior doador do Fundo Amazônia vê ‘situação muito infeliz’ com paralisação do mecanismo.  Brasil precisa mostrar que desmatamento não é tolerado, diz Noruega | Brasil | Valor Econômico  https://t.co/NhjEdapPP8",pt,[],['https://valor.globo.com/brasil/noticia/2020/10/26/brasil-precisa-mostrar-que-desmatamento-nao-e-tolerado-diz-noruega.ghtml'],[],1,0,2,[],[],https://twitter.com/AnaPatr92635628/status/1321562227720204289,False,,0,,,,,,,,[],,,,
1321557011872550915,1321557011872550915,2020-10-28 17:58:39 -03,2020-10-28,17:58:39,-0300,4719330443,ele3pacjere,Lunik 🦅🖤,,Segue o rabo do dinheiro... Amazônia--&gt;desmatamento--&gt;queimadas--&gt;pecuária--&gt;frigoríficos--&gt;políticos--&gt;bancos--&gt;ações--&gt;países,pt,[],[],[],1,0,1,[],[],https://twitter.com/ele3pacjere/status/1321557011872550915,False,https://twitter.com/stareginarocha/status/1321491007314087936,0,,,,,,,,[],,,,
1321550644952576001,1321550644952576001,2020-10-28 17:33:21 -03,2020-10-28,17:33:21,-0300,835849072808448000,i9treinamentosb,I9 Treinamentos,,Fundo Amazônia: especialistas dizem que desmatamento não está associado ao aumento de produtividade Fundo Amazônia:  #desmatamento #fundoamazônia #Meioambiente #STF  https://t.co/Dp5Imkkagi  https://t.co/25Cl8Hvef2,pt,[],['https://i9treinamentos.com/blog/?p=168615'],['https://pbs.twimg.com/media/ElcXTuQXUAUSIGB.jpg'],0,0,0,"['desmatamento', 'fundoamazônia', 'meioambiente', 'stf']",[],https://twitter.com/i9treinamentosb/status/1321550644952576001,False,,1,https://pbs.twimg.com/media/ElcXTuQXUAUSIGB.jpg,,,,,,,[],,,,
1321550486542176256,1321544043957018626,2020-10-28 17:32:43 -03,2020-10-28,17:32:43,-0300,816642675403329536,oliveirl_lis,impostora,,@normnia e assim morreu o desmatamento na Amazônia ✨,pt,[],[],[],0,0,0,[],[],https://twitter.com/oliveirl_lis/status/1321550486542176256,False,,0,,,,,,,,[],,,,
1321549558237855746,1321549558237855746,2020-10-28 17:29:02 -03,2020-10-28,17:29:02,-0300,1034275126861328391,nandobalassa,Nando bala,,"Empresas dos EUA são ‘cúmplices’ de desmatamento e abusos na Amazônia, diz Amazon Watch  https://t.co/SYJfobHgdv",pt,[],['http://brasilnoticias.org/empresas-dos-eua-sao-cumplices-de-desmatamento-e-abusos-na-amazonia-diz-amazon-watch/'],[],0,0,1,[],[],https://twitter.com/nandobalassa/status/1321549558237855746,False,,0,,,,,,,,[],,,,
1321549244856213510,1321549244856213510,2020-10-28 17:27:47 -03,2020-10-28,17:27:47,-0300,1080221101521801217,konigvs,Königvs,,"Seis instituições financeiras norte-americanas  investiram mais de 18 mil milhões de dólares, entre 2017 e 2020, em empresas cujo objetivo é o envolvimento em invasões, desmatamento e violações dos direitos dos indígenas da Amazónia.",pt,[],[],[],0,0,0,[],[],https://twitter.com/konigvs/status/1321549244856213510,False,https://twitter.com/EsquerdaNet/status/1321544281820069888,0,,,,,,,,[],,,,
1321543964529405955,1321543956656783361,2020-10-28 17:06:48 -03,2020-10-28,17:06:48,-0300,848495834887061505,apiboficial,Apib Oficial,,"O relatório denuncia uma complexa rede de financiamento norte-americano que investiu mais de US$ 18 bilhões, somente de 2017 a 2020, em empresas cujas atividades têm envolvimento com invasões, desmatamento e violações de direitos indígenas na Amazônia.",pt,[],[],[],1,3,6,[],[],https://twitter.com/ApibOficial/status/1321543964529405955,False,,0,,,,,,,,[],,,,
1321529356481683459,1321529356481683459,2020-10-28 16:08:46 -03,2020-10-28,16:08:46,-0300,62601015,fernandoguida,Fernando Guida,,Carlos Nobre: ‘Zerar o desmatamento é pouco; tem de restaurar a Amazônia’. Por Cida Oliveira  https://t.co/zxb19aDkOX via @fernandoGuida,pt,"[{'screen_name': 'fernandoguida', 'name': 'fernando guida', 'id': '62601015'}]",['https://blogdoguida.wordpress.com/2020/09/10/carlos-nobre-zerar-o-desmatamento-e-pouco-tem-de-restaurar-a-amazonia-por-cida-oliveira/'],[],0,0,1,[],[],https://twitter.com/FernandoGuida/status/1321529356481683459,False,,0,,,,,,,,[],,,,
1321526819775041539,1321526819775041539,2020-10-28 15:58:41 -03,2020-10-28,15:58:41,-0300,1288311912275607555,politicainteiro,Política Por Inteiro,,"Qual o futuro da Amazônia com + 4 anos de Trump na Casa Branca? E se Biden vencer: 20 bilhões de dólares de pagamento por redução de desmatamento, farão diferença à proteção da floresta em um governo Bolsonaro?    Venha conversar sb isso na próxima 3a feira, 3/11, às 10:30!  https://t.co/DLHEqjgd5I",pt,[],[],['https://pbs.twimg.com/media/ElcBCxdXYAIthQh.jpg'],0,2,12,[],[],https://twitter.com/PoliticaInteiro/status/1321526819775041539,False,,1,https://pbs.twimg.com/media/ElcBCxdXYAIthQh.jpg,,,,,,,[],,,,
1321524471396814848,1321494356126277636,2020-10-28 15:49:21 -03,2020-10-28,15:49:21,-0300,1091033895305465856,lara_loureirof,larinha,,@antunes_lua depois que ele teve a coragem de falar que na Amazônia não tem desmatamento nada mais me surpreende,pt,[],[],[],0,0,1,[],[],https://twitter.com/lara_loureirof/status/1321524471396814848,False,,0,,,,,,,,"[{'screen_name': 'antunes_lua', 'name': 'Lua Antunes', 'id': '1420934109883416578'}]",,,,
1321517539957104640,1321517539957104640,2020-10-28 15:21:48 -03,2020-10-28,15:21:48,-0300,176859552,trudaoceans,"José Truda Palazzo, Jr. 🇫🇲🇫🇲🇫🇲☘️",,Órgãos de governo contradizem Bolsonaro e Salles sobre Fundo Amazônia e desmatamento  https://t.co/cGO0XwmfPh via @socioambiental,pt,"[{'screen_name': 'socioambiental', 'name': 'socioambiental', 'id': '17871562'}]",['https://www.socioambiental.org/pt-br/noticias-socioambientais/orgaos-de-governo-contradizem-bolsonaro-e-salles-sobre-fundo-amazonia-e-desmatamento'],[],0,0,1,[],[],https://twitter.com/TrudaOceans/status/1321517539957104640,False,,0,,,,,,,,[],,,,
1321514986594816002,1321514986594816002,2020-10-28 15:11:40 -03,2020-10-28,15:11:40,-0300,1277364149710917632,plataformacipo,CIPÓ,,"Lançado ontem (27), o documento com as diretrizes e metas econômicas, sociais e ambientais do governo federal para o período de 2020 a 2031 não inclui nenhuma meta de combate ao desmatamento, nem menciona a Amazônia e o Pantanal no seu “eixo ambiental”.  👇",pt,[],[],[],1,2,11,[],[],https://twitter.com/PlataformaCipo/status/1321514986594816002,False,,0,,,,,,,,[],,,,
1321497201139425282,1321497201139425282,2020-10-28 14:00:59 -03,2020-10-28,14:00:59,-0300,74715478,climainfonews,ClimaInfo,,"Mesmo com R$ 2,9 bilhões disponíveis, o Fundo Amazônia, principal fundo de combate ao desmatamento do país, segue parado, sem aprovar nenhum projeto novo.  https://t.co/4pryOGSQDi",pt,[],['https://climainfo.org.br/2020/10/28/fundo-amazonia-tem-quase-r-3-bi-parados-e-sem-aplicacao'],[],0,1,7,[],[],https://twitter.com/ClimaInfoNews/status/1321497201139425282,False,,0,,,,,,,,[],,,,
1321494436317032449,1321494436317032449,2020-10-28 13:50:00 -03,2020-10-28,13:50:00,-0300,931198298932858881,obind_unb,Observatório dos Direitos e Políticas Indigenistas,,ISA: Órgãos de governo contradizem Bolsonaro e Salles sobre Fundo Amazônia e desmatamento  https://t.co/6rtARoRIXb,pt,[],['http://obind.eco.br/2020/10/27/isa-orgaos-de-governo-contradizem-bolsonaro-e-salles-sobre-fundo-amazonia-e-desmatamento/'],[],0,0,0,[],[],https://twitter.com/OBIND_UnB/status/1321494436317032449,False,,0,,,,,,,,[],,,,
1321494428087824384,1321494428087824384,2020-10-28 13:49:58 -03,2020-10-28,13:49:58,-0300,575713446,marcelozelic,Marcelo Zelic,,ISA: Órgãos de governo contradizem Bolsonaro e Salles sobre Fundo Amazônia e desmatamento  https://t.co/DgomNBjAbQ,pt,[],['http://obind.eco.br/2020/10/27/isa-orgaos-de-governo-contradizem-bolsonaro-e-salles-sobre-fundo-amazonia-e-desmatamento/'],[],0,0,0,[],[],https://twitter.com/MarceloZelic/status/1321494428087824384,False,,0,,,,,,,,[],,,,
1321483326528626689,1321483326528626689,2020-10-28 13:05:51 -03,2020-10-28,13:05:51,-0300,2414202577,ayla_chata,Ayla #MarcoTemporalNao,,"A Noruega está financiando um conjunto de dados de satélite exclusivo sobre as florestas tropicais do mundo, como a Amazônia brasileira — o que pode representar um ""divisor de águas"" na luta contra o desmatamento.   #DesmatamentoNão  #ForaBolsonaro  https://t.co/6QjNGt8x0q",pt,[],['https://www.bbc.com/portuguese/geral-54722145?at_custom4=B8CF4CCC-1935-11EB-97C2-8E404D484DA4&at_campaign=64&at_medium=custom7&at_custom3=BBC+Brasil&at_custom2=twitter&at_custom1=%5Bpost+type%5D'],[],0,0,5,"['desmatamentonão', 'forabolsonaro']",[],https://twitter.com/Ayla_chata/status/1321483326528626689,False,,0,,,,,,,,[],,,,
1321466776882941953,1321466776882941953,2020-10-28 12:00:05 -03,2020-10-28,12:00:05,-0300,1158389772920020993,secomvc,SecomVc,,"O vice-presidente Hamilton Mourão anunciou, nessa segunda (26), a prorrogação do reforço das Forças Armadas em operações de fiscalização e repressão de atividades ilegais de desmatamento e queimadas na Amazônia Legal.  https://t.co/FEgkqgkcNW",pt,[],[],['https://pbs.twimg.com/media/ElbKJT7XgAAWfVR.jpg'],38,154,1241,[],[],https://twitter.com/secomvc/status/1321466776882941953,False,,1,https://pbs.twimg.com/media/ElbKJT7XgAAWfVR.jpg,,,,,,,[],,,,
1321448389540720641,1321448389540720641,2020-10-28 10:47:02 -03,2020-10-28,10:47:02,-0300,43107330,ricardotripoli,Ricardo Tripoli,,"As metas de combate ao desmatamento não aparecem no documento, assim como não há menção à Amazônia ou ao Pantanal (que desde 2019 registram os piores níveis históricos de queimadas). Como pensar em desenvolvimento sem proteger o meio ambiente?   https://t.co/mHlVyfjJKe",pt,[],"['https://sustentabilidade.estadao.com.br/noticias/geral,governo-bolsonaro-ignora-metas-de-combate-ao-desmatamento-em-plano-estrategico-ate-2031,70003491522']",[],0,1,3,[],[],https://twitter.com/ricardotripoli/status/1321448389540720641,False,,0,,,,,,,,[],,,,
1321444859123740676,1321444859123740676,2020-10-28 10:33:00 -03,2020-10-28,10:33:00,-0300,123025081,gojammaj,gojamLULAmaj,,Órgãos de governo contradizem Bolsonaro e Salles sobre Fundo Amazônia e desmatamento  https://t.co/13sYYdgylb via @jornalggn,pt,"[{'screen_name': 'jornalggn', 'name': 'jornalggn', 'id': '1347385232'}]",['https://jornalggn.com.br/meio-ambiente/orgaos-de-governo-contradizem-bolsonaro-e-salles-sobre-fundo-amazonia-e-desmatamento/'],[],0,2,4,[],[],https://twitter.com/gojammaj/status/1321444859123740676,False,,0,,,,,,,,[],,,,
1321442730233548814,1319326832685178886,2020-10-28 10:24:32 -03,2020-10-28,10:24:32,-0300,36430255,aldembc,Aldem Bourscheit,,"Além de emperrar a aprovação do acordo no Congresso Peruano, grupos evangélicos estão conectados a desmatamento na Amazônia. Áreas servem à agropecuária e até cultivo de coca. Os Menonitas respondem por pelo menos 7,5 mil hectares recentemente destruídos no sudoeste peruano (ima-  https://t.co/pHEFsgk3tg",pt,[],[],['https://pbs.twimg.com/media/Ela06tzXgAAXDCw.jpg'],1,0,3,[],[],https://twitter.com/AldemBC/status/1321442730233548814,False,,1,https://pbs.twimg.com/media/Ela06tzXgAAXDCw.jpg,,,,,,,[],,,,
1321437009215430657,1321436231109091330,2020-10-28 10:01:48 -03,2020-10-28,10:01:48,-0300,855614996675538944,ritaberaldo,Rita Beraldo 🌏🌎🌍📚,,"Compromissos recentes de líderes mundiais para retardar o desmatamento desenfreado de florestas como a Amazônia provavelmente não serão cumpridos, a menos que os produtores de commodities melhorem rapidamente sua gestão dos riscos de desmatamento.",pt,[],[],[],0,0,0,[],[],https://twitter.com/ritaberaldo/status/1321437009215430657,False,,0,,,,,,,,[],,,,
1321433715222917121,1321433715222917121,2020-10-28 09:48:43 -03,2020-10-28,09:48:43,-0300,703792836,blogmauro,Blog do Mauro,,"No ""eixo ambiental"" do decreto, as metas de combate ao desmatamento não aparecem, assim como não há nenhuma menção à Amazônia ou ao Pantanal.  Click no link a seguir leia mais:  https://t.co/U4sJLjaKkQ  #blogdomauro",pt,[],['https://mla.bs/a9b6a500'],[],0,0,0,['blogdomauro'],[],https://twitter.com/blogmauro/status/1321433715222917121,False,,0,,,,,,,,[],,,,
1321433431847407619,1321433431847407619,2020-10-28 09:47:35 -03,2020-10-28,09:47:35,-0300,2209163210,leonesoaresdes1,leone soares de souz,,"Empresas dos EUA são 'cúmplices' de desmatamento e abusos na Amazônia, diz Amazon Watch  https://t.co/d6zfVBdbOs via @YahooBr",pt,"[{'screen_name': 'yahoobr', 'name': 'yahoo brasil', 'id': '31161322'}]",['https://br.noticias.yahoo.com/empresas-dos-eua-s%C3%A3o-c%C3%BAmplices-202222083.html?soc_src=social-sh&soc_trk=tw&tsrc=twtr'],[],0,0,0,[],[],https://twitter.com/leonesoaresdes1/status/1321433431847407619,False,,0,,,,,,,,[],,,,
1321429832153128964,1321429832153128964,2020-10-28 09:33:17 -03,2020-10-28,09:33:17,-0300,1487514031,mendesonca,Меndes,,Órgãos de governo contradizem O inútil  Bolsonaro e o condenado Salles sobre Fundo Amazônia e desmatamento - GGN  https://t.co/OoQqnk4wyP,pt,[],['https://jornalggn.com.br/meio-ambiente/orgaos-de-governo-contradizem-bolsonaro-e-salles-sobre-fundo-amazonia-e-desmatamento/'],[],1,0,2,[],[],https://twitter.com/MendesOnca/status/1321429832153128964,False,,0,,,,,,,,[],,,,
1321428815646760966,1321427495166660613,2020-10-28 09:29:15 -03,2020-10-28,09:29:15,-0300,332571180,jonasbarbosa_,Gonaas I'm,,"@SirThulio esse calor é o desmatamento recorde da amazonia, bom dia",pt,[],[],[],0,0,0,[],[],https://twitter.com/JonasBarbosa_/status/1321428815646760966,False,,0,,,,,,,,"[{'screen_name': 'SirThulio', 'name': 'SirThulio', 'id': '2239764811'}]",,,,
1321423927126581255,1321423927126581255,2020-10-28 09:09:49 -03,2020-10-28,09:09:49,-0300,1291527256083517440,ancipado,CRIDÃO LULA SANTANA,,Órgãos de governo contradizem Bolsonaro e Salles sobre Fundo Amazônia e desmatamento – GGN  https://t.co/SUiQ7jZyCR,pt,[],['https://evsarteblog.wordpress.com/2020/10/28/orgaos-de-governo-contradizem-bolsonaro-e-salles-sobre-fundo-amazonia-e-desmatamento-ggn/'],[],0,0,0,[],[],https://twitter.com/ancipado/status/1321423927126581255,False,,0,,,,,,,,[],,,,
1321422938134949890,1321422938134949890,2020-10-28 09:05:53 -03,2020-10-28,09:05:53,-0300,14754376,luisnassif,Luis Nassif,,Órgãos de governo contradizem Bolsonaro e Salles sobre Fundo Amazônia e desmatamento  https://t.co/PIsMl9bjD2  https://t.co/El9Ee1OM2X,pt,[],['https://jornalggn.com.br/meio-ambiente/orgaos-de-governo-contradizem-bolsonaro-e-salles-sobre-fundo-amazonia-e-desmatamento/'],['https://pbs.twimg.com/media/ElajJzpXIAINfRA.jpg'],0,6,33,[],[],https://twitter.com/luisnassif/status/1321422938134949890,False,,1,https://pbs.twimg.com/media/ElajJzpXIAINfRA.jpg,,,,,,,[],,,,
1321422918363025409,1321422918363025409,2020-10-28 09:05:49 -03,2020-10-28,09:05:49,-0300,74715478,climainfonews,ClimaInfo,,"Um levantamento inédito revelou as conexões entre algumas das principais instituições financeiras do Brasil e do exterior com empresas cujas atividades têm envolvimento com invasões, desmatamento e violação de Direitos Indígenas na Amazônia brasileira.  https://t.co/0DEyalzjR0",pt,[],['https://climainfo.org.br/2020/10/28/relatorio-identifica-bancos-e-empresas-cumplices-da-destruicao-de-terras-indigenas'],[],0,10,22,[],[],https://twitter.com/ClimaInfoNews/status/1321422918363025409,False,,0,,,,,,,,[],,,,
1321420199418077184,1321420199418077184,2020-10-28 08:55:00 -03,2020-10-28,08:55:00,-0300,1347385232,jornalggn,JornalGGN,,Órgãos de governo contradizem Bolsonaro e Salles sobre Fundo Amazônia e desmatamento  https://t.co/uwaRaBPero  https://t.co/oWyXvcxJDP,pt,[],['https://jornalggn.com.br/meio-ambiente/orgaos-de-governo-contradizem-bolsonaro-e-salles-sobre-fundo-amazonia-e-desmatamento/'],['https://pbs.twimg.com/media/ElagqyBXIAIdogQ.jpg'],0,3,9,[],[],https://twitter.com/JornalGGN/status/1321420199418077184,False,,1,https://pbs.twimg.com/media/ElagqyBXIAIdogQ.jpg,,,,,,,[],,,,
1321411546052993026,1321411546052993026,2020-10-28 08:20:37 -03,2020-10-28,08:20:37,-0300,962433092127461377,ddescomplicado,Direito Descomplicado,,Fundo Amazônia: desmatamento não está associado ao aumento de produtividade  https://t.co/H0gjpqftdh,pt,[],['https://direitodescomplicado.com/fundo-amazonia-desmatamento-nao-esta-associado-ao-aumento-de-produtividade/'],[],0,0,0,[],[],https://twitter.com/ddescomplicado/status/1321411546052993026,False,,0,,,,,,,,[],,,,
1321409134168698880,1321409134168698880,2020-10-28 08:11:02 -03,2020-10-28,08:11:02,-0300,1183723759,infojurid,Infojurid,,"Fundo Amazônia: desmatamento não está associado ao aumento de produtividade: Durante a audiência pública no âmbito da Ação Direta de Inconstitucionalidade por Omissão (ADO) 59, especialistas em clima, monitoramento e gestão ambiental…  https://t.co/q8dCZza5EP #Infojurid #cnj",pt,[],['http://dlvr.it/RkVXjJ'],[],0,0,0,"['infojurid', 'cnj']",[],https://twitter.com/Infojurid/status/1321409134168698880,False,,0,,,,,,,,[],,,,
1321384318602805250,1321384318602805250,2020-10-28 06:32:26 -03,2020-10-28,06:32:26,-0300,1084901675838648321,rodrigoleito8,Rodrigo Leitão no Tucupi 🇧🇷💉🦎🇵🇸,,"51% do desmatamento na Amazônia ocorreram no Pará, em setembro, dados do @Imazon. Não fosse “só” a mata no chão, que já seria um atentado a humanidade, junto com desmatamento vem o crime organizado e o trabalho escravo. Até quando viveremos o colonialismo como ideal de progresso?",pt,"[{'screen_name': 'imazon', 'name': 'imazon', 'id': '74842999'}]",[],[],0,0,1,[],[],https://twitter.com/RodrigoLeito8/status/1321384318602805250,False,,0,,,,,,,,[],,,,
1321367505110212610,1321367505110212610,2020-10-28 05:25:37 -03,2020-10-28,05:25:37,-0300,969582762909827072,o_expediente,Expediente Sínico,,Empresas norte-americanas acusadas de desmatamento e abusos na Amazónia  https://t.co/5SOn01vzgO,es,[],['http://expedientesinico.com/2020/10/28/empresas-norte-americanas-acusadas-de-desmatamento-e-abusos-na-amazonia/'],[],0,0,0,[],[],https://twitter.com/O_Expediente/status/1321367505110212610,False,,0,,,,,,,,[],,,,
1321271715159281664,1321271715159281664,2020-10-27 23:04:59 -03,2020-10-27,23:04:59,-0300,3349970531,andreborges_jor,André Borges,,"""Plano estratégico 2020-2031"" publicado por Bolsonaro ignora completamente metas de desmatamento. Sequer cita palavras como Amazônia e Pantanal, ao tratar do meio ambiente no que será o Brasil daqui a 11 anos. @estadao:   https://t.co/5GJIkohSZv",pt,"[{'screen_name': 'estadao', 'name': 'estadão', 'id': '9317502'}]","['https://sustentabilidade.estadao.com.br/noticias/geral,governo-bolsonaro-ignora-metas-de-combate-ao-desmatamento-em-plano-estrategia-ate-2031,70003491522?utm_source=estadao:twitter&utm_medium=link']",[],0,16,47,[],[],https://twitter.com/AndreBorges_JOR/status/1321271715159281664,False,,0,,,,,,,,[],,,,
