id,conversation_id,created_at,date,time,timezone,user_id,username,name,place,tweet,language,mentions,urls,photos,replies_count,retweets_count,likes_count,hashtags,cashtags,link,retweet,quote_url,video,thumbnail,near,geo,source,user_rt_id,user_rt,retweet_id,reply_to,retweet_date,translate,trans_src,trans_dest
1420883882954694656,1420883882954694656,2021-07-29 20:08:11 SA Eastern Standard Time,2021-07-29,20:08:11,-0300,1049689799467122688,cdantas5,Carlos Dantas 🇧🇷,,"O governo destruidor da Amazônia, apoiador das queimadas e matador dos índios, girafas e elefantes, liberou para o mundo ter acesso e vê imagens da Região Amazônica.  Como pode isso?    https://t.co/DsPWZkMBOJ  https://t.co/DsPWZkMBOJ",pt,[],"['https://www.gov.br/mcti/pt-br/acompanhe-o-mcti/noticias/2021/07/imagens-do-satelite-amazonia-1-estao-disponiveis-para-o-publico', 'https://www.gov.br/mcti/pt-br/acompanhe-o-mcti/noticias/2021/07/imagens-do-satelite-amazonia-1-estao-disponiveis-para-o-publico']",[],1,3,10,[],[],https://twitter.com/cdantas5/status/1420883882954694656,False,,0,,,,,,,,[],,,,
1420871591387348994,1420871591387348994,2021-07-29 19:19:20 SA Eastern Standard Time,2021-07-29,19:19:20,-0300,717509820379754497,naosoueudaiane,Daiane✨,,"O brasileiro quer a impressão do voto como forma de segurança do voto. O brasileiro quer mais papel, mais destruição ambiental, não bastam as queimadas e desmatamento em massa na Amazônia, o pessoal quer mais formas de destruição ambiental para se sentirem seguros...",pt,[],[],[],0,0,0,[],[],https://twitter.com/naosoueudaiane/status/1420871591387348994,False,,0,,,,,,,,[],,,,
1420870649644523520,1420870649644523520,2021-07-29 19:15:36 SA Eastern Standard Time,2021-07-29,19:15:36,-0300,101267040,b_ishigami,Bruno Ishigami,,"O Brasil deixou queimar o Museu Nacional, incentivou as queimadas na Amazônia e no Pantanal e agora deixa queimar a Cinemateca Brasileira.  Agora vai queimar uma estátua de um bandeirante pra ver o que acontece...  Nossa história recente é minúscula. Que tristeza...",pt,[],[],[],2,29,131,[],[],https://twitter.com/b_ishigami/status/1420870649644523520,False,https://twitter.com/g1/status/1420861254927888384,0,,,,,,,,[],,,,
1420850877053771777,1420849659539492871,2021-07-29 17:57:01 SA Eastern Standard Time,2021-07-29,17:57:01,-0300,2431545166,isaflehr,isabelle,,"Sei q alguns eventos climáticos q tão rolando por aí são naturais e just happens mas gnt Pelo amor Incêndios no pantanal ano passado (q já tá rolando dnv), queimadas na Amazônia, desmatamento do cerrado, enchentes na Alemanha Td isso rolando e a gnt ignora sabe.",pt,[],[],[],1,0,0,[],[],https://twitter.com/Isaflehr/status/1420850877053771777,False,,0,,,,,,,,[],,,,
1420846104598433794,1420829645537173504,2021-07-29 17:38:04 SA Eastern Standard Time,2021-07-29,17:38:04,-0300,1242122089328492553,frontnacaobr,@FrontNacionalista,,@araqueiro @Fiodanavalha1 @heldermaldonado Aí eu te pergunto do fundo coracao ? Qual é o problema das queimadas da Amazônia ?  Eu queria entender ... Como se constrói coisas e produz alimentos sem derrubar a floresta ?,pt,[],[],[],0,0,1,[],[],https://twitter.com/FrontNacaoBR/status/1420846104598433794,False,,0,,,,,,,,"[{'screen_name': 'araqueiro', 'name': '(B)araqueiro', 'id': '151891062'}, {'screen_name': 'Fiodanavalha1', 'name': 'Davi Ribeiro', 'id': '912473588657266692'}, {'screen_name': 'heldermaldonado', 'name': 'Helder Maldonado', 'id': '128619303'}]",,,,
1420840641563709444,1420829645537173504,2021-07-29 17:16:21 SA Eastern Standard Time,2021-07-29,17:16:21,-0300,151891062,araqueiro,(B)araqueiro,,"@Fiodanavalha1 @heldermaldonado Negar as queimadas na Amazônia eh d+, heim?",pt,[],[],[],2,0,1,[],[],https://twitter.com/araqueiro/status/1420840641563709444,False,,0,,,,,,,,"[{'screen_name': 'Fiodanavalha1', 'name': 'Davi Ribeiro', 'id': '912473588657266692'}, {'screen_name': 'heldermaldonado', 'name': 'Helder Maldonado', 'id': '128619303'}]",,,,
1420839142712397827,1420839142712397827,2021-07-29 17:10:24 SA Eastern Standard Time,2021-07-29,17:10:24,-0300,805566597943492609,zebedeudascoves,🚩Claudio🚩,,Desmente queimadas na Amazônia. Esperando ele vir desmentir o frio e a neve do sul. Este é o típico nacionalista puxa-saco de milico. Uma criatura desconjunturada e fora de propósito com a atualidade.,pt,[],[],[],0,0,0,[],[],https://twitter.com/zebedeudascoves/status/1420839142712397827,False,https://twitter.com/heldermaldonado/status/1420829645537173504,0,,,,,,,,[],,,,
1420836628805865473,1420836628805865473,2021-07-29 17:00:24 SA Eastern Standard Time,2021-07-29,17:00:24,-0300,1078004988989849600,semaamazonas,Sema Amazonas,,"A #SemaAmazonas participou de uma reunião com representantes governamentais  da Amazônia Legal, com o objetivo de articular ações conjuntas para combater incêndios florestais, queimadas e desmatamento no bioma.   Leia mais em ➡  https://t.co/6x82dFPifl  https://t.co/S26EvyXxDL",pt,[],['https://bit.ly/3iag7KE'],['https://pbs.twimg.com/media/E7fTYjaWQAI9VXj.jpg'],0,0,0,['semaamazonas'],[],https://twitter.com/semaamazonas/status/1420836628805865473,False,,1,https://pbs.twimg.com/media/E7fTYjaWQAI9VXj.jpg,,,,,,,[],,,,
1420836154069458951,1420836154069458951,2021-07-29 16:58:31 SA Eastern Standard Time,2021-07-29,16:58:31,-0300,26730571,laercionamikawa,Laercio Namikawa,,"São José dos Campos, SP,  entre 23 e 27/Jul/2021 em resolução espacial de ˜60 m, com CBERS4, 4A e AMAZONIA-1. Áreas queimadas em preto, aumentando a cada dia... @inpe_mct @obtinpe  https://t.co/jcqb3RgHnm",pt,"[{'screen_name': 'inpe_mct', 'name': 'inpe', 'id': '308605432'}, {'screen_name': 'obtinpe', 'name': 'obtinpe', 'id': '1016679469711491077'}]",[],['https://pbs.twimg.com/tweet_video_thumb/E7fSXbLWYAYJp2v.jpg'],0,7,24,[],[],https://twitter.com/laercionamikawa/status/1420836154069458951,False,,1,https://pbs.twimg.com/tweet_video_thumb/E7fSXbLWYAYJp2v.jpg,,,,,,,[],,,,
1420805523293753346,1420524105464430594,2021-07-29 14:56:48 SA Eastern Standard Time,2021-07-29,14:56:48,-0300,1129700059170398208,hayashi_claudio,Claudio Hayashi,,"@viniciuscfp82 Já pensou se a moda pega, as queimadas da Amazônia serão pequenas kkk",pt,[],[],[],0,0,0,[],[],https://twitter.com/hayashi_claudio/status/1420805523293753346,False,,0,,,,,,,,"[{'screen_name': 'viniciuscfp82', 'name': 'Vinicius Carrion', 'id': '87282944'}]",,,,
1420790380283506696,1420742241451069443,2021-07-29 13:56:38 SA Eastern Standard Time,2021-07-29,13:56:38,-0300,1341375116106739713,eduardo63558262,Eduardo Barbosa,,@cappellarianton Periga o ministério do meio ambiente falar q as queimadas da Amazônia possuem a função de proteger a floresta das geadas.  🤦‍♂️🤦‍♂️🤦‍♂️,pt,[],[],[],1,2,8,[],[],https://twitter.com/Eduardo63558262/status/1420790380283506696,False,,0,,,,,,,,"[{'screen_name': 'cappellarianton', 'name': 'Antonio Cappellari LULA É O ÚNICO CAMINHO', 'id': '137545998'}]",,,,
1420781165707923466,1420781165707923466,2021-07-29 13:20:01 SA Eastern Standard Time,2021-07-29,13:20:01,-0300,138492825,proindio,Comissão Pró-Índio,,Um abaixo-assinado que cobrava ações contra as queimadas na #Amazônia reuniu cinco milhões de assinaturas em 2019. A petição resultou na criação de uma Comissão Externa para avaliar as políticas públicas ambientais.   https://t.co/1zyCOK2Dxk,pt,[],['https://www1.folha.uol.com.br/empreendedorsocial/2021/07/de-luta-contra-racismo-a-desmatamento-ativismo-digital-atinge-resultados-no-pais.shtml'],[],0,2,19,['amazônia'],[],https://twitter.com/proindio/status/1420781165707923466,False,,0,,,,,,,,[],,,,
1420779665329897481,1420778720525180932,2021-07-29 13:14:03 SA Eastern Standard Time,2021-07-29,13:14:03,-0300,1308821032749486080,fumacasinal,SinalDeFumaca,,"O @delcio_rodrigu, do @ClimaInfoNews,  explicou um pouco como as queimadas na Amazônia estão acelerando processos de mudança climática e quais são os impactos que o Brasil inteiro já vai sentindo  https://t.co/6ZxVx6YI2k",pt,"[{'screen_name': 'delcio_rodrigu', 'name': 'delcio rodrigues', 'id': '3118342601'}, {'screen_name': 'climainfonews', 'name': 'climainfo', 'id': '74715478'}]",[],[],1,2,14,[],[],https://twitter.com/FumacaSinal/status/1420779665329897481,False,,1,https://pbs.twimg.com/ext_tw_video_thumb/1420779483632705538/pu/img/RLlQstv8gy2_eYkK.jpg,,,,,,,[],,,,
1420778706281324550,1420778706281324550,2021-07-29 13:10:15 SA Eastern Standard Time,2021-07-29,13:10:15,-0300,171255848,hericks1979,Herick🦅🏆🏆🏆,,Sobre o frio é a natureza ou acharam que aquelas queimadas na Amazônia iria ficar por isso mesmo 🤷a conta chegou,pt,[],[],[],0,0,0,[],[],https://twitter.com/HerickS1979/status/1420778706281324550,False,,0,,,,,,,,[],,,,
1420752007783010308,1420711129760862211,2021-07-29 11:24:09 SA Eastern Standard Time,2021-07-29,11:24:09,-0300,448047527,elianades,Eliana de Sá,,"@erikakokay Consequência do desmatamento da Amazônia, queimadas no Pantanal e um genocida no Planalto.",pt,[],[],[],0,0,0,[],[],https://twitter.com/ElianadeS/status/1420752007783010308,False,,0,,,,,,,,"[{'screen_name': 'erikakokay', 'name': 'Erika Kokay', 'id': '87021796'}]",,,,
1420751769206853646,1420749150807728136,2021-07-29 11:23:12 SA Eastern Standard Time,2021-07-29,11:23:12,-0300,1211139784774569984,sasabaody,Um Alguém,,"@maiconkusterk Vc tá reclamando do frio agora, mas daqui uns tempos vai estar reclamando do descaso com a ambiente. Você não passa de um verme hipócrita! Daqui a pouco vai estar ""lutando"" pela Amazônia e afins, reclamando das queimadas quando não para de queimar o beck.",pt,[],[],[],0,0,0,[],[],https://twitter.com/SAsabaody/status/1420751769206853646,False,,0,,,,,,,,"[{'screen_name': 'maiconkusterk', 'name': 'Maicon Küster', 'id': '3120745861'}]",,,,
1420747192894033928,1420747192894033928,2021-07-29 11:05:01 SA Eastern Standard Time,2021-07-29,11:05:01,-0300,1009627350714155009,eusouzazu,eusouzazu,,"A inversão de significados na justifica de atear fogo como uma ""abertura de debates"" não tem nada de Antifascista, é só fascista mesmo. Me lembrou o presidente justificando as queimadas na Amazônia pela proteção da floresta. O debate já está encerrado quando começa o fogo.",pt,[],[],[],0,0,0,[],[],https://twitter.com/eusouzazu/status/1420747192894033928,False,,0,,,,,,,,[],,,,
1420746693994180608,1420722050927370246,2021-07-29 11:03:02 SA Eastern Standard Time,2021-07-29,11:03:02,-0300,1114221681097216002,eliasteodoro8,Elias Teodoro,,@taoquei1 Isso é fumaça das queimadas na Amazônia  kkkkkkkkkkk,pt,[],[],[],0,0,0,[],[],https://twitter.com/EliasTeodoro8/status/1420746693994180608,False,,0,,,,,,,,"[{'screen_name': 'taoquei1', 'name': 'TeAtualizei 🇧🇷👊🏻❤️', 'id': '1087259768'}]",,,,
1420745503122276354,1420745503122276354,2021-07-29 10:58:18 SA Eastern Standard Time,2021-07-29,10:58:18,-0300,2188416542,fatoamazonico,Fato Amazônico,,Estados da Amazônia Legal se unem para combater queimadas e incêndios florestais  https://t.co/46ZgoEIW9w via @fatoamazonico,pt,"[{'screen_name': 'fatoamazonico', 'name': 'fato amazônico', 'id': '2188416542'}]",['https://www.fatoamazonico.com.br/estados-da-amazonia-legal-se-unem-para-combater-queimadas-e-incendios-florestais/'],[],0,0,0,[],[],https://twitter.com/fatoamazonico/status/1420745503122276354,False,,0,,,,,,,,[],,,,
1420736234935230470,1420736234935230470,2021-07-29 10:21:29 SA Eastern Standard Time,2021-07-29,10:21:29,-0300,1187571849561030656,portalamz,Portal AMZ!,,Estados da Amazônia Legal se unem para combater queimadas e incêndios florestais  https://t.co/mmjHulB6Yx,pt,[],['https://www.portalamz.com.br/estados-da-amazonia-legal-se-unem-para-combater-queimadas-e-incendios-florestais/'],[],0,0,0,[],[],https://twitter.com/PortalAmz/status/1420736234935230470,False,,0,,,,,,,,[],,,,
1420733667270447107,1420733667270447107,2021-07-29 10:11:16 SA Eastern Standard Time,2021-07-29,10:11:16,-0300,328588165,chefaodanoticia,O Chefão da Notícia,,"Estados da Amazônia Legal se unem para combater queimadas, incêndios florestais e desmatamentos  https://t.co/cZtjeydpjN",pt,[],['https://ochefaodanoticia.com.br/2021/07/29/estados-da-amazonia-legal-se-unem-para-combater-queimadas-incendios-florestais-e-desmatamentos/'],[],0,0,0,[],[],https://twitter.com/ChefaodaNoticia/status/1420733667270447107,False,,0,,,,,,,,[],,,,
1420731114033979393,1420725881153237029,2021-07-29 10:01:08 SA Eastern Standard Time,2021-07-29,10:01:08,-0300,996922969501982720,galo_1984,Galo 1984,,@josuenunes Mas aí no verão carioca 40 graus a questão é o aquecimento global. Queimadas na Amazônia etc. Esse é o padrão globalista! Pode anotar.,pt,[],[],[],0,0,0,[],[],https://twitter.com/galo_1984/status/1420731114033979393,False,,0,,,,,,,,"[{'screen_name': 'josuenunes', 'name': 'Josué Nunes', 'id': '615729718'}]",,,,
1420723743333175297,1420490713792458761,2021-07-29 09:31:50 SA Eastern Standard Time,2021-07-29,09:31:50,-0300,1232753343791030274,lillytsch,Lise Schneider,,"@rodartgabriela A especialidade do presidente é lesar patrimônio da humanidade, a Natureza, com as queimadas na Amazônia e no Pantanal. Ah, mas para solucionar estes incêndios temos os incríveis e heróicos ""bois bombeiros"", né?",pt,[],[],[],0,0,0,[],[],https://twitter.com/lillytsch/status/1420723743333175297,False,,0,,,,,,,,"[{'screen_name': 'rodartgabriela', 'name': 'Gabriela Rodart 🇧🇷🇻🇦', 'id': '1194344638087344128'}]",,,,
1420719905914114050,1420719905914114050,2021-07-29 09:16:35 SA Eastern Standard Time,2021-07-29,09:16:35,-0300,1044585439,monicarabelorio,Monica Rabelo - 13,,Bom dia! Vcs tem noção de quantas estátuas são queimadas diariamente na Amazônia?,pt,[],[],[],0,1,1,[],[],https://twitter.com/MonicaRabeloRio/status/1420719905914114050,False,,0,,,,,,,,[],,,,
1420719107578765324,1420719107578765324,2021-07-29 09:13:25 SA Eastern Standard Time,2021-07-29,09:13:25,-0300,515540998,reporterpin,Repórter Parintins,,Estados da Amazônia Legal se unem para combater queimadas e incêndios florestais  https://t.co/faMnUd5sUG,pt,[],['https://reporterparintins.com.br/?q=276-conteudo-204762-estados-da-amazonia-legal-se-unem-para-combater-queimadas-e-incendios-florestais'],[],0,0,1,[],[],https://twitter.com/reporterpin/status/1420719107578765324,False,,0,,,,,,,,[],,,,
1420718892117336064,1420718892117336064,2021-07-29 09:12:34 SA Eastern Standard Time,2021-07-29,09:12:34,-0300,364600736,portaldoam,PortaldoAmazonas.com,,Estados da Amazônia Legal se unem para combater queimadas e incêndios florestais  FOTOS: Divulgação/Sema  https://t.co/vlsvRBvCWf  https://t.co/ECDfSE1O7Q,pt,[],['https://portaldoamazonas.com/estados-da-amazonia-legal-se-unem-para-combater-queimadas-e-incendios-florestais'],['https://pbs.twimg.com/media/E7doSzfWYAUVhdQ.jpg'],0,0,0,[],[],https://twitter.com/PortaldoAM/status/1420718892117336064,False,,1,https://pbs.twimg.com/media/E7doSzfWYAUVhdQ.jpg,,,,,,,[],,,,
1420714263551877121,1420714263551877121,2021-07-29 08:54:10 SA Eastern Standard Time,2021-07-29,08:54:10,-0300,1329077387301056521,oprimeiroportal,O Primeiro Portal,,Estados da Amazônia Legal se unem para combater queimadas e incêndios florestais  https://t.co/45XmInJCdo,pt,[],['https://oprimeiroportal.com.br/popular/29/07/2021/estados-da-amazonia-legal-se-unem-para-combater-queimadas-e-incendios-florestais/'],[],0,0,0,[],[],https://twitter.com/oprimeiroportal/status/1420714263551877121,False,,0,,,,,,,,[],,,,
1420701174974582793,1420701174974582793,2021-07-29 08:02:10 SA Eastern Standard Time,2021-07-29,08:02:10,-0300,34304424,marcelinharosa,Marcela Rosa,,Estados da Amazônia Legal se unem para combater queimadas e incêndios florestais  https://t.co/TKJnQCnnLO,pt,[],['https://portaldamarcelarosa.com.br/estados-da-amazonia-legal-se-unem-para-combater-queimadas-e-incendios-florestais/?feed_id=14835&_unique_id=61028ab20df21'],[],0,0,0,[],[],https://twitter.com/marcelinharosa/status/1420701174974582793,False,,0,,,,,,,,[],,,,
1420686505505394694,1420578952016506881,2021-07-29 07:03:52 SA Eastern Standard Time,2021-07-29,07:03:52,-0300,404090745,marcioantonioma,Marcio Antonio,,"@reporterenato Aquecimento global para o qual certamente contribui Jair Bolsonaro com as queimadas e devastação da Amazônia inclusive pelo fogo. Ou aquele ministro irresponsável que disse ""vamos passando a boiada.""",pt,[],[],[],1,0,1,[],[],https://twitter.com/MarcioAntonioMa/status/1420686505505394694,False,,0,,,,,,,,"[{'screen_name': 'reporterenato', 'name': 'Renato Souza', 'id': '59150875'}]",,,,
1420683240738889732,1420543988495491072,2021-07-29 06:50:54 SA Eastern Standard Time,2021-07-29,06:50:54,-0300,1264590042418368513,cba_ze,ZeMariaCba 🚀,,@CrapulaLeonardo Bolsonaro esta se mostrando ao mundo um verdadeiro gelocida. Q frio da porr@. Saudade das queimadas da Amazônia.,pt,[],[],[],0,0,0,[],[],https://twitter.com/cba_ze/status/1420683240738889732,False,,0,,,,,,,,"[{'screen_name': 'CrapulaLeonardo', 'name': 'Leonardo DiCrápula 👉🧱😎🇧🇷', 'id': '1348814345434750978'}]",,,,
1420677624259432453,1420329000577163266,2021-07-29 06:28:35 SA Eastern Standard Time,2021-07-29,06:28:35,-0300,3348293212,monsterpiaza,dégueulasse 🏳️‍🌈,,"@Fantasma_267L @Carlos13577720 @antonio_packer @UOLNoticias Não faz nem sentido que você tá falando, justamente pq a Amazônia é uma floresta úmida e tropical como vc mesmo disso não faz sentido vc afirmar que as queimadas lá tem a mesma causa que as queimadas nas florestas australianas. Não tem a mesma causa, a grande maioria +",pt,[],[],[],0,0,1,[],[],https://twitter.com/monsterpIaza/status/1420677624259432453,False,,0,,,,,,,,"[{'screen_name': 'Fantasma_267L', 'name': 'Lucas Oliveira dos Santos', 'id': '1323462460209332226'}, {'screen_name': 'antonio_packer', 'name': 'Antonio Packer', 'id': '3346607914'}, {'screen_name': 'UOLNoticias', 'name': 'UOL Notícias', 'id': '14594698'}]",,,,
1420675923557429251,1420329000577163266,2021-07-29 06:21:49 SA Eastern Standard Time,2021-07-29,06:21:49,-0300,1323462460209332226,fantasma_267l,Lucas Oliveira dos Santos,,"@monsterpIaza @Carlos13577720 @antonio_packer @UOLNoticias Eu acabei de dizer... Baixa Umidade + Altas Temperaturas = Queimadas Eu sei que tem biomas diferentes e que a Amazônia é mais difícil de se incendiar justamente por ser uma floresta tropical, mas o motivo do incêndio dela foi o que eu já expliquei.",pt,[],[],[],3,0,0,[],[],https://twitter.com/Fantasma_267L/status/1420675923557429251,False,,0,,,,,,,,"[{'screen_name': 'monsterpIaza', 'name': 'dégueulasse 🏳️\u200d🌈', 'id': '3348293212'}, {'screen_name': 'antonio_packer', 'name': 'Antonio Packer', 'id': '3346607914'}, {'screen_name': 'UOLNoticias', 'name': 'UOL Notícias', 'id': '14594698'}]",,,,
1420672874822594567,1420329000577163266,2021-07-29 06:09:42 SA Eastern Standard Time,2021-07-29,06:09:42,-0300,3348293212,monsterpiaza,dégueulasse 🏳️‍🌈,,"@Fantasma_267L @Carlos13577720 @antonio_packer @UOLNoticias Pelo visto o animal é vc pq parece que nem sabe a diferença que um bioma faz, diferentes biomas são mais ou menos suscetíveis a queimadas, foi isso q eu quis dizer, a Amazônia não queima fácil assim e todo mundo sabe q quantidade de incêndio criminoso q tem lá, preciso desenhar?",pt,[],[],[],1,0,0,[],[],https://twitter.com/monsterpIaza/status/1420672874822594567,False,,0,,,,,,,,"[{'screen_name': 'Fantasma_267L', 'name': 'Lucas Oliveira dos Santos', 'id': '1323462460209332226'}, {'screen_name': 'antonio_packer', 'name': 'Antonio Packer', 'id': '3346607914'}, {'screen_name': 'UOLNoticias', 'name': 'UOL Notícias', 'id': '14594698'}]",,,,
1420591820539666437,1419790233525264386,2021-07-29 00:47:37 SA Eastern Standard Time,2021-07-29,00:47:37,-0300,42511246,dagc_investidor,David Cabañas (DAGC In - Paraguay-BR),,"@MartaSo72177141 @BolsonaroSP Desmatamento na amazonia atualmente é muito menor, se comparado aos tempo de Lula, é so ir la e filtrar biomas e verificar queimadas na epoca do PT, praticamente o dobro de queimadas.   Dificil acessar o site do INPE né? quer o link? o print e etc?",pt,[],[],[],0,0,0,[],[],https://twitter.com/DAGC_Investidor/status/1420591820539666437,False,,0,,,,,,,,"[{'screen_name': 'MartaSo72177141', 'name': 'Marta Souza', 'id': '1320148021024346114'}, {'screen_name': 'BolsonaroSP', 'name': 'Eduardo Bolsonaro🇧🇷', 'id': '74756085'}]",,,,
1420588324876689408,1420588324876689408,2021-07-29 00:33:44 SA Eastern Standard Time,2021-07-29,00:33:44,-0300,1172114825981419520,portalcaboco,Portal Caboco,,Estados da Amazônia Legal se unem para combater queimadas e incêndios florestais  https://t.co/HrWSBkut7V,pt,[],['https://portalcaboco.com.br/amazonas/estados-da-amazonia-legal-se-unem-para-combater-queimadas-e-incendios-florestais/'],[],0,0,0,[],[],https://twitter.com/PortalCaboco/status/1420588324876689408,False,,0,,,,,,,,[],,,,
1420579607200231428,1420579607200231428,2021-07-28 23:59:06 SA Eastern Standard Time,2021-07-28,23:59:06,-0300,98875202,am_noticias,Amazonas Notícias,,Estados da Amazônia Legal se unem para combater queimadas e incêndios florestais  https://t.co/tLJ5DQoOyb,pt,[],['http://dlvr.it/S4d40K'],[],0,1,1,[],[],https://twitter.com/am_noticias/status/1420579607200231428,False,,0,,,,,,,,[],,,,
1420579146539814914,1420579146539814914,2021-07-28 23:57:16 SA Eastern Standard Time,2021-07-28,23:57:16,-0300,1223752876822028288,amsemfronteira1,Portal Amazônia Sem Fronteira,,Estados da Amazônia Legal se unem para combater queimadas e incêndios florestais  Leia mais em  https://t.co/Dkypevjwnz  @semaamazonas @combate.a.incendio  @amazoniasemfronteira  https://t.co/MrRJ7gM9MI,pt,"[{'screen_name': 'semaamazonas', 'name': 'sema amazonas', 'id': '1078004988989849600'}, {'screen_name': 'combate', 'name': 'combate', 'id': '16119119'}]","['http://www.amazoniasemfronteira.com.br', 'https://www.instagram.com/p/CR5SdjnDSHJ/?utm_medium=twitter']",[],0,0,0,[],[],https://twitter.com/Amsemfronteira1/status/1420579146539814914,False,,0,,,,,,,,[],,,,
1420572084506333184,1420515981529686021,2021-07-28 23:29:12 SA Eastern Standard Time,2021-07-28,23:29:12,-0300,1269065872452325377,voznao,Voz Do Além. Não Vem Que Não Tem.,,@LeonelRadde E quem vai pagar pelos crimes das queimadas na Amazônia e no Pantanal? Cadê o Ministério Público Federal?,pt,[],[],[],0,0,2,[],[],https://twitter.com/VozNao/status/1420572084506333184,False,,0,,,,,,,,"[{'screen_name': 'LeonelRadde', 'name': 'Leonel Radde', 'id': '35268237'}]",,,,
1420572079339053058,1420572079339053058,2021-07-28 23:29:11 SA Eastern Standard Time,2021-07-28,23:29:11,-0300,131286287,minc_rj,Carlos Minc,,Descumprem.todas as metas que o Brasil assinou na Convenção do Clima.  Desativaram o Fundo Amazônia e o Fundo Clima que criei em 2008. Aumentaram 60% desmatamento e queimadas. Vi charge genial de alemão nazi dentro de carro submerso pela tempestade com adesivo: Greta - fuck you!,pt,[],[],[],7,16,98,[],[],https://twitter.com/minc_rj/status/1420572079339053058,False,https://twitter.com/Andymendes9o/status/1420550302395207689,0,,,,,,,,[],,,,
1420566252540604420,1420566252540604420,2021-07-28 23:06:02 SA Eastern Standard Time,2021-07-28,23:06:02,-0300,1243021755893067777,helioricardorio,Hélio Ricardo 🌵💉🐊,,"Cite um crime que tenha acontecido no Brasil, que os responsáveis ainda estão em liberdade: Ricardo Salles = queimadas e desmatamento na Amazônia.",pt,[],[],[],5,2,19,[],[],https://twitter.com/helioricardorio/status/1420566252540604420,False,,0,,,,,,,,[],,,,
1420563116639899648,1420563116639899648,2021-07-28 22:53:34 SA Eastern Standard Time,2021-07-28,22:53:34,-0300,1084902391726686210,eduardataveira_,dida🦋,,"Sim alecrim dourado esse calor é  do lixo jogado no chão, das queimadas na Amazônia e de todas as outras idiotices humanas, mas como a gnt ia imaginar né 🤷‍♀️",pt,[],[],[],0,0,1,[],[],https://twitter.com/eduardataveira_/status/1420563116639899648,False,,0,,,,,,,,[],,,,
1420562362906681351,1420543344485310465,2021-07-28 22:50:34 SA Eastern Standard Time,2021-07-28,22:50:34,-0300,1395805752951033863,johansenarmando,Armando Johansen,,"@bellanna Mas a Gretinha até agora não falou NADA das QUEIMADAS NA CALIFORNIA, acho que ela estudou geografia na mesma escola que o Humberto Bosta e vai falar que é na AMAZÔNIA, já que o muro é na divisa com o México.",pt,[],[],[],0,0,0,[],[],https://twitter.com/JohansenArmando/status/1420562362906681351,False,,0,,,,,,,,"[{'screen_name': 'bellanna', 'name': 'Anita 🇧🇷', 'id': '26486422'}]",,,,
1420550080143237121,1420548501696622599,2021-07-28 22:01:46 SA Eastern Standard Time,2021-07-28,22:01:46,-0300,1260602867318165512,yoluk1nh4,lukinha 🤠,,"@zorogls nossa velho era muito foda era tipo ""NEGO NEY É O MAIOR PSICOPATA, ASSASINO, RESPONSÁVEL PELAS QUEIMADAS NA AMAZÔNIA E LÍDER DO EXÉRCITO DO ESTADO ISLÂMICO""",pt,[],[],[],0,0,1,[],[],https://twitter.com/yoluk1nh4/status/1420550080143237121,False,,0,,,,,,,,[],,,,
1420541271073075217,1420527609578938370,2021-07-28 21:26:46 SA Eastern Standard Time,2021-07-28,21:26:46,-0300,531869955,cssiolf,Cássio M. dos Santos,,@andre_ito2 @canalCCore2 As queimadas na Amazônia foram tão grandes que conseguiram furar o muro fascista que separa o Brasil do México e chegou na Califórnia.,pt,[],[],[],1,0,4,[],[],https://twitter.com/CssioLf/status/1420541271073075217,False,,0,,,,,,,,"[{'screen_name': 'andre_ito2', 'name': 'André Ito', 'id': '1246138181751386117'}, {'screen_name': 'canalCCore2', 'name': 'caio temer', 'id': '1263607904378200069'}]",,,,
