id,conversation_id,created_at,date,time,timezone,user_id,username,name,place,tweet,language,mentions,urls,photos,replies_count,retweets_count,likes_count,hashtags,cashtags,link,retweet,quote_url,video,thumbnail,near,geo,source,user_rt_id,user_rt,retweet_id,reply_to,retweet_date,translate,trans_src,trans_dest
1354769999257337856,1354769999257337856,2021-01-28 09:35:12 SA Eastern Standard Time,2021-01-28,09:35:12,-0300,209560980,ivan_pd,na'vI,,"Com coronavírus, período de queimadas na Amazônia tem 28 mil hospitalizações por problemas respiratórios   https://t.co/wzdkQD7ls6",pt,[],['https://apublica.org/2021/01/com-coronavirus-periodo-de-queimadas-na-amazonia-tem-28-mil-hospitalizacoes-por-problemas-respiratorios/'],[],1,1,1,[],[],https://twitter.com/ivan_pd/status/1354769999257337856,False,,0,,,,,,,,[],,,,
1354766183736741894,1354766183736741894,2021-01-28 09:20:03 SA Eastern Standard Time,2021-01-28,09:20:03,-0300,35524446,ecodebate,Portal EcoDebate,,Período de queimadas na Amazônia tem 28 mil hospitalizações por problemas respiratórios  https://t.co/zMjSrpU21V,pt,[],['https://www.ecodebate.com.br/2021/01/28/periodo-de-queimadas-na-amazonia-tem-28-mil-hospitalizacoes-por-problemas-respiratorios/'],[],0,2,1,[],[],https://twitter.com/ecodebate/status/1354766183736741894,False,,0,,,,,,,,[],,,,
1354761145127759878,1354761145127759878,2021-01-28 09:00:01 SA Eastern Standard Time,2021-01-28,09:00:01,-0300,1285978765907111936,canalreload,Canal Reload,,"O povo Guató viu de perto os estragos que as queimadas causaram ano passado no Pantanal mato-grossense. Segundo infos da @amazonia_real, eles perderam 92% de seu território para o fogo.  #DáUmReload: saiba como está a rotina pós-queimadas!  #MeioAmbiente #Pantanal #Guató  https://t.co/bEmqGWkmWX",pt,"[{'screen_name': 'amazonia_real', 'name': 'amazônia real', 'id': '2147700098'}]",[],[],0,2,7,"['dáumreload', 'meioambiente', 'pantanal', 'guató']",[],https://twitter.com/CanalReload/status/1354761145127759878,False,,1,https://pbs.twimg.com/amplify_video_thumb/1354150395434721288/img/PxBNRrAUxbRG3FYz.jpg,,,,,,,[],,,,
1354761088076832768,1354761088076832768,2021-01-28 08:59:48 SA Eastern Standard Time,2021-01-28,08:59:48,-0300,273513557,combateracismo,Combate Racismo,,"Com coronavírus, período de queimadas na Amazônia tem 28 mil hospitalizações por problemas respiratórios   https://t.co/cFG0SonVOm @agenciapublica  https://t.co/9TdiSIumMp",pt,"[{'screen_name': 'agenciapublica', 'name': 'agência pública', 'id': '310497473'}]",['https://racismoambiental.net.br/2021/01/28/com-coronavirus-periodo-de-queimadas-na-amazonia-tem-28-mil-hospitalizacoes-por-problemas-respiratorios-2/'],['https://pbs.twimg.com/media/Es0T-fmXIAEknu3.jpg'],0,0,0,[],[],https://twitter.com/combateracismo/status/1354761088076832768,False,,1,https://pbs.twimg.com/media/Es0T-fmXIAEknu3.jpg,,,,,,,[],,,,
1354757423752474624,1354754769592705028,2021-01-28 08:45:14 SA Eastern Standard Time,2021-01-28,08:45:14,-0300,1189230244072480768,aurea_akagoldie,Aurea,,"@regiham não sei se estou maluca, mas desde outubro (auge das queimadas no Pantanal e Amazônia) não tivemos mais que 5 dias de sol. Agradeço a temperatura que não foi infernal, mas onde está o verão? Onde está a luz do sol, onde as estrelas, a lua?",pt,[],[],[],1,0,1,[],[],https://twitter.com/Aurea_AKAGoldie/status/1354757423752474624,False,,0,,,,,,,,"[{'screen_name': 'regiham', 'name': '🇨🇺 Regi 🇩🇪 1⃣3⃣ 🌵🚩', 'id': '721727021517291520'}]",,,,
1354756083026440194,1354202205344198660,2021-01-28 08:39:55 SA Eastern Standard Time,2021-01-28,08:39:55,-0300,1113823890961203200,mariaraiol1,Maria Raiol,,@lcoutinho É explícito que o Macrom quer se apoderar da nossa Amazônia brasileira! Ele vem tentando tornar a Amazônia brasileira em Amazônia francesa! Governos anteriores tiveram queimadas maiores e governantes internacionais nunca se prontificaram com veemência!,pt,[],[],[],0,0,0,[],[],https://twitter.com/MariaRaiol1/status/1354756083026440194,False,,0,,,,,,,,"[{'screen_name': 'lcoutinho', 'name': 'Leonardo Coutinho', 'id': '38421891'}]",,,,
1354755117455732737,1354726739042299904,2021-01-28 08:36:04 SA Eastern Standard Time,2021-01-28,08:36:04,-0300,1298334109979246597,henriqu21896986,Henriquea,,@junh51 A oposição pula de galho em galho: Mariele; Intervenção na PF; Cloroquina; Queimadas na Amazônia; vacina; leite condensado..... Todos esses assuntos defendidos com vias de fato....durante uma semana. Como não se sustentam por não terem a força de denúncias de corrupção.....mimimi,pt,[],[],[],0,0,0,[],[],https://twitter.com/Henriqu21896986/status/1354755117455732737,False,,0,,,,,,,,"[{'screen_name': 'junh51', 'name': 'Sulista 🇧🇷🇧🇷🇧🇷', 'id': '818126533139296256'}]",,,,
1354752384896000001,1354418271261499395,2021-01-28 08:25:13 SA Eastern Standard Time,2021-01-28,08:25:13,-0300,1105374573825089536,almeidacarolp,Ana Carolina,,"@danibacedo Quer acabar com qualquer tipo de divulgação de dados no governo. Quis ocultar informações das queimadas na Amazônia, quer calar a imprensa... estamos na mão de um ditador. Por puco tempo, assim espero!",pt,[],[],[],0,1,3,[],[],https://twitter.com/almeidacarolp/status/1354752384896000001,False,,0,,,,,,,,"[{'screen_name': 'danibacedo', 'name': 'Dani Bah', 'id': '201718418'}]",,,,
1354735746683432962,1354735746683432962,2021-01-28 07:19:06 SA Eastern Standard Time,2021-01-28,07:19:06,-0300,525756961,brasangola_,Brasangola_,,"Com coronavírus, período de queimadas na Amazônia tem 28 mil hospitalizações por problemas respiratórios   https://t.co/L0jmc4GWjD",pt,[],['https://brasdangola.wordpress.com/2021/01/28/com-coronavirus-periodo-de-queimadas-na-amazonia-tem-28-mil-hospitalizacoes-por-problemas-respiratorios/'],[],0,1,1,[],[],https://twitter.com/Brasangola_/status/1354735746683432962,False,,0,,,,,,,,[],,,,
1354729936091820032,1354412116694937600,2021-01-28 06:56:01 SA Eastern Standard Time,2021-01-28,06:56:01,-0300,166693482,esamorim,EDUARDO AMORIM,,"@AliceLMachado Pra quem não quer entender realmente é difícil. O maior custo se deve as forças armadas ao qual são totalmente dependentes da comida do rancho, aproximadamente 400 mil honens...O exército foi usado em diversas manobras na Amazônia com queimadas e em construções pelo país.",pt,[],[],[],1,0,0,[],[],https://twitter.com/ESAMORIM/status/1354729936091820032,False,,0,,,,,,,,[],,,,
1354668207043440642,1354668207043440642,2021-01-28 02:50:43 SA Eastern Standard Time,2021-01-28,02:50:43,-0300,941186815431725057,lksillva07,Lk.,,o que me deixa mais puto é saber que todo esse calor é reflexo das queimadas e desmatamentos na Amazônia !,pt,[],[],[],0,0,0,[],[],https://twitter.com/lksillva07/status/1354668207043440642,False,,0,,,,,,,,[],,,,
1354619394584932352,1354619394584932352,2021-01-27 23:36:45 SA Eastern Standard Time,2021-01-27,23:36:45,-0300,1204301854433316866,domingosnoguei7,🚩🚩Domingos Nogueira🚩🚩,,"Agência Pública: Com coronavírus, período de queimadas na Amazônia tem 28 mil hospitalizações por problemas respiratórios.  https://t.co/57jDZTlT7b  via @GoogleNews",pt,"[{'screen_name': 'googlenews', 'name': 'google news', 'id': '33584794'}]",['https://apublica.org/2021/01/com-coronavirus-periodo-de-queimadas-na-amazonia-tem-28-mil-hospitalizacoes-por-problemas-respiratorios/'],[],0,0,0,[],[],https://twitter.com/DomingosNoguei7/status/1354619394584932352,False,,0,,,,,,,,[],,,,
1354604956037357572,1354596691727560704,2021-01-27 22:39:23 SA Eastern Standard Time,2021-01-27,22:39:23,-0300,150409699,gugachu,Nolf,,"@xpcassio Ele falou também que tão usando a amazônia pra produção de cocaína, e que as queimadas é quando tem que destruir uma fábrica pq estavam perto de descobrir.  Povo doido, eu hein",pt,[],[],[],0,0,1,[],[],https://twitter.com/Gugachu/status/1354604956037357572,False,,0,,,,,,,,"[{'screen_name': 'xpcassio', 'name': 'Cássio N.', 'id': '126528899'}]",,,,
1354585166648397824,1354585145769041922,2021-01-27 21:20:45 SA Eastern Standard Time,2021-01-27,21:20:45,-0300,3589345337,vanecosta10,A Eng. Florestal do YouTube 🌳,,"o Ibama e o ICMBio tiveram seus orçamentos reduzidos, o que comprometeu a capacidade de o governo realizar ações estruturais de proteção, fiscalização e combate do desmatamento nas florestas nacionais – a Amazônia registrou volume recorde de queimadas no ano passado.",pt,[],[],[],0,2,12,[],[],https://twitter.com/vanecosta10/status/1354585166648397824,False,,0,,,,,,,,[],,,,
1354578168619925506,1354486035363864582,2021-01-27 20:52:56 SA Eastern Standard Time,2021-01-27,20:52:56,-0300,42214962,lsantanna,Lourival Sant'Anna,,"Entre essas 17 está a Agência Nacional de Inteligência Geospacial, que se dedica a interpretar imagens de satélites. Espere eventuais contestações públicas do governo americano aos dados do governo Bolsonaro sobre queimadas na Amazônia.",pt,[],[],[],2,1,24,[],[],https://twitter.com/lsantanna/status/1354578168619925506,False,,0,,,,,,,,[],,,,
1354566115192688642,1354566115192688642,2021-01-27 20:05:03 SA Eastern Standard Time,2021-01-27,20:05:03,-0300,51199592,djairgalvao,Djair Galvão,,"Com coronavírus, período de queimadas na Amazônia tem 28 mil hospitalizações por problemas respiratórios |  https://t.co/O1ox3v9Qo9 via @agenciapublica",pt,"[{'screen_name': 'agenciapublica', 'name': 'agência pública', 'id': '310497473'}]",['https://apublica.org/2021/01/com-coronavirus-periodo-de-queimadas-na-amazonia-tem-28-mil-hospitalizacoes-por-problemas-respiratorios/#.YBHxhYbPqhg.twitter'],[],0,0,2,[],[],https://twitter.com/djairgalvao/status/1354566115192688642,False,,0,,,,,,,,[],,,,
1354560600026832896,1354560600026832896,2021-01-27 19:43:08 SA Eastern Standard Time,2021-01-27,19:43:08,-0300,611864329,goyzuet4,Verónica Goyzueta,,Aumento de queimadas e desmatamento durante pandemia estão na conta do colapso da saúde na Amazônia. Durante queimadas e com COVID19 houve 28 mil internações por problemas respiratórios. Reportagem @agenciapublica com apoio do @Amazon_RJF e @pulitzercenter  https://t.co/zgWRYu1QCG,pt,"[{'screen_name': 'agenciapublica', 'name': 'agência pública', 'id': '310497473'}, {'screen_name': 'amazon_rjf', 'name': 'amazon rjf', 'id': '1266398859510665220'}, {'screen_name': 'pulitzercenter', 'name': 'pulitzer center', 'id': '23965121'}]",['https://apublica.org/2021/01/com-coronavirus-periodo-de-queimadas-na-amazonia-tem-28-mil-hospitalizacoes-por-problemas-respiratorios/#.YBHqUPcrvak.twitter'],[],0,4,7,[],[],https://twitter.com/Goyzuet4/status/1354560600026832896,False,,0,,,,,,,,[],,,,
1354552780883636237,1354552780883636237,2021-01-27 19:12:03 SA Eastern Standard Time,2021-01-27,19:12:03,-0300,761617378350362624,cabanadapoesia,MAGO DAS PALAVRAS: #Vacinado #SUS,,"@GeneralMourao O general mente sobre o desempenho do Brasil em relação ao meio ambiente.  Bolsonaro esta devastando a Amazônia com sua política extrativista, cortou verbas.  As queimadas aumentaram sob este governo. #MourãoMente",pt,[],[],[],0,0,0,['mourãomente'],[],https://twitter.com/CabanadaPoesia/status/1354552780883636237,False,,0,,,,,,,,[],,,,
1354551151480475651,1354551151480475651,2021-01-27 19:05:35 SA Eastern Standard Time,2021-01-27,19:05:35,-0300,33615996,ptribeirao,Rede PT (Partidos dos Trabalhadores),,"Com coronavírus, período de queimadas na Amazônia tem 28 mil hospitalizações por problemas respiratórios - Núcleo Luciano Lepera | Rede PT -  https://t.co/MW2dFPiFMi  #PTRibeirao #ForaBolsonaro #AnulaSTF #LulaLivre  https://t.co/HkzI4nG7Ay",pt,[],['https://nucleolucianolepera.com.br/index.php/2021/01/27/com-coronavirus-periodo-de-queimadas-na-amazonia-tem-28-mil-hospitalizacoes-por-problemas-respiratorios/'],['https://pbs.twimg.com/media/EsxVGCAXAAUcUxa.png'],0,0,0,"['ptribeirao', 'forabolsonaro', 'anulastf', 'lulalivre']",[],https://twitter.com/ptribeirao/status/1354551151480475651,False,,1,https://pbs.twimg.com/media/EsxVGCAXAAUcUxa.png,,,,,,,[],,,,
1354549351540994055,1354549351540994055,2021-01-27 18:58:26 SA Eastern Standard Time,2021-01-27,18:58:26,-0300,117158045,biancamuniz__,Bianca,,"Nessa série de reportagens da @agenciapublica mostramos os impactos da sobreposição da pandemia com as queimadas na Amazônia. Dificuldade de diagnóstico, falta de atendimento e piora no quadro de saúde foram alguns dos problemas resultantes desse cenário",pt,"[{'screen_name': 'agenciapublica', 'name': 'agência pública', 'id': '310497473'}]",[],[],1,2,11,[],[],https://twitter.com/biancamuniz__/status/1354549351540994055,False,https://twitter.com/agenciapublica/status/1354480360994852864,0,,,,,,,,[],,,,
1354541342861488138,1354533382328377344,2021-01-27 18:26:36 SA Eastern Standard Time,2021-01-27,18:26:36,-0300,1204722916467888130,gestor_de_risco,Portal da Gestão de Riscos,,"@GeneralMourao @wef O @GeneralMourao é pragmático. As queimadas, principal foco de atenção na Amazônia, não geram impacto econômico real. É hora de tratar de outros temas da região. https://t.co/MqPm1EyL8i",pt,"[{'screen_name': 'generalmourao', 'name': 'general hamilton mourão', 'id': '1058819604741525510'}]",['https://youtu.be/RBRTWSZ8O3E'],[],0,0,0,[],[],https://twitter.com/gestor_de_risco/status/1354541342861488138,False,,0,,,,,,,,"[{'screen_name': 'GeneralMourao', 'name': 'General Hamilton Mourão', 'id': '1058819604741525510'}, {'screen_name': 'wef', 'name': 'World Economic Forum', 'id': '5120691'}]",,,,
1354527981256003589,1354527977820848130,2021-01-27 17:33:31 SA Eastern Standard Time,2021-01-27,17:33:31,-0300,18869830,thiago_domenici,Thiago Domenici,,"A segunda, mostramos como no Acre, os infectados com Covid-19 pioraram por conta da densa fumaça que invadiu o estado que mais sofreu com queimadas em 2020 em toda a Amazônia Legal",pt,[],[],[],1,0,15,[],[],https://twitter.com/thiago_domenici/status/1354527981256003589,False,,0,,,,,,,,[],,,,
1354527979406123009,1354527977820848130,2021-01-27 17:33:30 SA Eastern Standard Time,2021-01-27,17:33:30,-0300,18869830,thiago_domenici,Thiago Domenici,,"São três reportagens: a primeira, traz um levantamento inédito que revela que os incêndios não só bateram recorde mas dificultaram o diagnóstico de Covid-19 no ano que marcou a trágica combinação de queimadas e pandemia na Amazônia",pt,[],[],[],1,0,15,[],[],https://twitter.com/thiago_domenici/status/1354527979406123009,False,,0,,,,,,,,[],,,,
1354527977820848130,1354527977820848130,2021-01-27 17:33:30 SA Eastern Standard Time,2021-01-27,17:33:30,-0300,18869830,thiago_domenici,Thiago Domenici,,"Lançamos hoje um trabalho de investigação da @agenciapublica: Amazônia Irrespirável. Com apoio do Amazon Rainforest Journalism Fund (@Amazon_RJF) em parceria com o @pulitzercenter, revelamos como o impacto da fumaça das queimadas se relaciona com a crise de saúde pela Covid-19",pt,"[{'screen_name': 'agenciapublica', 'name': 'agência pública', 'id': '310497473'}, {'screen_name': 'amazon_rjf', 'name': 'amazon rjf', 'id': '1266398859510665220'}, {'screen_name': 'pulitzercenter', 'name': 'pulitzer center', 'id': '23965121'}]",[],[],3,20,104,[],[],https://twitter.com/thiago_domenici/status/1354527977820848130,False,,0,,,,,,,,[],,,,
1354527737483059202,1354527737483059202,2021-01-27 17:32:33 SA Eastern Standard Time,2021-01-27,17:32:33,-0300,46280190,juliadolce_,Julia Dolce,,"Amazônia Irrespirável, série de reportagens que revela como o impacto da fumaça das queimadas associadas ao desmatamento se relaciona c/ a crise de saúde causada pela pandemia, foi publicada hj +  https://t.co/RsKz1ZB3rU",pt,[],['https://apublica.org/especial/amazonia-irrespiravel/'],[],1,2,11,[],[],https://twitter.com/JuliaDolce_/status/1354527737483059202,False,,0,,,,,,,,[],,,,
1354525832585375744,1354525832585375744,2021-01-27 17:24:59 SA Eastern Standard Time,2021-01-27,17:24:59,-0300,886347927840489473,arquivoimprensa,Arquivo da Imprensa,,"RETROSPECTO DA AGENDA 2020 Temas de setembro (9) Rubens Ometto, Estadão   Brasil tem a matriz energética mais limpa do mundo. Não podemos entrar nessa armadilha de dizer que nosso País está poluindo tudo com as queimadas da Amazônia. É preciso contra-atacar: Amazônia vale ouro  https://t.co/GGxCFgxTNL",pt,[],[],['https://pbs.twimg.com/media/Esw-Cb5XMAc_5El.jpg'],0,0,0,[],[],https://twitter.com/Arquivoimprensa/status/1354525832585375744,False,,1,https://pbs.twimg.com/media/Esw-Cb5XMAc_5El.jpg,,,,,,,[],,,,
1354516653946626049,1354516653946626049,2021-01-27 16:48:30 SA Eastern Standard Time,2021-01-27,16:48:30,-0300,273513557,combateracismo,Combate Racismo,,"Com coronavírus, período de queimadas na Amazônia tem 28 mil hospitalizações por problemas respiratórios   https://t.co/QqBUIO84AW  https://t.co/hQ0DbsCTRR",pt,[],['https://racismoambiental.net.br/2021/01/27/com-coronavirus-periodo-de-queimadas-na-amazonia-tem-28-mil-hospitalizacoes-por-problemas-respiratorios/@agenciapublica'],['https://pbs.twimg.com/media/Esw1nltXAAMJOhr.png'],0,0,1,[],[],https://twitter.com/combateracismo/status/1354516653946626049,False,,1,https://pbs.twimg.com/media/Esw1nltXAAMJOhr.png,,,,,,,[],,,,
1354513842282393600,1354513842282393600,2021-01-27 16:37:20 SA Eastern Standard Time,2021-01-27,16:37:20,-0300,3057413631,erudnitzki,Ethel Rudnitzki,,"A Amazônia – tida como o pulmão do planeta – está irrespirável.  Primeiro foram as queimadas, cada vez mais intensas. Aí veio a covid-19.  Nova série de reportagens da @agenciapublica mostra os efeitos das duas crises na região:  https://t.co/D5K0zTZWSR",pt,"[{'screen_name': 'agenciapublica', 'name': 'agência pública', 'id': '310497473'}]",['https://apublica.org/especial/amazonia-irrespiravel/'],[],0,0,0,[],[],https://twitter.com/ERudnitzki/status/1354513842282393600,False,,0,,,,,,,,[],,,,
1354507126807396359,1354507126807396359,2021-01-27 16:10:39 SA Eastern Standard Time,2021-01-27,16:10:39,-0300,57159372,arquiberlula13,Bernardete Aguiar❤🚩❤,,"Fumaça de ...queimadas na amazônia?  Mourão afirma que notícias sobre gastos do governo com alimentos é ""pura fumaça""   https://t.co/X0hvguOcH5",pt,[],['https://noticias.uol.com.br/ultimas-noticias/agencia-estado/2021/01/27/mourao-afirma-que-noticias-sobre-gastos-do-governo-com-alimentos-e-pura-fumaca.amp.htm#click=https://t.co/wfEZjofIJe'],[],0,0,0,[],[],https://twitter.com/arquiberlula13/status/1354507126807396359,False,,0,,,,,,,,[],,,,
1354506607896506370,1354506607896506370,2021-01-27 16:08:35 SA Eastern Standard Time,2021-01-27,16:08:35,-0300,49825011,oficialjbr,Jornal de Brasília,,"O vice-presidente citou ainda a Operação Verde Brasil 2, das Forças Armadas, para combater o desmatamento e as queimadas na Amazônia   https://t.co/tXnpLQihGW",pt,[],['https://bit.ly/3qQMXBM'],[],0,0,3,[],[],https://twitter.com/OficialJBr/status/1354506607896506370,False,,0,,,,,,,,[],,,,
1354505767362179073,1354505767362179073,2021-01-27 16:05:15 SA Eastern Standard Time,2021-01-27,16:05:15,-0300,14311308,ig,Portal iG,,Infectados com o novo coronavírus pioraram por conta da densa fumaça que invadiu o estado que mais sofreu com queimadas em 2020 em toda a Amazônia Legal. #PortaliG    https://t.co/NLS6114pLD,pt,[],['https://ultimosegundo.ig.com.br/2021-01-27/no-acre-as-queimadas-agravam-sintomas-da-covid-19.html'],[],1,1,5,['portalig'],[],https://twitter.com/iG/status/1354505767362179073,False,,0,,,,,,,,[],,,,
1354504447586537473,1354504447586537473,2021-01-27 16:00:00 SA Eastern Standard Time,2021-01-27,16:00:00,-0300,310497473,agenciapublica,Agência Pública,,"Qual a relação entre a Covid-19 e as queimadas na Amazônia? Uma tragédia intensificou a outra: no Acre, infectados pelo vírus pioraram por conta da densa fumaça que invadiu o estado que mais sofreu.  https://t.co/Sgb8Cmbfk2",pt,[],['https://agen.pub/yS'],[],0,18,45,[],[],https://twitter.com/agenciapublica/status/1354504447586537473,False,,0,,,,,,,,[],,,,
1354503308833153028,1354500685354721282,2021-01-27 15:55:28 SA Eastern Standard Time,2021-01-27,15:55:28,-0300,1354080591013171200,semfluxo,MurLo,,"@JoaoBANatal Além de que o Bolsonaro por enquanto foi um dos mais burros, primeiro ele é homofóbico, dps machista, escroto, cagou pras queimadas na amazônia, quase cortou comércio com os Estados Unidos, pago pau pro Trump, cagou pra Manaus, não aprova o #auxilioemergencial",pt,[],[],[],0,0,1,['auxilioemergencial'],[],https://twitter.com/SemFluxo/status/1354503308833153028,False,,0,,,,,,,,"[{'screen_name': 'JoaoBANatal', 'name': 'Joāo Batista Natal', 'id': '229903460'}]",,,,
1354502681650483204,1354502681650483204,2021-01-27 15:52:59 SA Eastern Standard Time,2021-01-27,15:52:59,-0300,972608916348645377,fabiopf08fabio,fabio paiva fagundes,,"Com coronavírus, período de queimadas na Amazônia tem 28 mil hospitalizações por problemas respiratórios | por @obrunofonseca, @brafajor  https://t.co/0YZhIBP5nQ via @agenciapublica",pt,"[{'screen_name': 'obrunofonseca', 'name': 'bruno fonseca', 'id': '90985954'}, {'screen_name': 'brafajor', 'name': 'rafael oliveira', 'id': '1095076334685118465'}, {'screen_name': 'agenciapublica', 'name': 'agência pública', 'id': '310497473'}]",['https://apublica.org/2021/01/com-coronavirus-periodo-de-queimadas-na-amazonia-tem-28-mil-hospitalizacoes-por-problemas-respiratorios/#.YBG2h5czadM.twitter'],[],0,0,3,[],[],https://twitter.com/Fabiopf08Fabio/status/1354502681650483204,False,,0,,,,,,,,[],,,,
1354501348876840960,1354499735609081857,2021-01-27 15:47:41 SA Eastern Standard Time,2021-01-27,15:47:41,-0300,1351207411256844288,teco04066564,fabiano,,@CNNBrasil Ele não consegue enxergar a fumaça das queimadas na Amazônia mesmo sendo responsável quem dirá enxergar a roubalheira do governo,pt,[],[],[],0,0,0,[],[],https://twitter.com/Teco04066564/status/1354501348876840960,False,,0,,,,,,,,"[{'screen_name': 'CNNBrasil', 'name': 'CNN Brasil', 'id': '809124436880322561'}]",,,,
1354497512602791937,1354497512602791937,2021-01-27 15:32:27 SA Eastern Standard Time,2021-01-27,15:32:27,-0300,159570732,redecastorphoto,Castor Filho,,"Com coronavírus, período de queimadas na Amazônia tem 28 mil hospitalizações por problemas respiratórios | por @obrunofonseca, @brafajor  https://t.co/xj6XQ5IjsR via @agenciapublica",pt,"[{'screen_name': 'obrunofonseca', 'name': 'bruno fonseca', 'id': '90985954'}, {'screen_name': 'brafajor', 'name': 'rafael oliveira', 'id': '1095076334685118465'}, {'screen_name': 'agenciapublica', 'name': 'agência pública', 'id': '310497473'}]",['https://apublica.org/2021/01/com-coronavirus-periodo-de-queimadas-na-amazonia-tem-28-mil-hospitalizacoes-por-problemas-respiratorios/#.YBGxto_R6R8.twitter'],[],0,0,1,[],[],https://twitter.com/redecastorphoto/status/1354497512602791937,False,,0,,,,,,,,[],,,,
1354497148956659715,1354487775144378372,2021-01-27 15:31:00 SA Eastern Standard Time,2021-01-27,15:31:00,-0300,138492825,proindio,Comissão Pró-Índio,,@agenciapublica Amazônia Irrespirável | Acre: Infectados com Covid-19 pioraram por conta da densa fumaça que invadiu o estado que mais sofreu com #queimadas em 2020 em toda a #Amazônia Legal. Via @agenciapublica   https://t.co/vSHbELgHqf,pt,"[{'screen_name': 'agenciapublica', 'name': 'agência pública', 'id': '310497473'}]",['https://apublica.org/2021/01/acre-nao-era-so-tosse-das-queimadas-era-covid-19/'],[],0,6,6,"['queimadas', 'amazônia']",[],https://twitter.com/proindio/status/1354497148956659715,False,,0,,,,,,,,"[{'screen_name': 'agenciapublica', 'name': 'Agência Pública', 'id': '310497473'}]",,,,
1354495565099315209,1354493122156220416,2021-01-27 15:24:42 SA Eastern Standard Time,2021-01-27,15:24:42,-0300,58222674,liciomaximo,LMD 🐊,,@GloboNews Fumaça igual à das queimadas da Amazônia e do Pantanal. Está certo o @GeneralMourao. Nós devemos ser os burros e ele o espertalhão.,pt,"[{'screen_name': 'generalmourao', 'name': 'general hamilton mourão', 'id': '1058819604741525510'}]",[],[],0,0,2,[],[],https://twitter.com/LicioMaximo/status/1354495565099315209,False,,0,,,,,,,,"[{'screen_name': 'GloboNews', 'name': 'GloboNews', 'id': '142393421'}]",,,,
1354495013242232845,1354495013242232845,2021-01-27 15:22:31 SA Eastern Standard Time,2021-01-27,15:22:31,-0300,4765138141,draomcqueen,Pedro Ribeiro Nogueira,,Excelente levantamento feito em cima de notícias horríveis. Como as queimadas na amazônia estão afetando a saúde respiratória das populações. Ainda mais numa época de pandemia.,pt,[],[],[],0,0,2,[],[],https://twitter.com/draomcqueen/status/1354495013242232845,False,https://twitter.com/obrunofonseca/status/1354484108680953861,0,,,,,,,,[],,,,
1354494362944761859,1354494362944761859,2021-01-27 15:19:56 SA Eastern Standard Time,2021-01-27,15:19:56,-0300,2147700098,amazonia_real,Amazônia Real,,O povo Guató foi muito afetado pelas queimadas no ano passado. Veja o vídeo e saiba o que mudou desde os incêndios que consumiram 92% do território indígena.  #SOSPantanal #Guató #Queimadas,pt,[],[],[],0,9,27,"['sospantanal', 'guató', 'queimadas']",[],https://twitter.com/amazonia_real/status/1354494362944761859,False,https://twitter.com/CanalReload/status/1354413854277521408,0,,,,,,,,[],,,,
1354493179295367168,1354487775144378372,2021-01-27 15:15:13 SA Eastern Standard Time,2021-01-27,15:15:13,-0300,138492825,proindio,Comissão Pró-Índio,,Amazônia Irrespirável | Levantamento inédito revela que os #incêndios não só bateram recorde mas dificultaram o diagnóstico de Covid-19 no ano que marcou a trágica combinação de #queimadas e pandemia na #Amazônia. Via @agenciapublica   https://t.co/52CeTyMuR0,pt,"[{'screen_name': 'agenciapublica', 'name': 'agência pública', 'id': '310497473'}]",['https://apublica.org/2021/01/com-coronavirus-periodo-de-queimadas-na-amazonia-tem-28-mil-hospitalizacoes-por-problemas-respiratorios/'],[],1,10,16,"['incêndios', 'queimadas', 'amazônia']",[],https://twitter.com/proindio/status/1354493179295367168,False,,0,,,,,,,,[],,,,
