id,conversation_id,created_at,date,time,timezone,user_id,username,name,place,tweet,language,mentions,urls,photos,replies_count,retweets_count,likes_count,hashtags,cashtags,link,retweet,quote_url,video,thumbnail,near,geo,source,user_rt_id,user_rt,retweet_id,reply_to,retweet_date,translate,trans_src,trans_dest
1367611048535154693,1367611047163678724,2021-03-04 20:00:57 SA Eastern Standard Time,2021-03-04,20:00:57,-0300,919993667850555393,call_suporte,Carlos Alberto,,"Para muitos isso não é novidade, é o início de uma nova campanha para tirar a AMAZÔNIA do BRASIL, isso vem sendo preparado a algum tempo, recordemos as girafas, os elefantes, os pandas mortos pelas queimadas do NEROSONARO. Recordemos os ataques feitos pelo ...",pt,[],[],[],1,1,10,[],[],https://twitter.com/call_suporte/status/1367611048535154693,False,,0,,,,,,,,[],,,,
1367601354848542725,1367601354848542725,2021-03-04 19:22:26 SA Eastern Standard Time,2021-03-04,19:22:26,-0300,1258975099300065280,blumarcheliss,bluníssima,,"ô satélite lindo, amazônia 1, fica de olho nas queimadas, hem! bebê lindo! 😍 #amazônia1",pt,[],[],[],0,0,0,['amazônia1'],[],https://twitter.com/blumarcheliss/status/1367601354848542725,False,,0,,,,,,,,[],,,,
1367548849817071618,1367548813074984966,2021-03-04 15:53:48 SA Eastern Standard Time,2021-03-04,15:53:48,-0300,963422957514215429,pastelcommel,beti boiola 👀,,Só lembro quando o céu ficou preto a tarde por causa das queimadas na Amazônia em 2019 e veio ator tipo Leonardo DiCaprio que é um dos meus atores favoritos postando foto de 2015 pra fazer protesto. Gente.... eles não tão nem ai.,pt,[],[],[],0,0,0,[],[],https://twitter.com/pastelcommel/status/1367548849817071618,False,,0,,,,,,,,[],,,,
1367513094109413378,1367512674003783681,2021-03-04 13:31:43 SA Eastern Standard Time,2021-03-04,13:31:43,-0300,1255175806034284545,crfbolso,Prof. Cabeça 🇧🇷🤖,,@Fernand13778677 Aí até as queimadas da amazônia passariam a ser acidentes naturais.,pt,[],[],[],1,0,1,[],[],https://twitter.com/CrfBolso/status/1367513094109413378,False,,0,,,,,,,,"[{'screen_name': 'Fernand13778677', 'name': 'FERNANDA', 'id': '1034149555577741322'}]",,,,
1367509409316888577,1367495345899524096,2021-03-04 13:17:04 SA Eastern Standard Time,2021-03-04,13:17:04,-0300,1224119835677921281,faizer2021,(RE)Existente,,@fiscaldoibama @MargotBM13 Só fico me perguntando pq as queimadas na Amazônia não podem ser transferidas pra BRASÍLIA? Ratos fogem do fogo,pt,[],[],[],0,0,2,[],[],https://twitter.com/faizer2021/status/1367509409316888577,False,,0,,,,,,,,"[{'screen_name': 'fiscaldoibama', 'name': 'O FISCAL do IBAMA', 'id': '3355746328'}, {'screen_name': 'MargotBM13', 'name': 'Historiadora sem fronteiras📚♻🌱🐾😷', 'id': '1123983261376688129'}]",,,,
1367465099338936327,1366924010643222529,2021-03-04 10:21:00 SA Eastern Standard Time,2021-03-04,10:21:00,-0300,1352344534651383811,dos_ayme,🌌,,"@_n3wson @lanatomia @_thearcanist Militante chata? O Brasil todo falando q ""a variante é de de Manaus "" a gente sofrendo xenofobia e vcs nem tchum p gente pq o norte é literalmente excluído. Quando a Amazônia sofria com queimadas o Brasil só foi se importar quando o céu de SP ficou preto, quando atingiu vcs.",pt,[],[],[],2,0,0,[],[],https://twitter.com/dos_ayme/status/1367465099338936327,False,,0,,,,,,,,"[{'screen_name': '_n3wson', 'name': 'Nil', 'id': '1174001902134185984'}, {'screen_name': 'lanatomia', 'name': 'red tv do sus', 'id': '40714457'}, {'screen_name': '_thearcanist', 'name': 'Edu 🌈', 'id': '1233923735205351424'}]",,,,
1367418234744537088,1367418234744537088,2021-03-04 07:14:47 SA Eastern Standard Time,2021-03-04,07:14:47,-0300,1083288489595146242,paclucas1,Agiota do amor,,"É muito engraçado o Beto Geballi fazendo publicidade na rádio   ""Então, novos relatórios estão dizendo que as queimadas na Amazônia estão em alta de novo, mas sabe o que você pode fazer pra evitar isso? A contra chama é a melhor opção de extintores para sua empresa"" kkkkkk",pt,[],[],[],0,0,2,[],[],https://twitter.com/Paclucas1/status/1367418234744537088,False,,0,,,,,,,,[],,,,
1367402561259646976,1367402561259646976,2021-03-04 06:12:30 SA Eastern Standard Time,2021-03-04,06:12:30,-0300,231599678,leo_koury,Leonardo Koury,,"Estar vivo se banalizou. Não só as mortes por COVID19, mas pela forma que lidamos com as queimadas no Pantanal e na Amazônia. Com a perda do nosso bioma. Para a economia capitalista só valemos enquanto damos lucro!  É necessário outra ordem de sociedade. Quando? Já!",pt,[],[],[],1,119,661,[],[],https://twitter.com/leo_koury/status/1367402561259646976,False,,0,,,,,,,,[],,,,
1367395624526700547,1367395624526700547,2021-03-04 05:44:56 SA Eastern Standard Time,2021-03-04,05:44:56,-0300,858949787869216768,meliconecta,Meli Conecta,,Dupla tragédia na Amazônia: Pandemia e Queimadas Via @agenciapublica   https://t.co/56TRz2mjLa,pt,"[{'screen_name': 'agenciapublica', 'name': 'agência pública', 'id': '310497473'}]",['https://www.youtube.com/watch?v=N5e399JuQmE'],[],0,0,1,[],[],https://twitter.com/MeliConecta/status/1367395624526700547,False,,0,,,,,,,,[],,,,
1367373095577804803,1367245810602180615,2021-03-04 04:15:25 SA Eastern Standard Time,2021-03-04,04:15:25,-0300,1314304035088982016,poblanrj,Poblan,,"@taoquei1 @SenadorKajuru Rapidamente entrando no seu Twitter, me deparo com compartilhamentos do canal/site Oeste, o mesmo que fez uma fake news tosca, com uma montagem bem primária , sobre as queimadas na Amazônia. Você não se sente envergonhada não, ou a sua prepotência boksonarista requer tratamento?",pt,[],[],[],0,0,0,[],[],https://twitter.com/poblanrj/status/1367373095577804803,False,,0,,,,,,,,"[{'screen_name': 'taoquei1', 'name': 'TeAtualizei 🇧🇷👊🏻❤️', 'id': '1087259768'}, {'screen_name': 'SenadorKajuru', 'name': 'Senador Kajuru', 'id': '193441509'}]",,,,
1367286871747887106,1367153032471982084,2021-03-03 22:32:47 SA Eastern Standard Time,2021-03-03,22:32:47,-0300,1325671498779078657,joopedr14149006,João Pedro,,"@Kekw74745764 @BellacosaVagner @pinguimneh Verdade, pib não significa nada né kkkkk são as 250 mil mortes de covid e as queimadas na Amazônia que significa boa ^^",pt,[],[],[],2,0,0,[],[],https://twitter.com/JooPedr14149006/status/1367286871747887106,False,,0,,,,,,,,"[{'screen_name': 'Kekw74745764', 'name': 'Real Life Ron Swanson', 'id': '1350558095924211712'}, {'screen_name': 'BellacosaVagner', 'name': 'Vagner Bellacosa', 'id': '4092985179'}]",,,,
1367282286845173762,1367243541911457792,2021-03-03 22:14:34 SA Eastern Standard Time,2021-03-03,22:14:34,-0300,147807712,danielnainterne,Celsus Daniel,,"@rachel_delage @BHCar5 @DallasginReturn @allanldsantos @LRobertoBarroso Isso. Mas essa modalidade foi suspensa devido às queimadas da Amazônia, do Pantanal, da Califórnia, da Rússia e da Austrália provocadas pelo Bolsonauru.",pt,[],[],[],1,0,3,[],[],https://twitter.com/danielnainterne/status/1367282286845173762,False,,0,,,,,,,,"[{'screen_name': 'rachel_delage', 'name': 'Rachel Delage', 'id': '1246073184014815232'}, {'screen_name': 'BHCar5', 'name': 'BH Car', 'id': '1324876745955299328'}, {'screen_name': 'DallasginReturn', 'name': 'DallasGinghinniReturn', 'id': '1351932348967870464'}, {'screen_name': 'allanldsantos', 'name': 'Allan Dos Santos \uea00', 'id': '52048790'}, {'screen_name': 'LRobertoBarroso', 'name': 'Luís Roberto Barroso', 'id': '1248628200952827910'}]",,,,
1367271963161485325,1367271201396129798,2021-03-03 21:33:33 SA Eastern Standard Time,2021-03-03,21:33:33,-0300,2161305115,deliriosb2,∞ gypsia,,@Dudu Acho que é Satélite de monitoramento da Amazônia e monitoramento de chuvas e queimadas etc... acho q não afetará em nada já q o desgoverna caga pra isso,pt,[],[],[],0,0,0,[],[],https://twitter.com/DeliriosB2/status/1367271963161485325,False,,0,,,,,,,,"[{'screen_name': 'Dudu', 'name': 'Dudu Guimaraes', 'id': '116247695'}]",,,,
1367261082885185538,1367252891636031489,2021-03-03 20:50:19 SA Eastern Standard Time,2021-03-03,20:50:19,-0300,3366840777,amaralmachadof,🔴🔴Fábio Amaral Machado🔴🔴,,@PedroMottaB @ProletarioRS Daqui um tempo se não tomarmos conta da Amazónia acabando com as queimadas os norte americanos vão fazer a guerra pela Amazónia.,pt,[],[],[],0,0,1,[],[],https://twitter.com/AmaralmachadoF/status/1367261082885185538,False,,0,,,,,,,,"[{'screen_name': 'PedroMottaB', 'name': 'PedroMottadeBarros', 'id': '978030180584316929'}, {'screen_name': 'ProletarioRS', 'name': 'Proletario do rs ;) ☯️🎮 501°BE', 'id': '152601193'}]",,,,
1367213277583974405,1367213277583974405,2021-03-03 17:40:21 SA Eastern Standard Time,2021-03-03,17:40:21,-0300,2171053886,cartaamazonia,Carta Amazônia,,"A @agenciapublica divulgou uma animação que mostra como o recorde de queimadas na Amazônia em 2020 se relacionou com a pandemia, confundindo pacientes e profissionais de saúde. Foram quase 28 mil casos de pessoas c/ síndrome respiratória grave no período mais crítico de incêndios  https://t.co/dOZozIOMuw",pt,"[{'screen_name': 'agenciapublica', 'name': 'agência pública', 'id': '310497473'}]",[],[],0,2,2,[],[],https://twitter.com/cartaamazonia/status/1367213277583974405,False,,1,https://pbs.twimg.com/ext_tw_video_thumb/1367211049750036488/pu/img/oyaLUUo-KocDplnI.jpg,,,,,,,[],,,,
1367208596778479619,1367208596778479619,2021-03-03 17:21:45 SA Eastern Standard Time,2021-03-03,17:21:45,-0300,946558156938862597,uma_ampola,Hisoka mete gala,,(Leia isso e veja as fotos como se uma música triste tocasse ao fundo)  As queimadas aumentaram 473% na Amazônia só no início de 2021  https://t.co/yKRaXvi3OR,pt,[],[],"['https://pbs.twimg.com/media/EvlM8y2XUAcs-IO.jpg', 'https://pbs.twimg.com/media/EvlM9LmXAAQn9aP.jpg', 'https://pbs.twimg.com/media/EvlM9pqXIAYrRik.jpg', 'https://pbs.twimg.com/media/EvlM-KxXIAI2g81.jpg']",1,0,3,[],[],https://twitter.com/uma_ampola/status/1367208596778479619,False,,1,https://pbs.twimg.com/media/EvlM8y2XUAcs-IO.jpg,,,,,,,[],,,,
1367180654018977794,1367095728821198852,2021-03-03 15:30:43 SA Eastern Standard Time,2021-03-03,15:30:43,-0300,3955484056,m_rapaz,M. Rapaz,,"@Sofuckingzen @fatourgente Pior que prejudica: o satélite é um importante passo para o desenvolvimento nacional, bem como para o monitoramento contínuo de queimadas na Amazônia",pt,[],[],[],0,0,4,[],[],https://twitter.com/M_Rapaz/status/1367180654018977794,False,,0,,,,,,,,"[{'screen_name': 'sofuckingzen', 'name': 'fuckingzen', 'id': '1420376931820785667'}, {'screen_name': 'fatourgente', 'name': 'Siga @cafeurgente e @oprimeirocafe', 'id': '1261298367847694337'}]",,,,
1367169834027347970,1367141004726435841,2021-03-03 14:47:43 SA Eastern Standard Time,2021-03-03,14:47:43,-0300,149146026,douglasminas,Douglas 🇧🇷🇧🇷🇧🇷🇧🇷,,@pedrouliani @bbcbrasil para onde vai os impostos que ela paga ? Vem para o Brasil ? Quando tem queimadas na Amazonia ela ajuda com alguma coisa? Dentro de todos estes anos que houve queimadas no norte do país onde ela estava ? Porque não se pronuciou ? Somente agora que o norte do país importa?,pt,[],[],[],1,0,0,[],[],https://twitter.com/douglasminas/status/1367169834027347970,False,,0,,,,,,,,"[{'screen_name': 'pedrouliani', 'name': 'pedro com p', 'id': '998307114039816192'}, {'screen_name': 'bbcbrasil', 'name': 'BBC News Brasil', 'id': '790680'}]",,,,
1367166559106568196,1367166559106568196,2021-03-03 14:34:43 SA Eastern Standard Time,2021-03-03,14:34:43,-0300,49089646,senadorcidgomes,Cid Gomes,,Bolsonaro não encara nada. Transfere as culpas e terceiriza as causas. Foi sempre assim: no desmatamento da Amazônia; nas queimadas criminosas do Pantanal; no óleo derramado nas nossas praias e em inúmeras outras vezes.,pt,[],[],[],91,306,2919,[],[],https://twitter.com/senadorcidgomes/status/1367166559106568196,False,,0,,,,,,,,[],,,,
1367162788192354305,1367162788192354305,2021-03-03 14:19:44 SA Eastern Standard Time,2021-03-03,14:19:44,-0300,35317431,paulogbarreto,Paulo Barreto,,O chefe dele é o mais esforçado:  Bolsonaro diz que 'potencializou' queimadas por nova política para Amazônia... - Veja mais em  https://t.co/kx5grnKSiV,pt,[],['https://noticias.uol.com.br/internacional/ultimas-noticias/2019/10/30/bolsonaro-diz-que-potencializou-queimadas-por-nova-politica-para-amazonia.htm?cmpid=copiaecola'],[],0,0,1,[],[],https://twitter.com/paulogbarreto/status/1367162788192354305,False,https://twitter.com/correio/status/1366832623713202185,0,,,,,,,,[],,,,
1367148038951731201,1367148038951731201,2021-03-03 13:21:07 SA Eastern Standard Time,2021-03-03,13:21:07,-0300,74842999,imazon,Imazon,,"As queimadas descontroladas na Amazônia são conhecidas por devastarem as florestas e a biodiversidade, e suas plumas de fumaça e a destruição podem gerar impactos muito além da área de ocorrência direta dos incêndios florestais. +  https://t.co/RHSuXPFHvm",pt,[],[],['https://pbs.twimg.com/media/EvkV4-sXYAIBoEy.jpg'],1,1,13,[],[],https://twitter.com/Imazon/status/1367148038951731201,False,,1,https://pbs.twimg.com/media/EvkV4-sXYAIBoEy.jpg,,,,,,,[],,,,
1367109052254330886,1367074135424315398,2021-03-03 10:46:12 SA Eastern Standard Time,2021-03-03,10:46:12,-0300,860193309691703296,paramahansa2,🚩Paramahansa🚩🚩🚩🚩🚩🚩🚩🚩🚩,,"@Marcelodedois Vai piorar. E com crianças na escola, as doença sazonais respiratórias delas já entraram em campo...crianças sem oxigênio...As queimadas no Pantanal e Amazônia vão ter início ...povo sem dinheiro vendendo suas panelas na rua...",pt,[],[],[],0,0,0,[],[],https://twitter.com/Paramahansa2/status/1367109052254330886,False,,0,,,,,,,,"[{'screen_name': 'Marcelodedois', 'name': 'Marcelo D2', 'id': '78473551'}]",,,,
1367099676458115081,1367095728821198852,2021-03-03 10:08:57 SA Eastern Standard Time,2021-03-03,10:08:57,-0300,1033894968857960448,thiagod43378551,Cabra do sertão de Tatooine,,@fatourgente É uma referência as queimadas na Amazônia. Vocês não entendem nada de referência 😂😂😂,pt,[],[],[],0,0,3,[],[],https://twitter.com/ThiagoD43378551/status/1367099676458115081,False,,0,,,,,,,,"[{'screen_name': 'fatourgente', 'name': 'Siga @cafeurgente e @oprimeirocafe', 'id': '1261298367847694337'}]",,,,
1366947235926323207,1366939747625623557,2021-03-03 00:03:12 SA Eastern Standard Time,2021-03-03,00:03:12,-0300,2176894999,leandrog1914,Leandro,,"@henrik_oliveira @osuissinha e assim, concordo plenamente com vc.....mas, se observarmos o que estão fazendo com Amazônia, Mato Grosso, etc, com queimadas....vou reescrever o que vc disse: fudemos o planeta.....",pt,[],[],[],2,0,1,[],[],https://twitter.com/LeandroG1914/status/1366947235926323207,False,,0,,,,,,,,"[{'screen_name': 'henrik_oliveira', 'name': 'Henrik_Oliveira.go', 'id': '1943931'}, {'screen_name': 'osuissinha', 'name': 'Jobisvaldo', 'id': '1334517433458184194'}]",,,,
1366938543340273665,1366936892567126018,2021-03-02 23:28:39 SA Eastern Standard Time,2021-03-02,23:28:39,-0300,22823409,lineenaomi,pistoline,,@heeybells_ ah sim vdd   já já me culpam pelas queimadas da amazônia 🤧,pt,[],[],[],1,0,0,[],[],https://twitter.com/lineenaomi/status/1366938543340273665,False,,0,,,,,,,,"[{'screen_name': 'heeybells_', 'name': 'Béus', 'id': '50164197'}]",,,,
1366928828271124481,1366928828271124481,2021-03-02 22:50:03 SA Eastern Standard Time,2021-03-02,22:50:03,-0300,100247716,corneta_montec,Corneta Monte Cristo,,O tanto de plantas nesse BBB é pra compensar as Queimadas da Amazônia e Pantanal,pt,[],[],[],0,0,1,[],[],https://twitter.com/Corneta_MonteC/status/1366928828271124481,False,,0,,,,,,,,[],,,,
1366920747277553665,1366920747277553665,2021-03-02 22:17:56 SA Eastern Standard Time,2021-03-02,22:17:56,-0300,173618649,kaduclisboa,Kadu Lisboa,,Nunca vi um dinheiro rodar tanto.  Já foi para queimadas na Amazônia Já foi para compra de respiradores  Agora para vacinas  No final retornará como prêmio para os procuradores de lava jato,pt,[],[],[],0,0,1,[],[],https://twitter.com/kaduclisboa/status/1366920747277553665,False,https://twitter.com/Poder360/status/1366918718366883840,0,,,,,,,,[],,,,
1366913911694503936,1366898494934560772,2021-03-02 21:50:47 SA Eastern Standard Time,2021-03-02,21:50:47,-0300,28637470,lcdelpapa,Luís Del Papa,,"@lavieri @danilovara voce fala embargo de outros paises por conta das variantes e da maneira que o Bozo lida com a pandemia? Se for, SIM, iremos, ja estao falando cada vez mais por aqui. e tem ainda o lance do desmatamento e queimadas da Amazonia ne?",pt,[],[],[],1,0,0,[],[],https://twitter.com/lcdelpapa/status/1366913911694503936,False,,0,,,,,,,,"[{'screen_name': 'lavieri', 'name': 'Marcos Lavieri', 'id': '14665148'}, {'screen_name': 'danilovara', 'name': 'temmasacabou', 'id': '76770216'}]",,,,
1366897094011867143,1366892803331096576,2021-03-02 20:43:57 SA Eastern Standard Time,2021-03-02,20:43:57,-0300,2861509182,akridgeid,καμίλ,,@montalvao_anna miga depois q ela veio dizer p minha sala q as queimadas na amazonia eram naturais eu nunca mais vi ela c os mesmos olhoskkk,pt,[],[],[],1,0,1,[],[],https://twitter.com/akridgeid/status/1366897094011867143,False,,0,,,,,,,,[],,,,
1366889761152126978,1366758266630533126,2021-03-02 20:14:49 SA Eastern Standard Time,2021-03-02,20:14:49,-0300,428167378,almirgms,4° Survivor 7 de setembro pela Liberdade do Brasil,,"@dedearaujo967 @taoquei1 Eu achei q a gente ia falar de Flávio só na primavera, já é primavera ? Ainda falta passar pela Mariele franco, o Queiroz ainda e assunto? O tema queimadas da Amazônia e só no verão mesmo né?? Só pra eu ter certeza q eu perdi a noção das estações temáticas!",pt,[],[],[],0,0,0,[],[],https://twitter.com/almirgms/status/1366889761152126978,False,,0,,,,,,,,"[{'screen_name': 'dedearaujo967', 'name': 'Andre Luiz Rodrigues', 'id': '802658993760071681'}, {'screen_name': 'taoquei1', 'name': 'TeAtualizei 🇧🇷👊🏻❤️', 'id': '1087259768'}]",,,,
1366882434252431360,1366800067148083202,2021-03-02 19:45:42 SA Eastern Standard Time,2021-03-02,19:45:42,-0300,397614852,levi_de_melo,LeviLevi_original,,@JornalDaCidadeO Em 2018 Soros se reuniu c/o poste Haddad e FHC em Paris. Qual o tema?  Fundação de Soros fonancua ONG da Amazônia: começa a narrativa das queimadas.  Fundação de Soros doa $5mio p/ONG combater racismo: Surge „vidas negras e favelas importam“ e GloboEsporte começa narrativa diária,pt,[],[],[],0,2,4,[],[],https://twitter.com/Levi_de_melo/status/1366882434252431360,False,,0,,,,,,,,"[{'screen_name': 'JornalDaCidadeO', 'name': 'Jornal da Cidade Online', 'id': '994303120376303616'}]",,,,
1366873065158803458,1366873065158803458,2021-03-02 19:08:28 SA Eastern Standard Time,2021-03-02,19:08:28,-0300,194136351,fts44,RODRIGO FOX TANGO SIERRA,,Narrativa: INPE perde dinheiro e ciência é abandonada pelo governo para destruir a Amazônia.  Realidade: primeiro satélite fabricado pelo INPE é lançado para monitorar as queimadas e o desmatamento na Amazônia.   https://t.co/MLO0URkUs5,pt,[],['https://www.gazetadopovo.com.br/republica/breves/satelite-amazonia-1-e-lancado-ao-espaco-na-india/?fbclid=IwAR17qaIcqRUOlZs_tDTkNu-RDQxu0rFA3YIk7Kynmj8HvMoNCV6XcXNNsWI'],[],1,0,0,[],[],https://twitter.com/FTS44/status/1366873065158803458,False,,0,,,,,,,,[],,,,
1366860535258570756,1366860535258570756,2021-03-02 18:18:41 SA Eastern Standard Time,2021-03-02,18:18:41,-0300,115026859,pr_jorge1962,Jorge Rodrigues,,Será que alguém pode me dizer uma coisa: Tem alguma ONG da Amazônia comemorando o lançamento do satélite de monitoramento da Amazônia para queimadas e desmatamento?,pt,[],[],[],1,0,1,[],[],https://twitter.com/pr_jorge1962/status/1366860535258570756,False,,0,,,,,,,,[],,,,
1366857995410317313,1366857995410317313,2021-03-02 18:08:35 SA Eastern Standard Time,2021-03-02,18:08:35,-0300,1184916427893030914,informetrica1,Informetrica,,"No dia, a Amazônia teve 17 focos de queimadas e foi o bioma mais atingido. A cidade mais atingida foi ESPLANADA / BAHIA, localizada em Mata Atlântica, que registrou 4 focos de incêndio.",pt,[],[],[],1,0,0,[],[],https://twitter.com/Informetrica1/status/1366857995410317313,False,,0,,,,,,,,[],,,,
1366845542177918977,1366841657820332032,2021-03-02 17:19:06 SA Eastern Standard Time,2021-03-02,17:19:06,-0300,1106203776585744384,hebergomesnogu1,Heber Gomes Nogueira,,@Fernand81106422 @CarlaZambelli38 Estamos no Brasil e temos que cuidar de nossa casa. Exigir que outros tb cuidem da natureza com um presidente que incentivou queimadas na Amazônia ?,pt,[],[],[],1,0,0,[],[],https://twitter.com/HeberGomesNogu1/status/1366845542177918977,False,,0,,,,,,,,"[{'screen_name': 'Fernand81106422', 'name': 'Fernando Aguiar', 'id': '1171175305123454981'}, {'screen_name': 'CarlaZambelli38', 'name': 'Carla Zambelli', 'id': '975127727501185025'}]",,,,
1366842321506082823,1366841657820332032,2021-03-02 17:06:18 SA Eastern Standard Time,2021-03-02,17:06:18,-0300,1106203776585744384,hebergomesnogu1,Heber Gomes Nogueira,,"@CarlaZambelli38 Direito natural da floresta amazônica, dos índios que lá tentam sobreviver ? Não o borso incentiva as queimadas, a destruição da Amazônia.",pt,[],[],[],3,0,1,[],[],https://twitter.com/HeberGomesNogu1/status/1366842321506082823,False,,0,,,,,,,,"[{'screen_name': 'CarlaZambelli38', 'name': 'Carla Zambelli', 'id': '975127727501185025'}]",,,,
1366817556057755648,1366817556057755648,2021-03-02 15:27:54 SA Eastern Standard Time,2021-03-02,15:27:54,-0300,35317431,paulogbarreto,Paulo Barreto,,Com certeza!  Bolsonaro diz que 'potencializou' queimadas por nova política para Amazônia... - Veja mais em  https://t.co/kx5grnKSiV,pt,[],['https://noticias.uol.com.br/internacional/ultimas-noticias/2019/10/30/bolsonaro-diz-que-potencializou-queimadas-por-nova-politica-para-amazonia.htm?cmpid=copiaecola'],[],0,0,0,[],[],https://twitter.com/paulogbarreto/status/1366817556057755648,False,https://twitter.com/Poder360/status/1366810850376507399,0,,,,,,,,[],,,,
1366794201573302274,1366794196561108992,2021-03-02 13:55:06 SA Eastern Standard Time,2021-03-02,13:55:06,-0300,77100803,bruno_ch,Bruno Chaves,,"No julgamento, o plenário analisa o caso de um jornalista bloqueado por Bolsonaro após posts sobre as queimadas na Amazônia.  Helder que é tão crítico de Bolsonaro em vários aspectos também agiu como um ""ditadorzinho"" me bloqueando.",pt,[],[],[],0,0,0,[],[],https://twitter.com/Bruno_CH/status/1366794201573302274,False,,0,,,,,,,,[],,,,
1366763617408974854,1366577898556129281,2021-03-02 11:53:34 SA Eastern Standard Time,2021-03-02,11:53:34,-0300,1153714271718711301,stela700,Stela700,,"@Ricamconsult E o STF ainda não deu 48 horas pro Bolsonaro explicar sua audácia de querer controlar o desmatamento IRREGULAR da Amazônia, o tráfico INTERNACIONAL de madeiras e as queimadas CRIMINOSAS da Amazônia????",pt,[],[],[],0,0,0,[],[],https://twitter.com/stela700/status/1366763617408974854,False,,0,,,,,,,,"[{'screen_name': 'Ricamconsult', 'name': 'Ricardo Amorim', 'id': '160910872'}]",,,,
1366748247239389187,1366747706606108675,2021-03-02 10:52:29 SA Eastern Standard Time,2021-03-02,10:52:29,-0300,1256584679404249098,tj74789480,Todo poder emana da toga.,,@opiniaoredetv @rsallesmma Queria perguntar se o Dicaprio e a Greta já doaram alguma coisa pra ajudar no combate às queimadas na Amazônia.,pt,[],[],[],0,0,1,[],[],https://twitter.com/TJ74789480/status/1366748247239389187,False,,0,,,,,,,,"[{'screen_name': 'opiniaoredetv', 'name': 'Opinião no Ar', 'id': '1312414394425511936'}, {'screen_name': 'rsallesmma', 'name': 'Ricardo Salles', 'id': '971822131024748545'}]",,,,
1366726684959997958,1366726684959997958,2021-03-02 09:26:48 SA Eastern Standard Time,2021-03-02,09:26:48,-0300,350090163,morbidarkangel_,☥ Guilherme Trismegisto ☥ ☥,,"E a indústria que mais contribui para o aquecimento global (indiretamente) é a da carne, e as queimadas da Amazônia para plantio de soja onde 72% vai virar ração...",pt,[],[],[],0,0,1,[],[],https://twitter.com/MorbiDarkAngel_/status/1366726684959997958,False,https://twitter.com/Artner_/status/1366714660976746497,0,,,,,,,,[],,,,
1366705569567035392,1366705569567035392,2021-03-02 08:02:54 SA Eastern Standard Time,2021-03-02,08:02:54,-0300,35317431,paulogbarreto,Paulo Barreto,,"Senador @rpsenador - se consideras que o presidente não foi doloso na pandemia, ele confessou o crime contra a Amazônia:  Bolsonaro diz que 'potencializou' queimadas por nova política para Amazônia  https://t.co/2cMgvG8XGr via @UOLNoticias @UOL",pt,"[{'screen_name': 'rpsenador', 'name': 'rodrigo pacheco', 'id': '762786918086180864'}, {'screen_name': 'uolnoticias', 'name': 'uol notícias', 'id': '14594698'}, {'screen_name': 'uol', 'name': 'uol', 'id': '70799317'}]",['https://noticias.uol.com.br/internacional/ultimas-noticias/2019/10/30/bolsonaro-diz-que-potencializou-queimadas-por-nova-politica-para-amazonia.htm'],[],1,0,6,[],[],https://twitter.com/paulogbarreto/status/1366705569567035392,False,,0,,,,,,,,[],,,,
1366578198461509641,1366578198461509641,2021-03-01 23:36:46 SA Eastern Standard Time,2021-03-01,23:36:46,-0300,3391362940,mariliachorta,Marilia Horta,,O que Pacheco teria a dizer sobre as queimadas na Amazônia #RodaViva,pt,[],[],[],0,0,1,['rodaviva'],[],https://twitter.com/mariliachorta/status/1366578198461509641,False,,0,,,,,,,,[],,,,
1366537976038195200,1366537976038195200,2021-03-01 20:56:57 SA Eastern Standard Time,2021-03-01,20:56:57,-0300,1276583635441901568,tiago_ribeiroc2,Tiago Ribeiro,,"Todas as grandes crises que o país passou nesses últimos ano na gestão do Bolsonaro so vimos alguma coisa boa acontecer quando as pessoas resolveram agir por conta própria. Seja nas queimadas na Amazônia, seja o óleo nas praias do Nordeste ou na pandemia. Bolsonaro mata. #JN",pt,[],[],[],0,0,1,['jn'],[],https://twitter.com/tiago_ribeiroc2/status/1366537976038195200,False,,0,,,,,,,,[],,,,
