id,conversation_id,created_at,date,time,timezone,user_id,username,name,place,tweet,language,mentions,urls,photos,replies_count,retweets_count,likes_count,hashtags,cashtags,link,retweet,quote_url,video,thumbnail,near,geo,source,user_rt_id,user_rt,retweet_id,reply_to,retweet_date,translate,trans_src,trans_dest
1225095910218174466,1225095910218174466,2020-02-05 13:36:40 -03,2020-02-05,13:36:40,-0300,805024556226318336,maygracebennet,☁︎︎ ᴍᴀʏᴀ ɪs ғɪɴᴇ ☁︎︎,,Abaixo assinado para impedir o desmatamento e a exploração da Amazônia. Fala tá pouco!! Assine ✍️  https://t.co/O0iknrqZBt  https://t.co/61j54UF2sF,pt,[],['https://www.change.org/p/impedir-o-desmatamento-e-explora%C3%A7%C3%A3o-da-amaz%C3%B4nia'],['https://pbs.twimg.com/media/EQBqOrmUcAMduUI.jpg'],0,0,2,[],[],https://twitter.com/maygracebennet/status/1225095910218174466,False,,1,https://pbs.twimg.com/media/EQBqOrmUcAMduUI.jpg,,,,,,,[],,,,
1225094801521106951,1225094801521106951,2020-02-05 13:32:16 -03,2020-02-05,13:32:16,-0300,149518454,heustienne,🐧,,desmatamento amazonia,pt,[],[],[],0,0,0,[],[],https://twitter.com/heustienne/status/1225094801521106951,False,https://twitter.com/naturabroficial/status/1224709762241236995,0,,,,,,,,[],,,,
1225081166371442688,1225081166371442688,2020-02-05 12:38:05 -03,2020-02-05,12:38:05,-0300,2358738354,portalvalentlna,Portal Valentina,,Desmatamento: os 25 piores inimigos da Amazônia |  https://t.co/y0Uz1SutJC (via @outraspalavrass) #Brasil #devastaçao #meioambiente,pt,"[{'screen_name': 'outraspalavrass', 'name': 'outras palavras', 'id': '163924021'}]",['http://ow.ly/8pyI30qfg9N'],[],0,0,0,"['brasil', 'devastaçao', 'meioambiente']",[],https://twitter.com/portalVALENTlNA/status/1225081166371442688,False,,0,,,,,,,,[],,,,
1225070796470652929,1225070796470652929,2020-02-05 11:56:53 -03,2020-02-05,11:56:53,-0300,742469390642368512,bncplay,BNC Amazonas,,Ministério Público Federal debate relação entre crime organizado e desmatamento na Amazônia.  https://t.co/hpi8kRpIp5,pt,[],['https://bncamazonas.com.br/municipios/mpf-crime-desmatamento-amazonia/'],[],0,0,0,[],[],https://twitter.com/bncplay/status/1225070796470652929,False,,0,,,,,,,,[],,,,
1225063152980762624,1225061453633347586,2020-02-05 11:26:30 -03,2020-02-05,11:26:30,-0300,875485027177553921,andrearoeirap,Aroeira 🌿 #MarcoTemporalNão,,"O massacre de indígenas, a violação dos direitos humanos e essa afronta à Constituição precisam ser tratados como tratamos o desmatamento, os incêndios na Amazônia, a gestão de Salles. Precisam gerar o mesmo assombro e ter a mesma visibilidade, NO MÍNIMO   https://t.co/nZNoabQSWI",pt,[],['https://twitter.com/andrearoeirap/status/1225040322784366593?s=19'],[],1,18,50,[],[],https://twitter.com/andrearoeirap/status/1225063152980762624,False,https://twitter.com/andrearoeirap/status/1225040322784366593?s=19,0,,,,,,,,[],,,,
1225053711988334592,1225053711988334592,2020-02-05 10:48:59 -03,2020-02-05,10:48:59,-0300,993854799950032896,dsrinpe,DSR INPE,,"Operação Tolerância Zero contra o #Desmatamento Ilegal do @mmeioambiente em 5 Estados da #Amazônia utiliza #SensoriamentoRemoto:  ""antes do trabalho de campo é realizado um levantamento detalhado por satélite"" Homero Cerqueira, Pres. do #ICMBio   https://t.co/iNPjN6EAVS  #Itaituba  https://t.co/DZsfWQG3IN",pt,"[{'screen_name': 'mmeioambiente', 'name': 'ministério do meio ambiente', 'id': '193003734'}]","['https://mma.gov.br/informma/item/15692-icmbio-realiza-fiscaliza%C3%A7%C3%A3o-na-floresta-nacional-de-itaituba,-no-par%C3%A1.html']","['https://pbs.twimg.com/media/EQBD2KPW4AAZMyC.jpg', 'https://pbs.twimg.com/media/EQBD2KRXkAATr0J.jpg', 'https://pbs.twimg.com/media/EQBD2KPWoAEb5Il.jpg']",0,0,5,"['desmatamento', 'amazônia', 'sensoriamentoremoto', 'icmbio', 'itaituba']",[],https://twitter.com/dsrinpe/status/1225053711988334592,False,https://twitter.com/mmeioambiente/status/1225050658589609986,1,https://pbs.twimg.com/media/EQBD2KPW4AAZMyC.jpg,,,,,,,[],,,,
1225043679338999809,1225043679338999809,2020-02-05 10:09:08 -03,2020-02-05,10:09:08,-0300,993854799950032896,dsrinpe,DSR INPE,,"Na reunião no Centro Regional da Amazônia (CRA), em #Belém, houve apresentações dos projetos DETER Cerrado e DETER Amazônia.  Lá, Darcton destacou o papel atribuído ao INPE na #Amazônia, região que tem se mostrado importante para o @MCTIC. #desmatamento   https://t.co/MMSnxLatoT  https://t.co/mqarm4yXOU",pt,[],['http://www.inpe.br/noticias/noticia.php?Cod_Noticia=5349'],['https://pbs.twimg.com/media/EQA6unpX4AQrMF-.jpg'],1,1,4,"['belém', 'amazônia', 'desmatamento']",[],https://twitter.com/dsrinpe/status/1225043679338999809,False,https://twitter.com/inpe_mct/status/1224828232014262274,1,https://pbs.twimg.com/media/EQA6unpX4AQrMF-.jpg,,,,,,,[],,,,
1225027002626990080,1224622655531126784,2020-02-05 09:02:51 -03,2020-02-05,09:02:51,-0300,2768369900,milkeduard,Eduard Santos,,"@LukeCageBr87 @BanZaiK7 @_NeoRedPill_ @CdNLeon O desmatamento na Amazônia cresceu no período desse governo. Exponencialmente. Não é coincidência.   As taxas de homicídio diminuíram num geral, mas a Polícia mata mais do que nunca. Ou seja, aumentaram as mortes estatais. Mas isso é coisa de ordem estadual, não federal.",pt,[],[],[],4,0,0,[],[],https://twitter.com/milkeduard/status/1225027002626990080,False,,0,,,,,,,,"[{'screen_name': 'LukeCageBr87', 'name': 'Leandro Silva', 'id': '1183513774898192385'}, {'screen_name': 'BanZaiK7', 'name': 'Gyokuzai', 'id': '730120058480037888'}, {'screen_name': '_NeoRedPill_', 'name': 'Wesley C.', 'id': '1044645104806498305'}, {'screen_name': 'CdNLeon', 'name': 'Leon Martins', 'id': '37312877'}]",,,,
1225017653993123841,1225007128886349825,2020-02-05 08:25:43 -03,2020-02-05,08:25:43,-0300,52168441,claudioangelo,Claudio Angelo 💉,,"@jairbolsonaro @JusticaGovBR Imagine o dia em que o @SF_Moro descobrir que a ligação entre narcotráfico, fazendas e desmatamento na Amazônia é mais do que coincidência?",pt,"[{'screen_name': 'sf_moro', 'name': 'sergio moro', 'id': '1113094855281008641'}]",[],[],0,2,20,[],[],https://twitter.com/claudioangelo/status/1225017653993123841,False,,0,,,,,,,,"[{'screen_name': 'jairbolsonaro', 'name': 'Jair M. Bolsonaro', 'id': '128372940'}, {'screen_name': 'JusticaGovBR', 'name': 'Ministério da Justiça e Segurança Pública', 'id': '68810711'}]",,,,
1225012957073084416,1225012957073084416,2020-02-05 08:07:03 -03,2020-02-05,08:07:03,-0300,34304424,marcelinharosa,Marcela Rosa,,"O vice-presidente da República, Hamilton Mourão, afirmou que pode ser editado até a semana que vem o decreto presidencial sobre o Conselho da Amazônia e a Força Nacional Ambiental.  ##conselho #Amazônia #desmatamento #Manaus  https://t.co/VLZQjZsL7M  https://t.co/UMVaeAvJXF",pt,[],['http://bit.ly/3bda82h'],['https://pbs.twimg.com/media/EQAeyt1X4AAl1JG.jpg'],0,0,0,"['conselho', 'amazônia', 'desmatamento', 'manaus']",[],https://twitter.com/marcelinharosa/status/1225012957073084416,False,,1,https://pbs.twimg.com/media/EQAeyt1X4AAl1JG.jpg,,,,,,,[],,,,
1224896657340407809,1224896657340407809,2020-02-05 00:24:55 -03,2020-02-05,00:24:55,-0300,813518637873168384,qtierobot,mafe,,pelo amor de deus vai ficar com dó de um mercado que servia pra lavagem de dinheiro do maior esquema de desmatamento da amazônia pra outro,pt,[],[],[],0,0,0,[],[],https://twitter.com/qtierobot/status/1224896657340407809,False,,0,,,,,,,,[],,,,
1224852340446023680,1224441600798887937,2020-02-04 21:28:49 -03,2020-02-04,21:28:49,-0300,1205098220759715840,fabianotomy,Fabiano Araujo,,"@secomvc Vamos a alguns fatos de 2019:  30% no aumento de feminicídio; extinção do + Médicos, os pobres estão sem médicos; desmatamento da Amazônia atendo aos interesses do agronegócio; censura; morte de líderes indígenas; Aumento de homicídio cometidos por policiais militares; e etc",pt,[],[],[],0,0,0,[],[],https://twitter.com/fabianotomy/status/1224852340446023680,False,,0,,,,,,,,"[{'screen_name': 'secomvc', 'name': 'SecomVc', 'id': '1158389772920020993'}]",,,,
1224849519868891138,1224476754414329856,2020-02-04 21:17:36 -03,2020-02-04,21:17:36,-0300,3434836468,kabracdabra,Memyself,,"@gabmag91 @kimpkat O desmatamento da Amazônia, em 519 anos foi de apenas 8%.  Sim, 92% da floresta está ABSOLUTAMENTE INTACTA, desde o descobrimento.",pt,[],[],[],0,0,0,[],[],https://twitter.com/Kabracdabra/status/1224849519868891138,False,,0,,,,,,,,"[{'screen_name': 'kimpkat', 'name': 'kimpkat', 'id': '1360542466571698179'}]",,,,
1224849456778108929,1224476754414329856,2020-02-04 21:17:21 -03,2020-02-04,21:17:21,-0300,3434836468,kabracdabra,Memyself,,"@brunomrv @kimpkat O desmatamento da Amazônia, em 519 anos foi de apenas 8%.  Sim, 92% da floresta está ABSOLUTAMENTE INTACTA, desde o descobrimento.",pt,[],[],[],0,0,0,[],[],https://twitter.com/Kabracdabra/status/1224849456778108929,False,,0,,,,,,,,"[{'screen_name': 'brunomrv', 'name': 'BRUNO MOREIRA', 'id': '20435122'}, {'screen_name': 'kimpkat', 'name': 'kimpkat', 'id': '1360542466571698179'}]",,,,
1224836511549599744,1224836511549599744,2020-02-04 20:25:55 -03,2020-02-04,20:25:55,-0300,1857286891,amazonasatual,Amazonas Atual,,"POLÍTICA | MPF quer identificar relação entre crime organizado, corrupção e desmatamento na Amazônia. Saiba mais:  https://t.co/wtDhW8J7XF   #corrupção #desmatamentosnaAmazônia #MPF  https://t.co/eVJ3WMFnX5",pt,[],['http://bit.ly/3b9YlBK'],['https://pbs.twimg.com/media/EP9-UOCXsAUtDm8.jpg'],0,0,0,"['corrupção', 'desmatamentosnaamazônia', 'mpf']",[],https://twitter.com/AmazonasAtual/status/1224836511549599744,False,,1,https://pbs.twimg.com/media/EP9-UOCXsAUtDm8.jpg,,,,,,,[],,,,
1224831821680201728,1224441600798887937,2020-02-04 20:07:17 -03,2020-02-04,20:07:17,-0300,971910039878492162,ultrajeahigor,ice-cold evil-plotting bitch,,"@secomvc @jairbolsonaro Vimos muito bem na demora e ineficiênciapara lidar com os focos de incêndio na Amazônia, na tentativa de afrouxar leis ambientais e de praticamente legalizar o desmatamento, @secomvc....",pt,"[{'screen_name': 'secomvc', 'name': 'secomvc', 'id': '1158389772920020993'}]",[],[],0,0,3,[],[],https://twitter.com/ultrajeahigor/status/1224831821680201728,False,,0,,,,,,,,"[{'screen_name': 'secomvc', 'name': 'SecomVc', 'id': '1158389772920020993'}, {'screen_name': 'jairbolsonaro', 'name': 'Jair M. Bolsonaro', 'id': '128372940'}]",,,,
1224829566268604416,1224829566268604416,2020-02-04 19:58:19 -03,2020-02-04,19:58:19,-0300,285874408,bymarjlibe,eirojram,,Imagens do desmatamento de um pé-de-moleque na Amazônia,pt,[],[],[],0,0,0,[],[],https://twitter.com/bymarjlibe/status/1224829566268604416,False,https://twitter.com/criancafazendoM/status/1224686614544375808,0,,,,,,,,[],,,,
1224827992150544385,1224827992150544385,2020-02-04 19:52:04 -03,2020-02-04,19:52:04,-0300,151653693,helderbarbalho,Helder Barbalho,,"Durante a COP25, em Madri, apresentamos o Projeto Amazônia Agora que atuará na prevenção, monitoramento e combate a queimadas e ao desmatamento ilegal, na Politica Territórios Sustentáveis, no programa de regularização fundiária e ambiental, e no Fundo Amazônia Oriental (FAO).",pt,[],[],[],7,3,45,[],[],https://twitter.com/helderbarbalho/status/1224827992150544385,False,,0,,,,,,,,[],,,,
1224825340226342914,1224825340226342914,2020-02-04 19:41:31 -03,2020-02-04,19:41:31,-0300,962433092127461377,ddescomplicado,Direito Descomplicado,,"Seminário discute relação entre desmatamento na Amazônia, crime organizado e corrupção  https://t.co/SmCdtB4tCF",pt,[],['https://direitodescomplicado.com/seminario-discute-relacao-entre-desmatamento-na-amazonia-crime-organizado-e-corrupcao/'],[],0,0,0,[],[],https://twitter.com/ddescomplicado/status/1224825340226342914,False,,0,,,,,,,,[],,,,
1224806826371436545,1224806826371436545,2020-02-04 18:27:57 -03,2020-02-04,18:27:57,-0300,111045942,alceu_moreira,Alceu Moreira 🇧🇷,,"Nas presenças do vice-presidente @GeneralMourao, nomeado coordenador do Conselho da Amazônia, e da ministra da Agricultura, @TerezaCrisMS, a @fpagropecuaria  se colocou à disposição do governo federal para contribuir e fiscalizar o desmatamento ilegal na região amazônica.  https://t.co/FTS7ZsQInS",pt,"[{'screen_name': 'generalmourao', 'name': 'general hamilton mourão', 'id': '1058819604741525510'}, {'screen_name': 'terezacrisms', 'name': 'tereza cristina', 'id': '270399607'}, {'screen_name': 'fpagropecuaria', 'name': 'fpa', 'id': '151112325'}]",[],['https://pbs.twimg.com/media/EP9jT18X0AIpM7C.jpg'],1,1,12,[],[],https://twitter.com/Alceu_Moreira/status/1224806826371436545,False,,1,https://pbs.twimg.com/media/EP9jT18X0AIpM7C.jpg,,,,,,,[],,,,
1224800916664193028,1224800916664193028,2020-02-04 18:04:28 -03,2020-02-04,18:04:28,-0300,259840707,mpf_pgr,MP Federal,,"Seminário discute relação entre desmatamento na Amazônia, crime organizado e corrupção -  https://t.co/Uqg337zIG8",pt,[],['http://bit.ly/2OrT3HU'],[],0,5,30,[],[],https://twitter.com/MPF_PGR/status/1224800916664193028,False,,0,,,,,,,,[],,,,
1224800273375354882,1224800273375354882,2020-02-04 18:01:55 -03,2020-02-04,18:01:55,-0300,142835897,portalne10,Portal NE10,,Pesquisa mostra multas milionárias por conta do desmatamento na Amazônia nos últimos 25 anos  https://t.co/BOVvwxEgNK  https://t.co/7zMLfwqGPX,pt,[],['https://jconline.ne10.uol.com.br/canal/mundo/brasil/noticia/2020/02/04/pesquisa-mostra-multas-milionarias-por-conta-do-desmatamento-na-amazonia-nos-ultimos-25-anos-398995.php'],['https://pbs.twimg.com/media/EP9dV7lWkAYsJFc.png'],0,0,0,[],[],https://twitter.com/portalne10/status/1224800273375354882,False,,1,https://pbs.twimg.com/media/EP9dV7lWkAYsJFc.png,,,,,,,[],,,,
1224799583638781952,1224799583638781952,2020-02-04 17:59:11 -03,2020-02-04,17:59:11,-0300,245896728,jc_pe,Jornal do Commercio,,Pesquisa mostra multas milionárias por conta do desmatamento na Amazônia nos últimos 25 anos  https://t.co/itepwYyD46  https://t.co/kYgh1W8XyC,pt,[],['https://jconline.ne10.uol.com.br/canal/mundo/brasil/noticia/2020/02/04/pesquisa-mostra-multas-milionarias-por-conta-do-desmatamento-na-amazonia-nos-ultimos-25-anos-398995.php'],['https://pbs.twimg.com/media/EP9cuwiWkAAV_no.jpg'],0,0,0,[],[],https://twitter.com/jc_pe/status/1224799583638781952,False,,1,https://pbs.twimg.com/media/EP9cuwiWkAAV_no.jpg,,,,,,,[],,,,
1224790658516422656,1224647422611206144,2020-02-04 17:23:43 -03,2020-02-04,17:23:43,-0300,42025417,gletjr,Gilberto Angelucci,,"@taoquei1 Eu acho que Petra está errada em um ponto... A amazônia não irá virar uma savana, mas o Brasil todo sofre com o desmatamento desenfreado... Talvez ela tenha sido gentil, não é apenas a amazônia que entrará em processo de desertificação, mas o Brasil TODO.",pt,[],[],[],0,0,0,[],[],https://twitter.com/gletjr/status/1224790658516422656,False,,0,,,,,,,,"[{'screen_name': 'taoquei1', 'name': 'TeAtualizei 🇧🇷👊🏻❤️', 'id': '1087259768'}]",,,,
1224781937346252800,1224781937346252800,2020-02-04 16:49:03 -03,2020-02-04,16:49:03,-0300,563104486,lisevga,sofia vergara de fortalezinha,,"""desmatamento amazonia"" sendo que a empresa literalmente fode a amazonia e ROUBA tecnicas dos povos locais aaaaaaaaaaaaaaaaaaaaaaaaaaaaaaaaaaaaaaaaaaaaaaaaaaaaaaa",pt,[],[],[],0,3,7,[],[],https://twitter.com/lisevga/status/1224781937346252800,False,https://twitter.com/naturabroficial/status/1224709762241236995,0,,,,,,,,[],,,,
1224775419607552000,1224775419607552000,2020-02-04 16:23:09 -03,2020-02-04,16:23:09,-0300,74715478,climainfonews,ClimaInfo,,"Para o cientista William Moomaw, prêmio Nobel da Paz pelo IPCC em 2007, o Brasil tem tido uma atuação vergonhosa nas negociações internacionais sobre clima e fracassado na luta contra o #desmatamento na Amazônia  https://t.co/Mpmj9mJWbq na @folha",pt,"[{'screen_name': 'folha', 'name': 'folha de s.paulo', 'id': '14594813'}]",['https://www1.folha.uol.com.br/ambiente/2020/02/so-florestas-maduras-barram-aquecimento-global-a-curto-prazo-diz-premio-nobel.shtml'],[],0,10,14,['desmatamento'],[],https://twitter.com/ClimaInfoNews/status/1224775419607552000,False,,0,,,,,,,,[],,,,
1224774617333665800,1224773523824152581,2020-02-04 16:19:58 -03,2020-02-04,16:19:58,-0300,14980096,cecyfernandes,Que Nem Elas Que Nem,,"""Nela, @petracostal lamenta a ascensão do poder de @jairbolsonaro as #FakeNews  e critica o incentivo do @jairbolsonaro ao desmatamento da #Amazonia e aos assassinatos da polícia , que, segundo ela, aumentaram 20% no estado do Rio de Janeiro desde a eleição de @jairBolsonaro.""",pt,"[{'screen_name': 'petracostal', 'name': 'petra costa', 'id': '204136120'}, {'screen_name': 'jairbolsonaro', 'name': 'jair m. bolsonaro', 'id': '128372940'}, {'screen_name': 'jairbolsonaro', 'name': 'jair m. bolsonaro', 'id': '128372940'}, {'screen_name': 'jairbolsonaro', 'name': 'jair m. bolsonaro', 'id': '128372940'}]",[],[],0,0,0,"['fakenews', 'amazonia']",[],https://twitter.com/cecyfernandes/status/1224774617333665800,False,,0,,,,,,,,[],,,,
1224773729844105216,1224773729844105216,2020-02-04 16:16:27 -03,2020-02-04,16:16:27,-0300,474829182,sebar1956,SEBAR,,Desmatamento: os 25 piores inimigos da Amazônia  https://t.co/Zlnyj7iDYg,pt,[],['https://outraspalavras.net/outrasmidias/desmatamento-os-25-piores-inimigos-da-amazonia/'],[],0,0,0,[],[],https://twitter.com/SEBAR1956/status/1224773729844105216,False,,0,,,,,,,,[],,,,
1224766237445627906,1224766237445627906,2020-02-04 15:46:40 -03,2020-02-04,15:46:40,-0300,17871562,socioambiental,socioambiental,,Desmatadores: no topo da lista dos piores inimigos do meio ambiente! Plataforma mapeia os multados pelo Ibama acusados de desmatamento nos últimos 25 anos. A pesquisa ainda destaca que a maior parte das autuações acontecem na #Amazônia. Saiba mais:  https://t.co/tT2JGbgL9l,pt,[],['https://isa.to/2GZDhzT'],[],1,22,50,['amazônia'],[],https://twitter.com/socioambiental/status/1224766237445627906,False,,0,,,,,,,,[],,,,
1224756863981498369,1224726939790979073,2020-02-04 15:09:25 -03,2020-02-04,15:09:25,-0300,145849776,elyjoao2,E. J.,,"@BolsonaroSP Bom, sobre a Amazonia, o próprio Inpe, hoje gerido por um diretor indicado pelo seu pai, revela que o desmatamento deste bioma só cresce desde 2018  . . . Mais « uma » que o Sr. escreve aqui no Twitter, e eu não entendo.",pt,[],[],[],0,0,2,[],[],https://twitter.com/elyjoao2/status/1224756863981498369,False,,0,,,,,,,,"[{'screen_name': 'BolsonaroSP', 'name': 'Eduardo Bolsonaro🇧🇷', 'id': '74756085'}]",,,,
1224754254801321984,1224754254801321984,2020-02-04 14:59:03 -03,2020-02-04,14:59:03,-0300,29013551,rhprj,rhp-rj ♥️♥️ 😷ॐ,,O MUNDO já sabe que esse governo é uma catástrofe.  De nada adianta o bandido da SECOM atacar Petra Costa.  Nature alerta e pede providências contra o desmatamento da Amazônia.  E o genocídio dos indígenas.  Quem apoia esse desgoverno TRAI o Brasil.,pt,[],[],[],0,0,0,[],[],https://twitter.com/rhprj/status/1224754254801321984,False,https://twitter.com/brasil247/status/1224743177334247424,0,,,,,,,,[],,,,
1224736686015438849,1224736686015438849,2020-02-04 13:49:15 -03,2020-02-04,13:49:15,-0300,11392672,iainlevine,Iain Levine,,Os incêndios e o desmatamento na Amazônia constituem não só uma crise ambiental mas também  uma crise de segurança pública pois o desmatamento ilegal e a violência na Amazônia são impulsionados ​em grande parte ​por redes criminosas diz @mlcanineu  https://t.co/2TwC9JQU5v  https://t.co/R4qzo3zIsx,pt,"[{'screen_name': 'mlcanineu', 'name': 'maria laura canineu', 'id': '866675707'}]",['https://www.hrw.org/pt/news/2020/02/04/338465'],['https://pbs.twimg.com/media/EP8jNq6WsAE5T6y.jpg'],0,0,0,[],[],https://twitter.com/iainlevine/status/1224736686015438849,False,,1,https://pbs.twimg.com/media/EP8jNq6WsAE5T6y.jpg,,,,,,,[],,,,
1224735624269266946,1224735624269266946,2020-02-04 13:45:01 -03,2020-02-04,13:45:01,-0300,1129433139170992128,2luiz_henrique,Luiz Henrique,,"Segundo a Petra, O GOVERNO BOLSONARO ESTÁ INCENTIVANDO DESMATAMENTO.   ""AMAZÔNIA ESTÁ VIRANDO UMA SAVANA.""  Façam suas escolhas: SAVANA OU ESTACIONAMENTO?  Eu prefiro estacionamento, tem muito carro no Amazonas.  É MUITO CINISMO!  https://t.co/lfaGIJx8ME",pt,[],[],['https://pbs.twimg.com/media/EP8iifTXUAIZ1_r.png'],0,0,0,[],[],https://twitter.com/2Luiz_Henrique/status/1224735624269266946,False,,1,https://pbs.twimg.com/media/EP8iifTXUAIZ1_r.png,,,,,,,[],,,,
1224731977036767234,1224731977036767234,2020-02-04 13:30:32 -03,2020-02-04,13:30:32,-0300,138492825,proindio,Comissão Pró-Índio,,"Reportagem da @agenciapublica revela que empresas investigadas ou citadas na #LavaJato cometeram infrações ambientais que somam mais de R$ 600 milhões na Amazônia Legal, incluindo desmatamento legal, fraude de licenças, matança de animais.    https://t.co/CkJa7vE7VJ",pt,"[{'screen_name': 'agenciapublica', 'name': 'agência pública', 'id': '310497473'}]",['https://apublica.org/2020/02/os-rastros-da-lava-jato-na-amazonia/'],[],0,20,41,['lavajato'],[],https://twitter.com/proindio/status/1224731977036767234,False,,0,,,,,,,,[],,,,
1224730700999483392,1224726939790979073,2020-02-04 13:25:28 -03,2020-02-04,13:25:28,-0300,1223303471673364480,historiadorf,O Cosmonauta 🇧🇷,,"@BolsonaroSP Presta atenção nesse discurso!   O principal responsável pelo desmatamento na Amazônia é o avanço da fronteira agrícola.  Mas o Dudu tá falando que ""produtor rural preserva até mais do que o exigido por lei em suas terras"". Logo a fronteira agrícola tem justificativa pra avançar!",pt,[],[],[],0,0,0,[],[],https://twitter.com/HistoriadorF/status/1224730700999483392,False,,0,,,,,,,,"[{'screen_name': 'BolsonaroSP', 'name': 'Eduardo Bolsonaro🇧🇷', 'id': '74756085'}]",,,,
1224719020521402369,1224717664821620736,2020-02-04 12:39:03 -03,2020-02-04,12:39:03,-0300,20435122,brunomrv,BRUNO MOREIRA,,"@GeracaodeValor No caso da Amazônia, não acho q ela estivesse exagerando. Temos os piores números de desmatamento da História. Nada que o mundo ainda não saiba.",pt,[],[],[],0,0,4,[],[],https://twitter.com/brunomrv/status/1224719020521402369,False,,0,,,,,,,,"[{'screen_name': 'GeracaodeValor', 'name': 'Flávio Augusto', 'id': '228120886'}]",,,,
1224709195129184256,1224709195129184256,2020-02-04 12:00:00 -03,2020-02-04,12:00:00,-0300,2586180074,edicoessescsp,Edições Sesc SP,,"Num cenário de intensas transformações políticas em nível global (Brexit, EUA x Irã, desmatamento da Amazônia), perspectivas históricas apresentadas no livro ""Identidades das nações"" lançam luz sobre os rumos que os países podem tomar.  https://t.co/EXwDNln8c3  https://t.co/zJgaS6NIvA",pt,[],['http://is.gd/identidades'],['https://pbs.twimg.com/media/EP4UP_0UYAExryc.jpg'],0,0,3,[],[],https://twitter.com/edicoessescsp/status/1224709195129184256,False,,1,https://pbs.twimg.com/media/EP4UP_0UYAExryc.jpg,,,,,,,[],,,,
1224706207111315466,1224524634760122368,2020-02-04 11:48:08 -03,2020-02-04,11:48:08,-0300,337400604,ntnetto,Newton Tércio Netto,,"@PauloMartins10 Do jeito que anda o desmatamento, não demora muito pra termos uma verdadeira savana na Amazônia.",pt,[],[],[],0,0,0,[],[],https://twitter.com/NTNetto/status/1224706207111315466,False,,0,,,,,,,,"[{'screen_name': 'PauloMartins10', 'name': 'Paulo Eduardo Martins', 'id': '36714942'}]",,,,
1224684307068923904,1224665701497131008,2020-02-04 10:21:06 -03,2020-02-04,10:21:06,-0300,1050458761117257728,so_ellipsis,Gerson,,"@fabsaldanha_ @bollemdb A fala da Amazônia mesmo é exagerada, mas o desmatamento aumentou mesmo. Caso contrário, a Secom poderia informar ""2019 teve o menor número de desmatamento dos últimos anos"". Ela pode até falar ""aumentou um pouquinho, mas não foi tanto assim, mas pega mal.",pt,[],[],[],1,0,3,[],[],https://twitter.com/so_ellipsis/status/1224684307068923904,False,,0,,,,,,,,"[{'screen_name': 'fabsaldanha_', 'name': 'Fábio', 'id': '2959739151'}, {'screen_name': 'bollemdb', 'name': 'Monica de Bolle, PhD', 'id': '539421221'}]",,,,
1224683393667010560,1224441600798887937,2020-02-04 10:17:29 -03,2020-02-04,10:17:29,-0300,1508049410,italomatosss,Matos,,"@secomvc Assistam o documentário ""Sob a Pata do Boi"" explica bem a parte do desmatamento que ela fala, na Amazônia pela agropecuária. Os números da produção são assustadores. Nós que compramos carne sem saber a origem, também colaboramos com o desmatamento. Froidis!",pt,[],[],[],0,0,0,[],[],https://twitter.com/ItaloMatosss/status/1224683393667010560,False,,0,,,,,,,,"[{'screen_name': 'secomvc', 'name': 'SecomVc', 'id': '1158389772920020993'}]",,,,
1224677536539586560,1224624545539207168,2020-02-04 09:54:12 -03,2020-02-04,09:54:12,-0300,2317281314,jagunceiro,Jagunçeiro Bilbônico,,"@snakemoral @EdgleyGreat @jairbolsonaro Vai tomar no seu cu, dados de desmatamento da Amazônia é mentira, só o que convém é verdade, ""conhecerei minha verdade, e a verdade te libertarais""",pt,[],[],[],0,0,0,[],[],https://twitter.com/jagunceiro/status/1224677536539586560,False,,0,,,,,,,,"[{'screen_name': 'snakemoral', 'name': 'Fernando Barros', 'id': '224069144'}, {'screen_name': 'EdgleyGreat', 'name': 'Edy Gonçalves', 'id': '368635254'}, {'screen_name': 'jairbolsonaro', 'name': 'Jair M. Bolsonaro', 'id': '128372940'}]",,,,
1224667535578226688,1224665218799808512,2020-02-04 09:14:28 -03,2020-02-04,09:14:28,-0300,15696703,thatianap,☆☆ тнαтιαηαρ ☆☆,,"@dilmabr 4 Petra Costa foi chamada de mentirosa por dizer a verdade que o mundo conhece sobre a maneira como o governo trata o meio ambiente: a Amazônia está sendo devastada pela leniência de Bolsonaro com o desmatamento e com as invasões, e pelo seu profundo desrespeito pelos indígenas.",pt,[],[],[],1,0,21,[],[],https://twitter.com/thatianap/status/1224667535578226688,False,,0,,,,,,,,"[{'screen_name': 'dilmabr', 'name': 'Dilma Rousseff', 'id': '131574396'}]",,,,
