id,conversation_id,created_at,date,time,timezone,user_id,username,name,place,tweet,language,mentions,urls,photos,replies_count,retweets_count,likes_count,hashtags,cashtags,link,retweet,quote_url,video,thumbnail,near,geo,source,user_rt_id,user_rt,retweet_id,reply_to,retweet_date,translate,trans_src,trans_dest
1370496011999776770,1370496011999776770,2021-03-12 19:04:46 -03,2021-03-12,19:04:46,-0300,143843707,neliobizzo,Nelio Bizzo,,Carla Zambeli presidindo a comissão de meio ambiente da Câmara dos Deputados do Brasil é um ESCÁRNIO! Ninguém pode apagar seu próprio histórico de incentivo ao desmatamento! #AmazonasPedeSocorro #savetheplanet #Amazonia,pt,[],[],[],0,2,1,"['amazonaspedesocorro', 'savetheplanet', 'amazonia']",[],https://twitter.com/neliobizzo/status/1370496011999776770,False,,0,,,,,,,,[],,,,
1370495045367894021,1370495045367894021,2021-03-12 19:00:56 -03,2021-03-12,19:00:56,-0300,4858045199,politzoficial,POLITZ,,"Com a Operação Verde Brasil, desmatamento na Amazônia é o menor já registrado nos últimos 4 anos pelo 2° mês consecutivo.  Nos últimos 7 meses, a redução acumulada já chegou em  21%.  Parabenizamos o @mmeioambiente de Salles (@rsallesmma) e o @DefesaGovBr.  https://t.co/WaTOZ1pxb7",pt,"[{'screen_name': 'mmeioambiente', 'name': 'ministério do meio ambiente', 'id': '193003734'}, {'screen_name': 'rsallesmma', 'name': 'ricardo salles', 'id': '971822131024748545'}, {'screen_name': 'defesagovbr', 'name': 'ministério da defesa', 'id': '70809242'}]",['https://forum.politz.com.br/ams/com-a-operacao-verde-brasil-desmatamento-na-amazonia-e-o-menor-ja-registrado-nos-ultimos-4-anos-pelo-2-mes-consecutivo.2051/'],[],2,59,253,[],[],https://twitter.com/PolitzOficial/status/1370495045367894021,False,,0,,,,,,,,[],,,,
1370493731770601481,1370493731770601481,2021-03-12 18:55:42 -03,2021-03-12,18:55:42,-0300,1351660158015983616,amazoniaobserva,Observatório da Amazônia,,"Pará é o estado com mais áreas protegidas no ranking de ameaça e pressão por desmatamento na Amazônia, diz @Imazon  https://t.co/Q30eZ9h6qQ",pt,"[{'screen_name': 'imazon', 'name': 'imazon', 'id': '74842999'}]",['https://g1.globo.com/pa/para/noticia/2021/03/11/pa-e-o-estado-com-mais-areas-protegidas-no-ranking-de-ameaca-e-pressao-por-desmatamento-na-amazonia-diz-imazon.ghtml'],[],1,0,0,[],[],https://twitter.com/amazoniaobserva/status/1370493731770601481,False,,0,,,,,,,,[],,,,
1370489396273811463,1370489361389740046,2021-03-12 18:38:29 -03,2021-03-12,18:38:29,-0300,1266415275857063938,vcoloridos,Voyeur de Animais Coloridos,,"E ai, eu não sei se vocês lembram mas nosso país têm aquele negócio que o governo parece odiar... Amazônia. A floresta Amazônica é rica pra kct, e por isso é um grande reservatório de covid-19 e com o desmatamento é o gatilho perfeito (o vídeo fala um pouco disso tmb)  https://t.co/5653WgjQhd",pt,[],[],['https://pbs.twimg.com/media/EwTwDglWgAQspLm.png'],1,2,23,[],[],https://twitter.com/VColoridos/status/1370489396273811463,False,,1,https://pbs.twimg.com/media/EwTwDglWgAQspLm.png,,,,,,,[],,,,
1370487913079832587,1370487913079832587,2021-03-12 18:32:35 -03,2021-03-12,18:32:35,-0300,3589345337,vanecosta10,A Eng. Florestal do YouTube 🌳,,Amazônia: multas por desmatamento somam mais de 3 bilhões de reais  https://t.co/mUxAqqjvA2,pt,[],['https://ultimosegundo.ig.com.br/meioambiente/2021-03-12/amazonia-multas-por-desmatamento-somam-mais-de-3-bilhoes-de-reais.html'],[],0,3,14,[],[],https://twitter.com/vanecosta10/status/1370487913079832587,False,,0,,,,,,,,[],,,,
1370487465161715714,1370487465161715714,2021-03-12 18:30:48 -03,2021-03-12,18:30:48,-0300,1258887922897563649,obscovid19br,Observatório COVID 19 BR,,"Em 2020, vimos uma área equivalente a três estados do Rio de Janeiro ser devastada pelo fogo e desmatamento no Pantanal e na Amazônia - mais um triste recorde deste ano em que enfrentamos a pandemia de COVID-19.",pt,[],[],[],1,7,45,[],[],https://twitter.com/obscovid19br/status/1370487465161715714,False,,0,,,,,,,,[],,,,
1370486936197009415,1370486936197009415,2021-03-12 18:28:42 -03,2021-03-12,18:28:42,-0300,8110402,ultimosegundo,iG Último Segundo,,Amazônia: multas por desmatamento somam mais de 3 bilhões de reais →  https://t.co/b4lpaiBBN0  https://t.co/DSdrStoMgm,pt,[],['https://bit.ly/3cnCrfW'],['https://pbs.twimg.com/media/EwTymc_WgAAVUy0.jpg'],1,4,5,[],[],https://twitter.com/ultimosegundo/status/1370486936197009415,False,,1,https://pbs.twimg.com/media/EwTymc_WgAAVUy0.jpg,,,,,,,[],,,,
1370483721229451268,1370483721229451268,2021-03-12 18:15:56 -03,2021-03-12,18:15:56,-0300,174328276,saletecangussu,salete cangussu | em 🏡 |,,"🟡Áreas ameaçadas pelo desmatamento, pelo mercúrio.. Seu investimento tb pode ser uma ameaça à Amazônia. Antes de investir em ouro, pergunte a origem. #OuroDaAmazôniaTôFora #CompromissoComAmazônia Campanha @_escolhas  @ApibOficial @GuajajaraSonia @policiafederal @MPF_PGR  https://t.co/NGhLULeL7z",pt,"[{'screen_name': '_escolhas', 'name': 'instituto escolhas', 'id': '709488239523074048'}, {'screen_name': 'apiboficial', 'name': 'apib oficial', 'id': '848495834887061505'}, {'screen_name': 'guajajarasonia', 'name': 'sonia guajajara', 'id': '924978508224516096'}, {'screen_name': 'policiafederal', 'name': 'polícia federal', 'id': '106714016'}, {'screen_name': 'mpf_pgr', 'name': 'mp federal', 'id': '259840707'}]",[],[],0,0,0,"['ourodaamazôniatôfora', 'compromissocomamazônia']",[],https://twitter.com/saletecangussu/status/1370483721229451268,False,,1,https://pbs.twimg.com/ext_tw_video_thumb/1370482836520759305/pu/img/B9opK6FN1J0gTHha.jpg,,,,,,,[],,,,
1370479794580815875,1370479794580815875,2021-03-12 18:00:19 -03,2021-03-12,18:00:19,-0300,1162637416110469121,adriana98496023,Adriana,,#deforestation  #desmatamento  #Amazônia  #Amazon  #biodiversidade  #biodiversity  #Brazil,und,[],[],[],0,0,0,"['deforestation', 'desmatamento', 'amazônia', 'amazon', 'biodiversidade', 'biodiversity', 'brazil']",[],https://twitter.com/Adriana98496023/status/1370479794580815875,False,https://twitter.com/proindio/status/1370475937024856070,0,,,,,,,,[],,,,
1370478625556938752,1370478625556938752,2021-03-12 17:55:41 -03,2021-03-12,17:55:41,-0300,36336107,obsclima,"Observatório do Clima, 19 anos",,Tem novidade no #Deter: o sistema do @inpe_mct de detecção de desmatamento em tempo real agora mostra também área coberta por nuvens na Amazônia mês a mês.  https://t.co/3iz4Dw9ZFz  https://t.co/WkLNjc74sj,pt,"[{'screen_name': 'inpe_mct', 'name': 'inpe', 'id': '308605432'}]",['http://terrabrasilis.dpi.inpe.br/app/dashboard/alerts/legal/amazon/aggregated/'],['https://pbs.twimg.com/media/EwTq5PGXIAEefTt.jpg'],2,7,25,['deter'],[],https://twitter.com/obsclima/status/1370478625556938752,False,,1,https://pbs.twimg.com/media/EwTq5PGXIAEefTt.jpg,,,,,,,[],,,,
1370477694710857736,1370470397121077251,2021-03-12 17:51:59 -03,2021-03-12,17:51:59,-0300,384506082,hamiltonbianco,HAMILTON BIANCO: Isentão por falta de opção.,,@miriamleitao @alvarogribel @JornalOGlobo Não vão noticiar queda no desmatamento da Amazônia? 34% em relação fev/21 x fev/20. Menor em 4 anos.  agora o assunto morreu?,pt,[],[],[],0,0,0,[],[],https://twitter.com/HAMILTONBIANCO/status/1370477694710857736,False,,0,,,,,,,,"[{'screen_name': 'miriamleitao', 'name': 'Míriam Leitão', 'id': '16814640'}, {'screen_name': 'alvarogribel', 'name': 'alvaro gribel', 'id': '98543947'}, {'screen_name': 'JornalOGlobo', 'name': 'Jornal O Globo', 'id': '54341363'}]",,,,
1370475961712533506,1370475961712533506,2021-03-12 17:45:06 -03,2021-03-12,17:45:06,-0300,28407958,radaronline,Radar,,Multas por desmatamento na Amazônia superam 3 bilhões de reais  https://t.co/1dWcJqV8a4,pt,[],['https://veja.abril.com.br/blog/radar/multas-por-desmatamento-na-amazonia-superam-3-bilhoes-de-reais/'],[],9,3,23,[],[],https://twitter.com/radaronline/status/1370475961712533506,False,,0,,,,,,,,[],,,,
1370470400296124416,1370470400296124416,2021-03-12 17:23:00 -03,2021-03-12,17:23:00,-0300,1058819604741525510,generalmourao,General Hamilton Mourão,,"Pressão constante, trabalho coordenado e integrado, reflete nos números do combate ao desmatamento na #Amazônia. No mês de fevereiro, houve queda de 34% comparado com o mesmo período de 2020. Confira outros dados na matéria do @defesagovbr 👇   https://t.co/hyGJoSDaos",pt,"[{'screen_name': 'defesagovbr', 'name': 'ministério da defesa', 'id': '70809242'}]",['https://www.gov.br/defesa/pt-br/centrais-de-conteudo/noticias/operacao-verde-brasil-com-queda-de-34-em-fevereiro-desmatamento-e-o-menor-dos-ultimos-4-anos-pelo-segundo-mes-consecutivo'],[],241,293,2066,['amazônia'],[],https://twitter.com/GeneralMourao/status/1370470400296124416,False,,0,,,,,,,,[],,,,
1370468846612586498,1370468846612586498,2021-03-12 17:16:49 -03,2021-03-12,17:16:49,-0300,35317431,paulogbarreto,Paulo Barreto,,SEGURO DE VIDA  Estudo mostra mais evidências de que precisamos para o desmatamento e reflorestar na Amazônia.  First-ever study of all Amazon greenhouse gases suggest the forest is worsening climate change  https://t.co/ROAqPLUlho via @NatGeo,pt,"[{'screen_name': 'natgeo', 'name': 'national geographic', 'id': '17471979'}]",['https://www.nationalgeographic.com/environment/article/amazon-rainforest-now-appears-to-be-contributing-to-climate-change'],[],0,0,2,[],[],https://twitter.com/paulogbarreto/status/1370468846612586498,False,,0,,,,,,,,[],,,,
1370460975049048064,1370460975049048064,2021-03-12 16:45:33 -03,2021-03-12,16:45:33,-0300,1453098463,diariodopoder,Diário do Poder,,Desmatamento na Amazônia é o menor dos últimos 4 anos pelo 2° mês consecutivo  https://t.co/3cf0U8DUQ9 #DiariodoPoder,pt,[],['http://dlvr.it/RvWMxk'],[],0,9,18,['diariodopoder'],[],https://twitter.com/diariodopoder/status/1370460975049048064,False,,0,,,,,,,,[],,,,
1370455529303244800,1370455529303244800,2021-03-12 16:23:54 -03,2021-03-12,16:23:54,-0300,1365292509031780352,anahaliuc,Ana Carolina Haliuc Bragança,,"A persecução penal não vai sozinha resolver os problemas da Amazônia. As políticas públicas de proteção ao meio ambiente, ordenamento fundiário, reforma agrária etc. precisam estar funcionando. Órgãos omissos colaboram para o desmatamento.",pt,[],[],[],0,8,18,[],[],https://twitter.com/AnaHaliuc/status/1370455529303244800,False,https://twitter.com/MPF_AM/status/1370422935387783175,0,,,,,,,,[],,,,
1370454511270178822,1370454511270178822,2021-03-12 16:19:51 -03,2021-03-12,16:19:51,-0300,866675707,mlcanineu,Maria Laura Canineu,,A @hrw_brasil enviou carta ao @ClimateEnvoy com propostas sobre como os #EUA deveria apoiar esforços de preservação da #Amazônia. O governo Biden deve condicionar o apoio a resultados concretos na redução do desmatamento. Confira a coluna de @JamilChade    https://t.co/E6UAiGbrbh,pt,"[{'screen_name': 'hrw_brasil', 'name': 'hrw brasil', 'id': '1581259116'}, {'screen_name': 'climateenvoy', 'name': 'special presidential envoy john kerry', 'id': '1351716580720316417'}, {'screen_name': 'jamilchade', 'name': 'jamil chade', 'id': '224628959'}]",['https://noticias.uol.com.br/colunas/jamil-chade/2021/03/11/amazonia-deve-condicionar-apoio-de-biden-ao-brasil-na-ocde-propoe-entidade.htm?cmpid=copiaecola'],[],0,0,2,"['eua', 'amazônia']",[],https://twitter.com/mlcanineu/status/1370454511270178822,False,,0,,,,,,,,[],,,,
1370454254935244800,1370454254935244800,2021-03-12 16:18:50 -03,2021-03-12,16:18:50,-0300,1581259116,hrw_brasil,HRW Brasil,,A @hrw_brasil enviou carta ao @ClimateEnvoy com propostas sobre como os #EUA deveria apoiar esforços de preservação da #Amazônia. O governo Biden deve condicionar o apoio a resultados concretos na redução do desmatamento. Confira a coluna de @JamilChade 👉 https://t.co/IP3Uwmlg85  https://t.co/bk7fEysxsf,pt,"[{'screen_name': 'hrw_brasil', 'name': 'hrw brasil', 'id': '1581259116'}, {'screen_name': 'climateenvoy', 'name': 'special presidential envoy john kerry', 'id': '1351716580720316417'}, {'screen_name': 'jamilchade', 'name': 'jamil chade', 'id': '224628959'}]",['https://bit.ly/3lfeXgP'],['https://pbs.twimg.com/media/EwTUst_WEAUg756.jpg'],0,10,19,"['eua', 'amazônia']",[],https://twitter.com/hrw_brasil/status/1370454254935244800,False,,1,https://pbs.twimg.com/media/EwTUst_WEAUg756.jpg,,,,,,,[],,,,
1370440433449451522,1370440427455840260,2021-03-12 15:23:55 -03,2021-03-12,15:23:55,-0300,70809242,defesagovbr,Ministério da Defesa,,"O resultado reflete a atuação ininterrupta das #ForçasArmadas, das agências ambientais e dos órgãos de segurança pública, no combate ao desmatamento e a ilícitos ambientais na Amazônia Legal.  📝 Leia a matéria completa da Defesa e confira mais informações: https://t.co/gc572WG3Tw  https://t.co/5a8Fl1r0lh",pt,[],['https://www.gov.br/defesa/pt-br/centrais-de-conteudo/noticias/operacao-verde-brasil-com-queda-de-34-em-fevereiro-desmatamento-e-o-menor-dos-ultimos-4-anos-pelo-segundo-mes-consecutivo'],['https://pbs.twimg.com/media/EwTHxd0WEAAQUih.jpg'],6,28,119,['forçasarmadas'],[],https://twitter.com/DefesaGovBr/status/1370440433449451522,False,,1,https://pbs.twimg.com/media/EwTHxd0WEAAQUih.jpg,,,,,,,[],,,,
1370440427455840260,1370440427455840260,2021-03-12 15:23:54 -03,2021-03-12,15:23:54,-0300,70809242,defesagovbr,Ministério da Defesa,,"#OperaçãoVerdeBrasil2 | Com queda de 34% em fevereiro, desmatamento na Amazônia é o menor dos últimos 4 anos pelo segundo mês consecutivo‼️ ➡️ Nos últimos sete meses, a redução acumulada chega a 21%, de acordo com dados do @inpe_mct.  https://t.co/Xozbrz0q8Q",pt,"[{'screen_name': 'inpe_mct', 'name': 'inpe', 'id': '308605432'}]",[],['https://pbs.twimg.com/media/EwTGw9wXEAAaWVq.jpg'],17,126,468,['operaçãoverdebrasil2'],[],https://twitter.com/DefesaGovBr/status/1370440427455840260,False,,1,https://pbs.twimg.com/media/EwTGw9wXEAAaWVq.jpg,,,,,,,[],,,,
1370435672121692166,1370435672121692166,2021-03-12 15:05:00 -03,2021-03-12,15:05:00,-0300,138492825,proindio,Comissão Pró-Índio,,"O Pará é o estado com o maior número de APs no ranking de ameaça e pressão por #desmatamento na #Amazônia Legal, segundo dados de novembro de 2020 a janeiro de 2021, do Imazon. As APs mais ameaçadas são as Terras #Indígenas Parakanã e Trincheira/Bacajá  https://t.co/MeLybzIPGM",pt,[],['https://g1.globo.com/pa/para/noticia/2021/03/11/pa-e-o-estado-com-mais-areas-protegidas-no-ranking-de-ameaca-e-pressao-por-desmatamento-na-amazonia-diz-imazon.ghtml'],[],1,8,10,"['desmatamento', 'amazônia', 'indígenas']",[],https://twitter.com/proindio/status/1370435672121692166,False,,0,,,,,,,,[],,,,
1370430827021107210,1370429489218531329,2021-03-12 14:45:45 -03,2021-03-12,14:45:45,-0300,813868325386260480,vitinkrai,Vitin ☭,,@jaost42 Os responsáveis pelo desmatamento na Amazônia,pt,[],[],[],1,0,1,[],[],https://twitter.com/vitinkrai/status/1370430827021107210,False,,0,,,,,,,,"[{'screen_name': 'jaost42', 'name': '͏', 'id': '1058192360381841408'}]",,,,
1370419633036070912,1370419630137876481,2021-03-12 14:01:16 -03,2021-03-12,14:01:16,-0300,1058872553509400576,marcior_silva,Marcio Silva.,,"Base de Alcântara, Biopirataria oficial, O fiasco dos 500 anos, Eduardo Jorge, Drible na reforma tributária, Rombo transamazônico na Sudam, Os desvios na Sudene; Calote no Fundef; Abuso de MPs; Acidentes na Petrobras; Apoio a Fujimori; Desmatamento na Amazônia",pt,[],[],[],1,0,4,[],[],https://twitter.com/MarcioR_Silva/status/1370419633036070912,False,,0,,,,,,,,[],,,,
1370418036998541316,1370397171267334146,2021-03-12 13:54:55 -03,2021-03-12,13:54:55,-0300,39615607,celsohlsj,Prof. Celso H. L. Silva Junior 🇧🇷,,"@RajaoPhD @rsallesmma Na verdade é o contrário. Desmatamento predatório gera pobreza. Veja o exemplo da Amazônia Maranhense, quase todos os recursos florestais explorados e um dos piores indicadores sociais do país.   https://t.co/BbC9U1IjJE",pt,[],['https://www.sciencedirect.com/science/article/abs/pii/S0264837720301071?via%3Dihub'],[],0,0,8,[],[],https://twitter.com/celsohlsj/status/1370418036998541316,False,,0,,,,,,,,"[{'screen_name': 'RajaoPhD', 'name': 'Raoni Rajão 🇧🇷', 'id': '1070270400662265856'}, {'screen_name': 'rsallesmma', 'name': 'Ricardo Salles', 'id': '971822131024748545'}]",,,,
1370414723951435778,1370414723951435778,2021-03-12 13:41:45 -03,2021-03-12,13:41:45,-0300,227033563,marcioastrini,Marcio Astrini,,"Ao contrário do que diz o ser abjeto, pobre não é culpado, mas vítima do desmatamento.  Primeiro, cerca de 2/3 da população da Amazônia vive em cidades e não estão no meio do mato com uma motosserra na mão pra tirar seu sustento, como faz crer o ministro.  https://t.co/1lP7ktKVIe",pt,[],['https://jovempan.com.br/programas/jornal-da-manha/desmatamento-ilegal-na-amazonia-e-consequencia-da-pobreza-da-populacao-diz-salles.html?amp&__twitter_impression=true'],[],1,9,35,[],[],https://twitter.com/MarcioAstrini/status/1370414723951435778,False,,0,,,,,,,,[],,,,
1370399445083299843,1370399444676440071,2021-03-12 12:41:03 -03,2021-03-12,12:41:03,-0300,1263106035964878848,damatareporter,Da Mata Repórter,,"A principal causa de destruição da Amazônia no mês (120,58 km²), foi o desmatamento com solo exposto, aquele que deixa a terra sem nenhuma vegetação. O Pará foi o estado que mais teve desmatamento (36,13 km²). A cidade que mais sofreu desmatamento foi Apui / Amazonas (9,02 km²).",pt,[],[],[],1,0,0,[],[],https://twitter.com/DaMataReporter/status/1370399445083299843,False,,0,,,,,,,,[],,,,
1370397183640547329,1370397171267334146,2021-03-12 12:32:03 -03,2021-03-12,12:32:03,-0300,1070270400662265856,rajaophd,Raoni Rajão 🇧🇷,,"Também ao analisar o perfil dos imóveis no CAR que mais desmatam, é possível notar que somente 2% dos imóveis médios e grandes concentram 62% de todo desmatamento potencialmente ilegal pós 2008 na Amazônia e Cerrado.  +  https://t.co/mDHlKkIOpy",pt,[],[],['https://pbs.twimg.com/media/EwSb28cWYAMsr9Q.png'],1,8,49,[],[],https://twitter.com/RajaoPhD/status/1370397183640547329,False,,1,https://pbs.twimg.com/media/EwSb28cWYAMsr9Q.png,,,,,,,[],,,,
1370397171267334146,1370397171267334146,2021-03-12 12:32:01 -03,2021-03-12,12:32:01,-0300,1070270400662265856,rajaophd,Raoni Rajão 🇧🇷,,"@rSallesmma sugere que o principal fator do desmatamento na Amazônia é a pobreza. Além de falsa, essa afirmação acaba contribuindo para o aumento da destruição ambiental ao desviar a atenção dos verdadeiros culpados. +   https://t.co/t2HpLKvnU6",pt,[],['https://jovempan.com.br/programas/jornal-da-manha/desmatamento-ilegal-na-amazonia-e-consequencia-da-pobreza-da-populacao-diz-salles.html'],[],9,20,92,[],[],https://twitter.com/RajaoPhD/status/1370397171267334146,False,,0,,,,,,,,[],,,,
1370391232380297217,1370391232380297217,2021-03-12 12:08:25 -03,2021-03-12,12:08:25,-0300,389860349,m_cavalcante3,Manoel Cavalcante,,"Fachin vota considerar inconstitucionaL.Bolsonaro SOBRE,armas,QUEM NÃOÉ CONTRATUDO DE ERRADO QUE O PRESIDENTE JAIR BOLSONARO TEM FEITO EM RALAÇÃO AO VÍRUS,AMAZÔNIA,AOS ÍNDIOS DESMATAMENTO,REDE GLOBO,ESSA BRIGA É UM INCENTIVO PARAPRESIDENTE JAIR,FANTASIA PAULO MARINHO CRIOUMORTE.V",pt,[],[],[],0,0,0,[],[],https://twitter.com/m_cavalcante3/status/1370391232380297217,False,,0,,,,,,,,[],,,,
1370389054605381635,1370374159583350786,2021-03-12 11:59:45 -03,2021-03-12,11:59:45,-0300,1199411120613842947,alexrt29187721,Alexrt,,@JovemPanNews -Favelado comete crime pq é bandido -Desmatamento na Amazônia acontece pq as pessoas são  pobres  A narrativa muda conforme o interesse,pt,[],[],[],0,0,0,[],[],https://twitter.com/Alexrt29187721/status/1370389054605381635,False,,0,,,,,,,,"[{'screen_name': 'JovemPanNews', 'name': 'Jovem Pan News', 'id': '106175018'}]",,,,
1370386029782441985,1370381315804176384,2021-03-12 11:47:44 -03,2021-03-12,11:47:44,-0300,886323530463404033,brainerkist,Brainer Kist,,"@rsallesmma Cuma??? Diria Didi Mocó. Todo mundo sabe que o desmatamento é para dar lugar a pastagens de grandes produtores de gado e depois para a plantação de monoculturas. Aliás, como que faz pra comprar um lote na Amazônia?",pt,[],[],[],0,0,0,[],[],https://twitter.com/BrainerKist/status/1370386029782441985,False,,0,,,,,,,,"[{'screen_name': 'rsallesmma', 'name': 'Ricardo Salles', 'id': '971822131024748545'}]",,,,
1370385040895574016,1370385040895574016,2021-03-12 11:43:48 -03,2021-03-12,11:43:48,-0300,67645610,mongabay_brasil,Mongabay Brasil,,Desmatamento e água contaminada: o lado obscuro do óleo de palma ‘sustentável’ da Amazônia  Estudos baseados em imagens de satélite também jogam por terra afirmações das empresas de que monocultura foi implantada apenas em terras previamente desmatadas.   https://t.co/2K3eFh7DgQ  https://t.co/SdwWSO7Hv6,pt,[],['https://brasil.mongabay.com/2021/03/desmatamento-e-agua-contaminada-o-lado-obscuro-do-oleo-de-palma-sustentavel-da-amazonia/'],['https://pbs.twimg.com/media/EwSVuNUXAAI7d13.png'],0,9,18,[],[],https://twitter.com/mongabay_brasil/status/1370385040895574016,False,,1,https://pbs.twimg.com/media/EwSVuNUXAAI7d13.png,,,,,,,[],,,,
1370383519655079957,1370383519655079957,2021-03-12 11:37:46 -03,2021-03-12,11:37:46,-0300,1183897036988526600,leoferreirabra,Léo Ferreira,,"Desmatamento ilegal na Amazônia é consequência da pobreza da população, diz Salles  https://t.co/SdsN7HYTSw",pt,[],['https://ift.tt/3tbUpbV'],[],0,0,0,[],[],https://twitter.com/leoferreirabra/status/1370383519655079957,False,,0,,,,,,,,[],,,,
1370374159583350786,1370374159583350786,2021-03-12 11:00:34 -03,2021-03-12,11:00:34,-0300,106175018,jovempannews,Jovem Pan News,,"Desmatamento ilegal na Amazônia é consequência da pobreza da população, diz Salles.   https://t.co/k2CHwCLPm3  https://t.co/av2U5cXRvL",pt,[],['https://buff.ly/3le8AdF'],['https://pbs.twimg.com/media/EwSMCSyXAAQlgRH.jpg'],35,9,143,[],[],https://twitter.com/JovemPanNews/status/1370374159583350786,False,,1,https://pbs.twimg.com/media/EwSMCSyXAAQlgRH.jpg,,,,,,,[],,,,
1370370134376861696,1370370134376861696,2021-03-12 10:44:34 -03,2021-03-12,10:44:34,-0300,2701254700,adilson23187067,ADILSON RODRIGUES,,"A imprensa fez campanha mentirosa sobre o desmatamento. Uns bostas líderes mundiais cortaram verbas e entraram na onda sob o pretexto d salvar vidas, pq a Amazonia  era o pulmão do mundo O q eles fazem agora pra liberação d vacinas e salvar os pulmões dos brasileiros? Canalhas!",pt,[],[],[],0,0,0,[],[],https://twitter.com/adilson23187067/status/1370370134376861696,False,,0,,,,,,,,[],,,,
1370367642524123137,1370367638141034497,2021-03-12 10:34:40 -03,2021-03-12,10:34:40,-0300,42694413,mobrandao,Monica Brandão,,"A desvalorização das ações da Petrobras por conta da interferência na presidência, a escolha de um milico covarde a frete da pasta da saúde, a incompetência do ministro da economia, o desmatamento na Amazônia, as queimadas no pantanal, a liberação dos agrotóxicos,",pt,[],[],[],1,0,1,[],[],https://twitter.com/mobrandao/status/1370367642524123137,False,,0,,,,,,,,[],,,,
1370367365540630537,1370367365540630537,2021-03-12 10:33:34 -03,2021-03-12,10:33:34,-0300,42981596,jullyienne,Julie,,Lula ofenda o presidente pelo desmatamento A Amazônia precisa de vc homem,pt,[],[],[],0,0,1,[],[],https://twitter.com/Jullyienne/status/1370367365540630537,False,,0,,,,,,,,[],,,,
1370335065763368966,1370335065763368966,2021-03-12 08:25:13 -03,2021-03-12,08:25:13,-0300,3091695449,janesouza08,Jane Souza,,Que o MUNDO saiba que os corruptos pegaram pelo sangue inocentes dedsas crianças. E o desmatamento na Amazônia.,pt,[],[],[],0,0,0,[],[],https://twitter.com/janesouza08/status/1370335065763368966,False,,0,,,,,,,,[],,,,
1370334241255460868,1370334241255460868,2021-03-12 08:21:57 -03,2021-03-12,08:21:57,-0300,3091695449,janesouza08,Jane Souza,,"Bolsonaro,  comece uma força tarefa PARA investigar o que aconteceu no Brasil nos últimos 15 anos.  As investigações abrangem o desmatamento na Amazônia,  quantas FAZENDAS de gados existem e de quem são?",pt,[],[],[],1,0,0,[],[],https://twitter.com/janesouza08/status/1370334241255460868,False,,0,,,,,,,,[],,,,
1370289311946571777,1370181620775464964,2021-03-12 05:23:25 -03,2021-03-12,05:23:25,-0300,3437124874,fabiobra_sep,Fabio 🇧🇷,,"@PauloMartins10 Enquanto fica essa putaria do stf dentro os paises la fora se articulam para enfraquecer o Brasil com sanções a respeito do ""desmatamento"" na Amazônia!",pt,[],[],[],0,0,0,[],[],https://twitter.com/FabioBRA_SEP/status/1370289311946571777,False,,0,,,,,,,,"[{'screen_name': 'PauloMartins10', 'name': 'Paulo Eduardo Martins', 'id': '36714942'}]",,,,
1370241474785390594,1370238266935549954,2021-03-12 02:13:20 -03,2021-03-12,02:13:20,-0300,1239570282723057666,presshubbr,Flash News Press Hub Brasil,,"@elpais_america Brasil foco de mortes por Covid-19. São dois dias seguidos com mais de 2 mil mortes /dia.   Desmatamento da Amazônia, queimadas, assassinatos de indígenas e pandemia.  Comprar produto brasileiro faz mal para vida. Tem sabor de fumaça, sangue e doença.   Quem compra respalda...",pt,[],[],[],1,0,1,[],[],https://twitter.com/presshubbr/status/1370241474785390594,False,,0,,,,,,,,"[{'screen_name': 'elpais_america', 'name': 'EL PAÍS América', 'id': '1244357988'}]",,,,
1370236733338615808,1365991749253029889,2021-03-12 01:54:29 -03,2021-03-12,01:54:29,-0300,1226721402952323073,rssc96,Vanderson,,"@GeneralMourao @GovernoPara Queremos ver o progresso do plano, queremos nossa amazônia sem desmatamento.",pt,[],[],[],0,0,0,[],[],https://twitter.com/RSSC96/status/1370236733338615808,False,,0,,,,,,,,"[{'screen_name': 'GeneralMourao', 'name': 'General Hamilton Mourão', 'id': '1058819604741525510'}, {'screen_name': 'GovernoPara', 'name': 'Governo do Pará', 'id': '153505589'}]",,,,
