id,conversation_id,created_at,date,time,timezone,user_id,username,name,place,tweet,language,mentions,urls,photos,replies_count,retweets_count,likes_count,hashtags,cashtags,link,retweet,quote_url,video,thumbnail,near,geo,source,user_rt_id,user_rt,retweet_id,reply_to,retweet_date,translate,trans_src,trans_dest
1356555650302701568,1356219856106868737,2021-02-02 07:50:45 SA Eastern Standard Time,2021-02-02,07:50:45,-0300,170736174,niltonlrs,NS,,"@renatoalligator @CNNBrasil Crime de responsabilidade por apoio ao ataque dos EUA que matou o gen. Iraniano Qassem Soleimaini sem consulta ao Cons. de Defesa Nacional nem autorização do congresso, queimadas na Amazônia e Pantanal, genocídio indígena, comportamento de risco e descaso com covid-19+",pt,[],[],[],1,0,0,[],[],https://twitter.com/niltonlrs/status/1356555650302701568,False,,0,,,,,,,,"[{'screen_name': 'renatoalligator', 'name': 'Renato Serrano Cruz', 'id': '161648832'}, {'screen_name': 'CNNBrasil', 'name': 'CNN Brasil', 'id': '809124436880322561'}]",,,,
1356551110589362176,1356425392752652289,2021-02-02 07:32:42 SA Eastern Standard Time,2021-02-02,07:32:42,-0300,4678191122,edumeirabr,Eduardo Meira,,"@Anitta Agora os bois vão peidar mais, aumentando assim as queimadas na Amazônia e prejudicando as girafas. Cada vez mais existirá mais boi que gente, sabia? Acabaram-se as esperanças.",pt,[],[],[],2,2,32,[],[],https://twitter.com/edumeirabr/status/1356551110589362176,False,,0,,,,,,,,"[{'screen_name': 'Anitta', 'name': 'Anitta', 'id': '141817380'}]",,,,
1356451502651564033,1356445634287517698,2021-02-02 00:56:54 SA Eastern Standard Time,2021-02-02,00:56:54,-0300,1280343628246908929,moneybaxsr,𝔪𝔬𝔫𝔢𝔶𝔟𝔞𝔵𝔰 - reserva,,"@escalea_ ela botou a cara pra falar do desmatamento e queimadas na Amazônia, botou a cara quando queria aprovar uma emenda que prejudicaria os compositores",pt,[],[],[],0,0,0,[],[],https://twitter.com/MoneybaxsR/status/1356451502651564033,False,,0,,,,,,,,"[{'screen_name': 'escalea_', 'name': 'Yasmin Escalea', 'id': '285969140'}]",,,,
1356390507447001104,1356381073039650820,2021-02-01 20:54:32 SA Eastern Standard Time,2021-02-01,20:54:32,-0300,947821716587282432,glauber22407621,Glauber 🌹,,"@lucaspcr_ @folha Marina mas queimadas na Amazônia e Pantanal apareceu e muito ,o seu partido rede ao lado do PDT são os que mais entrem com ações contra esse desgoverno",pt,[],[],[],0,0,9,[],[],https://twitter.com/Glauber22407621/status/1356390507447001104,False,,0,,,,,,,,"[{'screen_name': 'lucaspcr_', 'name': 'Lucas 🌿 🍿', 'id': '1109815318808051714'}, {'screen_name': 'folha', 'name': 'Folha de S.Paulo', 'id': '14594813'}]",,,,
1356306740300685318,1356306740300685318,2021-02-01 15:21:40 SA Eastern Standard Time,2021-02-01,15:21:40,-0300,256493925,sou_ecologico,Revista Ecológico,,"As queimadas na Amazônia e no Pantanal não foram abordadas por Mourão. Por outro lado, o vice-presidente abordou o Fundo Amazônia. Veja!   https://t.co/RqNrIoMNRA",pt,[],['http://www.souecologico.com/sou-ecologico/em-participacao-no-forum-economico-mourao-distorce-realidade-ambiental-e-pede-ajuda-ao-setor-privado/'],[],0,0,0,[],[],https://twitter.com/sou_ecologico/status/1356306740300685318,False,,0,,,,,,,,[],,,,
1356285069154004995,1355828443624189952,2021-02-01 13:55:33 SA Eastern Standard Time,2021-02-01,13:55:33,-0300,1331990790348922880,barbara80777166,Barbara,,"@nguedesboot @xicograziano @jairbolsonaro @ministropazuelo @policiafederal @ernestofaraujo @MPF_PGR @alexandregarcia Sem esquecer que toda essas queimadas na Amazônia e etc, foram feitas criminalmente. E as imagens delas vendidas com um contrato de exclusividade, com a WWF e que conseguiram doações milionárias, inclusive do Leonardo DiCaprio! Parabéns a Polícia Federal!  https://t.co/zSg6EX1M0R",pt,[],[],[],0,0,0,[],[],https://twitter.com/Barbara80777166/status/1356285069154004995,False,,1,https://pbs.twimg.com/ext_tw_video_thumb/1356284867999371267/pu/img/H7NO4r0vZ-cBYZZ9.jpg,,,,,,,"[{'screen_name': 'nguedesboot', 'name': '#NaoDeixemOcristianismoMORRER🙏🇧🇷', 'id': '1214147024888614912'}, {'screen_name': 'xicograziano', 'name': 'Xico Graziano', 'id': '41881267'}, {'screen_name': 'jairbolsonaro', 'name': 'Jair M. Bolsonaro', 'id': '128372940'}, {'screen_name': 'ministropazuelo', 'name': 'Pazuello', 'id': '1253682389512941568'}, {'screen_name': 'policiafederal', 'name': 'Polícia Federal', 'id': '106714016'}, {'screen_name': 'ernestofaraujo', 'name': 'Ernesto Araújo', 'id': '1062831969476771842'}, {'screen_name': 'MPF_PGR', 'name': 'MP Federal', 'id': '259840707'}, {'screen_name': 'alexandregarcia', 'name': 'Alexandre Garcia', 'id': '727130698021261313'}]",,,,
1356255988861513731,1356255988861513731,2021-02-01 12:00:00 SA Eastern Standard Time,2021-02-01,12:00:00,-0300,1285978765907111936,canalreload,Canal Reload,,"O povo Guató indígenas nativos do pantanal mato-grossense, teve mais de 90% de seu território destruído pelas queimadas. A @amazonia_real conta como eles tentam se reerguer dia após dia.  #DáUmReload #Queimadas #MeioAmbiente  https://t.co/QGmkpY9tmY",pt,"[{'screen_name': 'amazonia_real', 'name': 'amazônia real', 'id': '2147700098'}]",[],[],0,6,5,"['dáumreload', 'queimadas', 'meioambiente']",[],https://twitter.com/CanalReload/status/1356255988861513731,False,,1,https://pbs.twimg.com/amplify_video_thumb/1354150395434721288/img/PxBNRrAUxbRG3FYz.jpg,,,,,,,[],,,,
1356246665804587012,1356064537468956675,2021-02-01 11:22:57 SA Eastern Standard Time,2021-02-01,11:22:57,-0300,1311066874579476481,imperiovale,Rio Doce,,"@urso_polar_fofo Blm, Chapecoense, 7X1, copa de 2014, atleta falando sobre assalto no rio 2016 (os fakes) surto de febre amarela aqui em minas e arredores, queimadas na Amazônia e pantanal  Impeachment da Dilma, Iphone 12 sem carregador e os anonymous, isso é o que eu lembro",pt,[],[],[],0,0,0,[],[],https://twitter.com/ImperioVale/status/1356246665804587012,False,,0,,,,,,,,[],,,,
1356232377878663170,1356231904920481795,2021-02-01 10:26:11 SA Eastern Standard Time,2021-02-01,10:26:11,-0300,840891392,johncakelover,John,,@ojudeuateu eu achava que isso ia acontecer quando as queimadas da amazonia cairam na midia internacional,pt,[],[],[],1,0,0,[],[],https://twitter.com/johncakelover/status/1356232377878663170,False,,0,,,,,,,,"[{'screen_name': 'ojudeuateu', 'name': 'O Judeu Ateu 🏴🚩', 'id': '152832353'}]",,,,
1356218634968965120,1355672145288945665,2021-02-01 09:31:34 SA Eastern Standard Time,2021-02-01,09:31:34,-0300,213074502,sandroprofmat,Sandro,,"@RamonSo16799186 @malubelan @Abimaelfontes @jornalnacional Pera... Sobre as queimadas na Amazônia e no Pantanal. Disse que seu governo é vítima de “uma das mais brutais campanhas de desinformação sobre a Amazônia e o Pantanal”. E sobre a cristofobia? Fraude nas eleições 2018? ... Ramon, se fosse uma, caberia no tal contexto da declaração",pt,[],[],[],4,0,1,[],[],https://twitter.com/Sandroprofmat/status/1356218634968965120,False,,0,,,,,,,,"[{'screen_name': 'malubelan', 'name': 'Maria Luisa', 'id': '16930892'}, {'screen_name': 'Abimaelfontes', 'name': 'Abimael F. Ferreira', 'id': '233608113'}, {'screen_name': 'jornalnacional', 'name': 'Jornal Nacional', 'id': '214570761'}]",,,,
1356061504857059330,1356055581820399617,2021-01-31 23:07:11 SA Eastern Standard Time,2021-01-31,23:07:11,-0300,1245641247621918729,pelaiog,pelaio gentil,,"@GarimpeiroGeo Jay estão militarizado a questão da Amazônia, colocando o problema das queimadas como um risco a segurança de vários países, o BIDÊ deu 120 dias para o pentágono concluir um estudo e colocar a questão da Amazônia em sua prioridade! Eles virão, mais cedo do que se imagina!",pt,[],[],[],0,0,3,[],[],https://twitter.com/PelaioG/status/1356061504857059330,False,,0,,,,,,,,[],,,,
1356041529341652998,1355882490079150082,2021-01-31 21:47:49 SA Eastern Standard Time,2021-01-31,21:47:49,-0300,1323436519303094272,vinizanoni,Vini Zanoni,,"@Metropoles @SGPsicopolitica Exatamente o que estava sendo dito. A fixação no frame ""Amazônia / queimadas / oxigênio /sufocamento"". Só falta imitaram George Floyd.",pt,[],[],[],1,0,2,[],[],https://twitter.com/ViniZanoni/status/1356041529341652998,False,,0,,,,,,,,"[{'screen_name': 'Metropoles', 'name': 'Metrópoles', 'id': '3331429624'}]",,,,
1356027236118355968,1356027236118355968,2021-01-31 20:51:01 SA Eastern Standard Time,2021-01-31,20:51:01,-0300,76515309,leocisneiros,Leo Cisneiros 🌵🏜️,,Bolsonaro deveria já ter sido enquadrado como ameaça à segurança do planeta desde as queimadas na Amazônia. E agora com o Bolsovirus ameaçando anular todo esforço com as vacinas. É engraçado como uma retórica militaresca de intervenção do passado perdeu poder com as novas ameaças,pt,[],[],[],0,0,23,[],[],https://twitter.com/leocisneiros/status/1356027236118355968,False,,0,,,,,,,,[],,,,
1356005963858325507,1356005963858325507,2021-01-31 19:26:29 SA Eastern Standard Time,2021-01-31,19:26:29,-0300,1273655800146337792,sandroquirinog1,Sandro Quirino Goncalves,,VERGONHA A ONG WWF ESTÁ ENVOLVIDA NAS QUEIMADAS DA AMAZÔNIA E MAIS CAMIN...  https://t.co/a1tPNtfdjD via @YouTube,pt,"[{'screen_name': 'youtube', 'name': 'youtube', 'id': '10228272'}]",['https://youtu.be/MChXocriGhk'],[],0,0,0,[],[],https://twitter.com/SandroQuirinoG1/status/1356005963858325507,False,,0,,,,,,,,[],,,,
1355966255824564225,1355966255824564225,2021-01-31 16:48:42 SA Eastern Standard Time,2021-01-31,16:48:42,-0300,1260238322,jorgegueler,Jorge Gueler,,Queimadas da Amazônia sempre foram um grande negócio! Porque a esquerda esqueceu do fogo na Amazônia... 🤣🤣🤣🤣🤣🤣🤣🤣🤣🤣   https://t.co/0c9zw2WTQf,pt,[],['https://m.facebook.com/story.php?story_fbid=1696850073827486&id=100005075281687&sfnsn=wiwspwa'],[],0,0,0,[],[],https://twitter.com/JorgeGueler/status/1355966255824564225,False,,0,,,,,,,,[],,,,
1355958472534327297,1355951044833009670,2021-01-31 16:17:46 SA Eastern Standard Time,2021-01-31,16:17:46,-0300,1049076388089794562,beccaria_de,CÉSARE BECCARIA,,@kardecvirtual NÃO FALEI DAS IGREJAS QUEIMADAS NO CHILE NÃO FALEI DA APROVAÇÃO DO ABORTO NA ARGENTINA... MAS FALEI DAS QUEIMADAS NA AMAZÔNIA . PAPA FRANCISCO,pt,[],[],[],0,0,0,[],[],https://twitter.com/beccaria_de/status/1355958472534327297,False,,0,,,,,,,,"[{'screen_name': 'kardecvirtual', 'name': 'Kardec Virtual', 'id': '2904231345'}]",,,,
1355952243250487296,1355933606129119236,2021-01-31 15:53:01 SA Eastern Standard Time,2021-01-31,15:53:01,-0300,2865953295,zuzudokeke,o que é que num faz a falta dum cleme,,"@netolab_ ""por que, deus?""?  tira isso aí da conta de deus kkkkkkk esse calor infernal é fruto da intervenção humana mesmo. lembra as queimadas e o desmatamento da amazônia em 2020? então, a conta chegou. kkkk verões mais quentes e infernos mais frios são efeitos das mudanças climáticas",pt,[],[],[],2,0,0,[],[],https://twitter.com/ZuzuDoKeke/status/1355952243250487296,False,,0,,,,,,,,"[{'screen_name': 'netolab_', 'name': 'Netolab (de 🏠)', 'id': '1204796683214868480'}]",,,,
1355951639216222209,1355951639216222209,2021-01-31 15:50:37 SA Eastern Standard Time,2021-01-31,15:50:37,-0300,35524446,ecodebate,Portal EcoDebate,,Levantamento inédito revela que os incêndios não só bateram recorde mas dificultaram o diagnóstico de Covid-19 no ano que marcou a trágica combinação de queimadas e pandemia na Amazônia   https://t.co/zMjSrpU21V,pt,[],['https://www.ecodebate.com.br/2021/01/28/periodo-de-queimadas-na-amazonia-tem-28-mil-hospitalizacoes-por-problemas-respiratorios/'],[],0,3,4,[],[],https://twitter.com/ecodebate/status/1355951639216222209,False,,0,,,,,,,,[],,,,
1355942527862509568,1355862826200477697,2021-01-31 15:14:25 SA Eastern Standard Time,2021-01-31,15:14:25,-0300,3195311927,angelopiauhy,Angelo Araujo,,"@danibacedo Depois que esse genocida assumiu todas as desgraças caíram sobre a nação; Brumadinho, óleo nas praias do nordeste, queimadas no Pantanal e na Amazônia,  covid 19, inflação alta, dólar nas alturas, fome, ódio e ignorância....",pt,[],[],[],0,0,12,[],[],https://twitter.com/angelopiauhy/status/1355942527862509568,False,,0,,,,,,,,"[{'screen_name': 'danibacedo', 'name': 'Dani Bah', 'id': '201718418'}]",,,,
1355928307032842241,1355475847780548615,2021-01-31 14:17:54 SA Eastern Standard Time,2021-01-31,14:17:54,-0300,1057446371534475264,feliperngel1,que isso?,,@ar_adriano @thomasnilton @KelyOliveira @g1 Mil desculpas. Mas entendeu o que eu tô falando? Você disse pra analisar os incêndios no bioma amazônico e pantaneiro a partir do encontro deles com o cerrado. Eu acabei de te mostrar que a queimadas na Amazônia não vem disso e simplesmente das zonas de desmate.,pt,[],[],[],2,0,0,[],[],https://twitter.com/FelipeRngel1/status/1355928307032842241,False,,0,,,,,,,,"[{'screen_name': 'ar_adriano', 'name': 'Rodrigo ˢᶜᶜᵖ 🦅', 'id': '344965817'}, {'screen_name': 'thomasnilton', 'name': 'Thomas Teixeira', 'id': '52061548'}, {'screen_name': 'KelyOliveira', 'name': 'Kely Oliveira ☀️✨', 'id': '46575669'}, {'screen_name': 'g1', 'name': 'G1', 'id': '8802752'}]",,,,
1355922638846230534,1355922638846230534,2021-01-31 13:55:23 SA Eastern Standard Time,2021-01-31,13:55:23,-0300,885814942317850624,luizxrosario,LUIZ_6.3♎ 📸⚖😷,,"Em carta, Sting acusa Bolsonaro de negligência criminal em escala global por queimadas na Amazônia  https://t.co/XlXNO2SwTx",pt,[],['https://rollingstone.uol.com.br/noticia/em-carta-sting-acusa-bolsonaro-de-negligencia-criminal-em-escala-global/#.YBbg8IsVxIQ.twitter'],[],2,0,17,[],[],https://twitter.com/LuizxRosario/status/1355922638846230534,False,,0,,,,,,,,[],,,,
1355914974934294528,1355914974934294528,2021-01-31 13:24:56 SA Eastern Standard Time,2021-01-31,13:24:56,-0300,1176714169,scoobynil,NORIVALDO FERNANDES,,"Assista a ""Bolsonaro diz que ONGs podem ter provocado queimadas na Amazônia"" no YouTube  https://t.co/uE5wUnzoDT",pt,[],['https://youtu.be/y_aWXEgxNnA'],[],0,0,0,[],[],https://twitter.com/scoobynil/status/1355914974934294528,False,,0,,,,,,,,[],,,,
1355904504814776320,1355904504814776320,2021-01-31 12:43:20 SA Eastern Standard Time,2021-01-31,12:43:20,-0300,938837643667935232,millenepaulaa,sagiotaria,,"Pra vc que acha que as queimadas do pantanal e da Amazônia não interferem na nossa chuva, só percebam a diferença de chuva dos últimos anos, sério, tá muito alarmante",pt,[],[],[],0,0,4,[],[],https://twitter.com/millenepaulaa/status/1355904504814776320,False,,0,,,,,,,,[],,,,
1355879437166899200,1355475847780548615,2021-01-31 11:03:43 SA Eastern Standard Time,2021-01-31,11:03:43,-0300,1057446371534475264,feliperngel1,que isso?,,"@ar_adriano @thomasnilton @KelyOliveira @g1 E sobre a amazônia, as queimadas são quase todas, causadas pelo desmatamento. A amazônia é um bioma enorme, esse argumento de encontro com o cerrado faria sentido se os incêndios fosse no sul do mato grosso. Já que a floresta se estende até essa região.",pt,[],[],[],2,0,0,[],[],https://twitter.com/FelipeRngel1/status/1355879437166899200,False,,0,,,,,,,,"[{'screen_name': 'ar_adriano', 'name': 'Rodrigo ˢᶜᶜᵖ 🦅', 'id': '344965817'}, {'screen_name': 'thomasnilton', 'name': 'Thomas Teixeira', 'id': '52061548'}, {'screen_name': 'KelyOliveira', 'name': 'Kely Oliveira ☀️✨', 'id': '46575669'}, {'screen_name': 'g1', 'name': 'G1', 'id': '8802752'}]",,,,
1355862598651142146,1355862598651142146,2021-01-31 09:56:48 SA Eastern Standard Time,2021-01-31,09:56:48,-0300,83557732,josueisonline,Josué,,"Incêndios e queimadas na Amazônia, tão comuns no mundo, flamejaram discursos ambientalistas tipo Macron/Merkel e ações da esquerda brasileira, midiática, onguista/para$ita e estudantil ramificada por Londres, Paris, que faz retumbância contra o Brasil",pt,[],[],[],0,0,2,[],[],https://twitter.com/JosueIsOnline/status/1355862598651142146,False,,0,,,,,,,,[],,,,
1355857437262303232,1355857437262303232,2021-01-31 09:36:18 SA Eastern Standard Time,2021-01-31,09:36:18,-0300,1259854023710191624,sgtpereiradopra,Luiz Pedro Pereira,,VEJAM A VERDADE SOBRE AS QUEIMADAS NA AMAZÔNIA  https://t.co/B1piWaIyPz,pt,[],[],[],0,1,2,[],[],https://twitter.com/sgtpereiradopra/status/1355857437262303232,False,,1,https://pbs.twimg.com/ext_tw_video_thumb/1355857389325582336/pu/img/wFY5idqXktkaN19N.jpg,,,,,,,[],,,,
1355833479523655682,1355833479523655682,2021-01-31 08:01:06 SA Eastern Standard Time,2021-01-31,08:01:06,-0300,53745090,glauciotimao,Glauco🇧🇷💚💛🇧🇷,,Óleo na praia falhou  Queimadas na Amazônia falhou  Porteiro do condomínio falhou  Sérgio Moro falhou  Impeachment falhou  Falta de oxigênio falhou  Leite condensado falhou  Assessor de Mourão falhou   Continuem tentando esquerdopatas  kkkkkkkkkkkkkkkkkkkkk #StopBolsonaroMundial,pt,[],[],[],0,0,0,['stopbolsonaromundial'],[],https://twitter.com/glauciotimao/status/1355833479523655682,False,,0,,,,,,,,[],,,,
1355828037498130434,1355828033333161986,2021-01-31 07:39:28 SA Eastern Standard Time,2021-01-31,07:39:28,-0300,1328370724130713601,cb2por,PorTiMeuCB2,,Vamos Prosseguir dar audiência aos que tinham práticas de queimadas na Amazônia as ONGs. Vale lembrar que estavam culpando o Presidente.  #BolsonaroEstavaCerto  #GoBolsonaroMundial,pt,[],[],[],0,0,0,"['bolsonaroestavacerto', 'gobolsonaromundial']",[],https://twitter.com/Cb2Por/status/1355828037498130434,False,,0,,,,,,,,[],,,,
1355811719579394048,1355811719579394048,2021-01-31 06:34:38 SA Eastern Standard Time,2021-01-31,06:34:38,-0300,95651804,brasigois,Brasigóis Felício,,"Militares do Pentágono, viajando na maionese, dizem que a fumaça gerada pelas queimadas na Amazônia são uma ameaça à Segurança dos Estados Unidos. Ameaça maior e mais presente que a dos OVNIS; um sinal de que logo estarão ameaçando a soberania brasileira.",pt,[],[],[],0,0,0,[],[],https://twitter.com/brasigois/status/1355811719579394048,False,,0,,,,,,,,[],,,,
1355754906808889344,1355475847780548615,2021-01-31 02:48:53 SA Eastern Standard Time,2021-01-31,02:48:53,-0300,344965817,ar_adriano,Rodrigo ˢᶜᶜᵖ 🦅,,"@FelipeRngel1 @thomasnilton @KelyOliveira @g1 Mas o pantanal e a Amazônia em si não se misturam com a parte do cerrado! Faltou na aula de geográfia desde quando?  Toma uma pequena mostra mapa. Nas outras áreas, as queimadas e chuvas com ""reflorestamento"" natural são normais. Falta de conhecimento básico é foda.  https://t.co/NEFMuj21PP",pt,[],[],['https://pbs.twimg.com/media/EtCb5nSWMAUnr1h.jpg'],2,0,0,[],[],https://twitter.com/ar_adriano/status/1355754906808889344,False,,1,https://pbs.twimg.com/media/EtCb5nSWMAUnr1h.jpg,,,,,,,"[{'screen_name': 'FelipeRngel1', 'name': 'que isso?', 'id': '1057446371534475264'}, {'screen_name': 'thomasnilton', 'name': 'Thomas Teixeira', 'id': '52061548'}, {'screen_name': 'KelyOliveira', 'name': 'Kely Oliveira ☀️✨', 'id': '46575669'}, {'screen_name': 'g1', 'name': 'G1', 'id': '8802752'}]",,,,
1355686561497698316,1355674600366026761,2021-01-30 22:17:18 SA Eastern Standard Time,2021-01-30,22:17:18,-0300,1106948692702085127,ademacyaugusto,ademacyaugusto@gmail.com,,@gleisi Agora também os bolsominions querem tirar a culpa das queimadas de Bozo no Pantanal e amazônia ...o histórico não livra presidente Bozo da culpa ...,pt,[],[],[],5,0,0,[],[],https://twitter.com/ademacyaugusto/status/1355686561497698316,False,,0,,,,,,,,"[{'screen_name': 'gleisi', 'name': 'Gleisi Hoffmann', 'id': '31139434'}]",,,,
1355670525322928134,1355279335666679811,2021-01-30 21:13:35 SA Eastern Standard Time,2021-01-30,21:13:35,-0300,4120665634,eitaniadias,Eitania Silva,,@PRF_Aggio @PRFBrasil A gente não quer uma resposta. O povo brasileiro quer fatos. Então quando VC for responder sobre as queimadas da Amazonia. Mostre as providências sendo tomadas. Essas respostinhas fajutas não mostra nada e não convence,pt,[],[],[],0,0,0,[],[],https://twitter.com/EitaniaDias/status/1355670525322928134,False,,0,,,,,,,,"[{'screen_name': 'PRF_Aggio', 'name': 'Eduardo Aggio', 'id': '1264210331309662208'}, {'screen_name': 'PRFBrasil', 'name': 'PRF Brasil', 'id': '1208570756'}]",,,,
1355666577870495749,1355601842772828163,2021-01-30 20:57:53 SA Eastern Standard Time,2021-01-30,20:57:53,-0300,38184229,rujion,@ℝ𝕦𝕛𝕚𝕠𝕟,,"@RodrigoMaia @Baleia_Rossi 223 mil mortes, milhões de desempregados, ameaças de golpe, óleo em praias, queimadas no Pantanal e Amazônia, gastos abusivos... Bastou quebrar as placas do seu candidato e virou fascismo? Viu porque fomos contra o golpe parlamentar de 2016, @RodrigoMaia? Faz uma nota de repúdio.",pt,"[{'screen_name': 'rodrigomaia', 'name': 'rodrigo maia', 'id': '35260027'}]",[],[],0,0,0,[],[],https://twitter.com/Rujion/status/1355666577870495749,False,,0,,,,,,,,"[{'screen_name': 'RodrigoMaia', 'name': 'Rodrigo Maia', 'id': '35260027'}, {'screen_name': 'Baleia_Rossi', 'name': 'Baleia Rossi', 'id': '86373674'}]",,,,
1355654350857764868,1355654350857764868,2021-01-30 20:09:18 SA Eastern Standard Time,2021-01-30,20:09:18,-0300,1045165458658406400,inseigure,fernanda coxta se bronzeando ao som de solar power,,"estar do lado da karol conká, é estar do lado de: jair bolsonaro fiuk mussolini adolf hitler ustra desmonte do sus privatização das universidades públicas queimadas na amazônia trabalho análogo a escravidão latrocínio miséria",pt,[],[],[],0,1,2,[],[],https://twitter.com/inseigure/status/1355654350857764868,False,https://twitter.com/ppgnaro/status/1355652967672766464,0,,,,,,,,[],,,,
1355626553099563008,1355626553099563008,2021-01-30 18:18:51 SA Eastern Standard Time,2021-01-30,18:18:51,-0300,797650380238753792,real_rollo,Rollo 🥊,,"**** A mídia desmentindo a mídia. O Presidente Bolsonaro sempre disse que as queimadas na Amazônia são sempre no mesmo local e, graças a natureza, a vegetação recompõem-se.",pt,[],[],[],3,18,63,[],[],https://twitter.com/real_rollo/status/1355626553099563008,False,https://twitter.com/g1/status/1355475847780548615,0,,,,,,,,[],,,,
1355617682767405056,1355617331750252544,2021-01-30 17:43:36 SA Eastern Standard Time,2021-01-30,17:43:36,-0300,3009171466,cristiannoturno,Eh o Cris,,@klausbebado Próximo passo é acusar ela das queimadas da Amazônia.,pt,[],[],[],0,0,0,[],[],https://twitter.com/CristianNoturno/status/1355617682767405056,False,,0,,,,,,,,"[{'screen_name': 'klausbebado', 'name': 'athena', 'id': '760298368409088004'}]",,,,
1355615508641542147,1355610382329643009,2021-01-30 17:34:58 SA Eastern Standard Time,2021-01-30,17:34:58,-0300,1161304319095910400,cesardrusus,César Drusus,,"@VEJA Não pode faltar no desfile uma parte exaltando a cloroquina, outra falando do abandono do povo de Manaus morrendo sem oxigênio, o aumento das queimadas na Amazônia entre outros tantos temas....",pt,[],[],[],0,0,0,[],[],https://twitter.com/CesarDrusus/status/1355615508641542147,False,,0,,,,,,,,"[{'screen_name': 'VEJA', 'name': 'VEJA', 'id': '17715048'}]",,,,
1355599529496752128,1355599529496752128,2021-01-30 16:31:28 SA Eastern Standard Time,2021-01-30,16:31:28,-0300,140810916,sulvinteum,Sul21,,Infectados com Covid-19 pioraram por conta da densa fumaça que invadiu o estado que mais sofreu com queimadas em 2020 em toda a Amazônia Legal (via @agenciapublica).    https://t.co/qL9WLOLTKc,pt,"[{'screen_name': 'agenciapublica', 'name': 'agência pública', 'id': '310497473'}]",['https://www.sul21.com.br/ultimas-noticias/coronavirus/2021/01/acre-nao-era-so-tosse-das-queimadas-era-covid-19/'],[],1,4,12,[],[],https://twitter.com/sulvinteum/status/1355599529496752128,False,,0,,,,,,,,[],,,,
1355591576521764869,1355509873425981443,2021-01-30 15:59:52 SA Eastern Standard Time,2021-01-30,15:59:52,-0300,773985647518420992,ciganocomunista,conhecido distante mas nem tanto do araujo A🇧🇷,,"@samico22001904 @epyoshiura @Carlito_rj1 @cirogomes Qualquer outra pessoa, este homem desrespeita as 220 mil mortes em toda a oportunidade que ele tem, sem planejamento contra a pandemia, no ano de 2019 e 2020 temos recordes de queimadas na amazônia e pantanal. Não existe programa econômico para pequenos e médios empreendedores...",pt,[],[],[],2,0,2,[],[],https://twitter.com/ciganocomunista/status/1355591576521764869,False,,0,,,,,,,,"[{'screen_name': 'samico22001904', 'name': 'samico', 'id': '1148764531839180805'}, {'screen_name': 'epyoshiura', 'name': 'Edvander Yoshiura jacaré 💉💉💉 !', 'id': '145023201'}, {'screen_name': 'Carlito_rj1', 'name': 'carlito_RJ 😎🐶', 'id': '1336466888113737729'}, {'screen_name': 'cirogomes', 'name': 'Ciro Gomes', 'id': '33374761'}]",,,,
1355583170914250752,1355542420323262466,2021-01-30 15:26:28 SA Eastern Standard Time,2021-01-30,15:26:28,-0300,93720351,riolimaf,A Profound Hatred,,@tcmpacheco @DOprimido Todo mundo sabe que o vírus foi criado pessoalmente pelo Bolsonaro nas queimadas da Amazônia. A China só quis ajudar mas foi destratada pelo governo fascista,pt,[],[],[],0,0,0,[],[],https://twitter.com/riolimaf/status/1355583170914250752,False,,0,,,,,,,,"[{'screen_name': 'tcmpacheco', 'name': 'Thiago Pacheco', 'id': '2901050897'}, {'screen_name': 'DOprimido', 'name': 'Demagogia do Oprimido 🔥', 'id': '1249063841201377281'}]",,,,
1355582125383307269,1355484661850525697,2021-01-30 15:22:18 SA Eastern Standard Time,2021-01-30,15:22:18,-0300,1140699055653302275,carinacarolinas,Carina Carolina,,@WWF_Brasil Vocês estão por trás das queimadas na Amazônia?? É isso mesmo?? Gente ... como pode uma sem vergonhice dessa???!!!,pt,[],[],[],0,0,0,[],[],https://twitter.com/CarinacarolinaS/status/1355582125383307269,False,,0,,,,,,,,"[{'screen_name': 'WWF_Brasil', 'name': 'WWF-Brasil', 'id': '11160692'}]",,,,
