id,conversation_id,created_at,date,time,timezone,user_id,username,name,place,tweet,language,mentions,urls,photos,replies_count,retweets_count,likes_count,hashtags,cashtags,link,retweet,quote_url,video,thumbnail,near,geo,source,user_rt_id,user_rt,retweet_id,reply_to,retweet_date,translate,trans_src,trans_dest
1191133721627447297,1191133721627447297,2019-11-03 20:23:04 -03,2019-11-03,20:23:04,-0300,846355452279603201,wybielovatx,Golden⚡️🏀,,"Acho incrível, o massacre em Suzano, desmatamento na Amazônia, obesidade, sei lá, tanta coisa em alta e os cara bota democratização do cinema no Brasil",pt,[],[],[],0,0,1,[],[],https://twitter.com/wybielovatx/status/1191133721627447297,False,,0,,,,,,,,[],,,,
1191133295372881920,1191133295372881920,2019-11-03 20:21:22 -03,2019-11-03,20:21:22,-0300,216372203,geografiagraria,Geografia  Agrária,,"CAMPEÕES DE DESMATAMENTO E QUEIMADAS NA AMAZÔNIA SÃO DOMINADOS PELO GADO E PELA SOJA Primeiro a derrubada, depois o fogo e tudo vira pasto. Saiba quais são os municípios líderes em desmatamento na região  https://t.co/TEFsCyq7MQ",pt,[],['https://www.brasildefato.com.br/2019/09/30/campeoes-de-desmatamento-e-queimadas-na-amazonia-sao-dominados-pelo-gado-e-pela-soja/index.html'],[],0,0,0,[],[],https://twitter.com/GeografiAgraria/status/1191133295372881920,False,,0,,,,,,,,[],,,,
1191130972772806656,1191129239195705344,2019-11-03 20:12:08 -03,2019-11-03,20:12:08,-0300,697953347136053249,rbkmzs,rebekka,,"@desnecessauro naaa real, desmatamento é tema possível sim, não pelas chamas da Amazônia, mas pela relevância temática mesmo. :)",pt,[],[],[],1,0,0,[],[],https://twitter.com/rbkmzs/status/1191130972772806656,False,,0,,,,,,,,"[{'screen_name': 'desnecessauro', 'name': 'FP do Prem Baba', 'id': '15293962'}]",,,,
1191130116757368832,1191130116757368832,2019-11-03 20:08:44 -03,2019-11-03,20:08:44,-0300,1168358103395516423,wen_azevedo,Wen Azevedo,,"Desmatamento na Amazônia  Refugiados Depressão: A doença do século  O ENEM: Então, sabe em 1895 que inventaram aquele bagui que joga imagem na parede...",pt,[],[],[],0,1,0,[],[],https://twitter.com/wen_azevedo/status/1191130116757368832,False,,0,,,,,,,,[],,,,
1191128538084265984,1191128538084265984,2019-11-03 20:02:28 -03,2019-11-03,20:02:28,-0300,837809577060098048,anyaneannie,dane - se,,"Questões ambientais em alta (fogo na Amazônia, petróleo nas praias, grande aumento do desmatamento...)  Crises políticas em todo canto do mundo  Questões LGBTQ+  Feminicidio  Exploração infantil   Enem: Democratização do cinema no Brasil",pt,[],[],[],0,0,0,[],[],https://twitter.com/anyaneannie/status/1191128538084265984,False,,0,,,,,,,,[],,,,
1191127712682958848,1191127712682958848,2019-11-03 19:59:11 -03,2019-11-03,19:59:11,-0300,732402555528089605,sd_valmarath,Alisson Valmarath,,"Eu chutava que o tema da redação seria sei lá, depressão,doenças psicossomáticas, desmatamento da Amazônia.. entre outros... Mas agora"" Democratização do acesso ao cinema no Brasil"" Nada ver😳",pt,[],[],[],0,0,0,[],[],https://twitter.com/Sd_Valmarath/status/1191127712682958848,False,,0,,,,,,,,[],,,,
1191127131994152960,1191127131994152960,2019-11-03 19:56:52 -03,2019-11-03,19:56:52,-0300,4277469137,ithecarlim,Carlim,,"@FeCastanhari Aposto que graças ao seu vídeo sobre o desmatamento na Amazônia, muitas pessoas devem ter acertado essa questão no #Enem2019  https://t.co/rCGjiewovw",pt,[],[],['https://pbs.twimg.com/media/EIe7zteWwAUJB1Y.jpg'],0,0,0,['enem2019'],[],https://twitter.com/iTheCarlim/status/1191127131994152960,False,,1,https://pbs.twimg.com/media/EIe7zteWwAUJB1Y.jpg,,,,,,,[],,,,
1191126702052855808,1191126702052855808,2019-11-03 19:55:10 -03,2019-11-03,19:55:10,-0300,1087551497443921920,otauiz,ً,,"O Enem tem tantos temas melhores a serem dissertados e argumentados, como o desmatamento da Amazônia, doenças, sistema unificado de saúde, vacinação e ele me vem com a democratização do cinema brasileiro a meu, por favor né... Ok  errei no título galera, botei ss e o c por cima",pt,[],[],[],0,0,0,[],[],https://twitter.com/otauiz/status/1191126702052855808,False,,0,,,,,,,,[],,,,
1191126670041858048,1190944550270971904,2019-11-03 19:55:02 -03,2019-11-03,19:55:02,-0300,70594685,ricsdeol,Ricardo S. O. Leite 🇧🇷🌹🇧🇷,,"@xicograziano Isso é falta de desmatamento na Amazônia, vamos desmatar mais",pt,[],[],[],0,0,0,[],[],https://twitter.com/ricsdeol/status/1191126670041858048,False,,0,,,,,,,,"[{'screen_name': 'xicograziano', 'name': 'Xico Graziano', 'id': '41881267'}]",,,,
1191121029747359746,1191121029747359746,2019-11-03 19:32:38 -03,2019-11-03,19:32:38,-0300,2883920581,gachemarcos,marcos gache,,Macron apoiou projeto que previa desmatamento de milhares de hectares com mais de 120 espécies protegidas na Amazônia  https://t.co/QjkxGf8f6l,pt,[],['https://www.jornaldacidadeonline.com.br/noticias/16071/macron-apoiou-projeto-de-desmatamento-de-milhares-de-hectares-com-mais-de-120-especies-protegidas-na-amazonia'],[],0,0,0,[],[],https://twitter.com/GacheMarcos/status/1191121029747359746,False,,0,,,,,,,,[],,,,
1191120063799140358,1191120063799140358,2019-11-03 19:28:47 -03,2019-11-03,19:28:47,-0300,817531221001596936,khapetaa,satanazinho,,"-bolsonaro aqui estão os temas pra redação do enem -manda ae taokei😎👉👉 -""desmatamento na Amazônia"" -isso é ong certeza😡😡😡 manda otra -""violência contra mulheres no Brasil"" -fodase mulhe 😡👉 esse não -mas presidente só sobrou um tema sobre cinema -bota esse teitei😎😎👉",pt,[],[],[],0,1,2,[],[],https://twitter.com/khapetaa/status/1191120063799140358,False,,0,,,,,,,,[],,,,
1191119296044453888,1191109173255294979,2019-11-03 19:25:44 -03,2019-11-03,19:25:44,-0300,1156316546219876354,producerkuster1,maicon küster produtor musical 7/12,,@GabrielStoider @nosensemine Falei olheo no nordeste e desmatamento da amazonia passei longe tbm,pt,[],[],[],0,0,1,[],[],https://twitter.com/producerkuster1/status/1191119296044453888,False,,0,,,,,,,,"[{'screen_name': 'nosensemine', 'name': 'no sense mine', 'id': '1142923196531990528'}]",,,,
1191118520773496833,1191118520773496833,2019-11-03 19:22:39 -03,2019-11-03,19:22:39,-0300,3227263853,alxboorges,Alexandre Borges,,"quem tá criticando o tema da redação do enem desse ano só pode que desconhece a lógica da prova, a pessoa tem que tá muito louca das ideias p achar q iria cair sobre ""desmatamento na amazônia"" ou ""saneamento básico no brasil""",pt,[],[],[],0,0,0,[],[],https://twitter.com/alxboorges/status/1191118520773496833,False,,0,,,,,,,,[],,,,
1191105365150224385,1191105031782748161,2019-11-03 18:30:23 -03,2019-11-03,18:30:23,-0300,22914738,o_eco,((o))eco | Jornalismo Ambiental,,"@inpe_mct O INPE esteve no centro de ataques do governo Bolsonaro no final de julho, após virem à tona dados que indicavam uma alta no desmatamento da Amazônia. Damião não deu, durante a coletiva, respostas claras sobre a necessidade ou os benefícios da reforma.",pt,[],[],[],0,2,5,[],[],https://twitter.com/o_eco/status/1191105365150224385,False,,0,,,,,,,,"[{'screen_name': 'inpe_mct', 'name': 'INPE', 'id': '308605432'}]",,,,
1191099268523839488,1191097139486744576,2019-11-03 18:06:09 -03,2019-11-03,18:06:09,-0300,1006111377428230144,jangolatier,inspector detector,,@vivvvvvvvvi pra acelerar o desmatamento da Amazônia pra dar lugar pra sala de cinem,pt,[],[],[],1,0,1,[],[],https://twitter.com/Jangolatier/status/1191099268523839488,False,,0,,,,,,,,"[{'screen_name': 'vivvvvvvvvi', 'name': 'pequena. burra.', 'id': '4820494900'}]",,,,
1191089044614242304,1191047469842489347,2019-11-03 17:25:32 -03,2019-11-03,17:25:32,-0300,1167061340416069637,de4rtom,mundinho alisson becker e yas 😘🍷,,"@dcucomics @wonderxluthor O TEMA É BOM, mas não para um ENEM. Podia ter vários outros temas:  • desmatamento da Amazônia  • Óleo nas praias  • O aumento do Feminicidio  E vários outros... Mas lembrando é minha opinião, e eu respeito a sua, moro em interior onde não tem cinema só a 100 km daqui, várias+",pt,[],[],[],7,0,5,[],[],https://twitter.com/de4rtom/status/1191089044614242304,False,,0,,,,,,,,"[{'screen_name': 'dcucomics', 'name': 'sana', 'id': '1165759483911593989'}, {'screen_name': 'wonderxluthor', 'name': 's', 'id': '1287676646418460673'}]",,,,
1191084890890153988,1191083748386840576,2019-11-03 17:09:01 -03,2019-11-03,17:09:01,-0300,4807352271,ronaldo_gzuz,Ronaldo,,@GuiiMartinss__ oq é desmatamento da Amazônia perto do que vai acontecer hoje na Arena,pt,[],[],[],1,0,1,[],[],https://twitter.com/ronaldo_gzuz/status/1191084890890153988,False,,0,,,,,,,,"[{'screen_name': 'GuiiMartinss__', 'name': 'gui', 'id': '728790388002164740'}]",,,,
1191078344126869507,1191078317929177089,2019-11-03 16:43:01 -03,2019-11-03,16:43:01,-0300,3038077181,joseschneider74,JORNAL O NOVO                  Jose luis schneider,,2-As mãos locais do rancho têm sentimentos mais conflitantes. Especialistas culpam a criação de gado por até 80% do desmatamento da Amazônia nos últimos anos. The Times  https://t.co/hR8D2hHLfU,pt,[],[],['https://pbs.twimg.com/media/EIePbAIXkAEJkcm.jpg'],0,0,2,[],[],https://twitter.com/joseschneider74/status/1191078344126869507,False,,1,https://pbs.twimg.com/media/EIePbAIXkAEJkcm.jpg,,,,,,,[],,,,
1191076016560726023,1191076016560726023,2019-11-03 16:33:46 -03,2019-11-03,16:33:46,-0300,903772224305463296,vaaaaaah97,vanessinha,,"Eu ontem de noite lendo sobre desmatamento, queimadas na Amazônia, reforma na previdência e diabo a 4 pra cair “Democratização do cinema no Brasil” na redação do Enem 🤦🏻‍♀️ não sei se eu agradeço oi se eu fico puta",pt,[],[],[],0,0,3,[],[],https://twitter.com/Vaaaaaah97/status/1191076016560726023,False,,0,,,,,,,,[],,,,
1191049391190282240,1190944550270971904,2019-11-03 14:47:58 -03,2019-11-03,14:47:58,-0300,151752039,erro500,Victor Sousa - MIDCast ✠,,"@carlosefcarv @Ber_Art @xicograziano Eu falei no Bolsonaro na minha resposta? Eu falei de política? Vc que tá interpretando as coisas aí. Já que o debate precisa ser pautado pela ciência, vc acha que os anos de estudo sobre a influência do desmatamento da Amazônia na questão que vc tá reclamando, são válidos?",pt,[],[],[],1,0,1,[],[],https://twitter.com/erro500/status/1191049391190282240,False,,0,,,,,,,,"[{'screen_name': 'carlosefcarv', 'name': 'Carlos Carvalho', 'id': '1041302582562480128'}, {'screen_name': 'Ber_Art', 'name': 'Arthur Bernardes', 'id': '877662354649034752'}, {'screen_name': 'xicograziano', 'name': 'Xico Graziano', 'id': '41881267'}]",,,,
1191048759528108033,1190944550270971904,2019-11-03 14:45:27 -03,2019-11-03,14:45:27,-0300,3131149479,bioformigoni,Capitão não tão Fantástico,,"@jamillesd @Valterbatuk @xicograziano @EdisonJacobson A amazonia é responsavel pela umidificação do ar atmosférico e pela criação de rios aéreos que leva chuva da floresta para as outras regiões do  país. O desmatamento da amazonia bagunça o clima todo. Seja oq esta ocorrendo nesse governo, ou ja ocorreu em outros.",pt,[],[],[],3,0,21,[],[],https://twitter.com/bioformigoni/status/1191048759528108033,False,,0,,,,,,,,"[{'screen_name': 'jamillesd', 'name': 'Jam Duarte 🇧🇷', 'id': '2299125604'}, {'screen_name': 'xicograziano', 'name': 'Xico Graziano', 'id': '41881267'}, {'screen_name': 'EdisonJacobson', 'name': 'Edison R Jacobson🇧🇷', 'id': '3623064676'}]",,,,
1191045646998016000,1191045330852143106,2019-11-03 14:33:05 -03,2019-11-03,14:33:05,-0300,3589345337,vanecosta10,A Eng. Florestal do YouTube 🌳,,"O diretor INPE, Darcton Policarpo Damião, apresentou sua proposta de reestruturação do Instituto, que inclui mudanças importantes em coordenações que hoje possuem grande protagonismo e reconhecimento dentro do INPE, como o setor de monitoramento do desmatamento da Amazônia.",pt,[],[],[],0,2,3,[],[],https://twitter.com/vanecosta10/status/1191045646998016000,False,,0,,,,,,,,[],,,,
1191044871555026944,1191044871555026944,2019-11-03 14:30:00 -03,2019-11-03,14:30:00,-0300,336104350,portaldbo,Portal DBO,,Mais de 97% dos produtores rurais da Amazônia não participam do desmatamento e estão ameaçados de extinção  https://t.co/VxikiRvXAk,pt,[],['https://www.portaldbo.com.br/dez-fatos-e-mitos-sobre-pequenos-produtores-e-vegetacao-nativa-na-amazonia/'],[],0,0,0,[],[],https://twitter.com/portaldbo/status/1191044871555026944,False,,0,,,,,,,,[],,,,
1191044809038938112,1191044809038938112,2019-11-03 14:29:45 -03,2019-11-03,14:29:45,-0300,983678899187077122,alberi_petersen,Alberi Petersen,,"Agora o desmatamento tem estímulo Presidencial!  ""O superintendente da Polícia Federal no Amazonas, delegado Alexandre Saraiva disse recentemente que “sendo otimista, 90% da madeira que sai da Amazônia é ilegal”.""  https://t.co/5VXucednl9 via @YahooBr",pt,"[{'screen_name': 'yahoobr', 'name': 'yahoo brasil', 'id': '31161322'}]",['https://br.noticias.yahoo.com/amazonia-madeira-ilegal-070048586.html?soc_src=social-sh&soc_trk=tw'],[],0,0,1,[],[],https://twitter.com/alberi_petersen/status/1191044809038938112,False,,0,,,,,,,,[],,,,
1191044403294588929,1191044403294588929,2019-11-03 14:28:08 -03,2019-11-03,14:28:08,-0300,17602766,charlesnisz,Charles Nisz 🏡🇧🇷 🌵,,Não é culpa do desmatamento da Amazônia. É culpa do Foro de SP,pt,[],[],[],0,1,7,[],[],https://twitter.com/charlesnisz/status/1191044403294588929,False,https://twitter.com/xicograziano/status/1190944550270971904,0,,,,,,,,[],,,,
1191040219698606081,1191037878991826944,2019-11-03 14:11:31 -03,2019-11-03,14:11:31,-0300,798358555384541184,anabiasaldanha,nabs.,,@palomapolonio eu jurava q seria sobre desmatamento na Amazônia nos últimos anos e me vem cm esse tema,pt,[],[],[],1,0,1,[],[],https://twitter.com/anabiasaldanha/status/1191040219698606081,False,,0,,,,,,,,[],,,,
1191032986101338114,1190944550270971904,2019-11-03 13:42:46 -03,2019-11-03,13:42:46,-0300,176859552,trudaoceans,"José Truda Palazzo, Jr. 🇫🇲🇫🇲🇫🇲☘️",,@xicograziano Que tal ajudares a parar o desmatamento atroz da Amazônia ao invés de apelar pra São Pedro? Não foi falta de aviso de que essa bandalheira iria destruir o agronegócio... precisamos dar jeito nisso!,pt,[],[],[],0,0,0,[],[],https://twitter.com/TrudaOceans/status/1191032986101338114,False,,0,,,,,,,,"[{'screen_name': 'xicograziano', 'name': 'Xico Graziano', 'id': '41881267'}]",,,,
1191012416236216323,1191012416236216323,2019-11-03 12:21:02 -03,2019-11-03,12:21:02,-0300,38203639,beth_garcez,Elisabete Garcez 👑,,Ansiosa para saber qual será o tema da redação do ENEM! Graças a redação a minha nota aumentou e consegui a bolsa kkk lembro até hj. Foi sobre o desmatamento da Amazônia e seu impacto! Até hj um tema atual!,pt,[],[],[],0,0,1,[],[],https://twitter.com/Beth_garcez/status/1191012416236216323,False,,0,,,,,,,,[],,,,
1190992570119344128,1190990227659280384,2019-11-03 11:02:10 -03,2019-11-03,11:02:10,-0300,1177348744636968961,agfacetoface,FACETOFACE,,"Infelizmente, o número de desmatamento na Amazônia só  aumenta. De acordo com dados do INPE, entre janeiro e setembro de 2019, a Floresta Amazônica perdeu 7,85 mil km² de sua cobertura vegetal.",pt,[],[],[],1,0,0,[],[],https://twitter.com/agfacetoface/status/1190992570119344128,False,,0,,,,,,,,[],,,,
1190990227659280384,1190990227659280384,2019-11-03 10:52:52 -03,2019-11-03,10:52:52,-0300,1177348744636968961,agfacetoface,FACETOFACE,,"O número de queimadas na Amazônia diminuiu! Porém, o percentual de desmatamento na Amazônia só aumentou. #speaktomyfacetiojuca #commultiplataprofthaiscarrapatoso",pt,[],[],[],1,0,1,"['speaktomyfacetiojuca', 'commultiplataprofthaiscarrapatoso']",[],https://twitter.com/agfacetoface/status/1190990227659280384,False,https://twitter.com/BrazilBrian/status/1190355794799341571,0,,,,,,,,[],,,,
1190988453917417472,1190988453917417472,2019-11-03 10:45:49 -03,2019-11-03,10:45:49,-0300,18946347,schubert_pro,Schubert,,"É só PENSAR! Não deveríamos ver no Brasil uma gigantesca mobilização de todo o agronegócio em trono do #desmatamento da #Amazônia? É simples: desmatou, acabou a água circulante no Brasil, acabou o #agronegócio. É o que querem? #Amazon (foto Maristela Crispim @stelacrispim )  https://t.co/Hk53C6xm2J",pt,"[{'screen_name': 'stelacrispim', 'name': 'maristela crispim', 'id': '52921153'}]",[],['https://pbs.twimg.com/media/EIc9rsvX0AIQvrT.jpg'],0,0,0,"['desmatamento', 'amazônia', 'agronegócio', 'amazon']",[],https://twitter.com/Schubert_pro/status/1190988453917417472,False,,1,https://pbs.twimg.com/media/EIc9rsvX0AIQvrT.jpg,,,,,,,[],,,,
1190987847064526848,1190987847064526848,2019-11-03 10:43:24 -03,2019-11-03,10:43:24,-0300,3589345337,vanecosta10,A Eng. Florestal do YouTube 🌳,,"O desmatamento crescente e o aumento de incêndios na Amazônia brasileira jogaram a região no centro do debate público, no Brasil e internacionalmente.   https://t.co/MnUH6kGpcG via @exame",pt,"[{'screen_name': 'exame', 'name': 'exame', 'id': '30070288'}]",['https://exame.abril.com.br/brasil/incendios-fortalecem-debate-sobre-o-valor-da-amazonia-dizem-especialistas/'],[],1,4,15,[],[],https://twitter.com/vanecosta10/status/1190987847064526848,False,,0,,,,,,,,[],,,,
1190984298838536193,1190984298838536193,2019-11-03 10:29:18 -03,2019-11-03,10:29:18,-0300,42630768,versoereverso,Juliana Lopes,,"""O agronegócio brasileiro é dependente da chuva – só 6% da área cultivada é feita com irrigação. Caso não contenha o desmatamento da Amazônia, o Brasil vai ter dificuldade para se manter como uma potência agrícola global.""  https://t.co/rvibw0LOcT",pt,[],['https://piaui.folha.uol.com.br/o-mundo-sem-amazonia/'],[],0,0,1,[],[],https://twitter.com/versoereverso/status/1190984298838536193,False,,0,,,,,,,,[],,,,
1190966480206204934,1190966480206204934,2019-11-03 09:18:30 -03,2019-11-03,09:18:30,-0300,17886356,perinlua,Luana Varaschim Perin,,"Antes de comemorarmos o menor índice de queimadas na Amazônia ""desde 1998"", vamos só lembrar que o Bolsonaro exonerou o diretor do INPE, Ricardo Galvão, em agosto desse ano porque não estava contente com os dados do desmatamento.",pt,[],[],[],0,0,3,[],[],https://twitter.com/perinlua/status/1190966480206204934,False,,0,,,,,,,,[],,,,
1190965941091405829,1190965941091405829,2019-11-03 09:16:22 -03,2019-11-03,09:16:22,-0300,1158889619968135168,gustavosarmen16,🌸Frutífera🌸,,Impedir o desmatamento e exploração da Amazônia! - Assine a petição!  https://t.co/C0ZNIVwrC2 via @change_br,pt,"[{'screen_name': 'change_br', 'name': 'change.org brasil #luteemcasa', 'id': '900348469'}]",['http://chng.it/6GbfMfR8'],[],0,0,0,[],[],https://twitter.com/GustavoSarmen16/status/1190965941091405829,False,,0,,,,,,,,[],,,,
1190964202346819586,1190944550270971904,2019-11-03 09:09:27 -03,2019-11-03,09:09:27,-0300,132905672,malkavianno,Cláudio Pena,,"@xicograziano Desmatamento, principalmente na Amazônia, contribuem para que isso aconteça.",pt,[],[],[],1,0,0,[],[],https://twitter.com/Malkavianno/status/1190964202346819586,False,,0,,,,,,,,"[{'screen_name': 'xicograziano', 'name': 'Xico Graziano', 'id': '41881267'}]",,,,
1190942056606244864,1190942056606244864,2019-11-03 07:41:27 -03,2019-11-03,07:41:27,-0300,227122106,michel_tmartins,Michel Martins,,"Resultados da era burrice ostentação:  - 28% dizem que fé é mais importante para ter uma vida melhor; - 7% acreditam que a terra é plana; - 28,6% não vêem problemas com o aumento do desmatamento na Amazônia; - 23% dizem que a Venezuela é a responsavel pelo óleo no Nordeste.",pt,[],[],[],0,0,0,[],[],https://twitter.com/Michel_TMartins/status/1190942056606244864,False,https://twitter.com/folha/status/1190622084680032256,0,,,,,,,,[],,,,
1190858768701165568,1190858768701165568,2019-11-03 02:10:30 -03,2019-11-03,02:10:30,-0300,388434140,luanasophiafe,Luana,,Hipócrita!! Macron apoiou projeto que previa desmatamento de milhares de hectares com mais de 120 espécies protegidas na Amazônia.    https://t.co/NEAZ0Xfu40,pt,[],['https://www.jornaldacidadeonline.com.br/noticias/16071/macron-apoiou-projeto-de-desmatamento-de-milhares-de-hectares-com-mais-de-120-especies-protegidas-na-amazonia'],[],0,0,0,[],[],https://twitter.com/LuanaSophiaFe/status/1190858768701165568,False,,0,,,,,,,,[],,,,
1190848919296708609,1190848919296708609,2019-11-03 01:31:21 -03,2019-11-03,01:31:21,-0300,61872030,heliocruzeiro,Hélio Cruzeiro dos Santos,,Macron apoiou projeto que previa desmatamento de milhares de hectares com mais de 120 espécies protegidas na Amazônia  https://t.co/shPjpLaCWk,pt,[],['https://www.jornaldacidadeonline.com.br/noticias/16071/macron-apoiou-projeto-de-desmatamento-de-milhares-de-hectares-com-mais-de-120-especies-protegidas-na-amazonia'],[],0,0,0,[],[],https://twitter.com/heliocruzeiro/status/1190848919296708609,False,,0,,,,,,,,[],,,,
1190809340653035520,1190809340653035520,2019-11-02 22:54:05 -03,2019-11-02,22:54:05,-0300,1113063331533852672,neuzasi89497557,Neuza Silva,,Impedir o desmatamento e exploração da Amazônia! - Sign the Petition!  https://t.co/xemYYlOjch via @Change,pt,"[{'screen_name': 'change', 'name': 'change.org', 'id': '15947602'}]",['http://chng.it/yprvKrXz'],[],0,0,0,[],[],https://twitter.com/NeuzaSi89497557/status/1190809340653035520,False,,0,,,,,,,,[],,,,
1190808108089716738,1190808108089716738,2019-11-02 22:49:11 -03,2019-11-02,22:49:11,-0300,74232443,pingounica,Pingo xD,,Impedir o desmatamento e exploração da Amazônia! - Assine a petição!  https://t.co/1N9QcrStEq via @change_br,pt,"[{'screen_name': 'change_br', 'name': 'change.org brasil #luteemcasa', 'id': '900348469'}]",['http://chng.it/Gw2SmM2Q'],[],0,0,0,[],[],https://twitter.com/pingounica/status/1190808108089716738,False,,0,,,,,,,,[],,,,
1190801105451663362,1190801105451663362,2019-11-02 22:21:22 -03,2019-11-02,22:21:22,-0300,2826467428,souza_tataa,Thai_Souza,,Impedir o desmatamento e exploração da Amazônia! - Assine a petição!  https://t.co/rjRVnBzlXp via @change_br,pt,"[{'screen_name': 'change_br', 'name': 'change.org brasil #luteemcasa', 'id': '900348469'}]",['http://chng.it/LRFcDS8f'],[],0,0,0,[],[],https://twitter.com/souza_tataa/status/1190801105451663362,False,,0,,,,,,,,[],,,,
1190797039845687297,1190797039845687297,2019-11-02 22:05:12 -03,2019-11-02,22:05:12,-0300,1554882512,davidlennor,LENNOR,,"Já fiz tantos enem que, por minha causa, derrubaram tantas árvores para fazerem minhas provas, que o governo Bolsonaro vai me culpar por o desmatamento na Amazônia. #Enem2019",pt,[],[],[],0,0,1,['enem2019'],[],https://twitter.com/DavidLennor/status/1190797039845687297,False,,0,,,,,,,,[],,,,
1190795684745756672,1190795684745756672,2019-11-02 21:59:49 -03,2019-11-02,21:59:49,-0300,950706214249402370,lewdginger1,Claude De Bussy,,Impedir o desmatamento e exploração da Amazônia! - Sign the Petition!  https://t.co/4sxLPjAT6M via @Change,pt,"[{'screen_name': 'change', 'name': 'change.org', 'id': '15947602'}]",['http://chng.it/sGzFtFHc'],[],0,0,0,[],[],https://twitter.com/lewdginger1/status/1190795684745756672,False,,0,,,,,,,,[],,,,
1190783181114527745,1190777140431724544,2019-11-02 21:10:08 -03,2019-11-02,21:10:08,-0300,963916585831411712,lucasser4fim,serafim.tattoo,,@drumond_milena Tema vai ser desmatamento na Amazônia,pt,[],[],[],1,0,0,[],[],https://twitter.com/LucasSer4fim/status/1190783181114527745,False,,0,,,,,,,,[],,,,
1190770384330727424,1190770384330727424,2019-11-02 20:19:17 -03,2019-11-02,20:19:17,-0300,974698575761428488,eleni_marchi,Eleni de Marchi,,Impedir o desmatamento e exploração da Amazônia! - Assine a petição!  https://t.co/WLGxy6EZBC via @change_br,pt,"[{'screen_name': 'change_br', 'name': 'change.org brasil #luteemcasa', 'id': '900348469'}]",['http://chng.it/XNdxktjk'],[],0,0,0,[],[],https://twitter.com/eleni_marchi/status/1190770384330727424,False,,0,,,,,,,,[],,,,
1190751382023876613,1190751382023876613,2019-11-02 19:03:47 -03,2019-11-02,19:03:47,-0300,482473296,flrs01,flavio ressurreição,,Impedir o desmatamento e exploração da Amazônia! - Assine a petição!  https://t.co/6x8u4GLRdE via @change_br,pt,"[{'screen_name': 'change_br', 'name': 'change.org brasil #luteemcasa', 'id': '900348469'}]",['http://chng.it/QdtDzKfM'],[],0,0,0,[],[],https://twitter.com/flrs01/status/1190751382023876613,False,,0,,,,,,,,[],,,,
1190742196942725121,1190742196942725121,2019-11-02 18:27:17 -03,2019-11-02,18:27:17,-0300,64277402,reh_sayuri,Sayuri ❍ 𝐵𝜇𝜏𝜏𝜀𝑟 🥞 ❍ 🇧🇷🎗 ❍,,Entenda o Desmatamento na AMAZÔNIA de um jeito SIMPLES  https://t.co/qNCdO79l9F via @YouTube,pt,"[{'screen_name': 'youtube', 'name': 'youtube', 'id': '10228272'}]",['https://youtu.be/Yo3xbzSbcCE'],[],0,0,0,[],[],https://twitter.com/Reh_Sayuri/status/1190742196942725121,False,,0,,,,,,,,[],,,,
1190741430634979328,1190741430634979328,2019-11-02 18:24:14 -03,2019-11-02,18:24:14,-0300,81435711,coresenomes,Margot Ferreira,,Impedir o desmatamento e exploração da Amazônia! - Assine a petição!  https://t.co/yq5sXOFYiH via @change_br,pt,"[{'screen_name': 'change_br', 'name': 'change.org brasil #luteemcasa', 'id': '900348469'}]",['http://chng.it/vSTrRGNb'],[],0,0,0,[],[],https://twitter.com/coresenomes/status/1190741430634979328,False,,0,,,,,,,,[],,,,
1190740384034492416,1190740384034492416,2019-11-02 18:20:05 -03,2019-11-02,18:20:05,-0300,138492825,proindio,Comissão Pró-Índio,,"Desmatamento na Amazônia aumenta o risco de malária | Estudo da Universidade Stanford descobriu que um está relacionado ao outro: quando aumenta casos da doença, a deflorestação diminui, e vice-versa  https://t.co/cPC0Fo7nz5",pt,[],['https://epocanegocios.globo.com/Brasil/noticia/2019/11/desmatamento-na-amazonia-aumenta-o-risco-de-malaria.html'],[],0,5,15,[],[],https://twitter.com/proindio/status/1190740384034492416,False,,0,,,,,,,,[],,,,
