id,conversation_id,created_at,date,time,timezone,user_id,username,name,place,tweet,language,mentions,urls,photos,replies_count,retweets_count,likes_count,hashtags,cashtags,link,retweet,quote_url,video,thumbnail,near,geo,source,user_rt_id,user_rt,retweet_id,reply_to,retweet_date,translate,trans_src,trans_dest
1245079595109568512,1245079595109568512,2020-03-31 17:04:42 -03,2020-03-31,17:04:42,-0300,222296230,abramovay,Ricardo Abramovay,,"Os alertas de desmatamento na Amazônia, em janeiro de 2020, foram 52% superiores ao de jan/2019. Fevereiro 2020, foram 25% superiores a fev/2019. Com Covid-19 temor de que fiscalização menor estimule o avanço da grilagem, mostram estes 3 especialistas   https://t.co/u8yHmoKMC0",pt,[],['https://brasil.elpais.com/opiniao/2020-03-31/covid-19-e-o-desmatamento-amazonico.html?ssm=whatsapp'],[],1,1,4,[],[],https://twitter.com/abramovay/status/1245079595109568512,False,,0,,,,,,,,[],,,,
1245061488311754752,1245033007850893312,2020-03-31 15:52:45 -03,2020-03-31,15:52:45,-0300,3029126512,esquerdadiario,Esquerda Diário,,"6. Destruição ambiental. Com o lema “integrar para não entregar”, o trator da ditadura avançou na devastação da Amazônia. Na década de 70 o desmatamento atinge pela primeira vez grandes proporções, com 14 milhões de hectares devastados. +  #DitaduraNuncaMais #56AnosDoGolpeMilitar",pt,[],[],[],2,2,5,"['ditaduranuncamais', '56anosdogolpemilitar']",[],https://twitter.com/EsquerdaDiario/status/1245061488311754752,False,,0,,,,,,,,[],,,,
1245010521058955265,1245010521058955265,2020-03-31 12:30:14 -03,2020-03-31,12:30:14,-0300,138492825,proindio,Comissão Pró-Índio,,"DESMATAMENTO I No caso da #Amazônia, lavar as mãos para a ação de grileiros neste momento é contabilizar novos prejuízos socioambientais e econômicos num futuro próximo. #desmatamento #queimadas #covid90. Via @elpais_brasil   https://t.co/FdkB45k12z",pt,"[{'screen_name': 'elpais_brasil', 'name': 'el país brasil', 'id': '2174537102'}]",['https://brasil.elpais.com/opiniao/2020-03-31/covid-19-e-o-desmatamento-amazonico.html'],[],0,3,9,"['amazônia', 'desmatamento', 'queimadas', 'covid90']",[],https://twitter.com/proindio/status/1245010521058955265,False,,0,,,,,,,,[],,,,
1245003201117552646,1245000725912006657,2020-03-31 12:01:08 -03,2020-03-31,12:01:08,-0300,1210205567442194433,juliofe86448240,Julio Fernandes,,"@gui_togniolo Concordo. Pena que no Brasil, estão se aproveitando do momento para aumentar o desmatamento na  Amazônia devido um afrouxamento maior na fiscalização.",pt,[],[],[],1,0,1,[],[],https://twitter.com/JulioFe86448240/status/1245003201117552646,False,,0,,,,,,,,"[{'screen_name': 'gui_togniolo', 'name': 'Guilherme Togniolo', 'id': '1004842416980054018'}]",,,,
1244993381325049856,1244993381325049856,2020-03-31 11:22:07 -03,2020-03-31,11:22:07,-0300,552219213,fatimalhas,λ∈ℝ,,"Acabei de dizer #MP910Não. Vamos, juntos, acabar com a corrupção e o desmatamento na Amazônia!   https://t.co/28ZSNM1AOB",pt,[],['http://www.saldaodaamazonia.org.br'],[],0,0,1,['mp910não'],[],https://twitter.com/fatimalhas/status/1244993381325049856,False,,0,,,,,,,,[],,,,
1244965187075137537,1244965187075137537,2020-03-31 09:30:05 -03,2020-03-31,09:30:05,-0300,58319292,josebertotti,José Bertotti,,"Isolado internacionalmente pela Irresponsabilidade no enfrentamento ao Corona Vírus, ataca a ciência, defende desmatamento na Amazônia, nega o aquecimento global, destrói a legislação trabalhista, defende o Golpe de 64 e Ditadura, você realmente acha que isso tudo é coincidência?  https://t.co/ZpfBsz1TDT",pt,[],[],['https://pbs.twimg.com/media/EUcBPSfXQAAuyEk.jpg'],0,1,4,[],[],https://twitter.com/josebertotti/status/1244965187075137537,False,,1,https://pbs.twimg.com/media/EUcBPSfXQAAuyEk.jpg,,,,,,,[],,,,
1244824747449495553,1244816030259650560,2020-03-31 00:12:02 -03,2020-03-31,00:12:02,-0300,3229772159,adaopassoca,Perder para ganhar,,@Lets_Dex Faltou a água potável do Brasil iria acabar em 2015 por causa do desmatamento da Amazônia,pt,[],[],[],0,0,6,[],[],https://twitter.com/adaopassoca/status/1244824747449495553,False,,0,,,,,,,,"[{'screen_name': 'Lets_Dex', 'name': ""Let's Dex"", 'id': '172572824'}]",,,,
1244814949261742080,1244814949261742080,2020-03-30 23:33:06 -03,2020-03-30,23:33:06,-0300,3355746328,fiscaldoibama,O FISCAL do IBAMA,,Estendo o comentário do @oatila para as consequências do desmatamento da Amazônia (tb relacionado as mudanças climáticas) e adiciono a importância da pirralha @GretaThunberg como expoente da geração q sofrerá com o caos climático. As narrativas NEGACIONISTAS sendo confrontadas.,pt,"[{'screen_name': 'oatila', 'name': 'atila imunizando *de licença-paternidade', 'id': '13769472'}, {'screen_name': 'gretathunberg', 'name': 'greta thunberg', 'id': '1006419421244678144'}]",[],[],6,66,433,[],[],https://twitter.com/fiscaldoibama/status/1244814949261742080,False,https://twitter.com/emiliomoreno/status/1244813696234393601,0,,,,,,,,[],,,,
1244802229762248704,1244802229762248704,2020-03-30 22:42:33 -03,2020-03-30,22:42:33,-0300,2667530654,estevaoslowp,Estêvão Slow 👣💡,,"Vcs lembram da crise da Amazônia em 2019?  Jair demitiu o diretor do INPE por revelar dados oficiais sobre o aumento do desmatamento. Em seguida, fizeram guerra de informação para relativizar métodos e camuflar dados.  É isso q podemos esperar do Jair para enfrentar a Pandemia.",pt,[],[],[],13,212,1027,[],[],https://twitter.com/EstevaoSlowP/status/1244802229762248704,False,,0,,,,,,,,[],,,,
1244786522076913664,1244786522076913664,2020-03-30 21:40:08 -03,2020-03-30,21:40:08,-0300,314917127,thejornaleo,ela não vem mais,,"“eu sou Prior el mago até a final”  ah é? e vc é a favor de mais o q? do desmatamento da Amazônia? da teoria de q coronavírus é um resfriado q está sendo como arma pelos comunistas? ah, vai dormir, seu fascistinha de maternal!",pt,[],[],[],0,1,2,[],[],https://twitter.com/thejornaleo/status/1244786522076913664,False,,0,,,,,,,,[],,,,
1244765915759038465,1244765915759038465,2020-03-30 20:18:15 -03,2020-03-30,20:18:15,-0300,1090404492569395200,bap_rodrigoo,rodrigo,,Impedir o desmatamento e exploração da Amazônia! - Sign the Petition!  https://t.co/SiVk2RlzgK via @Change,pt,"[{'screen_name': 'change', 'name': 'change.org', 'id': '15947602'}]",['http://chng.it/sKRKvNBW'],[],0,0,0,[],[],https://twitter.com/Bap_Rodrigoo/status/1244765915759038465,False,,0,,,,,,,,[],,,,
1244764167657205760,1244764167657205760,2020-03-30 20:11:18 -03,2020-03-30,20:11:18,-0300,88097310,andremiragaia,André Miragaia,,"Acabei de dizer #MP910Não. Vamos, juntos, acabar com a corrupção e o desmatamento na Amazônia!   https://t.co/Z4QgwGWhxM",pt,[],['http://www.saldaodaamazonia.org.br'],[],0,0,1,['mp910não'],[],https://twitter.com/AndreMiragaia/status/1244764167657205760,False,,0,,,,,,,,[],,,,
1244750415482281985,1244750415482281985,2020-03-30 19:16:40 -03,2020-03-30,19:16:40,-0300,570290912,_arimonteiro,Ari :P,,"Só para descontrair um  pouco,  como anda o desmatamento na Amazônia?",pt,[],[],[],0,0,2,[],[],https://twitter.com/_AriMonteiro/status/1244750415482281985,False,,0,,,,,,,,[],,,,
1244666119442620416,1244666119442620416,2020-03-30 13:41:42 -03,2020-03-30,13:41:42,-0300,771163874762559488,joaomeirellxs,mundinho you dayeon brasil,,"qualquer assunto com relevancia igual ou menor ao desmatamento da amazonia apenas pode ser comentado apenas com um ""foda né menina""",pt,[],[],[],0,0,1,[],[],https://twitter.com/joaomeirellxs/status/1244666119442620416,False,,0,,,,,,,,[],,,,
1244649354981449728,1244649354981449728,2020-03-30 12:35:05 -03,2020-03-30,12:35:05,-0300,951294176154607618,romulogsoares,Rômulo Soares,,"Caralho, do nada BBB virou racismo, sorteio de camisa de time, politicamente correto, MBL, Casos de Família de Neymar e Marquezine, política, Deus, coronavírus, guerra do Irã, desmatamento da Amazônia, treta entre atléticas universitárias, zoofilia e broxar.",pt,[],[],[],0,35,64,[],[],https://twitter.com/romulogsoares/status/1244649354981449728,False,,0,,,,,,,,[],,,,
1244648282489577474,1244648282489577474,2020-03-30 12:30:49 -03,2020-03-30,12:30:49,-0300,855614996675538944,ritaberaldo,Rita Beraldo 🌏🌎🌍📚,,Governo de Bolsonaro agradeceu a Johnson pelo apoio a incêndios na Amazônia Recusa do primeiro-ministro do Reino Unido de criticar incêndios na Amazônia e aumento acentuado do desmatamento   https://t.co/p3mzsLU5uf,pt,[],['https://www.theguardian.com/environment/2020/mar/30/bolsonaro-government-thanked-johnson-for-amazon-fire-support'],[],1,1,1,[],[],https://twitter.com/ritaberaldo/status/1244648282489577474,False,,0,,,,,,,,[],,,,
1244627801740849153,1244627801740849153,2020-03-30 11:09:26 -03,2020-03-30,11:09:26,-0300,4783362989,luizg_chrispino,🇧🇷Luiz Gustavo Chrispino🇧🇷,,Primeiro Conselho da Amazônia foca no combate às queimadas e ao desmatamento ilegal  https://t.co/cpPTYQ1Ubx  https://t.co/sXzt0zyEQn,pt,[],['https://dunapress.org/2020/03/30/primeiro-conselho-da-amazonia-foca-no-combate-as-queimadas-e-ao-desmatamento-ilegal/'],['https://pbs.twimg.com/media/EUXOY6gWoAAY3X8.jpg'],0,0,0,[],[],https://twitter.com/luizg_chrispino/status/1244627801740849153,False,,1,https://pbs.twimg.com/media/EUXOY6gWoAAY3X8.jpg,,,,,,,[],,,,
1244627766345154563,1244627766345154563,2020-03-30 11:09:18 -03,2020-03-30,11:09:18,-0300,869155606183243777,joice_m_,Joice Maria Ferreira,,Primeiro Conselho da Amazônia foca no combate às queimadas e ao desmatamento ilegal  https://t.co/nRCwcE9RJq  https://t.co/8mqZiw8GrM,pt,[],['https://dunapress.org/2020/03/30/primeiro-conselho-da-amazonia-foca-no-combate-as-queimadas-e-ao-desmatamento-ilegal/'],['https://pbs.twimg.com/media/EUXOW4xX0AELOsh.jpg'],0,0,0,[],[],https://twitter.com/Joice_M_/status/1244627766345154563,False,,1,https://pbs.twimg.com/media/EUXOW4xX0AELOsh.jpg,,,,,,,[],,,,
1244627750809452545,1244627750809452545,2020-03-30 11:09:14 -03,2020-03-30,11:09:14,-0300,221219622,paulofdbarros,Paulo Fernando de Barros,,Primeiro Conselho da Amazônia foca no combate às queimadas e ao desmatamento ilegal  https://t.co/DFf8Tzwqjh  https://t.co/s3qQsNCMzJ,pt,[],['https://dunapress.org/2020/03/30/primeiro-conselho-da-amazonia-foca-no-combate-as-queimadas-e-ao-desmatamento-ilegal/'],['https://pbs.twimg.com/media/EUXOV-TWoAQMN7C.jpg'],0,0,0,[],[],https://twitter.com/paulofdbarros/status/1244627750809452545,False,,1,https://pbs.twimg.com/media/EUXOV-TWoAQMN7C.jpg,,,,,,,[],,,,
1244627742001422337,1244627742001422337,2020-03-30 11:09:12 -03,2020-03-30,11:09:12,-0300,720601460430516225,nordica_news,NNNBC,,Primeiro Conselho da Amazônia foca no combate às queimadas e ao desmatamento ilegal  https://t.co/30NI29mVsN  https://t.co/rxuSADbWZb,pt,[],['https://dunapress.org/2020/03/30/primeiro-conselho-da-amazonia-foca-no-combate-as-queimadas-e-ao-desmatamento-ilegal/'],['https://pbs.twimg.com/media/EUXOVeVX0AENAnj.jpg'],0,0,1,[],[],https://twitter.com/nordica_news/status/1244627742001422337,False,,1,https://pbs.twimg.com/media/EUXOVeVX0AENAnj.jpg,,,,,,,[],,,,
1244610004528893958,1244610004528893958,2020-03-30 09:58:43 -03,2020-03-30,09:58:43,-0300,1123321960115654657,iamasmanaus,Instituto Amazônia Sustentável,,"Atenção proprietário de imóvel rural cadastrado no SICAR. Existe grande possibilidade de autuação e cobrança de multa por crime ambiental. Órgãos de fiscalização ambiental detectam, por satélite, ações de desmatamento. #amazonia #amazonas contato@iamas.org.br 92 999857864  https://t.co/IDZ9Vbe7Fh",pt,[],[],['https://pbs.twimg.com/media/EUW-L_mXgAYv8BI.jpg'],0,0,1,"['amazonia', 'amazonas']",[],https://twitter.com/iamasmanaus/status/1244610004528893958,False,,1,https://pbs.twimg.com/media/EUW-L_mXgAYv8BI.jpg,,,,,,,[],,,,
1244478528034308098,1244475130849435648,2020-03-30 01:16:17 -03,2020-03-30,01:16:17,-0300,1021579980940222464,1spectring,Spectring,,"@xetdoxv Foi o aquecimento global, junto com a seca que causaram os incêndios e o grande aumento de desmatamento na Amazônia.  O Bolsonaro não é a Tempestade pelo o'que eu sei.",pt,[],[],[],0,0,0,[],[],https://twitter.com/1Spectring/status/1244478528034308098,False,,0,,,,,,,,"[{'screen_name': 'xetdoxv', 'name': 'xet do xvideos', 'id': '1135374400059006977'}]",,,,
1244471793693442049,1244471793693442049,2020-03-30 00:49:31 -03,2020-03-30,00:49:31,-0300,1187826444858265604,ibsonfalcao,IBSON FALCÃO,,NÃO SE FALAM MAIS EM DESMATAMENTO DA AMAZÔNIA! E GRETA A GAROTA PROPAGANDA? 😂😂😂😂😂😂  https://t.co/pT7FIzOJif,pt,[],[],['https://pbs.twimg.com/tweet_video_thumb/EUVAd0xWAAwELhz.jpg'],0,0,0,[],[],https://twitter.com/IbsonFalcao/status/1244471793693442049,False,,1,https://pbs.twimg.com/tweet_video_thumb/EUVAd0xWAAwELhz.jpg,,,,,,,[],,,,
1244455362142580742,1244347679255285768,2020-03-29 23:44:13 -03,2020-03-29,23:44:13,-0300,2273385182,vinyalves_acg,Vinícius 💡☝,,"@aleealcatraz @jairbolsonaro Respeito acima de tudo sua opinião, mas discordo totalmente que seja ao menos um bom governo. Na crise do desmatamento e queimadas na Amazônia ano passado o governo foi fraco, omisso e ineficiente. E nessa está sendo mais uma vez.",pt,[],[],[],0,0,1,[],[],https://twitter.com/vinyalves_acg/status/1244455362142580742,False,,0,,,,,,,,"[{'screen_name': 'aleealcatraz', 'name': 'Alexandre Alcatraz', 'id': '1218986630163419136'}, {'screen_name': 'jairbolsonaro', 'name': 'Jair M. Bolsonaro', 'id': '128372940'}]",,,,
1244447530483580929,1244328041653960704,2020-03-29 23:13:06 -03,2020-03-29,23:13:06,-0300,20435122,brunomrv,BRUNO MOREIRA,,"@oproprioarantes @wilsonwitzel @filipetrielli @Day_Camargo18 @bieelrochab2 É vc então o responsável pelo dólar a $5, PIB pífio, desemprego alto, recorde de desmatamento, perda do fundo Amazônia, falha na correção do ENEM, balança comercial negativa, fuga de investimento estrangeiro...?",pt,[],[],[],0,0,0,[],[],https://twitter.com/brunomrv/status/1244447530483580929,False,,0,,,,,,,,"[{'screen_name': 'oproprioarantes', 'name': 'João Lucas Arantes', 'id': '1029774904743407616'}, {'screen_name': 'wilsonwitzel', 'name': 'Wilson Witzel', 'id': '971110539169591298'}, {'screen_name': 'filipetrielli', 'name': 'Filipe Trielli', 'id': '27699093'}, {'screen_name': 'Day_Camargo18', 'name': 'Dayane', 'id': '1047465162406543361'}]",,,,
1244440738697445377,1244440738697445377,2020-03-29 22:46:07 -03,2020-03-29,22:46:07,-0300,952624995263565826,a_fuckingflower,🌸little flower 🌸,,"Eu n achava q ia tá viva pra ver nd ksksksks Mas já vi um impeachment, uma quase terceira guerra, desmatamento absurdo da Amazônia e um quase fim do mundo por causa de um vírus. Meus filhos q lutem pra escutar minhas histórias ksksksks",pt,[],[],[],0,0,0,[],[],https://twitter.com/a_fuckingflower/status/1244440738697445377,False,https://twitter.com/whyparkjeon/status/1244413154261708804,0,,,,,,,,[],,,,
1244390542974345216,1244390542974345216,2020-03-29 19:26:39 -03,2020-03-29,19:26:39,-0300,786710861801021441,duamerican22,Filho Pródigo,,Fiz una redação sobre o desmatamento da Amazônia pro bgl da escola e acabei fritando meus últimos neurônios pqp que bgl chato,pt,[],[],[],5,0,5,[],[],https://twitter.com/Duamerican22/status/1244390542974345216,False,,0,,,,,,,,[],,,,
1244389044265586693,1244389044265586693,2020-03-29 19:20:42 -03,2020-03-29,19:20:42,-0300,3243410511,splderh4n,@kaza,,falei da amazônia linda e perfeita em Rio e depois falei da queimada do 1 e o desmatamento do 2 ✌️😗,pt,[],[],[],0,0,0,[],[],https://twitter.com/SPlDERH4N/status/1244389044265586693,False,,0,,,,,,,,[],,,,
1244379028003475456,1244301691652104195,2020-03-29 18:40:54 -03,2020-03-29,18:40:54,-0300,740646284911116289,paosovad0,𝖺́ 𝗏 𝖾 𝗅 🌿 THE WANTED IS BACK,,@batatafrita_ desmatamento da Amazônia,pt,[],[],[],1,0,0,[],[],https://twitter.com/paosovad0/status/1244379028003475456,False,,0,,,,,,,,"[{'screen_name': 'batatafrita_', 'name': 'kim su-mi', 'id': '938384491160141825'}]",,,,
1244347813745623040,1244347813745623040,2020-03-29 16:36:52 -03,2020-03-29,16:36:52,-0300,174017304,thinkfloyd61,Maurício Castro,,Brasil reduz medidas contra o desmatamento da Amazônia em meio ao coronavírus:  https://t.co/nOdNyUcRf9 via @sputnik_brasil,pt,"[{'screen_name': 'sputnik_brasil', 'name': 'sputnik brasil', 'id': '499107662'}]",['https://br.sputniknews.com/brasil/2020032715383201-brasil-reduz-medidas-contra-o-desmatamento-da-amazonia-em-meio-ao-coronavirus/'],[],0,0,0,[],[],https://twitter.com/ThinkFloyd61/status/1244347813745623040,False,,0,,,,,,,,[],,,,
1244337105423208448,1244337105423208448,2020-03-29 15:54:19 -03,2020-03-29,15:54:19,-0300,573244194,andymiritz,Andy Miritz,,"Sei que não posso sentir raiva das pessoas que comem carne porque a grande maioria não tem noção nenhuma do mal que a agropecuária faz para o planeta, desde o desmatamento da Amazônia, a extinção dos animais marinhos, a nossa futura extinção e o gasto absurdo de água, mas é... +",pt,[],[],[],2,0,0,[],[],https://twitter.com/AndyMiritz/status/1244337105423208448,False,,0,,,,,,,,[],,,,
1244316513072566272,1242532099602743297,2020-03-29 14:32:29 -03,2020-03-29,14:32:29,-0300,198289717,lima_mike,Lima_Mike,,@GreenpeaceBR Estão mesmo preocupados com desmatamento ou só se for na Amazônia?  Queria saber sobre esse outro desmatamento na Alemanha da @AngelaMerkelCDU.  Ou lá está liberado?   https://t.co/ry4l2m57oU,pt,"[{'screen_name': 'angelamerkelcdu', 'name': 'merkel, angela', 'id': '20057426'}]","['https://www.google.com/amp/s/www.terra.com.br/amp/noticias/tribunal-autoriza-tesla-a-derrubar-floresta-nos-arredores-de-berlim,342a451037690a468ce81b29f07f3901n780xh8d.html']",[],0,0,0,[],[],https://twitter.com/Lima_Mike/status/1244316513072566272,False,,0,,,,,,,,"[{'screen_name': 'GreenpeaceBR', 'name': 'Greenpeace Brasil', 'id': '16334137'}]",,,,
1244312589812850688,1244310223294214144,2020-03-29 14:16:54 -03,2020-03-29,14:16:54,-0300,1655389585,pedrojportela,Pedro Portela,,@thameadanelon O MP é engenheiro florestal quando denuncia desmatamento ilegal na Amazônia ? Passada de pano sofisticada à moda conivência.,pt,[],[],[],15,9,235,[],[],https://twitter.com/PedroJPortela/status/1244312589812850688,False,,0,,,,,,,,"[{'screen_name': 'thameadanelon', 'name': 'Thaméa Danelon', 'id': '732397017423597568'}]",,,,
1244300501405089794,1244300501405089794,2020-03-29 13:28:52 -03,2020-03-29,13:28:52,-0300,308793113,ce_albuquerque,carlos albuquerque,,"O diretor do Instituto Nacional de Pesquisas Espaciais (Inpe), Ricardo Galvão, que denunciou ao mundo dados que mostram a intensificação do desmatamento da Amazônia, será exonerado do cargo, a mando de Jair.",pt,[],[],[],0,0,0,[],[],https://twitter.com/ce_albuquerque/status/1244300501405089794,False,,0,,,,,,,,[],,,,
1244273569632342016,1244273569632342016,2020-03-29 11:41:51 -03,2020-03-29,11:41:51,-0300,1216912850171629569,rogerio_mmorais,Rogério Morais,,"Começando a semana que celebrará o dia do Pr. e dos seus filhos! De quem diz que governa, mas não manda em nada, de quem disse que era “só uma gripezinha”, de quem recebe em 48x de $2 mil do Queiroz, de quem disse que o desmatamento na Amazônia não aumentou! #1ºdeabril",pt,[],[],[],0,0,1,['1ºdeabril'],[],https://twitter.com/rogerio_mmorais/status/1244273569632342016,False,,0,,,,,,,,[],,,,
1244255907426467840,1244255907426467840,2020-03-29 10:31:40 -03,2020-03-29,10:31:40,-0300,15170564,benzina,benzina,,"o governo federal escondeu dados sobre desmatamento na amazonia e vetou o relatorio da fiocruz sobre drogas no brasil, meses atrás. Por qual motivo eles divulgariam dados realistas do covid?",pt,[],[],[],0,0,2,[],[],https://twitter.com/benzina/status/1244255907426467840,False,,0,,,,,,,,[],,,,
1244139412025495552,1244104493370761217,2020-03-29 02:48:45 -03,2020-03-29,02:48:45,-0300,4618269515,xyztres,Lucas Cabral 🖖👻😻🤓🍺💡🏗⚡💾,,@FotosDeFatos Depois ficou do lado de quem questiona as fotos de satélites sobre desmatamento da Amazônia,pt,[],[],[],0,0,13,[],[],https://twitter.com/XyzTres/status/1244139412025495552,False,,0,,,,,,,,"[{'screen_name': 'FotosDeFatos', 'name': 'Fotos de Fatos', 'id': '2959459379'}]",,,,
1243959866617626626,1243959866617626626,2020-03-28 14:55:18 -03,2020-03-28,14:55:18,-0300,1190511193208827904,monikinha051,Mônik 𓋹,,O Chico Bento a favor do desmatamento da Amazônia,pt,[],[],[],0,0,0,[],[],https://twitter.com/Monikinha051/status/1243959866617626626,False,,0,,,,,,,,[],,,,
1243948336652132354,1243649287231332352,2020-03-28 14:09:29 -03,2020-03-28,14:09:29,-0300,17688361,robgordon_sp,Rob Gordon,,@bicmuller @vuintrieri Isso depois de acusar de fraude os estudos sobre desmatamento e queimadas na Amazônia feitos pelo próprio governo.,pt,[],[],[],0,0,3,[],[],https://twitter.com/robgordon_sp/status/1243948336652132354,False,,0,,,,,,,,"[{'screen_name': 'bicmuller', 'name': 'Bic Müller', 'id': '15336738'}, {'screen_name': 'vuintrieri', 'name': 'Soren Lorensen', 'id': '53282527'}]",,,,
1243947034983436290,1243947034983436290,2020-03-28 14:04:19 -03,2020-03-28,14:04:19,-0300,1199063986022572032,coronavirushj,Notícias do Corona Vírus no Brasil,,Brasil reduz medidas contra o desmatamento da Amazônia em meio ao coronavírus -  https://t.co/CtX5CScFYk  Fonte: Jornal do Brasil #CoronaVirusNoBrasil #COVIDー19,pt,[],['https://www.jb.com.br/pais/ecologia/2020/03/1023013-brasil-reduz-medidas-contra-o-desmatamento-da-amazonia-em-meio-ao-coronavirus.html'],[],0,0,0,"['coronavirusnobrasil', 'covidー19']",[],https://twitter.com/coronavirushj/status/1243947034983436290,False,,0,,,,,,,,[],,,,
1243930382837395456,1243930382837395456,2020-03-28 12:58:09 -03,2020-03-28,12:58:09,-0300,1192844684290342912,ecosolpsolsp,Ecossocialismo PSOL-SP,,"A Amazônia e o meio ambiente tornaram-se um dos principais calcanhares de Aquiles do governo de Jair Bolsonaro. Desmatamento em larga escala, emergência climática, enchentes, chuvas torrenciais, perspectiva de uma nova crise hídrica, desmoronamentos.  https://t.co/LGZkw9035y",pt,[],[],['https://pbs.twimg.com/media/EUNUFitWsAE2nby.jpg'],2,5,8,[],[],https://twitter.com/ecosolpsolsp/status/1243930382837395456,False,,1,https://pbs.twimg.com/media/EUNUFitWsAE2nby.jpg,,,,,,,[],,,,
1243851341845446658,1243851341845446658,2020-03-28 07:44:04 -03,2020-03-28,07:44:04,-0300,3356178363,ssilviacassa,Silvia Cassa 🌵😷🏳🆘️ AMAZÔNIA E SERRADO,,"E o sujeito não para, nem com a pandemia! Tem que ser expulso do cargo. Novas eleições  RR: desmatamento revela avanço à última fronteira agropecuária da Amazônia  https://t.co/qG0ypb0VmS via @UOLNoticias @UOL",pt,"[{'screen_name': 'uolnoticias', 'name': 'uol notícias', 'id': '14594698'}, {'screen_name': 'uol', 'name': 'uol', 'id': '70799317'}]",['https://noticias.uol.com.br/meio-ambiente/ultimas-noticias/redacao/2019/11/29/rr-desmatamento-revela-avanco-a-ultima-fronteira-agropecuaria-da-amazonia.htm'],[],0,0,0,[],[],https://twitter.com/SSilviacassa/status/1243851341845446658,False,,0,,,,,,,,[],,,,
1243770614600564738,1243770614600564738,2020-03-28 02:23:17 -03,2020-03-28,02:23:17,-0300,968716271553536006,carlosgomesac,Carlos Gomes ,,A família Bittar para proteção da Amazônia propõe o desmatamento; pra evitar o coronavírus a circulação em massa.,pt,[],[],[],2,18,146,[],[],https://twitter.com/carlosgomesac/status/1243770614600564738,False,,0,,,,,,,,[],,,,
1243735840930611202,1243543754495139840,2020-03-28 00:05:06 -03,2020-03-28,00:05:06,-0300,252461418,assisbergman,Por um país sem bozos,,"@luciakind @gen_heleno Opa! A PR já tá ocupada. Não adianta sequer sugerir. Talvez sobre vaga em animado condomínio da Barra, em rachadinha na ALERJ ou em desmatamento ilegal na Amazônia. Vai terra de indígena aí? Proteção de milícia contra COVID?",pt,[],[],[],0,0,1,[],[],https://twitter.com/assisbergman/status/1243735840930611202,False,,0,,,,,,,,"[{'screen_name': 'luciakind', 'name': '🔰Lucia HS🇧🇷⚖️Ⓜ️☘️', 'id': '1539444834'}, {'screen_name': 'gen_heleno', 'name': 'General Heleno', 'id': '1163562471854133250'}]",,,,
1243710308553822213,1243710308553822213,2020-03-27 22:23:39 -03,2020-03-27,22:23:39,-0300,66867484,dcvitti,#DialisonCleberVitti,,#Brasil reduz medidas contra o desmatamento da #Amazônia em meio ao #coronavírus  https://t.co/0MuYh2pbfb,pt,[],['https://br.sputniknews.com/brasil/2020032715383201-brasil-reduz-medidas-contra-o-desmatamento-da-amazonia-em-meio-ao-coronavirus'],[],0,0,0,"['brasil', 'amazônia', 'coronavírus']",[],https://twitter.com/dcvitti/status/1243710308553822213,False,,0,,,,,,,,[],,,,
1243706052983631872,1243706052983631872,2020-03-27 22:06:44 -03,2020-03-27,22:06:44,-0300,27338874,gkellygbernardo,Kelly GB,,Brasil reduz medidas contra o desmatamento da Amazônia em meio ao coronavírus  https://t.co/SmJeOYKVu4,pt,[],['https://www.jb.com.br/pais/ecologia/2020/03/1023013-brasil-reduz-medidas-contra-o-desmatamento-da-amazonia-em-meio-ao-coronavirus.html#.Xn6jIjuklzI.twitter'],[],0,0,0,[],[],https://twitter.com/GKellyGBernardo/status/1243706052983631872,False,,0,,,,,,,,[],,,,
1243702061885202432,1243702061885202432,2020-03-27 21:50:53 -03,2020-03-27,21:50:53,-0300,236185838,marioscand,MARIO,,Brasil reduz medidas contra o desmatamento da Amazônia em meio ao coronavírus:  https://t.co/aNRhpt3S8u via @sputnik_brasil,pt,"[{'screen_name': 'sputnik_brasil', 'name': 'sputnik brasil', 'id': '499107662'}]",['https://br.sputniknews.com/brasil/2020032715383201-brasil-reduz-medidas-contra-o-desmatamento-da-amazonia-em-meio-ao-coronavirus/'],[],0,0,0,[],[],https://twitter.com/marioscand/status/1243702061885202432,False,,0,,,,,,,,[],,,,
