id,conversation_id,created_at,date,time,timezone,user_id,username,name,place,tweet,language,mentions,urls,photos,replies_count,retweets_count,likes_count,hashtags,cashtags,link,retweet,quote_url,video,thumbnail,near,geo,source,user_rt_id,user_rt,retweet_id,reply_to,retweet_date,translate,trans_src,trans_dest
1242844800442863621,1242844800442863621,2020-03-25 13:04:26 -03,2020-03-25,13:04:26,-0300,70225548,murilo_brasil,Murilo Brasil,,Pandemia terá impacto direto no desmatamento da Amazônia - ((o))eco -  https://t.co/WAkMf2WCGx via @shareaholic,pt,"[{'screen_name': 'shareaholic', 'name': 'shareaholic', 'id': '791635'}]",['https://go.shr.lc/3aff9GI'],[],0,0,0,[],[],https://twitter.com/murilo_brasil/status/1242844800442863621,False,,0,,,,,,,,[],,,,
1242837555399311360,1242731499700367360,2020-03-25 12:35:38 -03,2020-03-25,12:35:38,-0300,1001546343083659265,futur3peep,Gui,,@EckertMaciel @nilmoretto e agora a bolsa em queda histórica e dólar em alta histórica. Incrível mesmo!! Além disso 2019 tendo desmatamento da Amazônia mais alto da década e maior crise ambiental da história do país. Mt bom mesmo,pt,[],[],[],0,0,2,[],[],https://twitter.com/Futur3Peep/status/1242837555399311360,False,,0,,,,,,,,"[{'screen_name': 'nilmoretto', 'name': 'Nil #ForaBolsonaro | #VacinaJá', 'id': '52499387'}]",,,,
1242827413580656646,1242827413580656646,2020-03-25 11:55:20 -03,2020-03-25,11:55:20,-0300,931198298932858881,obind_unb,Observatório dos Direitos e Políticas Indigenistas,,AMAZÔNIA NOTÍCIA E INFORMAÇÃO: Pandemia terá impacto direto no desmatamento da Amazônia  https://t.co/0FHogH92Ee  https://t.co/NsMskwN7NW,pt,[],['http://obind.eco.br/2020/03/24/amazonia-noticia-e-informacao-pandemia-tera-impacto-direto-no-desmatamento-da-amazonia/'],['https://pbs.twimg.com/media/ET9o8gsXkAEuosT.jpg'],0,0,0,[],[],https://twitter.com/OBIND_UnB/status/1242827413580656646,False,,1,https://pbs.twimg.com/media/ET9o8gsXkAEuosT.jpg,,,,,,,[],,,,
1242827405171085312,1242827405171085312,2020-03-25 11:55:18 -03,2020-03-25,11:55:18,-0300,575713446,marcelozelic,Marcelo Zelic,,AMAZÔNIA NOTÍCIA E INFORMAÇÃO: Pandemia terá impacto direto no desmatamento da Amazônia  https://t.co/SmRKpbCVtP  https://t.co/SVbp6ClbKS,pt,[],['http://obind.eco.br/2020/03/24/amazonia-noticia-e-informacao-pandemia-tera-impacto-direto-no-desmatamento-da-amazonia/'],['https://pbs.twimg.com/media/ET9o8EiXQAAAfhu.jpg'],0,0,0,[],[],https://twitter.com/MarceloZelic/status/1242827405171085312,False,,1,https://pbs.twimg.com/media/ET9o8EiXQAAAfhu.jpg,,,,,,,[],,,,
1242826610392346630,1242825827919835136,2020-03-25 11:52:09 -03,2020-03-25,11:52:09,-0300,993172117272367106,amoreusous2,feminist of Naboo 🦋,,"@fiscaldoibama eu estou preocupada com o desmatamento atual da Amazonia. eles devem estar adorando todos só falando de corona e não do avanço do desmatamento. só vejo como já tem alteração em chuvas, com sul tendo seca e nordeste tendo aumento de chuvas.",pt,[],[],[],1,0,12,[],[],https://twitter.com/amoreusous2/status/1242826610392346630,False,,0,,,,,,,,"[{'screen_name': 'fiscaldoibama', 'name': 'O FISCAL do IBAMA', 'id': '3355746328'}]",,,,
1242815314447994881,1242815314447994881,2020-03-25 11:07:16 -03,2020-03-25,11:07:16,-0300,3354043378,cattsilver,catarina,,"Acabei de dizer #MP910Não. Vamos, juntos, acabar com a corrupção e o desmatamento na Amazônia!   https://t.co/5TZWUUHpfx",pt,[],['http://www.saldaodaamazonia.org.br'],[],0,0,0,['mp910não'],[],https://twitter.com/cattsilver/status/1242815314447994881,False,,0,,,,,,,,[],,,,
1242807049282621441,1242807049282621441,2020-03-25 10:34:25 -03,2020-03-25,10:34:25,-0300,220373606,ohyeahdamn,princesa da favela,,"Acabei de dizer #MP910Não. Vamos, juntos, acabar com a corrupção e o desmatamento na Amazônia!   https://t.co/6TW55y4MOw",pt,[],['http://www.saldaodaamazonia.org.br'],[],0,0,0,['mp910não'],[],https://twitter.com/ohyeahdamn/status/1242807049282621441,False,,0,,,,,,,,[],,,,
1242806275618021376,1242806268538040322,2020-03-25 10:31:20 -03,2020-03-25,10:31:20,-0300,1230565581708877824,heloisealmeidal,Luna ᛡ,,"graças à atenção que Mendes conseguiu chamar para a Amazônia, os dados sobre o ritmo do desmatamento na floresta começaram a ser coletados também em 1977 os números eram alarmantes e escandalizavam a comunidade internacional",pt,[],[],[],1,0,0,[],[],https://twitter.com/heloisealmeidal/status/1242806275618021376,False,,0,,,,,,,,[],,,,
1242805304875790338,1242805304875790338,2020-03-25 10:27:29 -03,2020-03-25,10:27:29,-0300,15980430,edu_cezimbra,Edu Cezimbra,,Pandemia terá impacto direto no desmatamento da Amazônia - ((o))eco -  https://t.co/9LNg85W0DA via @shareaholic,pt,"[{'screen_name': 'shareaholic', 'name': 'shareaholic', 'id': '791635'}]",['https://go.shr.lc/3aff9GI'],[],0,0,0,[],[],https://twitter.com/Edu_Cezimbra/status/1242805304875790338,False,,0,,,,,,,,[],,,,
1242804682956906498,1242804682956906498,2020-03-25 10:25:01 -03,2020-03-25,10:25:01,-0300,373999953,alessandrahecke,Alealeale,,Pandemia terá impacto direto no desmatamento da Amazônia - ((o))eco -  https://t.co/1urmcbiBcD via @shareaholic,pt,"[{'screen_name': 'shareaholic', 'name': 'shareaholic', 'id': '791635'}]",['https://go.shr.lc/3aff9GI'],[],0,0,0,[],[],https://twitter.com/AlessandraHecke/status/1242804682956906498,False,,0,,,,,,,,[],,,,
1242787177873969155,1242787177873969155,2020-03-25 09:15:27 -03,2020-03-25,09:15:27,-0300,1225918532887744512,peldforr,Peld Forr,,#Pandemia terá impacto direto no #desmatamento da #Amazônia .... por Fernanda Wenzel  https://t.co/gNij9cY6wz @imbrozio @ricoperdiz @coronaviruscare @group1crew @paulogbarreto @IPAM_Amazonia @Ascom_Inpa @PPBio_INPA @fecoelhos @ED_AMAZONIA @AmazoniaOrg,es,"[{'screen_name': 'imbrozio', 'name': 'reinaldo imbrozio', 'id': '1164000126'}, {'screen_name': 'ricoperdiz', 'name': 'ricardo perdiz', 'id': '1226152135756328960'}, {'screen_name': 'group1crew', 'name': '.', 'id': '29788830'}, {'screen_name': 'paulogbarreto', 'name': 'paulo barreto', 'id': '35317431'}, {'screen_name': 'ipam_amazonia', 'name': 'ipam_amazônia', 'id': '67302940'}, {'screen_name': 'ascom_inpa', 'name': 'ascom do inpa', 'id': '71283780'}, {'screen_name': 'ppbio_inpa', 'name': 'ppbio inpa', 'id': '183660651'}, {'screen_name': 'fecoelhos', 'name': 'fernanda coelho', 'id': '3094260838'}, {'screen_name': 'ed_amazonia', 'name': 'edwin keizer', 'id': '168772292'}, {'screen_name': 'amazoniaorg', 'name': 'site amazônia', 'id': '65454115'}]",['https://www.oeco.org.br/reportagens/pandemia-tera-impacto-direto-no-desmatamento-da-amazonia/?utm_source=wysija&utm_medium=email&utm_campaign=Newsletter+Diaria'],[],0,7,8,"['pandemia', 'desmatamento', 'amazônia']",[],https://twitter.com/PeldForr/status/1242787177873969155,False,,0,,,,,,,,[],,,,
1242740965582032897,1242731499700367360,2020-03-25 06:11:49 -03,2020-03-25,06:11:49,-0300,65192275,1gabrielxavier,gabs ✠,,"@nilmoretto Eu só queria a Marina na presidência meu sonho, imagina como teria sido totalmente diferente as situações do desmatamento na Amazônia, do óleo nas praias do Nordeste e agora dessa pandemia",pt,[],[],[],1,0,28,[],[],https://twitter.com/1gabrielxavier/status/1242740965582032897,False,,0,,,,,,,,"[{'screen_name': 'nilmoretto', 'name': 'Nil #ForaBolsonaro | #VacinaJá', 'id': '52499387'}]",,,,
1242668782893641728,1242668781706625025,2020-03-25 01:25:00 -03,2020-03-25,01:25:00,-0300,43893868,cristiano993,labrador bravo,,Ligação clara com as milícias  Desmatamento na Amazônia a níveis nunca vistos antes.   Grupo de ministros inaptos e loucos.  Total falta de articulação com o congresso.  PIBinho do nível ou inferior ao governo Dilma  Ataques a imprensa livre,pt,[],[],[],1,0,0,[],[],https://twitter.com/cristiano993/status/1242668782893641728,False,,0,,,,,,,,[],,,,
1242663463945674753,1242663463945674753,2020-03-25 01:03:52 -03,2020-03-25,01:03:52,-0300,282874229,blaasfemo,Blaasfemo,,Bolsonaro quer te matar É isso mesmo que você leu:  Se você não morrer Por COVID19 Por bala perdida do desarmamento Por sofrer preconceito/racismo na rua Por desmatamento na Amazônia Por poluição  Você morrerá sem a sua aposentadoria. É isto. #Impeachment #ForaBolsonaro,pt,[],[],[],1,1,2,"['impeachment', 'forabolsonaro']",[],https://twitter.com/Blaasfemo/status/1242663463945674753,False,,0,,,,,,,,[],,,,
1242650756940955649,1242650756940955649,2020-03-25 00:13:22 -03,2020-03-25,00:13:22,-0300,282296753,ogabrielfelipi,Filpês Gabriel,,"Polêmicas em menos de 4 anos: Desmatamento da Amazônia, coronavírus sendo tratado como “gripezinha” machismo, racismo e preconceito. Falta mais o que agora pro tombo ficar completo?",pt,[],[],[],0,0,1,[],[],https://twitter.com/oGabrielFelipi/status/1242650756940955649,False,,0,,,,,,,,[],,,,
1242648424081752064,1242648424081752064,2020-03-25 00:04:06 -03,2020-03-25,00:04:06,-0300,62601015,fernandoguida,Fernando Guida,,'A grande mentira verde': como a destruição da Amazônia vai além do desmatamento  https://t.co/ZIwNvcC0UW via @fernandoGuida,pt,"[{'screen_name': 'fernandoguida', 'name': 'fernando guida', 'id': '62601015'}]",['https://blogdoguida.wordpress.com/2020/03/02/a-grande-mentira-verde-como-a-destruicao-da-amazonia-vai-alem-do-desmatamento/'],[],0,1,1,[],[],https://twitter.com/FernandoGuida/status/1242648424081752064,False,,0,,,,,,,,[],,,,
1242645179661791234,1242645179661791234,2020-03-24 23:51:12 -03,2020-03-24,23:51:12,-0300,317455014,juniorcardoso8,Junior Cardoso,,Pandemia terá impacto direto no desmatamento da Amazônia - ((o))eco -  https://t.co/wrBXga4pYL via @shareaholic,pt,"[{'screen_name': 'shareaholic', 'name': 'shareaholic', 'id': '791635'}]",['https://go.shr.lc/3aff9GI'],[],0,0,0,[],[],https://twitter.com/JuniorCardoso8/status/1242645179661791234,False,,0,,,,,,,,[],,,,
1242635842973294597,1242635842973294597,2020-03-24 23:14:06 -03,2020-03-24,23:14:06,-0300,60423601,hellderdias,Hellder Dias,,"Muito obrigado #michaeljackson Você realmente foi um artista que cantou e encantou o mundo com a sua luz, abordando temas nas letras como amor, igualdade, desmatamento, humanidade, amazonia, raça negra e tantos…  https://t.co/LzCRyygU2L",pt,[],['https://www.instagram.com/p/B-I7NzkHoRt/?igshid=10qms5714wk7f'],[],0,0,1,['michaeljackson'],[],https://twitter.com/hellderdias/status/1242635842973294597,False,,0,,,,,,,,[],,,,
1242630373500215302,1242630373500215302,2020-03-24 22:52:22 -03,2020-03-24,22:52:22,-0300,1029532756987072512,mdecampos_,Matheus é Lula 2022,,"Em uma eleição repleta de professores universitários, gente que presta serviço para ONU, Banco Mundial e afins, gente que fez o desmatamento na Amazônia cair como nunca antes... ganhar um militar aposentado completamente retardado. Essa aí a gente tá de parabéns, em Brasil?",pt,[],[],[],0,0,1,[],[],https://twitter.com/mdecampos_/status/1242630373500215302,False,,0,,,,,,,,[],,,,
1242610254887694341,1242610254887694341,2020-03-24 21:32:26 -03,2020-03-24,21:32:26,-0300,25538057,vihh14,Vihh,,Pandemia terá impacto direto no desmatamento da Amazônia - ((o))eco -  https://t.co/RXAkLsaES3,pt,[],['https://go.shr.lc/3aff9GI'],[],0,0,0,[],[],https://twitter.com/Vihh14/status/1242610254887694341,False,,0,,,,,,,,[],,,,
1242601955173728256,1242601955173728256,2020-03-24 20:59:27 -03,2020-03-24,20:59:27,-0300,1095536523968217088,carolinemonstra,@Marrenta💲,,"Amazônia desmatada não tinha desmatamento , COVID matando em todos os países não tem COVID é apenas uma gripe um resfriado quem boto ele na presidência",pt,[],[],[],0,0,0,[],[],https://twitter.com/CarolineMonstra/status/1242601955173728256,False,,0,,,,,,,,[],,,,
1242595985060237313,1242595985060237313,2020-03-24 20:35:43 -03,2020-03-24,20:35:43,-0300,138492825,proindio,Comissão Pró-Índio,,"Para o vice-presidente Hamilton Mourão, a crise do #covid_19 e seus efeitos econômicos podem levar a uma intensificação do #desmatamento na #Amazônia, que estaria mais vulnerável agora com todas as atenções voltadas para a pandemia @ClimaInfoNews",pt,"[{'screen_name': 'climainfonews', 'name': 'climainfo', 'id': '74715478'}]",[],[],0,1,5,"['covid_19', 'desmatamento', 'amazônia']",[],https://twitter.com/proindio/status/1242595985060237313,False,https://twitter.com/ClimaInfoNews/status/1242451726231392256,0,,,,,,,,[],,,,
1242589028987424770,1242588367830818823,2020-03-24 20:08:05 -03,2020-03-24,20:08:05,-0300,140642634,vinistrack,Vinícius Strack 🏳️‍🌈 IMPEACHMENT JÁ!!!,,"#ErgasuavozcontraaMP910 #MP910Não Vamos, juntos, acabar com a corrupção e o desmatamento na Amazônia!   https://t.co/1hiYnWRx0P",pt,[],['http://saldaodaamazonia.org.br'],[],0,0,0,"['ergasuavozcontraamp910', 'mp910não']",[],https://twitter.com/vinistrack/status/1242589028987424770,False,,0,,,,,,,,[],,,,
1242588367830818823,1242588367830818823,2020-03-24 20:05:27 -03,2020-03-24,20:05:27,-0300,140642634,vinistrack,Vinícius Strack 🏳️‍🌈 IMPEACHMENT JÁ!!!,,"Acabei de dizer #MP910Não. Vamos, juntos, acabar com a corrupção e o desmatamento na Amazônia!   https://t.co/97ZUfZgQ3O",pt,[],['http://www.saldaodaamazonia.org.br'],[],1,0,0,['mp910não'],[],https://twitter.com/vinistrack/status/1242588367830818823,False,,0,,,,,,,,[],,,,
1242555034073735172,1242555034073735172,2020-03-24 17:53:00 -03,2020-03-24,17:53:00,-0300,65454115,amazoniaorg,Site Amazônia,,Pandemia terá impacto direto no desmatamento da Amazônia  https://t.co/80hmtVg7IS  https://t.co/csSf7ERQdH,pt,[],['https://bit.ly/3agham5'],['https://pbs.twimg.com/media/ET5xMdAWkAIileS.jpg'],0,1,4,[],[],https://twitter.com/AmazoniaOrg/status/1242555034073735172,False,,1,https://pbs.twimg.com/media/ET5xMdAWkAIileS.jpg,,,,,,,[],,,,
1242549633953521666,1241066490817925121,2020-03-24 17:31:32 -03,2020-03-24,17:31:32,-0300,3486607162,21_8641,Jeane🌹,,"@felipeneto Cara depois da medica da cidade de Deus e da denuncia da funerária de MG eu começo a ""suspeitar"" q estes dados estão mais maquiados que os do desmatamento da Amazônia... será q este grupo de trabalho anticiencia e em negação faria isso???",pt,[],[],[],0,0,0,[],[],https://twitter.com/21_8641/status/1242549633953521666,False,,0,,,,,,,,"[{'screen_name': 'felipeneto', 'name': 'Felipe Neto', 'id': '14128609'}]",,,,
1242537918922620929,1242537918922620929,2020-03-24 16:44:59 -03,2020-03-24,16:44:59,-0300,2674564802,niltotatto,🇧🇷 Nilto Tatto - #ForaBolsonaro 🍀,,"Pandemia terá impacto direto no desmatamento da Amazônia  Desde que a #OMS reconheceu a #pandemia do #coronavirus, em 11/03, o #desmatamento desapareceu dos noticiários.   @nandawenzel @JornalOeco1 #Amazonia  https://t.co/7SjvUXumtD",pt,"[{'screen_name': 'nandawenzel', 'name': 'fernanda wenzel', 'id': '160015262'}, {'screen_name': 'jornaloeco1', 'name': 'jornal o eco', 'id': '363049219'}]",[],['https://pbs.twimg.com/media/ET5hY5wXYAIZ1mF.jpg'],0,7,13,"['oms', 'pandemia', 'coronavirus', 'desmatamento', 'amazonia']",[],https://twitter.com/NiltoTatto/status/1242537918922620929,False,,1,https://pbs.twimg.com/media/ET5hY5wXYAIZ1mF.jpg,,,,,,,[],,,,
1242520568303239168,1242520568303239168,2020-03-24 15:36:03 -03,2020-03-24,15:36:03,-0300,52084139,emrondonia,EMRONDONIA.COM,,Pandemia terá impacto direto no desmatamento da Amazônia  https://t.co/KCY3Fhmhon #ariquemesonline #emrondonia #ultimasnoticias,pt,[],['http://dlvr.it/RSTpwR'],[],0,1,0,"['ariquemesonline', 'emrondonia', 'ultimasnoticias']",[],https://twitter.com/emrondonia/status/1242520568303239168,False,,0,,,,,,,,[],,,,
1242504088245415944,1242504088245415944,2020-03-24 14:30:33 -03,2020-03-24,14:30:33,-0300,83112415,espacoecologico,Espaço Ecológico,,Pandemia terá impacto direto no desmatamento da Amazônia  https://t.co/zEqpcxlLch,pt,[],['https://espacoecologiconoar.com.br/pandemia-tera-impacto-direto-no-desmatamento-da-amazonia/'],[],0,0,0,[],[],https://twitter.com/espacoecologico/status/1242504088245415944,False,,0,,,,,,,,[],,,,
1242497228465475584,1242497228465475584,2020-03-24 14:03:18 -03,2020-03-24,14:03:18,-0300,74842999,imazon,Imazon,,"#ImazonNaMídia: ""Pandemia terá impacto direto no desmatamento da Amazônia"" via @o_eco c/ @paulogbarreto   https://t.co/7pmawsGU4A",pt,"[{'screen_name': 'o_eco', 'name': '((o))eco | jornalismo ambiental', 'id': '22914738'}, {'screen_name': 'paulogbarreto', 'name': 'paulo barreto', 'id': '35317431'}]",['https://imazon.org.br/imprensa/imazonnamidia-pandemia-tera-impacto-direto-no-desmatamento-da-amazonia-o-eco/'],[],0,2,3,['imazonnamídia'],[],https://twitter.com/Imazon/status/1242497228465475584,False,,0,,,,,,,,[],,,,
1242494203227189251,1242494203227189251,2020-03-24 13:51:17 -03,2020-03-24,13:51:17,-0300,77257018,gineuls,"Gisele Neuls (ela, she)",,"""O ouro já subiu quase 100%, e se a economia continuar desmontando o ouro vai continuar subindo."" É fudeu que fala ne?  Pandemia terá impacto direto no desmatamento da Amazônia - ((o))eco -  https://t.co/fSFs4GFVuf via @shareaholic",pt,"[{'screen_name': 'shareaholic', 'name': 'shareaholic', 'id': '791635'}]",['https://go.shr.lc/3aff9GI'],[],0,0,2,[],[],https://twitter.com/gineuls/status/1242494203227189251,False,,0,,,,,,,,[],,,,
1242492960551231488,1242492960551231488,2020-03-24 13:46:20 -03,2020-03-24,13:46:20,-0300,72110914,cmilaoliveiraa,Camila,,Eu sei que meu modo de pensar é ridículo e ainda mais com tantas pessoas morrendo ... mas depois de tanto desmatamento na Amazônia e milhares de animais mortos com as queima na Austrália. Vcs realmente pensaram que nada ia acontecer com nós?,pt,[],[],[],0,0,0,[],[],https://twitter.com/CmilaOliveiraa/status/1242492960551231488,False,,0,,,,,,,,[],,,,
1242490512562696192,1242490512562696192,2020-03-24 13:36:37 -03,2020-03-24,13:36:37,-0300,3142379039,jampawebjornal,🚩ᒍ. Alves - ᒍᗩᗰᑭᗩ ᗯᕮᗷ ᒍOᖇᑎᗩᒪ,,CORONAVÍRUS x DESMATAMENTO: Pandemia terá impacto direto no desmatamento da Amazônia...   https://t.co/zIh10wN0cX,pt,[],['https://jampawebjornal.blogspot.com/2020/03/coronavirus-x-desmatamento-pandemia.html'],[],0,0,0,[],[],https://twitter.com/JampaWebJornal/status/1242490512562696192,False,,0,,,,,,,,[],,,,
1242488100229656576,1242488100229656576,2020-03-24 13:27:02 -03,2020-03-24,13:27:02,-0300,696518825869705217,toninhocaetan17,TomWolf #Galo113Anos,,BBC News Brasil - 'A grande mentira verde': como a destruição da Amazônia vai além do desmatamento  https://t.co/hl1SgemR1a,pt,[],['https://www.bbc.com/portuguese/brasil-51317040'],[],0,0,0,[],[],https://twitter.com/ToninhoCaetan17/status/1242488100229656576,False,,0,,,,,,,,[],,,,
1242485846839889920,1242485846839889920,2020-03-24 13:18:04 -03,2020-03-24,13:18:04,-0300,925822026291523585,kingbenites,mohamed,,Essa mulheres brincando com papel eo desmatamento da Amazônia 😭😭😭😭😭😭😭😭,pt,[],[],[],0,0,0,[],[],https://twitter.com/kingbenites/status/1242485846839889920,False,,0,,,,,,,,[],,,,
1242480839042064384,1242480839042064384,2020-03-24 12:58:10 -03,2020-03-24,12:58:10,-0300,4383595517,moacirdosanjoss,Moacir,,"Estamos enxergando um recuo do Bolsonaro a subestimar a pandemia. Infelizmente, no caso dessa doença, a realidade se esfrega na cara daqueles que tentam negar, diferente de acusar os outros comunista, negar aquecimento global, desmatamento da Amazônia e etc.",pt,[],[],[],1,0,3,[],[],https://twitter.com/moacirdosanjoss/status/1242480839042064384,False,,0,,,,,,,,[],,,,
1242477483464757250,1242477483464757250,2020-03-24 12:44:50 -03,2020-03-24,12:44:50,-0300,25283401,unatalie,Natalie Unterstell,,Pandemia terá impacto direto no desmatamento da Amazônia - ((o))eco -  https://t.co/IATXbrb1DA,pt,[],['https://go.shr.lc/3dnPRrV'],[],0,2,3,[],[],https://twitter.com/unatalie/status/1242477483464757250,False,,0,,,,,,,,[],,,,
1242474142047207425,1242451726231392256,2020-03-24 12:31:34 -03,2020-03-24,12:31:34,-0300,35201891,pluraleemsite,plurale em site #vacinaparatodos,,@ClimaInfoNews Acompanhe ...impacto no desmatamento da Amazônia ...// @climaxbra @obsclima @fasamazonas @IPAM_Amazonia,pt,"[{'screen_name': 'climaxbra', 'name': '🌎🌈🌳☀️ clímax brasil', 'id': '2704725908'}, {'screen_name': 'obsclima', 'name': 'observatório do clima, 19 anos', 'id': '36336107'}, {'screen_name': 'ipam_amazonia', 'name': 'ipam_amazônia', 'id': '67302940'}]",[],[],0,0,0,[],[],https://twitter.com/pluraleemsite/status/1242474142047207425,False,,0,,,,,,,,"[{'screen_name': 'ClimaInfoNews', 'name': 'ClimaInfo', 'id': '74715478'}]",,,,
1242471280755920897,1242471280755920897,2020-03-24 12:20:11 -03,2020-03-24,12:20:11,-0300,1108695238888091648,elianemariapar3,Eliane Maria Parente,,Esse país virou uma barbárie depois do golpe contra a Presidenta Dilma Rousseff.    RR: desmatamento revela avanço à última fronteira agropecuária da Amazônia  https://t.co/cRPxxBNUGb via @UOLNoticias @UOL,pt,"[{'screen_name': 'uolnoticias', 'name': 'uol notícias', 'id': '14594698'}, {'screen_name': 'uol', 'name': 'uol', 'id': '70799317'}]",['https://noticias.uol.com.br/meio-ambiente/ultimas-noticias/redacao/2019/11/29/rr-desmatamento-revela-avanco-a-ultima-fronteira-agropecuaria-da-amazonia.htm'],[],0,0,0,[],[],https://twitter.com/ElianeMariaPar3/status/1242471280755920897,False,,0,,,,,,,,[],,,,
1242470934482747392,1242470934482747392,2020-03-24 12:18:49 -03,2020-03-24,12:18:49,-0300,227033563,marcioastrini,Marcio Astrini,,"Para Mourão, coronavírus pode intensificar desmate da Amazônia. Talvez. Em 2019 desmatamento cresceu 30%. Em fev/2020, já havia 100% de aumento no acumulado. Mesmo antes da pandemia, a floresta já sofria de uma doença devastadora, chamada Governo Bolsonaro  https://t.co/WWkAT7B4AO",pt,[],['https://blogs.oglobo.globo.com/lauro-jardim/post/amazonia-e-o-coronavirus-o-recado-de-mourao-bolsonaro.html'],[],0,1,5,[],[],https://twitter.com/MarcioAstrini/status/1242470934482747392,False,,0,,,,,,,,[],,,,
1242455658445840389,1242268545397985288,2020-03-24 11:18:07 -03,2020-03-24,11:18:07,-0300,151584335,genario_azevedo,genario azevedo,,"@DamaresAlves Não há recursos novos. A letargia do Governo, como aconteceu na poluição do óleo nas praias do Nordeste, bem como no desmatamento e queimadas na Amazônia, vai custar caro. O Coronavírus chegou pelos aeroportos, que ficaram sem fiscalização da Anvisa: nem fazia e nem deixava fazer",pt,[],[],[],0,0,0,[],[],https://twitter.com/genario_azevedo/status/1242455658445840389,False,,0,,,,,,,,"[{'screen_name': 'DamaresAlves', 'name': 'Damares Alves', 'id': '1083774484123975680'}]",,,,
1242451726231392256,1242451726231392256,2020-03-24 11:02:29 -03,2020-03-24,11:02:29,-0300,74715478,climainfonews,ClimaInfo,,"Para o vice-presidente Hamilton Mourão, a crise do #covid_19 e seus efeitos econômicos podem levar a uma intensificação do #desmatamento na #Amazônia, que estaria mais vulnerável agora com todas as atenções voltadas para a pandemia.  https://t.co/SfqcfxX9bK  https://t.co/E99YPaxtUi",pt,[],['https://climainfo.org.br/2020/03/23/mourao-coronavirus-pode-acelerar-desmatamento-da-amazonia/'],['https://pbs.twimg.com/media/ET4S0GdXkAEcs_U.png'],1,1,4,"['covid_19', 'desmatamento', 'amazônia']",[],https://twitter.com/ClimaInfoNews/status/1242451726231392256,False,,1,https://pbs.twimg.com/media/ET4S0GdXkAEcs_U.png,,,,,,,[],,,,
1242448433287442433,1242448433287442433,2020-03-24 10:49:24 -03,2020-03-24,10:49:24,-0300,1108695238888091648,elianemariapar3,Eliane Maria Parente,,Esse país virou uma barbárie depois do golpe contra a Presidenta Dilma Rousseff.    RR: desmatamento revela avanço à última fronteira agropecuária da Amazônia  https://t.co/cRPxxBwjOD via @UOLNoticias @UOL,pt,"[{'screen_name': 'uolnoticias', 'name': 'uol notícias', 'id': '14594698'}, {'screen_name': 'uol', 'name': 'uol', 'id': '70799317'}]",['https://noticias.uol.com.br/meio-ambiente/ultimas-noticias/redacao/2019/11/29/rr-desmatamento-revela-avanco-a-ultima-fronteira-agropecuaria-da-amazonia.htm'],[],0,0,0,[],[],https://twitter.com/ElianeMariaPar3/status/1242448433287442433,False,,0,,,,,,,,[],,,,
1242446805050306561,1242267483773558784,2020-03-24 10:42:56 -03,2020-03-24,10:42:56,-0300,1723908871,taemreuniao,Tàiyáng nǚwáng ☀️,,"@exmaridodela Já li sobre a trajetória inclusive o motivo do nome Madero...tem até uma contribuição no desmatamento da Amazônia, tô ligada",pt,[],[],[],1,0,1,[],[],https://twitter.com/taemreuniao/status/1242446805050306561,False,,0,,,,,,,,[],,,,
1242436409430073347,1242436409430073347,2020-03-24 10:01:38 -03,2020-03-24,10:01:38,-0300,138492825,proindio,Comissão Pró-Índio,,"Desde que a Organização Mundial da Saúde reconheceu a pandemia do #coronavírus, em 11 de março, o #desmatamento desapareceu dos noticiários. A #Amazônia, no entanto, tem uma dinâmica própria, e ainda não se sabe de que forma será impactada por esta crise.  https://t.co/dHTN8u0rYJ",pt,[],['https://www.oeco.org.br/reportagens/pandemia-tera-impacto-direto-no-desmatamento-da-amazonia/'],[],1,8,12,"['coronavírus', 'desmatamento', 'amazônia']",[],https://twitter.com/proindio/status/1242436409430073347,False,,0,,,,,,,,[],,,,
1242436161005662208,1242436161005662208,2020-03-24 10:00:38 -03,2020-03-24,10:00:38,-0300,256493925,sou_ecologico,Revista Ecológico,,O controverso Conselho Nacional da Amazônia Legal teme pelo avanço do desmatamento em meio à pandemia do coronavírus. Confira:  https://t.co/jAINH0MveJ #amazonia #desmantamento  https://t.co/uMDkMgQiR5,pt,[],['https://mla.bs/32c55898'],['https://pbs.twimg.com/media/ET4FGnrXgAAC9_u.jpg'],0,1,0,"['amazonia', 'desmantamento']",[],https://twitter.com/sou_ecologico/status/1242436161005662208,False,,1,https://pbs.twimg.com/media/ET4FGnrXgAAC9_u.jpg,,,,,,,[],,,,
