id,conversation_id,created_at,date,time,timezone,user_id,username,name,place,tweet,language,mentions,urls,photos,replies_count,retweets_count,likes_count,hashtags,cashtags,link,retweet,quote_url,video,thumbnail,near,geo,source,user_rt_id,user_rt,retweet_id,reply_to,retweet_date,translate,trans_src,trans_dest
1245808349523914752,1245808349523914752,2020-04-02 17:20:31 -03,2020-04-02,17:20:31,-0300,109354333,socelnews,Socel News,,Governo do Pará defende uso das Forças Armadas no combate às queimadas e ao desmatamento da Amazônia | Socel News - Blog do jornalista Celso Freire  https://t.co/NNEBOn9jtu,pt,[],['http://socelnews.blogspot.com/2020/04/governo-do-para-defende-uso-das-forcas.html'],[],0,0,0,[],[],https://twitter.com/SocelNews/status/1245808349523914752,False,,0,,,,,,,,[],,,,
1245790638932713478,1245790638932713478,2020-04-02 16:10:08 -03,2020-04-02,16:10:08,-0300,57776660,pnudbrasil,PNUD Brasil,,"@mmeioambiente, @ItamaratyGovBr e o PNUD assinaram o projeto “Pagamentos por resultados de REDD+ por resultados alcançados pelo Brasil no bioma Amazônia”, em reconhecimento ao esforço na implementação de políticas de combate ao desmatamento. Confira  https://t.co/QpfLt8HDY4  https://t.co/GPCyHZ6nfM",pt,"[{'screen_name': 'itamaratygovbr', 'name': 'itamaraty brasil 🇧🇷', 'id': '49762925'}]",['https://bit.ly/2wPnNNM'],['https://pbs.twimg.com/media/EUnv--rXQAcyNQY.jpg'],0,4,26,[],[],https://twitter.com/PNUDBrasil/status/1245790638932713478,False,,1,https://pbs.twimg.com/media/EUnv--rXQAcyNQY.jpg,,,,,,,[],,,,
1245778447458279425,1245778447458279425,2020-04-02 15:21:41 -03,2020-04-02,15:21:41,-0300,1229488400236974082,allanvsbr,Allan 🇧🇷 🇧🇷 🇧🇷 🇺🇸,,"Há poucos meses, o Presidente da França quis boicotar o Brasil por conta do desmatamento da Amazônia, quero ver se esse pilantra terá a vontade de boicotar a China por seus conhecidos problemas com trabalho escravo e matança de animais silvestres para alimentação... #VirusChines",pt,[],[],[],0,0,1,['viruschines'],[],https://twitter.com/allanvsbr/status/1245778447458279425,False,,0,,,,,,,,[],,,,
1245776417889161219,1245754929152696322,2020-04-02 15:13:38 -03,2020-04-02,15:13:38,-0300,203749613,emingardi,LEFT QUEEN,,"@ConversaAfiada Com boa vontade vimos: cocaína em avião, rachadinhas, laranjas, desmatamento e fogo na amazônia, incentivo a garimpo ilegal, descaso no vazamento de óleo, nepotismo, corrupção em família, ofensas a nordestinos e lgbts, entrega de riquezas nacionais, envolvimento com milícias...",pt,[],[],[],0,0,0,[],[],https://twitter.com/emingardi/status/1245776417889161219,False,,0,,,,,,,,"[{'screen_name': 'ConversaAfiada', 'name': 'TV Afiada', 'id': '17229791'}]",,,,
1245767569547681793,1245764071972012035,2020-04-02 14:38:28 -03,2020-04-02,14:38:28,-0300,1217197116235427842,iwillian_fds,iWillian,,@maiconkusterkkk Fala sobre o desmatamento da Amazonia ou como o efeito estufa prejudica a Antartida,pt,[],[],[],0,0,0,[],[],https://twitter.com/iWillian_fds/status/1245767569547681793,False,,0,,,,,,,,"[{'screen_name': 'maiconkusterkkk', 'name': 'maicon reserva', 'id': '1281711589759082496'}]",,,,
1245764532301180933,1245764532301180933,2020-04-02 14:26:24 -03,2020-04-02,14:26:24,-0300,721773119057371136,grugol_,sapequinha,,"se tivessem pensado nisso quando tinha candidato à presidência que apoiava a tortura, o genocídio contra indígenas, o desmatamento da amazônia... mas né",pt,[],[],[],0,0,0,[],[],https://twitter.com/grugol_/status/1245764532301180933,False,https://twitter.com/jdoriajr/status/1245666644875239426,0,,,,,,,,[],,,,
1245750799805878273,1245750799805878273,2020-04-02 13:31:50 -03,2020-04-02,13:31:50,-0300,965696565074714625,waldezoficial,Waldez Góes,,"Na manhã desta quinta-feira, em reunião do Conselho da Amazônia com o vice-presidente da República, @GeneralMourao, os governadores da região defenderam o fortalecimento de ações no combate ao desmatamento e outros ilícitos ambientais.  https://t.co/sSMBzbxLK2",pt,"[{'screen_name': 'generalmourao', 'name': 'general hamilton mourão', 'id': '1058819604741525510'}]",[],[],5,5,12,[],[],https://twitter.com/waldezoficial/status/1245750799805878273,False,,1,https://pbs.twimg.com/ext_tw_video_thumb/1245750649427505153/pu/img/VmeWJBUUX5VtTeSd.jpg,,,,,,,[],,,,
1245735509005139968,1245735509005139968,2020-04-02 12:31:04 -03,2020-04-02,12:31:04,-0300,155239083,lagerthaloth1,Lagertha,,"Acabei de dizer #MP910Não. Vamos, juntos, acabar com a corrupção e o desmatamento na Amazônia!   https://t.co/WXR56EVrZu",pt,[],['http://www.saldaodaamazonia.org.br'],[],0,0,0,['mp910não'],[],https://twitter.com/Lagerthaloth1/status/1245735509005139968,False,,0,,,,,,,,[],,,,
1245722003451129861,1245722003451129861,2020-04-02 11:37:24 -03,2020-04-02,11:37:24,-0300,33586595,drelimalima,Andre Lima,,Enquanto o mundo ta preocupado com o #coronavirus como está a vigilancia do desmatamento na amazônia será? @showdavida @g1 @jairbolsonaro @GauchaZH @folha,pt,"[{'screen_name': 'showdavida', 'name': 'fantástico', 'id': '29797128'}, {'screen_name': 'g1', 'name': 'g1', 'id': '8802752'}, {'screen_name': 'jairbolsonaro', 'name': 'jair m. bolsonaro', 'id': '128372940'}, {'screen_name': 'folha', 'name': 'folha de s.paulo', 'id': '14594813'}]",[],[],0,0,0,['coronavirus'],[],https://twitter.com/drelimalima/status/1245722003451129861,False,,0,,,,,,,,[],,,,
1245720456252067842,1245720456252067842,2020-04-02 11:31:15 -03,2020-04-02,11:31:15,-0300,282537050,cassiamgflor,Cassia Florencio,,Impedir o desmatamento e exploração da Amazônia! - Assine a petição!  https://t.co/lL5RJl0kbk via @change_br,pt,"[{'screen_name': 'change_br', 'name': 'change.org brasil #luteemcasa', 'id': '900348469'}]",['http://chng.it/VMftgBPj'],[],0,0,0,[],[],https://twitter.com/cassiamgflor/status/1245720456252067842,False,,0,,,,,,,,[],,,,
1245706991730937856,1245706991730937856,2020-04-02 10:37:45 -03,2020-04-02,10:37:45,-0300,2627002654,alicesgoncalo28,Alice de Souza 🐾🌳 🌎,,"Acabei de dizer #MP910Não. Vamos, juntos, acabar com a corrupção e o desmatamento na Amazônia!   https://t.co/tpPnKjjlmE",pt,[],['http://www.saldaodaamazonia.org.br'],[],0,0,0,['mp910não'],[],https://twitter.com/alicesgoncalo28/status/1245706991730937856,False,,0,,,,,,,,[],,,,
1245703128328155137,1245692545839050752,2020-04-02 10:22:24 -03,2020-04-02,10:22:24,-0300,1240062910338121730,flaviosantix,Flavio S,,@v3ll1ch0r @b_glaucon @thomasnilton @UOL Defensores de fake news Mamadeira de piroca Desmatamento da amazônia De armas em nome de Jesus Que o coronavirus é uma gripinha Que depósitos em nome de laranja e normal.  e eu que sou surtado kkkkkkkkkkkkkklkkk,pt,[],[],[],1,0,2,[],[],https://twitter.com/flaviosantix/status/1245703128328155137,False,,0,,,,,,,,"[{'screen_name': 'thomasnilton', 'name': 'Thomas Teixeira', 'id': '52061548'}, {'screen_name': 'UOL', 'name': 'UOL', 'id': '70799317'}]",,,,
1245694741251063808,1245692174638907393,2020-04-02 09:49:04 -03,2020-04-02,09:49:04,-0300,1318443008,luizgilsonjr,Luiz Gilson Júnior ✊🏽 #Antifacista #1dose,,"@FernandoGuida Fico me perguntando se não tem um ""coronavírus"" da Amazônia, esperando o desmatamento chegar até ele pra se espalhar pelo mundo, sabe-se lá com qual impacto...",pt,[],[],[],1,0,1,[],[],https://twitter.com/luizgilsonjr/status/1245694741251063808,False,,0,,,,,,,,"[{'screen_name': 'FernandoGuida', 'name': 'Fernando Guida', 'id': '62601015'}]",,,,
1245488615381184521,1245190964169207808,2020-04-01 20:10:00 -03,2020-04-01,20:10:00,-0300,862737605565313025,cpetters_,Pett,,@AlcoLucas Isso mesmo! E quem não apoia a Mari é a favor do desmatamento da amazônia,pt,[],[],[],1,0,0,[],[],https://twitter.com/cpetters_/status/1245488615381184521,False,,0,,,,,,,,"[{'screen_name': 'AlcoLucas', 'name': 'Lusca 🇧🇷', 'id': '1132329036464762881'}]",,,,
1245487447422763009,1245484830709682176,2020-04-01 20:05:22 -03,2020-04-01,20:05:22,-0300,1192589306885550091,leyse65081133,Leyse🇧🇷 #LendYourVoicetotheAmazon,,"@MarinaSilva Isso Marina, ele está sucumbindo; o q antes queria ver sua economia crescer c desmatamento da Amazônia, hj está diante de uma pandemia q prova q temos q salvar nossas florestas e proteger nossos Indigenas; e sucumbe tal qual seus eleitores, q ora eram ignorantes e hj ridiculos !!",pt,[],[],[],3,0,8,[],[],https://twitter.com/Leyse65081133/status/1245487447422763009,False,,0,,,,,,,,"[{'screen_name': 'MarinaSilva', 'name': 'Marina Silva', 'id': '105155795'}]",,,,
1245469139097071619,1245463426685681669,2020-04-01 18:52:37 -03,2020-04-01,18:52:37,-0300,1197183350483693569,glenson_since78,Glenson Ronieli de Souza (do🏭) 🔴⚪⚫🇾🇪🇧🇷🇺🇸,,"@nanavieirafraga @WinstonLing Fabrica de celulose, ou seja, fabrica de derivados de madeira. Desmatamento, Amazônia...",pt,[],[],[],0,0,3,[],[],https://twitter.com/Glenson_since78/status/1245469139097071619,False,,0,,,,,,,,"[{'screen_name': 'nanavieirafraga', 'name': 'Vieira - SDV', 'id': '68402881'}, {'screen_name': 'WinstonLing', 'name': 'Winston Ling', 'id': '36413526'}]",,,,
1245462173087924225,1245462173087924225,2020-04-01 18:24:56 -03,2020-04-01,18:24:56,-0300,3040154038,ederdicado,Eder Carvalho,,"- da maconha e balbúrdia na universidade - dos dados ""falsos"" do INPE sobre desmatamento na Amazônia - das ONGs que causaram incêndios na Amazônia - do Green Peace que derramou óleo no litoral do nordeste #BolsonaroDay",pt,[],[],[],0,0,0,['bolsonaroday'],[],https://twitter.com/Ederdicado/status/1245462173087924225,False,,0,,,,,,,,[],,,,
1245444013764853762,1245443205233025025,2020-04-01 17:12:46 -03,2020-04-01,17:12:46,-0300,1036980550492479488,infoamazoniabr,InfoAmazonia Brasil,,"Desmatamento e queimadas, obras de infraestrutura, urbanização, garimpo e tráfico de animais fazem parte do cotidiano da Amazônia. A destruição dos ambientes naturais engrossa um caldo semelhante ao que fez surgir a Covid-19 e outras doenças na Ásia e África. #coronavirus",pt,[],[],[],1,1,8,['coronavirus'],[],https://twitter.com/InfoAmazoniaBR/status/1245444013764853762,False,,0,,,,,,,,[],,,,
1245443205233025025,1245443205233025025,2020-04-01 17:09:34 -03,2020-04-01,17:09:34,-0300,1036980550492479488,infoamazoniabr,InfoAmazonia Brasil,,Nossa reportagem mostra porque o desmatamento da Amazônia e o risco de surgimento de novos vírus letais são coisas que estão relacionadas    https://t.co/fJoRC0M7Fv,pt,[],['https://infoamazonia.org/pt/2020/04/portugues-uma-proxima-pandemia-pode-surgir-da-amazonia-com-avanco-sobre-a-floresta'],[],1,4,9,[],[],https://twitter.com/InfoAmazoniaBR/status/1245443205233025025,False,,0,,,,,,,,[],,,,
1245439131464974336,1245439131464974336,2020-04-01 16:53:22 -03,2020-04-01,16:53:22,-0300,49762925,itamaratygovbr,Itamaraty Brasil 🇧🇷,,"O governo 🇧🇷 assinou ontem documentos do Floresta+, US$ 96 milhões. O 🇧🇷 é o primeiro país a receber recursos do Fundo Verde para o Clima (GCF) para combater o desmatamento na Amazônia. Apoio ao desenvolvimento sustentável da nossa floresta!  https://t.co/fuHqvGePH1 @GeneralMourao  https://t.co/obWWKslCcR",pt,"[{'screen_name': 'generalmourao', 'name': 'general hamilton mourão', 'id': '1058819604741525510'}]",['http://greenclimate.fund/project/fp100'],['https://pbs.twimg.com/media/EUiv85uXYAIk7wV.jpg'],15,34,139,[],[],https://twitter.com/ItamaratyGovBr/status/1245439131464974336,False,,1,https://pbs.twimg.com/media/EUiv85uXYAIk7wV.jpg,,,,,,,[],,,,
1245432123831586816,1245300090169970688,2020-04-01 16:25:31 -03,2020-04-01,16:25:31,-0300,1095687192733802501,claricemeirell1,Clarice Meirelles 🇧🇷💉😷,,"@Rconstantino @FernandoMagnat3 A próxima pandemia virá da Amazônia! O desmatamento tem levado a epidemias de Hantavirus em vários locais, dizimando populações de macacos e outros animais silvestres.",pt,[],[],[],0,0,0,[],[],https://twitter.com/ClariceMeirell1/status/1245432123831586816,False,,0,,,,,,,,"[{'screen_name': 'Rconstantino', 'name': 'Rodrigo Constantino', 'id': '33520195'}, {'screen_name': 'FernandoMagnat3', 'name': 'Fernando Magnata Jr', 'id': '955612707176308736'}]",,,,
1245410603281395715,1245410603281395715,2020-04-01 15:00:01 -03,2020-04-01,15:00:01,-0300,3623816603,fausto_macedo,Fausto Macedo,,"O montante faz parte do R$ 1,06 bilhão do Fundo da Lava Jato que foi destinado aos Estados da Amazônia Legal para as ações de prevenção, fiscalização e combate ao desmatamento e outros outros ilícitos ambientais  https://t.co/wmnk7QBxLp",pt,[],['https://politica.estadao.com.br/blogs/fausto-macedo/aras-agu-e-camara-concordam-com-r-327-mi-do-fundo-da-lava-jato-para-o-acre-para-enfrentar-o-coronavirus/'],[],0,2,3,[],[],https://twitter.com/fausto_macedo/status/1245410603281395715,False,,0,,,,,,,,[],,,,
1245406113249529858,1245406113249529858,2020-04-01 14:42:10 -03,2020-04-01,14:42:10,-0300,1168518600069660672,coalizao_brasil,"Coalizão Brasil Clima, Florestas e Agricultura",,"Artigo publicado por membros do #Ipam e da #UFPA lembra que, mesmo na pandemia do #covid19, é preciso seguir alerta ao avanço do desmatamento na #Amazonia.   https://t.co/gnJABq7Vua via @elpais_brasil",pt,"[{'screen_name': 'elpais_brasil', 'name': 'el país brasil', 'id': '2174537102'}]",['https://brasil.elpais.com/opiniao/2020-03-31/covid-19-e-o-desmatamento-amazonico.html?ssm=TW_CC'],[],0,1,2,"['ipam', 'ufpa', 'covid19', 'amazonia']",[],https://twitter.com/coalizao_brasil/status/1245406113249529858,False,,0,,,,,,,,[],,,,
1245396865581043712,1245396865581043712,2020-04-01 14:05:25 -03,2020-04-01,14:05:25,-0300,505971557,odolberto,Francisco Odolberto,,"Acabei de dizer #MP910Não. Vamos, juntos, acabar com a corrupção e o desmatamento na Amazônia!   https://t.co/Rs9gCi4k2v",pt,[],['http://www.saldaodaamazonia.org.br'],[],0,0,0,['mp910não'],[],https://twitter.com/Odolberto/status/1245396865581043712,False,,0,,,,,,,,[],,,,
1245372900024213504,1245372900024213504,2020-04-01 12:30:11 -03,2020-04-01,12:30:11,-0300,16334137,greenpeacebr,Greenpeace Brasil,,"As mudanças climáticas não existem? Os vegetarianos são os culpados pelo desmatamento porque comem muita soja? As queimadas na Amazônia são naturais? Opa, não caia nessa! Nesse #DiaDaMentira, te contamos algumas verdades 😉  https://t.co/D1dUhNb5gi  #1deAbril",pt,[],['https://act.gp/3avraI9'],[],0,16,38,"['diadamentira', '1deabril']",[],https://twitter.com/GreenpeaceBR/status/1245372900024213504,False,,0,,,,,,,,[],,,,
1245370948439638019,1245370948439638019,2020-04-01 12:22:26 -03,2020-04-01,12:22:26,-0300,768195645979004928,claudiacoleoni,Cláudia Coleoni,,"Artigo com colaboração do @SEIresearch propõe quatro estratégias para reduzir o #desmatamento na #Amazônia brasileira, ao mesmo tempo que garante o desenvolvimento socioeconômico da região. Acesso aberto:  https://t.co/vTTovpiFgA",pt,"[{'screen_name': 'seiresearch', 'name': 'sei research', 'id': '63135089'}]",['https://www.sciencedirect.com/science/article/pii/S0264837719309809?via%3Dihub'],[],0,1,1,"['desmatamento', 'amazônia']",[],https://twitter.com/ClaudiaColeoni/status/1245370948439638019,False,https://twitter.com/SEIenEspanol/status/1245143758947180549,0,,,,,,,,[],,,,
1245368446193487872,1245368446193487872,2020-04-01 12:12:30 -03,2020-04-01,12:12:30,-0300,853678884646264832,emmanuel7olv,Emmanuel Oliveira,,"Para comemorar o 1° de Abril lá vão cinco mentiras: 1) Não existe racismo estrutural no Brasil; 2) Nazismo é de esquerda; 3) É culpa dos pobres o desmatamento da Amazônia; 4) O Brasil já foi SIM um país comunista; 5) É apenas uma gripezinha, acabem com esse isolamento vertical.",pt,[],[],[],0,0,0,[],[],https://twitter.com/emmanuel7olv/status/1245368446193487872,False,,0,,,,,,,,[],,,,
1245367621127675910,1245367621127675910,2020-04-01 12:09:13 -03,2020-04-01,12:09:13,-0300,1156695262364164097,the_monelisa,Elisa não aguenta mais o capitalismo,,Assisti Cowspiracy. Sou uma vegetariana ainda mais convicta agora.   Sabia que a pecuária é a causa n° 1 do desmatamento na Amazônia?  Fica a dica do documentário aí. Façam umas receitas vegetarianas e veganas tbm. Boa quarentena!,pt,[],[],[],0,0,2,[],[],https://twitter.com/The_monelisa/status/1245367621127675910,False,,0,,,,,,,,[],,,,
1245361732027105280,1245361732027105280,2020-04-01 11:45:49 -03,2020-04-01,11:45:49,-0300,114058393,gabrielamartel,Gabriela Martel,,"O fim do desmatamento amazônico é crucial para que não tenhamos de enfrentar outras crises no futuro próximo, em especial em um momento de economia fragilizada pelos efeitos prolongados da #pandemia.  https://t.co/ippQZnPN7e via @elpais_brasil #Amazon #Amazônia #COVIDー19",pt,"[{'screen_name': 'elpais_brasil', 'name': 'el país brasil', 'id': '2174537102'}]",['https://brasil.elpais.com/opiniao/2020-03-31/covid-19-e-o-desmatamento-amazonico.html?ssm=TW_CC'],[],0,0,1,"['pandemia', 'amazon', 'amazônia', 'covidー19']",[],https://twitter.com/gabrielamartel/status/1245361732027105280,False,,0,,,,,,,,[],,,,
1245358233809805314,1245317191626633218,2020-04-01 11:31:55 -03,2020-04-01,11:31:55,-0300,2562031076,marcondesaraiva,Marcondes Saraiva,,@FlavioDino Acho que boa parte do desmatamento da Amazônia vai pra manutenção da cara de pau dele,pt,[],[],[],0,0,0,[],[],https://twitter.com/marcondesaraiva/status/1245358233809805314,False,,0,,,,,,,,"[{'screen_name': 'FlavioDino', 'name': 'Flávio Dino 🇧🇷', 'id': '25577585'}]",,,,
1245344508218347523,1244962959572566017,2020-04-01 10:37:22 -03,2020-04-01,10:37:22,-0300,159358703,spassosrj,Sol Pazos,,"@petracostal @rvianna Sem falar  no desmatamento  da Amazônia,  a despeito de levar o progresso  , e com dezenas de indígenas mortos.",pt,[],[],[],0,0,0,[],[],https://twitter.com/SpassosRJ/status/1245344508218347523,False,,0,,,,,,,,"[{'screen_name': 'petracostal', 'name': 'Petra Costa', 'id': '204136120'}, {'screen_name': 'rvianna', 'name': 'rodrigo vianna 🇧🇷🇺🇾🇦🇷🇵🇾🇧🇴🇻🇪🇨🇺🇨🇴', 'id': '24043827'}]",,,,
1245339211173167104,1245339192256876544,2020-04-01 10:16:19 -03,2020-04-01,10:16:19,-0300,1107814243179642880,euanalauraa_,"estagiária, vacinada e beba",,"Ano passado os vests particulares(que eu fiz), os temas de redações foram sobre a área do Meio Ambiente. Alguns até sobre a Amazônia. Acho um provável tema p tais instituições, visto que ano passado estávamos vivenciando o desmatamento em grande escala...",pt,[],[],[],1,0,0,[],[],https://twitter.com/euanalauraa_/status/1245339211173167104,False,,0,,,,,,,,[],,,,
1245334651578744833,1245192167037054976,2020-04-01 09:58:12 -03,2020-04-01,09:58:12,-0300,134168148,dygno,Diego,,@HugoBonemer Pelo pouco que vi você é contra o desmatamento da Amazônia também 🙈🙈,pt,[],[],[],0,0,0,[],[],https://twitter.com/DyGno/status/1245334651578744833,False,,0,,,,,,,,"[{'screen_name': 'HugoBonemer', 'name': 'Bonêmer', 'id': '56367647'}]",,,,
1245312912022999040,1245312912022999040,2020-04-01 08:31:49 -03,2020-04-01,08:31:49,-0300,3355746328,fiscaldoibama,O FISCAL do IBAMA,,"Desde segunda feira pipocam notícias afirmando que a FISCALIZAÇÃO está parada e que os desmatadores estão se aproveitando do apagão pra aumentar o desmatamento na Amazônia.  Além de ser equivocado,  ESSA FALA É UM GRANDE DESSERVIÇO!!  explico: 1/",pt,[],[],[],9,90,413,[],[],https://twitter.com/fiscaldoibama/status/1245312912022999040,False,,0,,,,,,,,[],,,,
1245229448753860612,1245229448753860612,2020-04-01 03:00:10 -03,2020-04-01,03:00:10,-0300,256493925,sou_ecologico,Revista Ecológico,,O controverso Conselho Nacional da Amazônia Legal teme pelo avanço do desmatamento em meio à pandemia do coronavírus. Confira:  https://t.co/jAINH0uTQ9 #amazonia #desmantamento  https://t.co/d2Lb4ondrP,pt,[],['https://mla.bs/32c55898'],['https://pbs.twimg.com/media/EUfxlaZXkAgyFwa.jpg'],0,0,0,"['amazonia', 'desmantamento']",[],https://twitter.com/sou_ecologico/status/1245229448753860612,False,,1,https://pbs.twimg.com/media/EUfxlaZXkAgyFwa.jpg,,,,,,,[],,,,
1245198067323764744,1245198067323764744,2020-04-01 00:55:28 -03,2020-04-01,00:55:28,-0300,53120618,renanversiani,Renan Versiani,,Reclamaram tanto do desmatamento da Amazônia que encheram de planta o #BBB,pt,[],[],[],0,0,0,['bbb'],[],https://twitter.com/Renanversiani/status/1245198067323764744,False,,0,,,,,,,,[],,,,
1245171982305497089,1245151437837029378,2020-03-31 23:11:49 -03,2020-03-31,23:11:49,-0300,716079561482567681,taoelababi,ｂｒａｓｉｌｅñａ ✨🇧🇷,,"@PedinPH @hiagomtlima fazendo o país ser o pioneiro na utilização de automóveis movidos a álcool, as “desvantagens” foram o assassinato de vagabundos sendo torturados e mortos pelos militares, a ausência dos direitos humanos, a censura, o índice de desmatamento da Amazônia que sempre teve",pt,[],[],[],1,0,1,[],[],https://twitter.com/taoelababi/status/1245171982305497089,False,,0,,,,,,,,"[{'screen_name': 'hiagomtlima', 'name': 'matheus sokanela', 'id': '3420523199'}]",,,,
1245170983037739010,1244973087759765507,2020-03-31 23:07:51 -03,2020-03-31,23:07:51,-0300,68593857,juliusoares,Julio Cesar,,"@fiscaldoibama @ThomstonA Acredito que haja declínio forte enquanto o caos perdure. Todos os motores que moviam o desmatamento da Amazônia, foram desligados no mundo inteiro. Não tem nem navio disponível para escoar.",pt,[],[],[],0,0,0,[],[],https://twitter.com/Juliusoares/status/1245170983037739010,False,,0,,,,,,,,"[{'screen_name': 'fiscaldoibama', 'name': 'O FISCAL do IBAMA', 'id': '3355746328'}]",,,,
1245170911420067841,1245125841152954368,2020-03-31 23:07:34 -03,2020-03-31,23:07:34,-0300,1238870376396066819,observadorne,Emiliano Campos G. Lins,,@nilmoretto Primeiro as queimadas e desmatamento da Amazônia. Agora um comportamento genocida. Tudo em prol da reeleição. Bolsonaro não é mais só um problema do Brasil. É um problema do mundo. É precisa ser resolvido.,pt,[],[],[],0,0,0,[],[],https://twitter.com/observadorne/status/1245170911420067841,False,,0,,,,,,,,"[{'screen_name': 'nilmoretto', 'name': 'Nil #ForaBolsonaro | #VacinaJá', 'id': '52499387'}]",,,,
1245170772634714113,1245149017924702208,2020-03-31 23:07:01 -03,2020-03-31,23:07:01,-0300,1238870376396066819,observadorne,Emiliano Campos G. Lins,,@nilmoretto Primeiro as queimadas e desmatamento da Amazônia. Agora um comportamento genocida. Tudo em prol da reeleição. Bolsonaro não é mais só um problema do Brasil. É um problema do mundo. É precisa ser resolvido.,pt,[],[],[],0,0,1,[],[],https://twitter.com/observadorne/status/1245170772634714113,False,,0,,,,,,,,"[{'screen_name': 'nilmoretto', 'name': 'Nil #ForaBolsonaro | #VacinaJá', 'id': '52499387'}]",,,,
1245116784245641216,1245009671506866178,2020-03-31 19:32:29 -03,2020-03-31,19:32:29,-0300,871905240043466752,zeliamcn,Zélia Costa,,"@Br_Brasil01 @Maria81198994 @ju_f1000 Mas claro que a figura de liderança do país está certo em minimizar as terras e demarcações indígenas, ignorar a queima e o desmatamento da Amazônia e pedir pro povo brasileiro ignorar o OMS e sair. ""Até pq só morre velho"" então pra ele é ótimo.",pt,[],[],[],0,0,0,[],[],https://twitter.com/ZeliaMcn/status/1245116784245641216,False,,0,,,,,,,,"[{'screen_name': 'Maria81198994', 'name': 'Maria', 'id': '1223083332776402946'}, {'screen_name': 'ju_f1000', 'name': 'Tiana', 'id': '1007734141'}]",,,,
1245112693750669313,1245112693750669313,2020-03-31 19:16:13 -03,2020-03-31,19:16:13,-0300,484016557,marceloscarneir,Marcelo Carneiro,,"Importante reflexão sobre a necessidade do fortalecimento do monitoramento  do desmatamento na Amazônia, pois as motosserras e os correntões não pararam com o Covid19...  https://t.co/NoCM2O45Kd via @elpais_brasil",pt,"[{'screen_name': 'elpais_brasil', 'name': 'el país brasil', 'id': '2174537102'}]",['https://brasil.elpais.com/opiniao/2020-03-31/covid-19-e-o-desmatamento-amazonico.html?ssm=TW_CC'],[],0,3,5,[],[],https://twitter.com/marceloscarneir/status/1245112693750669313,False,,0,,,,,,,,[],,,,
1245087416307912705,1245087416307912705,2020-03-31 17:35:47 -03,2020-03-31,17:35:47,-0300,261012244,abstrapasson,Alexandre Strapasson,,"Grilagem de terras da amazônia corre solta na atual pandemia. Desmatamento do cerrado também preocupa, embora não mencionado na reportagem  https://t.co/UKvHlP6MlZ",pt,[],['https://brasil.elpais.com/opiniao/2020-03-31/covid-19-e-o-desmatamento-amazonico.html?outputType=amp&__twitter_impression=true'],[],0,0,1,[],[],https://twitter.com/abstrapasson/status/1245087416307912705,False,,0,,,,,,,,[],,,,
1245084287222849539,1245084287222849539,2020-03-31 17:23:21 -03,2020-03-31,17:23:21,-0300,582954864,sebastiaobarbar,sebastiao Bárbara LULA DA SILVA,,Desenvolveram muito o tanto de favela foi criado desenvolvimento o desprezo falta de ensino público falta de divisões riquezas do país onde criou e está até hoje instalada a pobreza que assola uma nação Tão rica como o Brasil distribuíram terras na Amazônia para desmatamento,pt,[],[],[],0,0,0,[],[],https://twitter.com/sebastiaobarbar/status/1245084287222849539,False,https://twitter.com/GeneralMourao/status/1244929367773523969,0,,,,,,,,[],,,,
1245079662553939971,1245079662553939971,2020-03-31 17:04:58 -03,2020-03-31,17:04:58,-0300,74715478,climainfonews,ClimaInfo,,"Na #Amazônia, os efeitos do #covid_19 não são apenas na saúde: sem fiscais para combater o #desmatamento “in loco”, os criminosos estão livres para agir à luz do dia sem qualquer risco de serem pegos.  E aí, @GeneralMourao, vai deixar isso acontecer?  https://t.co/5uxKhkZveB",pt,"[{'screen_name': 'generalmourao', 'name': 'general hamilton mourão', 'id': '1058819604741525510'}]",['https://brasil.elpais.com/opiniao/2020-03-31/covid-19-e-o-desmatamento-amazonico.html?ssm=whatsapp'],[],1,26,63,"['amazônia', 'covid_19', 'desmatamento']",[],https://twitter.com/ClimaInfoNews/status/1245079662553939971,False,,0,,,,,,,,[],,,,
