id,conversation_id,created_at,date,time,timezone,user_id,username,name,place,tweet,language,mentions,urls,photos,replies_count,retweets_count,likes_count,hashtags,cashtags,link,retweet,quote_url,video,thumbnail,near,geo,source,user_rt_id,user_rt,retweet_id,reply_to,retweet_date,translate,trans_src,trans_dest
1354951771769208834,1354873699439157253,2021-01-28 21:37:30 SA Eastern Standard Time,2021-01-28,21:37:30,-0300,322301071,rogerramer,Rogério de Abreu,,"@o_antagonista @kimpkat @jairbolsonaro Facada falhou   Óleo nas praias falhou  Queimadas na Amazônia falhou  Porteiro do condomínio falhou  Sérgio Moro falhou  Culpa pela pandemia falhou  Culpa por falta de oxigênio falhou  Leite condensado falhou  Agora Mourão , vai falhar de novo  Kkkkkkkkkkk continuem tentando",pt,[],[],[],0,0,0,[],[],https://twitter.com/Rogerramer/status/1354951771769208834,False,,0,,,,,,,,"[{'screen_name': 'o_antagonista', 'name': 'O Antagonista', 'id': '2880932962'}, {'screen_name': 'kimpkat', 'name': 'kimpkat', 'id': '1360542466571698179'}, {'screen_name': 'jairbolsonaro', 'name': 'Jair M. Bolsonaro', 'id': '128372940'}]",,,,
1354951731289993223,1354830767902371841,2021-01-28 21:37:21 SA Eastern Standard Time,2021-01-28,21:37:21,-0300,322301071,rogerramer,Rogério de Abreu,,"@o_antagonista @GeneralMourao Facada falhou   Óleo nas praias falhou  Queimadas na Amazônia falhou  Porteiro do condomínio falhou  Sérgio Moro falhou  Culpa pela pandemia falhou  Culpa por falta de oxigênio falhou  Leite condensado falhou  Agora Mourão , vai falhar de novo  Kkkkkkkkkkk continuem tentando",pt,[],[],[],1,0,0,[],[],https://twitter.com/Rogerramer/status/1354951731289993223,False,,0,,,,,,,,"[{'screen_name': 'o_antagonista', 'name': 'O Antagonista', 'id': '2880932962'}, {'screen_name': 'GeneralMourao', 'name': 'General Hamilton Mourão', 'id': '1058819604741525510'}]",,,,
1354951699513933828,1354935045631389706,2021-01-28 21:37:13 SA Eastern Standard Time,2021-01-28,21:37:13,-0300,322301071,rogerramer,Rogério de Abreu,,"@folha Facada falhou   Óleo nas praias falhou  Queimadas na Amazônia falhou  Porteiro do condomínio falhou  Sérgio Moro falhou  Culpa pela pandemia falhou  Culpa por falta de oxigênio falhou  Leite condensado falhou  Agora Mourão , vai falhar de novo  Kkkkkkkkkkk continuem tentando",pt,[],[],[],0,0,0,[],[],https://twitter.com/Rogerramer/status/1354951699513933828,False,,0,,,,,,,,"[{'screen_name': 'folha', 'name': 'Folha de S.Paulo', 'id': '14594813'}]",,,,
1354951093101481984,1354766737414234113,2021-01-28 21:34:49 SA Eastern Standard Time,2021-01-28,21:34:49,-0300,53745090,glauciotimao,Glauco🇧🇷💚💛🇧🇷,,"@o_antagonista Facada falhou   Óleo nas praias falhou  Queimadas na Amazônia falhou  Porteiro do condomínio falhou  Sérgio Moro falhou  Culpa pela pandemia falhou  Culpa por falta de oxigênio falhou  Leite condensado falhou  Agora Mourão , vai falhar de novo  Kkkkkkkkkkk continuem tentando",pt,[],[],[],0,0,1,[],[],https://twitter.com/glauciotimao/status/1354951093101481984,False,,0,,,,,,,,"[{'screen_name': 'o_antagonista', 'name': 'O Antagonista', 'id': '2880932962'}]",,,,
1354943376102187014,1354853785156395011,2021-01-28 21:04:09 SA Eastern Standard Time,2021-01-28,21:04:09,-0300,950478903746940932,aaramos44,aaramos44,,"@DerlinRod @iarabellini38 Moral da história, o idiota do Capri financiando as queimadas criminosas na Amazônia.",pt,[],[],[],1,0,1,[],[],https://twitter.com/aaramos44/status/1354943376102187014,False,,0,,,,,,,,"[{'screen_name': 'DerlinRod', 'name': 'Derlin Rodrigues.’. 🇧🇷🔰🌿👁BOLSONARO ATÉ 2026', 'id': '345082308'}, {'screen_name': 'iarabellini38', 'name': 'Iara 🇧🇷🇧🇷🇧🇷🇧🇷', 'id': '3040324384'}]",,,,
1354941660082429955,1354941660082429955,2021-01-28 20:57:20 SA Eastern Standard Time,2021-01-28,20:57:20,-0300,1344676615960342528,aliancapelobrrp,Aliança Pelo Brasil - Ribeirão Preto,,Queimadas na Amazônia financiada pela ONG WWF!  #JairCondensadoAte2026    https://t.co/M1nS6o3rmJ,pt,[],['https://youtu.be/no7xZOWl6Pc'],[],0,0,0,['jaircondensadoate2026'],[],https://twitter.com/aliancapelobrrp/status/1354941660082429955,False,,0,,,,,,,,[],,,,
1354937403715280899,1354895942374338560,2021-01-28 20:40:25 SA Eastern Standard Time,2021-01-28,20:40:25,-0300,945696392483360770,danieltuodersch,Chaotic Disaster,,@iMandyCandy Belo como as queimadas na Amazônia e no Pantanal  https://t.co/ZEoWEbzRQM,pt,[],[],['https://pbs.twimg.com/media/Es20Y1BXcAkYVD0.jpg'],0,0,4,[],[],https://twitter.com/DanieltuOdersch/status/1354937403715280899,False,,1,https://pbs.twimg.com/media/Es20Y1BXcAkYVD0.jpg,,,,,,,[],,,,
1354935025716895756,1354935023774928909,2021-01-28 20:30:58 SA Eastern Standard Time,2021-01-28,20:30:58,-0300,995632249,mrlumertz,🍵+🥅 (TeaGoal),,"Pq se a P.1 se confirmar dominante (em relação a B.1.1.7 e a 501.V2), já não se há o que fazer se não a contenção de danos internacional. E  por isso, até usando as queimadas na Amazônia como triangulação, sanções econômicas HOJE fariam mais sentido.",pt,[],[],[],1,0,0,[],[],https://twitter.com/MrLumertz/status/1354935025716895756,False,,0,,,,,,,,[],,,,
1354927932326764548,1354927932326764548,2021-01-28 20:02:47 SA Eastern Standard Time,2021-01-28,20:02:47,-0300,1575423205,bloisvinicius,Vinícius Blóis,,"E tinha ""inocente"" achando que as queimadas na Amazônia não eram criminosas! A esquerda é cruel e, eles não tem escrúpulos! Fazem o que for necessário para chegar ao poder, independente de quem será atingindo. A única coisa importante é o poder! Animais mortos? Poder!",pt,[],[],[],0,0,0,[],[],https://twitter.com/BloisVinicius/status/1354927932326764548,False,https://twitter.com/JoseMedeirosMT/status/1354897486708674568,0,,,,,,,,[],,,,
1354926089416683520,1354926089416683520,2021-01-28 19:55:27 SA Eastern Standard Time,2021-01-28,19:55:27,-0300,329144500,thiagobioqneuro,Chicotadas Psicológicas,,Seguem as queimadas na Amazônia e pantanal. O litoral aqui do RS fica completamente enfumaçado. É repugnante.,pt,[],[],[],0,0,2,[],[],https://twitter.com/thiagoBioqneuro/status/1354926089416683520,False,,0,,,,,,,,[],,,,
1354921497048002566,1354883501343068161,2021-01-28 19:37:12 SA Eastern Standard Time,2021-01-28,19:37:12,-0300,866398193197752320,aimcmoreira,ANA MOURA,,"@esmaelmorais Com coronavírus, período de queimadas na Amazônia tem 28 mil hospitalizações por problemas respiratórios os incêndios não só bateram recorde mas dificultaram o diagnóstico de Covid-19 no ano q marcou a trágica combinação de queimadas e pandemia na Amazônia  https://t.co/xcEuuEudtj",pt,[],['https://apublica.org/2021/01/com-coronavirus-periodo-de-queimadas-na-amazonia-tem-28-mil-hospitalizacoes-por-problemas-respiratorios/'],[],0,0,0,[],[],https://twitter.com/aimcmoreira/status/1354921497048002566,False,,0,,,,,,,,"[{'screen_name': 'esmaelmorais', 'name': 'Esmael Morais', 'id': '19657485'}]",,,,
1354921416190271488,1354774033397673988,2021-01-28 19:36:53 SA Eastern Standard Time,2021-01-28,19:36:53,-0300,866398193197752320,aimcmoreira,ANA MOURA,,"@sulvinteum Com coronavírus, período de queimadas na Amazônia tem 28 mil hospitalizações por problemas respiratórios os incêndios não só bateram recorde mas dificultaram o diagnóstico de Covid-19 no ano q marcou a trágica combinação de queimadas e pandemia na Amazônia  https://t.co/xcEuuEudtj",pt,[],['https://apublica.org/2021/01/com-coronavirus-periodo-de-queimadas-na-amazonia-tem-28-mil-hospitalizacoes-por-problemas-respiratorios/'],[],0,0,0,[],[],https://twitter.com/aimcmoreira/status/1354921416190271488,False,,0,,,,,,,,"[{'screen_name': 'sulvinteum', 'name': 'Sul21', 'id': '140810916'}]",,,,
1354921210082189315,1354903631208853507,2021-01-28 19:36:04 SA Eastern Standard Time,2021-01-28,19:36:04,-0300,866398193197752320,aimcmoreira,ANA MOURA,,"@aassissouza @TheInterceptBr Com coronavírus, período de queimadas na Amazônia tem 28 mil hospitalizações por problemas respiratórios os incêndios não só bateram recorde mas dificultaram o diagnóstico de Covid-19 no ano q marcou a trágica combinação de queimadas e pandemia na Amazônia  https://t.co/xcEuuEudtj",pt,[],['https://apublica.org/2021/01/com-coronavirus-periodo-de-queimadas-na-amazonia-tem-28-mil-hospitalizacoes-por-problemas-respiratorios/'],[],0,0,0,[],[],https://twitter.com/aimcmoreira/status/1354921210082189315,False,,0,,,,,,,,"[{'screen_name': 'aassissouza', 'name': 'André S.', 'id': '806594868'}, {'screen_name': 'TheInterceptBr', 'name': 'The Intercept Brasil', 'id': '751454653011951616'}]",,,,
1354921133074747393,1353731146253742080,2021-01-28 19:35:45 SA Eastern Standard Time,2021-01-28,19:35:45,-0300,866398193197752320,aimcmoreira,ANA MOURA,,"@Helenasth Com coronavírus, período de queimadas na Amazônia tem 28 mil hospitalizações por problemas respiratórios os incêndios não só bateram recorde mas dificultaram o diagnóstico de Covid-19 no ano q marcou a trágica combinação de queimadas e pandemia na Amazônia  https://t.co/xcEuuEudtj",pt,[],['https://apublica.org/2021/01/com-coronavirus-periodo-de-queimadas-na-amazonia-tem-28-mil-hospitalizacoes-por-problemas-respiratorios/'],[],0,0,0,[],[],https://twitter.com/aimcmoreira/status/1354921133074747393,False,,0,,,,,,,,"[{'screen_name': 'Helenasth', 'name': 'ℋeℓeηαSthephanowitz™', 'id': '75105340'}]",,,,
1354920661811146758,1354025840280014849,2021-01-28 19:33:53 SA Eastern Standard Time,2021-01-28,19:33:53,-0300,866398193197752320,aimcmoreira,ANA MOURA,,"@PauloPamplona5 Com coronavírus, período de queimadas na Amazônia tem 28 mil hospitalizações por problemas respiratórios os incêndios não só bateram recorde mas dificultaram o diagnóstico de Covid-19 no ano q marcou a trágica combinação de queimadas e pandemia na Amazônia  https://t.co/xcEuuEudtj",pt,[],['https://apublica.org/2021/01/com-coronavirus-periodo-de-queimadas-na-amazonia-tem-28-mil-hospitalizacoes-por-problemas-respiratorios/'],[],0,1,0,[],[],https://twitter.com/aimcmoreira/status/1354920661811146758,False,,0,,,,,,,,"[{'screen_name': 'PauloPamplona5', 'name': 'Paulo Pamplona Frazao', 'id': '1079374567397834752'}]",,,,
1354914661750202368,1354914661750202368,2021-01-28 19:10:03 SA Eastern Standard Time,2021-01-28,19:10:03,-0300,35524446,ecodebate,Portal EcoDebate,,Período de queimadas na Amazônia tem 28 mil hospitalizações por problemas respiratórios  https://t.co/zMjSrpU21V,pt,[],['https://www.ecodebate.com.br/2021/01/28/periodo-de-queimadas-na-amazonia-tem-28-mil-hospitalizacoes-por-problemas-respiratorios/'],[],0,2,3,[],[],https://twitter.com/ecodebate/status/1354914661750202368,False,,0,,,,,,,,[],,,,
1354912166445535232,1354912166445535232,2021-01-28 19:00:08 SA Eastern Standard Time,2021-01-28,19:00:08,-0300,17871562,socioambiental,socioambiental,,"O ano de 2020 marcou uma combinação trágica e inédita na #Amazônia brasileira: queimadas e a pandemia. A sobreposição dificultou os diagnósticos da #Covid19 e os atendimentos hospitalares, além de deixar indígenas ainda mais vulneráveis. Confira:  https://t.co/TIFeKMsX6a",pt,[],['https://apublica.org/2021/01/com-coronavirus-periodo-de-queimadas-na-amazonia-tem-28-mil-hospitalizacoes-por-problemas-respiratorios/'],[],0,5,14,"['amazônia', 'covid19']",[],https://twitter.com/socioambiental/status/1354912166445535232,False,,0,,,,,,,,[],,,,
1354912134065315841,1354912134065315841,2021-01-28 19:00:00 SA Eastern Standard Time,2021-01-28,19:00:00,-0300,310497473,agenciapublica,Agência Pública,,As queimadas na Amazônia aumentaram em 2020 e se fundiram com os picos da pandemia. Resultado? Um sistema de saúde sobrecarregado em que os sintomas de inalar fumaça se misturavam com os da Covid-19.  https://t.co/swHscZZBiX,pt,[],['https://agen.pub/yP'],[],3,23,56,[],[],https://twitter.com/agenciapublica/status/1354912134065315841,False,,0,,,,,,,,[],,,,
1354907782986739720,1354784337707859971,2021-01-28 18:42:43 SA Eastern Standard Time,2021-01-28,18:42:43,-0300,1231028002424836097,mjoanadarc1,"Joana, M. 🆘 🏴🌹♓♏",,"@jmmurbach @ciclonexplosivo Mourão é um negacionista (vide queimadas na Amazônia), burro e saudosista da ditadura. Essa semana mesmo disse q o Pazuello está fazendo um EXCELENTE trabalho no ministério da saúde p/combater a pandemia 😱 O melhor mesmo seria #CassaAChapaTSE. Todos criminosos. Todos podres.",pt,[],[],[],1,0,0,['cassaachapatse'],[],https://twitter.com/MJoanaDarc1/status/1354907782986739720,False,,0,,,,,,,,"[{'screen_name': 'jmmurbach', 'name': 'João', 'id': '1219261930986229760'}, {'screen_name': 'ciclonexplosivo', 'name': 'Venisse Schossler', 'id': '378733153'}]",,,,
1354905901602385926,1354905901602385926,2021-01-28 18:35:14 SA Eastern Standard Time,2021-01-28,18:35:14,-0300,1320853324778844162,defesafoco,Defesa em Foco,,"A continuidade das ações de fiscalização e combate ao desmatamento ilegal e queimadas na Amazônia Legal, após o término da Operação Verde Brasil 2, previsto para abril, foram tema de reunião na sede do Ministério da Defesa. O debate ocorreu na manhã dest   https://t.co/04TAX2MCm1  https://t.co/csmFLjm4gS",pt,[],['https://www.defesaemfoco.com.br/continuidade-do-combate-a-delitos-na-amazonia-legal-e-tema-de-reuniao-na-defesa/'],['https://pbs.twimg.com/media/Es2XvKUXIAk3pW9.jpg'],0,1,0,[],[],https://twitter.com/DefesaFoco/status/1354905901602385926,False,,1,https://pbs.twimg.com/media/Es2XvKUXIAk3pW9.jpg,,,,,,,[],,,,
1354904932529410051,1354904932529410051,2021-01-28 18:31:23 SA Eastern Standard Time,2021-01-28,18:31:23,-0300,27438844,vagnocarvalho,Vagno Carvalho,,"""Reflorestar Alemanha""... ""Saliva e pólvora"", ""US$ 20 bi para cessar queimadas na Amazônia""  Missão: Estabilidade governamental geopolítica em nível diplomático diferenciado, excelência, em constante evolução, desenvolvimento... Vice-presidente Mourão. De nada. ""Só agradece"".",pt,[],[],[],1,0,0,[],[],https://twitter.com/vagnocarvalho/status/1354904932529410051,False,,0,,,,,,,,[],,,,
1354890194512732170,1354890113390665729,2021-01-28 17:32:49 SA Eastern Standard Time,2021-01-28,17:32:49,-0300,541156738,mariluparreiras,#LulaRousseff #ComLulaEm2022,,"_Esta matéria faz parte da série de reportagens Amazônia Irrespirável, que revela como as queimadas na floresta dificultaram o enfrentamento da pandemia na região  https://t.co/16CuYim4Tc",pt,[],['https://agen.pub/yQ_'],[],0,3,2,[],[],https://twitter.com/MariluParreiras/status/1354890194512732170,False,,0,,,,,,,,[],,,,
1354890113390665729,1354890113390665729,2021-01-28 17:32:30 SA Eastern Standard Time,2021-01-28,17:32:30,-0300,541156738,mariluparreiras,#LulaRousseff #ComLulaEm2022,,COVID OU INTOXICAÇÃO POR FUMAÇA?  ▪ Profissionais de saúde do Mato Grosso e Pará tiveram dificuldades para diferenciar sintomas respiratórios de Covid-19 e de fumaça das queimadas na Amazônia.  … (continua),pt,[],[],[],2,7,10,[],[],https://twitter.com/MariluParreiras/status/1354890113390665729,False,,0,,,,,,,,[],,,,
1354880074726699010,1354812736736161802,2021-01-28 16:52:36 SA Eastern Standard Time,2021-01-28,16:52:36,-0300,1106203776585744384,hebergomesnogu1,Heber Gomes Nogueira,,"@ricardope Com o ritmo das queimadas na Amazônia, cada vez haverá menos ambiente...",pt,[],[],[],0,0,0,[],[],https://twitter.com/HeberGomesNogu1/status/1354880074726699010,False,,0,,,,,,,,"[{'screen_name': 'ricardope', 'name': 'Ricardo Pereira', 'id': '36705462'}]",,,,
1354859039134539777,1354839091356061699,2021-01-28 15:29:01 SA Eastern Standard Time,2021-01-28,15:29:01,-0300,1254213667127808000,emdireitacruze1,@EmDireitaCruzeiro,,"@Jouberth19 Manchas de petróleo nas praias , queimadas da Amazônia e depois no Pantanal ...",pt,[],[],[],0,0,0,[],[],https://twitter.com/EmDireitaCruze1/status/1354859039134539777,False,,0,,,,,,,,"[{'screen_name': 'Jouberth19', 'name': 'Jouberth Souza', 'id': '350476403'}]",,,,
1354847752891600897,1354840972513988615,2021-01-28 14:44:10 SA Eastern Standard Time,2021-01-28,14:44:10,-0300,38447128,d_quixote,Sommelier de Manifestação,,"@DelfinoTuito Já foi usado na educação, no combate às queimadas da Amazônia, ajudou contra a Covid e agora vai comprar vacina! Mais importante que ter o dinheiro é ter a segurança de que o dinheiro vai dar conta de ajudar!!",pt,[],[],[],0,0,1,[],[],https://twitter.com/d_quixote/status/1354847752891600897,False,,0,,,,,,,,"[{'screen_name': 'DelfinoTuito', 'name': 'Delfino Gaúcho Monarquista de Esquerda', 'id': '1302358432394162176'}]",,,,
1354836738691227648,1354836738691227648,2021-01-28 14:00:24 SA Eastern Standard Time,2021-01-28,14:00:24,-0300,1001954033450586117,verdeviver,VerdeViver,,Período de queimadas na Amazônia tem 28 mil hospitalizações por problemas respiratórios  https://t.co/XxWal4OSqr,pt,[],['https://www.ecodebate.com.br/2021/01/28/periodo-de-queimadas-na-amazonia-tem-28-mil-hospitalizacoes-por-problemas-respiratorios/'],[],0,0,0,[],[],https://twitter.com/VerdeViver/status/1354836738691227648,False,,0,,,,,,,,[],,,,
1354835382072987648,1354835382072987648,2021-01-28 13:55:01 SA Eastern Standard Time,2021-01-28,13:55:01,-0300,209710154,martinskc,Kevin,,Eu tô achando esse calor absurdo estranho por alguns fatores:   Era pra estar mais fresco com a La Niña esse ano. Logo:   Será que a falta de chuvas agora em janeiro (RJ) tá sendo uma resposta direta aos desmatamentos e queimadas do ano passado na Amazônia?,pt,[],[],[],2,0,6,[],[],https://twitter.com/martinskc/status/1354835382072987648,False,https://twitter.com/felipeneto/status/1354811661740195858,0,,,,,,,,[],,,,
1354828203362111488,1354828203362111488,2021-01-28 13:26:29 SA Eastern Standard Time,2021-01-28,13:26:29,-0300,931198298932858881,obind_unb,Observatório dos Direitos e Políticas Indigenistas,,"AGÊNCIA PÚBLICA: Com coronavírus, período de queimadas na Amazônia tem 28 mil hospitalizações por problemas respiratórios  https://t.co/F7pnWlJdGr",pt,[],['http://obind.eco.br/2021/01/27/agencia-publica-com-coronavirus-periodo-de-queimadas-na-amazonia-tem-28-mil-hospitalizacoes-por-problemas-respiratorios/'],[],0,0,0,[],[],https://twitter.com/OBIND_UnB/status/1354828203362111488,False,,0,,,,,,,,[],,,,
1354828195338407942,1354828195338407942,2021-01-28 13:26:27 SA Eastern Standard Time,2021-01-28,13:26:27,-0300,575713446,marcelozelic,Marcelo Zelic,,"AGÊNCIA PÚBLICA: Com coronavírus, período de queimadas na Amazônia tem 28 mil hospitalizações por problemas respiratórios  https://t.co/03mI0npn93",pt,[],['http://obind.eco.br/2021/01/27/agencia-publica-com-coronavirus-periodo-de-queimadas-na-amazonia-tem-28-mil-hospitalizacoes-por-problemas-respiratorios/'],[],0,0,0,[],[],https://twitter.com/MarceloZelic/status/1354828195338407942,False,,0,,,,,,,,[],,,,
1354823096218177537,1354823096218177537,2021-01-28 13:06:12 SA Eastern Standard Time,2021-01-28,13:06:12,-0300,35524446,ecodebate,Portal EcoDebate,,Levantamento inédito revela que os incêndios não só bateram recorde mas dificultaram o diagnóstico de Covid-19 no ano que marcou a trágica combinação de queimadas e pandemia na Amazônia   https://t.co/zMjSrqbCTt,pt,[],['https://www.ecodebate.com.br/2021/01/28/periodo-de-queimadas-na-amazonia-tem-28-mil-hospitalizacoes-por-problemas-respiratorios/'],[],0,2,4,[],[],https://twitter.com/ecodebate/status/1354823096218177537,False,,0,,,,,,,,[],,,,
1354822772782813193,1354822772782813193,2021-01-28 13:04:55 SA Eastern Standard Time,2021-01-28,13:04:55,-0300,1309599420837756929,antonio66600284,Antonio,,"#TamoJuntoBMD Ex-deputado, porque você não se comoveu com os animais mortos nas últimas queimadas no Pantanal e na Amazônia animais que perderam inclusive as patas",pt,[],[],[],0,0,0,['tamojuntobmd'],[],https://twitter.com/Antonio66600284/status/1354822772782813193,False,,0,,,,,,,,[],,,,
1354820310516699143,1354708291394265089,2021-01-28 12:55:08 SA Eastern Standard Time,2021-01-28,12:55:08,-0300,2212392613,zuzarodrigo,Rodrigo 🇧🇷♥️🇹🇱,,"@jornaldarecord Os caras dizem que a ""Amazônia é nossa"", mas pressionam por mais capital internacional para proteger a Amazônia. Ainda acham ruim quando países como França e Noruega criticam as queimadas, sendo que são eles que mais doam para o fundo de proteção. Enfim a hipocrisia.",pt,[],[],[],1,0,5,[],[],https://twitter.com/ZuzaRodrigo/status/1354820310516699143,False,,0,,,,,,,,"[{'screen_name': 'jornaldarecord', 'name': 'Jornal da Record', 'id': '291926260'}]",,,,
1354811792359182338,1354811792359182338,2021-01-28 12:21:17 SA Eastern Standard Time,2021-01-28,12:21:17,-0300,713318124242731009,diretodaciencia,Direto da Ciência,,"Para variar, ele minimizou os problemas ambientais enfrentados pela floresta nos últimos anos, com alta nas queimadas e no desmatamento, e cobrou ajuda internacional para que a Amazônia seja protegida.  https://t.co/p8f9AY0Swu",pt,[],['https://climainfo.org.br/2021/01/28/mourao-distorce-dados-sobre-desmatamento-e-diz-negociar-retomada-do-fundo-amazonia/'],[],0,1,2,[],[],https://twitter.com/diretodaciencia/status/1354811792359182338,False,,0,,,,,,,,[],,,,
1354798580062507008,1354559430235480077,2021-01-28 11:28:47 SA Eastern Standard Time,2021-01-28,11:28:47,-0300,505968479,felina_e_loba,Fora Terraplanistas,,@acarolamaral @folha Traduzindo: não vão investir enquanto o governo estiver destruindo a Amazônia e não adianta vir de historinha porque ninguém acredita no mentiroso chamado Jair.  Jogaram a economia no lixo ao permitir desmatamento e queimadas para agradar um grupo de pecuaristas e garimpeiros.,pt,[],[],[],0,0,1,[],[],https://twitter.com/Felina_e_Loba/status/1354798580062507008,False,,0,,,,,,,,"[{'screen_name': 'acarolamaral', 'name': 'Ana Carolina Amaral', 'id': '26685504'}, {'screen_name': 'folha', 'name': 'Folha de S.Paulo', 'id': '14594813'}]",,,,
1354791434268913664,1354791434268913664,2021-01-28 11:00:23 SA Eastern Standard Time,2021-01-28,11:00:23,-0300,65454115,amazoniaorg,Site Amazônia,,"Com coronavírus, período de queimadas na Amazônia tem 28 mil hospitalizações por problemas respiratórios  https://t.co/Bee4R9UyrS via @agenciapublica  https://t.co/V95quWwMLM",pt,"[{'screen_name': 'agenciapublica', 'name': 'agência pública', 'id': '310497473'}]",['http://bit.ly/3orPP6L'],['https://pbs.twimg.com/media/Es0vj-qW4AECM2-.jpg'],0,2,6,[],[],https://twitter.com/AmazoniaOrg/status/1354791434268913664,False,,1,https://pbs.twimg.com/media/Es0vj-qW4AECM2-.jpg,,,,,,,[],,,,
1354789455949922307,1354789455949922307,2021-01-28 10:52:31 SA Eastern Standard Time,2021-01-28,10:52:31,-0300,58811453,greenpeacerj,Grupo de Voluntários,,Levantamento inédito revela que os incêndios não só bateram recorde mas dificultaram o diagnóstico de Covid-19 no ano que marcou a trágica combinação de queimadas e pandemia na Amazônia   https://t.co/SU0MqH3vh2,pt,[],['https://www.ecodebate.com.br/2021/01/28/periodo-de-queimadas-na-amazonia-tem-28-mil-hospitalizacoes-por-problemas-respiratorios/'],[],0,0,0,[],[],https://twitter.com/GreenpeaceRJ/status/1354789455949922307,False,,0,,,,,,,,[],,,,
1354789034061668363,1354789034061668363,2021-01-28 10:50:51 SA Eastern Standard Time,2021-01-28,10:50:51,-0300,157685472,ricardovolunta,Ricardo Machado,,Levantamento inédito revela que os incêndios não só bateram recorde mas dificultaram o diagnóstico de Covid-19 no ano que marcou a trágica combinação de queimadas e pandemia na Amazônia   https://t.co/Stz6fPXOer,pt,[],['https://www.ecodebate.com.br/2021/01/28/periodo-de-queimadas-na-amazonia-tem-28-mil-hospitalizacoes-por-problemas-respiratorios/'],[],0,0,0,[],[],https://twitter.com/RicardoVolunta/status/1354789034061668363,False,,0,,,,,,,,[],,,,
1354788140754591744,1354788140754591744,2021-01-28 10:47:18 SA Eastern Standard Time,2021-01-28,10:47:18,-0300,15980430,edu_cezimbra,Edu Cezimbra,,"Com coronavírus, período de queimadas na Amazônia tem 28 mil hospitalizações por problemas respiratórios | por @obrunofonseca, @brafajor  https://t.co/Qk47qWsPEO via @agenciapublica",pt,"[{'screen_name': 'obrunofonseca', 'name': 'bruno fonseca', 'id': '90985954'}, {'screen_name': 'brafajor', 'name': 'rafael oliveira', 'id': '1095076334685118465'}, {'screen_name': 'agenciapublica', 'name': 'agência pública', 'id': '310497473'}]",['https://apublica.org/2021/01/com-coronavirus-periodo-de-queimadas-na-amazonia-tem-28-mil-hospitalizacoes-por-problemas-respiratorios/#.YBLAXRgsh7o.twitter'],[],0,0,0,[],[],https://twitter.com/Edu_Cezimbra/status/1354788140754591744,False,,0,,,,,,,,[],,,,
1354778370727432194,1354778370727432194,2021-01-28 10:08:28 SA Eastern Standard Time,2021-01-28,10:08:28,-0300,134902150,siqueiract,Claudio Siqueira 🇧🇷,,"#saúde | Com coronavírus, período de queimadas na Amazônia tem 28 mil hospitalizações por problemas respiratórios:  https://t.co/jxbgq207u9  #COVID19 #Amazônia #alerta   ---",pt,[],['https://apublica.org/2021/01/com-coronavirus-periodo-de-queimadas-na-amazonia-tem-28-mil-hospitalizacoes-por-problemas-respiratorios/'],[],0,0,0,"['saúde', 'covid19', 'amazônia', 'alerta']",[],https://twitter.com/siqueiract/status/1354778370727432194,False,,0,,,,,,,,[],,,,
1354778221800206340,1354778221800206340,2021-01-28 10:07:53 SA Eastern Standard Time,2021-01-28,10:07:53,-0300,74715478,climainfonews,ClimaInfo,,"Essencial neste momento, a série de reportagens Amazônia Irrespirável, da @agenciapublica, revela como o impacto da fumaça das queimadas associadas ao desmatamento se relaciona com a crise de saúde causada pela pandemia de Covid-19.  https://t.co/7ckBcUWmYB",pt,"[{'screen_name': 'agenciapublica', 'name': 'agência pública', 'id': '310497473'}]",['https://apublica.org/especial/amazonia-irrespiravel/'],[],0,3,6,[],[],https://twitter.com/ClimaInfoNews/status/1354778221800206340,False,,0,,,,,,,,[],,,,
