id,conversation_id,created_at,date,time,timezone,user_id,username,name,place,tweet,language,mentions,urls,photos,replies_count,retweets_count,likes_count,hashtags,cashtags,link,retweet,quote_url,video,thumbnail,near,geo,source,user_rt_id,user_rt,retweet_id,reply_to,retweet_date,translate,trans_src,trans_dest
1246944524863234050,1246944524863234050,2020-04-05 20:35:16 -03,2020-04-05,20:35:16,-0300,329929116,olivaelisabeth,Elisabeth oliva,,"Acabei de dizer #MP910Não. Vamos, juntos, acabar com a corrupção e o desmatamento na Amazônia!   https://t.co/5jVWv8Zhtv",pt,[],['http://www.saldaodaamazonia.org.br'],[],0,2,1,['mp910não'],[],https://twitter.com/OlivaElisabeth/status/1246944524863234050,False,,0,,,,,,,,[],,,,
1246932356558135309,1246500601095225347,2020-04-05 19:46:55 -03,2020-04-05,19:46:55,-0300,1155433548050046976,lenesoa69629340,Lene Soares,,"@marcelorubens Exceto na Amazônia, onde o desmatamento continua, enquanto fazemos quarentena. Os meios de comunicação precisam informar isso @andretrig",pt,"[{'screen_name': 'andretrig', 'name': 'andré trigueiro', 'id': '42593930'}]",[],[],0,0,0,[],[],https://twitter.com/LeneSoa69629340/status/1246932356558135309,False,,0,,,,,,,,"[{'screen_name': 'marcelorubens', 'name': 'Marcelo Rubens Paiva', 'id': '30117765'}]",,,,
1246926397806972934,1246926397806972934,2020-04-05 19:23:14 -03,2020-04-05,19:23:14,-0300,2690249798,estefany_rb,Istífaniii,,Essa estiagem na região sul poderia ser consequência do grande desmatamento e das queimadas na Amazônia??,pt,[],[],[],1,0,2,[],[],https://twitter.com/estefany_rb/status/1246926397806972934,False,,0,,,,,,,,[],,,,
1246856613123760130,1246856604286423040,2020-04-05 14:45:56 -03,2020-04-05,14:45:56,-0300,1068903012586975232,countdown38,countdown38,,"4. Dr. Ricardo Galvão, ex-presidente do INPE,  exonerado pelo Presidente Bolsonaro.  Qual o motivo? Divulgação de dados considerados muito altos do desmatamento da Amazônia.   O que aconteceu? Exatamente o que alertava. Foi um dos cientistas de 2019 da Nature",pt,[],[],[],1,0,0,[],[],https://twitter.com/countdown38/status/1246856613123760130,False,,0,,,,,,,,[],,,,
1246815365797154817,1246808829104476168,2020-04-05 12:02:02 -03,2020-04-05,12:02:02,-0300,993172117272367106,amoreusous2,feminist of Naboo 🦋,,@ThayIsTired pois é...o tempo tem estado bem louco aqui também. mas já imaginava pois o desmatamento da Amazonia dos ultimos tempos só podia resultar nisso.,pt,[],[],[],0,0,1,[],[],https://twitter.com/amoreusous2/status/1246815365797154817,False,,0,,,,,,,,"[{'screen_name': 'ThayIsTired', 'name': '🦋Thay🌷', 'id': '1244587346114293760'}]",,,,
1246801041473093633,1246801041473093633,2020-04-05 11:05:07 -03,2020-04-05,11:05:07,-0300,64388419,rkuppe,RK Moraes,,"Acabei de ver Em meio à pandemia, desmatamento na Amazônia continua a todo vapor - Clique para ver também ☛   https://t.co/tcWMmLFtVc",pt,[],['https://institutorondon.com.br/em-meio-a-pandemia-desmatamento-na-amazonia-continua-a-todo-vapor/'],[],0,0,0,[],[],https://twitter.com/rkuppe/status/1246801041473093633,False,,0,,,,,,,,[],,,,
1246799967131521024,1246799967131521024,2020-04-05 11:00:51 -03,2020-04-05,11:00:51,-0300,2906696458,roquepoarrr,mateus,,"Quando (sabe-se lá quando) essa pandemia passar, uma das primeiras coisas que vamos ter que encarar será um aumento devastador do desmatamento na Amazônia.  O desmatamento não está de quatentena, e se alastra tal qual um câncer.",pt,[],[],[],0,0,4,[],[],https://twitter.com/roquepoarrr/status/1246799967131521024,False,,0,,,,,,,,[],,,,
1246623423872335878,1246623423872335878,2020-04-04 23:19:20 -03,2020-04-04,23:19:20,-0300,3001172009,emiliaatrajano,Emilia Trajano,,55) Pré-sal 56) Redução de 79% do desmatamento da Amazônia brasileira 57) Aumento em mais de 50% da extensão total de área florestal protegida. #NinguemApagaNossaEstrela,pt,[],[],[],0,0,0,['ninguemapaganossaestrela'],[],https://twitter.com/emiliaatrajano/status/1246623423872335878,False,,0,,,,,,,,[],,,,
1246618647654735874,1246406604058132480,2020-04-04 23:00:21 -03,2020-04-04,23:00:21,-0300,840162396144599040,gdagostini1,Julio D'Agostini,,"@MarcosQuezado1 @PBM_Cruzeiro Sem problemas. Por solicitação de Bolsonaro Mourão ficou responsável pela Amazônia Legal, problemas com terras, desmatamento, incêndios;;; Conhece muito bem, serviu lá. Só isso! Mourão é reto e serio, alguém em que se pode confiar",pt,[],[],[],0,0,1,[],[],https://twitter.com/GDAGOSTINI1/status/1246618647654735874,False,,0,,,,,,,,"[{'screen_name': 'MarcosQuezado1', 'name': 'Delegado M Quezado', 'id': '1148318806303027205'}, {'screen_name': 'PBM_Cruzeiro', 'name': 'pborgesmorais', 'id': '616142461'}]",,,,
1246607757727457285,1246296529822011392,2020-04-04 22:17:04 -03,2020-04-04,22:17:04,-0300,827689449983209472,cadelinhadmuie,Ana cadelinha da karila,,"@artaimez Quem gosta de desmatamento é o agronegócio, brota com a Amazônia",pt,[],[],[],0,0,0,[],[],https://twitter.com/cadelinhadmuie/status/1246607757727457285,False,,0,,,,,,,,[],,,,
1246599216497123329,1246599216497123329,2020-04-04 21:43:08 -03,2020-04-04,21:43:08,-0300,36439280,domtotal,DomTotal,,"Em meio à pandemia, desmatamento na Amazônia continua a todo vapor  https://t.co/l03agWwPGv  https://t.co/euXYK7Oe95",pt,[],['https://ift.tt/2XbDHfR'],['https://pbs.twimg.com/media/EUzPYY4WAAInVi3.jpg'],1,2,0,[],[],https://twitter.com/domtotal/status/1246599216497123329,False,,1,https://pbs.twimg.com/media/EUzPYY4WAAInVi3.jpg,,,,,,,[],,,,
1246584115320836096,1246584115320836096,2020-04-04 20:43:08 -03,2020-04-04,20:43:08,-0300,346615952,tiago_mello82,Tiago Mello #PFF2 #CovidPegaNoAr #CiroGomes 🌹,,"@oatila tendo em vista o aumento significativo do desmatamento da Amazônia no gov @jairbolsonaro, podemos ter um ""COVID19"" Made in Brazil? (ñ gosto do rótulo mas os lunáticos usam, tbm irei usar)",pt,"[{'screen_name': 'jairbolsonaro', 'name': 'jair m. bolsonaro', 'id': '128372940'}]",[],[],0,0,0,[],[],https://twitter.com/Tiago_Mello82/status/1246584115320836096,False,,0,,,,,,,,[],,,,
1246580857835606027,1246580857835606027,2020-04-04 20:30:11 -03,2020-04-04,20:30:11,-0300,138492825,proindio,Comissão Pró-Índio,,"“Não se trata apenas de um problema de saúde. É um problema de desmatamento e invasão de terras. Se não agirmos em conjunto com o governo e as organizações indígenas, pode haver um novo genocídio na Amazônia"", denunciou Mirabal.  https://t.co/pkQnRoTP5E",pt,[],['http://www.rfi.fr/br/am%C3%A9ricas/20200402-covid-19-pode-provocar-um-novo-genoc%C3%ADdio-na-amaz%C3%B4nia-alertam-representantes-ind%C3%ADgenas'],[],1,142,296,[],[],https://twitter.com/proindio/status/1246580857835606027,False,,0,,,,,,,,[],,,,
1246552726273736704,1246552724059181056,2020-04-04 18:38:24 -03,2020-04-04,18:38:24,-0300,90619222,incra_oficial,Incra Ascom,,Essa parceria #Incra e União Europeia objetiva ampliar a emissão dos títulos em terras públicas na Amazônia Legal para aumentar a segurança jurídica no campo e contribuir com a redução do desmatamento.,pt,[],[],[],1,1,3,['incra'],[],https://twitter.com/Incra_oficial/status/1246552726273736704,False,,0,,,,,,,,[],,,,
1246503171209527300,1246503171209527300,2020-04-04 15:21:29 -03,2020-04-04,15:21:29,-0300,174017304,thinkfloyd61,Maurício Castro,,Rios voadores: saiba porque desmatamento na Amazônia os deixa em risco    https://t.co/K0GZ1D8Dt2,pt,[],['https://d.emtempo.com.br/ciencia-e-tecnologia-meio-ambiente/197080/rios-voadores-saiba-porque-desmatamento-na-amazonia-os-deixa-em-risco'],[],0,0,0,[],[],https://twitter.com/ThinkFloyd61/status/1246503171209527300,False,,0,,,,,,,,[],,,,
1246491563330621440,1246491563330621440,2020-04-04 14:35:22 -03,2020-04-04,14:35:22,-0300,16710559,meunomeehefziba,Hefzibá (Use máscara PFF2!),,"Depois de o céu ter escurecido às 15h em São Paulo, pela nuvem negra do desmatamento na Amazônia, temos isto:",pt,[],[],[],0,0,0,[],[],https://twitter.com/meunomeehefziba/status/1246491563330621440,False,https://twitter.com/AndradeRNegro2/status/1246435737517555712,0,,,,,,,,[],,,,
1246463885227458560,1246463885227458560,2020-04-04 12:45:23 -03,2020-04-04,12:45:23,-0300,586847477,beansandrice_,Juliana,,“Atividades como o corte de madeira ilegal e eventos recentes como os incêndios de 2019 fazem parte do problema”.  BBC News Brasil - 'A grande mentira verde': como a destruição da Amazônia vai além do desmatamento  https://t.co/7kYWrGiehc,pt,[],['https://www.bbc.com/portuguese/brasil-51317040'],[],0,0,0,[],[],https://twitter.com/beansandrice_/status/1246463885227458560,False,,0,,,,,,,,[],,,,
1246444468632465408,1246444468632465408,2020-04-04 11:28:13 -03,2020-04-04,11:28:13,-0300,1036980550492479488,infoamazoniabr,InfoAmazonia Brasil,,"O desmatamento segue em alta e animais selvagens são capturados e comercializados livremente na Amazônia e outras regiões do Brasil. Traficados, podem transmitir doenças para quem participa desse mercado ilegal.  https://t.co/fJoRC0M7Fv",pt,[],['https://infoamazonia.org/pt/2020/04/portugues-uma-proxima-pandemia-pode-surgir-da-amazonia-com-avanco-sobre-a-floresta'],[],0,3,6,[],[],https://twitter.com/InfoAmazoniaBR/status/1246444468632465408,False,,0,,,,,,,,[],,,,
1246411946213113856,1246411946213113856,2020-04-04 09:18:59 -03,2020-04-04,09:18:59,-0300,819252392990539776,inforchannel,InforChannel,,"Sensoriamento remoto pode ajudar na proteção de terras indígenas  Alana Toniol, desmatamento na Amazônia Legal, Hex, imagens de satélites, Instituto Chico Mendes de Conservação da Biodiversidade (ICMBio), proteção de terras indígenas, sensoriamento remoto  https://t.co/mDIwL1TBMt",pt,[],['https://is.gd/76HHyB'],[],0,0,0,[],[],https://twitter.com/InforChannel/status/1246411946213113856,False,,0,,,,,,,,[],,,,
1246244080092360704,1246244080092360704,2020-04-03 22:11:57 -03,2020-04-03,22:11:57,-0300,58902770,cajucajr,🇧🇷🌹 Götterdämmerung 🌹🇧🇷,,Já pensou são Paulo sem água por falta de chuva devido o desmatamento da Amazônia? Surreal. #jornaldacultura,pt,[],[],[],1,2,9,['jornaldacultura'],[],https://twitter.com/cajucajr/status/1246244080092360704,False,,0,,,,,,,,[],,,,
1246243357686411264,1246243357686411264,2020-04-03 22:09:05 -03,2020-04-03,22:09:05,-0300,126750296,jornal_cultura,Jornalismo TV Cultura,,"Monitoramento do Instituto Nacional de Pesquisas Espacias mostra que o desmatamento na Amazônia dobrou no período chuvoso deste ano. E a redução das equipes de fiscalização do Ibama, por causa do coronavírus, pode agravar ainda mais o problema. #JornaldaCultura",pt,[],[],[],4,6,43,['jornaldacultura'],[],https://twitter.com/jornal_cultura/status/1246243357686411264,False,,0,,,,,,,,[],,,,
1246210875385499648,1246210875385499648,2020-04-03 20:00:00 -03,2020-04-03,20:00:00,-0300,23798169,governoacre,Governo do Acre,,"Em videoconferência, o vice-presidente da República, Hamilton Mourão, reuniu os representantes do Conselho da Amazônia Legal para apresentar as ações estratégicas que serão executadas pelo conselho no combate ao desmatamento e queimadas ilegais. 📲Mais em:  https://t.co/yRFrkH5xvq  https://t.co/b8YybQAddn",pt,[],['https://bit.ly/3dRMhGA'],['https://pbs.twimg.com/media/EUodmMxXsAIgCnY.jpg'],0,0,5,[],[],https://twitter.com/GovernoAcre/status/1246210875385499648,False,,1,https://pbs.twimg.com/media/EUodmMxXsAIgCnY.jpg,,,,,,,[],,,,
1246207117566062594,1246206049905971200,2020-04-03 19:45:04 -03,2020-04-03,19:45:04,-0300,1143203230568144896,lxr_2004,Lixero,,"É mais torturador q ver a Leticia Sherakin e o namorado dela falando do desmatamento da Amazônia, é mais torturador q a animação do Pain na batalha contra o Naruto, é mais torturador q Mano Brown acústico SIM",pt,[],[],[],0,0,1,[],[],https://twitter.com/LXR_2004/status/1246207117566062594,False,,0,,,,,,,,[],,,,
1246200860268470275,1246174275675004929,2020-04-03 19:20:13 -03,2020-04-03,19:20:13,-0300,292089465,escritor4,Prof. Nelson,,"Na mensagem acima, observa-se o impacto da linguagem verbal (contiguidade: {Mensagem de Natal.}) sobre a não verbal, preponderantemente, no signo linguístico “texto sobre a ameaça do desmatamento”, interpretado como “desmatamento da Amazônia”...",pt,[],[],[],0,0,0,[],[],https://twitter.com/Escritor4/status/1246200860268470275,False,,0,,,,,,,,[],,,,
1246195364329328641,1246195364329328641,2020-04-03 18:58:22 -03,2020-04-03,18:58:22,-0300,3961476868,katiaflimab,kátia,,"Pratinho do dia, simples, gostoso e livre de crueldade 💚 #desmatamento #sustentabilidade #menoslixo  #mareslimpos #sustentavel #mudancasclimaticas #amazonia #salveaamazonia #salveoplaneta #naoexisteplanetab #aquecimentoglobal #mataatlantica #recife  https://t.co/ZOPN1DsnCo",pt,[],[],['https://pbs.twimg.com/media/EUtgD9eWAAIZDfY.jpg'],0,1,1,"['desmatamento', 'sustentabilidade', 'menoslixo', 'mareslimpos', 'sustentavel', 'mudancasclimaticas', 'amazonia', 'salveaamazonia', 'salveoplaneta', 'naoexisteplanetab', 'aquecimentoglobal', 'mataatlantica', 'recife']",[],https://twitter.com/katiaflimab/status/1246195364329328641,False,,1,https://pbs.twimg.com/media/EUtgD9eWAAIZDfY.jpg,,,,,,,[],,,,
1246177714417123328,1246171830110601216,2020-04-03 17:48:14 -03,2020-04-03,17:48:14,-0300,57951163,anapbveiga,Ana V.,,"Interessante colocação de um dos palestrantes que: ""após grandes crises econômicas, as atividades extrativistas aumentam"". Nesse sentido, os palestrantes demonstraram preocupação, por exemplo, com o aumento do desmatamento na Amazônia.",pt,[],[],[],1,0,1,[],[],https://twitter.com/anapbveiga/status/1246177714417123328,False,,0,,,,,,,,[],,,,
1246171658194386949,1246171658194386949,2020-04-03 17:24:10 -03,2020-04-03,17:24:10,-0300,576776937,augiepullman,antonio,,no 3x8 de tamers falam do desmatamento da amazonia digimon fazendo mais pelo brasil do q o president,pt,[],[],[],0,0,0,[],[],https://twitter.com/augiepullman/status/1246171658194386949,False,,0,,,,,,,,[],,,,
1246128073080287235,1246128073080287235,2020-04-03 14:30:59 -03,2020-04-03,14:30:59,-0300,1070270400662265856,rajaophd,Raoni Rajão 🇧🇷,,"Parabéns ao @GeneralMourao pela fala firme e necessária: ""Aquelas pessoas que estão buscando fazer ilegalidades em relação a desmatamento e queimadas na Amazônia, podem ter certeza que braço da lei vai busca-los""  https://t.co/FgJEtvjF5L",pt,"[{'screen_name': 'generalmourao', 'name': 'general hamilton mourão', 'id': '1058819604741525510'}]",['https://www.youtube.com/watch?v=pDWymUCLcpU&feature=youtu.be'],[],0,0,3,[],[],https://twitter.com/RajaoPhD/status/1246128073080287235,False,,0,,,,,,,,[],,,,
1246118925164838912,1246024440112168961,2020-04-03 13:54:38 -03,2020-04-03,13:54:38,-0300,1086789015599304705,marcelonorkey,Marcelo Norkey,,"@xicograziano @xicograziano seus comentário não leva em consideração o histórico e a problemática que vivemos hoje na Amazônia, ONGs criando discursos falsos para dificultar o desmatamento legal, políticos desviando o dinheiro que vem do fundo Amazônia que deveria ajudar a regularização!",pt,[],[],[],0,0,0,[],[],https://twitter.com/MarceloNorkey/status/1246118925164838912,False,,0,,,,,,,,"[{'screen_name': 'xicograziano', 'name': 'Xico Graziano', 'id': '41881267'}]",,,,
1246110103738163205,1246080942143397890,2020-04-03 13:19:34 -03,2020-04-03,13:19:34,-0300,1070270400662265856,rajaophd,Raoni Rajão 🇧🇷,,@GabrielaPrioli Parabéns pela retitude e pelo foco na importância de debates com base na Ciência e não em achismos. Pode contar com o apoio do nosso grupo de pesquisa na UFMG sobre desmatamento e produção agropecuária na Amazônia no seu novo projeto.,pt,[],[],[],0,0,1,[],[],https://twitter.com/RajaoPhD/status/1246110103738163205,False,,0,,,,,,,,"[{'screen_name': 'GabrielaPrioli', 'name': 'Gabriela Prioli', 'id': '1095834875716874245'}]",,,,
1246105385402056706,1246105382973562887,2020-04-03 13:00:50 -03,2020-04-03,13:00:50,-0300,21417843,alexmansur,Alexandre Mansur,,"A grilagem, o roubo de terras públicas, a invasão de florestas públicas, o desmatamento em terras públicas é a principal causa do desmatamento na Amazônia. Qual é o sentido em premiar os bandidos?",pt,[],[],[],1,1,2,[],[],https://twitter.com/alexmansur/status/1246105385402056706,False,,0,,,,,,,,[],,,,
1246097627747237895,1246097627747237895,2020-04-03 12:30:00 -03,2020-04-03,12:30:00,-0300,1154143621148545024,cbrasilnoclima,Centro Brasil no Clima - CBC,,"CLIMA: Atividades relacionadas a agropecuária são responsáveis pela maior parte das emissões de GEE brasileiras. Do total de emissões de 2018, 44% foi proveniente de mudanças no uso da terra, tradicionalmente vinculado ao desmatamento nos biomas Amazônia e Cerrado.",pt,[],[],[],0,0,0,[],[],https://twitter.com/cbrasilnoclima/status/1246097627747237895,False,,0,,,,,,,,[],,,,
1246083267712991232,1246024440112168961,2020-04-03 11:32:56 -03,2020-04-03,11:32:56,-0300,859887615537008643,lvdovici,Luis Nunes,,"@xicograziano Desmatamento ilegal na Amazônia? Você é CO MU NIS TA,  TALKEI.",pt,[],[],[],0,0,0,[],[],https://twitter.com/LVDOVICI/status/1246083267712991232,False,,0,,,,,,,,"[{'screen_name': 'xicograziano', 'name': 'Xico Graziano', 'id': '41881267'}]",,,,
1246035519634419712,1246035519634419712,2020-04-03 08:23:12 -03,2020-04-03,08:23:12,-0300,778268374287679488,ronniedantas10,Portal RDN.com.br,,Governo do Pará defende uso das Forças Armadas no combate às queimadas e ao desmatamento da Amazônia  https://t.co/MaEe7RwE29  https://t.co/4n1pSgtIYq,pt,[],['https://rdnoticias.blog.br/2020/04/03/governo-do-para-defende-uso-das-forcas-armadas-no-combate-as-queimadas-e-ao-desmatamento-da-amazonia/'],['https://pbs.twimg.com/media/EUrOsN6UMAAqmBf.jpg'],0,0,0,[],[],https://twitter.com/RonnieDantas10/status/1246035519634419712,False,,1,https://pbs.twimg.com/media/EUrOsN6UMAAqmBf.jpg,,,,,,,[],,,,
1246025271595216897,1246024440112168961,2020-04-03 07:42:29 -03,2020-04-03,07:42:29,-0300,1154063821499244544,palla_vera,Vera Lúcia Palla,,"@xicograziano O pior que colocam tudo na conta dos produtores rurais. Sou a favor sim do desmatamento zero na Amazônia, mas p isso é preciso fiscalização e punição severa!!",pt,[],[],[],1,0,2,[],[],https://twitter.com/palla_vera/status/1246025271595216897,False,,0,,,,,,,,"[{'screen_name': 'xicograziano', 'name': 'Xico Graziano', 'id': '41881267'}]",,,,
1245939749803696129,1245939749803696129,2020-04-03 02:02:39 -03,2020-04-03,02:02:39,-0300,586847477,beansandrice_,Juliana,,"Até 2035, a Amazônia perderá a capacidade de absorver CO2 devido, dentre outros motivos, ao desmatamento e ao aumento de sua emissão pelo homem. Uma boa saída é plantar + árvores! 🌱🌱  Florestas tropicais podem emitir mais CO2 do que capturam em breve  https://t.co/CVRZDAvti3",pt,[],"['https://www.correiobraziliense.com.br/app/noticia/mundo/2020/03/04/interna_mundo,832145/florestas-tropicais-podem-emitir-mais-co2-do-que-capturam-em-breve.shtml']",[],0,0,0,[],[],https://twitter.com/beansandrice_/status/1245939749803696129,False,,0,,,,,,,,[],,,,
1245903720942120960,1245903720942120960,2020-04-02 23:39:29 -03,2020-04-02,23:39:29,-0300,384198115,alvesclo,JESUS REI DOS REIS!,, https://t.co/0Y6qMfTPE5 MOURÃO FALA D DESMATAMENTO NA AMAZÔNIA!,pt,[],['https://www.oantagonista.com/brasil/amazonia-esta-em-estacao-de-chuva-e-ha-algum-desmatamento-vamos-atacar-isso-diz-mourao/'],[],0,0,0,[],[],https://twitter.com/Alvesclo/status/1245903720942120960,False,,0,,,,,,,,[],,,,
1245896676642086915,1245895660492271618,2020-04-02 23:11:30 -03,2020-04-02,23:11:30,-0300,1055090704442105857,totoviscky,Um Sonho 🇧🇷,,"@fiscaldoibama A maior causa do desmatamento da Amazonia, o maior grupo que possui terras na amazonia, os politicos que possuem terras na amazonia.",pt,[],[],[],1,0,1,[],[],https://twitter.com/totoviscky/status/1245896676642086915,False,,0,,,,,,,,"[{'screen_name': 'fiscaldoibama', 'name': 'O FISCAL do IBAMA', 'id': '3355746328'}]",,,,
1245883556007641089,1245883556007641089,2020-04-02 22:19:21 -03,2020-04-02,22:19:21,-0300,2551097662,adrianobrunett2,Adriano Brunetti,,Acabou desmatamento da Amazônia? E as manchas de óleo no litoral? Ainda existe dengue? Ronaldinho foi solto? Para quem foi a herança do Gugu? Prederam o assassino da Marielle? Ainda existe homofobia no Brasil? E racismo? E afinal quem é melhor: Palmeiras (1994) x Flamengo (2019)?,pt,[],[],[],1,0,0,[],[],https://twitter.com/AdrianoBrunett2/status/1245883556007641089,False,,0,,,,,,,,[],,,,
1245876587519770624,1245843844056469505,2020-04-02 21:51:40 -03,2020-04-02,21:51:40,-0300,380158600,llbrzfree,No lado esquerdo do peito,,@DamaresAlves Orar? Como assim? Brasileiro não vive no esgoto e cria anticorpos? Vão orar pelo desmatamento da Amazônia? Pelos filhos dos índios? Pelos ladrões que devem ser executados? Pelos gays q devem morrer? Pelos pobres q aguardam ajuda? deus d vcs é o kpta,pt,[],[],[],0,0,0,[],[],https://twitter.com/LLBRZFREE/status/1245876587519770624,False,,0,,,,,,,,"[{'screen_name': 'DamaresAlves', 'name': 'Damares Alves', 'id': '1083774484123975680'}]",,,,
1245859184580505600,1245859184580505600,2020-04-02 20:42:31 -03,2020-04-02,20:42:31,-0300,395905491,aprovinciadopa,A Província do Pará,,"Diante os desafios impostos pela pandemia do coronavírus que fragilizaram o sistema de fiscalização das queimadas e desmatamento da Amazônia, nesta quinta-feira (02), o governador Helder Barbalho pleiteou, junto ao vice-presidente da República,  #Amazônia   https://t.co/M6bM7Ny2Ih  https://t.co/OV4uLkdv5y",pt,[],['http://aprovinciadopara.com.br/?p=65080'],['https://pbs.twimg.com/media/EUouU25WkAEuAp6.jpg'],0,0,0,['amazônia'],[],https://twitter.com/aprovinciadopa/status/1245859184580505600,False,,1,https://pbs.twimg.com/media/EUouU25WkAEuAp6.jpg,,,,,,,[],,,,
1245823084059168776,1245823084059168776,2020-04-02 18:19:04 -03,2020-04-02,18:19:04,-0300,45166734,sgfb,SpiceGirlsForeverBr,,Gente a Amazônia ainda ta pegando fogo? Ninguém mais falou sobre o desmatamento,pt,[],[],[],0,0,2,[],[],https://twitter.com/sgfb/status/1245823084059168776,False,,0,,,,,,,,[],,,,
1245819878973616128,1245812532830515200,2020-04-02 18:06:20 -03,2020-04-02,18:06:20,-0300,1055090704442105857,totoviscky,Um Sonho 🇧🇷,,"@GeneralMourao @mmeioambiente Como planejam acabar com o desmatamento, se que o condiciona é a agropecuária dentro da Amazônia?",pt,[],[],[],0,0,0,[],[],https://twitter.com/totoviscky/status/1245819878973616128,False,,0,,,,,,,,"[{'screen_name': 'GeneralMourao', 'name': 'General Hamilton Mourão', 'id': '1058819604741525510'}, {'screen_name': 'mmeioambiente', 'name': 'Ministério do Meio Ambiente', 'id': '193003734'}]",,,,
1245815267717980161,1245815267717980161,2020-04-02 17:48:00 -03,2020-04-02,17:48:00,-0300,70321319,videversus,Vitor Vieira,,"Hamilton Mourão afirmou nesta quinta-feira (2) que as Forças Armadas, pelo Conselho da Amazônia, vão intensificar o combate ao desmatamento desde já.",pt,[],[],[],0,0,7,[],[],https://twitter.com/Videversus/status/1245815267717980161,False,,0,,,,,,,,[],,,,
1245812532830515200,1245812532830515200,2020-04-02 17:37:08 -03,2020-04-02,17:37:08,-0300,1058819604741525510,generalmourao,General Hamilton Mourão,,Importante ação para a obtenção de recursos para o combate ao desmatamento  da #Amazônia. É a atuação do @mmeioambiente no #ConselhodaAmazoniaLegal  https://t.co/6PxIMkesc7,pt,"[{'screen_name': 'mmeioambiente', 'name': 'ministério do meio ambiente', 'id': '193003734'}]",[],['https://pbs.twimg.com/media/EUoD5HHWsAcEC6j.jpg'],296,98,1070,"['amazônia', 'conselhodaamazonialegal']",[],https://twitter.com/GeneralMourao/status/1245812532830515200,False,https://twitter.com/PNUDBrasil/status/1245790638932713478,1,https://pbs.twimg.com/media/EUoD5HHWsAcEC6j.jpg,,,,,,,[],,,,
1245812329117290497,1245812329117290497,2020-04-02 17:36:19 -03,2020-04-02,17:36:19,-0300,138492825,proindio,Comissão Pró-Índio,,"Diante os desafios impostos pela pandemia do #coronavírus que fragilizaram o sistema de fiscalização das queimadas e #desmatamento da Amazônia, o governador Helder Barbalho pleiteou, junto ao vice-presidente da República, o reforço imediato na fiscalização  https://t.co/TkE3PNM3XS",pt,[],['https://agenciapara.com.br/noticia/18777'],[],0,4,4,"['coronavírus', 'desmatamento']",[],https://twitter.com/proindio/status/1245812329117290497,False,,0,,,,,,,,[],,,,
1245810616645963776,1245810616645963776,2020-04-02 17:29:31 -03,2020-04-02,17:29:31,-0300,3253964386,prsamuelcarlos1,Samuel Pereira 🇧🇷🇺🇲🇮🇱,,"Tweet de O Antagonista (@o_antagonista) O Antagonista (@o_antagonista) tweetou: “Amazônia está em estação de chuva e há algum desmatamento. Vamos atacar isso”, diz Mourão.  https://t.co/cWn1496hSk  https://t.co/JyW9eBJxMO",pt,"[{'screen_name': 'o_antagonista', 'name': 'o antagonista', 'id': '2880932962'}, {'screen_name': 'o_antagonista', 'name': 'o antagonista', 'id': '2880932962'}]","['https://www.oantagonista.com/brasil/amazonia-esta-em-estacao-de-chuva-e-ha-algum-desmatamento-vamos-atacar-isso-diz-mourao/?oam', 'https://twitter.com/o_antagonista/status/1245809695014731776?s=20']",[],0,0,0,[],[],https://twitter.com/PrSamuelCarlos1/status/1245810616645963776,False,https://twitter.com/o_antagonista/status/1245809695014731776?s=20,0,,,,,,,,[],,,,
1245809695014731776,1245809695014731776,2020-04-02 17:25:51 -03,2020-04-02,17:25:51,-0300,2880932962,o_antagonista,O Antagonista,,"“Amazônia está em estação de chuva e há algum desmatamento. Vamos atacar isso”, diz Mourão.  https://t.co/odQtO8wsu9",pt,[],['https://www.oantagonista.com/brasil/amazonia-esta-em-estacao-de-chuva-e-ha-algum-desmatamento-vamos-atacar-isso-diz-mourao/?oam'],[],5,15,144,[],[],https://twitter.com/o_antagonista/status/1245809695014731776,False,,0,,,,,,,,[],,,,
