id,conversation_id,created_at,date,time,timezone,user_id,username,name,place,tweet,language,mentions,urls,photos,replies_count,retweets_count,likes_count,hashtags,cashtags,link,retweet,quote_url,video,thumbnail,near,geo,source,user_rt_id,user_rt,retweet_id,reply_to,retweet_date,translate,trans_src,trans_dest
1422306759276957707,1422209214278213642,2021-08-02 18:22:11 SA Eastern Standard Time,2021-08-02,18:22:11,-0300,1215836535200849921,nilzamaram,Nilzamara Marques,,"@SekaiCWB @douglasiks @taoquei1 Que idiota, morei 10 anos na Amazônia e para os ignorantes como vc explicarei, lá existe dois períodos climáticos: o chuvoso e o seco, no período de seca não cai uma gota do céu e o calor beira ao insuportável e as queimadas ocorrem naturalmente como na Califórnia Grécia e etc,⤵️",pt,[],[],[],1,0,10,[],[],https://twitter.com/NilzamaraM/status/1422306759276957707,False,,0,,,,,,,,"[{'screen_name': 'SekaiCWB', 'name': 'CK Ishikawa', 'id': '137712212'}, {'screen_name': 'douglasiks', 'name': 'Douglas Ribeiro', 'id': '3882102255'}, {'screen_name': 'taoquei1', 'name': 'TeAtualizei 🇧🇷👊🏻❤️', 'id': '1087259768'}]",,,,
1422300549106524163,1422300549106524163,2021-08-02 17:57:30 SA Eastern Standard Time,2021-08-02,17:57:30,-0300,342428078,daltonomendes,DaltonOMendes,,Greenpeace flagra avanço de queimadas na Amazônia  https://t.co/tVcsd1GwsK,pt,[],['https://veja.abril.com.br/blog/radar/greenpeace-flagra-avanco-de-queimadas-na-amazonia/'],[],0,0,0,[],[],https://twitter.com/DaltonOMendes/status/1422300549106524163,False,,0,,,,,,,,[],,,,
1422296749675188244,1422296749675188244,2021-08-02 17:42:24 SA Eastern Standard Time,2021-08-02,17:42:24,-0300,160392357,camila_cake,o agro é golpe,,"bozo e erdogolum às vezes parecem gêmeos. assim como o bozo mentiu falando q foram as ONGs que queimaram a Amazônia, erdogolum mente falando que o PKK está por trás das queimadas na Turquia.  E acredita quem é corno. Ou fascista. Ou ambos.",pt,[],[],[],1,0,1,[],[],https://twitter.com/camila_cake/status/1422296749675188244,False,https://twitter.com/fgeerdink/status/1422094554744897537,0,,,,,,,,[],,,,
1422294568251367428,1422294564220678150,2021-08-02 17:33:44 SA Eastern Standard Time,2021-08-02,17:33:44,-0300,54235025,agenciajovem_,AJN | Agência Jovem de Notícias,,"tem acelerado a destruição do que ainda nos resta, com o desmatamento na Amazônia, queimadas no Pantanal, contaminação de água no Cerrado, exploração irregular na Caatinga, diminuição na já escassa Mata Atlântica, erosão do solo nos Pampas.",pt,[],[],[],1,0,0,[],[],https://twitter.com/agenciajovem_/status/1422294568251367428,False,,0,,,,,,,,[],,,,
1422288654593056772,1422288654593056772,2021-08-02 17:10:14 SA Eastern Standard Time,2021-08-02,17:10:14,-0300,1384380134468333574,vigilanteportal,Portal Vigilante,,"De acordo com os dados do Inpe Queimadas, julho registrou 4.977 focos de calor no bioma Amazônia. #Greenpeace #Amazônia  https://t.co/QdPSYjm5to",pt,[],['https://portalvigilante.com.br/2021/08/02/greenpeace-sobrevoa-a-amazonia-e-flagra-o-avanco-do-fogo-sobre-a-floresta/'],[],0,0,1,"['greenpeace', 'amazônia']",[],https://twitter.com/VigilantePortal/status/1422288654593056772,False,,0,,,,,,,,[],,,,
1422285473326804998,1422285473326804998,2021-08-02 16:57:36 SA Eastern Standard Time,2021-08-02,16:57:36,-0300,2855717202,hbcugreenfund,HBCU Green Fund,,"Greenpeace: RT @GreenpeaceBR: Segundo dados do Inpe Queimadas, julho registrou 4.977 focos de calor no bioma Amazônia, todos ilegais, já que o Decreto nº 10.735, que proíbe o uso do fogo no Brasil, está vigente desde 28 de junho de 2021. Foto de 29/7, fo…  https://t.co/dZ8bPn6qVy",pt,"[{'screen_name': 'greenpeacebr', 'name': 'greenpeace brasil', 'id': '16334137'}]",[],['https://pbs.twimg.com/media/E7yZQH1XoAIaLjP.jpg'],0,0,0,[],[],https://twitter.com/HBCUGreenFund/status/1422285473326804998,False,,1,https://pbs.twimg.com/media/E7yZQH1XoAIaLjP.jpg,,,,,,,[],,,,
1422284726883266565,1422284726883266565,2021-08-02 16:54:38 SA Eastern Standard Time,2021-08-02,16:54:38,-0300,1246548901936709633,oantenado_,O Antenado,,"De acordo com os dados do Inpe Queimadas, julho registrou 4.977 focos de calor no bioma Amazônia. #Greenpeace #Amazônia  https://t.co/G4nD1tUMhy",pt,[],['https://portaloantenado.com.br/2021/08/02/greenpeace-sobrevoa-a-amazonia-e-flagra-o-avanco-do-fogo-sobre-a-floresta/'],[],0,0,1,"['greenpeace', 'amazônia']",[],https://twitter.com/oantenado_/status/1422284726883266565,False,,0,,,,,,,,[],,,,
1422277072282607627,1422277072282607627,2021-08-02 16:24:13 SA Eastern Standard Time,2021-08-02,16:24:13,-0300,142499519,rosepaixao_on,Rose Paixão 🆘🇧🇷🚩,,A aula de amanhã será.   ALERTA: SATANARO POR TRÁS DAS QUEIMADAS DA AMAZÔNIA 🔥🔥🔥🔥🔥  https://t.co/tKTRk36L2d,pt,[],['https://youtu.be/5jxYgv08fPE'],[],0,0,0,[],[],https://twitter.com/rosepaixao_on/status/1422277072282607627,False,,0,,,,,,,,[],,,,
1422271074314735624,1422271074314735624,2021-08-02 16:00:23 SA Eastern Standard Time,2021-08-02,16:00:23,-0300,1246234551476801539,edlany5,Edlany,,"Vou fazer um fogo aqui pra ver se a GRETA THUNBERG, ONGs, GLOBO, Esquerdopatas, MACRON, MARINA SILVA, e os demais ambientalistas lembram das QUEIMADAS NA AMAZÔNIA! #Tá calmo demais! Esse ano o plano é meter fogo nas estátuas em Praça Pública! #Silêncio eles podem ouvir!🤔🤫🤫🤐",pt,[],[],[],0,0,0,"['tá', 'silêncio']",[],https://twitter.com/Edlany5/status/1422271074314735624,False,,0,,,,,,,,[],,,,
1422271058976165894,1422271058976165894,2021-08-02 16:00:19 SA Eastern Standard Time,2021-08-02,16:00:19,-0300,138492825,proindio,Comissão Pró-Índio,,Hamilton Mourão afirmou nesta segunda (2) que provavelmente não será cumprida a meta de redução de #desmatamento na #Amazônia. Emprego de militares das Forças Armadas foi a principal aposta do governo para reduzir os índices de desmatamento e #queimadas.  https://t.co/SUF58NDJat,pt,[],['https://g1.globo.com/politica/noticia/2021/08/02/mourao-diz-que-reducao-do-desmatamento-na-amazonia-no-ultimo-ano-deve-ficar-abaixo-da-meta.ghtml'],[],1,4,12,"['desmatamento', 'amazônia', 'queimadas']",[],https://twitter.com/proindio/status/1422271058976165894,False,,0,,,,,,,,[],,,,
1422263801974566915,1422263801974566915,2021-08-02 15:31:29 SA Eastern Standard Time,2021-08-02,15:31:29,-0300,28407958,radaronline,Radar,,Greenpeace flagra avanço de queimadas na Amazônia  https://t.co/L9xRi834GX,pt,[],['https://veja.abril.com.br/blog/radar/greenpeace-flagra-avanco-de-queimadas-na-amazonia/'],[],8,3,10,[],[],https://twitter.com/radaronline/status/1422263801974566915,False,,0,,,,,,,,[],,,,
1422250330578948098,1422250330578948098,2021-08-02 14:37:57 SA Eastern Standard Time,2021-08-02,14:37:57,-0300,17715048,veja,VEJA,,Greenpeace registra o avanço de queimadas na Amazônia (via @radaronline)  https://t.co/xu3yrF0x6P,pt,"[{'screen_name': 'radaronline', 'name': 'radar', 'id': '28407958'}]",['https://veja.abril.com.br/blog/radar/greenpeace-flagra-avanco-de-queimadas-na-amazonia/'],[],50,24,147,[],[],https://twitter.com/VEJA/status/1422250330578948098,False,,0,,,,,,,,[],,,,
1422248168499073027,1422248168499073027,2021-08-02 14:29:22 SA Eastern Standard Time,2021-08-02,14:29:22,-0300,1275548206320009216,nagenciabr,Agência de notícias Brasil,,Greenpeace flagra avanço de queimadas na Amazônia  https://t.co/SkmDPL5Vqe,pt,[],['https://agenciabr.com.br/greenpeace-flagra-avanco-de-queimadas-na-amazonia/'],[],0,0,0,[],[],https://twitter.com/nagenciabr/status/1422248168499073027,False,,0,,,,,,,,[],,,,
1422245499474784260,1422245494412255233,2021-08-02 14:18:45 SA Eastern Standard Time,2021-08-02,14:18:45,-0300,2567480833,bossseven1,Fausto Figueiredo,,"a esse  https://t.co/9IBwyAsjq1 campanha que ele dizia-se honesto, trocou VOTOS por promessa não fiscalizar e nem des truir os equipamentos aos ilegais na Amazonia, invaso res,mineradores e contiua cumprindo a promessa vide as queimadas,desmatagens que batem o record nos  últimos",pt,[],['http://ponto.Na'],[],1,0,0,[],[],https://twitter.com/bossseven1/status/1422245499474784260,False,,0,,,,,,,,[],,,,
1422245397389582341,1422245397389582341,2021-08-02 14:18:21 SA Eastern Standard Time,2021-08-02,14:18:21,-0300,1294284740237852673,sbtnews,SBT News,,"De acordo com os dados do Inpe Queimadas, julho registrou 4.977 focos de calor no bioma Amazônia, todos ilegais   https://t.co/hBU1BM3gRL",pt,[],['https://bit.ly/3lp5kyq'],[],1,2,6,[],[],https://twitter.com/sbtnews/status/1422245397389582341,False,,0,,,,,,,,[],,,,
1422244250331267079,1422244250331267079,2021-08-02 14:13:47 SA Eastern Standard Time,2021-08-02,14:13:47,-0300,78738957,crisfrodrigues,Cris Rodrigues Fotografia,,Mas o problema do mundo são as queimadas na Amazônia brasileira. 🤔,pt,[],[],[],0,1,3,[],[],https://twitter.com/Crisfrodrigues/status/1422244250331267079,False,https://twitter.com/BarbeariaPoian/status/1421705940877860865,0,,,,,,,,[],,,,
1422229458413621255,1422229458413621255,2021-08-02 13:15:01 SA Eastern Standard Time,2021-08-02,13:15:01,-0300,56500419,pensandoaltorc,Pensando Alto,,Quem lembra do Bolsonaro explicando as queimadas da Amazônia? 🤣🤣🤣 #bolsonaro #amazonia #amazon #rainforest  https://t.co/0xrW1SzOrr,pt,[],[],[],4,9,30,"['bolsonaro', 'amazonia', 'amazon', 'rainforest']",[],https://twitter.com/pensandoaltorc/status/1422229458413621255,False,,1,https://pbs.twimg.com/ext_tw_video_thumb/1422229413257785354/pu/img/STrNSkSEJomOnXF7.jpg,,,,,,,[],,,,
1422219279395655684,1422185152403357697,2021-08-02 12:34:34 SA Eastern Standard Time,2021-08-02,12:34:34,-0300,314549479,pastor_geovane,Geovane Rodrigues Pr,,"@mitags @jovempan Você tem que ligar as queimadas da Amazônia com as rachadinhas, botar carluxo no meio, gritar genocida três vezes e vai perceber que está tudo interligado. Entendeu? É isso!",pt,[],[],[],0,0,0,[],[],https://twitter.com/Pastor_Geovane/status/1422219279395655684,False,,0,,,,,,,,"[{'screen_name': 'mitags', 'name': 'Mita Guimarães', 'id': '266861485'}, {'screen_name': 'jovempan', 'name': 'jovempan', 'id': '17314756'}]",,,,
1422218544851259397,1422207850382823426,2021-08-02 12:31:39 SA Eastern Standard Time,2021-08-02,12:31:39,-0300,1102336567,husseinbrasil,Hussein - 🎗🇱🇧🇧🇷Justiça #FreeAssange,,@metsul @carlagastal AS queimadas na Amazonia e no Pantanal estão intimamante ligadas a essas mudanças.,pt,[],[],[],0,1,4,[],[],https://twitter.com/HusseinBrasil/status/1422218544851259397,False,,0,,,,,,,,"[{'screen_name': 'metsul', 'name': 'MetSul.com', 'id': '26416363'}, {'screen_name': 'carlagastal', 'name': 'carla gastal 🌵💜', 'id': '52076129'}]",,,,
1422217045668728833,1422217045668728833,2021-08-02 12:25:41 SA Eastern Standard Time,2021-08-02,12:25:41,-0300,65900039,joseleonidas,Leônidas Cristino,,"O compromisso do governo de reduzir em 10% o desmatamento na Amazônia não será cumprido e ficará na faixa dos 4% a 5%, diz o governo Federal. A floresta amazônica, com as queimadas, já emite mais carbono do que consegue absorver, o que pesa nas mudanças climáticas.",pt,[],[],[],1,2,10,[],[],https://twitter.com/joseleonidas/status/1422217045668728833,False,,0,,,,,,,,[],,,,
1422208977467752459,1422207563421081603,2021-08-02 11:53:38 SA Eastern Standard Time,2021-08-02,11:53:38,-0300,1232785035570372610,eniteixeiradov1,eni teixeira do vale,,"@bellanna Essas queimadas não interessam a  ela, não é na Amazônia.",pt,[],[],[],0,1,4,[],[],https://twitter.com/eniteixeiradov1/status/1422208977467752459,False,,0,,,,,,,,"[{'screen_name': 'bellanna', 'name': 'Anita 🇧🇷', 'id': '26486422'}]",,,,
1422188844494041091,1422188844494041091,2021-08-02 10:33:38 SA Eastern Standard Time,2021-08-02,10:33:38,-0300,54880885,fabiospontes,Fabio Pontes,,"Na contramão  O Acre vai em sentido contrário aos estados da Amazônia Legal quanto às queimadas. Segundo o Inpe, até ontem, os focos no estado estavam 21% acima de igual período de 2020; em todo a Amazônia, as queimadas estão 25% abaixo   Efeito do agronegócio de @GladsonCameli",pt,"[{'screen_name': 'gladsoncameli', 'name': 'gladson cameli', 'id': '96775581'}]",[],[],0,0,5,[],[],https://twitter.com/fabiospontes/status/1422188844494041091,False,,0,,,,,,,,[],,,,
1422182293679091715,1422182293679091715,2021-08-02 10:07:36 SA Eastern Standard Time,2021-08-02,10:07:36,-0300,16334137,greenpeacebr,Greenpeace Brasil,,"Segundo dados do Inpe Queimadas, julho registrou 4.977 focos de calor no bioma Amazônia, todos ilegais, já que o Decreto nº 10.735, que proíbe o uso do fogo no Brasil, está vigente desde 28 de junho de 2021. Foto de 29/7, fogo em Porto Velho (RO) #TodosPelaAmazônia  https://t.co/E6a3mLU0rD",pt,[],[],['https://pbs.twimg.com/media/E7yZQH1XoAIaLjP.jpg'],8,87,256,['todospelaamazônia'],[],https://twitter.com/GreenpeaceBR/status/1422182293679091715,False,,1,https://pbs.twimg.com/media/E7yZQH1XoAIaLjP.jpg,,,,,,,[],,,,
1422179968885403649,1422179968885403649,2021-08-02 09:58:22 SA Eastern Standard Time,2021-08-02,09:58:22,-0300,1298024956576428032,ccamilodias,CRO,,"Amo que as desgraças ambientais tá acontecendo bem rápidin das queimadas da Amazônia, vamos todos morrer, obrigado natureza 😍❤️🥰",pt,[],[],[],0,0,1,[],[],https://twitter.com/ccamilodias/status/1422179968885403649,False,,0,,,,,,,,[],,,,
1422178624401195009,1422178624401195009,2021-08-02 09:53:01 SA Eastern Standard Time,2021-08-02,09:53:01,-0300,36336107,obsclima,"Observatório do Clima, 19 anos",,"Soldados treinando esportes durante queimadas criminosas, proibidos de usar roupas corta incêndio sobre farda e ostentação de aparato estragando flagrantes: entenda a ineficiência da GLO da Amazônia 👇👇   https://t.co/Ecy3d85mrC",pt,[],['https://www.opendemocracy.net/pt/servidores-ibama-expoem-absurdos-doutrina-militar-combate-ao-crime-ambiental-amazonia/?utm_source=wa'],[],1,24,45,[],[],https://twitter.com/obsclima/status/1422178624401195009,False,,0,,,,,,,,[],,,,
1422178013685460995,1422177293246636039,2021-08-02 09:50:35 SA Eastern Standard Time,2021-08-02,09:50:35,-0300,2246218340,meirele_ana,Ana Luiza 🇧🇷,,"@schmittpaula olha paula,vc sabe que daqui a pouco começa a temporada né? aquela fase do ano em que as queimadas naturais ocorrem e o mundo lembra que amazônia e índio até existe aquele momento em que greta e macron palpitam sobre o  mundo e biden cobra o brasil o que ele mesmo não faz",pt,[],[],[],1,0,4,[],[],https://twitter.com/meirele_ana/status/1422178013685460995,False,,0,,,,,,,,"[{'screen_name': 'schmittpaula', 'name': 'Paula Schmitt', 'id': '44333533'}]",,,,
1422167390645800964,1422113541025304578,2021-08-02 09:08:23 SA Eastern Standard Time,2021-08-02,09:08:23,-0300,888135932049805314,olecramnivram,Marcelo Oliveira,,@Damadeferroofic Pro Brasil. Mas depois o Bolsonaro matou todas queimadas na amazonia,pt,[],[],[],0,0,0,[],[],https://twitter.com/OlecramNivram/status/1422167390645800964,False,,0,,,,,,,,"[{'screen_name': 'Damadeferroofic', 'name': 'Dama de Ferro', 'id': '1043615581973499904'}]",,,,
1421953344780873734,1421953344780873734,2021-08-01 18:57:50 SA Eastern Standard Time,2021-08-01,18:57:50,-0300,1327815157855227909,eusamaantha,Sam.🍒,,"Queimadas na Amazônia: O presidente ""???""  Turquia em chamas: O presidente recusando ajuda.     Não aguento mais ver gente INCOMPETENTE no poder!",pt,[],[],[],0,0,1,[],[],https://twitter.com/EuSamaantha/status/1421953344780873734,False,,0,,,,,,,,[],,,,
1421952330430238722,1421897760069009408,2021-08-01 18:53:48 SA Eastern Standard Time,2021-08-01,18:53:48,-0300,1123686324022796289,paulocdasilvaf1,Paulopcsf,,"@Rconstantino E põe merda nisso, vai se espalhar mais que a fumaça das queimadas na Amazônia.",pt,[],[],[],0,0,0,[],[],https://twitter.com/PauloCdaSilvaF1/status/1421952330430238722,False,,0,,,,,,,,"[{'screen_name': 'Rconstantino', 'name': 'Rodrigo Constantino', 'id': '33520195'}]",,,,
1421946629087768581,1421946629087768581,2021-08-01 18:31:09 SA Eastern Standard Time,2021-08-01,18:31:09,-0300,1327815157855227909,eusamaantha,Sam.🍒,,"A vontade que eu tinha quando teve as queimadas na Amazônia era de viajar com um balde de água só para poder ajudar de alguma forma, sla.     É frustrante se sentir incapaz de ajudar, mais frustrante ainda ver quem tem poder não fazer absolutamente NADA!",pt,[],[],[],0,0,2,[],[],https://twitter.com/EuSamaantha/status/1421946629087768581,False,,0,,,,,,,,[],,,,
1421863307472949251,1421863307472949251,2021-08-01 13:00:04 SA Eastern Standard Time,2021-08-01,13:00:04,-0300,2985977507,sktsad,𝕤𝕒𝕞𝕦𝕔𝕒,,"vc tão delirando??? 2019 foi UM LIXO ou vcs já se esqueceram de brumadinho, incêndio no alojamento do flamengo, massacre de suzano, óleo no nordeste e queimadas na amazônia???????????",pt,[],[],[],0,0,2,[],[],https://twitter.com/sktsad/status/1421863307472949251,False,https://twitter.com/tox1asc0re/status/1421189818973921281,0,,,,,,,,[],,,,
1421853670996578304,1421853670996578304,2021-08-01 12:21:46 SA Eastern Standard Time,2021-08-01,12:21:46,-0300,1187540332940005376,alvesrickelmi,𝕽𝖎𝖈𝖐𝖊𝖑𝖒𝖎,,"Ta tendo incêndios florestais em uma caralhada de países, nada se fala. UMA FORMIGA PEGA FOGO NA AMAZÔNIA E O GREEN PEACE ATACA COMO SE FOSSE O APOCALIPSE. Interesse na Amazônia é total econômico. Queimadas ditas por países que não tem mais nenhuma árvore nativa",pt,[],[],[],0,0,1,[],[],https://twitter.com/AlvesrickelmI/status/1421853670996578304,False,,0,,,,,,,,[],,,,
1421822466306023431,1421774031112519684,2021-08-01 10:17:46 SA Eastern Standard Time,2021-08-01,10:17:46,-0300,757699626304696320,adilsonhefler,adilsonhefler,,"@DelegadoSaraiva @miriamleitao Daqui ha pouco o miliciano  estará  decretando  ""100 anos de sigilo"" sobre as queimadas e garimpos ilegais da Amazônia.  Estamos perdidos.",pt,[],[],[],0,0,1,[],[],https://twitter.com/adilsonhefler/status/1421822466306023431,False,,0,,,,,,,,"[{'screen_name': 'DelegadoSaraiva', 'name': 'Alexandre Saraiva', 'id': '1383828241232797697'}, {'screen_name': 'miriamleitao', 'name': 'Míriam Leitão', 'id': '16814640'}]",,,,
1421799484309315586,1421796391018541057,2021-08-01 08:46:27 SA Eastern Standard Time,2021-08-01,08:46:27,-0300,18609171,rldigital,rldigital,,@RussoIsrael Muitos não vão entender o cartoon. Mas as queimadas e desmatamento mudaram fortemente o regime de ventos. O resultado foi q rios da Amazônia tiveram as maiores cheias dos últimos 119 anos e o resto do Brasil está penando com frio e seca recordes.,pt,[],[],[],1,0,1,[],[],https://twitter.com/rldigital/status/1421799484309315586,False,,0,,,,,,,,"[{'screen_name': 'RussoIsrael', 'name': 'israel zeferino 🇧🇷🇧🇷Esquerdista sim senhor!', 'id': '858151314'}]",,,,
1421760220791967744,1421760220791967744,2021-08-01 06:10:26 SA Eastern Standard Time,2021-08-01,06:10:26,-0300,57330197,sergio_cunha,Sergio Cunha,,"Queimadas, sêcas, exploração madeireira fizeram da Amazônia uma fonte de carbono ao invés de sumidouro, como sempre foi..",pt,[],[],[],0,0,0,[],[],https://twitter.com/sergio_cunha/status/1421760220791967744,False,,0,,,,,,,,[],,,,
1421702958899679232,1421702958899679232,2021-08-01 02:22:54 SA Eastern Standard Time,2021-08-01,02:22:54,-0300,33795738,combatenteserra,𝘾𝙤𝙢⚡𝙣𝙙𝙖𝙙🪖𝙧 𝙎𝙚𝙧𝙧∴,,O canalha Casagrande usou Cocula e Macula (cocaína e erva com esperma e fezes do criminoso Lula).   O drogado ataca o Presidente com mentiras:   Queimadas Amazônia e Pantanal;  Mortes em decorrência Covid-19;  Cinemateca;  Os inimigos da pátria não têm compromisso com a verdade.  https://t.co/M3Q1muZ886,pt,[],[],"['https://pbs.twimg.com/media/E7rnPtKWYAApTk2.jpg', 'https://pbs.twimg.com/media/E7rnRseX0AAGnsI.jpg', 'https://pbs.twimg.com/media/E7rnSClX0AAIdbg.jpg', 'https://pbs.twimg.com/media/E7rnTl6XIAYC5We.jpg']",1,1,3,[],[],https://twitter.com/CombatenteSerra/status/1421702958899679232,False,,1,https://pbs.twimg.com/media/E7rnPtKWYAApTk2.jpg,,,,,,,[],,,,
1421625761484709892,1421623968377810945,2021-07-31 21:16:08 SA Eastern Standard Time,2021-07-31,21:16:08,-0300,1241945970042195971,pedhrios,Pedroᶜʳᶠ 🇧🇷,,@crvg_tayane Não foi por causa da poluição foi por causa das queimadas na Amazônia,pt,[],[],[],1,0,0,[],[],https://twitter.com/pedhrios/status/1421625761484709892,False,,0,,,,,,,,"[{'screen_name': 'crvg_tayane', 'name': 'tay tay ✠', 'id': '1081295597615935489'}]",,,,
1421609428604887041,1421603452472512512,2021-07-31 20:11:14 SA Eastern Standard Time,2021-07-31,20:11:14,-0300,1376618433601748995,rosana_indianz,Zana,,"@marcelorubens Deixa a primavera chegar, as queimadas na Amazônia e pantanal vão recomeçar",pt,[],[],[],0,0,0,[],[],https://twitter.com/Rosana_Indianz/status/1421609428604887041,False,,0,,,,,,,,"[{'screen_name': 'marcelorubens', 'name': 'Marcelo Rubens Paiva', 'id': '30117765'}]",,,,
1421599355245563904,1421596533586284544,2021-07-31 19:31:12 SA Eastern Standard Time,2021-07-31,19:31:12,-0300,1381254271912542209,tony67309384,Tony Marcos,,@CNNBrasil Cadê o presidente da França que tava preocupado com as queimadas da Amazônia.  Manuel macron não consegue nem dominar seu país.  😂😂😂😂😂😂😂,pt,[],[],[],0,0,0,[],[],https://twitter.com/Tony67309384/status/1421599355245563904,False,,0,,,,,,,,"[{'screen_name': 'CNNBrasil', 'name': 'CNN Brasil', 'id': '809124436880322561'}]",,,,
1421597972039622656,1421516178757926919,2021-07-31 19:25:43 SA Eastern Standard Time,2021-07-31,19:25:43,-0300,43369451,nunesopedro,"nunes, o pedro",,"@GeneralMourao vergonha para o Br, esse conselho da Amazônia é ridículo e não funciona, não é atoa q estamos batendo recorde nas queimadas, o gov q vc faz parte incentiva grilagem, queimadas, desmatamento, mas a mamata tá garantida né? gov genocida só envergonha o país e destrói nossas riquezas",pt,[],[],[],0,0,0,[],[],https://twitter.com/nunesopedro/status/1421597972039622656,False,,0,,,,,,,,"[{'screen_name': 'GeneralMourao', 'name': 'General Hamilton Mourão', 'id': '1058819604741525510'}]",,,,
1421583332773609475,1421569355159150595,2021-07-31 18:27:32 SA Eastern Standard Time,2021-07-31,18:27:32,-0300,1407660918452928517,excelsiortzx,Excelsior! #Nando3k,,"@Powerpinkill Teu Nick é vadia né bicho, já pensei em alguém transante sarrando rebolando em nome das queimadas na Amazônia",pt,[],[],[],1,0,0,[],[],https://twitter.com/ExcelsiorTzx/status/1421583332773609475,False,,0,,,,,,,,[],,,,
1421492935649079304,1421381293527343105,2021-07-31 12:28:20 SA Eastern Standard Time,2021-07-31,12:28:20,-0300,811915774239580161,fabiobolt,Fábio Gomes,,"@rinaharo Deve ser as queimadas na amazônia, o ecossistema todo esta entrando em colapso. Efeito dominó",pt,[],[],[],0,0,1,[],[],https://twitter.com/fabiobolt/status/1421492935649079304,False,,0,,,,,,,,"[{'screen_name': 'rinaharo', 'name': 'Deise Bueno 🐊 Gundam Girl 🐊', 'id': '51607482'}]",,,,
1421486053094002695,1421486053094002695,2021-07-31 12:00:59 SA Eastern Standard Time,2021-07-31,12:00:59,-0300,2447347574,gorfo_verdades,Gorfando Verdades,,#frio  Aquecimento Global? Queimadas? Desmatamento? Emissão de CO² ?  Queima de combustíveis fósseis? Destruição da Amazônia?,pt,[],[],[],0,0,0,['frio'],[],https://twitter.com/gorfo_verdades/status/1421486053094002695,False,https://twitter.com/bbcbrasil/status/1421240205336584201,0,,,,,,,,[],,,,
1421478383658151943,1421478383658151943,2021-07-31 11:30:31 SA Eastern Standard Time,2021-07-31,11:30:31,-0300,964601809527390208,canalmynews,MyNews,,"“A mudança climática é a pandemia em câmera lenta”, afirma @salnog no #QuintaChamadaCiência. Falamos da pesquisa que mostra que a #Amazônia, por causa do desmatamento e das queimadas, está emitindo mais gás carbônico do que absorvendo. Na íntegra:  https://t.co/na4i3Ay5BY.  https://t.co/CBj2M9jvG1",pt,"[{'screen_name': 'salnog', 'name': 'salvador nogueira 🇧🇷🇺🇳', 'id': '515737611'}]",['https://bit.ly/3BVXBxt'],[],1,8,33,"['quintachamadaciência', 'amazônia']",[],https://twitter.com/CanalMyNews/status/1421478383658151943,False,,1,https://pbs.twimg.com/ext_tw_video_thumb/1421478316842921990/pu/img/1wb8ZXvzo1so-SMs.jpg,,,,,,,[],,,,
1421467344140963849,1421467344140963849,2021-07-31 10:46:39 SA Eastern Standard Time,2021-07-31,10:46:39,-0300,1560797137,tarlouze,#LULA e PonTo final.,,bolsonaro e seus GENOCIDAS de plantão e afins &gt; e o gado em geral  O D E I A  &gt; arte - cultura - livro &gt; enfim &gt; tudo que leva a reflexão . Não se importam com as queimadas - da Amazônia - Cinemateca e outros. VÃO QUEIMAR TUDO Inclusive nós e o Brasil. Quem não se queimar - verá.  https://t.co/a3l5828MAt,pt,[],[],"['https://pbs.twimg.com/media/E7oRAmgXsAsqF4t.png', 'https://pbs.twimg.com/media/E7oRAmkWUAQkLV1.jpg']",0,0,0,[],[],https://twitter.com/tarlouze/status/1421467344140963849,False,,1,https://pbs.twimg.com/media/E7oRAmgXsAsqF4t.png,,,,,,,[],,,,
1421447192355737604,1421447192355737604,2021-07-31 09:26:34 SA Eastern Standard Time,2021-07-31,09:26:34,-0300,1188832442486083584,doguinhofeliz,pedro,,"Este ano, durante o verão, tivemos recordes de temperaturas elevadas. Na minha cidade fez 42 graus. Agora no inverno, depois de 5 meses, foi recorde de temperatura negativa, -1,6 graus.  Teve o desmatamento recorde da Amazônia, as queimadas no pantanal, derramamento de petróleo",pt,[],[],[],1,0,3,[],[],https://twitter.com/doguinhofeliz/status/1421447192355737604,False,,0,,,,,,,,[],,,,
