id,conversation_id,created_at,date,time,timezone,user_id,username,name,place,tweet,language,mentions,urls,photos,replies_count,retweets_count,likes_count,hashtags,cashtags,link,retweet,quote_url,video,thumbnail,near,geo,source,user_rt_id,user_rt,retweet_id,reply_to,retweet_date,translate,trans_src,trans_dest
1187738505839042561,1187738505839042561,2019-10-25 11:31:41 -03,2019-10-25,11:31:41,-0300,22788189,fredypereira,Fredy Pereira,,"Por conta de queimadas e desmatamento, Amazônia deixará de produzir chuva daqui a dois anos, diz pesquisadora  https://t.co/Rch4Evn6vt",pt,[],['https://www.brasil247.com/brasil/por-conta-de-queimadas-e-desmatamento-amazonia-deixara-de-produzir-chuva-daqui-a-dois-anos-diz-pesquisadora#.XbMHSydYnIM.twitter'],[],0,0,0,[],[],https://twitter.com/fredypereira/status/1187738505839042561,False,,0,,,,,,,,[],,,,
1187738448490307584,1187738448490307584,2019-10-25 11:31:27 -03,2019-10-25,11:31:27,-0300,227033563,marcioastrini,Marcio Astrini,,"Certíssimo @jairbolsonaro.  Atuamos contra o desmatamento. No seu gov a destruição da Amazônia disparou. Cobramos medidas sérias sobre o óleo na costa brasileira. Seu ministro brinca nas redes sociais.  Portanto, realmente atrapalhamos. Com muito orgulho   #InimigoDoMeioAmbiente",pt,"[{'screen_name': 'jairbolsonaro', 'name': 'jair m. bolsonaro', 'id': '128372940'}]",[],[],2,15,51,['inimigodomeioambiente'],[],https://twitter.com/MarcioAstrini/status/1187738448490307584,False,https://twitter.com/VEJA/status/1187583074772701189,0,,,,,,,,[],,,,
1187736919544881154,1187736919544881154,2019-10-25 11:25:23 -03,2019-10-25,11:25:23,-0300,1560797137,tarlouze,#LULA e PonTo final.,,"Por conta de queimadas e desmatamento, Amazônia deixará de produzir chuva daqui a dois anos, diz pesquisadora  https://t.co/zkvMMceREj",pt,[],['https://ino.to/XVo5bS4'],[],0,2,1,[],[],https://twitter.com/tarlouze/status/1187736919544881154,False,,0,,,,,,,,[],,,,
1187735346970333185,1187735346970333185,2019-10-25 11:19:08 -03,2019-10-25,11:19:08,-0300,248890506,brasil247,Brasil 247,,"Por conta de queimadas e desmatamento, Amazônia deixará de produzir chuva daqui a dois anos, diz pesquisadora  https://t.co/HmI0g0oFUb",pt,[],['https://www.brasil247.com/brasil/por-conta-de-queimadas-e-desmatamento-amazonia-deixara-de-produzir-chuva-daqui-a-dois-anos-diz-pesquisadora'],[],10,48,80,[],[],https://twitter.com/brasil247/status/1187735346970333185,False,,0,,,,,,,,[],,,,
1187735340053868544,1187735340053868544,2019-10-25 11:19:06 -03,2019-10-25,11:19:06,-0300,3355746328,fiscaldoibama,O FISCAL do IBAMA,,"O efetivo do IBAMA, Infelizmente, é pequeno. Imagine q, em 2019, tivemos que atuar em brumadinho, em combate à fogo, desmatamento na Amazônia e agora óleo! Tem servidor q foi em TODAS TRAGÉDIAS.  Precisamos de ajuda, de voluntários, de ongs, precisamos de UNIÃO, não MENTIRAS!",pt,[],[],[],8,87,448,[],[],https://twitter.com/fiscaldoibama/status/1187735340053868544,False,https://twitter.com/karlaffalcao/status/1187014710740344833,0,,,,,,,,[],,,,
1187733237222825985,1187733237222825985,2019-10-25 11:10:45 -03,2019-10-25,11:10:45,-0300,848495834887061505,apiboficial,Apib Oficial,,"""Nossa sobrevivência está em jogo!” s lideranças indígenas realizaram um ato em Berlim, na Alemanha, onde exigem que as indústrias multinacionais parem de comprar carne e soja ligadas ao desmatamento na Amazônia e no Cerrado brasileiros. Vídeo: @midianinja  https://t.co/VFBUF4Rb7x",pt,"[{'screen_name': 'midianinja', 'name': 'mídia ninja', 'id': '1540034828'}]",['https://youtu.be/2Dkmra7L3yE'],[],0,13,16,[],[],https://twitter.com/ApibOficial/status/1187733237222825985,False,,0,,,,,,,,[],,,,
1187732122288775168,1187732122288775168,2019-10-25 11:06:19 -03,2019-10-25,11:06:19,-0300,49020088,juliocotting,JulioCotting,,Amazônia tem menos queimadas e mais desmatamento após dois meses de missão de combate a incêndios  https://t.co/39mkPc5ZYe,pt,[],['https://glo.bo/2WkLANS'],[],0,0,0,[],[],https://twitter.com/JulioCotting/status/1187732122288775168,False,,0,,,,,,,,[],,,,
1187727134518906882,1187727134518906882,2019-10-25 10:46:30 -03,2019-10-25,10:46:30,-0300,1108123393864462337,18horasnews,18horasnews,,"GLO da Amazônia termina com diminuição de queimadas, mas desmatamento cresce -  https://t.co/X5RYjb8ZkJ #Brasil #18horas  https://t.co/xrUjkGJfqm",pt,[],['http://tinyurl.com/y2nl8b6e'],['https://pbs.twimg.com/media/EHuniLsWwAAlvDo.jpg'],0,0,0,"['brasil', '18horas']",[],https://twitter.com/18horasnews/status/1187727134518906882,False,,1,https://pbs.twimg.com/media/EHuniLsWwAAlvDo.jpg,,,,,,,[],,,,
1187720734358945793,1187720734358945793,2019-10-25 10:21:04 -03,2019-10-25,10:21:04,-0300,54341363,jornaloglobo,Jornal O Globo,,"GLO da Amazônia termina com diminuição de queimadas, mas desmatamento cresce  https://t.co/Ga3HP7Vw5O  https://t.co/0TBhRUJ66f",pt,[],['https://glo.bo/2Wft6OQ'],['https://pbs.twimg.com/media/EHuhtprUYAA7yRP.jpg'],9,18,44,[],[],https://twitter.com/JornalOGlobo/status/1187720734358945793,False,,1,https://pbs.twimg.com/media/EHuhtprUYAA7yRP.jpg,,,,,,,[],,,,
1187698977845792769,1187698977845792769,2019-10-25 08:54:37 -03,2019-10-25,08:54:37,-0300,2372200146,prazeresleandro,Leandro Prazeres,,"Na reportagem de hoje conto que a GLO da Amazônia termina com diminuição de queimadas, mas com aumento do desmatamento.   https://t.co/Xb53dvlcFO",pt,[],['https://oglobo.globo.com/sociedade/glo-da-amazonia-termina-com-diminuicao-de-queimadas-mas-desmatamento-cresce-24041354?utm_source=Twitter&utm_medium=Social&utm_campaign=compartilhar'],[],1,0,4,[],[],https://twitter.com/PrazeresLeandro/status/1187698977845792769,False,,0,,,,,,,,[],,,,
1187683243602173952,1187683243602173952,2019-10-25 07:52:06 -03,2019-10-25,07:52:06,-0300,1162006325607485440,dialogochinopt,Diálogo Chino PT,,"Em um importante projeto em colaboração com @InfoAmazonia, @gufalei rastreia a demanda chinesa por carne ao desmatamento na cidade de Porto Velho, na Amazônia. Leia a reportagem completa aqui  https://t.co/5npEtKXONN Fotos @fabionasciment_ Mapa interativo por @jumoriana @bwstefano  https://t.co/XiQbwbt7p0",pt,"[{'screen_name': 'infoamazonia', 'name': 'infoamazonia', 'id': '518749094'}, {'screen_name': 'gufalei', 'name': 'gustavo faleiros', 'id': '20600212'}, {'screen_name': 'fabionasciment_', 'name': 'fábio nascimento', 'id': '841441207507120128'}, {'screen_name': 'jumoriana', 'name': 'juliana mori', 'id': '282235636'}, {'screen_name': 'bwstefano', 'name': 'stefano wrobleski', 'id': '3237710493'}]",['https://bit.ly/2JgJTM8'],"['https://pbs.twimg.com/media/EHt_mRaWsAI0uf3.jpg', 'https://pbs.twimg.com/media/EHt_mv8WoAcEsQN.jpg', 'https://pbs.twimg.com/media/EHt_m-gX0AIk9Lx.jpg', 'https://pbs.twimg.com/media/EHt_nNkXUAYQAo1.jpg']",0,3,10,[],[],https://twitter.com/DialogoChinoPT/status/1187683243602173952,False,,1,https://pbs.twimg.com/media/EHt_mRaWsAI0uf3.jpg,,,,,,,[],,,,
1187680982146703360,1187680982146703360,2019-10-25 07:43:06 -03,2019-10-25,07:43:06,-0300,732730857123926016,noticias_ro,Jornal Notícias RO,,"O Ministério Público Federal criou em agosto de 2018 a Força-tarefa Amazônia, formada para atuar no combate à mineração ilegal, ao desmatamento, à grilagem de terras públicas, à violência agrária e ao tráfico de animais silvestres na Amazônia.  https://t.co/HHYgXBYzUw",pt,[],['http://www.noticiasro.com.br/Noticias/Exibir/36441'],[],0,0,0,[],[],https://twitter.com/noticias_ro/status/1187680982146703360,False,,0,,,,,,,,[],,,,
1187586005446119425,1187584168957493248,2019-10-25 01:25:42 -03,2019-10-25,01:25:42,-0300,1109650409902276608,diariodanovaera,Diário da Nova Era 📰,,Desmatamento da Amazonia Leva a aumento dos casos de malaria.  https://t.co/0pI2FMfiX0,pt,[],['https://www.pnas.org/content/early/2019/10/08/1905315116'],[],1,2,2,[],[],https://twitter.com/diariodanovaera/status/1187586005446119425,False,,0,,,,,,,,[],,,,
1187576660729708544,1187575286201802752,2019-10-25 00:48:34 -03,2019-10-25,00:48:34,-0300,2985293351,luznofimdocu,cruella bissexual,,além da agropecuária ser uma das principais causas do desmatamento na Amazônia porque não basta só jogar gases poluentes tem que acabar com o que pode controlar isso para ferrar o planeta de vez,pt,[],[],[],0,0,0,[],[],https://twitter.com/luznofimdocu/status/1187576660729708544,False,,0,,,,,,,,[],,,,
1187571811833319424,1187571811833319424,2019-10-25 00:29:18 -03,2019-10-25,00:29:18,-0300,170002542,pafranco2005,"SOCIEDADE SUSTENTÁVEL - Siga-nos, que te seguimos.",,"Se a atual taxa de desmatamento na Amazônia não for reduzida, a maior floresta do mundo corre o risco de atingir um  ""ponto de virada""  em dois anos, após o qual não será capaz de gerar chuvas suficientes para sustentar sua existência.  https://t.co/GUlaaMOXw4  https://t.co/eAlGSwuv5u",pt,[],['https://actualidad.rt.com/actualidad/331414-experta-advertir-desforestacion-amazonia'],['https://pbs.twimg.com/media/EHsaQixWsAABV_S.jpg'],0,0,0,[],[],https://twitter.com/pafranco2005/status/1187571811833319424,False,,1,https://pbs.twimg.com/media/EHsaQixWsAABV_S.jpg,,,,,,,[],,,,
1187556260700401664,1187532365847040006,2019-10-24 23:27:30 -03,2019-10-24,23:27:30,-0300,95554169,well_pds,Wellington Santos 🇾🇪,,"@CarlosPort ...Não é de se estranhar, já q eles estão lutando contra a distorção e omissão de informações que o Bolsonaro e subordinados tem tentado fazer. Mas se vc q é um cara informado, apoia iniciativas de um governo q apoia o desmatamento da Amazônia em prol do garimpo, fazer o q né?!",pt,[],[],[],1,0,0,[],[],https://twitter.com/Well_PdS/status/1187556260700401664,False,,0,,,,,,,,"[{'screen_name': 'CarlosPort', 'name': 'Carlos Port 🇧🇷', 'id': '52031618'}]",,,,
1187550237377908738,1187550237377908738,2019-10-24 23:03:34 -03,2019-10-24,23:03:34,-0300,3335680785,limasdw,mari 💛🐇,,"É interessante pensar sobre como consumir soja contribui para o desmatamento na amazonia e para a monocultura, que acaba gerando consequências na alimentação da população e só alimenta o agronegócio.",pt,[],[],[],1,1,1,[],[],https://twitter.com/limasdw/status/1187550237377908738,False,,0,,,,,,,,[],,,,
1187548375081766912,1187406485195821056,2019-10-24 22:56:10 -03,2019-10-24,22:56:10,-0300,1092148373371670528,moleraboy,Matheus Brandão,,"@rsallesmma Tem umas coincidências na vida bizarras... tipo depois de você assumir a pasta do meio ambiente, o desmatamento e queimadas na Amazônia crescerem vertiginosamente, essas coincidências...",pt,[],[],[],0,0,0,[],[],https://twitter.com/MoleraBoy/status/1187548375081766912,False,,0,,,,,,,,"[{'screen_name': 'rsallesmma', 'name': 'Ricardo Salles', 'id': '971822131024748545'}]",,,,
1187516709789241344,1187516709789241344,2019-10-24 20:50:21 -03,2019-10-24,20:50:21,-0300,336104350,portaldbo,Portal DBO,,Mais de 97% dos produtores rurais da Amazônia não participam do desmatamento e estão ameaçados de extinção.   https://t.co/VxikiRembK,pt,[],['https://www.portaldbo.com.br/dez-fatos-e-mitos-sobre-pequenos-produtores-e-vegetacao-nativa-na-amazonia/'],[],0,1,1,[],[],https://twitter.com/portaldbo/status/1187516709789241344,False,,0,,,,,,,,[],,,,
1187481300002721792,1187481300002721792,2019-10-24 18:29:38 -03,2019-10-24,18:29:38,-0300,54083818,belamegale,Bela Megale,,"Em operação de combate ao desmatamento na Amazônia, PF apreende 36 caminhões de madeira ilegal em área próxima à terra indígena do Pará.   https://t.co/xqhJdYWpXR",pt,[],['https://blogs.oglobo.globo.com/bela-megale/post/pf-apreende-37-caminhoes-de-madeira-ilegal-em-regiao-de-terra-indigena-no-para.html?utm_source=Twitter&utm_medium=Social&utm_campaign=compartilhar'],[],0,2,12,[],[],https://twitter.com/BelaMegale/status/1187481300002721792,False,,0,,,,,,,,[],,,,
1187471890115256326,1187440963620352003,2019-10-24 17:52:15 -03,2019-10-24,17:52:15,-0300,36336107,obsclima,"Observatório do Clima, 19 anos",,@vinnybrandt Desmatamento e queimadas. Foram duas na Amazônia.,pt,[],[],[],2,6,163,[],[],https://twitter.com/obsclima/status/1187471890115256326,False,,0,,,,,,,,"[{'screen_name': 'vinnybrandt', 'name': 'Vinícius Sacramento 🎙️', 'id': '221402775'}]",,,,
1187460460838174722,1187406485195821056,2019-10-24 17:06:50 -03,2019-10-24,17:06:50,-0300,29518945,dagowberto,Bobby,,@rsallesmma Também deve ser coincidência que tanto o fogo/desmatamento na Amazônia e o vazamento de óleo favorecem a pecuária,pt,[],[],[],0,0,0,[],[],https://twitter.com/dagowberto/status/1187460460838174722,False,,0,,,,,,,,"[{'screen_name': 'rsallesmma', 'name': 'Ricardo Salles', 'id': '971822131024748545'}]",,,,
1187457829214609415,1187457829214609415,2019-10-24 16:56:23 -03,2019-10-24,16:56:23,-0300,926625466236235777,barbsou1347,____________Barbosa,,Impedir o desmatamento e exploração da Amazônia! - Assine a petição!  https://t.co/mdNH7hlidr via @change_br,pt,"[{'screen_name': 'change_br', 'name': 'change.org brasil #luteemcasa', 'id': '900348469'}]",['http://chng.it/6JdTzkbD'],[],0,0,0,[],[],https://twitter.com/Barbsou1347/status/1187457829214609415,False,,0,,,,,,,,[],,,,
1187455807723577344,1187406485195821056,2019-10-24 16:48:21 -03,2019-10-24,16:48:21,-0300,2456938808,brasjs,José Brasil,,"@rsallesmma Ah... aí já é deboche né ministro?  Mas vamos lá tentar montar o quebra cabeça e revelar a teoria da conspiração internacional, segundo a órbita do sol em torno da terra: Greenpeace derramou óleo no mar para desviar a atenção das queimadas e desmatamento da Amazonia. Acertei???",pt,[],[],[],0,1,2,[],[],https://twitter.com/brasjs/status/1187455807723577344,False,,0,,,,,,,,"[{'screen_name': 'rsallesmma', 'name': 'Ricardo Salles', 'id': '971822131024748545'}]",,,,
1187440731461443584,1187440731461443584,2019-10-24 15:48:26 -03,2019-10-24,15:48:26,-0300,925164032298049537,marciacarmona8,Marcia Carmona,,Impedir o desmatamento e exploração da Amazônia! - Assine a petição!  https://t.co/f8nicwFWG1 via @change_br,pt,"[{'screen_name': 'change_br', 'name': 'change.org brasil #luteemcasa', 'id': '900348469'}]",['http://chng.it/vsVPJW7V'],[],0,0,0,[],[],https://twitter.com/MarciaCarmona8/status/1187440731461443584,False,,0,,,,,,,,[],,,,
1187433366129434624,1187433361687695361,2019-10-24 15:19:10 -03,2019-10-24,15:19:10,-0300,3325338610,odara_10,🇧🇷🇧🇷🚩Lula é amor 🚩🇧🇷🇧🇷🇵🇸🇵🇸,,".... como tem feito com as estatísticas alarmantes do desmatamento da Amazônia. O Brasil está nas mãos deste perverso, que reúne ao seu redor outros perversos e alguns oportunistas. Submetidos a um cotidiano dominado pela autoverdade, fenômeno que converte a verdade numa ... +",pt,[],[],[],1,0,0,[],[],https://twitter.com/Odara_10/status/1187433366129434624,False,,0,,,,,,,,[],,,,
1187426018686046208,1187426018686046208,2019-10-24 14:49:58 -03,2019-10-24,14:49:58,-0300,840700156962078721,phillipeburgos,Burgos,,Só vai piorar com o desmatamento da Amazônia,pt,[],[],[],0,0,0,[],[],https://twitter.com/PhillipeBurgos/status/1187426018686046208,False,https://twitter.com/recifeordinario/status/1187425039332888576,0,,,,,,,,[],,,,
1187419248236400641,1187416723328327681,2019-10-24 14:23:04 -03,2019-10-24,14:23:04,-0300,1153235874206928896,luiscla06629147,Luis_Ramos 🇧🇷🇧🇷🇧🇷,,"@cesaraasantana @folha Nós governos anteriores o Brasil era a maior economia do mundo, todo mundo era rico, não existia fome, cada pessoa tinha seu próprio caixa eletrônico, não existia desmatamento e a Amazônia era totalmente virgem, e índios eram os únicos moradores. Era o paraíso (para ladrões).",pt,[],[],[],0,0,1,[],[],https://twitter.com/LuisCla06629147/status/1187419248236400641,False,,0,,,,,,,,"[{'screen_name': 'cesaraasantana', 'name': 'César Augusto 🇧🇷🇧🇷🇧🇷', 'id': '772095840676610048'}, {'screen_name': 'folha', 'name': 'Folha de S.Paulo', 'id': '14594813'}]",,,,
1187414458961924096,1187406485195821056,2019-10-24 14:04:02 -03,2019-10-24,14:04:02,-0300,80719161,joankaio,JK 🪙,,"@rsallesmma São fatos que coincidem também: queimadas ilegais na Amazônia, dados do desmatamento florestal, candidatos e servidores laranjas, crimes envolvendo milícias físicas e virtuais e a grande leva de fake news. O Ministro deveria ser pontual em resoluções, e não em insinuações.",pt,[],[],[],0,0,0,[],[],https://twitter.com/joankaio/status/1187414458961924096,False,,0,,,,,,,,"[{'screen_name': 'rsallesmma', 'name': 'Ricardo Salles', 'id': '971822131024748545'}]",,,,
1187394385446604801,1187046871614873600,2019-10-24 12:44:16 -03,2019-10-24,12:44:16,-0300,1110897855621939200,eliascarneiroj2,Um gordinho carente😉,,"@jairbolsonaro E um tempo de 30 minutos, falaram sobre o desenvolvimento ou o Desmatamento da Amazônia? Ou ele falou sobre seus filhos? As merdas que vem fazendo, pq esse príncipe aí👆 tá mais para princesa 😂😂😂😂😂😂 E uma coisa ele (a) muito educado Porém a sua pessoa🤔🤔🤔🤔🤔🤔🤔",pt,[],[],[],0,0,0,[],[],https://twitter.com/EliasCarneiroJ2/status/1187394385446604801,False,,0,,,,,,,,"[{'screen_name': 'jairbolsonaro', 'name': 'Jair M. Bolsonaro', 'id': '128372940'}]",,,,
1187392061466726400,1187392061466726400,2019-10-24 12:35:02 -03,2019-10-24,12:35:02,-0300,715522368039428097,elizangela79ros,Elizangela Rosa,,Impedir o desmatamento e exploração da Amazônia! - Assine a petição!  https://t.co/NdwavEUXdX via @change_br,pt,"[{'screen_name': 'change_br', 'name': 'change.org brasil #luteemcasa', 'id': '900348469'}]",['http://chng.it/sdLkffcS'],[],0,0,0,[],[],https://twitter.com/elizangela79ros/status/1187392061466726400,False,,0,,,,,,,,[],,,,
1187385026909999104,1187385026909999104,2019-10-24 12:07:05 -03,2019-10-24,12:07:05,-0300,1162006325607485440,dialogochinopt,Diálogo Chino PT,,"O que o censo de cabeças de gado do @ibgecomunica nos diz sobre exportações de carne para a China e o aumento do desmatamento para a Amazônia brasileira?  Em uma parceria com o @infoamazonia, @gufalei, @fabionasciment_ e @jumoriana mapearam os dados aqui:  https://t.co/5npEtKXONN  https://t.co/3neYSsEhgx",pt,"[{'screen_name': 'ibgecomunica', 'name': 'ibge comunica', 'id': '164779867'}, {'screen_name': 'infoamazonia', 'name': 'infoamazonia', 'id': '518749094'}, {'screen_name': 'gufalei', 'name': 'gustavo faleiros', 'id': '20600212'}, {'screen_name': 'fabionasciment_', 'name': 'fábio nascimento', 'id': '841441207507120128'}, {'screen_name': 'jumoriana', 'name': 'juliana mori', 'id': '282235636'}]",['https://bit.ly/2JgJTM8'],['https://pbs.twimg.com/tweet_video_thumb/EHpwYAxWwAE4aEC.jpg'],0,4,5,[],[],https://twitter.com/DialogoChinoPT/status/1187385026909999104,False,,1,https://pbs.twimg.com/tweet_video_thumb/EHpwYAxWwAE4aEC.jpg,,,,,,,[],,,,
1187384201215131648,1187384201215131648,2019-10-24 12:03:48 -03,2019-10-24,12:03:48,-0300,1917010604,nerea_0209,Nerea,,Impedir o desmatamento e exploração da Amazônia! - ¡Firma la petición!  https://t.co/xjmsPC5BT0 vía @change_es,pt,"[{'screen_name': 'change_es', 'name': 'change.org españa', 'id': '134857150'}]",['http://chng.it/rLnYqgZM'],[],0,0,0,[],[],https://twitter.com/nerea_0209/status/1187384201215131648,False,,0,,,,,,,,[],,,,
1187368467441377282,1187368467441377282,2019-10-24 11:01:17 -03,2019-10-24,11:01:17,-0300,46517696,_ary_martins,Ary Martins,,Programas monitoram o desmatamento na Amazônia  https://t.co/HojI5JFZoB via @PesquisaFapesp,pt,"[{'screen_name': 'pesquisafapesp', 'name': 'pesquisafapesp', 'id': '17465506'}]",['https://youtu.be/Ki_wug5pYxo'],[],0,0,0,[],[],https://twitter.com/_ary_martins/status/1187368467441377282,False,,0,,,,,,,,[],,,,
1187366221391499264,1187347702666989568,2019-10-24 10:52:22 -03,2019-10-24,10:52:22,-0300,45252060,adrianopacheco,Jesus Lord DONDA,,@talktoleu Ironizando aquela menina que discursou na ONU sobre o desmatamento na Amazônia,pt,[],[],[],0,0,0,[],[],https://twitter.com/adrianopacheco/status/1187366221391499264,False,,0,,,,,,,,[],,,,
1187345756623179776,1187345756623179776,2019-10-24 09:31:02 -03,2019-10-24,09:31:02,-0300,1036980550492479488,infoamazoniabr,InfoAmazonia Brasil,,"Parceria do InfoAmazonia com o @DialogoChinoPT   China compra carne brasileira ligada a risco de desmatamento Gado na Amazônia tem um crescimento de 22%, comparado a 4% na média do país em 15 anos, como mostra o novo mapa da pecuária no Brasil   https://t.co/YwK09MwWDG  #Amazonia  https://t.co/279llnxRzm",pt,"[{'screen_name': 'dialogochinopt', 'name': 'diálogo chino pt', 'id': '1162006325607485440'}]",['https://dialogochino.net/31057-chinas-brazilian-beef-demand-linked-to-amazon-deforestation-risk/?lang=pt-br'],['https://pbs.twimg.com/media/EHpMkt3XkAIEm0z.jpg'],0,13,8,['amazonia'],[],https://twitter.com/InfoAmazoniaBR/status/1187345756623179776,False,,1,https://pbs.twimg.com/media/EHpMkt3XkAIEm0z.jpg,,,,,,,[],,,,
1187344083511066630,1187135708965810176,2019-10-24 09:24:23 -03,2019-10-24,09:24:23,-0300,958026889284739073,dbora10gomes,Xavier G,,@GreenpeaceBR Que palhaçada! sempre houve desmatamento na Amazônia e nunca ninguém se manifestou. Vcs querem jogar na conta do governo atual o que sempre aconteceu. Sobre o óleo conversar lá com amiguinhos do chefe da facção criminosa luladrão.. Vai desenformar outro!😠,pt,[],[],[],0,0,1,[],[],https://twitter.com/Dbora10Gomes/status/1187344083511066630,False,,0,,,,,,,,"[{'screen_name': 'GreenpeaceBR', 'name': 'Greenpeace Brasil', 'id': '16334137'}]",,,,
1187343303643193344,1187046871614873600,2019-10-24 09:21:18 -03,2019-10-24,09:21:18,-0300,1617902773,simonisolange,Solange Simoni 🇧🇷🇧🇷,,"@FelipeNog03 @PsychoHelder @jairbolsonaro quem vive onde tem conforto,acha q moradores da amazônia tem viver como massa de manobra de grileiros, garimpos clandestinos e madeireiras, essas sim promovem desmatamento e destruição, desenvolvimento com preservação sim, é possível",pt,[],[],[],1,0,3,[],[],https://twitter.com/SimoniSolange/status/1187343303643193344,False,,0,,,,,,,,"[{'screen_name': 'FelipeNog03', 'name': 'Felipe Nogueira🇧🇷 🇮🇹', 'id': '4890687328'}, {'screen_name': 'PsychoHelder', 'name': 'Psychos Olderius', 'id': '2400534750'}, {'screen_name': 'jairbolsonaro', 'name': 'Jair M. Bolsonaro', 'id': '128372940'}]",,,,
1187331911284416513,1187314930208464897,2019-10-24 08:36:01 -03,2019-10-24,08:36:01,-0300,2731307878,aviadorcascavel,Bob Ksk🐍🇧🇷. Bolsonaro 2022,,@CarlosBolsonaro @MInfraestrutura @tarcisiogdf Quando vão montar uma força tarefa com as forças armadas e fazer uma varredura na Amazônia para acabar com desmatamento e garimpo ilegal??? Desce o chumbo nessa raça que está destruindo tudo???!!!,pt,[],[],[],0,0,0,[],[],https://twitter.com/AviadorCascavel/status/1187331911284416513,False,,0,,,,,,,,"[{'screen_name': 'CarlosBolsonaro', 'name': 'Carlos Bolsonaro', 'id': '68712576'}, {'screen_name': 'MInfraestrutura', 'name': 'Ministério da Infraestrutura', 'id': '523331076'}, {'screen_name': 'tarcisiogdf', 'name': 'Tarcísio Gomes de Freitas', 'id': '1078618844007157761'}]",,,,
1187328388345876481,1187328388345876481,2019-10-24 08:22:01 -03,2019-10-24,08:22:01,-0300,35227862,horacioccosta,Horacio C. Costa,,Desmatamento na Amazônia com dados do #IMPE e cientistas internacionais contestados pelo ministério do #meioambiente em especial pelo...  https://t.co/UgxZ41cito,pt,[],['https://oglobo.globo.com/sociedade/desmatamento-no-brasil-23843126?utm_source=Facebook&utm_medium=Social&utm_campaign=compartilhar'],[],0,0,0,"['impe', 'meioambiente']",[],https://twitter.com/horacioccosta/status/1187328388345876481,False,,0,,,,,,,,[],,,,
1187321241465741312,1187321241465741312,2019-10-24 07:53:37 -03,2019-10-24,07:53:37,-0300,2699329674,raquel20ana,Ana Raquel Barreto,,"Pensem bem: esse ano perdemos pessoas importantes para algumas áreas de atuação, além do aumento do desmatamento na Amazônia, prejuízos às praias do nordeste por vazamento de óleo, e o ano ainda não acabou! Nem citei as inúmeras babaquices de pessoas com visibilidade. #2019",pt,[],[],[],0,0,0,[],[],https://twitter.com/Raquel20Ana/status/1187321241465741312,False,,0,,,,,,,,[],,,,
1187242420326420481,1187242420326420481,2019-10-24 02:40:25 -03,2019-10-24,02:40:25,-0300,883697325188763648,julia_antonini,Tia Chica,,Comecei a ver um vídeo do desmatamento da Amazônia e to chorando horrores,pt,[],[],[],0,0,0,[],[],https://twitter.com/julia_antonini/status/1187242420326420481,False,,0,,,,,,,,[],,,,
1187162079419088896,1187007777941676032,2019-10-23 21:21:10 -03,2019-10-23,21:21:10,-0300,64248422,jj1002jj,Jimmy Olsen,,@OpusckiSulains @folha E depois reclamam do desmatamento da Amazônia e da crise da água. Desperdício de alimentos e água!!,pt,[],[],[],0,0,0,[],[],https://twitter.com/jj1002jj/status/1187162079419088896,False,,0,,,,,,,,"[{'screen_name': 'folha', 'name': 'Folha de S.Paulo', 'id': '14594813'}]",,,,
1187148273146105862,1187135708965810176,2019-10-23 20:26:19 -03,2019-10-23,20:26:19,-0300,436152321,fabianossantana,FabianoSSantana,,"@GreenpeaceBR inúteis e mentirosos! Oleo Venezuelano e nao protestam contra o Governo venezuelano; no Brasil, nao ajudam no recolhimento do oleo e ainda fazem uma encenacao ridicula; na amazonia, o Governo esta atuando contra o desmatamento e vcs mentem novamente.  Esquerdistas Imbecis!!!",pt,[],[],[],0,0,0,[],[],https://twitter.com/FabianoSSantana/status/1187148273146105862,False,,0,,,,,,,,"[{'screen_name': 'GreenpeaceBR', 'name': 'Greenpeace Brasil', 'id': '16334137'}]",,,,
