id,conversation_id,created_at,date,time,timezone,user_id,username,name,place,tweet,language,mentions,urls,photos,replies_count,retweets_count,likes_count,hashtags,cashtags,link,retweet,quote_url,video,thumbnail,near,geo,source,user_rt_id,user_rt,retweet_id,reply_to,retweet_date,translate,trans_src,trans_dest
1230267907365572608,1230267907365572608,2020-02-19 20:08:21 -03,2020-02-19,20:08:21,-0300,1041835993106669569,elisams9,🇧🇷Elisa🇧🇷,,Era só o que faltava! Deputados manobram para ampliar desmatamento na Amazônia. Click e leia a matéria  https://t.co/N3wJD5KHMU  https://t.co/jFm5AmBv4i,pt,[],['https://www.otaviosaleitao.com.br/noticias/7ob0l-era-so-o-que-faltava-deputados-manobram-para-ampliar-desmatamento-na-amazonia-click-e-leia-a-materia'],"['https://pbs.twimg.com/media/ERLAggBW4AEypka.jpg', 'https://pbs.twimg.com/media/ERLAhbUW4AEwDik.jpg', 'https://pbs.twimg.com/media/ERLKHaUXkAE_-FG.jpg', 'https://pbs.twimg.com/media/ERLKItuXUAEnku3.jpg']",1,0,3,[],[],https://twitter.com/ElisaMS9/status/1230267907365572608,False,,1,https://pbs.twimg.com/media/ERLAggBW4AEypka.jpg,,,,,,,[],,,,
1230253245307768832,1230163682992283648,2020-02-19 19:10:05 -03,2020-02-19,19:10:05,-0300,1229089978766053376,rakaneboy,Rakan E-boy,,@NautilusAmigo @pykevingativo F de fresh e D de Desmatamento na Amazônia (fogo),pt,[],[],[],0,0,1,[],[],https://twitter.com/RakanEboy/status/1230253245307768832,False,,0,,,,,,,,[],,,,
1230248386382696454,1230248386382696454,2020-02-19 18:50:46 -03,2020-02-19,18:50:46,-0300,169140026,roberto_ssantos,Roberto Santos,,Diretor do Ministério da Economia diz que governo tem que coibir desmatamento ilegal na Amazônia   https://t.co/Z9u2KfURsg  https://t.co/YO1tEhBfEa,pt,[],['http://www.blogdorobertosantos.com.br/diretor-do-ministerio-da-economia-diz-que-governo-tem-que-coibir-desmatamento-ilegal-na-amazonia%e2%80%a8/'],['https://pbs.twimg.com/media/ERK4Y0ZWoAAJnYp.jpg'],0,0,0,[],[],https://twitter.com/Roberto_SSANTOS/status/1230248386382696454,False,,1,https://pbs.twimg.com/media/ERK4Y0ZWoAAJnYp.jpg,,,,,,,[],,,,
1230235108558475264,1230235108558475264,2020-02-19 17:58:01 -03,2020-02-19,17:58:01,-0300,58811453,greenpeacerj,Grupo de Voluntários,,"Entenda o que está em jogo com a #MPdaGrilagem, que pode favorecer os invasores de terras públicas e aumentar o desmatamento e a destruição da Amazônia.  https://t.co/A6hqpuAUQv  https://t.co/6mOGSH0TVp",pt,[],['https://act.gp/2ugqjLE'],[],0,0,2,['mpdagrilagem'],[],https://twitter.com/GreenpeaceRJ/status/1230235108558475264,False,,1,https://pbs.twimg.com/media/ERJd-ktWoAEkTlk.jpg,,,,,,,[],,,,
1230231700917059587,1230231700917059587,2020-02-19 17:44:28 -03,2020-02-19,17:44:28,-0300,1002637310180110336,ti_interbr,Transparência Internacional - Brasil,,"“O desmatamento vem mudando de perfil. Agora temos praticamente institucionalizado o roubo de patrimônio público. Estamos sendo como sociedade roubados no que temos de mais precioso, a floresta amazônica”, alerta Paulo Moutinho, diretor do @IPAM_Amazonia. #CorrupçãoDesmata",pt,"[{'screen_name': 'ipam_amazonia', 'name': 'ipam_amazônia', 'id': '67302940'}]",[],[],1,18,33,['corrupçãodesmata'],[],https://twitter.com/TI_InterBr/status/1230231700917059587,False,,0,,,,,,,,[],,,,
1230230871157936129,1230154502793256962,2020-02-19 17:41:10 -03,2020-02-19,17:41:10,-0300,50846546,bigatounesp,comunista de iphone🇨🇳🇨🇺🇻🇪🇺🇸,,"@guilhermedm19 Eu parei durante minha viagem para Amazônia. Em Alter do Chão eu fiz 4 horas de voo com um amigo que trabalha com sensoriamento remoto, depois de ver tanto desmatamento para pasto tomei a decisão de parar. Já são 8 meses sem carne",pt,[],[],[],1,0,2,[],[],https://twitter.com/Bigatounesp/status/1230230871157936129,False,,0,,,,,,,,"[{'screen_name': 'guilhermedm19', 'name': 'Guilherme', 'id': '1110246853700960256'}]",,,,
1230225912718856192,1230162488064401409,2020-02-19 17:21:28 -03,2020-02-19,17:21:28,-0300,67302940,ipam_amazonia,IPAM_Amazônia,,"Existem 2,3 milhões já desmatados em florestas públicas não-designadas também com CAR na Amazônia. Representa 90% do desmatamento registrado nessas áreas devolutas. #SejaLegalcomaAmazônia",pt,[],[],[],1,1,9,['sejalegalcomaamazônia'],[],https://twitter.com/IPAM_Amazonia/status/1230225912718856192,False,,0,,,,,,,,[],,,,
1230223131631067142,1230162488064401409,2020-02-19 17:10:25 -03,2020-02-19,17:10:25,-0300,67302940,ipam_amazonia,IPAM_Amazônia,,"@MPF_AM @MPF_AP @fiscaldoibama @brasil_IBAMA Existe, dentro da Amazônia, uma área equivalente à da França como florestas públicas não-designadas. É patrimônio de toda a população brasileira - e é o alvo preferencial de grileiros. Em 2019, 27% do desmatamento aconteceu ali. #SejaLegalcomaAmazônia",pt,[],[],[],1,2,12,['sejalegalcomaamazônia'],[],https://twitter.com/IPAM_Amazonia/status/1230223131631067142,False,,0,,,,,,,,"[{'screen_name': 'MPF_AM', 'name': 'MPF_AM', 'id': '101827352'}, {'screen_name': 'MPF_AP', 'name': 'MPF no Amapá', 'id': '150733706'}, {'screen_name': 'fiscaldoibama', 'name': 'O FISCAL do IBAMA', 'id': '3355746328'}, {'screen_name': 'brasil_IBAMA', 'name': 'IBAMA', 'id': '38790549'}]",,,,
1230221380240781314,1230221380240781314,2020-02-19 17:03:28 -03,2020-02-19,17:03:28,-0300,44885304,blogdoestado,Miguel Oliveira,,"Desmatamento na Amazônia sobe em janeiro, diz Imazon  https://t.co/DTvBsdMdMJ via @oestadonet",pt,"[{'screen_name': 'oestadonet', 'name': 'o estado net', 'id': '1290083317'}]",['https://www.oestadonet.com.br/noticia/16093/desmatamento-na-amazonia-sobe-em-janeiro-diz-imazon/'],[],0,0,0,[],[],https://twitter.com/BlogdoEstado/status/1230221380240781314,False,,0,,,,,,,,[],,,,
1230220937364201472,1230220937364201472,2020-02-19 17:01:42 -03,2020-02-19,17:01:42,-0300,721102070825283584,niloeustaquiom1,Nilo Eustáquio Morei,,Câmara prepara votação de MP que aumenta desmatamento na Amazônia  https://t.co/QmHtPLbvbn,pt,[],['https://www.redebrasilatual.com.br/ambiente/2020/02/camara-prepara-votacao-de-mp-que-aumenta-desmatamento-na-amazonia/'],[],0,0,0,[],[],https://twitter.com/niloeustaquiom1/status/1230220937364201472,False,,0,,,,,,,,[],,,,
1230220701778481153,1230220701778481153,2020-02-19 17:00:46 -03,2020-02-19,17:00:46,-0300,27703690,samiabomfim,Sâmia Bomfim,,"Depois de desproteger a floresta, atacar os índios, anistiar o desmatamento e apoiar a grilagem, Bolsonaro agora quer vender florestas na Amazônia. É um atentado sem precedentes ao nosso país. Não podemos permitir mais desmandos. #ForaBolsonaro   https://t.co/C1bd0xoiFd",pt,[],['https://www1.folha.uol.com.br/mercado/2020/02/governo-autoriza-concessao-de-florestas-da-regiao-amazonica-a-iniciativa-privada.shtml?utm_source=twitter&utm_medium=social&utm_campaign=twfolha'],[],79,344,1234,['forabolsonaro'],[],https://twitter.com/samiabomfim/status/1230220701778481153,False,,0,,,,,,,,[],,,,
1230218893878317056,1230162488064401409,2020-02-19 16:53:35 -03,2020-02-19,16:53:35,-0300,67302940,ipam_amazonia,IPAM_Amazônia,,"@MPF_AM @MPF_AP @fiscaldoibama A venda de uma única árvore na Amazônia financia o desmatamento de um hectare, diz René de Oliveira, coordenador-geral de Fiscalização Ambiental do @brasil_IBAMA. ""Imagina que há 20, 30 árvores por hectare que podem ser vendidas.""",pt,"[{'screen_name': 'brasil_ibama', 'name': 'ibama', 'id': '38790549'}]",[],[],1,2,5,[],[],https://twitter.com/IPAM_Amazonia/status/1230218893878317056,False,,0,,,,,,,,"[{'screen_name': 'MPF_AM', 'name': 'MPF_AM', 'id': '101827352'}, {'screen_name': 'MPF_AP', 'name': 'MPF no Amapá', 'id': '150733706'}, {'screen_name': 'fiscaldoibama', 'name': 'O FISCAL do IBAMA', 'id': '3355746328'}]",,,,
1230215586833195013,1230162488064401409,2020-02-19 16:40:26 -03,2020-02-19,16:40:26,-0300,67302940,ipam_amazonia,IPAM_Amazônia,,"@MPF_AM @MPF_AP ""A gente tem a tecnologia para mostrar onde está ocorrendo o desmatamento. Falta gente para ir lá. Precisamos de dezenas, centenas de fiscais trabalhando com isso.” #SejaLegalcomaAmazônia. @fiscaldoibama",pt,"[{'screen_name': 'fiscaldoibama', 'name': 'o fiscal do ibama', 'id': '3355746328'}]",[],[],1,3,7,['sejalegalcomaamazônia'],[],https://twitter.com/IPAM_Amazonia/status/1230215586833195013,False,,0,,,,,,,,"[{'screen_name': 'MPF_AM', 'name': 'MPF_AM', 'id': '101827352'}, {'screen_name': 'MPF_AP', 'name': 'MPF no Amapá', 'id': '150733706'}]",,,,
1230214898547929089,1230203298067685380,2020-02-19 16:37:42 -03,2020-02-19,16:37:42,-0300,866398193197752320,aimcmoreira,ANA MOURA,,"@ConversaAfiada Desde que o Bolsonaro começou a sua campanha com esse discurso de ataque às ONGs, isso começou a gerar a sensação de impunidade. Não à toa, os assassinatos aumentaram, o desmatamento, as queimadas aumentaram significativamente na Amazônia  https://t.co/u6e9Gl291q",pt,[],['https://br2pontos.com.br/nacional/filha-de-chico-mendes-lamenta-retorica-belicosa-de-bolsonaro-mata-ambientalistas-e-vulneraveis/'],[],0,0,0,[],[],https://twitter.com/aimcmoreira/status/1230214898547929089,False,,0,,,,,,,,"[{'screen_name': 'ConversaAfiada', 'name': 'TV Afiada', 'id': '17229791'}]",,,,
1230209239450345475,1230209239450345475,2020-02-19 16:15:13 -03,2020-02-19,16:15:13,-0300,1168518600069660672,coalizao_brasil,"Coalizão Brasil Clima, Florestas e Agricultura",,"Hoje, seminário “Amazônia: desmatamento, crime organizado e corrupção”, promovido pela Câmara de Meio Ambiente e Patrimônio Cultural do Ministério Público Federal (4CCR/MPF), viabilizado pela @TI_InterBr, com a campanha #SejaLegalcomaAmazônia, apoiada pela @coalizaobrasil.  https://t.co/8Clg8aBJhJ",pt,"[{'screen_name': 'ti_interbr', 'name': 'transparência internacional - brasil', 'id': '1002637310180110336'}, {'screen_name': 'coalizaobrasil', 'name': 'c.o.b.r.a', 'id': '99493219'}]",[],['https://pbs.twimg.com/media/ERKUyA8WoAAM4rg.jpg'],0,0,1,['sejalegalcomaamazônia'],[],https://twitter.com/coalizao_brasil/status/1230209239450345475,False,,1,https://pbs.twimg.com/media/ERKUyA8WoAAM4rg.jpg,,,,,,,[],,,,
1230208177280434176,1230208177280434176,2020-02-19 16:11:00 -03,2020-02-19,16:11:00,-0300,16334137,greenpeacebr,Greenpeace Brasil,,"Entenda o que está em jogo com a #MPdaGrilagem, que pode favorecer os invasores de terras públicas e aumentar o desmatamento e a destruição da Amazônia.  https://t.co/0X35zNzUmB  https://t.co/fgc3ePV2b4",pt,[],['https://act.gp/2ugqjLE'],[],4,55,122,['mpdagrilagem'],[],https://twitter.com/GreenpeaceBR/status/1230208177280434176,False,,1,https://pbs.twimg.com/media/ERJd-ktWoAEkTlk.jpg,,,,,,,[],,,,
1230204212212092930,1230162488064401409,2020-02-19 15:55:14 -03,2020-02-19,15:55:14,-0300,67302940,ipam_amazonia,IPAM_Amazônia,,"@MPF_AM No último ano, o desmatamento em terras não-designadas respondeu por 27% de toda a derrubada registrada na Amazônia.  https://t.co/kgWw9hwRMp #SejaLegalcomaAmazônia",pt,[],['https://ipam.org.br/35-do-desmatamento-na-amazonia-e-grilagem-indica-analise-do-ipam/'],[],1,1,10,['sejalegalcomaamazônia'],[],https://twitter.com/IPAM_Amazonia/status/1230204212212092930,False,,0,,,,,,,,"[{'screen_name': 'MPF_AM', 'name': 'MPF_AM', 'id': '101827352'}]",,,,
1230198878496083971,1230162488064401409,2020-02-19 15:34:03 -03,2020-02-19,15:34:03,-0300,67302940,ipam_amazonia,IPAM_Amazônia,,"O procurador Rafael Rocha, do @MPF_AM, levanta a questão: ""O cenário é muito preocupante. Quanto mais o desmatamento cresce, mais o governo enfraquece a governança.""",pt,"[{'screen_name': 'mpf_am', 'name': 'mpf_am', 'id': '101827352'}]",[],[],2,1,11,[],[],https://twitter.com/IPAM_Amazonia/status/1230198878496083971,False,,0,,,,,,,,[],,,,
1230198876113637383,1230162488064401409,2020-02-19 15:34:02 -03,2020-02-19,15:34:02,-0300,67302940,ipam_amazonia,IPAM_Amazônia,,"A ocupação desordenada da Amazônia traz consequências para todos, e reforçar a governança é um caminho fundamental para evitar o desmatamento.",pt,[],[],[],1,1,12,[],[],https://twitter.com/IPAM_Amazonia/status/1230198876113637383,False,,0,,,,,,,,[],,,,
1230198093913694214,1230167008890802177,2020-02-19 15:30:56 -03,2020-02-19,15:30:56,-0300,1086789015599304705,marcelonorkey,Marcelo Norkey,,"@AssisMarinhodf O MP chamo pessoas de todo Brasil pra debater a Amazônia, menos os moradores da Amazônia, principalmente os moradores das áreas onde o desmatamento é maior! Os produtores da Amazônia precisam fazer parte da solução, para deixar de ser problema!",pt,[],[],[],1,0,0,[],[],https://twitter.com/MarceloNorkey/status/1230198093913694214,False,,0,,,,,,,,[],,,,
1230197514403557376,1230197514403557376,2020-02-19 15:28:38 -03,2020-02-19,15:28:38,-0300,163924021,outraspalavrass,Outras Palavras,,"Em debate na Câmara, MP que altera Código Florestal e amplia desmatamento: propriedades na Amazônia poderão devastar metade de áreas com florestas -- hoje lei permite só 20%. Bioma amazônico caminha para ponto de não-retorno de regeneração  Na BBC Brasil:  https://t.co/5JDMszOfuA",pt,[],['http://bit.ly/39HqyOK'],[],0,5,5,[],[],https://twitter.com/outraspalavrass/status/1230197514403557376,False,,0,,,,,,,,[],,,,
1230190038018854912,1230190038018854912,2020-02-19 14:58:55 -03,2020-02-19,14:58:55,-0300,46535103,mario_bonsaglia,Mario Bonsaglia,,"Seminário Amazônia, tendo por foco o problema do desmatamento na Amazônia. Acontecendo agora no auditório JK do MPF.  https://t.co/BXktp0WIZl",pt,[],[],['https://pbs.twimg.com/media/ERKDT1IXkAAzy-Q.jpg'],0,0,3,[],[],https://twitter.com/Mario_Bonsaglia/status/1230190038018854912,False,,1,https://pbs.twimg.com/media/ERKDT1IXkAAzy-Q.jpg,,,,,,,[],,,,
1230189052231606272,1230189052231606272,2020-02-19 14:55:00 -03,2020-02-19,14:55:00,-0300,1002637310180110336,ti_interbr,Transparência Internacional - Brasil,,"""A vinculação entre corrupção e degradação do meio ambiente é um problema global e não é, nem de longe, uma questão restrita aos países em desenvolvimento"" - Bruno Brandão, nosso diretor, no Seminário Amazônia: Desmatamento, Crime Organizado e Corrupção #CorrupçãoDesmata",pt,[],[],[],1,10,17,['corrupçãodesmata'],[],https://twitter.com/TI_InterBr/status/1230189052231606272,False,,0,,,,,,,,[],,,,
1230184357106737153,1230184357106737153,2020-02-19 14:36:21 -03,2020-02-19,14:36:21,-0300,1120098535742103552,425vrocha,Vostok,,"""A Amazônia tem sido um exemplo mundial de descaso de políticas públicas""  ""Em um mundo em que identificamos uma placa de carro via satélite, pq não podemos parar o desmatamento e punir a grilagem?""",pt,[],[],[],0,0,1,[],[],https://twitter.com/425Vrocha/status/1230184357106737153,False,,0,,,,,,,,[],,,,
1230182533574340609,1230182533574340609,2020-02-19 14:29:06 -03,2020-02-19,14:29:06,-0300,67302940,ipam_amazonia,IPAM_Amazônia,,"O seminário ""Amazônia: desmatamento, crime organizado e corrupção"" começou. Vai ter participação do nosso pesquisador Paulo Moutinho! 🤩  Bora ver?  https://t.co/uK5YlaTHT1",pt,[],['http://www.tvmpf.mpf.mp.br/events/2186'],[],0,2,4,[],[],https://twitter.com/IPAM_Amazonia/status/1230182533574340609,False,,0,,,,,,,,[],,,,
1230180381569306628,1230180381569306628,2020-02-19 14:20:33 -03,2020-02-19,14:20:33,-0300,1168518600069660672,coalizao_brasil,"Coalizão Brasil Clima, Florestas e Agricultura",,"Vai começar a transmissão do seminário “Amazônia: desmatamento, crime organizado e corrupção” através do link:  https://t.co/t0XcupVmy4",pt,[],['http://www.tvmpf.mpf.mp.br/events/2186'],[],0,0,1,[],[],https://twitter.com/coalizao_brasil/status/1230180381569306628,False,,0,,,,,,,,[],,,,
1230175389286371334,1230175389286371334,2020-02-19 14:00:43 -03,2020-02-19,14:00:43,-0300,1120098535742103552,425vrocha,Vostok,,Em um seminário sobre desmatamento na Amazônia. O público tá mais pra direito que biologia. Por Deus que não seja cilada,pt,[],[],[],1,0,0,[],[],https://twitter.com/425Vrocha/status/1230175389286371334,False,,0,,,,,,,,[],,,,
1230175213205082112,1230175213205082112,2020-02-19 14:00:01 -03,2020-02-19,14:00:01,-0300,9317502,estadao,Estadão,,Cresce pressão de acionistas sobre empresas com desmatamento da Amazônia  https://t.co/Ej30jaTf9B -via @colunadobroad,pt,"[{'screen_name': 'colunadobroad', 'name': 'coluna do broadcast', 'id': '791391509631336448'}]",['http://bit.ly/2v24QpU'],[],4,8,30,[],[],https://twitter.com/Estadao/status/1230175213205082112,False,,0,,,,,,,,[],,,,
1230167008890802177,1230167008890802177,2020-02-19 13:27:24 -03,2020-02-19,13:27:24,-0300,953037523911106562,assis2021brasil,Assis,,Participando de evento no #mpf em #brasilia . Os temas são: #amazonia #desmatamento #crimeorganizado # #corrupcao  https://t.co/p6qhIH9YSC,pt,[],[],['https://pbs.twimg.com/media/ERJuXc5WsAQJeyZ.jpg'],1,0,2,"['mpf', 'brasilia', 'amazonia', 'desmatamento', 'crimeorganizado', 'corrupcao']",[],https://twitter.com/assis2021brasil/status/1230167008890802177,False,,1,https://pbs.twimg.com/media/ERJuXc5WsAQJeyZ.jpg,,,,,,,[],,,,
1230154797002764289,1229854490829950977,2020-02-19 12:38:53 -03,2020-02-19,12:38:53,-0300,2350201549,60anarita,Rita Soares,,"@VitielloRenata @gleisi @camposmello @jairbolsonaro Usado os termos da intelectualidade para justificar o que não é justificável. O mundo sabe da familicia, laranjal, 39kg de cocaína no avião presidencial, da matança dos índios, do desmatamento da Amazônia, a grosseria rasa do coiso do Planalto. Vc como mulher se olha no espelho?",pt,[],[],[],1,0,0,[],[],https://twitter.com/60Anarita/status/1230154797002764289,False,,0,,,,,,,,"[{'screen_name': 'VitielloRenata', 'name': 'renata vitiello', 'id': '1130935063510753280'}, {'screen_name': 'gleisi', 'name': 'Gleisi Hoffmann', 'id': '31139434'}, {'screen_name': 'camposmello', 'name': 'Patricia Campos Mello', 'id': '36714704'}, {'screen_name': 'jairbolsonaro', 'name': 'Jair M. Bolsonaro', 'id': '128372940'}]",,,,
1230152720704851970,1230152720704851970,2020-02-19 12:30:38 -03,2020-02-19,12:30:38,-0300,1002637310180110336,ti_interbr,Transparência Internacional - Brasil,,"O Seminário Amazônia: Desmatamento, Crime Organizado e Corrupção começará em instantes. Cadastre-se e receba o link para acompanhar a transmissão ao vivo:  https://t.co/SinXOPY1kf.  https://t.co/2K0sC6UjYQ",pt,[],['https://transparenciainternacional.org.br/seminario-amazonia'],['https://pbs.twimg.com/media/ERJhI_4WAAEJjMd.jpg'],0,5,6,[],[],https://twitter.com/TI_InterBr/status/1230152720704851970,False,,1,https://pbs.twimg.com/media/ERJhI_4WAAEJjMd.jpg,,,,,,,[],,,,
1230151045927645184,1230151045927645184,2020-02-19 12:23:59 -03,2020-02-19,12:23:59,-0300,1035962156,robsonetlima,ROBSON E.T. LIMA,,⚡️ “A destruição da Amazônia bem além do desmatamento (e do Brasil)” de @bbcbrasil  https://t.co/oB8EKAcijB,pt,"[{'screen_name': 'bbcbrasil', 'name': 'bbc news brasil', 'id': '790680'}]",['https://twitter.com/i/events/1228313544816459780'],[],0,0,0,[],[],https://twitter.com/Robsonetlima/status/1230151045927645184,False,,0,,,,,,,,[],,,,
1230149048826507264,1230149048826507264,2020-02-19 12:16:02 -03,2020-02-19,12:16:02,-0300,2742108062,katiandra1,Sousa s Khatya,,Impedir o desmatamento e exploração da Amazônia! - Assine a petição!  https://t.co/uagd87MDVA via @change_br,pt,"[{'screen_name': 'change_br', 'name': 'change.org brasil #luteemcasa', 'id': '900348469'}]",['http://chng.it/HsdpZfCJ'],[],0,0,0,[],[],https://twitter.com/katiandra1/status/1230149048826507264,False,,0,,,,,,,,[],,,,
1230142494475726850,1230142494475726850,2020-02-19 11:50:00 -03,2020-02-19,11:50:00,-0300,194081049,sinergiaemrede,🍀,,'A grande mentira verde': como a destruição da Amazônia vai além do desmatamento  https://t.co/tF14ZwOsBF,pt,[],['https://www.bbc.com/portuguese/brasil-51317040'],[],0,0,0,[],[],https://twitter.com/sinergiaemrede/status/1230142494475726850,False,,0,,,,,,,,[],,,,
1230141236356558848,1230141236356558848,2020-02-19 11:45:00 -03,2020-02-19,11:45:00,-0300,20433046,portalamazonia,Portal Amazônia,,"Cientistas de diversas instituições de pesquisa, como o Museu Goeldi, indicam que o desmatamento e a degradação florestal na região amazônica podem custar mais caro do que se calcula atualmente.  #PortalAmazônia #Amazônia   https://t.co/iTBVPPa5Vs",pt,[],['http://bit.ly/2SV8j1H'],[],0,0,4,"['portalamazônia', 'amazônia']",[],https://twitter.com/PortalAmazonia/status/1230141236356558848,False,,0,,,,,,,,[],,,,
1230140800585150465,1230140800585150465,2020-02-19 11:43:16 -03,2020-02-19,11:43:16,-0300,59286596,claudiacaliel,CLAUDIA CALIEL,,Segue Republiqueta de Banania andando de marcha à ré  @jairbolsonaro #Bolsonaro #RicardoSalles @rsallesmma #MeioAmbiente #Agrotóxico #Isenção #SaudePublica #Despreparado #ImpeachmentBolsonaro #Irresponsável #BolsonaroEntreguista #Amazônia #Indios #Desmatamento,pt,"[{'screen_name': 'jairbolsonaro', 'name': 'jair m. bolsonaro', 'id': '128372940'}, {'screen_name': 'rsallesmma', 'name': 'ricardo salles', 'id': '971822131024748545'}]",[],[],0,0,0,"['bolsonaro', 'ricardosalles', 'meioambiente', 'agrotóxico', 'isenção', 'saudepublica', 'despreparado', 'impeachmentbolsonaro', 'irresponsável', 'bolsonaroentreguista', 'amazônia', 'indios', 'desmatamento']",[],https://twitter.com/CLAUDIACALIEL/status/1230140800585150465,False,https://twitter.com/MarinaSilva/status/1230130232700657664,0,,,,,,,,[],,,,
1230137644211851264,1230137644211851264,2020-02-19 11:30:43 -03,2020-02-19,11:30:43,-0300,1168518600069660672,coalizao_brasil,"Coalizão Brasil Clima, Florestas e Agricultura",,"Assista ao vivo hoje, a partir das 14hs, o seminário “Amazonia: desmatamento, crime organizado e corrupção”, através do link:  https://t.co/SsOaPYZJm2  https://t.co/mJIWD1Ozzh",pt,[],['http://www.tvmpf.mpf.mp.br/events'],['https://pbs.twimg.com/media/ERJTpBCXkAEDitc.jpg'],0,8,8,[],[],https://twitter.com/coalizao_brasil/status/1230137644211851264,False,,1,https://pbs.twimg.com/media/ERJTpBCXkAEDitc.jpg,,,,,,,[],,,,
1230131644666916864,1230131644666916864,2020-02-19 11:06:53 -03,2020-02-19,11:06:53,-0300,821781747020992512,_anamarquesc,Ana Lívia,,"""A destruição da Amazônia bem além do desmatamento (e do Brasil)""   https://t.co/rG6iNVQe3A",pt,[],['https://twitter.com/i/events/1228313544816459780'],[],0,0,0,[],[],https://twitter.com/_anamarquesc/status/1230131644666916864,False,,0,,,,,,,,[],,,,
1230113263721107458,1230113263721107458,2020-02-19 09:53:51 -03,2020-02-19,09:53:51,-0300,89668181,gabilfernandes,Permacultora desiludida,,Fico impressionada. Amazônia sendo destruída e um bando de babacas mandando as mulheres rasparem o sovaco. #RaspemOSovaco  BBC News Brasil - 'A grande mentira verde': como a destruição da Amazônia vai além do desmatamento  https://t.co/miZj5zFZ1f,pt,[],['https://www.bbc.com/portuguese/brasil-51317040'],[],0,0,0,['raspemosovaco'],[],https://twitter.com/gabilfernandes/status/1230113263721107458,False,,0,,,,,,,,[],,,,
1230110281096888321,1230110281096888321,2020-02-19 09:42:00 -03,2020-02-19,09:42:00,-0300,113410319,jornalistavitor,Vitor Santos,,"Grilagem, desmatamento e violência. Confira entrevista com procuradores produzida pela  @coalizao_brasil  uma iniciativa da sociedade civil e do agronegócio pelo fim da grilagem de terras na Amazônia.  Saiba mais em:  https://t.co/siDVYQ39RL  https://t.co/zolPPqaYwx",pt,"[{'screen_name': 'coalizao_brasil', 'name': 'coalizão brasil clima, florestas e agricultura', 'id': '1168518600069660672'}]","['http://sejalegalcomaamazonia.org.br', 'https://twitter.com/Imazon/status/1229842595062435842?s=20']",[],0,0,0,[],[],https://twitter.com/jornalistavitor/status/1230110281096888321,False,https://twitter.com/Imazon/status/1229842595062435842?s=20,0,,,,,,,,[],,,,
1230099174433132544,1230099174433132544,2020-02-19 08:57:51 -03,2020-02-19,08:57:51,-0300,4519592477,venusbr56,@Venusbr60,,"""A destruição da Amazônia bem além do desmatamento (e do Brasil)""   https://t.co/oe3m4B4wqS",pt,[],['https://twitter.com/i/events/1228313544816459780'],[],0,0,0,[],[],https://twitter.com/Venusbr56/status/1230099174433132544,False,,0,,,,,,,,[],,,,
1230089735185616897,1230089735185616897,2020-02-19 08:20:21 -03,2020-02-19,08:20:21,-0300,132631349,aguiausp,AGUIA,,'A grande mentira verde': como a destruição da Amazônia vai além do desmatamento afirma pesquisador do Inpe. Saiba mais:  https://t.co/O5qXi5FaWq   https://t.co/3AI8aQNJUj  https://t.co/TKA0567mXn,pt,[],"['https://www.globalforestwatch.org/', 'https://bbc.in/2P448Q2']",['https://pbs.twimg.com/media/ERIoFemWoAAtwdX.jpg'],0,0,0,[],[],https://twitter.com/aguiausp/status/1230089735185616897,False,,1,https://pbs.twimg.com/media/ERIoFemWoAAtwdX.jpg,,,,,,,[],,,,
1230076853240639488,1230076853240639488,2020-02-19 07:29:10 -03,2020-02-19,07:29:10,-0300,32690744,sergioyariwake,Serginho Yariwake - Vacinado D2,,Por que repercutir as ofensas sexuais do presidente Bolsonaro? Vamos falar das coisas positivas! Fila no INSS. Problema no Bolsa Família. Problema no ENEM. Crescimento do desmatamento na Amazônia. PIB abaixo de 1% em 2019. Desaceleração da economia. Enganar caminhoneiros 0 ICMS..,pt,[],[],[],0,1,2,[],[],https://twitter.com/sergioyariwake/status/1230076853240639488,False,,0,,,,,,,,[],,,,
1230075404196728838,1230075404196728838,2020-02-19 07:23:24 -03,2020-02-19,07:23:24,-0300,1013936486352289792,_plutodaughter,lis ✨,,"""A destruição da Amazônia bem além do desmatamento (e do Brasil)""   https://t.co/aVnIhGxnGc",pt,[],['https://twitter.com/i/events/1228313544816459780'],[],0,0,0,[],[],https://twitter.com/_plutodaughter/status/1230075404196728838,False,,0,,,,,,,,[],,,,
