id,conversation_id,created_at,date,time,timezone,user_id,username,name,place,tweet,language,mentions,urls,photos,replies_count,retweets_count,likes_count,hashtags,cashtags,link,retweet,quote_url,video,thumbnail,near,geo,source,user_rt_id,user_rt,retweet_id,reply_to,retweet_date,translate,trans_src,trans_dest
1412388535596953601,1412169612880494596,2021-07-06 09:30:42 SA Eastern Standard Time,2021-07-06,09:30:42,-0300,1246062861023133697,ricardomunizz20,ricardomunizz20 🇧🇷🇧🇷🇧🇷🇧🇷🇧🇷,,@aleph_juan @Jenairamarley @L_Isentao @ABKBRUCKMANN @2022Enquetes Kkkkk. Tirando o delegado que atuava. Veja o que a PF diz sobre o exército. Veja os mapa das queimadas. Vcs são uma vergonha mundial. Perderam bilhoes do fundo de proteção da Amazônia. Genocidas.,pt,[],[],[],0,1,1,[],[],https://twitter.com/ricardomunizz20/status/1412388535596953601,False,,0,,,,,,,,"[{'screen_name': 'aleph_juan', 'name': 'Aleph J Silva', 'id': '1326353970575577088'}, {'screen_name': 'Jenairamarley', 'name': 'Boris 🌵🚩🇧🇷🇱🇧', 'id': '1192887808052154368'}, {'screen_name': 'L_Isentao', 'name': 'L_Isentão Ant-sistema', 'id': '1397312235702296576'}, {'screen_name': 'ABKBRUCKMANN', 'name': 'Angelo Brückmann 🇧🇷 ☘', 'id': '1326007213694070784'}, {'screen_name': '2022Enquetes', 'name': 'Enquetes 2022', 'id': '1276939993534038016'}]",,,,
1412361216811581443,1412361216811581443,2021-07-06 07:42:09 SA Eastern Standard Time,2021-07-06,07:42:09,-0300,1228100284448153601,cin_braun,Cinthya,,"O estudo do governo não citou a intensificação das queimadas na Amazônia e as mudanças climáticas que vêm ocorrendo por causa disso. Ela fornece um grande volume de umidade pra atmosfera, gerando os ""rios voadores"" que distribuem chuvas por todo o país. Queimadas = menos chuvas",pt,[],[],[],0,0,1,[],[],https://twitter.com/cin_braun/status/1412361216811581443,False,https://twitter.com/UOL/status/1412355395067203584,0,,,,,,,,[],,,,
1412342135936987136,1412019502640943109,2021-07-06 06:26:19 SA Eastern Standard Time,2021-07-06,06:26:19,-0300,874000670495576064,noleto_rj,Gilvan Noleto Da Sil,,"@JuaresCruz5 @ArthurWeint Ué,  não é ele que critica o governo pelas milhares de árvores queimadas na Amazônia?? E as bilhões que não foram queimadas? Pela lógica desse imbecil o número de óbitos por Covid no mundo também não representa nada, afinal tem outros 7 bilhões que não morreram. Vai entende!!!!",pt,[],[],[],2,0,1,[],[],https://twitter.com/noleto_rj/status/1412342135936987136,False,,0,,,,,,,,"[{'screen_name': 'JuaresCruz5', 'name': 'Juares Cruz', 'id': '1230678548228210688'}, {'screen_name': 'ArthurWeint', 'name': 'Arthur Weintraub', 'id': '1074209186752413696'}]",,,,
1412232035427667968,1411998559654793217,2021-07-05 23:08:49 SA Eastern Standard Time,2021-07-05,23:08:49,-0300,162144966,mchiapparini,Marcelo Chiapparini,,@ThanyaMotta @Debora_D_Diniz A Sra tem uma onça pintada na foto do perfil. Igualzinha com as que foram carbonizadas vivas nas  queimadas criminosas da Amazônia e Pantanal perpetradas pelo governo da pessoa que você defende.,pt,[],[],[],0,0,3,[],[],https://twitter.com/mchiapparini/status/1412232035427667968,False,,0,,,,,,,,"[{'screen_name': 'ThanyaMotta', 'name': '🇧🇷Thanya Motta🇧🇷', 'id': '438449045'}, {'screen_name': 'Debora_D_Diniz', 'name': 'Debora Diniz', 'id': '1028620936176656384'}]",,,,
1412216222574317570,1412216222574317570,2021-07-05 22:05:59 SA Eastern Standard Time,2021-07-05,22:05:59,-0300,757818764,lramos52,Lramos52🚩🚩🚩🚩🚩🚩🚩,,"Este ser fantasiado de presidente está conseguindo ficar famoso no mundo todo. Queimadas na Amazônia,  genocídio,  corrupção na compra de vacinas, rachadinhas, faltou alguma coisa????   https://t.co/yXu1CZI2iY",pt,[],['https://noticias.uol.com.br/politica/ultimas-noticias/2021/07/05/imprensa-internacional-repercute-caso-das-rachadinhas-da-familia-bolsonaro.htm'],[],0,1,2,[],[],https://twitter.com/lramos52/status/1412216222574317570,False,,0,,,,,,,,[],,,,
1412192502698889222,1412192490480975875,2021-07-05 20:31:44 SA Eastern Standard Time,2021-07-05,20:31:44,-0300,1308821032749486080,fumacasinal,SinalDeFumaca,,"🚨 Após um primeiro semestre de queimadas recorde na Amazônia, chegamos na temporada seca sob grave risco. O que o presidente fez? Mais uma vez optou por seu custoso e ineficaz exército numa GLO.  https://t.co/jQgwWXrqfO",pt,[],[],['https://pbs.twimg.com/media/E5kc8flWEAUUBo0.jpg'],1,1,5,[],[],https://twitter.com/FumacaSinal/status/1412192502698889222,False,,1,https://pbs.twimg.com/media/E5kc8flWEAUUBo0.jpg,,,,,,,[],,,,
1412191884978569217,1412191884978569217,2021-07-05 20:29:17 SA Eastern Standard Time,2021-07-05,20:29:17,-0300,45199438,caiobrilhante,Caio Brilhante,,Época de secas chegando na Amazônia.  O que o governo federal está fazendo para evitar queimadas? Proibição do emprego de fogo e operação GLO pelas forças armadas.  E ano passado?  Foi feito o mesmo.  Vimos no que deu.  #direitoambiental #Amazonia,pt,[],[],[],0,0,1,"['direitoambiental', 'amazonia']",[],https://twitter.com/caiobrilhante/status/1412191884978569217,False,,0,,,,,,,,[],,,,
1412165484829679617,1412159023642730504,2021-07-05 18:44:23 SA Eastern Standard Time,2021-07-05,18:44:23,-0300,42935800,ameliorera,fofoka,,sou ovolactovegetariana ha quase 2 anos e parei por causa do meio ambiente (inclusive decidi naquelas queimadas de 2019 na amazonia) raramente fico super triste etc por causa da exploração animal e me sinto até mal por não ter esse sentimento:( kk,pt,[],[],[],2,0,3,[],[],https://twitter.com/ameliorera/status/1412165484829679617,False,,0,,,,,,,,[],,,,
1412156071351918599,1412156071351918599,2021-07-05 18:06:58 SA Eastern Standard Time,2021-07-05,18:06:58,-0300,1373294177165926412,jardimgaudio,Maristela Jardim Gaudio,,"Queimadas na Amazônia batem recorde de 14 anos em junho - O registro de 2.308 focos de incêndio coincide com mais uma troca de comando no centro de combate ao fogo do Ibama. CADÊ O MINISTRO DO MEIO AMBIENTE??? CADÊ MOURÃO, PRES. DO CONSELHO DA AMAZÔNIA???  https://t.co/2aHuZeLrtI",pt,[],['https://www.oc.eco.br/queimadas-na-amazonia-batem-recorde-de-14-anos-em-junho/'],[],0,0,0,[],[],https://twitter.com/JardimGaudio/status/1412156071351918599,False,,0,,,,,,,,[],,,,
1412143141570977792,1412143141570977792,2021-07-05 17:15:35 SA Eastern Standard Time,2021-07-05,17:15:35,-0300,2674564802,niltotatto,🇧🇷 Nilto Tatto - #ForaBolsonaro 🍀,,O QUE LIGA O AUMENTO NA CONTA DE LUZ AO DESMATAMENTO DA AMAZÔNIA E À EMERGÊNCIA CLIMÁTICA? TUDO  Devastação da floresta impacta nível dos reservatórios  @gil_alessi  @elpais_brasil     https://t.co/gactpghpne #amazonia #desmatamento #Queimadas #meioambiente #água #CriseHídrica,pt,"[{'screen_name': 'gil_alessi', 'name': 'gil alessi', 'id': '507698810'}, {'screen_name': 'elpais_brasil', 'name': 'el país brasil', 'id': '2174537102'}]",['https://cutt.ly/ZmxAPrs'],[],0,2,6,"['amazonia', 'desmatamento', 'queimadas', 'meioambiente', 'água', 'crisehídrica']",[],https://twitter.com/NiltoTatto/status/1412143141570977792,False,,0,,,,,,,,[],,,,
1412118306178404353,1411999115140075520,2021-07-05 15:36:54 SA Eastern Standard Time,2021-07-05,15:36:54,-0300,1409168647076130823,lucidisantos,Dayse L 🚩🚩⭐❤🦋🌹🤜🤛👊🚩🚩,,"@marcosdoval Os investidores já fugiram a tempos mas não pela possibilidade de impeachment e sim pela queimadas da Amazônia e pantanal do Min. Sales, dos discursos boçais de Guedes e do PR",pt,[],[],[],0,0,0,[],[],https://twitter.com/LucidiSantos/status/1412118306178404353,False,,0,,,,,,,,"[{'screen_name': 'marcosdoval', 'name': 'Marcos do Val', 'id': '54600557'}]",,,,
1412112844628312064,1412112844628312064,2021-07-05 15:15:12 SA Eastern Standard Time,2021-07-05,15:15:12,-0300,1284114809366228993,pedrofogaca6,Pedro Fogaca,,Vamos comemorar o aumento dos combustíveis. Vamos comemorar o aumento da cinta de energia. Vamos comemorar o desemprego. Vamos comemorar a 14ª posição no ranking mundial. Vamos comemorar as queimadas das florestas e em especial da Amazônia. Vamos comemorar a COVAXIN,pt,[],[],[],0,0,0,[],[],https://twitter.com/PedroFogaca6/status/1412112844628312064,False,,0,,,,,,,,[],,,,
1412080133792538633,1412080133792538633,2021-07-05 13:05:13 SA Eastern Standard Time,2021-07-05,13:05:13,-0300,1169986304333008896,josluiz30548518,José Luiz,,"Conversa da esquerda: ""Como o papo de genocida não funcionou, vamos ressuscitar a Rachadinha. Se não funcionar, não se preocupe: daqui a pouco voltamos a falar das queimadas na Amazônia"".  Essa esquerda é patética mesmo.",pt,[],[],[],0,0,1,[],[],https://twitter.com/JosLuiz30548518/status/1412080133792538633,False,,0,,,,,,,,[],,,,
1412076206703349762,1411634240408653825,2021-07-05 12:49:37 SA Eastern Standard Time,2021-07-05,12:49:37,-0300,496014013,katherinebenevi,Katherine Benevides,,"@revistaforum O que é umas vidracinhas contra 550 mil mortos, queimadas na Amazônia,  fome, desemprego, corrupção bozo?! Vai trabalhar.",pt,[],[],[],0,0,0,[],[],https://twitter.com/KATHERINEBENEVI/status/1412076206703349762,False,,0,,,,,,,,"[{'screen_name': 'revistaforum', 'name': 'Revista Fórum', 'id': '19593634'}]",,,,
1412074151049838595,1412066560022388739,2021-07-05 12:41:27 SA Eastern Standard Time,2021-07-05,12:41:27,-0300,140986038,p1alex,Alexitimia.,,"@Mpafarias3 o cara já pós em dúvida, inpe, vacinas, eleição, eleição nós EUA, queimadas na Amazônia, no Pantanal e nunca apresentou provas fatos. isso é só o que ele faz. ele é praticamente o galinho chicken little",pt,[],[],[],0,0,0,[],[],https://twitter.com/P1Alex/status/1412074151049838595,False,,0,,,,,,,,"[{'screen_name': 'Mpafarias3', 'name': 'Marcos Farias', 'id': '876546012210483205'}]",,,,
1412070490374557696,1411843400341639169,2021-07-05 12:26:54 SA Eastern Standard Time,2021-07-05,12:26:54,-0300,1246625093368889350,jorgemesm0,Jorge,,"@barroshelena @nathfinancas Sei q isso se soma às queimadas, principalmente na Amazônia, pois diminuem a frequência dos rios aéreos e tudo mais. E tb n é em todas as regiões do país que ocorreu a diminuição dos reservatórios, porém todo ele vai pagar mais caro. Mas basicamente é por essa geração mais cara ?",pt,[],[],[],0,0,1,[],[],https://twitter.com/Jorgemesm0/status/1412070490374557696,False,,0,,,,,,,,"[{'screen_name': 'barroshelena', 'name': 'Helena Barros', 'id': '73206550'}, {'screen_name': 'nathfinancas', 'name': 'Nath Finanças', 'id': '916008599205359617'}]",,,,
1412051217417654274,1412050632102531072,2021-07-05 11:10:19 SA Eastern Standard Time,2021-07-05,11:10:19,-0300,57358660,wesleydagama,⚡Wesley ⚡,,"@Damadeferroofic Daqui a pouco vem as ""queimadas na Amazônia"" ou o ""AI-5"" ou as ""Fake News"" e assim a roda gira, gira, gira...",pt,[],[],[],0,0,2,[],[],https://twitter.com/wesleydagama/status/1412051217417654274,False,,0,,,,,,,,"[{'screen_name': 'Damadeferroofic', 'name': 'Dama de Ferro', 'id': '1043615581973499904'}]",,,,
1412048623232339977,1412043725274959883,2021-07-05 11:00:01 SA Eastern Standard Time,2021-07-05,11:00:01,-0300,86091914,mrcpasti,Marcelo Pasti,,"@JornalOGlobo Já que CPI, pandemia e genocídio não cola mais, a extrema imprensa retorna com as narrativas das queimadas da Amazônia, do pantanal,  da fuga das girafas por conta das queimadas, o petróleo derramado na costa norte, etc..",pt,[],[],[],0,0,0,[],[],https://twitter.com/mrcpasti/status/1412048623232339977,False,,0,,,,,,,,"[{'screen_name': 'JornalOGlobo', 'name': 'Jornal O Globo', 'id': '54341363'}]",,,,
1412042041446514691,1412042041446514691,2021-07-05 10:33:51 SA Eastern Standard Time,2021-07-05,10:33:51,-0300,198684670,tarcisioxingu,Tarcísio Feitosa,,Sinta o poder do desmatamento na sua casa. Quando o chegar a conta de energia lembre-se das queimadas que não foram combatidas #Amazonia #ContaDeEnergia @goldmanprize,pt,"[{'screen_name': 'goldmanprize', 'name': 'goldman prize', 'id': '21226905'}]",[],[],0,0,0,"['amazonia', 'contadeenergia']",[],https://twitter.com/tarcisioxingu/status/1412042041446514691,False,,0,,,,,,,,[],,,,
1412024182909571072,1411748814478876680,2021-07-05 09:22:54 SA Eastern Standard Time,2021-07-05,09:22:54,-0300,841616176014864385,thiagobarboza89,Thiago Barboza,,@rodrigocortat @arthurmoledoval Essa narrativa tá mais certa que as girafas morrendo queimadas na Amazônia..🤡,pt,[],[],[],0,0,0,[],[],https://twitter.com/ThiagoBarboza89/status/1412024182909571072,False,,0,,,,,,,,"[{'screen_name': 'RodrigoCortat', 'name': 'Rodrigo Teixeira ≛≣ ✪', 'id': '83661382'}, {'screen_name': 'arthurmoledoval', 'name': 'Arthur do Val - Mamaefalei', 'id': '4106068103'}]",,,,
1412012375646085123,1412011536684568578,2021-07-05 08:35:58 SA Eastern Standard Time,2021-07-05,08:35:58,-0300,1247911890489090048,punkbiology,Fernando #MarcoTemporalNão,,"Uma coisa que eu não deixei claro no fio: a Amazônia armazena carbono pra caramba. Então as queimadas além de tudo liberam uma quantidade enorme de CO2 pra atmosfera, agravando todo o problema...",pt,[],[],[],0,0,3,[],[],https://twitter.com/punkbiology/status/1412012375646085123,False,,0,,,,,,,,[],,,,
1411985050904764416,1411985050904764416,2021-07-05 06:47:24 SA Eastern Standard Time,2021-07-05,06:47:24,-0300,814883311881482240,santinhoaimar,Aimar Santinho,,@andretrig Bom dia André Trigueiro. Muito se fala das queimadas e devastação da Amazônia e do Pantanal. Como está a situação da Mata Atlântica. Havia um projeto de restauração desse bioma? Como está? Muito obrigado.,pt,[],[],[],0,0,0,[],[],https://twitter.com/SantinhoAimar/status/1411985050904764416,False,,0,,,,,,,,[],,,,
1411882409902149636,1411882409902149636,2021-07-04 23:59:32 SA Eastern Standard Time,2021-07-04,23:59:32,-0300,820891701132849152,brodersfly,investigado por receptação de fofoca,,e nada sobre as queimadas no Pantanal e nem sobre o desmatamento da Amazônia 🤡🤡,pt,[],[],[],0,0,1,[],[],https://twitter.com/brodersfly/status/1411882409902149636,False,https://twitter.com/nathfinancas/status/1411843400341639169,0,,,,,,,,[],,,,
1411869464572968961,1411687490914635784,2021-07-04 23:08:06 SA Eastern Standard Time,2021-07-04,23:08:06,-0300,1399312784584814600,breviscristiane,Cristiane Brevis,,"@STF_oficial Mercúrio nos garimpos, queimadas e correntões na Amazônia, mortes de indígenas, centenas de agrotóxicos liberados... boiada passando e tudo bem...  E eu que aprendi ser o STF nosso maior guardião...",pt,[],[],[],0,0,0,[],[],https://twitter.com/BrevisCristiane/status/1411869464572968961,False,,0,,,,,,,,"[{'screen_name': 'STF_oficial', 'name': 'STF', 'id': '68313718'}]",,,,
1411846992318406662,1411846453677469697,2021-07-04 21:38:48 SA Eastern Standard Time,2021-07-04,21:38:48,-0300,962375696734674945,last_parawhore,Marcelo from Paramore,,"@Allymak2 amiga, tudo isso é muito triste. Pode ter haver com as queimadas da amazonia. tudo está interligado.",pt,[],[],[],1,0,1,[],[],https://twitter.com/last_parawhore/status/1411846992318406662,False,,0,,,,,,,,"[{'screen_name': 'Allymak2', 'name': 'ALLYMAK', 'id': '953122254648434689'}]",,,,
1411845386650718209,1411843400341639169,2021-07-04 21:32:25 SA Eastern Standard Time,2021-07-04,21:32:25,-0300,1101921192322183168,faceolrj,EuTbmVouRrclamar,,@nathfinancas Engraçado que falar sobre o aumento das queimadas na Amazônia graças ao Salles e ao governo bolsonaro acabando com os rios aéreos nem de longe né??? Todo mundo sabe que o objetivo do governo é aumentar energia pra justificar privatização da Eletrobrás.,pt,[],[],[],0,0,0,[],[],https://twitter.com/Faceolrj/status/1411845386650718209,False,,0,,,,,,,,"[{'screen_name': 'nathfinancas', 'name': 'Nath Finanças', 'id': '916008599205359617'}]",,,,
1411833236737728519,1411833236737728519,2021-07-04 20:44:08 SA Eastern Standard Time,2021-07-04,20:44:08,-0300,1353502028190937088,carlosa53134005,Carlos Alberto Salas,,"Ops, cadê a mocinha das queimadas??? Corre pra lá ajudar a pagar, afinal as fagulhas podem chegar na Amazônia,vai saber.Ela passa por cima dos USA ,America Central,é um pulinho.  https://t.co/qK7FstOn8Q",pt,[],[],['https://pbs.twimg.com/tweet_video_thumb/E5fW14nX0AAmPuz.jpg'],0,0,0,[],[],https://twitter.com/CarlosA53134005/status/1411833236737728519,False,https://twitter.com/MarcosQuezado1/status/1411829389424218115,1,https://pbs.twimg.com/tweet_video_thumb/E5fW14nX0AAmPuz.jpg,,,,,,,[],,,,
1411746375050665987,1411637552939945987,2021-07-04 14:58:59 SA Eastern Standard Time,2021-07-04,14:58:59,-0300,1403730529728532480,fernand03911390,Fernando Santos Santos,,"@MartaRcf @aguinaldaosilva @MariaLCAb Amazônia: está como sempre esteve com várias queimadas legais, legais e irregulares e ilegais. O Governo vem combatendo as ilegais e buscando regularizar as demais com o acréscimo de um elemento a equação ambiental, o humano.",pt,[],[],[],1,0,0,[],[],https://twitter.com/Fernand03911390/status/1411746375050665987,False,,0,,,,,,,,"[{'screen_name': 'MartaRcf', 'name': 'marta_rcf', 'id': '1377378089852923907'}, {'screen_name': 'aguinaldaosilva', 'name': 'aguinaldo silva', 'id': '105761223'}, {'screen_name': 'MariaLCAb', 'name': 'Maria', 'id': '194645058'}]",,,,
1411736065048731649,1411637552939945987,2021-07-04 14:18:01 SA Eastern Standard Time,2021-07-04,14:18:01,-0300,1140732261924577280,oleonardosoueu,Leonardo,,"@aguinaldaosilva de livre comércio entre a União Européia e o Mercosul. Hoje, eles espalham fake news na Europa e dizem que o Brasil não cuida da Amazônia, tem queimadas sem controle, não cuida dos índios,etc. Já ""ameaçaram o Brasil"" de tirar os produtos das prateleiras se não acabassem (cont.)",pt,[],[],[],1,0,0,[],[],https://twitter.com/oleonardosoueu/status/1411736065048731649,False,,0,,,,,,,,"[{'screen_name': 'aguinaldaosilva', 'name': 'aguinaldo silva', 'id': '105761223'}]",,,,
1411725304528257028,1411725304528257028,2021-07-04 13:35:15 SA Eastern Standard Time,2021-07-04,13:35:15,-0300,1351660158015983616,amazoniaobserva,Observatório da Amazônia,,Queimadas na Amazônia batem recorde de 12 anos para o mês de junho... Leia mais em  https://t.co/I7hxhoNlvO. via @cartacapital  #amazonia #amazoniaobserva,pt,"[{'screen_name': 'cartacapital', 'name': 'cartacapital', 'id': '16632084'}]",['https://www.cartacapital.com.br/sustentabilidade/queimadas-na-amazonia-batem-recorde-de-12-anos-para-o-mes-de-junho/'],[],0,0,0,"['amazonia', 'amazoniaobserva']",[],https://twitter.com/amazoniaobserva/status/1411725304528257028,False,,0,,,,,,,,[],,,,
1411722648845963265,1411718061585960960,2021-07-04 13:24:42 SA Eastern Standard Time,2021-07-04,13:24:42,-0300,2845452681,caisanto,Caio Santos,,"@diImabr Para lembrar: PCO defendeu queimadas na Amazônia contra ""interferência externa"", disse que estupro do Robinho era ""perseguição xenofóbica"" e que homofobia em estádios é parte da ""cultura nacional"".  A função do PCO é vestir vermelho e apoiar o bolsonarismo.",pt,[],[],[],1,0,1,[],[],https://twitter.com/caisanto/status/1411722648845963265,False,,0,,,,,,,,"[{'screen_name': 'diImabr', 'name': 'Dilma', 'id': '116820742'}]",,,,
1411704035846111232,1411691398395535364,2021-07-04 12:10:44 SA Eastern Standard Time,2021-07-04,12:10:44,-0300,2845452681,caisanto,Caio Santos,,"@distopi Foi mal, mas essa lógica também serve para o PCO: eles defenderam as queimadas na Amazônia contra a ""interferência externa"" dos EUA, que o estupro do Robinho é ""xenofobia"" da Itália e que homofobia nos estádios é ""cultura nacional"". PCO é bolsonarista que usa vermelho, nada mais.",pt,[],[],[],1,0,0,[],[],https://twitter.com/caisanto/status/1411704035846111232,False,,0,,,,,,,,"[{'screen_name': 'distopi', 'name': 'Maurício Angelo', 'id': '15191656'}]",,,,
1411697623887663109,1411637552939945987,2021-07-04 11:45:16 SA Eastern Standard Time,2021-07-04,11:45:16,-0300,1318443008,luizgilsonjr,Luiz Gilson Júnior ✊🏽 #Antifacista #1dose,,"@YMCBahia @aguinaldaosilva 520 mil mortos por covid, desemprego recorde, 25% do pantanal devastado por queimadas no ano passado, Amazônia sendo devastada por garimpeiros, grileiros e madeireiros, com omissão do governo, ataques à democracia diários cometidos pelo presidente...",pt,[],[],[],3,2,5,[],[],https://twitter.com/luizgilsonjr/status/1411697623887663109,False,,0,,,,,,,,"[{'screen_name': 'YMCBahia', 'name': '🤷\u200d♀️ Penélope 🚩🚩Nova Conta', 'id': '1202773212213497859'}, {'screen_name': 'aguinaldaosilva', 'name': 'aguinaldo silva', 'id': '105761223'}]",,,,
1411690989513809920,1411686126356664321,2021-07-04 11:18:54 SA Eastern Standard Time,2021-07-04,11:18:54,-0300,2845452681,caisanto,Caio Santos,,"@ChicoFoureaux @Pedro_Barciela @fabiomalini E n é a 1a vez que esquerdomacho do PCO apoia bolsonaristas: defendrram queimadas na Amazônia diante ""interferência externa"" dos EUA, que o estupro do Robinho era ""xenofobia"" dos italianos e que homofobia nos estádios é ""cultura nacional"".  PCO é bolsonarista que veste vermelho.",pt,[],[],[],0,0,1,[],[],https://twitter.com/caisanto/status/1411690989513809920,False,,0,,,,,,,,"[{'screen_name': 'ChicoFoureaux', 'name': 'Francisco Foureaux 🌹🇧🇷', 'id': '1034908794'}, {'screen_name': 'Pedro_Barciela', 'name': 'Pedro Barciela', 'id': '18229867'}, {'screen_name': 'fabiomalini', 'name': 'Fabio Malini', 'id': '20449367'}]",,,,
1411686757146505222,1411685553943232515,2021-07-04 11:02:05 SA Eastern Standard Time,2021-07-04,11:02:05,-0300,772258519596892160,hostnewsbrasil,HOST NEWS BRASIL🎙️,,"@jornalodia Eu também choraria com qualquer música, inclusive se não tivesse outra coisa pra fazer e com muito dinheiro na conta! Mas, ultimamente estou chorando por várias pessoas de rua, vários animais abandonados e grandes queimadas na amazônia",pt,[],[],[],0,0,0,[],[],https://twitter.com/HOSTNEWSBRASIL/status/1411686757146505222,False,,0,,,,,,,,"[{'screen_name': 'jornalodia', 'name': 'Jornal O Dia', 'id': '17675497'}]",,,,
1411682266061881344,1411637552939945987,2021-07-04 10:44:14 SA Eastern Standard Time,2021-07-04,10:44:14,-0300,303941857,glamagagnin,Gladys Magagnin,,"@aguinaldaosilva E povo morre, e o gás sobe, e a energia elétrica sobe, e a pobreza aumenta, e as queimadas na Amazônia aumentam...",pt,[],[],[],0,0,0,[],[],https://twitter.com/GlaMagagnin/status/1411682266061881344,False,,0,,,,,,,,"[{'screen_name': 'aguinaldaosilva', 'name': 'aguinaldo silva', 'id': '105761223'}]",,,,
1411672002021232648,1411637552939945987,2021-07-04 10:03:27 SA Eastern Standard Time,2021-07-04,10:03:27,-0300,392266681,m650709,Donkey CHE 🇧🇷,,@laryssamarq @aguinaldaosilva Muitas girafas morrendo queimadas na Amazônia. 🤣,pt,[],[],[],0,1,28,[],[],https://twitter.com/M650709/status/1411672002021232648,False,,0,,,,,,,,"[{'screen_name': 'laryssamarq', 'name': 'Laryssa Melo', 'id': '280227373'}, {'screen_name': 'aguinaldaosilva', 'name': 'aguinaldo silva', 'id': '105761223'}]",,,,
