id,conversation_id,created_at,date,time,timezone,user_id,username,name,place,tweet,language,mentions,urls,photos,replies_count,retweets_count,likes_count,hashtags,cashtags,link,retweet,quote_url,video,thumbnail,near,geo,source,user_rt_id,user_rt,retweet_id,reply_to,retweet_date,translate,trans_src,trans_dest
1410626411308666882,1410626411308666882,2021-07-01 12:48:39 SA Eastern Standard Time,2021-07-01,12:48:39,-0300,810118697130098688,agentebaiano007,Perry Mann,,Amazônia registra maior número de queimadas dos últimos 14 anos para mês de junho  https://t.co/uEnLfPLdn5,pt,[],['https://www.diariodocentrodomundo.com.br/essencial/amazonia-registra-maior-numero-de-queimadas-dos-ultimos-14-anos-para-mes-de-junho/'],[],0,1,2,[],[],https://twitter.com/agentebaiano007/status/1410626411308666882,False,,0,,,,,,,,[],,,,
1410626349165862917,1410626349165862917,2021-07-01 12:48:24 SA Eastern Standard Time,2021-07-01,12:48:24,-0300,226664170,gant_e,Gant_e,,Amazônia tem junho com maior número de queimadas desde 2007...   https://t.co/hJlEhnMJq6,pt,[],['https://www1.folha.uol.com.br/ambiente/2021/07/amazonia-tem-junho-com-maior-numero-de-queimadas-desde-2007.shtml?utm_source=sharenativo&utm_medium=social&utm_campaign=sharenativo'],[],0,0,1,[],[],https://twitter.com/Gant_e/status/1410626349165862917,False,,0,,,,,,,,[],,,,
1410621878524432386,1410621878524432386,2021-07-01 12:30:38 SA Eastern Standard Time,2021-07-01,12:30:38,-0300,53243190,adbrasil,Assembleia de Deus,,"🔥 Amazônia tem o maior número de focos de queimadas dos últimos 14 anos para mês de junho  Na comparação entre maio e junho deste ano, houve um aumento de 98% nos focos de queimadas no bioma de um mês para o outro, segundo dados do Inpe  https://t.co/JmBdWTlTVs",pt,[],['https://g1.globo.com/natureza/amazonia/noticia/2021/07/01/amazonia-tem-o-maior-numero-de-focos-de-queimadas-dos-ultimos-14-anos-para-mes-de-junho.ghtml'],[],0,0,8,[],[],https://twitter.com/adbrasil/status/1410621878524432386,False,,0,,,,,,,,[],,,,
1410619225731960833,1410619225731960833,2021-07-01 12:20:06 SA Eastern Standard Time,2021-07-01,12:20:06,-0300,61752537,folhape,Folha de Pernambuco,,QUEIMADAS | Amazônia tem junho com maior número de queimadas desde 2007 -  https://t.co/yck7GidduK  https://t.co/J1moXI3zRD,pt,[],['https://mla.bs/64b83ed5'],['https://pbs.twimg.com/media/E5OGtfDXwAEir7K.jpg'],1,1,1,[],[],https://twitter.com/folhape/status/1410619225731960833,False,,1,https://pbs.twimg.com/media/E5OGtfDXwAEir7K.jpg,,,,,,,[],,,,
1410615451848118276,1410615451848118276,2021-07-01 12:05:06 SA Eastern Standard Time,2021-07-01,12:05:06,-0300,1076348538102128640,fresheralert_in,FresherAlert.in,,Amazônia tem junho com maior número de queimadas desde 2007  https://t.co/Ui3QuKHRcy,pt,[],['https://fresheralert.in/amazonia-tem-junho-com-maior-numero-de-queimadas-desde-2007/'],[],0,0,0,[],[],https://twitter.com/fresheralert_in/status/1410615451848118276,False,,0,,,,,,,,[],,,,
1410610841901158406,1410610841901158406,2021-07-01 11:46:47 SA Eastern Standard Time,2021-07-01,11:46:47,-0300,719601789688016896,cadredominguez1,Cadre Dominguez,,Amazônia tem o maior número de focos de queimadas dos últimos 14 anos para mês de junho | Amazônia | G1  https://t.co/5Zqy8g0J6E,pt,[],['https://g1.globo.com/natureza/amazonia/noticia/2021/07/01/amazonia-tem-o-maior-numero-de-focos-de-queimadas-dos-ultimos-14-anos-para-mes-de-junho.ghtml'],[],0,0,0,[],[],https://twitter.com/cadredominguez1/status/1410610841901158406,False,,0,,,,,,,,[],,,,
1410609913798139919,1410503568474398721,2021-07-01 11:43:05 SA Eastern Standard Time,2021-07-01,11:43:05,-0300,1057446371534475264,feliperngel1,que isso?,,"@Alisujavorksi @caioshark @nilmoretto Num país há queimadas normalmente e são ampliadas pelas mudanças climáticas. O país tá sendo uma vítima.  No outro, biomas umidos como amazônia e Pantanal que não queimam estavam sendo derrubados e queimados pra pastagem. O país é o responsável pelas queimadas.  Tendeu?",pt,[],[],[],1,0,3,[],[],https://twitter.com/FelipeRngel1/status/1410609913798139919,False,,0,,,,,,,,"[{'screen_name': 'Alisujavorksi', 'name': '🇧🇷 GORDO DESNUTRIDO 🇧🇷', 'id': '979431111003697153'}, {'screen_name': 'caioshark', 'name': 'Caio', 'id': '76851361'}, {'screen_name': 'nilmoretto', 'name': 'Nil #ForaBolsonaro | #VacinaJá', 'id': '52499387'}]",,,,
1410608893361725441,1410608893361725441,2021-07-01 11:39:02 SA Eastern Standard Time,2021-07-01,11:39:02,-0300,366094604,gepeto2014,GABRIEL PARON vacina já,,Amazônia tem junho com maior número de queimadas desde 2007  https://t.co/lhqw1k7Ut8 #CadeiaBOLLSONARO #CadeiaLULLA #ForaTODOS #VamoVamoPraRUA #EmendaConstitucionalPOPULAR #FimDaDemocraciaRepresentativa #DemocraciaDIRETA #PlebiscitoPraTUDO #CidadaniaPLENA #EmpregoPLENO,pt,[],['https://www1.folha.uol.com.br/ambiente/2021/07/amazonia-tem-junho-com-maior-numero-de-queimadas-desde-2007.shtml?utm_source=twitter&utm_medium=social&utm_campaign=comptw'],[],0,0,0,"['cadeiabollsonaro', 'cadeialulla', 'foratodos', 'vamovamoprarua', 'emendaconstitucionalpopular', 'fimdademocraciarepresentativa', 'democraciadireta', 'plebiscitopratudo', 'cidadaniaplena', 'empregopleno']",[],https://twitter.com/gepeto2014/status/1410608893361725441,False,,0,,,,,,,,[],,,,
1410608681104732168,1410608681104732168,2021-07-01 11:38:12 SA Eastern Standard Time,2021-07-01,11:38:12,-0300,185729586,siteagoramt,Agora MT,,Amazônia tem junho com maior número de queimadas desde 2007  https://t.co/2H4KFUYarj  https://t.co/gwKhT3IMn3,pt,[],['https://is.gd/B41gqb'],['https://pbs.twimg.com/media/E5N9Ho3VoAIzdpE.jpg'],0,0,0,[],[],https://twitter.com/siteagoramt/status/1410608681104732168,False,,1,https://pbs.twimg.com/media/E5N9Ho3VoAIzdpE.jpg,,,,,,,[],,,,
1410607608487022600,1410607608487022600,2021-07-01 11:33:56 SA Eastern Standard Time,2021-07-01,11:33:56,-0300,1168549394830020608,robertocidadeam,Roberto Cidade,,"Infelizmente, uma má notícia.  Segundo o Instituto Nacional de Pesquisa Espaciais (Inpe), a Amazônia teve 2.308 focos de calor em junho, o maior número de queimadas desde 2007 para o mesmo mês comparado com dos anos anteriores.",pt,[],[],[],0,0,2,[],[],https://twitter.com/RobertoCidadeAm/status/1410607608487022600,False,,0,,,,,,,,[],,,,
1410607491533066248,1410607491533066248,2021-07-01 11:33:28 SA Eastern Standard Time,2021-07-01,11:33:28,-0300,54312869,pcdob_oficial,PCdoB 🇧🇷,,Passando a boiada: taxa de queimadas na Amazônia é o maior desde 2007  https://t.co/b5XmShYrAN,pt,[],['https://vermelho.org.br/2021/07/01/passando-a-boiada-taxa-de-queimadas-na-amazonia-e-o-maior-desde-2007/'],[],1,2,6,[],[],https://twitter.com/PCdoB_Oficial/status/1410607491533066248,False,,0,,,,,,,,[],,,,
1410607484520173571,1410607484520173571,2021-07-01 11:33:26 SA Eastern Standard Time,2021-07-01,11:33:26,-0300,45908423,portalvermelho,Portal Vermelho,,Passando a boiada: taxa de queimadas na Amazônia é o maior desde 2007  https://t.co/tqPn5GPora,pt,[],['https://vermelho.org.br/2021/07/01/passando-a-boiada-taxa-de-queimadas-na-amazonia-e-o-maior-desde-2007/'],[],0,0,2,[],[],https://twitter.com/portalvermelho/status/1410607484520173571,False,,0,,,,,,,,[],,,,
1410606536288653316,1410606536288653316,2021-07-01 11:29:40 SA Eastern Standard Time,2021-07-01,11:29:40,-0300,29274419,otempo,O Tempo,,Amazônia tem junho com maior número de queimadas desde 2007  https://t.co/DXSgpw7xYm,pt,[],['https://www.otempo.com.br/brasil/amazonia-tem-junho-com-maior-numero-de-queimadas-desde-2007-1.2506790'],[],0,1,3,[],[],https://twitter.com/otempo/status/1410606536288653316,False,,0,,,,,,,,[],,,,
1410602690585915401,1410602690585915401,2021-07-01 11:14:23 SA Eastern Standard Time,2021-07-01,11:14:23,-0300,1041328367499239425,jpdrmsq,João Pedro Mesquita,,Renovamos o recorde do ano passado e tivemos o mês de junho com mais queimadas na Amazônia desde 2007. A temporada do fogo promete ser animada...  Ainda que bem que também renovamos a GLO e as Forças Armadas tão por lá cuidando da nossa Amazônia 🙏   https://t.co/NGf0W2bMzh,pt,[],['https://g1.globo.com/natureza/amazonia/noticia/2021/07/01/amazonia-tem-o-maior-numero-de-focos-de-queimadas-dos-ultimos-14-anos-para-mes-de-junho.ghtml'],[],0,0,0,[],[],https://twitter.com/jpdrmsq/status/1410602690585915401,False,,0,,,,,,,,[],,,,
1410601054014644236,1410601054014644236,2021-07-01 11:07:53 SA Eastern Standard Time,2021-07-01,11:07:53,-0300,35524446,ecodebate,Portal EcoDebate,,Fogo na Amazônia: Junho registra maior número de focos de calor desde 2007  Registro ocorre na semana em que o governo anuncia o mesmo plano de combate a desmatamento e queimadas que fracassou nos últimos dois anos   https://t.co/58pgnUIEPQ,pt,[],['https://www.ecodebate.com.br/2021/07/01/fogo-na-amazonia-junho-registra-maior-numero-de-focos-de-calor-desde-2007/'],[],0,0,0,[],[],https://twitter.com/ecodebate/status/1410601054014644236,False,,0,,,,,,,,[],,,,
1410600830680457223,1410600830680457223,2021-07-01 11:07:00 SA Eastern Standard Time,2021-07-01,11:07:00,-0300,1396517829894098950,mariade42745134,Maria de Fátima Soares,,"Greenpeace alerta para novo recorde de queimadas na Amazônia  https://t.co/AeUdU5WCoG via @vicentenunes   O ""capeta"" saiu, ficou seu encarregado! 😈😠",pt,"[{'screen_name': 'vicentenunes', 'name': 'vicente nunes', 'id': '58611077'}]",['https://blogs.correiobraziliense.com.br/vicente/greenpeace-alerta-para-novo-recorde-de-queimadas-na-amazonia/'],[],0,0,1,[],[],https://twitter.com/Mariade42745134/status/1410600830680457223,False,,0,,,,,,,,[],,,,
1410599855630610446,1410599855630610446,2021-07-01 11:03:07 SA Eastern Standard Time,2021-07-01,11:03:07,-0300,1204301854433316866,domingosnoguei7,🚩🚩Domingos Nogueira🚩🚩,,G1: Amazônia tem o maior número de focos de queimadas dos últimos 14 anos para mês de junho.  https://t.co/bPLcIJIboG  via @GoogleNews,pt,"[{'screen_name': 'googlenews', 'name': 'google news', 'id': '33584794'}]",['https://g1.globo.com/natureza/amazonia/noticia/2021/07/01/amazonia-tem-o-maior-numero-de-focos-de-queimadas-dos-ultimos-14-anos-para-mes-de-junho.ghtml'],[],0,0,0,[],[],https://twitter.com/DomingosNoguei7/status/1410599855630610446,False,,0,,,,,,,,[],,,,
1410599056301182976,1410599056301182976,2021-07-01 10:59:57 SA Eastern Standard Time,2021-07-01,10:59:57,-0300,63000204,leila_argollo,Leila Argollo Lula da Silva,,Amazônia registra maior número de queimadas dos últimos 14 anos para mês de junho  https://t.co/Wv0ayQK8kJ #3JForaBolsonaro,pt,[],['https://www.diariodocentrodomundo.com.br/essencial/amazonia-registra-maior-numero-de-queimadas-dos-ultimos-14-anos-para-mes-de-junho/'],[],0,2,2,['3jforabolsonaro'],[],https://twitter.com/Leila_Argollo/status/1410599056301182976,False,,0,,,,,,,,[],,,,
1410598827992567828,1410598827992567828,2021-07-01 10:59:02 SA Eastern Standard Time,2021-07-01,10:59:02,-0300,98875202,am_noticias,Amazonas Notícias,,Amazônia tem junho com maior número de queimadas desde 2007  https://t.co/f3zhmv9O3Q,pt,[],['http://dlvr.it/S2rfVZ'],[],0,0,0,[],[],https://twitter.com/am_noticias/status/1410598827992567828,False,,0,,,,,,,,[],,,,
1410597684994400259,1410597684994400259,2021-07-01 10:54:30 SA Eastern Standard Time,2021-07-01,10:54:30,-0300,1134653651706945538,flaviaestevan,Ponto Cru,,Junho de 2021 com maior número de queimadas na Amazônia dos últimos 14 anos.  É... hoje as crianças vão ler notícia e escutar Saga da Amazônia na escola.   https://t.co/seQQVTJRxY,pt,[],['https://www.youtube.com/watch?v=Fa61E8G7Axc&ab_channel=SocorroLira-Topic'],[],0,0,1,[],[],https://twitter.com/FlaviaEstevan/status/1410597684994400259,False,,0,,,,,,,,[],,,,
1410596756656594952,1410596756656594952,2021-07-01 10:50:49 SA Eastern Standard Time,2021-07-01,10:50:49,-0300,14870978,agazetaes,A Gazeta ES,,Amazônia tem junho com maior número de queimadas desde 2007 [  https://t.co/QLcmzpEqj0 ]  https://t.co/7khavx4aqT,pt,[],['https://leia.ag/a/B73C/o2mw7ra'],['https://pbs.twimg.com/media/E5NyPz4WYAIjDql.jpg'],2,0,7,[],[],https://twitter.com/AGazetaES/status/1410596756656594952,False,,1,https://pbs.twimg.com/media/E5NyPz4WYAIjDql.jpg,,,,,,,[],,,,
1410596361779642377,1410596361779642377,2021-07-01 10:49:14 SA Eastern Standard Time,2021-07-01,10:49:14,-0300,606979341,melhorzoom,Melhor Zoom,,Greenpeace alerta para novo recorde de queimadas na Amazônia.  Foi destacado o maior volume de focos de incêndio detectados nos últimos 14 anos. #Natureza #Queimadas #Brasil  https://t.co/oDGZxhiYU7,pt,[],[],['https://pbs.twimg.com/media/E5Nx6icUcAsWTzz.jpg'],0,0,0,"['natureza', 'queimadas', 'brasil']",[],https://twitter.com/melhorzoom/status/1410596361779642377,False,,1,https://pbs.twimg.com/media/E5Nx6icUcAsWTzz.jpg,,,,,,,[],,,,
1410595691437584392,1410595691437584392,2021-07-01 10:46:35 SA Eastern Standard Time,2021-07-01,10:46:35,-0300,43340387,dcm_online,DCM ONLINE,,Amazônia registra maior número de queimadas dos últimos 14 anos para mês de junho  https://t.co/FWQnwkz4Ld,pt,[],['https://www.diariodocentrodomundo.com.br/essencial/amazonia-registra-maior-numero-de-queimadas-dos-ultimos-14-anos-para-mes-de-junho/'],[],2,19,45,[],[],https://twitter.com/DCM_online/status/1410595691437584392,False,,0,,,,,,,,[],,,,
1410594790270377990,1410594790270377990,2021-07-01 10:43:00 SA Eastern Standard Time,2021-07-01,10:43:00,-0300,1178035369985658880,nobrejorge2,Nobre Jorge,,UOL: Amazônia tem junho com maior número de focos de queimadas em 14 anos.  https://t.co/wJqDpViBgb  através do @GoogleNews,pt,"[{'screen_name': 'googlenews', 'name': 'google news', 'id': '33584794'}]",['https://noticias.uol.com.br/meio-ambiente/ultimas-noticias/redacao/2021/07/01/junho-tem-maior-numero-de-focos-de-queimadas-na-amazonia-em-14-anos.htm'],[],0,2,1,[],[],https://twitter.com/NobreJorge2/status/1410594790270377990,False,,0,,,,,,,,[],,,,
1410593985471471619,1410593985471471619,2021-07-01 10:39:48 SA Eastern Standard Time,2021-07-01,10:39:48,-0300,284566764,salles_marcos,Marcos Salles,,Amazônia tem junho com maior número de queimadas desde 2007  https://t.co/KqprOJs791,pt,[],['http://expressopb.net/2021/07/01/amazonia-tem-junho-com-maior-numero-de-queimadas-desde-2007/'],[],0,0,0,[],[],https://twitter.com/salles_marcos/status/1410593985471471619,False,,0,,,,,,,,[],,,,
1410593976030097415,1410593976030097415,2021-07-01 10:39:46 SA Eastern Standard Time,2021-07-01,10:39:46,-0300,60418599,expressopb,ExpressoPB,,Amazônia tem junho com maior número de queimadas desde 2007  https://t.co/z15Q0xI6XM,pt,[],['http://expressopb.net/2021/07/01/amazonia-tem-junho-com-maior-numero-de-queimadas-desde-2007/'],[],0,0,0,[],[],https://twitter.com/ExpressoPB/status/1410593976030097415,False,,0,,,,,,,,[],,,,
1410591669058117632,1410591669058117632,2021-07-01 10:30:36 SA Eastern Standard Time,2021-07-01,10:30:36,-0300,67614895,lucconstantino,Luciana Constantino 🐊😷,,Amazônia tem o maior número de focos de queimadas dos últimos 14 anos para mês de junho | G1  https://t.co/d6xK1D6tXW,pt,[],['https://g1.globo.com/natureza/amazonia/noticia/2021/07/01/amazonia-tem-o-maior-numero-de-focos-de-queimadas-dos-ultimos-14-anos-para-mes-de-junho.ghtml'],[],4,18,57,[],[],https://twitter.com/lucconstantino/status/1410591669058117632,False,,0,,,,,,,,[],,,,
1410589227885248513,1410589227885248513,2021-07-01 10:20:54 SA Eastern Standard Time,2021-07-01,10:20:54,-0300,92741652,institutomais,IMAIS/BISA: Benchmarking Inteligência Sustentável,,Amazônia tem junho com maior número de focos de queimadas em 14 anos  https://t.co/j9aa1Vp6FJ via @UOLNoticias @UOL,pt,"[{'screen_name': 'uolnoticias', 'name': 'uol notícias', 'id': '14594698'}, {'screen_name': 'uol', 'name': 'uol', 'id': '70799317'}]",['https://noticias.uol.com.br/meio-ambiente/ultimas-noticias/redacao/2021/07/01/junho-tem-maior-numero-de-focos-de-queimadas-na-amazonia-em-14-anos.htm'],[],0,0,0,[],[],https://twitter.com/InstitutoMAIS/status/1410589227885248513,False,,0,,,,,,,,[],,,,
1410588940223012867,1410588940223012867,2021-07-01 10:19:45 SA Eastern Standard Time,2021-07-01,10:19:45,-0300,246985981,vivireispsol,Vivi Reis,,"Infelizmente a Amazonia, mês após mês, continua acumulando recordes de desflorestamento e queimadas. Sinal de que não basta apenas mudar a cúpula do Min. do Meio Ambiente. É preciso também tirar Bolsonaro. Enquanto ele não cair, a floresta corre risco.  https://t.co/gOWZl9V6mN",pt,[],['https://g1.globo.com/natureza/amazonia/noticia/2021/07/01/amazonia-tem-o-maior-numero-de-focos-de-queimadas-dos-ultimos-14-anos-para-mes-de-junho.ghtml?utm_source=push&utm_medium=app&utm_campaign=pushg1'],[],2,10,30,[],[],https://twitter.com/vivireispsol/status/1410588940223012867,False,,0,,,,,,,,[],,,,
1410587670938587141,1410587670938587141,2021-07-01 10:14:42 SA Eastern Standard Time,2021-07-01,10:14:42,-0300,176859552,trudaoceans,"José Truda Palazzo, Jr. 🇫🇲🇫🇲🇫🇲☘️",,Parabéns @GeneralMourao emporcalhando a farda com a cinza das queimadas e a venda da soberania brasileira na Amazônia às quadrilhas de malfeitores de toda sorte.,pt,"[{'screen_name': 'generalmourao', 'name': 'general hamilton mourão', 'id': '1058819604741525510'}]",[],[],0,0,0,[],[],https://twitter.com/TrudaOceans/status/1410587670938587141,False,https://twitter.com/o_antagonista/status/1410584310940307461,0,,,,,,,,[],,,,
1410586736560902147,1410586736560902147,2021-07-01 10:11:00 SA Eastern Standard Time,2021-07-01,10:11:00,-0300,171578470,rafaelrba,Rafael Brandão,,"Amazônia tem o maior número de focos de queimadas dos últimos 14 anos. O recorde histórico havia sido registrado em junho do ano passado, mas os dados do mesmo período deste ano foram ainda maiores, representando um aumento de 2,6%.  Isso é assustador!  https://t.co/LX4c6gmcc3",pt,[],['https://www.oantagonista.com/brasil/amazonia-tem-o-maior-numero-de-focos-de-queimadas-dos-ultimos-14-anos/'],[],0,0,1,[],[],https://twitter.com/rafaelrba/status/1410586736560902147,False,,0,,,,,,,,[],,,,
1410585485643292677,1410585485643292677,2021-07-01 10:06:01 SA Eastern Standard Time,2021-07-01,10:06:01,-0300,24237705,diariope,Diario de Pernambuco,,Amazônia tem segundo junho consecutivo com maior número de queimadas  https://t.co/VOkdiqaO23,pt,[],['https://www.diariodepernambuco.com.br/noticia/brasil/2021/07/amazonia-tem-segundo-junho-consecutivo-com-maior-numero-de-queimadas.html'],[],4,3,9,[],[],https://twitter.com/DiarioPE/status/1410585485643292677,False,,0,,,,,,,,[],,,,
1410584310940307461,1410584310940307461,2021-07-01 10:01:21 SA Eastern Standard Time,2021-07-01,10:01:21,-0300,2880932962,o_antagonista,O Antagonista,,A Amazônia teve o maior número de focos de queimadas dos últimos 14 anos de junho para o mês de junho.  https://t.co/5ZMD06dVEk,pt,[],['https://www.oantagonista.com/brasil/amazonia-tem-o-maior-numero-de-focos-de-queimadas-dos-ultimos-14-anos/'],[],11,16,73,[],[],https://twitter.com/o_antagonista/status/1410584310940307461,False,,0,,,,,,,,[],,,,
1410584008497500162,1410584008497500162,2021-07-01 10:00:09 SA Eastern Standard Time,2021-07-01,10:00:09,-0300,1488848017,noticiaminutobr,Notícias ao Minuto Brasil,,Amazônia tem junho com maior número de queimadas desde 2007  https://t.co/V7kvOfy69h #brasil,pt,[],['https://bit.ly/3dzVxRf'],[],0,0,0,['brasil'],[],https://twitter.com/noticiaminutobr/status/1410584008497500162,False,,0,,,,,,,,[],,,,
1410583883264020480,1410583883264020480,2021-07-01 09:59:39 SA Eastern Standard Time,2021-07-01,09:59:39,-0300,70799317,uol,UOL,,Amazônia tem junho com maior número de focos de queimadas em 14 anos  https://t.co/zcfGFtq3go,pt,[],['https://zpr.io/GCE3T56qvK7a'],[],3,2,13,[],[],https://twitter.com/UOL/status/1410583883264020480,False,,0,,,,,,,,[],,,,
1410583565880991754,1410583565880991754,2021-07-01 09:58:24 SA Eastern Standard Time,2021-07-01,09:58:24,-0300,14594698,uolnoticias,UOL Notícias,,Amazônia tem junho com maior número de focos de queimadas em 14 anos  https://t.co/hQDbTWujUA,pt,[],['https://zpr.io/EkPjkXF5yKFc'],[],3,13,40,[],[],https://twitter.com/UOLNoticias/status/1410583565880991754,False,,0,,,,,,,,[],,,,
1410582620489105415,1410582620489105415,2021-07-01 09:54:38 SA Eastern Standard Time,2021-07-01,09:54:38,-0300,3355746328,fiscaldoibama,O FISCAL do IBAMA,,"MAIOR NÚMERO DE FOCOS DE QUEIMADA DOS ÚLTIMOS 14 ANOS!!  De todas as medidas q o desgoverno tomou pra diminuir as queimadas, qual a mais INEFICIENTE?  📝Assinar um DECRETO proibindo queimadas 🐮 Chamar o BOI BOMBEIRO 💤 Mandar MILICO pra Amazônia?   https://t.co/lXY2hixlFS",pt,[],['https://g1.globo.com/natureza/amazonia/noticia/2021/07/01/amazonia-tem-o-maior-numero-de-focos-de-queimadas-dos-ultimos-14-anos-para-mes-de-junho.ghtml'],[],7,79,360,[],[],https://twitter.com/fiscaldoibama/status/1410582620489105415,False,,0,,,,,,,,[],,,,
1410581220988227586,1410581220988227586,2021-07-01 09:49:05 SA Eastern Standard Time,2021-07-01,09:49:05,-0300,1137848000137613312,berninicida,Cida Bernini,,Greenpeace alerta para novo recorde de queimadas na Amazônia  https://t.co/YVdxfbAnlS via @vicentenunes,pt,"[{'screen_name': 'vicentenunes', 'name': 'vicente nunes', 'id': '58611077'}]",['https://blogs.correiobraziliense.com.br/vicente/greenpeace-alerta-para-novo-recorde-de-queimadas-na-amazonia/amp/'],[],0,1,1,[],[],https://twitter.com/BerniniCida/status/1410581220988227586,False,,0,,,,,,,,[],,,,
1410580506463383558,1410580506463383558,2021-07-01 09:46:14 SA Eastern Standard Time,2021-07-01,09:46:14,-0300,67150902,correio,Correio Braziliense,,Greenpeace alerta para novo recorde de queimadas na Amazônia.  Foi destacado o maior volume de focos de incêndio detectados nos últimos 14 anos.  https://t.co/08ZLly9cX9  https://t.co/eLH00ob2ZG,pt,[],['https://bit.ly/3dxuru5'],['https://pbs.twimg.com/media/E5NjfldXEAUigZI.jpg'],1,5,28,[],[],https://twitter.com/correio/status/1410580506463383558,False,,1,https://pbs.twimg.com/media/E5NjfldXEAUigZI.jpg,,,,,,,[],,,,
1410580424108220416,1410580424108220416,2021-07-01 09:45:55 SA Eastern Standard Time,2021-07-01,09:45:55,-0300,3589345337,vanecosta10,A Eng. Florestal do YouTube 🌳,,Só piora... 👇 Amazônia tem o maior número de focos de queimadas dos últimos 14 anos para mês de junho   https://t.co/llfTt9tLTr,pt,[],['https://g1.globo.com/natureza/amazonia/noticia/2021/07/01/amazonia-tem-o-maior-numero-de-focos-de-queimadas-dos-ultimos-14-anos-para-mes-de-junho.ghtml'],[],0,5,35,[],[],https://twitter.com/vanecosta10/status/1410580424108220416,False,,0,,,,,,,,[],,,,
1410576879925579786,1410576879925579786,2021-07-01 09:31:50 SA Eastern Standard Time,2021-07-01,09:31:50,-0300,1050174967298629633,haddaddebochado,Haddad Debochado,,Amazônia registra o MAIOR número de QUEIMADAS no mês de Junho desde 2007.  PARABÉNS A TODOS OS ENVOLVIDOS NA DESTRUIÇÃO DA NOSSA MAIOR RIQUEZA.,pt,[],[],[],3,45,383,[],[],https://twitter.com/HaddadDebochado/status/1410576879925579786,False,,0,,,,,,,,[],,,,
1410576185105469443,1410576185105469443,2021-07-01 09:29:04 SA Eastern Standard Time,2021-07-01,09:29:04,-0300,70799317,uol,UOL,,Amazônia tem junho com maior número de queimadas desde 2007  https://t.co/65er1FCdfs,pt,[],['https://zpr.io/wcEUDyfgnV5Z'],[],5,6,31,[],[],https://twitter.com/UOL/status/1410576185105469443,False,,0,,,,,,,,[],,,,
1410576133050019841,1410576133050019841,2021-07-01 09:28:52 SA Eastern Standard Time,2021-07-01,09:28:52,-0300,14594698,uolnoticias,UOL Notícias,,Amazônia tem junho com maior número de queimadas desde 2007  https://t.co/bgOzHsYXkt,pt,[],['https://zpr.io/Gs68SCScYHB4'],[],6,11,66,[],[],https://twitter.com/UOLNoticias/status/1410576133050019841,False,,0,,,,,,,,[],,,,
1410573329904418818,1410573329904418818,2021-07-01 09:17:43 SA Eastern Standard Time,2021-07-01,09:17:43,-0300,188919827,crmazzet,Cristiane Mazzetti,,Greenpeace alerta para novo recorde de queimadas na Amazônia  https://t.co/UEEoOBXV8p,pt,[],['https://blogs.correiobraziliense.com.br/vicente/greenpeace-alerta-para-novo-recorde-de-queimadas-na-amazonia/'],[],0,0,0,[],[],https://twitter.com/crmazzet/status/1410573329904418818,False,,0,,,,,,,,[],,,,
1410573295653507076,1410573295653507076,2021-07-01 09:17:35 SA Eastern Standard Time,2021-07-01,09:17:35,-0300,10710422,vonivar,vonivar,,Amazônia tem junho com maior número de queimadas desde 2007  https://t.co/ewZMCv9IeW,pt,[],['http://dlvr.it/S2rKdj'],[],0,0,0,[],[],https://twitter.com/vonivar/status/1410573295653507076,False,,0,,,,,,,,[],,,,
1410572906891993088,1410572906891993088,2021-07-01 09:16:02 SA Eastern Standard Time,2021-07-01,09:16:02,-0300,14594813,folha,Folha de S.Paulo,,Amazônia tem junho com maior número de queimadas desde 2007  https://t.co/JQj77mhwix,pt,[],['https://www1.folha.uol.com.br/ambiente/2021/07/amazonia-tem-junho-com-maior-numero-de-queimadas-desde-2007.shtml?utm_source=twitter&utm_medium=social&utm_campaign=twfolha'],[],20,21,134,[],[],https://twitter.com/folha/status/1410572906891993088,False,,0,,,,,,,,[],,,,
1410569436319432706,1410569436319432706,2021-07-01 09:02:15 SA Eastern Standard Time,2021-07-01,09:02:15,-0300,58611077,vicentenunes,Vicente Nunes,,New post: Greenpeace alerta para novo recorde de queimadas na Amazônia  https://t.co/leuZ1iE0Ti,pt,[],['https://blogs.correiobraziliense.com.br/vicente/greenpeace-alerta-para-novo-recorde-de-queimadas-na-amazonia/'],[],0,2,1,[],[],https://twitter.com/vicentenunes/status/1410569436319432706,False,,0,,,,,,,,[],,,,
1410565104580562953,1410537714827550722,2021-07-01 08:45:02 SA Eastern Standard Time,2021-07-01,08:45:02,-0300,1398234724867493889,rosely87771283,Rosely,,@JanainaDoBrasil Hoje nos sabemos  os esta por traz das narrativas das queimadas na  Amazônia as demarcações de terra indígena interesses  de dentro é de fora do país,pt,[],[],[],0,0,0,[],[],https://twitter.com/Rosely87771283/status/1410565104580562953,False,,0,,,,,,,,"[{'screen_name': 'JanainaDoBrasil', 'name': 'Janaina Paschoal', 'id': '759001618884939776'}]",,,,
