id,conversation_id,created_at,date,time,timezone,user_id,username,name,place,tweet,language,mentions,urls,photos,replies_count,retweets_count,likes_count,hashtags,cashtags,link,retweet,quote_url,video,thumbnail,near,geo,source,user_rt_id,user_rt,retweet_id,reply_to,retweet_date,translate,trans_src,trans_dest
1366511190994780166,1366027551349616644,2021-03-01 19:10:31 SA Eastern Standard Time,2021-03-01,19:10:31,-0300,1347277964568915975,atorporno9009,tuxedo mask 🌹,,@fiscaldoibama @Pirulla25 Detalhe q o satélite é pra monitorar a Amazônia sendo que o Governo Bolsonaro favoreceu queimadas 🙄,pt,[],[],[],0,0,0,[],[],https://twitter.com/atorporno9009/status/1366511190994780166,False,,0,,,,,,,,"[{'screen_name': 'fiscaldoibama', 'name': 'O FISCAL do IBAMA', 'id': '3355746328'}, {'screen_name': 'Pirulla25', 'name': 'Pirula', 'id': '363801092'}]",,,,
1366497247572197386,1366241398945628161,2021-03-01 18:15:06 SA Eastern Standard Time,2021-03-01,18:15:06,-0300,1153432125015769090,esfingeamazonic,꧁Märįnhø§꧂,,@D3SKT0P_1S essa dai era pra tá na Amazônia na época das queimadas,pt,[],[],[],1,0,0,[],[],https://twitter.com/esfingeamazonic/status/1366497247572197386,False,,0,,,,,,,,"[{'screen_name': 'D3SKT0P_1S', 'name': 'desktop is', 'id': '1033350156312346624'}]",,,,
1366455181110628353,1366455181110628353,2021-03-01 15:27:57 SA Eastern Standard Time,2021-03-01,15:27:57,-0300,1156393965219930112,bmerimar,TEN BM ERIMAR - Pará 🇧🇷🇧🇷🇧🇷🇺🇸🇮🇱🇺🇸🇮🇱,,"Lançamento do satélite 🛰Amazônia 01. Dia histórico para o Brasil, dia 28 de fevereiro 2021, Bolsonaro lança satélite 100% brasileiro pra ajudar no monitoramento da Amazônia. Para auxiliar no combate ao tráfico de drogas,  desmatamento e das queimadas.  Bravo! 👏🏼👏🏼👏🏼🇧🇷🇧🇷  https://t.co/9IEltavLgV",pt,[],[],[],0,0,1,[],[],https://twitter.com/BmErimar/status/1366455181110628353,False,,1,https://pbs.twimg.com/ext_tw_video_thumb/1366455108939177987/pu/img/9B-yhwZU3l5Grt4q.jpg,,,,,,,[],,,,
1366432717051748354,1366432717051748354,2021-03-01 13:58:41 SA Eastern Standard Time,2021-03-01,13:58:41,-0300,901154506334973953,rogers697,®ogers_Memes_🎯🕷🕸,,Até parece a histórias das queimadas na Amazônia 🤣 #Marvel #vingadoresultimato  https://t.co/Qx1asjZBcM,pt,[],['https://www.instagram.com/p/CL4jhCuHdgE/?igshid=1ik32kkzf1m9u'],[],0,0,0,"['marvel', 'vingadoresultimato']",[],https://twitter.com/Rogers697/status/1366432717051748354,False,,0,,,,,,,,[],,,,
1366407110335090689,1366407110335090689,2021-03-01 12:16:56 SA Eastern Standard Time,2021-03-01,12:16:56,-0300,728716990723072000,arianaitadori,raissa,,"as queimadas na amazônia e cerrado, confirmado essa temática em uma questão de geografia no vestibular  https://t.co/5ommA9h006",pt,[],[],['https://pbs.twimg.com/media/EvZ0BiNWYAA1e-1.jpg'],0,0,7,[],[],https://twitter.com/arianaitadori/status/1366407110335090689,False,,1,https://pbs.twimg.com/media/EvZ0BiNWYAA1e-1.jpg,,,,,,,[],,,,
1366393374220161028,1366393374220161028,2021-03-01 11:22:21 SA Eastern Standard Time,2021-03-01,11:22:21,-0300,1241906673666740225,its_iucas,Príncipe do Semiárido,,Eu amo o contraste entre eu que estudo queimadas na Amazônia onde a agricultura é um grande vilão e minha melhor amiga do mestrado que estuda agrometeorologia e soja na Amazônia,pt,[],[],[],0,0,0,[],[],https://twitter.com/its_Iucas/status/1366393374220161028,False,,0,,,,,,,,[],,,,
1366392153635700736,1366392153635700736,2021-03-01 11:17:30 SA Eastern Standard Time,2021-03-01,11:17:30,-0300,1255520008798683137,roberto_68092,Roberto Pereira 🆙,,"Parabéns ao Diretor do @inpe_mct Dr. @cleziodenardin e toda a sua Equipe, pelo sucesso no lançamento do Satélite Brasileiro Amazonia 1. É muito bom saber que a nossa Amazônia agora terá cobertura radar SAR para controle de desmatamentos e queimadas! (segue)",pt,"[{'screen_name': 'inpe_mct', 'name': 'inpe', 'id': '308605432'}, {'screen_name': 'cleziodenardin', 'name': 'clezio m. de nardin', 'id': '148195363'}]",[],[],1,0,2,[],[],https://twitter.com/Roberto_68092/status/1366392153635700736,False,,0,,,,,,,,[],,,,
1366386468210561025,1366386468210561025,2021-03-01 10:54:54 SA Eastern Standard Time,2021-03-01,10:54:54,-0300,138492825,proindio,Comissão Pró-Índio,,"Com o atraso, o Ibama precisará de uma alternativa para ter helicópteros para combater #queimadas e fiscalizar crimes ambientais na #Amazônia a partir de março deste ano.  https://t.co/mIuApy8gHU",pt,[],['https://theintercept.com/2021/01/07/ibama-muda-edital-para-agradar-fornecedor-e-atraso-pode-deixar-o-orgao-sem-helicopteros-para-fiscalizacao/'],[],0,5,14,"['queimadas', 'amazônia']",[],https://twitter.com/proindio/status/1366386468210561025,False,,0,,,,,,,,[],,,,
1366380493831299073,1366136506029637650,2021-03-01 10:31:10 SA Eastern Standard Time,2021-03-01,10:31:10,-0300,1206708957303230466,fernandinloomps,fernandin,,"@deb156411 @CNNBrasil porque, pra apoiar o bolsonaro tem que ter QI negativo  é o mesmo cara que -não fez quase nada pra impedir a pandemia, nem as queimadas na amazonia e no pantanal -tem um ""conselheiro"" que acredita na terra plana -fez o brasil cair no ranking de liberdade de imprensa  e mt mais",pt,[],[],[],1,0,1,[],[],https://twitter.com/fernandinloomps/status/1366380493831299073,False,,0,,,,,,,,"[{'screen_name': 'deb156411', 'name': 'deborammbarbosa', 'id': '704848045666471936'}, {'screen_name': 'CNNBrasil', 'name': 'CNN Brasil', 'id': '809124436880322561'}]",,,,
1366380025788960770,1366380025788960770,2021-03-01 10:29:18 SA Eastern Standard Time,2021-03-01,10:29:18,-0300,334715092,jrobertosilva_s,Jose Roberto da Silv,,"Agora irão usar isso p demonizar o Brasil por queimadas na Amazônia, bomba atômica urgente no Brasil, me ajuda aí oh Cientistas advertem para risco de nova pandemia com vírus 75 vezes mais mortal do que COVID-19   https://t.co/5YtMnRr6Y5",pt,[],['https://br.sputniknews.com/ciencia_tecnologia/2021022116997298-cientistas-advertem-para-risco-de-nova-pandemia-com-virus-75-vezes-mais-mortal-do-que-covid-19/'],[],0,0,1,[],[],https://twitter.com/JRobertoSilva_S/status/1366380025788960770,False,,0,,,,,,,,[],,,,
1366374381480460291,1366358035447373824,2021-03-01 10:06:53 SA Eastern Standard Time,2021-03-01,10:06:53,-0300,336072544,djwerson,REBOLATIVISTA VACINADO,,@congressoemfoco Vai ser tipo assim: Satélite da NASA aponta aumento de 20% de queimadas na Amazônia em comparação a 2020. Mentira pois...  Satélite brasileiro confirma aumento de 50% de área verde recuperada. E 100% menos desmatamento. Brasil o país q mais preserva o ambiente.,pt,[],[],[],0,0,0,[],[],https://twitter.com/DjWerson/status/1366374381480460291,False,,0,,,,,,,,"[{'screen_name': 'congressoemfoco', 'name': 'Congresso em Foco', 'id': '47754867'}]",,,,
1366323282459447301,1366323282459447301,2021-03-01 06:43:50 SA Eastern Standard Time,2021-03-01,06:43:50,-0300,191858122,jornal_ja,Jornal JÁ,,"Já em órbita, o Amazonia 1 vai ampliar o controle de desmatamento e queimadas  https://t.co/2qH9WSfXVI Ambiente JÁ Ambiente JÁ  https://t.co/qHK2CenGPt",pt,[],['https://www.jornalja.com.br/ambiente/ja-esta-em-orbita-o-amazonia-1-vai-ampliar-o-controle-de-desmatamento-e-queimadas'],['https://pbs.twimg.com/media/EvYnyPDXYAgk386.png'],0,0,1,[],[],https://twitter.com/jornal_ja/status/1366323282459447301,False,,1,https://pbs.twimg.com/media/EvYnyPDXYAgk386.png,,,,,,,[],,,,
1366322891357376516,1366322891357376516,2021-03-01 06:42:17 SA Eastern Standard Time,2021-03-01,06:42:17,-0300,191858122,jornal_ja,Jornal JÁ,,Já está em órbita o Amazonia 1: vai ampliar o controle de desmatamento e queimadas  https://t.co/2qH9WSfXVI Já está em órbita o Amazonia 1: vai ampliar o controle de desmatamento e queimadas Ambiente JÁ Ambiente JÁ  https://t.co/MOfxAkv0Du,pt,[],['https://www.jornalja.com.br/ambiente/ja-esta-em-orbita-o-amazonia-1-vai-ampliar-o-controle-de-desmatamento-e-queimadas'],['https://pbs.twimg.com/media/EvYnbebWYAE-XBG.png'],0,0,0,[],[],https://twitter.com/jornal_ja/status/1366322891357376516,False,,1,https://pbs.twimg.com/media/EvYnbebWYAE-XBG.png,,,,,,,[],,,,
1366167292099362818,1365782999757946881,2021-02-28 20:23:59 SA Eastern Standard Time,2021-02-28,20:23:59,-0300,1090625336222646272,regianebezerr12,rcr,,@Biakicis @Astro_Pontes @jairbolsonaro Pra negligenciar ao vivo as queimadas da Amazônia?,pt,[],[],[],0,0,0,[],[],https://twitter.com/REGIANEBEZERR12/status/1366167292099362818,False,,0,,,,,,,,"[{'screen_name': 'Biakicis', 'name': 'Bia Kicis', 'id': '357030742'}, {'screen_name': 'Astro_Pontes', 'name': 'Marcos Pontes', 'id': '93339429'}, {'screen_name': 'jairbolsonaro', 'name': 'Jair M. Bolsonaro', 'id': '128372940'}]",,,,
1366137266247188488,1366046457787273222,2021-02-28 18:24:40 SA Eastern Standard Time,2021-02-28,18:24:40,-0300,703378433024331778,old_nash,Old_Nash,,"@unab_brasil @carlosjordy Não fui eu que afirmei que as imagens dos satélites da NASA, sobre as queimadas na Amazônia eram falsas. Mesmo com outras agencias afirmando tal coisa, né? Agora com ele, o governo já pode mentir com mais veermencia com ""provas"" que ele fabrica.",pt,[],[],[],0,0,0,[],[],https://twitter.com/Old_Nash/status/1366137266247188488,False,,0,,,,,,,,"[{'screen_name': 'unab_brasil', 'name': 'UNAB', 'id': '1279624990145601536'}, {'screen_name': 'carlosjordy', 'name': 'Carlos Jordy', 'id': '82271629'}]",,,,
1366105289855037440,1365745194361118720,2021-02-28 16:17:36 SA Eastern Standard Time,2021-02-28,16:17:36,-0300,1106699530861510656,ulisseslimaa,Q6sTãoFazendo!?🇧🇷🌎🏳,,@gracabrito20 @SILVASO39432334 @RaquelBlak @jairbolsonaro @mctic @Astro_Pontes Ta sabendo o de foi parar o dinheiro enviado pra combater as queimadas na Amazônia? que não combateram e o dinheiro sumiu e estão pedindo mais. Sabe onde foi parar as cestas básicas que a damares iria doar para os indigenas? E os indígenas não receberam.,pt,[],[],[],0,0,0,[],[],https://twitter.com/Ulisseslimaa/status/1366105289855037440,False,,0,,,,,,,,"[{'screen_name': 'gracabrito20', 'name': 'Imperatriz', 'id': '774679122270384128'}, {'screen_name': 'SILVASO39432334', 'name': 'SILVA & SOUZA', 'id': '1255854351425421313'}, {'screen_name': 'RaquelBlak', 'name': 'Raquel Blak', 'id': '56138718'}, {'screen_name': 'jairbolsonaro', 'name': 'Jair M. Bolsonaro', 'id': '128372940'}, {'screen_name': 'Astro_Pontes', 'name': 'Marcos Pontes', 'id': '93339429'}]",,,,
1366097487832973314,1365967907889573888,2021-02-28 15:46:36 SA Eastern Standard Time,2021-02-28,15:46:36,-0300,1257158207388168194,jaquelinelinqui,Jaqueline Link,,@silvaocastro Óbvio que não tem. Queimadas? Vc sabia que o índice esse ano foi o menor dos últimos anos? Aí não interessa ne? E as ONGs que atearam fogo na Amazônia? Ah amigo...Se liga né?  https://t.co/jm7krpjx3O,pt,[],[],"['https://pbs.twimg.com/media/EvVaaa8WYAIXO7i.jpg', 'https://pbs.twimg.com/media/EvVaa1TXMAUR2Ic.jpg']",1,0,0,[],[],https://twitter.com/JaquelineLinqui/status/1366097487832973314,False,,1,https://pbs.twimg.com/media/EvVaaa8WYAIXO7i.jpg,,,,,,,"[{'screen_name': 'silvaocastro', 'name': 'Silvio, 🚩Saudades de ter presidente🚩🇾🇪🇾🇪', 'id': '540337757'}]",,,,
1366094309334908933,1366040463279497220,2021-02-28 15:33:58 SA Eastern Standard Time,2021-02-28,15:33:58,-0300,1356600162966192131,helosal15254714,Heloísa Lopes,,"@Anitta Quando será que a defensora da Amazônia vai posta !!!! Primeiro satélite brasileiro , irá monitora queimadas e toda área da Amazônia .  https://t.co/tjVrmCT6sd",pt,[],[],['https://pbs.twimg.com/media/EvVXh1ZXEAUOQOq.jpg'],0,0,0,[],[],https://twitter.com/HelosaL15254714/status/1366094309334908933,False,,1,https://pbs.twimg.com/media/EvVXh1ZXEAUOQOq.jpg,,,,,,,"[{'screen_name': 'Anitta', 'name': 'Anitta', 'id': '141817380'}]",,,,
1366062873110319110,1366062873110319110,2021-02-28 13:29:03 SA Eastern Standard Time,2021-02-28,13:29:03,-0300,1028643183369048065,plinio78437520,Plini,,"Satélite fabricaado no Brasil será vigilante da Amazônia.Agora quero ver relatório das ongs sobre desmatamento e queimadas .Também.monitoraras.mineiradoras clandestinas e roubos mais,não dona Marina ?",pt,[],[],[],0,0,0,[],[],https://twitter.com/Plinio78437520/status/1366062873110319110,False,,0,,,,,,,,[],,,,
1366060260243439619,1365908940928684032,2021-02-28 13:18:40 SA Eastern Standard Time,2021-02-28,13:18:40,-0300,1009063892847296512,stucknstray,stojan chankov,,"@ryanalves20000 @Astronomiaum o objetivo dele é auxiliar no monitoramento do desmatamento na Amazônia.  com ele, será mais fácil localizar focos de desmatamento, além de focos de queimadas tbm.",pt,[],[],[],0,0,21,[],[],https://twitter.com/stucknstray/status/1366060260243439619,False,,0,,,,,,,,"[{'screen_name': 'ryanalves20000', 'name': 'Ryan Alves', 'id': '708687172757544960'}, {'screen_name': 'Astronomiaum', 'name': 'Astronomiaum 🌎 🚀', 'id': '764141902572691456'}]",,,,
1366050439477792774,1366030988875362308,2021-02-28 12:39:39 SA Eastern Standard Time,2021-02-28,12:39:39,-0300,810606897023873024,gabreboredo23,Gabriel,,"@dipaula2021 @Estadao Exatamente. O Inpe já analisou os impactos das queimadas com imagens reais da Amazônia, desde sei lá, 2018. E nada foi feito desde então. Mas agora com esse satélite vai.. 👍",pt,[],[],[],0,0,0,[],[],https://twitter.com/gabreboredo23/status/1366050439477792774,False,,0,,,,,,,,"[{'screen_name': 'dipaula2021', 'name': 'martha_dipaula2021', 'id': '1351189843087384577'}, {'screen_name': 'Estadao', 'name': 'Estadão', 'id': '9317502'}]",,,,
1366048507426189314,1365852692560699394,2021-02-28 12:31:58 SA Eastern Standard Time,2021-02-28,12:31:58,-0300,197537582,sansadu,sandra sadu,,"@BetoSilvaBR @fbras11 @madrilenha @jairbolsonaro Passa em todos os canais fechados. Falam que as queimadas continuam e cada vez mais. Mostram imagens. É claro que terminam pedindo doações para ""salvar a Amazônia"". É bem longa a publicidade negativa. H&amp;B, HGTV....",pt,[],[],[],2,1,2,[],[],https://twitter.com/sansadu/status/1366048507426189314,False,,0,,,,,,,,"[{'screen_name': 'BetoSilvaBR', 'name': 'BetoSilvaBR 🇧🇷🇧🇷', 'id': '2808633116'}, {'screen_name': 'madrilenha', 'name': 'Maria', 'id': '67487546'}, {'screen_name': 'jairbolsonaro', 'name': 'Jair M. Bolsonaro', 'id': '128372940'}]",,,,
1366031754444824579,1366031739567689734,2021-02-28 11:25:24 SA Eastern Standard Time,2021-02-28,11:25:24,-0300,246033826,juliabrazolim,hey julia brazolim,,"Pra quem tiver curiosidade em conhecer o satélite Amazônia 1, recomendo essa leitura. E dizer aqui que a conquista é do INPE, não do cosplay de astronauta ou do buz0, mas do INPE. O mesmo que foi ignorado quanto aos dados das queimadas.  https://t.co/sRtlg9oWgs",pt,[],['http://www.inpe.br/noticias/noticia.php?Cod_Noticia=5706'],[],1,3,8,[],[],https://twitter.com/JuliaBrazolim/status/1366031754444824579,False,,0,,,,,,,,[],,,,
1366016433063415810,1366016433063415810,2021-02-28 10:24:31 SA Eastern Standard Time,2021-02-28,10:24:31,-0300,37817071,filipedomingues,Filipe Domingues,,"Se tiver a chance ouça comentaristas de saúde internacionais.  Alguns dizem que se a pandemia não for controlada em países populosos como o Brasil, o México e aqueles do continente africano, o mundo todo vai sofrer.  Voltaremos ao foco global, como com as queimadas na Amazônia.",pt,[],[],[],0,1,14,[],[],https://twitter.com/filipedomingues/status/1366016433063415810,False,,0,,,,,,,,[],,,,
1365961691775856642,1365957905384570880,2021-02-28 06:47:00 SA Eastern Standard Time,2021-02-28,06:47:00,-0300,1350432924261359620,beckterlouie,Louie beckTer,,"@CNNBrasil O programa espacial brasileiro é tão decepcionante que depende de um foguete indiano para ir ao espaço. Além disso, um satélite para monitoramento da Amazônia — pergunto-me por qual razão, se não fazemos absolutamente nada contra queimadas, desmatamentos e garimpos ilegais.",pt,[],[],[],3,0,7,[],[],https://twitter.com/BeckterLouie/status/1365961691775856642,False,,0,,,,,,,,"[{'screen_name': 'CNNBrasil', 'name': 'CNN Brasil', 'id': '809124436880322561'}]",,,,
1365935514868719616,1365925913670656000,2021-02-28 05:02:59 SA Eastern Standard Time,2021-02-28,05:02:59,-0300,1103424726532349952,maelawa2,Lawa2,,"@humberto_herb @Astronomiaum A missão do Amazônia 1 é monitorar a floresta e identificar queimadas, grilagem, desmatamento, garimpo ilegal entre outras atividades que vão contra o regulamento das áreas de proteção ambiental na região amazônica e em outros biomas brasileiros próximos.",pt,[],[],[],2,0,3,[],[],https://twitter.com/Maelawa2/status/1365935514868719616,False,,0,,,,,,,,"[{'screen_name': 'Astronomiaum', 'name': 'Astronomiaum 🌎 🚀', 'id': '764141902572691456'}]",,,,
1365926715944493056,1365915179112951808,2021-02-28 04:28:01 SA Eastern Standard Time,2021-02-28,04:28:01,-0300,1038087906148188160,koonigg,Kœnigsberg,,"@mandybebe16 Conseguiram problematizar até nosso primeiro satélite, sendo construído desde 2008 para conter as queimadas na Amazônia, marco em nossa história.",pt,[],[],[],0,0,1,[],[],https://twitter.com/koonigg/status/1365926715944493056,False,,0,,,,,,,,[],,,,
1365900115236573185,1365898093078667271,2021-02-28 02:42:19 SA Eastern Standard Time,2021-02-28,02:42:19,-0300,1093171958622109696,ivapaulany3822,iva1,,"@jairbolsonaro Parabéns Presidente Bolsonaro, Parabéns Ministro Marcos Pontes. O Brasil acaba de lançar a partir da Índia,o primeiro Satélite totalmente brasileiro,q rá monitorar queimadas e outras irregularidades na Amazônia.Hercúlea esse projeto necessário,acaba a narrativa de descaso. 🇧🇷👏🏻👏🏻",pt,[],[],[],1,0,12,[],[],https://twitter.com/ivapaulany3822/status/1365900115236573185,False,,0,,,,,,,,"[{'screen_name': 'jairbolsonaro', 'name': 'Jair M. Bolsonaro', 'id': '128372940'}]",,,,
1365898827698438145,1365897072633864195,2021-02-28 02:37:12 SA Eastern Standard Time,2021-02-28,02:37:12,-0300,2628645893,panasancho,Correia Filho,,"@TitioSilvio38 @TitiaCila É verdade Tito, mas o INPE,  formado na era petista, destrata Bolsonaro por querer moralizar as notícias das ONGs q falam das queimadas na Amazônia, sempre com ranço ideológico",pt,[],[],[],0,0,1,[],[],https://twitter.com/PanaSancho/status/1365898827698438145,False,,0,,,,,,,,[],,,,
1365890082947874817,1365890082947874817,2021-02-28 02:02:27 SA Eastern Standard Time,2021-02-28,02:02:27,-0300,138812030,denisfoto,Denis Ferreira Netto,,"Amazônia 1 - Primeiro Satélite 100% Brasileiro é lançado na Índia, vai monitorar o desmatamento e as queimadas do desgoverno brasileiro.  https://t.co/zCOZAQRPhK",pt,[],[],"['https://pbs.twimg.com/media/EvSdyYHXUAU6A3L.jpg', 'https://pbs.twimg.com/media/EvSdyYDXYAMudTr.jpg']",0,0,2,[],[],https://twitter.com/DenisFoto/status/1365890082947874817,False,,1,https://pbs.twimg.com/media/EvSdyYHXUAU6A3L.jpg,,,,,,,[],,,,
1365886085793001472,1365886085793001472,2021-02-28 01:46:34 SA Eastern Standard Time,2021-02-28,01:46:34,-0300,576317858,monicasalescruz,🇧🇷Mônica Sales 🙏🏼🇧🇷🙏🏼,,"É uma verdadeira estratégia para não haver mais fakes sobre as queimadas da Amazônia.  As terras já tem escrituras, cada uma com sua demarcação. Onde houver queimadas ou desmatamento, vai ter endereço e nome certo.  Quero ver ONGs aprontarem de novo    https://t.co/7ipv03O6xv",pt,[],['https://agenciabrasil.ebc.com.br/geral/noticia/2021-02/satelite-brasileiro-sera-lancado-na-madrugada-deste-domingo'],[],0,3,14,[],[],https://twitter.com/monicasalescruz/status/1365886085793001472,False,,0,,,,,,,,[],,,,
1365859809405329409,1365859809405329409,2021-02-28 00:02:09 SA Eastern Standard Time,2021-02-28,00:02:09,-0300,1354299455466565634,marcelossa01ba,Marcelo Santos,,"Após os caças Gripen, da Embraer exportar aviões para a maior companhia aérea regional do mundo, o lançamento do satélite esta madrugada, põe fim a uma era de Ong's que saquearam os cofres públicos. Finda também os descontroles das queimadas na Amazônia. Só lamento...",pt,[],[],[],0,0,2,[],[],https://twitter.com/MarceloSSA01BA/status/1365859809405329409,False,,0,,,,,,,,[],,,,
1365854599631011844,1365852640379367424,2021-02-27 23:41:27 SA Eastern Standard Time,2021-02-27,23:41:27,-0300,985647642574229505,jpschwenck,j.p guurdenky sliplogruya-q schwenck,,@OTalDoTioCris1 Vai monitorar a Amazônia das queimadas e desmatamentos q o próprio governo vai bancar,pt,[],[],[],0,0,1,[],[],https://twitter.com/jpschwenck/status/1365854599631011844,False,,0,,,,,,,,[],,,,
1365839539705683970,1365745194361118720,2021-02-27 22:41:36 SA Eastern Standard Time,2021-02-27,22:41:36,-0300,91830381,marcosjacob,Marcos Jacob 🇧🇷,,"@cloroazitrzonio @jairbolsonaro @mctic @Astro_Pontes Satélite exclusivo para monitoramento de queimadas na Amazônia, comprado com dinheiro destinado à ciência e tecnologia. No governo Bolsonaro não há corrupção. Monitoramento de queimadas para que pessoas idiotas, como vc, parem de falar merda. 🖕",pt,[],[],[],1,0,1,[],[],https://twitter.com/marcosjacob/status/1365839539705683970,False,,0,,,,,,,,"[{'screen_name': 'cloroazitrzonio', 'name': 'Vic', 'id': '739146841510514688'}, {'screen_name': 'jairbolsonaro', 'name': 'Jair M. Bolsonaro', 'id': '128372940'}, {'screen_name': 'Astro_Pontes', 'name': 'Marcos Pontes', 'id': '93339429'}]",,,,
1365826164573536256,1365826164573536256,2021-02-27 21:48:28 SA Eastern Standard Time,2021-02-27,21:48:28,-0300,1161382148,waltersonferrei,walterson ferreira ,,"A TV BRASIL  transmite a 1 da manhã o lançamento do primeiro satélite 100% brasileiro, vai monitorar as queimadas da Amazônia. Um avanço espacial brasileiro.",pt,[],[],[],0,0,1,[],[],https://twitter.com/waltersonferrei/status/1365826164573536256,False,,0,,,,,,,,[],,,,
1365825782107504643,1365745194361118720,2021-02-27 21:46:56 SA Eastern Standard Time,2021-02-27,21:46:56,-0300,141058845,maton_3,Márcia Tondello,,"@jairbolsonaro @taoquei1 @mctic @Astro_Pontes Que o lançamento seja um sucesso, auxiliando para pôr fim às narrativas fraudulentas sobre as ""queimadas"" etc na Amazônia. 👏👏👏 Parabéns por mais esse trabalho incrível.",pt,[],[],[],1,0,0,[],[],https://twitter.com/Maton_3/status/1365825782107504643,False,,0,,,,,,,,"[{'screen_name': 'jairbolsonaro', 'name': 'Jair M. Bolsonaro', 'id': '128372940'}, {'screen_name': 'taoquei1', 'name': 'TeAtualizei 🇧🇷👊🏻❤️', 'id': '1087259768'}, {'screen_name': 'Astro_Pontes', 'name': 'Marcos Pontes', 'id': '93339429'}]",,,,
1365824892453740546,1365392984775286786,2021-02-27 21:43:24 SA Eastern Standard Time,2021-02-27,21:43:24,-0300,1080848412080263168,haden_st,ANONIMATO,,"@KoryeDick @MongeHan @wilherondal Mano, eu não entro no assunto da Amazônia pq é bem complicado, alem das queimadas criminosas, tem as que são naturais e talz. Só peço ao ser maior que ele ilumine nossas vidas e nos ajude a solucionar esses problemas, pq do jeito que ta indo é foda :|",pt,[],[],[],1,0,1,[],[],https://twitter.com/Haden_St/status/1365824892453740546,False,,0,,,,,,,,"[{'screen_name': 'KoryeDick', 'name': '𝑰𝒛𝒂𝒅𝒐𝒓𝒂 𝒘𝒊𝒕𝒉 𝒂𝒏 𝒁🍒', 'id': '947497683115225089'}, {'screen_name': 'MongeHan', 'name': 'monjinho✨', 'id': '723684990727393281'}, {'screen_name': 'wilherondal', 'name': 'r.', 'id': '1894854835'}]",,,,
1365819005471232003,1365818531762352128,2021-02-27 21:20:01 SA Eastern Standard Time,2021-02-27,21:20:01,-0300,3186876029,feijoao_,canecagem sana pn,,@mari_bebop Propaganda ao assassinato da fauna e flora em consequência das queimadas na Amazônia (fogo grátis),pt,[],[],[],0,0,1,[],[],https://twitter.com/feijoao_/status/1365819005471232003,False,,0,,,,,,,,"[{'screen_name': 'mari_bebop', 'name': 'Mesas para festa', 'id': '1337398744111853568'}]",,,,
1365804107622191106,1365804107622191106,2021-02-27 20:20:49 SA Eastern Standard Time,2021-02-27,20:20:49,-0300,482329757,ngsampa,Nathanael Giglio,,"Hoje 23:50 Hs. de Brasília será lançado o satélite totalmente brasileiro AMAZÔNIA 1 - Servirá para funcionar como um "" OLHO "" sobre toda esta região principalmente rastrear as chamadas queimadas ! Poderemos acompanhar o lançamento pelo LINK -&gt;  https://t.co/8gjz0ZEIVi",pt,[],['https://www.youtube.com/watch?v=3AdHg1vYKa4'],[],0,0,1,[],[],https://twitter.com/ngsampa/status/1365804107622191106,False,,0,,,,,,,,[],,,,
1365790598750490635,1365745194361118720,2021-02-27 19:27:08 SA Eastern Standard Time,2021-02-27,19:27:08,-0300,1000388273792045056,juliame75489206,Brasileira juli🇧🇷🇧🇷🇧🇷💚💛💙,,@jairbolsonaro @mctic @Astro_Pontes Preparando Presidente o STF vai te pedir explicações porque o senhor vai mandar na órbita do planeta sem dar satisfação a eles! Lembra ágora as  queimadas da Amazônia vão passar ser cultural para o PT!,pt,[],[],[],0,3,10,[],[],https://twitter.com/JuliaMe75489206/status/1365790598750490635,False,,0,,,,,,,,"[{'screen_name': 'jairbolsonaro', 'name': 'Jair M. Bolsonaro', 'id': '128372940'}, {'screen_name': 'Astro_Pontes', 'name': 'Marcos Pontes', 'id': '93339429'}]",,,,
1365777791514529795,1365443640131264512,2021-02-27 18:36:15 SA Eastern Standard Time,2021-02-27,18:36:15,-0300,1239336986915278848,josucordeiro5,Josué Cordeiro,,"@cappellarianton Quem não se lembra da crise hídrica de SP x séculos de seca no nordeste, das queimadas anuais na Amazônia x da mata Atlântica, os desastres naturais e atentados que acontecem nos países pobres x ricos?Parece que os acontecimentos doem mais em alguma parte do mundo que em outras.",pt,[],[],[],1,1,2,[],[],https://twitter.com/JosuCordeiro5/status/1365777791514529795,False,,0,,,,,,,,"[{'screen_name': 'cappellarianton', 'name': 'Antonio Cappellari LULA É O ÚNICO CAMINHO', 'id': '137545998'}]",,,,
