id,conversation_id,created_at,date,time,timezone,user_id,username,name,place,tweet,language,mentions,urls,photos,replies_count,retweets_count,likes_count,hashtags,cashtags,link,retweet,quote_url,video,thumbnail,near,geo,source,user_rt_id,user_rt,retweet_id,reply_to,retweet_date,translate,trans_src,trans_dest
1373754330692657156,1373661930276159497,2021-03-21 18:52:10 -03,2021-03-21,18:52:10,-0300,63229394,tomboypg3,Wellington,,"@Estadao @EstadaoEconomia Xiiiii  de novo essa blá blá blá de desmatamento Amazônia pulmão do mundo pingüim passando frio na Amazônia elefante sendo mortos por fazendeiro 🥱o coco da vaca acabando com a camada de ozônio 🥱 aí depis volta para o Queiroz, depois Flávio rachadinha Bolsonaro sem máscara🥱",pt,[],[],[],0,0,0,[],[],https://twitter.com/tomboypg3/status/1373754330692657156,False,,0,,,,,,,,"[{'screen_name': 'Estadao', 'name': 'Estadão', 'id': '9317502'}, {'screen_name': 'EstadaoEconomia', 'name': 'Economia Estadão', 'id': '78774644'}]",,,,
1373749476523925518,1373749476523925518,2021-03-21 18:32:52 -03,2021-03-21,18:32:52,-0300,1354064265485955075,joaoliraam,João Lira,,"Esses últimos dias, muito tem se falado sobre bioeconomia, esse é um caminho incrível pra desenvolver a Amazônia, a floresta em pé gera muito mais valor do que o desmatamento desregrado",pt,[],[],[],1,0,1,[],[],https://twitter.com/joaoliraam/status/1373749476523925518,False,,0,,,,,,,,[],,,,
1373746422286278656,1373746422286278656,2021-03-21 18:20:44 -03,2021-03-21,18:20:44,-0300,1351660158015983616,amazoniaobserva,Observatório da Amazônia,,"“Assim, não vemos até o momento nenhuma melhoria material em relação ao meio ambiente e à região amazônica”   https://t.co/chwyx2NC8e  #amazonia #amazoniaobserva #desmatamento #economia",pt,[],"['https://economia.estadao.com.br/noticias/geral,fundos-estrangeiros-acusam-governo-de-nao-ter-mudado-postura-sobre-pauta-ambiental,70003654867']",[],0,0,0,"['amazonia', 'amazoniaobserva', 'desmatamento', 'economia']",[],https://twitter.com/amazoniaobserva/status/1373746422286278656,False,,0,,,,,,,,[],,,,
1373745514257260547,1373744896490803211,2021-03-21 18:17:08 -03,2021-03-21,18:17:08,-0300,1273325160314134530,xtrago1,Xtrago,,@thiwitter Hoje estava assistindo a um documentario de uns 7 anos atras sobre as tribos indigenas da amazonia e o pilot responsavel pela transporte da equipe de filmagem falou: e se surgir um virus? o desmatamento vai piorar a situacao. Nem precisava ser cientista para prever Manaus.,pt,[],[],[],1,0,17,[],[],https://twitter.com/Xtrago1/status/1373745514257260547,False,,0,,,,,,,,"[{'screen_name': 'thiwitter', 'name': 'Thiago Theodoro 🏳️\u200d🌈', 'id': '16142566'}]",,,,
1373735349885804547,1373735349885804547,2021-03-21 17:36:44 -03,2021-03-21,17:36:44,-0300,1167588157,feamaral_online,🌶Fernanda Amaral🌶,,"Queria que aqueles que ficam esbravejando “meu país nunca será vermelho” fizesse algo para que ele volte se tornar verde, por favor: nas bandeiras de gravidade do Covid nos estados brasileiros; em combater o desmatamento, principalmente da Amazônia e do Pantanal...",pt,[],[],[],1,0,2,[],[],https://twitter.com/FeAmaral_online/status/1373735349885804547,False,,0,,,,,,,,[],,,,
1373712153841111044,1373712153841111044,2021-03-21 16:04:34 -03,2021-03-21,16:04:34,-0300,54527239,jornal_opopular,O Popular,,"Para Peter Wilson, 52, embaixador do Reino Unido no Brasil, a preocupação em todo o mundo em relação ao desmatamento na Amazônia não representa uma campanha negativa de mídia contra o país, mas um temor genuíno.   📲 Leia Agora no #OPOPULAR  https://t.co/UMv3IK5tTv",pt,[],['http://ow.ly/5xJL50E4tjH'],[],1,1,3,['opopular'],[],https://twitter.com/jornal_opopular/status/1373712153841111044,False,,0,,,,,,,,[],,,,
1373709554005999623,1373709554005999623,2021-03-21 15:54:14 -03,2021-03-21,15:54:14,-0300,101764971,elessejp,Elesse jp - Patriota e democratico 🇧🇷,,"E ai Macrom, esquerdolixos , é culpa do JB ? Ou é o vírus do desmatamento da Amazônia?  https://t.co/N0XyBls8uZ",pt,[],[],['https://pbs.twimg.com/media/ExBljwiW8AU35FY.jpg'],0,0,5,[],[],https://twitter.com/elessejp/status/1373709554005999623,False,,1,https://pbs.twimg.com/media/ExBljwiW8AU35FY.jpg,,,,,,,[],,,,
1373706163154530304,1373706163154530304,2021-03-21 15:40:46 -03,2021-03-21,15:40:46,-0300,1581371587,sethsblair,luke,,"to assistindo crepúsculo, o soco no bruxo que precisa de um pedaço de pau pra lançar feitiço, o desmatamento da amazônia grita nessa situação",pt,[],[],[],0,0,3,[],[],https://twitter.com/sethsblair/status/1373706163154530304,False,,0,,,,,,,,[],,,,
1373700870408392706,1373661780447268867,2021-03-21 15:19:44 -03,2021-03-21,15:19:44,-0300,1359342934089494533,pngeba,P.N.G.,,"@83MarcosSantos Essa é a fake news mais bem feita que eu já vi, pois a Amazônia teve uma queda de 45% no desmatamento nos últimos 20 anos ( dados retirados da GLOBO ), A corrupção realmente diminuiu, mas o único problema é que ainda a governadores e prefeitos que estão com o rabo preso no PT",pt,[],[],[],3,0,0,[],[],https://twitter.com/PNGeba/status/1373700870408392706,False,,0,,,,,,,,"[{'screen_name': '83MarcosSantos', 'name': 'Marcos Brasil 🇧🇷☘1️⃣2️⃣🌹', 'id': '574005969'}]",,,,
1373690315572412418,1373118293331079174,2021-03-21 14:37:47 -03,2021-03-21,14:37:47,-0300,1956783692,ericofmartins,EricoFMartins,,"@AntifascistaCe @helenapalmquist @zubrycky @Leoni_a_jato Sim, com bostanaro o Ibama foi destruído. Nos governos do PT aumentou a fiscalização na Amazônia e houve queda considerável no desmatamento. No entanto, o pantanal e o cerrado (dois biomas cruciais para o país) não receberam a mesma atenção.",pt,[],[],[],0,0,0,[],[],https://twitter.com/EricoFMartins/status/1373690315572412418,False,,0,,,,,,,,"[{'screen_name': 'AntifascistaCe', 'name': 'Mário Gaspar', 'id': '73778042'}, {'screen_name': 'helenapalmquist', 'name': 'Helena Palm', 'id': '28157433'}, {'screen_name': 'zubrycky', 'name': 'Diego Zubrycky', 'id': '28055998'}, {'screen_name': 'Leoni_a_jato', 'name': 'Leoni', 'id': '16968506'}]",,,,
1373661782720573441,1373661782720573441,2021-03-21 12:44:25 -03,2021-03-21,12:44:25,-0300,1347589475191451650,hubespecialista,O Especialista,,Desmatamento na Amazônia afasta fundos estrangeiros  https://t.co/L2tvBPcJTB,pt,[],['https://oespecialista.com.br/desmatamento-amazonia-afasta-fundos-estrangeiros/'],[],0,0,0,[],[],https://twitter.com/hubespecialista/status/1373661782720573441,False,,0,,,,,,,,[],,,,
1373658269449863169,1372607948409692161,2021-03-21 12:30:27 -03,2021-03-21,12:30:27,-0300,262737479,maryjuana2108,Maria Atônita,,"@FaccirolliRafa Responsável por 69% dos gases do efeito estufa, 80% do desmatamento da Amazônia, além de que 70% das doenças desde 1940 surgiram por causa da pecuária (dados da ONU), então mais uma vez: muito obrigada, Igreja!",pt,[],[],[],1,0,0,[],[],https://twitter.com/maryjuana2108/status/1373658269449863169,False,,0,,,,,,,,"[{'screen_name': 'FaccirolliRafa', 'name': 'Raffs é nóis', 'id': '1057284304185769985'}]",,,,
1373606182456332289,1373606182456332289,2021-03-21 09:03:28 -03,2021-03-21,09:03:28,-0300,4826996662,p_orliange,Philippe Orliange,,"#DiaInternacionalDasFlorestas O projeto #TerrAmaz de €9,5 mi apoia o desenvolvimento econômico de baixo carbono e a conservação dos ecossistemas  para o combate ao desmatamento na Amazônia 🇧🇷🇨🇴🇵🇪🇪🇨, @AFD_France @franceaubresil @rachel_alvares @Mathieu_Boche  https://t.co/qMCn11VnxM",pt,"[{'screen_name': 'afd_france', 'name': 'agence française de #développement (afd) 🇫🇷', 'id': '140897183'}, {'screen_name': 'franceaubresil', 'name': 'france au brésil', 'id': '296426423'}, {'screen_name': 'rachel_alvares', 'name': 'rachel marimon alvares', 'id': '1096481990671589376'}, {'screen_name': 'mathieu_boche', 'name': 'mathieu boche', 'id': '322068149'}]",[],['https://pbs.twimg.com/media/ExAHN-6WUAAMo_J.jpg'],0,3,7,"['diainternacionaldasflorestas', 'terramaz']",[],https://twitter.com/P_Orliange/status/1373606182456332289,False,,1,https://pbs.twimg.com/media/ExAHN-6WUAAMo_J.jpg,,,,,,,[],,,,
1373605947235504128,1373605942160457728,2021-03-21 09:02:32 -03,2021-03-21,09:02:32,-0300,861707648584085504,govbr,Governo do Brasil,,🌳 As ações do Conselho Nacional da Amazônia Legal vêm gerando resultados expressivos: queda de 21% no desmatamento ilegal de agosto do ano passado a fevereiro deste ano e ampliação da presença do Estado na região amazônica.,pt,[],[],[],3,12,67,[],[],https://twitter.com/govbr/status/1373605947235504128,False,,0,,,,,,,,[],,,,
1373598580624273412,1373598580624273412,2021-03-21 08:33:16 -03,2021-03-21,08:33:16,-0300,1268323729429446656,argemirotlf,Argemiro T. Leite-Filho,,Não posso deixar de compartilhar esta plataforma sensacional que estimula a venda de produtos da Amazônia Legal feitos exclusivamente por artesãos e artesãs locais. O combate ao desmatamento também é educacional.  https://t.co/m9WKnEdayy,pt,[],[],['https://pbs.twimg.com/media/ExAALwHXMAQaOu6.jpg'],0,0,0,[],[],https://twitter.com/Argemirotlf/status/1373598580624273412,False,,1,https://pbs.twimg.com/media/ExAALwHXMAQaOu6.jpg,,,,,,,[],,,,
1373588471609237505,1373495276925685762,2021-03-21 07:53:06 -03,2021-03-21,07:53:06,-0300,957630134059700225,rodrigo88441897,Pacificado,,"@YourAnonCentral A natureza é forte com seu poder de recuperação, mas infelizmente Amazônia não está conseguindo respirar para conseguir essa recuperação. Desmatamento, grilagem, garimpo, ONGS e Bolssominhos juntos com essas corporações vão acabar com esse patrimônio mundial.",pt,[],[],[],0,0,0,[],[],https://twitter.com/Rodrigo88441897/status/1373588471609237505,False,,0,,,,,,,,"[{'screen_name': 'YourAnonCentral', 'name': 'YAC', 'id': '373157754'}]",,,,
1373585877759328257,1373383636133810176,2021-03-21 07:42:47 -03,2021-03-21,07:42:47,-0300,2541909199,ngelopt,Quase Lá 🇵🇹,,"@rperesrocha @Ketzer_p Fique sabendo também que o principal parceiro comercial do Brasil é, de longe, a China. É para lá que vocês mandam a maioria da soja e do gado que fomenta o desmatamento da Amazónia. E agora, não tem vergonha de receber aula sobre o seu país da parte de um estrangeiro? 🤡",pt,[],[],[],0,0,0,[],[],https://twitter.com/ngelopt/status/1373585877759328257,False,,0,,,,,,,,"[{'screen_name': 'Ketzer_p', 'name': 'luto é verbo', 'id': '1248116856134799365'}]",,,,
1373534421639442439,1373534421639442439,2021-03-21 04:18:19 -03,2021-03-21,04:18:19,-0300,1061405198852284417,frances02650166,Frances,,"Bolsonaro destruindo o Brasil, pandemia fora de controle,  desmatamento na Amazônia e agora ameaça área próxima a F.Noronha, liberação compra armas ao invés de melhorar condições no país.",pt,[],[],[],0,0,0,[],[],https://twitter.com/FranceS02650166/status/1373534421639442439,False,https://twitter.com/antoniotabet/status/1373281772243464209,0,,,,,,,,[],,,,
1373488906327449605,1373323554989740039,2021-03-21 01:17:28 -03,2021-03-21,01:17:28,-0300,1373321903310565378,andregustavx,HDG Drx 🇦🇴,,"@HERRONDEMONS @millyslaoq @SINKYFILMS @bearskata Vdd linda, diga não ao desmatamento da amazônia #Soudaigrejaetranso",pt,[],[],[],1,0,0,['soudaigrejaetranso'],[],https://twitter.com/AndreGustavx/status/1373488906327449605,False,,0,,,,,,,,"[{'screen_name': 'HERRONDEMONS', 'name': 'guardando user', 'id': '1372549343568408578'}, {'screen_name': 'millyslaoq', 'name': 'Milly 🏳️\u200d🌈⃤', 'id': '1234312060114231296'}, {'screen_name': 'SINKYFILMS', 'name': 'ً', 'id': '1433376539995955200'}, {'screen_name': 'bearskata', 'name': 'davi', 'id': '1304879030630522892'}]",,,,
1373481632108314630,1373481632108314630,2021-03-21 00:48:33 -03,2021-03-21,00:48:33,-0300,1103325048029544449,cachos_sccp,cigarro solto,,Acabei de dar uma aula de como plantar açafrão e batata  Que foi pra como o desmatamento da Amazônia influencia na seca do sistema cantareira  Que foi pra como o bolsonaro usa o poder de presidente pra ser corrupto  Eu tava explicando como plantar açafrão???????,pt,[],[],[],0,0,4,[],[],https://twitter.com/cachos_sccp/status/1373481632108314630,False,,0,,,,,,,,[],,,,
1373477538727608322,1373378933194907656,2021-03-21 00:32:17 -03,2021-03-21,00:32:17,-0300,37805308,tiporei,Caio,,"@wernervf Você acha que o desmatamento recorde na Amazônia não foi corrupção? Você acha que o apoio a grileiros, milicianos não é corrupção? Que o desmanche das estruturas de combate à corrupção foram à toa?",pt,[],[],[],1,0,0,[],[],https://twitter.com/tiporei/status/1373477538727608322,False,,0,,,,,,,,"[{'screen_name': 'wernervf', 'name': 'WVF', 'id': '58921547'}]",,,,
1373473946864078848,1373416618290741250,2021-03-21 00:18:01 -03,2021-03-21,00:18:01,-0300,1075208239267094528,jefeschreiner,Jefinho,,"@tenoreogabriel Pia já percebeu que o crescimento no desmatamento da Amazônia, e o crescimento do número de veganos, crescem juntos. Eu não acho coincidência",pt,[],[],[],0,0,0,[],[],https://twitter.com/jefeschreiner/status/1373473946864078848,False,,0,,,,,,,,[],,,,
1373469824848904192,1373402318448816143,2021-03-21 00:01:38 -03,2021-03-21,00:01:38,-0300,1232068029141438470,felipesc_adm,FelipeSoares,,"@SenadorRogerio @sensacionalista O desmatamento na Amazônia caiu 33% com o novo satélite Amazônia 1 , o aumento é a política do fica em casa , então senador toma vergonha na sua cara é deixa de ser vagabundo!",pt,[],[],[],0,0,0,[],[],https://twitter.com/felipesc_adm/status/1373469824848904192,False,,0,,,,,,,,"[{'screen_name': 'SenadorRogerio', 'name': 'Rogério Carvalho 🇧🇷🏴', 'id': '144372753'}, {'screen_name': 'sensacionalista', 'name': 'Sensacionalista', 'id': '36751573'}]",,,,
1373442433434935301,1373442433434935301,2021-03-20 22:12:48 -03,2021-03-20,22:12:48,-0300,88742825,agorajafalei,Junior,,O Fiuk é a favor do desmatamento da Amazônia.   #bbb21  https://t.co/rJ0a94ijrS,pt,[],[],[],0,0,2,['bbb21'],[],https://twitter.com/agorajafalei/status/1373442433434935301,False,,1,https://pbs.twimg.com/ext_tw_video_thumb/1373442373624156162/pu/img/_-W1Bw-iP8JZ-s8i.jpg,,,,,,,[],,,,
1373424310006734857,1373423191675314179,2021-03-20 21:00:47 -03,2021-03-20,21:00:47,-0300,2770526735,gobieia,Gobi,,Época de chuva em todo o território brasileiro e a amazônia batendo recorde de desmatamento,pt,[],[],[],0,0,1,[],[],https://twitter.com/GobieIa/status/1373424310006734857,False,,0,,,,,,,,[],,,,
1373422090922131457,1373422090922131457,2021-03-20 20:51:58 -03,2021-03-20,20:51:58,-0300,777263560854503424,vortexbrito,Brito Vagner Dantas,,"Assassinatos, desmatamento e roubo de terras: um laboratório do crime no meio da Amazônia | Combate Racismo Ambiental  https://t.co/XExpjMKcU5",pt,[],['https://racismoambiental.net.br/2020/05/25/assassinatos-desmatamento-e-roubo-de-terras-um-laboratorio-do-crime-no-meio-da-amazonia/#.YFaKmXM7gYA.twitter'],[],0,0,0,[],[],https://twitter.com/VortexBrito/status/1373422090922131457,False,,0,,,,,,,,[],,,,
1373415337203486720,1373409571507740674,2021-03-20 20:25:07 -03,2021-03-20,20:25:07,-0300,1100626270155653120,biodiversidadeb,Biodiversidade Brasileira,,"@roxmo Talvez por que essa época do ano seja justamente a época de chuvas, né. Mas fica tranquilo, nem tem o que queimar no Pantanal mais, só ano passado mais de 30% do Pantanal morreu. E a Amazônia? Bateu todos os recordes de desmatamento nesses 3 anos de governo.",pt,[],[],[],19,27,568,[],[],https://twitter.com/BiodiversidadeB/status/1373415337203486720,False,,0,,,,,,,,"[{'screen_name': 'roxmo', 'name': 'Roger Rocha Moreira', 'id': '17752026'}]",,,,
1373413491768451073,1373413491768451073,2021-03-20 20:17:47 -03,2021-03-20,20:17:47,-0300,28559850,oferadasferas,O Fera da Gaita,,"O COVID19 acabou com incêndios no Pantanal, com o desmatamento na Amazônia, com o Fascismo, com o Nazismo, com a Homofobia, com o derramamento de óleo nas praias, com a ditadura, enfim... a narrativa do momento é Genocídio.    #ConteComigoBolsonaro",pt,[],[],[],0,1,1,['contecomigobolsonaro'],[],https://twitter.com/OFeradasFeras/status/1373413491768451073,False,,0,,,,,,,,[],,,,
1373398451594145792,1373398446011514881,2021-03-20 19:18:02 -03,2021-03-20,19:18:02,-0300,1274531639314599939,abolicionistabr,Contexto Abolicionista,,"Isso sem falar no desmatamento: mais de 80% das áreas desmatadas na Amazônia são destinadas à pecuária.  Mas o consumo de carne traz consigo algo ainda mais perverso do que o desastre ecológico: ele carrega consigo a mercantilização de animais,  👇#DiaMundialSemCarne",pt,[],[],[],1,0,1,['diamundialsemcarne'],[],https://twitter.com/abolicionistaBR/status/1373398451594145792,False,,0,,,,,,,,[],,,,
1373394921135161346,1373388480697491460,2021-03-20 19:04:00 -03,2021-03-20,19:04:00,-0300,66204196,viananatalia,Natalia Viana 🇧🇷,,"Para ela, esse governo ""reúne todos os negacionismos""- da ditadura do aquecimento climático, do COVID, da tortura, do desmatamento da Amazônia",pt,[],[],[],1,0,3,[],[],https://twitter.com/VianaNatalia/status/1373394921135161346,False,,0,,,,,,,,[],,,,
1373374568967049218,1373374568967049218,2021-03-20 17:43:07 -03,2021-03-20,17:43:07,-0300,1275173062028165120,brasileiracienc,Ciência Brasileira é de Qualidade,,"Em artigo recém publicado na revista científica Regional Environmental Change, os autores discutem sobre a relação da mineração ilegal de ouro na Amazônia e o aumento das taxas de desmatamento nos últimos anos.  . Confira:   https://t.co/MIADd0OqdK .  https://t.co/wF9ELX7LyR  https://t.co/xvjy0YUUWD",pt,[],"['https://www.facebook.com/326080958209080/posts/925312098285960/?d=n', 'https://www.instagram.com/p/CMp4HIxp44i/?igshid=1sekll1zjeln5']",['https://pbs.twimg.com/media/Ew804rrWUAA8uWN.jpg'],0,0,0,[],[],https://twitter.com/brasileiracienc/status/1373374568967049218,False,,1,https://pbs.twimg.com/media/Ew804rrWUAA8uWN.jpg,,,,,,,[],,,,
1373368217876492290,1373364947929997317,2021-03-20 17:17:53 -03,2021-03-20,17:17:53,-0300,294904703,lcncluizclaudio,Luiz Cláudio - Parafraseando,,"@DCM_online Podem ficar tranquilos, o @mmeioambiente, através do @rsallesmma está garantindo o desmatamento da Amazônia. Enquanto passa a boiada, saem as madeiras. Então, matéria prima para caixões não vai faltar, neste período de pandemia, né meu amigo @fiscaldoibama? Só temos a lamentar.  https://t.co/IfaCdDRYOB",pt,"[{'screen_name': 'mmeioambiente', 'name': 'ministério do meio ambiente', 'id': '193003734'}, {'screen_name': 'rsallesmma', 'name': 'ricardo salles', 'id': '971822131024748545'}, {'screen_name': 'fiscaldoibama', 'name': 'o fiscal do ibama', 'id': '3355746328'}]",[],['https://pbs.twimg.com/tweet_video_thumb/Ew8vGxrWYAgZ02X.jpg'],0,0,0,[],[],https://twitter.com/LCNCLuizClaudio/status/1373368217876492290,False,,1,https://pbs.twimg.com/tweet_video_thumb/Ew8vGxrWYAgZ02X.jpg,,,,,,,"[{'screen_name': 'DCM_online', 'name': 'DCM ONLINE', 'id': '43340387'}]",,,,
1373354981147967493,1373354981147967493,2021-03-20 16:25:17 -03,2021-03-20,16:25:17,-0300,70321319,videversus,Vitor Vieira,,Justiça leva seis anos para concluir que empresário não produziu desmatamento na Amazônia by @Videversus  https://t.co/5XkZEwi9XN,pt,"[{'screen_name': 'videversus', 'name': 'vitor vieira', 'id': '70321319'}]",['https://vitorvieira.substack.com/p/justica-leva-seis-anos-para-concluir?r=b9hxj&utm_campaign=post&utm_medium=email&utm_source=twitter'],[],0,3,5,[],[],https://twitter.com/Videversus/status/1373354981147967493,False,,0,,,,,,,,[],,,,
1373351557241180175,1373351557241180175,2021-03-20 16:11:41 -03,2021-03-20,16:11:41,-0300,1318443008,luizgilsonjr,Luiz Gilson Júnior ✊🏽 #Antifacista #1dose,,"E mentiu? Ele já era graças ao incentivo ao desmatamento na Amazônia, agora no ""controle"" da pandemia é em dobro!",pt,[],[],[],0,0,0,[],[],https://twitter.com/luizgilsonjr/status/1373351557241180175,False,https://twitter.com/DCM_online/status/1373347861103063045,0,,,,,,,,[],,,,
1373343506408865793,1373343506408865793,2021-03-20 15:39:42 -03,2021-03-20,15:39:42,-0300,1148318806303027205,marcosquezado1,Delegado M Quezado,,"Amazônia: Fundo pode chegar a R$ 5,5 bilhões, diz Mourão. De acordo com o vice-presidente, uma das metas é reduzir em 30% o desmatamento.  https://t.co/gvtfxSGaMT",pt,[],['https://pleno.news/brasil/politica-nacional/amazonia-fundo-pode-chegar-a-r-55-bilhoes-diz-mourao.html'],[],0,8,20,[],[],https://twitter.com/MarcosQuezado1/status/1373343506408865793,False,,0,,,,,,,,[],,,,
1373335723844239361,1373335723844239361,2021-03-20 15:08:46 -03,2021-03-20,15:08:46,-0300,968990754403168257,_seongshine,zero: nickk ❤️‍🔥,,"30min de conversar do namjoon hongjoong e bangchan e eles resolveriam o problema do aquecimento global, cura do c0vid, fim do desemprego, acabariam com a inflação no mundo, com desmatamento na amazonia, despenca as taxas de vi0lência no mundo e acabaria com o r4c1sm0 e h0m0f0bia",pt,[],[],[],0,2,5,[],[],https://twitter.com/_seongshine/status/1373335723844239361,False,,0,,,,,,,,[],,,,
1373329988972380161,1373329988972380161,2021-03-20 14:45:59 -03,2021-03-20,14:45:59,-0300,333553475,juliovschneider,Julio Schneider 🇧🇷🇺🇸,,Desmatamento na Amazônia tem queda de 34% em fevereiro. Essa notícia você não irá ler na extrema-imprensa:    https://t.co/LgdxNnYZrB via @vuejs,pt,"[{'screen_name': 'vuejs', 'name': 'vue.js', 'id': '2292889800'}]",['https://fleekus.com/b/monte-castello/article/desmatamento-na-amazonia-tem-queda-de-34-em-fevereiro-rkaby'],[],3,137,255,[],[],https://twitter.com/juliovschneider/status/1373329988972380161,False,,0,,,,,,,,[],,,,
1373315299353763840,1373301037986103299,2021-03-20 13:47:36 -03,2021-03-20,13:47:36,-0300,50878533,m_mtss81,Marcus Alexandre 🃏📈📊💰,,"@RodrigoMaia passou dos limites!  como assim paulo guedes fala a verdade pro mundo, explicando q a educação sempre foi ruim no brasil, e q na amazonia sempre houve desmatamento??  não pode ficar falando a VERDADE pro mundo não!!!",pt,[],[],[],0,0,0,[],[],https://twitter.com/M_mtss81/status/1373315299353763840,False,,0,,,,,,,,"[{'screen_name': 'RodrigoMaia', 'name': 'Rodrigo Maia', 'id': '35260027'}]",,,,
1373306804411768836,1373261966110785539,2021-03-20 13:13:51 -03,2021-03-20,13:13:51,-0300,1362043535692881921,rossiniprof,ProfRossini,,"@lcfiorini @TaschnerNatalia Sei muita coisa , sou amazonino .  Amazônia é gigante , o problema do desmatamento eh o mesmo há décadas e nada tem haver com o Agro e nem com Governo autual , agro  é um dos únicos motivos de orgulho do Brasil , o problema é social dos milhões de vivem nas beiras da floresta .",pt,[],[],[],1,0,0,[],[],https://twitter.com/RossiniProf/status/1373306804411768836,False,,0,,,,,,,,"[{'screen_name': 'lcfiorini', 'name': 'Melhor Jair se F%#&NDO', 'id': '61535098'}, {'screen_name': 'TaschnerNatalia', 'name': 'Natalia Pasternak, PhD 🧬 🇧🇷 🇮🇱', 'id': '732774741040320512'}]",,,,
1373306210204663812,1373300666270093315,2021-03-20 13:11:29 -03,2021-03-20,13:11:29,-0300,253270730,augustofadu,Luxuoso Fadusom,,@sadeckgeo Se a moda pega pra todo mundo que estudar desmatamento na Amazônia ... Se bem que ja há fatos ...,pt,[],[],[],0,0,0,[],[],https://twitter.com/AugustoFadu/status/1373306210204663812,False,,0,,,,,,,,"[{'screen_name': 'sadeckgeo', 'name': 'Luis Sadeck', 'id': '29972789'}]",,,,
1373296793614696453,1373296793614696453,2021-03-20 12:34:04 -03,2021-03-20,12:34:04,-0300,3325047111,baiarodrigues,João Rodrigues Baia,,'Guedes sobre desmatamento: 'Não ocorreu nos últimos anos'  #PauloGuedes #Amazônia #PlenoNews  https://t.co/4idDGtBvhG,pt,[],['https://pleno.news/brasil/politica-nacional/guedes-sobre-desmatamento-nao-ocorreu-nos-ultimos-anos.html'],[],0,0,0,"['pauloguedes', 'amazônia', 'plenonews']",[],https://twitter.com/BaiaRodrigues/status/1373296793614696453,False,https://twitter.com/PlenoNews/status/1372977903756058624,0,,,,,,,,[],,,,
1373280745368731660,1373273449460826112,2021-03-20 11:30:18 -03,2021-03-20,11:30:18,-0300,743182013453172736,brandaogeison,Mal caractere,,"@LuizGMCassa @SpaceToday1 Se vc preste atenção, a cor do rio tá vermelha, e os rios da Amazônia são barrentos. Logo, tudo que é vermelho na verdade é cor de barro. Claramente aquelas manchas são área de desmatamento",pt,[],[],[],0,0,0,[],[],https://twitter.com/BrandaoGeison/status/1373280745368731660,False,,0,,,,,,,,"[{'screen_name': 'LuizGMCassa', 'name': 'Luiz Cassa', 'id': '2739091013'}, {'screen_name': 'SpaceToday1', 'name': 'Sacani (Space Today)', 'id': '338335282'}]",,,,
1373274441954758656,1373265589255426053,2021-03-20 11:05:15 -03,2021-03-20,11:05:15,-0300,1241221254268489729,nilton08424368,Nilton,,"@revistaoeste O problema do nosso Agro é q temos um chanceler incompetente há frente do Itamaraty, todos os ataques da Europa e dos EUA sobre a Amazônia dizendo que o Agro é culpado pelo desmatamento é fake news A cada ataque dos europeus e dos EUA sobre o Agro vc não vê o Itamaraty falar nada",pt,[],[],[],0,0,0,[],[],https://twitter.com/Nilton08424368/status/1373274441954758656,False,,0,,,,,,,,"[{'screen_name': 'revistaoeste', 'name': 'Revista Oeste', 'id': '1222939896349970432'}]",,,,
1373273839283666949,1373273819029340163,2021-03-20 11:02:52 -03,2021-03-20,11:02:52,-0300,1068133308574375942,haraflaeschen,Hara Flaeschen,,"☠ Agrotóxico na Amazônia: nos últimos anos, o deslocamento da soja do cerrado para o bioma amazônico- com queimada é desmatamento - fez aumentar em 50% o uso de venenos na região norte do país.",pt,[],[],[],1,0,4,[],[],https://twitter.com/HaraFlaeschen/status/1373273839283666949,False,,0,,,,,,,,[],,,,
