id,conversation_id,created_at,date,time,timezone,user_id,username,name,place,tweet,language,mentions,urls,photos,replies_count,retweets_count,likes_count,hashtags,cashtags,link,retweet,quote_url,video,thumbnail,near,geo,source,user_rt_id,user_rt,retweet_id,reply_to,retweet_date,translate,trans_src,trans_dest
1094355721024606209,1094355721024606209,2019-02-09 19:01:50 SA Eastern Standard Time,2019-02-09,19:01:50,-0300,939645703516803073,arenatasato,Renats,,Vocês sabiam que na década de 80 foi desenvolvida uma forma de identificar as queimadas que estavam acontecendo em tempo real na Amazônia (que não se trata só do estado Amazonas) como forma de evitar o desmatamento e duas hrs depois helicópteros iam a caminho do local,pt,[],[],[],1,0,0,[],[],https://twitter.com/arenatasato/status/1094355721024606209,False,,0,,,,,,,,[],,,,
1094208025634787329,1094208025634787329,2019-02-09 09:14:57 SA Eastern Standard Time,2019-02-09,09:14:57,-0300,120189578,dlerda,Daniela Lerda 💉,,"Desmatamento, queimadas, e aquecimento global provocam savanização da floresta. ""Não deveríamos deixar o desmatamento passar de 20%, 25% na Bacia Amazônica. Já chegou a 17% na internacional, e 20% na parte brasileira""#clima #deforestation #amazonia #brasil  https://t.co/AEgdky8T7W",pt,[],['http://www.ihu.unisinos.br/586016-amazonia-esta-sendo-transformada-em-cerrado-diz-carlos-nobre'],[],0,2,2,"['clima', 'deforestation', 'amazonia', 'brasil']",[],https://twitter.com/dlerda/status/1094208025634787329,False,,0,,,,,,,,[],,,,
1091343915905626112,1091343915905626112,2019-02-01 11:34:00 SA Eastern Standard Time,2019-02-01,11:34:00,-0300,3428906843,restoreforward,WRI Restoration,,"Um bom projeto de restauração florestal precisa se preocupar em conhecer a paisagem que será restaurada. Na Amazônia, entender a paisagem social está ajudando a transformar queimadas em agrofloresta. Saiba mais ➡ @WRIBrasil  https://t.co/LAXogE13Tt .  https://t.co/EvKNV8OM0i  https://t.co/uLSx43kJkN",pt,"[{'screen_name': 'wribrasil', 'name': 'wri brasil', 'id': '198594899'}]","['http://bit.ly/2Mz0xXB', 'http://wribrasil.org.br/pt/blog/2019/01/na-amazonia-entender-paisagem-transforma-queimadas-em-agrofloresta']",['https://pbs.twimg.com/media/DyUAAyuWsAIrvnt.jpg'],0,2,7,[],[],https://twitter.com/restoreforward/status/1091343915905626112,False,,1,https://pbs.twimg.com/media/DyUAAyuWsAIrvnt.jpg,,,,,,,[],,,,
1091321230433665024,1091321230433665024,2019-02-01 10:03:51 SA Eastern Standard Time,2019-02-01,10:03:51,-0300,148462153,lordsaulon,Saulo Andrade,,"Na Amazônia, entender a paisagem social ajuda a transformar queimadas em agrofloresta | WRI Brasil -  https://t.co/V9qD9BKQXC via @WRIBrasil  https://t.co/3SyhW0s35V",pt,"[{'screen_name': 'wribrasil', 'name': 'wri brasil', 'id': '198594899'}]",['http://wribrasil.org.br/pt/blog/2019/01/na-amazonia-entender-paisagem-transforma-queimadas-em-agrofloresta'],['https://pbs.twimg.com/media/DyUm3-aWkAE8Vav.jpg'],0,0,1,[],[],https://twitter.com/lordsaulon/status/1091321230433665024,False,,1,https://pbs.twimg.com/media/DyUm3-aWkAE8Vav.jpg,,,,,,,[],,,,
1090354223743680512,1090354223743680512,2019-01-29 18:01:19 SA Eastern Standard Time,2019-01-29,18:01:19,-0300,198594899,wribrasil,WRI Brasil,,"Um bom projeto de restauração florestal precisa se preocupar em conhecer a paisagem que será restaurada. Na Amazônia, entender a paisagem social está ajudando a transformar queimadas em agrofloresta. Saiba mais ➡  https://t.co/5rW4wt0zQ5.  https://t.co/u0xlS1UChK",pt,[],['http://bit.ly/2Mz0xXB'],['https://pbs.twimg.com/media/DyG3Y1OWwAAVsfy.jpg'],0,2,3,[],[],https://twitter.com/WRIBrasil/status/1090354223743680512,False,,1,https://pbs.twimg.com/media/DyG3Y1OWwAAVsfy.jpg,,,,,,,[],,,,
1090332437358497792,1090332437358497792,2019-01-29 16:34:45 SA Eastern Standard Time,2019-01-29,16:34:45,-0300,35568011,brenda_brito,Brenda Brito,,"Desmatamento na Amazônia é tragédia diária associada a conflitos no campo, roubo de terras, corrupção, além de gerar mortes pelos impactos na saúde com queimadas. Atividade de alto impacto e risco que precisa de medidas sérias e urgentes de enfrentamento.",pt,[],[],[],0,0,2,[],[],https://twitter.com/brenda_brito/status/1090332437358497792,False,https://twitter.com/Imazon/status/1090324853549342722,0,,,,,,,,[],,,,
