id,conversation_id,created_at,date,time,timezone,user_id,username,name,place,tweet,language,mentions,urls,photos,replies_count,retweets_count,likes_count,hashtags,cashtags,link,retweet,quote_url,video,thumbnail,near,geo,source,user_rt_id,user_rt,retweet_id,reply_to,retweet_date,translate,trans_src,trans_dest
1190080549068648448,1190080549068648448,2019-10-31 22:38:08 -03,2019-10-31,22:38:08,-0300,875485027177553921,andrearoeirap,Aroeira 🌿 #MarcoTemporalNão,,"Anotem aí: em algum momento dos próximos 45 dias vai sair a estimativa do PRODES, a medida mais refinada do INPE sobre o desmatamento da Amazônia. Vamos aos 5 dígitos, ou &gt;10 mil km2, pela 1a vez em mais de 10 anos.  Vai ter manchete mundial e bolsominion rasgando o * com a unha.",pt,[],[],[],17,219,1307,[],[],https://twitter.com/andrearoeirap/status/1190080549068648448,False,,0,,,,,,,,[],,,,
1190076407663251459,1190076407663251459,2019-10-31 22:21:40 -03,2019-10-31,22:21:40,-0300,993533870707544071,fagneragkfs,tuiteiro Fagner,,"A seca que é resultado do desmatamento desenfreado da Amazônia que, mesmo não sendo o ""pulmão do mundo"" afeta o ciclo das chuvas no Brasil inteiro. Desmatamento potencializado pela eleição do presidente, como ele mesmo admitiu agora, na Arábia.",pt,[],[],[],0,6,8,[],[],https://twitter.com/fagneragkfs/status/1190076407663251459,False,https://twitter.com/jornalnacional/status/1190074769993011202,0,,,,,,,,[],,,,
1190073642383745030,1190073642383745030,2019-10-31 22:10:41 -03,2019-10-31,22:10:41,-0300,555180816,ftimalacerda1,Maria Fátima Lacerda,,Chove menos na Amazônia por causa do desmatamento - ClimaInfo  https://t.co/PufyKRXAR4,pt,[],['http://climainfo.org.br/2019/10/31/chove-menos-na-amazonia-por-causa-do-desmatamento/'],[],0,0,0,[],[],https://twitter.com/FtimaLacerda1/status/1190073642383745030,False,,0,,,,,,,,[],,,,
1190038432577400832,1190028683056238600,2019-10-31 19:50:46 -03,2019-10-31,19:50:46,-0300,57010292,vterleski,PSY,,"@vidz1979 @juansr_11 @exame ""...o integrante do governo Bolsonaro já relativizou o aquecimento global, questionou dados sobre o desmatamento da Amazônia e culpou o Greenpeace pelo vazamento de óleo que tem atingido o Nordeste desde o mês passado.""",pt,[],[],[],1,0,0,[],[],https://twitter.com/vterleski/status/1190038432577400832,False,,0,,,,,,,,"[{'screen_name': 'vidz1979', 'name': 'Vidotti', 'id': '16716289'}, {'screen_name': 'juansr_11', 'name': 'geralt of rivia', 'id': '1005852207999266816'}, {'screen_name': 'exame', 'name': 'exame', 'id': '30070288'}]",,,,
1190024120311984128,1190024120311984128,2019-10-31 18:53:54 -03,2019-10-31,18:53:54,-0300,22912268,dionisiopiaui,Dionísio,,Chove menos na Amazônia por causa do desmatamento - ClimaInfo  https://t.co/kWBCSGTfev,pt,[],['http://climainfo.org.br/2019/10/31/chove-menos-na-amazonia-por-causa-do-desmatamento/'],[],0,0,0,[],[],https://twitter.com/dionisiopiaui/status/1190024120311984128,False,,0,,,,,,,,[],,,,
1190024055170228224,1188864563971870720,2019-10-31 18:53:38 -03,2019-10-31,18:53:38,-0300,2436395947,martabikelis,Marta,,"@Jaoliver21 @BolsonaroSP @jairbolsonaro Você já foi à Amazônia?Já  conversou com quem mora na Amazônia.Perguntei à um fazendeiro do Sul do Pará neste domingo sobre o meio ambiente, ele me disse que o meio ambiente já está comprometido, já está afetado.O sudeste sofre com a falta de chuvas, consequência de desmatamento",pt,[],[],[],1,0,0,[],[],https://twitter.com/martabikelis/status/1190024055170228224,False,,0,,,,,,,,"[{'screen_name': 'Jaoliver21', 'name': ""O último a saber .'. 🇧🇷🇵🇹🇧🇷🇵🇹"", 'id': '2816777314'}, {'screen_name': 'BolsonaroSP', 'name': 'Eduardo Bolsonaro🇧🇷', 'id': '74756085'}, {'screen_name': 'jairbolsonaro', 'name': 'Jair M. Bolsonaro', 'id': '128372940'}]",,,,
1190017450399678481,1189931942684299265,2019-10-31 18:27:24 -03,2019-10-31,18:27:24,-0300,215672305,escarachiulli,Andre -DECA-,,"@dontleft1 @RicardoFSEP @Movimentodirei3 @Schiavon_26 O que é oficial é o que se apresenta diante de nossos olhos, e não relatórios chapa-branca emitidos pelo governo. Só nesse ano:  • Fim Fundo Amazônia • Desmatamento recorde • Negligência com óleo • Liberação recorde Agrotóxicos • Anistia de multas ambientais  ... Tá ótimo!",pt,[],[],[],1,0,0,[],[],https://twitter.com/escarachiulli/status/1190017450399678481,False,,0,,,,,,,,"[{'screen_name': 'dontleft1', 'name': 'dontleft', 'id': '1083927319838969856'}]",,,,
1190014649711910913,1190014649711910913,2019-10-31 18:16:16 -03,2019-10-31,18:16:16,-0300,28248491,pauloavas,PALAVRAS DOS BRASILEIROS,,O DESMATAMENTO E MORTE QUE NÃO SE QUER VÊ- AMAZÔNIA E EL CHACO A lenta morte do Gran Chaco  https://t.co/aBv7klA1Jw,pt,[],['https://www.palavrasdosbrasileiros.com/2019/10/amazonia-e-el-chaco-lenta-morte-dol.html'],[],0,1,0,[],[],https://twitter.com/pauloavas/status/1190014649711910913,False,,0,,,,,,,,[],,,,
1190007710634393603,1189562761967210499,2019-10-31 17:48:42 -03,2019-10-31,17:48:42,-0300,1171205187026980869,grasiel25402484,Grasieli,,"@AndreWeintraub @filipebarrost @eder_bareto @JornalOGlobo Ah não, kit gay, ONGs colocando fogo na Amazônia, o desmatamento não existe, aquecimento global não existe, não existeu ditadura.... E por aí vai...ele não só cria, mas propaga fake News. Basta acompanhar as redes dele.",pt,[],[],[],3,0,0,[],[],https://twitter.com/Grasiel25402484/status/1190007710634393603,False,,0,,,,,,,,"[{'screen_name': 'filipebarrost', 'name': 'Filipe Barros', 'id': '225925013'}, {'screen_name': 'eder_bareto', 'name': '🇧🇷 Eder Barreto 🇮🇱', 'id': '846083814929711107'}, {'screen_name': 'JornalOGlobo', 'name': 'Jornal O Globo', 'id': '54341363'}]",,,,
1190007599107887104,1190007599107887104,2019-10-31 17:48:15 -03,2019-10-31,17:48:15,-0300,1869929936,tvobservatorio,Observatório da TV,,"Record TV indenizará homem por ""reportagem sensacionalista"" sobre desmatamento na Amazônia | Observatório da Televisão  https://t.co/NnXLA3zJhJ  https://t.co/8My3iZ7hAa",pt,[],['http://bit.ly/2JFpVuv'],['https://pbs.twimg.com/media/EIPBmtmXkAAbFYt.jpg'],0,0,0,[],[],https://twitter.com/TVObservatorio/status/1190007599107887104,False,,1,https://pbs.twimg.com/media/EIPBmtmXkAAbFYt.jpg,,,,,,,[],,,,
1190006496920293378,1190006496920293378,2019-10-31 17:43:52 -03,2019-10-31,17:43:52,-0300,49132320,bielvaquer,Gabriel Vaquer,,Record TV indenizará homem por “reportagem sensacionalista” sobre desmatamento na Amazônia  https://t.co/L0jO42gJWZ via @TVObservatorio,pt,"[{'screen_name': 'tvobservatorio', 'name': 'observatório da tv', 'id': '1869929936'}]",['https://observatoriodatelevisao.bol.uol.com.br/noticia-da-tv/2019/10/record-tv-indenizara-homem-por-reportagem-sensacionalista-sobre-desmatamento-na-amazonia'],[],1,2,3,[],[],https://twitter.com/bielvaquer/status/1190006496920293378,False,,0,,,,,,,,[],,,,
1189972192211165185,1189972192211165185,2019-10-31 15:27:33 -03,2019-10-31,15:27:33,-0300,395905491,aprovinciadopa,A Província do Pará,,Estudos anteriores apresentaram evidências de que o desmatamento pode afetar a sazonalidade da precipitação no sul da Amazônia.Este estudo usa dados diários de chuva do produto Tropical Rainfall Measurement Mission 3B42 e um recente conjunto anual de 1  #  https://t.co/C8fEmFsbwi  https://t.co/lq7s0Xxk0O,pt,[],['http://aprovinciadopara.com.br/estados-sao-prejudicados-pelo-desmatamento-da-amazonia/'],['https://pbs.twimg.com/media/EIOhZrjXsAI20tW.jpg'],0,0,0,[],[],https://twitter.com/aprovinciadopa/status/1189972192211165185,False,,1,https://pbs.twimg.com/media/EIOhZrjXsAI20tW.jpg,,,,,,,[],,,,
1189961372714573825,1189961372714573825,2019-10-31 14:44:34 -03,2019-10-31,14:44:34,-0300,64813857,liacrespo,Lia Crespo #ForaCabeçaDeOvo,,"Desmatamento na Amazônia desaba 40,5%, mas boa nova não vira notícia - Diário do Poder  https://t.co/u3IQyeBXAh",pt,[],['https://diariodopoder.com.br/desmatamento-na-amazonia-cai-405-mas-nao-vira-noticia/'],[],0,0,0,[],[],https://twitter.com/liacrespo/status/1189961372714573825,False,,0,,,,,,,,[],,,,
1189961194590879744,1189947577954902016,2019-10-31 14:43:51 -03,2019-10-31,14:43:51,-0300,2455597783,tiagoabelini,Tiago Abelini,,"@JulianoMJR @Sussu_BR @melaogustavo Amazônia sempre queima: claro pq a desmatamento ilegal, mas esse ano bateu recorde pois fazendeiros se sentiram a vontade com a politica ambiental do bolsonaro o Petróleo é importante cobrar de quem vazou, mas nao seria interessante impedir q ele se espalhe?",pt,[],[],[],3,0,1,[],[],https://twitter.com/TiagoAbelini/status/1189961194590879744,False,,0,,,,,,,,"[{'screen_name': 'JulianoMJR', 'name': 'Juliano P. 😈', 'id': '198502568'}, {'screen_name': 'Sussu_BR', 'name': 'Sussu', 'id': '3977802675'}, {'screen_name': 'melaogustavo', 'name': 'Gustavo Melão #VALORANTMasters 🇩🇪', 'id': '950972784'}]",,,,
1189953015475818496,1189953015475818496,2019-10-31 14:11:21 -03,2019-10-31,14:11:21,-0300,3439454120,patriciaeichler,Patricia Eichler,,Chove menos na Amazônia por causa do desmatamento - ClimaInfo  https://t.co/RBhcmD9zzR,pt,[],['http://climainfo.org.br/2019/10/31/chove-menos-na-amazonia-por-causa-do-desmatamento/'],[],0,0,0,[],[],https://twitter.com/patriciaeichler/status/1189953015475818496,False,,0,,,,,,,,[],,,,
1189941206089908225,1189941206089908225,2019-10-31 13:24:26 -03,2019-10-31,13:24:26,-0300,1887493232,scaniabarbiet,é cbt 🤬,,"""Ao comprar carne no supermercado, você não vê o desmatamento na Amazônia, você não vê o índio sangrando porque vê o sangue entrando na picanha""  - sob a pata do boi",pt,[],[],[],0,0,1,[],[],https://twitter.com/ScaniaBarbieT/status/1189941206089908225,False,,0,,,,,,,,[],,,,
1189937336387342336,1189937336387342336,2019-10-31 13:09:03 -03,2019-10-31,13:09:03,-0300,319354424,thelifeoffdiego,𝐝𝐢𝐞𝐠𝐨,,hoje haverá o desmatamento da Amazônia... irei me depilar,pt,[],[],[],2,0,4,[],[],https://twitter.com/thelifeoffdiego/status/1189937336387342336,False,,0,,,,,,,,[],,,,
1189906126999097346,1189906126999097346,2019-10-31 11:05:02 -03,2019-10-31,11:05:02,-0300,3898310757,ruka10ruan,Ruan Vittor,,"De Brumadinho ao ninho do urubu , das tempestades no rio de janeiro a funcionários e alunos da escola atacada em São Paulo.. familiares, amigos perdidos desastres provocados pelo homen, como o desmatamento na Amazônia e óleo derramado no mar.. proteja nosso fim de ano meu Deus",pt,[],[],[],0,5,16,[],[],https://twitter.com/ruka10ruan/status/1189906126999097346,False,,0,,,,,,,,[],,,,
1189894114839605248,1189871893920321536,2019-10-31 10:17:18 -03,2019-10-31,10:17:18,-0300,1123369006843473920,alwysope,vic,,@icretinoreal eu quero detalhe por causa do desmatamento na Amazônia,pt,[],[],[],0,0,0,[],[],https://twitter.com/alwysope/status/1189894114839605248,False,,0,,,,,,,,"[{'screen_name': 'icretinoreal', 'name': 'icretino ✪', 'id': '915732862506323971'}]",,,,
1189889721209688065,1189889721209688065,2019-10-31 09:59:51 -03,2019-10-31,09:59:51,-0300,1055320324760330240,doceevidencia,Júnior S.,,"Um estúpido mesmo puta que pariu! Se tem desmatamento, É na Amazônia as árvores secas depois de mortas deixam de ser amazônicas?",pt,[],[],[],0,0,0,[],[],https://twitter.com/doceevidencia/status/1189889721209688065,False,https://twitter.com/nayaraldr/status/1189738290225790976,0,,,,,,,,[],,,,
1189889099341221889,1189889099341221889,2019-10-31 09:57:23 -03,2019-10-31,09:57:23,-0300,64388419,rkuppe,RK Moraes,,"Fiel a Bolsonaro, Marcos Rocha ignorou encontro de governadores no Vaticano, para debater desmatamento da Amazônia  https://t.co/4kBvwUgOq2 via @Mais RO",pt,"[{'screen_name': 'mais', 'name': 'ismael belliot', 'id': '19018234'}]",['https://maisro.com.br/fiel-a-bolsonaro-marcos-rocha-ignorou-encontro-de-governadores-no-vaticano-para-debater-desmatamento-da-amazonia/'],[],0,0,0,[],[],https://twitter.com/rkuppe/status/1189889099341221889,False,,0,,,,,,,,[],,,,
1189863672421765120,1189863672421765120,2019-10-31 08:16:20 -03,2019-10-31,08:16:20,-0300,51754277,conradopreto,Coisa de internet,,O fogo na Amazônia guarda esteira relação com o desmatamento. Eis o mais tenebroso problema.,pt,[],[],[],0,0,0,[],[],https://twitter.com/conradopreto/status/1189863672421765120,False,https://twitter.com/Debora_D_Diniz/status/1189758303603175425,0,,,,,,,,[],,,,
1189844016537452544,1189844016537452544,2019-10-31 06:58:14 -03,2019-10-31,06:58:14,-0300,181416248,fernandes027,Rafael da Silva,,"Desmatamento na Amazônia desaba 40,5%, mas boa nova não vira notícia - Diário do Poder  https://t.co/hgSxkeBmW7",pt,[],['https://diariodopoder.com.br/desmatamento-na-amazonia-cai-405-mas-nao-vira-noticia/'],[],0,0,0,[],[],https://twitter.com/fernandes027/status/1189844016537452544,False,,0,,,,,,,,[],,,,
1189827529231753216,1189827529231753216,2019-10-31 05:52:43 -03,2019-10-31,05:52:43,-0300,567662102,inspaschoarelli,🚩Inês Paschoarelli,,"As pessoas precisam saber que as empresas que estão por trás do desmatamento da Amazônia brasileira são, em sua imensa maioria,  norte-americanas e européias. O que elas estão fazendo ou planejando fazer são coisas  que jamais ousariam sequer pensar em seus países de origem.",pt,[],[],[],0,0,0,[],[],https://twitter.com/InsPaschoarelli/status/1189827529231753216,False,https://twitter.com/cmjornal/status/1189820726070693889,0,,,,,,,,[],,,,
1189774221498634240,1189774221498634240,2019-10-31 02:20:53 -03,2019-10-31,02:20:53,-0300,3297861,faconti,Fa Conti,,"O mundo sem a #Amazônia -   https://t.co/6WKeigawZx -  RT ClimaInfo #Ambiente #Amazônia #Desmatamento #Dinheiro #Floresta #Fogo #Garimpo #Incêndios #Latifundiários #Mineração #Queimadas #Terras  Problema p/o planeta, mas o sofrimento maior será dos brasileiros e dos sulAmericanos",pt,[],['https://piaui.folha.uol.com.br/o-mundo-sem-amazonia/'],[],0,0,0,"['amazônia', 'ambiente', 'amazônia', 'desmatamento', 'dinheiro', 'floresta', 'fogo', 'garimpo', 'incêndios', 'latifundiários', 'mineração', 'queimadas', 'terras']",[],https://twitter.com/faconti/status/1189774221498634240,False,,0,,,,,,,,[],,,,
1189764417879195648,1189762429552607232,2019-10-31 01:41:56 -03,2019-10-31,01:41:56,-0300,1042087537790144513,patriadaterra,Progresso é Lei Divina,,@rsallesmma Nobre ministro recebi esta carta do GPeace pedindo contribuição e fiquei indignada com o absurdo que estão divulgando no exterior. Fiz os cálculos do desmatamento que eles afirmam e cheguei à conclusão que não restou sequer um metro quadrado de Amazônia.,pt,[],[],[],1,0,2,[],[],https://twitter.com/PatriaDaTerra/status/1189764417879195648,False,,0,,,,,,,,"[{'screen_name': 'rsallesmma', 'name': 'Ricardo Salles', 'id': '971822131024748545'}]",,,,
1189764131072749568,1189140248682532864,2019-10-31 01:40:48 -03,2019-10-31,01:40:48,-0300,1042087537790144513,patriadaterra,Progresso é Lei Divina,,@rsallesmma Nobre ministro recebi esta carta do GPeace pedindo contribuição e fiquei indignada com o absurdo que estão divulgando no exterior. Fiz os cálculos do desmatamento que eles afirmam e cheguei à conclusão que não restou sequer um metro quadrado de Amazônia.,pt,[],[],[],0,0,0,[],[],https://twitter.com/PatriaDaTerra/status/1189764131072749568,False,,0,,,,,,,,"[{'screen_name': 'rsallesmma', 'name': 'Ricardo Salles', 'id': '971822131024748545'}]",,,,
1189754344377335814,1189364931776466949,2019-10-31 01:01:54 -03,2019-10-31,01:01:54,-0300,1152106632291246080,dgtenente,TenenteDG,,@MarinaSilva Grave foi o desmatamento criminozo praticado na Amazônia p/seu marido c/madereira clandestina. Ganhou R$ 8 milhões c/o crime ambiental praticado. Passou até no Fantástico. Você era Ministra de enfeite do Meio Ambiente e Dilma Presidente. Colocaram panos quentes. Cobra peçonhenta.  https://t.co/LotcOdF2Zw,pt,[],[],"['https://pbs.twimg.com/media/EILbQ1EXsAIClBO.jpg', 'https://pbs.twimg.com/media/EILbRA6WoAUGboK.jpg', 'https://pbs.twimg.com/media/EILbRLDX0AAqT08.jpg', 'https://pbs.twimg.com/media/EILbRUgXYAEtrDJ.jpg']",0,1,1,[],[],https://twitter.com/DgTenente/status/1189754344377335814,False,,1,https://pbs.twimg.com/media/EILbQ1EXsAIClBO.jpg,,,,,,,"[{'screen_name': 'MarinaSilva', 'name': 'Marina Silva', 'id': '105155795'}]",,,,
1189753348435697666,1189753348435697666,2019-10-31 00:57:57 -03,2019-10-31,00:57:57,-0300,212662503,aguianeves,Márcio Neves,,"#CentralGloboNews O  verdadeiro projeto desse e de outros governos para Amazonia antes das repercussões  e dos números do desmatamento e das queimadas,  sempre foi  entrega-la a indústria madereira e ao agronegócio  nunca houve desenvolvimento sustentável para Amazônia.",pt,[],[],[],0,0,0,['centralglobonews'],[],https://twitter.com/aguianeves/status/1189753348435697666,False,,0,,,,,,,,[],,,,
1189737159789621248,1189733730660675584,2019-10-30 23:53:37 -03,2019-10-30,23:53:37,-0300,73445640,alexandroamaro,Alex yog 🇧🇷,,"@GauchaZH Capaz, as queimadas da Amazônia, o desmatamento e o quecimento global são tudo fake, nem está chovendo e nem existe cheias no RS, estamos em berço esplêndido!!!",pt,[],[],[],0,0,0,[],[],https://twitter.com/alexandroamaro/status/1189737159789621248,False,,0,,,,,,,,[],,,,
1189708584550096896,1189708584550096896,2019-10-30 22:00:04 -03,2019-10-30,22:00:04,-0300,336104350,portaldbo,Portal DBO,,Mais de 97% dos produtores rurais da Amazônia não participam do desmatamento e estão ameaçados de extinção   https://t.co/VxikiRvXAk,pt,[],['https://www.portaldbo.com.br/dez-fatos-e-mitos-sobre-pequenos-produtores-e-vegetacao-nativa-na-amazonia/'],[],0,0,0,[],[],https://twitter.com/portaldbo/status/1189708584550096896,False,,0,,,,,,,,[],,,,
1189699252957696000,1189631168590823426,2019-10-30 21:23:00 -03,2019-10-30,21:23:00,-0300,38905246,sander7002,🇧🇷,,@eilif_myrhe @BlogdoNoblat @gugtavas Também pelas palavras q geram o desmatamento na Amazônia.,pt,[],[],[],0,0,0,[],[],https://twitter.com/sander7002/status/1189699252957696000,False,,0,,,,,,,,"[{'screen_name': 'eilif_myrhe', 'name': 'Ⓐⓝⓓⓡⓔ́', 'id': '193161289'}, {'screen_name': 'BlogdoNoblat', 'name': 'Blog do Noblat', 'id': '16794066'}]",,,,
1189680123244625920,1189680123244625920,2019-10-30 20:06:59 -03,2019-10-30,20:06:59,-0300,842093638297501696,lilyotoart,🎭 lily 🎭,,"quando passa o comercial do agro dizendo q ele é ""tudo"", é vdd  é divida com o governo é exploração é agrotóxico é desmatamento da Amazônia  agro é tudo de ruim",pt,[],[],[],0,0,2,[],[],https://twitter.com/lilyotoart/status/1189680123244625920,False,,0,,,,,,,,[],,,,
1189679246903566337,1189679246903566337,2019-10-30 20:03:30 -03,2019-10-30,20:03:30,-0300,145403337,ciprianypatriot,Cipriany🇧🇷 Patriota 🇧🇷,,"Usando a mesma referência que a globobosta faz para dá a maior dimensão possível ao desmatamento na Amazônia, até agora, só hoje, em torno de 8 estádios do tamanho do Maracanã lotados, publicaram essa tag. #GloboLixo",pt,[],[],[],0,2,2,['globolixo'],[],https://twitter.com/CiprianyPatriot/status/1189679246903566337,False,,0,,,,,,,,[],,,,
1189678509314187264,1189678509314187264,2019-10-30 20:00:34 -03,2019-10-30,20:00:34,-0300,400124942,lourencoesouza,Lourenço e Souza,,Emissora de televisão é condenada por reportagem sobre desmatamento na Amazônia. Confira na íntegra:  https://t.co/h85OXlRc1z  https://t.co/vwFNjR7ZYk,pt,[],['http://bit.ly/320nclC'],['https://pbs.twimg.com/media/EIKWTG0XUAE6qQp.jpg'],0,0,0,[],[],https://twitter.com/LourencoeSouza/status/1189678509314187264,False,,1,https://pbs.twimg.com/media/EIKWTG0XUAE6qQp.jpg,,,,,,,[],,,,
1189666764965208064,1189603320236773379,2019-10-30 19:13:54 -03,2019-10-30,19:13:54,-0300,943166138317443072,tavindosus,Gustavo,,"@esperondo @beatrizcianci1 @AFPBrasil @swwbrys  parece que o coiso faltou às aulas de geografia e não sabe que tem uma massa de ar seca bem do lado da Amazônia que consegue alterar a umidade do local, aliás, já que estamos falando de Amazônia, olha que interessante, o desmatamento que o presidente diz não existir...",pt,[],[],[],1,0,3,[],[],https://twitter.com/tavindosus/status/1189666764965208064,False,,0,,,,,,,,"[{'screen_name': 'esperondo', 'name': 'Esperon', 'id': '1124447283616067584'}, {'screen_name': 'AFPBrasil', 'name': 'AFP Brasil', 'id': '2284162934'}]",,,,
1189661770144796679,1189661770144796679,2019-10-30 18:54:03 -03,2019-10-30,18:54:03,-0300,757765682897399808,ett42,tha,,"olha q coisa mais linda  eu falando mal do bolsonar*, mamãe e papai defendendo ""não pq até a globo falou q teve um crescimento da economia""  ai eu ""ta, sabe oq tb cresceu ? o desmatamento da Amazônia, q atingiu o maior nível desde 2010. O nordeste ta todo cheio de óleo, e o +",pt,[],[],[],1,0,2,[],[],https://twitter.com/ett42/status/1189661770144796679,False,,0,,,,,,,,[],,,,
1189651639126376452,1189651639126376452,2019-10-30 18:13:48 -03,2019-10-30,18:13:48,-0300,902940611497558016,bielly26pedrosa,gaby's,,"[30/10 18:04] Amorzona: mas gnt tá muita fumaça [30/10 18:05] gaby》: SIMMMMMMMMMMM [30/10 18:05] Pabllo: Será q chegou só agr o desmatamento da Amazônia aq no rio ? [30/10 18:05] Pedro, baby: n é só a tdd não [30/10 18:05] gaby》: KKKKKKKLM FALA SÉRIO",pt,[],[],[],0,0,0,[],[],https://twitter.com/bielly26pedrosa/status/1189651639126376452,False,,0,,,,,,,,[],,,,
1189637140994560000,1189637140994560000,2019-10-30 17:16:11 -03,2019-10-30,17:16:11,-0300,1117920133979287553,ocaosmarx,julie,,Em 10 meses de governo bozonaro:  O desmatamento na Amazônia é 96% maior que em setembro de 2018  O CNPq reduziu em 87% da verba p materiais de pesquisa em 2020  Reforma da previdência aumentou  Dólar aumentou   Liberação de agrotóxicos maior já registrada até hoje no país,pt,[],[],[],1,0,0,[],[],https://twitter.com/ocaosmarx/status/1189637140994560000,False,https://twitter.com/jairbolsonaro/status/1188950546851516419,0,,,,,,,,[],,,,
1189633247942197248,1189633247942197248,2019-10-30 17:00:43 -03,2019-10-30,17:00:43,-0300,1001582844936933376,fgvagroanalysis,FGV Agro,,Em meio à crise de imagem do Brasil por conta do desmatamento da Amazônia surgiu a união de organizações do agronegócio e da sociedade civil para promover uma ação que chame a atenção para o problema crônico que é a ocupação ilegal do bioma amazônico:  https://t.co/yJIyruYiZy  https://t.co/AX35hXTtVj,pt,[],['http://bit.ly/35TuBqh'],['https://pbs.twimg.com/media/EIJtIf-WwAA1wbV.jpg'],0,0,2,[],[],https://twitter.com/fgvagroanalysis/status/1189633247942197248,False,,1,https://pbs.twimg.com/media/EIJtIf-WwAA1wbV.jpg,,,,,,,[],,,,
1189614113414156294,1189614113414156294,2019-10-30 15:44:41 -03,2019-10-30,15:44:41,-0300,176859552,trudaoceans,"José Truda Palazzo, Jr. 🇫🇲🇫🇲🇫🇲☘️",,E aí @TerezaCrisMS feliz com deixar a gestão ambiental federal ser destroçada por um picareta e o desmatamento ilegal tomar conta da Amazônia em definitivo? Taí a conta chegando.,pt,"[{'screen_name': 'terezacrisms', 'name': 'tereza cristina', 'id': '270399607'}]",[],[],0,0,2,[],[],https://twitter.com/TrudaOceans/status/1189614113414156294,False,https://twitter.com/andrearoeirap/status/1189611752788516864,0,,,,,,,,[],,,,
1189607749786710016,1189607749786710016,2019-10-30 15:19:24 -03,2019-10-30,15:19:24,-0300,14062398,jprcapo,João P R Capobianco,,"Estudo na Amazônia meridional revela que o desmatamento já é uma ameaça concreta para a viabilidade da segunda safra em Rondônia e Mato Grosso. O início da estação chuvosa registra atraso em 5,7 dias e uma redução de 27 ± 14,5 dias.  https://t.co/cHx4P1Plyv",pt,[],['https://rmets.onlinelibrary.wiley.com/doi/abs/10.1002/joc.6335?af=R'],[],4,93,213,[],[],https://twitter.com/jprcapo/status/1189607749786710016,False,,0,,,,,,,,[],,,,
1189573890802106374,1189573890802106374,2019-10-30 13:04:51 -03,2019-10-30,13:04:51,-0300,1188935813662416897,suellen22923845,suellen carolina,,Impedir o desmatamento e exploração da Amazônia! - Assine a petição!  https://t.co/lBx2NaOkTn via @change_br  https://t.co/nAUvnaebNj,pt,"[{'screen_name': 'change_br', 'name': 'change.org brasil #luteemcasa', 'id': '900348469'}]",['http://chng.it/PH2HBLFf'],['https://pbs.twimg.com/tweet_video_thumb/EII3JHRXYAA5zUT.jpg'],0,0,1,[],[],https://twitter.com/suellen22923845/status/1189573890802106374,False,,1,https://pbs.twimg.com/tweet_video_thumb/EII3JHRXYAA5zUT.jpg,,,,,,,[],,,,
1189565383067471873,1189565383067471873,2019-10-30 12:31:03 -03,2019-10-30,12:31:03,-0300,2826633823,jotakallil,Jota Kallil,,"CRIMINOSO OU MANDANTE DE CRIME NÃO VAI FALAR QUE ESTA ENVOLVIDO. O MANDANE PODE ESTAR A 100 MIL km DO LUGAR MAS DA ORDEM POR ELEFONE, IGUAL MANDANTES DO DESMATAMENTO E QUEIMA NA AMAZONIA FICAM LIVRES P/CONTINUAR DANDO ORDENS.",pt,[],[],[],0,0,0,[],[],https://twitter.com/JotaKallil/status/1189565383067471873,False,,0,,,,,,,,[],,,,
1189556289455697921,1189556289455697921,2019-10-30 11:54:54 -03,2019-10-30,11:54:54,-0300,66844160,cheyn_,Chavanna,,"GENTE PAREM TUDO, A CULPA DO DESMATAMENTO/INCEDIOS NA AMAZONIA É DOS INDIOS  https://t.co/NurebDrrIS",pt,[],[],['https://pbs.twimg.com/media/EIInIrdWoAMRe68.jpg'],3,0,3,[],[],https://twitter.com/Cheyn_/status/1189556289455697921,False,,1,https://pbs.twimg.com/media/EIInIrdWoAMRe68.jpg,,,,,,,[],,,,
1189550321657352192,1189364931776466949,2019-10-30 11:31:12 -03,2019-10-30,11:31:12,-0300,475724631,martinescm,everaldo martines,,@MarinaSilva Era muito grave também quando o maior desmatamento da Amazônia foi enquanto vc estava de ministra do meio ambiente,pt,[],[],[],0,0,0,[],[],https://twitter.com/MartinesCm/status/1189550321657352192,False,,0,,,,,,,,"[{'screen_name': 'MarinaSilva', 'name': 'Marina Silva', 'id': '105155795'}]",,,,
1189545577958248449,1189545577958248449,2019-10-30 11:12:21 -03,2019-10-30,11:12:21,-0300,325851199,_fabioazevedo_,Fabio Azevedo,,Record é condenada por reportagem sobre desmatamento na Amazônia  https://t.co/0xhrtISypH,pt,[],['http://dlvr.it/RHD3HD'],[],0,0,0,[],[],https://twitter.com/_FabioAzevedo_/status/1189545577958248449,False,,0,,,,,,,,[],,,,
