id,conversation_id,created_at,date,time,timezone,user_id,username,name,place,tweet,language,mentions,urls,photos,replies_count,retweets_count,likes_count,hashtags,cashtags,link,retweet,quote_url,video,thumbnail,near,geo,source,user_rt_id,user_rt,retweet_id,reply_to,retweet_date,translate,trans_src,trans_dest
1224352853688561664,1224350658167558146,2020-02-03 12:24:02 -03,2020-02-03,12:24:02,-0300,74715478,climainfonews,ClimaInfo,,"O que mais preocupa nestes alertas do DETER é que entre novembro e abril as chuvas reduzem as derrubadas da Amazônia. Se nada for feito para parar as motosserras, quando a seca chegar, teremos mais 1 ano de desmatamento recorde, e pior do que o de 2019.  https://t.co/iomru7CrHS",pt,[],['http://terrabrasilis.dpi.inpe.br/app/dashboard/alerts/legal/amazon/aggregated/'],[],0,11,23,[],[],https://twitter.com/ClimaInfoNews/status/1224352853688561664,False,,0,,,,,,,,[],,,,
1224352405044760576,1224300857166045186,2020-02-03 12:22:15 -03,2020-02-03,12:22:15,-0300,2466202912,96panisson,Panisson,,"@xicograziano @jairbolsonaro Quando vc deixar de acreditar que a terra é plana e começar a se informar por artigos científicos verá que ela está parcialmente certa. Se continuar o mesmo titia de desmatamento, em menos de 30 anos é possível que a Amazônia vire um lugar extrema seco, como uma savana.",pt,[],[],[],0,0,0,[],[],https://twitter.com/96Panisson/status/1224352405044760576,False,,0,,,,,,,,"[{'screen_name': 'xicograziano', 'name': 'Xico Graziano', 'id': '41881267'}, {'screen_name': 'jairbolsonaro', 'name': 'Jair M. Bolsonaro', 'id': '128372940'}]",,,,
1224350658167558146,1224350658167558146,2020-02-03 12:15:18 -03,2020-02-03,12:15:18,-0300,74715478,climainfonews,ClimaInfo,,"Até 23 de janeiro, os alertas de desmatamento do DETER na Amazônia somaram 4.707 km2, mais que os 12 meses de 2018 (4.571 km2). Mesmo faltando ainda 6 meses a apurar, esta já é 3a taxa de alertas mais alta da série histórica.  https://t.co/Lv3ehXdisv",pt,[],['http://conexaoplaneta.com.br/blog/desmatamento-na-amazonia-nos-ultimos-6-meses-ja-e-maior-do-que-o-registrado-no-ano-todo-de-2018/'],[],1,42,81,[],[],https://twitter.com/ClimaInfoNews/status/1224350658167558146,False,,0,,,,,,,,[],,,,
1224347577472225280,1224347577472225280,2020-02-03 12:03:04 -03,2020-02-03,12:03:04,-0300,14268150,tatti,Talita de Moraes,,Vocês que são inteligentes: esse verão com menos cara de verão de que tenho memória em meus 32 anos de vida tem a ver com o desmatamento da Amazônia?,pt,[],[],[],0,0,0,[],[],https://twitter.com/tatti/status/1224347577472225280,False,,0,,,,,,,,[],,,,
1224346663369740290,1224051988922621955,2020-02-03 11:59:26 -03,2020-02-03,11:59:26,-0300,1100630437590953985,gabrieltrosa1,🚩 Frodo.,,"@hilde_angel O mesmo madeireiro que você dá visibilidade por aqui é o que mata índios impunemente. O que o ministério do meio ambiente mais quer e que se legitime o desmatamento. Na Amazônia as coisas são interligadas. Tenha cautela ao divulgar, sem um texto explicativo, noticias assim.",pt,[],[],[],0,0,1,[],[],https://twitter.com/Gabrieltrosa1/status/1224346663369740290,False,,0,,,,,,,,"[{'screen_name': 'hilde_angel', 'name': 'Hildegard Angel', 'id': '174396298'}]",,,,
1224346362323574785,1224346362323574785,2020-02-03 11:58:14 -03,2020-02-03,11:58:14,-0300,496651076,stop_monsanto,StopMonsanto #bayer=monsanto,,Desmatamento: os 25 piores inimigos da Amazônia  https://t.co/tFVFQjlpA2 #OGM,pt,[],['http://www.biodiversidadla.org/Recomendamos/Desmatamento-os-25-piores-inimigos-da-Amazonia'],[],0,0,0,['ogm'],[],https://twitter.com/Stop_Monsanto/status/1224346362323574785,False,,0,,,,,,,,[],,,,
1224345710604230658,1214537857626517504,2020-02-03 11:55:39 -03,2020-02-03,11:55:39,-0300,1098582874968735744,amazonialatitud,Amazônia Latitude,,"[2] Lábrea-AM, é uma terra de ninguém? A cidade é a quarta com o maior índice de desmatamento e nos focos de incêndio dentro da Amazônia. Grilagem, exploração de madeira e outros flagelos foram registrados por Edmar Barros   https://t.co/LUJwhIf3Hk",pt,[],['https://amazonialatitude.com/2019/09/10/as-queimadas-em-labrea-terra-de-ninguem/'],[],1,0,2,[],[],https://twitter.com/amazonialatitud/status/1224345710604230658,False,,0,,,,,,,,[],,,,
1224342499528970240,1224342499528970240,2020-02-03 11:42:53 -03,2020-02-03,11:42:53,-0300,383359690,umagotanooceano,Uma Gota no Oceano,,"Desmatamento na Amazônia nos últimos 6 meses já é maior do que o registrado no ano todo de 2018 (4.571 km). Os alertas de desmate somaram 4.707 km até o dia 23 de janeiro. Os dados são do sistema Deter-B, do @inpe_mct.   https://t.co/r136u0tOH8",pt,"[{'screen_name': 'inpe_mct', 'name': 'inpe', 'id': '308605432'}]",['https://bit.ly/2GPL7MD'],[],0,3,4,[],[],https://twitter.com/UmaGotaNoOceano/status/1224342499528970240,False,,0,,,,,,,,[],,,,
1224340177381986307,1224293301941153797,2020-02-03 11:33:40 -03,2020-02-03,11:33:40,-0300,23496828,zanirato,Pariparoba,,"@veramagalhaes @Estadao Já ocupamos 93% da Mata Atlântica, 50% do Cerrado e 20% da Amazônia. Tudo de forma desordenada, desmatamento e grilagem de terra. Não tratamos o esgoto e não fornecemos água potável a população. Se não tivermos uma má reputação seria estranho.",pt,[],[],[],0,0,0,[],[],https://twitter.com/zanirato/status/1224340177381986307,False,,0,,,,,,,,"[{'screen_name': 'veramagalhaes', 'name': 'Vera Magalhães VACINA SIM💉', 'id': '19667016'}, {'screen_name': 'Estadao', 'name': 'Estadão', 'id': '9317502'}]",,,,
1224330989494771712,1224330989494771712,2020-02-03 10:57:09 -03,2020-02-03,10:57:09,-0300,1412842141,georgeafg,RÓRRE,,"Tá mais pra ""salvo"", já q por ex, na área ambiental NDA freou o desmonte dos órgãos da pasta e o desmatamento na amazônia segue em alta e na educação o MEC tá como a gente tá vendo aí.",pt,[],[],[],0,0,0,[],[],https://twitter.com/georgeafg/status/1224330989494771712,False,https://twitter.com/NPTO/status/1224288043613421568,0,,,,,,,,[],,,,
1224318405471342593,1224318405471342593,2020-02-03 10:07:09 -03,2020-02-03,10:07:09,-0300,3345989931,conexaoplaneta,Conexão Planeta,,"Desmatamento na Amazônia nos últimos 6 meses já é maior do que o registrado no ano todo de 2018  https://t.co/1adtXrRenp O mais preocupante é que o período entre novembro e abril deveria ser o de redução no ritmo da derrubada da floresta, devido à estação de chuvas  https://t.co/zQnfRvge10",pt,[],['https://bit.ly/2UmpV94'],['https://pbs.twimg.com/media/EP2nGZsX0AI9Ifw.jpg'],1,3,4,[],[],https://twitter.com/conexaoplaneta/status/1224318405471342593,False,,1,https://pbs.twimg.com/media/EP2nGZsX0AI9Ifw.jpg,,,,,,,[],,,,
1224307152262701057,1224307152262701057,2020-02-03 09:22:26 -03,2020-02-03,09:22:26,-0300,1117811675720187904,alexnogueirasp,Alex Nogueira 🇧🇷,,"Sou contra o desmatamento, adoro ruas e cidades arborizadas, tanto que, se pudesse, gostaria de ter um bosque particular dentro da cidade, mas acredito que a Amazônia pode ter um desenvolvimento sustentável, que ajude a manter a biodiversidade e a protege-la.",pt,[],[],[],0,0,1,[],[],https://twitter.com/AlexNogueiraSP/status/1224307152262701057,False,https://twitter.com/TLjuntos/status/1224292094136766464,0,,,,,,,,[],,,,
1224298765852594176,1224298765852594176,2020-02-03 08:49:06 -03,2020-02-03,08:49:06,-0300,8110402,ultimosegundo,iG Último Segundo,,Desmatamento nos últimos 6 meses na Amazônia supera todo o ano de 2018 →  https://t.co/0cFe0fV4X4  https://t.co/re01muf5kI,pt,[],['http://bit.ly/31nzfux'],['https://pbs.twimg.com/media/EP2VPJ6XkAEd7vX.jpg'],1,2,3,[],[],https://twitter.com/ultimosegundo/status/1224298765852594176,False,,1,https://pbs.twimg.com/media/EP2VPJ6XkAEd7vX.jpg,,,,,,,[],,,,
1224278280867545088,1224125931842871302,2020-02-03 07:27:42 -03,2020-02-03,07:27:42,-0300,921806300,soniawmaluf,Sônia Maluf #VacinaJá,,"@TssiaC Que absurdo essa postagem. Estavam fazendo o trabalho deles e foram recebidos a tiros. Quem atirou se defendendo foi a polícia ambiental, não os fiscais do IBAMA. Vc defende o desmatamento da Amazônia e a política de destruição ambiental do Bolsonaro?",pt,[],[],[],0,0,0,[],[],https://twitter.com/soniawmaluf/status/1224278280867545088,False,,0,,,,,,,,"[{'screen_name': 'TssiaC', 'name': 'Tássia Camargo', 'id': '322244089'}]",,,,
1224165665063559170,1224165665063559170,2020-02-03 00:00:13 -03,2020-02-03,00:00:13,-0300,1115815155097579520,soberano_e,Brasil Soberano e Livre,,Mourão já tem todos os instrumentos para combater desmatamento da Amazônia    https://t.co/gtA3oKy9sy  https://t.co/LwI4VmKjMT,pt,[],['https://brasilsoberanoelivre.blogspot.com/2020/02/mourao-ja-tem-todos-os-instrumentos.html'],['https://pbs.twimg.com/media/EP0cLtvW4AEg34b.jpg'],0,0,0,[],[],https://twitter.com/soberano_e/status/1224165665063559170,False,,1,https://pbs.twimg.com/media/EP0cLtvW4AEg34b.jpg,,,,,,,[],,,,
1224130844081651713,1224125503902224384,2020-02-02 21:41:51 -03,2020-02-02,21:41:51,-0300,399624221,andreysarmento,Andrey Sarmento,,"@TssiaC Tudo isso é para enfraquecer órgãos ambientais para poder liberar o desmatamento e garimpo na Amazônia e em terras índigenas, o que o Ibama mais precisa nesse momento é de proteção e apoio.",pt,[],[],[],0,4,31,[],[],https://twitter.com/AndreySarmento/status/1224130844081651713,False,,0,,,,,,,,"[{'screen_name': 'TssiaC', 'name': 'Tássia Camargo', 'id': '322244089'}]",,,,
1224113207096287232,1224113207096287232,2020-02-02 20:31:46 -03,2020-02-02,20:31:46,-0300,42332041,zezalulaestrela,Zeza Lula Estrela1⃣3⃣,,"Madeireiro ilegal morre em operação de combate a desmatamento em Roraima  https://t.co/Dbkz0RcS3j A operação era do @brasil_IBAMA contra o desmatamento ilegal e contava com o apoio da PM de Rondônia. Ninguém merece morrer assim, mas não dá para deixar a Amazônia morrer também.",pt,"[{'screen_name': 'brasil_ibama', 'name': 'ibama', 'id': '38790549'}]",['https://br.reuters.com/article/domesticNews/idBRKBN1ZW0LF-OBRDN'],[],2,10,8,[],[],https://twitter.com/zezaLulaestrela/status/1224113207096287232,False,,0,,,,,,,,[],,,,
1224104947354099714,1224104943113711618,2020-02-02 19:58:56 -03,2020-02-02,19:58:56,-0300,3355746328,fiscaldoibama,O FISCAL do IBAMA,,"Tão a vontade que as nossas fiscalizações NÃO DÃO CONTA. O desmatamento na Amazônia está sem freio. Some a isso o estímulo ao armamento do Cidadão de bem.  Nossas fiscalizações estão cada vez mais difíceis! Nos últimos meses fomos ameaçados em diversas operações, NÃO TA FÁCIL!",pt,[],[],[],2,39,204,[],[],https://twitter.com/fiscaldoibama/status/1224104947354099714,False,,0,,,,,,,,[],,,,
1224082060395999232,1224082060395999232,2020-02-02 18:28:00 -03,2020-02-02,18:28:00,-0300,17465506,pesquisafapesp,PesquisaFapesp,," https://t.co/Kr1LX8dhQj O físico Paulo Artaxo, da USP, explica por que a #Amazônia é tão importante para regulação do clima global. #ciência #floresta #florestamazônica #rainforest #desmatamento  #ambiente  https://t.co/X4FuRhjJj2",pt,[],['http://bit.ly/twVAmazonia'],['https://pbs.twimg.com/media/EPx4b2TX0AEzaeM.jpg'],0,41,27,"['amazônia', 'ciência', 'floresta', 'florestamazônica', 'rainforest', 'desmatamento', 'ambiente']",[],https://twitter.com/PesquisaFapesp/status/1224082060395999232,False,,1,https://pbs.twimg.com/media/EPx4b2TX0AEzaeM.jpg,,,,,,,[],,,,
1224039893397049361,1223806806423756800,2020-02-02 15:40:26 -03,2020-02-02,15:40:26,-0300,1194652827999703041,filhosimos,Simos Filho,,@Clistenes_alves @MisaelCavalcan6 @BolsonaroSP As estatais sempre foram usadas pela esquerda pra sobrevivência própria e ñ do país. Quanto mais direitos trabalhistas.. menos emprego. O desmatamento na Amazônia sempre existiu.. mas só agora o Brasil (hipócrita) descobriu isso. Foj Luladrão q falou em regulamentar a imprensa.🖕,pt,[],[],[],0,0,0,[],[],https://twitter.com/FilhoSimos/status/1224039893397049361,False,,0,,,,,,,,"[{'screen_name': 'MisaelCavalcan6', 'name': 'Misael Silva', 'id': '1189159650605830144'}, {'screen_name': 'BolsonaroSP', 'name': 'Eduardo Bolsonaro🇧🇷', 'id': '74756085'}]",,,,
1224038361020715009,1223999519320231936,2020-02-02 15:34:21 -03,2020-02-02,15:34:21,-0300,23496828,zanirato,Pariparoba,,"@ColpaniThiago @Estadao @EstadaoEconomia Amigo já desmatamos.93% da Mata Atlântica, 50% do Cerrado e 20% da Amazônia. 80% das patagens no Brasil estão degradadas. Não precisamos derrubar mais nenhuma árvore pra aumentar a produção agrícola. Porém o governo incentiva o desmatamento e grilagem de terras públicas.",pt,[],[],[],2,0,0,[],[],https://twitter.com/zanirato/status/1224038361020715009,False,,0,,,,,,,,"[{'screen_name': 'ColpaniThiago', 'name': 'Dr Thiago Colpani', 'id': '405622184'}, {'screen_name': 'Estadao', 'name': 'Estadão', 'id': '9317502'}, {'screen_name': 'EstadaoEconomia', 'name': 'Economia Estadão', 'id': '78774644'}]",,,,
1224030221063639041,1224029851440443392,2020-02-02 15:02:00 -03,2020-02-02,15:02:00,-0300,183635669,hcmkarla,🇧🇷Karla Macedo🇧🇷Roraima,,"@JornalOGlobo Carioca tomando.agua de cocô  E ""esquerdistas do Leblon  "" reclamando de desmatamento na Amazônia  Kkkkkkkkkkkkkk Vibe lacracão",pt,[],[],[],1,0,3,[],[],https://twitter.com/hcmkarla/status/1224030221063639041,False,,0,,,,,,,,"[{'screen_name': 'JornalOGlobo', 'name': 'Jornal O Globo', 'id': '54341363'}]",,,,
1224007302023450630,1224007302023450630,2020-02-02 13:30:56 -03,2020-02-02,13:30:56,-0300,470552116,joscarloswernec,JOSÉ CARLOS WERNECK,,Mourão já tem todos os instrumentos para combater desmatamento da Amazônia  https://t.co/WAtS0Xvdga,pt,[],['http://www.tribunadainternet.com.br/governo-acorda-e-vai-a-justica-cobrar-r-555-milhoes-aos-desmatadores-da-amazonia/'],[],0,0,0,[],[],https://twitter.com/JOSCARLOSWERNEC/status/1224007302023450630,False,,0,,,,,,,,[],,,,
1223985036640378880,1223806806423756800,2020-02-02 12:02:27 -03,2020-02-02,12:02:27,-0300,1153163968581705728,clisalvess,Clis,,"@MisaelCavalcan6 @BolsonaroSP Com certeza a ""esquerda"" está ""destruindo"" o país, com suas vendas de estatais e perda de direitos trabalhista, foi a esquerda, que em 2019 fez o aumento no DESMATAMENTO da Amazônia, fez os ataques a imprensa, e a cima de tudo, trouxe uma imagem ruim aí país criando inimigos.",pt,[],[],[],4,0,0,[],[],https://twitter.com/clisalvess/status/1223985036640378880,False,,0,,,,,,,,"[{'screen_name': 'MisaelCavalcan6', 'name': 'Misael Silva', 'id': '1189159650605830144'}, {'screen_name': 'BolsonaroSP', 'name': 'Eduardo Bolsonaro🇧🇷', 'id': '74756085'}]",,,,
1223951102191730689,1223951102191730689,2020-02-02 09:47:37 -03,2020-02-02,09:47:37,-0300,1056906934396248064,abullshitalker,crisis,,"sonhei q eu descobria um código da amazonia e eu n podia contar pra ngm pq se pessoas erradas descobrissem daí eles meio q teriam a ""legalização"" pra desmatar e aumentaria MUITO o desmatamento",pt,[],[],[],1,0,1,[],[],https://twitter.com/abullshitalker/status/1223951102191730689,False,,0,,,,,,,,[],,,,
1223937412205809669,1222489264476344320,2020-02-02 08:53:13 -03,2020-02-02,08:53:13,-0300,1162422873736327170,felipe_rosane,Rosane Terezinha Felipe,,@jairbolsonaro E mais uma coisa: quando esses que estão ali para fiscalizar e punir vão fazer o seu trabalho com a questão do desmatamento na Amazônia? Precisam estudar os artigos científicos para ver que a floresta é importantíssima para a nossa vida. Dá mais lucro em pé!,pt,[],[],[],1,0,0,[],[],https://twitter.com/felipe_rosane/status/1223937412205809669,False,,0,,,,,,,,"[{'screen_name': 'jairbolsonaro', 'name': 'Jair M. Bolsonaro', 'id': '128372940'}]",,,,
1223853730015141889,1223853730015141889,2020-02-02 03:20:41 -03,2020-02-02,03:20:41,-0300,74685087,terapeutaholist,luizaurelionogueira,,Impedir o desmatamento e exploração da Amazônia! - Assine a petição!  https://t.co/6ZzAGbU3pT via @change_br,pt,"[{'screen_name': 'change_br', 'name': 'change.org brasil #luteemcasa', 'id': '900348469'}]",['http://chng.it/xXDyBzHf'],[],0,0,0,[],[],https://twitter.com/terapeutaholist/status/1223853730015141889,False,,0,,,,,,,,[],,,,
1223766853945843712,1223586897622130688,2020-02-01 21:35:29 -03,2020-02-01,21:35:29,-0300,1155221219081424898,vitorello25,"L.C.V (Sou PT, sempre serei)",,"@jojoletthy Sem maldade, gostaria de saber se esse povo todo não apoia o governo, só em razão da cultura, ou pelo descaso com a Educação, Aposentadoria, Entreguismo, por não gerar emprego, Revisionismo Histórico, Desmatamento da Amazônia, Lei do Armamento, isso que eu queria saber.",pt,[],[],[],0,0,1,[],[],https://twitter.com/vitorello25/status/1223766853945843712,False,,0,,,,,,,,"[{'screen_name': 'jojoletthy', 'name': 'Milicianos ocupam o Planalto', 'id': '802220015739080704'}]",,,,
1223739372794716166,1223739372794716166,2020-02-01 19:46:17 -03,2020-02-01,19:46:17,-0300,19070116,leacemoah,Louis XIV,,Um sonho: Sanders presidente e uma bela sanção econômicas contra o Brasil pelo desmatamento da Amazônia.,pt,[],[],[],1,0,4,[],[],https://twitter.com/leacemoah/status/1223739372794716166,False,,0,,,,,,,,[],,,,
1223725986581307394,1222676170061352967,2020-02-01 18:53:05 -03,2020-02-01,18:53:05,-0300,1166746262395400193,killagateira,Walkiria,,@blogdopannunzio Essa mulher é pecuarista e só foi ocupar um cargo público visando seus próprios interesses. Como descendente de índio peguei nojo dessa criatura ao saber de suas incursões para o desmatamento na Amazônia e dificultar a demarcação de terras para o assentamento dos índios.,pt,[],[],[],0,0,0,[],[],https://twitter.com/killagateira/status/1223725986581307394,False,,0,,,,,,,,"[{'screen_name': 'blogdopannunzio', 'name': 'Fabio Pannunzio', 'id': '46040478'}]",,,,
1223725214925803521,1223573019085410305,2020-02-01 18:50:01 -03,2020-02-01,18:50:01,-0300,902254882488508417,alexandre141828,ALEXANDRE,,@rsallesmma Como é possível defender o desmatamento de uma riqueza incomparável (Amazônia)! Inevitavelmente precisamos de políticas protetivas do nosso patrimônio. @jairbolsonaro @SenadorKajuru @majorolimpio @BolsonaroSP @LuizFux @davialcolumbre @RodrigoMaia,pt,"[{'screen_name': 'jairbolsonaro', 'name': 'jair m. bolsonaro', 'id': '128372940'}, {'screen_name': 'senadorkajuru', 'name': 'senador kajuru', 'id': '193441509'}, {'screen_name': 'majorolimpio', 'name': 'major olimpio', 'id': '94451423'}, {'screen_name': 'bolsonarosp', 'name': 'eduardo bolsonaro🇧🇷', 'id': '74756085'}, {'screen_name': 'luizfux', 'name': 'luiz fux', 'id': '335338965'}, {'screen_name': 'davialcolumbre', 'name': 'davi alcolumbre', 'id': '2716763753'}, {'screen_name': 'rodrigomaia', 'name': 'rodrigo maia', 'id': '35260027'}]",[],[],0,0,0,[],[],https://twitter.com/ALEXANDRE141828/status/1223725214925803521,False,,0,,,,,,,,"[{'screen_name': 'rsallesmma', 'name': 'Ricardo Salles', 'id': '971822131024748545'}]",,,,
1223720451106537480,1223720451106537480,2020-02-01 18:31:05 -03,2020-02-01,18:31:05,-0300,162872621,eternothiago,Éter No Thiago,,"Fui na casa de uma amiga da minha avó hj e entendi pq o Bolsonaro não liga pro desmatamento da Amazônia, as senhoras já reflorestam tudo no quintal",pt,[],[],[],0,0,0,[],[],https://twitter.com/eternothiago/status/1223720451106537480,False,,0,,,,,,,,[],,,,
1223690818751467520,1223690818751467520,2020-02-01 16:33:20 -03,2020-02-01,16:33:20,-0300,80732922,accuarya,Adriana✡Ramirez⚜️,,"Falaram que o desmatamento da Amazônia iria acabar com as girafa...ops, com o mundo! #IsolemAChinaPorra",pt,[],[],[],0,0,1,['isolemachinaporra'],[],https://twitter.com/Accuarya/status/1223690818751467520,False,https://twitter.com/JornalOGlobo/status/1223682570975473664,0,,,,,,,,[],,,,
1223688851606134784,1223688851606134784,2020-02-01 16:25:31 -03,2020-02-01,16:25:31,-0300,1094749446041145346,fbio85375679,Fábio Moura,,@ACCIONA_EN boa tarde sou cidadão civil estou lhe encorajando a nos patrocinar um documentário sobre as queimadas e desmatamento diário da Amazônia que aliás acho que e responsavel por 30 por cento das mudanças climáticas  Amazônia está sendo invadida em um esquema flaudulento,pt,[],[],[],0,0,0,[],[],https://twitter.com/Fbio85375679/status/1223688851606134784,False,,0,,,,,,,,[],,,,
1223683366165385216,1223631773629931522,2020-02-01 16:03:44 -03,2020-02-01,16:03:44,-0300,1145039876775194624,vamos_em,Vamos em Frente,,"@bellamoura25 Se vc estudasse um pouco saberia que o desmatamento na Amazônia é pra criar gado. Mas pelo visto quem come grama é outro tipo de animal, né?",pt,[],[],[],0,0,0,[],[],https://twitter.com/vamos_em/status/1223683366165385216,False,,0,,,,,,,,[],,,,
1223680887327465475,1223680887327465475,2020-02-01 15:53:53 -03,2020-02-01,15:53:53,-0300,391011746,pralozano,PAULO R LOZANO,,"1 No nível atual de queima de carvão por ano para gerar eletricidade na Alemanha, o CO2 emitido equivale à queima de 8,9 mil Km2 de florestas úmidas, como a amazônica. A média do desmatamento na Amazônia Legal foi de 6,6 mil km2 por ano nos últimos 10 anos.",pt,[],[],[],0,0,0,[],[],https://twitter.com/pralozano/status/1223680887327465475,False,,0,,,,,,,,[],,,,
1223653843524825088,1223364385252442113,2020-02-01 14:06:25 -03,2020-02-01,14:06:25,-0300,1086789015599304705,marcelonorkey,Marcelo Norkey,,@obsclima @agenciabrasil A informação está incompleta e tendenciosa! O desmatamento no Brasil não é crime! Vcs tem como garantir que esses desmatamentos são ilegais ou eles seguem o código florestal que autoriza o desmatamento de até 50% (dependo do município) na Amazônia! Não desinformem!,pt,[],[],[],1,0,0,[],[],https://twitter.com/MarceloNorkey/status/1223653843524825088,False,,0,,,,,,,,"[{'screen_name': 'obsclima', 'name': 'Observatório do Clima, 19 anos', 'id': '36336107'}, {'screen_name': 'agenciabrasil', 'name': 'Agência Brasil', 'id': '14434407'}]",,,,
1223651071555461120,1223651071555461120,2020-02-01 13:55:24 -03,2020-02-01,13:55:24,-0300,1138965305760374784,chicopinto8,Chico Pinto,,"Durante meses, nos debruçamos sobre 284.235 multas por desmatamento nos últimos 25 anos. E descobrimos que os maiores destruidores do meio ambiente – principalmente da Amazônia – não são os pobres. São algumas das pessoas mais ricas e poderosas do Brasil.  https://t.co/piLl1TOXVs",pt,[],['https://theintercept.com/2020/01/31/maiores-desmatadores-amazonia/'],[],0,20,30,[],[],https://twitter.com/ChicoPinto8/status/1223651071555461120,False,,0,,,,,,,,[],,,,
1223641890488225792,1223641890488225792,2020-02-01 13:18:55 -03,2020-02-01,13:18:55,-0300,8314982,mamendex,Marcelol,,"Essas coincidências... desmatamento recorde na Amazônia, chuva recorde proveniente da Amazônia, governo que não acredita em sustentabilidade e aquecimento global...    https://t.co/iaIqw2qCiM",pt,[],['https://g1.globo.com/mg/minas-gerais/noticia/2020/02/01/janeiro-mais-chuvoso-da-historia-de-bh-termina-com-quase-3-vezes-mais-chuva-que-a-media-esperada-para-o-mes.ghtml'],[],0,0,0,[],[],https://twitter.com/mamendex/status/1223641890488225792,False,,0,,,,,,,,[],,,,
1223636398667915270,1223381981259608067,2020-02-01 12:57:06 -03,2020-02-01,12:57:06,-0300,1088978148530798592,dudsmeello,dudsmelo,,@JeanCarlo_co Uai meu papel de trouxa é responsável por 98% do desmatamento da Amazônia,pt,[],[],[],0,1,1,[],[],https://twitter.com/dudsmeello/status/1223636398667915270,False,,0,,,,,,,,"[{'screen_name': 'JeanCarlo_co', 'name': 'Jean Carlo #FORA SSR', 'id': '832344202491072512'}]",,,,
1223628118600056832,1223628118600056832,2020-02-01 12:24:12 -03,2020-02-01,12:24:12,-0300,120302111,carlosnoronha53,Noronha,,"Quem destrói a floresta não são os pobres (Paulo Guedes) e o desmatamento não é ‘cultural’ (Bozo). Ela é movida a muito dinheiro Bilionários, políticos, paulistas, estrangeiros, reincidentes contumazes:  aqui estão os 25 maiores destruidores da Amazônia  https://t.co/r4XpVon0RB",pt,[],['https://interc.pt/2S5itMM'],[],0,0,1,[],[],https://twitter.com/carlosnoronha53/status/1223628118600056832,False,,0,,,,,,,,[],,,,
1223625560607395841,1223579327805169664,2020-02-01 12:14:02 -03,2020-02-01,12:14:02,-0300,343659270,marilzarezende,marilza rezende,,"@JulioCe31010224 @erikakokay Qual moral? Destruir a educação do pais, retroceder aos séculos de escuridão cultural? A do desprezo a diversidade? A de dizer q foram ""apenas"" 6.000 erros no Enem? O de negar o desmatamento na Amazônia Brasileira? A de aceitar a deportação dos brasileiros algemados? Quem????????",pt,[],[],[],0,0,0,[],[],https://twitter.com/MarilzaRezende/status/1223625560607395841,False,,0,,,,,,,,"[{'screen_name': 'JulioCe31010224', 'name': 'JulioCesar', 'id': '903277910500433920'}, {'screen_name': 'erikakokay', 'name': 'Erika Kokay', 'id': '87021796'}]",,,,
1223618279924813824,1223618279924813824,2020-02-01 11:45:06 -03,2020-02-01,11:45:06,-0300,66197913,tadeu_alves,Tadeu Alves,,Desmatamento: os 25 piores inimigos da Amazônia  https://t.co/N4aOX4h5Ll,pt,[],['https://outraspalavras.net/outrasmidias/desmatamento-os-25-piores-inimigos-da-amazonia/'],[],0,0,0,[],[],https://twitter.com/tadeu_alves/status/1223618279924813824,False,,0,,,,,,,,[],,,,
1223586925858238464,1223586925858238464,2020-02-01 09:40:30 -03,2020-02-01,09:40:30,-0300,1213862922578870272,roberta73624874,ROBERTA SALES 🚩🚩🚩,,CartaCaputal desmente o ministro Paulo Guedes sobre responsáveis pelo desmatamento na Amazônia.,pt,[],[],[],0,0,0,[],[],https://twitter.com/ROBERTA73624874/status/1223586925858238464,False,https://twitter.com/cartacapital/status/1223565417068802048,0,,,,,,,,[],,,,
