id,conversation_id,created_at,date,time,timezone,user_id,username,name,place,tweet,language,mentions,urls,photos,replies_count,retweets_count,likes_count,hashtags,cashtags,link,retweet,quote_url,video,thumbnail,near,geo,source,user_rt_id,user_rt,retweet_id,reply_to,retweet_date,translate,trans_src,trans_dest
1188995551729205248,1188995551729205248,2019-10-28 22:46:44 -03,2019-10-28,22:46:44,-0300,474633073,priscilapedros2,Priscila Prisco,,O presidente considera que o desmatamento na Amazônia é de total responsabilidade do Coringa e da Joelma  https://t.co/xe3n3U6XoZ,pt,[],['https://rafaelcapanema.blogosfera.uol.com.br/2019/10/28/faca-como-o-governo-e-invente-culpados-aleatorios-pelos-nossos-problemas/'],[],0,0,0,[],[],https://twitter.com/PriscilaPedros2/status/1188995551729205248,False,,0,,,,,,,,[],,,,
1188994875083165696,1188994875083165696,2019-10-28 22:44:03 -03,2019-10-28,22:44:03,-0300,1081903650350485511,thiagoassun,Thiago Assunção,,Aula Magna do Prof. Carlos Nobre sobre desmatamento da Amazônia!,pt,[],[],[],0,0,0,[],[],https://twitter.com/ThiagoAssun/status/1188994875083165696,False,https://twitter.com/rodaviva/status/1188983859183943680,0,,,,,,,,[],,,,
1188993858358726656,1188993858358726656,2019-10-28 22:40:00 -03,2019-10-28,22:40:00,-0300,1149680282984964096,pv43capital,PV São Paulo,,Se não zerarmos o desmatamento corremos o risco de acelerar o processo de “savanização” da Amazônia. Carlos Nobre no #RodaViva,pt,[],[],[],0,6,11,['rodaviva'],[],https://twitter.com/pv43capital/status/1188993858358726656,False,,0,,,,,,,,[],,,,
1188988906638843904,1188986930811359233,2019-10-28 22:20:20 -03,2019-10-28,22:20:20,-0300,44663550,elainisilva,Elaini Silva (em 🏠),,"O tema do ponto de não retorno sa Amazônia identificado pelo prpf Carlos Nobre décadas atrás - além do desmatamento, ele diz incluir hj outro fatores: mufança do clima e maior vulnerabilidade ao fogo. Isso a deixa mto mais próxima do ponto de se tornar savana.",pt,[],[],[],0,0,2,[],[],https://twitter.com/elainisilva/status/1188988906638843904,False,,0,,,,,,,,[],,,,
1188983886010880000,1188979021561958406,2019-10-28 22:00:23 -03,2019-10-28,22:00:23,-0300,290066923,ronivaldopa,Roni --- 🇧🇷 Brasil 🇧🇷,,"@jornal_cultura Putss... Sr. geógrafo, atribuir o crescimento do desmatamento da Amazônia ""a fala"" de um presidente é, pra mim, vazio demais!!",pt,[],[],[],0,0,0,[],[],https://twitter.com/ronivaldopa/status/1188983886010880000,False,,0,,,,,,,,"[{'screen_name': 'jornal_cultura', 'name': 'Jornalismo TV Cultura', 'id': '126750296'}]",,,,
1188979021561958406,1188979021561958406,2019-10-28 21:41:03 -03,2019-10-28,21:41:03,-0300,126750296,jornal_cultura,Jornalismo TV Cultura,,"Segundo o INPE, alertas de desmatamento na Amazônia cresceram 80% nos 10 primeiros meses deste ano em relação a 2018. A região mais preocupante é a Norte. #JornaldaCultura",pt,[],[],[],6,4,26,['jornaldacultura'],[],https://twitter.com/jornal_cultura/status/1188979021561958406,False,,0,,,,,,,,[],,,,
1188969450164371456,1188616665833132039,2019-10-28 21:03:01 -03,2019-10-28,21:03:01,-0300,3903650555,barbogeorgina,Maria Georgina Barbo,,@MarinaSilva O principal para implementar não é muitos discursos vazios de ações participativas. A situação do ÓLEO é para todos os brasileiros participarem independente de partidos Chega de discursos.Lembre na sua gestão tivemos uma das maiores queimadas e desmatamento da Amazônia.,pt,[],[],[],0,0,1,[],[],https://twitter.com/BarboGeorgina/status/1188969450164371456,False,,0,,,,,,,,"[{'screen_name': 'MarinaSilva', 'name': 'Marina Silva', 'id': '105155795'}]",,,,
1188963884020961280,1188963884020961280,2019-10-28 20:40:54 -03,2019-10-28,20:40:54,-0300,8273552,danilars,Danila Ribeiro,,O governo acredita que o desmatamento na Amazônia é resultado da ação do japonês da Federal e da Taylor Swift.,pt,[],[],[],0,0,1,[],[],https://twitter.com/danilars/status/1188963884020961280,False,https://twitter.com/rafaelcapanema/status/1188917234787344385,0,,,,,,,,[],,,,
1188957928797159426,1188957928797159426,2019-10-28 20:17:14 -03,2019-10-28,20:17:14,-0300,2405669068,aluquett,Ana Clara,,O governo considera que o desmatamento na Amazônia é culpa do Coringa e da Joelma.,pt,[],[],[],0,0,0,[],[],https://twitter.com/aluquett/status/1188957928797159426,False,https://twitter.com/rafaelcapanema/status/1188917234787344385,0,,,,,,,,[],,,,
1188954271397617669,1188954271397617669,2019-10-28 20:02:42 -03,2019-10-28,20:02:42,-0300,4827731242,igorama0,RETRO,,"""O establishment quer esconder de você que o desmatamento na Amazônia tem como causa a ação do Érick Jacquin e da Tatá Werneck""",pt,[],[],[],0,0,0,[],[],https://twitter.com/igorama0/status/1188954271397617669,False,https://twitter.com/rafaelcapanema/status/1188917234787344385,0,,,,,,,,[],,,,
1188940061502574594,1188940061502574594,2019-10-28 19:06:14 -03,2019-10-28,19:06:14,-0300,713772147194335232,augusto7_cesar,CESAUGUSTO,,Impedir o desmatamento e exploração da Amazônia!  - Assine a petição!  https://t.co/z1mpsQmddI via @change_br,pt,"[{'screen_name': 'change_br', 'name': 'change.org brasil #luteemcasa', 'id': '900348469'}]",['http://chng.it/6qpY2FRb'],[],0,2,1,[],[],https://twitter.com/augusto7_cesar/status/1188940061502574594,False,,0,,,,,,,,[],,,,
1188939547519913987,1188915230212001793,2019-10-28 19:04:12 -03,2019-10-28,19:04:12,-0300,1187707218780663813,moon72193403,Moon,,@JovanneJesus33 @psol50 E ele está ? Se ele estivesse trabalhado ele tentaria cuidar do desmatamento na Amazônia.,pt,[],[],[],0,0,0,[],[],https://twitter.com/Moon72193403/status/1188939547519913987,False,,0,,,,,,,,"[{'screen_name': 'JovanneJesus33', 'name': 'Jovanne Jesus', 'id': '899260912019922945'}, {'screen_name': 'psol50', 'name': 'PSOL 50', 'id': '1202130601'}]",,,,
1188937962937036801,1188937962937036801,2019-10-28 18:57:54 -03,2019-10-28,18:57:54,-0300,198292005,betaquarks,"Millennial não, eu sou um cringe Centennial!",,"O coração: Desmatamento, fogo na Amazônia, fumaça nos céus, educação desmoronando, privatizações, desemprego, óleo nas praias do Nordeste, o país em um caos político.  A mente: Caneta azuuul, azul caneeeta. Caneta azul está marcada com minha letra!   #socorro #musica #chiclete",pt,[],[],[],0,0,0,"['socorro', 'musica', 'chiclete']",[],https://twitter.com/betaquarks/status/1188937962937036801,False,,0,,,,,,,,[],,,,
1188936478581243909,1188936478581243909,2019-10-28 18:52:00 -03,2019-10-28,18:52:00,-0300,772222904998256640,regazevedo,Sônia Azevedo,,Maior desmatamento da Amazônia.#1AnodeDesgraca,pt,[],[],[],0,0,0,['1anodedesgraca'],[],https://twitter.com/regazevedo/status/1188936478581243909,False,,0,,,,,,,,[],,,,
1188932841708707843,1188917234787344385,2019-10-28 18:37:33 -03,2019-10-28,18:37:33,-0300,107219975,necksanexa,Mary 🇧🇷🇧🇷,,@rafaelcapanema O presidente considera que o desmatamento na Amazônia é consequência da atuação do Smilinguido e da Joelma.,pt,[],[],[],0,0,0,[],[],https://twitter.com/Necksanexa/status/1188932841708707843,False,,0,,,,,,,,"[{'screen_name': 'rafaelcapanema', 'name': 'Rafael Capanema', 'id': '15754806'}]",,,,
1188932472597299204,1188932472597299204,2019-10-28 18:36:05 -03,2019-10-28,18:36:05,-0300,1012064605282193408,breniltoo,brenu. 💫,,o desmatamento na Amazônia é de total responsabilidade da Larissa Manoela e do Faustão,pt,[],[],[],0,0,0,[],[],https://twitter.com/Breniltoo/status/1188932472597299204,False,https://twitter.com/rafaelcapanema/status/1188917234787344385,0,,,,,,,,[],,,,
1188927230098976770,1188927230098976770,2019-10-28 18:15:15 -03,2019-10-28,18:15:15,-0300,138492825,proindio,Comissão Pró-Índio,,"“Desmatamento zero” não é um slogan nem uma utopia”, Carlos Nobre | “É uma política concreta e viável. O grande potencial econômico da Amazônia pode ser valorizado dentro de um sistema que deixe a floresta intacta.”  https://t.co/LxzrECb0Bs",pt,[],['http://www.ihu.unisinos.br/593835-desmatamento-zero-uma-politica-possivel-e-viavel-entrevista-com-carlos-nobre'],[],0,10,17,[],[],https://twitter.com/proindio/status/1188927230098976770,False,,0,,,,,,,,[],,,,
1188926270412935169,1188926270412935169,2019-10-28 18:11:26 -03,2019-10-28,18:11:26,-0300,190463455,esquilo_,Esquila,,Estamos convictos de que o desmatamento na Amazônia é consequência da atuação do papa Francisco e da Geisy Arruda.  https://t.co/cS8tqgN7LY,pt,[],['https://rafaelcapanema.blogosfera.uol.com.br/2019/10/28/faca-como-o-governo-e-invente-culpados-aleatorios-pelos-nossos-problemas/'],[],1,2,1,[],[],https://twitter.com/esquilo_/status/1188926270412935169,False,,0,,,,,,,,[],,,,
1188925586300899335,1188925586300899335,2019-10-28 18:08:43 -03,2019-10-28,18:08:43,-0300,51932830,leamaral13,Le🅰️ndro¹³,,Tudo indica que o desmatamento na Amazônia é responsabilidade do Kanye West e da Tatá Werneck.,pt,[],[],[],0,0,0,[],[],https://twitter.com/LeAmaral13/status/1188925586300899335,False,https://twitter.com/rafaelcapanema/status/1188917234787344385,0,,,,,,,,[],,,,
1188921391241924609,1188921391241924609,2019-10-28 17:52:03 -03,2019-10-28,17:52:03,-0300,1114259195229024256,limaaaah1,Lima,,O establishment quer esconder de você que o desmatamento na Amazônia é culpa da Joice Hasselmann e da Luciana Gimenez.,pt,[],[],[],0,0,1,[],[],https://twitter.com/Limaaaah1/status/1188921391241924609,False,https://twitter.com/rafaelcapanema/status/1188917234787344385,0,,,,,,,,[],,,,
1188921106851336194,1188921106851336194,2019-10-28 17:50:55 -03,2019-10-28,17:50:55,-0300,210221247,mthlimao,Matheus,,"""O governo considera que o desmatamento na Amazônia decorre das atividades dos otakus e da Larissa Manoela.""  Se o Ministro tivesse emendado essa, acreditaria 100% nele",pt,[],[],[],2,0,10,[],[],https://twitter.com/mthlimao/status/1188921106851336194,False,https://twitter.com/rafaelcapanema/status/1188917234787344385,0,,,,,,,,[],,,,
1188920361531916288,1188920361531916288,2019-10-28 17:47:57 -03,2019-10-28,17:47:57,-0300,1004511711251099653,dudasalabert,Duda Salabert 🌳,,"Desde que Bolsonaro assumiu: desmatamento da Amazônia cresceu 93%;maior crime ambiental do litoral brasileiro; aumento da desigualdade social;aumento do trabalho informal,chegando a 44,4% da população ocupada; aumento no número de feminicídios;  economia estagnada #1AnodeDesgraca",pt,[],[],[],4,46,182,['1anodedesgraca'],[],https://twitter.com/DudaSalabert/status/1188920361531916288,False,,0,,,,,,,,[],,,,
1188920056262119425,1188920056262119425,2019-10-28 17:46:45 -03,2019-10-28,17:46:45,-0300,442372809,brumedus,o ator vegano joaquin phoenix,,Tudo indica que o desmatamento na Amazônia é de total responsabilidade do filme Bacurau e da Luísa Mell.  https://t.co/L096qElgvG,pt,[],['https://rafaelcapanema.blogosfera.uol.com.br/2019/10/28/faca-como-o-governo-e-invente-culpados-aleatorios-pelos-nossos-problemas/'],[],0,0,0,[],[],https://twitter.com/brumedus/status/1188920056262119425,False,,0,,,,,,,,[],,,,
1188904079881322497,1188877520638267393,2019-10-28 16:43:16 -03,2019-10-28,16:43:16,-0300,3312135711,ogabrielsal,"Rafa, não é indireta",,"@jairbolsonaro Se acha herói, mas tem sido vilão.   Fez acordo pra livrar filho corrupto; Causou brigas internas no partido; Fez pouco caso com o desmatamento da Amazônia e a poluição dos litorais; Queria indicar o filho que não fala nem português direito pra ser embaixador e nem isso conseguiu",pt,[],[],[],0,0,0,[],[],https://twitter.com/ogabrielsal/status/1188904079881322497,False,,0,,,,,,,,"[{'screen_name': 'jairbolsonaro', 'name': 'Jair M. Bolsonaro', 'id': '128372940'}]",,,,
1188894464292589569,1188894464292589569,2019-10-28 16:05:03 -03,2019-10-28,16:05:03,-0300,17684034,dias_silvia,a pandemia não acabou 😷🏡,,#1AnodeDesgraca -&gt; um ano de recordes: Desmatamento recorde Recorde de incêndios na Amazônia Recorde de incêndios no Pantanal Recorde de aprovação de agrotóxicos Recorde de desmonte ambiental Recorde de acusações sem provas contra ONGs E ainda falta explicar #QuemMatouMarielle,pt,[],[],[],1,0,0,"['1anodedesgraca', 'quemmatoumarielle']",[],https://twitter.com/dias_silvia/status/1188894464292589569,False,,0,,,,,,,,[],,,,
1188871751834460165,1188871751834460165,2019-10-28 14:34:48 -03,2019-10-28,14:34:48,-0300,1040365312259121152,mariavaleriame4,mariameloAdEvogada❤️🇧🇷 ❤️,,AMAZÔNIA - MITOS e VERDADES sobre o DESMATAMENTO  https://t.co/ofw1UbzoM3 via @YouTube  #BolsonarosMentirosos,pt,"[{'screen_name': 'youtube', 'name': 'youtube', 'id': '10228272'}]",['https://youtu.be/h6z74DuqtUc'],[],0,0,0,['bolsonarosmentirosos'],[],https://twitter.com/mariavaleriame4/status/1188871751834460165,False,,0,,,,,,,,[],,,,
1188855642427015168,1188774048311971842,2019-10-28 13:30:47 -03,2019-10-28,13:30:47,-0300,1128652114924797958,mantinom,Mocinha Isentona,,"@norman221947 @eumesmadenise @henrybugalho Se vc acha q o UOL é a mídia ""Anticomunista"", então tudo pode ser fake news. Até as notícias sobre desmatamento na Amazônia. Como vc vai verificar isso? Se o UOL é ""do mal"", só diz fake news, então as notícias sobre fogos devem ser tbm fake news da MÍDIA PRODUTORA DE FAKE NEWS.",pt,[],[],[],0,0,0,[],[],https://twitter.com/MAntinom/status/1188855642427015168,False,,0,,,,,,,,"[{'screen_name': 'Norman221947', 'name': 'ImMinervaShush', 'id': '1214557875609030656'}, {'screen_name': 'henrybugalho', 'name': 'Henry Bugalho', 'id': '20294499'}]",,,,
1188845611589746694,1188845611589746694,2019-10-28 12:50:56 -03,2019-10-28,12:50:56,-0300,69971102,welovebac0n,jose bizarre aventure,,Tudo indica que o desmatamento na Amazônia é de total responsabilidade dos otakus e do Paulo Coelho  O establishment quer esconder de você que o derramamento de óleo na costa do nordeste é resultado da ação do Coringa e dos estudantes de humanas.  adorei,pt,[],[],[],0,0,1,[],[],https://twitter.com/welovebac0n/status/1188845611589746694,False,https://twitter.com/UOL/status/1188844724729368583,0,,,,,,,,[],,,,
1188821196663603201,1188615381205827585,2019-10-28 11:13:55 -03,2019-10-28,11:13:55,-0300,58092496,laricadenoite,amazing amy,,"@Normose_ Pra mim o pior é a política ambiental. O Ricardo Salles. Eu sabia que seria ruim, mas não sabia que seria TANTO. Eu sabia que teria desmatamento recorde na Amazônia, mas não imaginei que teriam esses incêndios horríveis, e a falta de ação contra o petróleo no mar é absurda",pt,[],[],[],0,0,0,[],[],https://twitter.com/laricadenoite/status/1188821196663603201,False,,0,,,,,,,,"[{'screen_name': 'Normose_', 'name': 'Normose_', 'id': '827288700501508096'}]",,,,
1188818827968208899,1188818827968208899,2019-10-28 11:04:30 -03,2019-10-28,11:04:30,-0300,14282032,besteves,Bernardo Esteves,,"Hoje à noite o climatologista Carlos Nobre vai ao Roda Viva. Em pauta, desmatamento, aquecimento global, o futuro da Amazônia e o sínodo do Vaticano encerrado ontem",pt,[],[],[],1,11,54,[],[],https://twitter.com/besteves/status/1188818827968208899,False,https://twitter.com/diretodaciencia/status/1188807163029929985,0,,,,,,,,[],,,,
1188787739220688896,1188787739220688896,2019-10-28 09:00:58 -03,2019-10-28,09:00:58,-0300,1013442157611487232,augustoomss,augustooo,,Entenda o Desmatamento na AMAZÔNIA de um jeito SIMPLES  https://t.co/P74KJAq8qw via @YouTube,pt,"[{'screen_name': 'youtube', 'name': 'youtube', 'id': '10228272'}]",['https://youtu.be/Yo3xbzSbcCE'],[],0,0,0,[],[],https://twitter.com/augustoomss/status/1188787739220688896,False,,0,,,,,,,,[],,,,
1188774824157601792,1188623483070234625,2019-10-28 08:09:39 -03,2019-10-28,08:09:39,-0300,715010093885030400,fabiojs_pb,Fábio_PB,,@Carlinhosmaiaof Pronto agora o desmatamento da Amazônia e os Mares do Nordeste vai virá desculpa para qualquer cagada que algum famoso faz.,pt,[],[],[],0,0,6,[],[],https://twitter.com/Fabiojs_PB/status/1188774824157601792,False,,0,,,,,,,,"[{'screen_name': 'Carlinhosmaiaof', 'name': 'Carlinhos Maia', 'id': '805922985483862016'}]",,,,
1188764847380422661,1188764847380422661,2019-10-28 07:30:00 -03,2019-10-28,07:30:00,-0300,41123392,_ihu,IHU,,"“Desmatamento zero” não é um slogan nem uma utopia. “É uma política concreta e viável. O grande potencial econômico da Amazônia pode ser valorizado dentro de um sistema que, a partir da sua incalculável biodiversidade, deixe a floresta intacta.”  https://t.co/9Ce8a77VxP",pt,[],['http://bit.ly/2NnE3cO'],[],0,16,20,[],[],https://twitter.com/_ihu/status/1188764847380422661,False,,0,,,,,,,,[],,,,
1188660889005760513,1188660674852982787,2019-10-28 00:36:54 -03,2019-10-28,00:36:54,-0300,1182865196873900037,mikaell66519117,Deborah Garcia,,#desmatamento #Amazonia #Fazenda11 #professores #trabalho #poluição,und,[],[],[],0,0,0,"['desmatamento', 'amazonia', 'fazenda11', 'professores', 'trabalho', 'poluição']",[],https://twitter.com/Mikaell66519117/status/1188660889005760513,False,,0,,,,,,,,[],,,,
1188652693692276736,1188616665833132039,2019-10-28 00:04:20 -03,2019-10-28,00:04:20,-0300,756010231,majorgabdf,KMR DF,,@MarinaSilva Quero saber sobre o desmatamento bilionário que seu marido fez na Amazônia...,pt,[],[],[],0,0,1,[],[],https://twitter.com/majorgabdf/status/1188652693692276736,False,,0,,,,,,,,"[{'screen_name': 'MarinaSilva', 'name': 'Marina Silva', 'id': '105155795'}]",,,,
1188636501464117249,1188636501464117249,2019-10-27 23:00:00 -03,2019-10-27,23:00:00,-0300,32529120,valoreconomico,Valor Econômico,,“Amazônia Sociedade Anônima” exalta a beleza da floresta e denuncia seu desmatamento   https://t.co/drS66F3aGY,pt,[],['https://valor.globo.com/eu-e/noticia/2019/10/25/amazonia-sociedade-anonima-exalta-a-beleza-da-floresta-e-denuncia-seu-desmatamento.ghtml'],[],4,8,43,[],[],https://twitter.com/valoreconomico/status/1188636501464117249,False,,0,,,,,,,,[],,,,
1188631324170620934,1188631324170620934,2019-10-27 22:39:26 -03,2019-10-27,22:39:26,-0300,1167979325368471552,sofialeaooo,sofria,,Eu espero muito muito muito que o tema da redação tenha relação com as queimadas e o desmatamento da Amazônia aaaaaaaa,pt,[],[],[],1,0,1,[],[],https://twitter.com/sofialeaooo/status/1188631324170620934,False,,0,,,,,,,,[],,,,
1188618234196561921,1188606627609485312,2019-10-27 21:47:25 -03,2019-10-27,21:47:25,-0300,1185258419722293250,lucianegiuli1,Lu Giuli,,@showdavida @RedeGlobo Bia Noite! Cadê o mundo que estava tão interessado no desmatamento da Amazônia pra agora nos ajudar a limpar os mares e praias contaminados por óleo? Precisamos de ajuda. #pelobrasil #chegadeexploracao #acordabrasil,pt,[],[],[],0,0,1,"['pelobrasil', 'chegadeexploracao', 'acordabrasil']",[],https://twitter.com/LucianeGiuli1/status/1188618234196561921,False,,0,,,,,,,,"[{'screen_name': 'showdavida', 'name': 'Fantástico', 'id': '29797128'}]",,,,
1188616636263288834,1188616636263288834,2019-10-27 21:41:04 -03,2019-10-27,21:41:04,-0300,249899579,_pedroramiro,Pedro Ramiro,,É a irresponsabilidade em Mariana + Brumadinho + Desmatamento na Amazônia + manchas de óleo...   Aos poucos tudo vai se perdendo e a natureza deixando de existir...,pt,[],[],[],0,0,5,[],[],https://twitter.com/_pedroramiro/status/1188616636263288834,False,,0,,,,,,,,[],,,,
1188611079351525384,1188456998146195456,2019-10-27 21:18:59 -03,2019-10-27,21:18:59,-0300,184203146,margatt,Márcia Nogueira🇧🇷🇮🇹🇨🇭🇩🇪🇵🇹🇪🇸🚩🏳️‍🌈🏳️,,"@ClauBraghini @gigi_dutra @exame Que pensamento mais distorcido! Problemas ambientais tem que ser todos combatidos, exemplos no Brasil não faltam: mineradoras em Minas Gerais, Petroleiras no litoral nordestino e sim, desmatamento e queimadas gigantescas na Amazônia. Uma coisa não substitui a outra.",pt,[],[],[],2,0,2,[],[],https://twitter.com/margatt/status/1188611079351525384,False,,0,,,,,,,,"[{'screen_name': 'ClauBraghini', 'name': 'Claudio Braghini', 'id': '25763868'}, {'screen_name': 'gigi_dutra', 'name': '🕯⚔️G̺͆i̺͆G̺͆i̺͆⚔️🕯', 'id': '3257594932'}, {'screen_name': 'exame', 'name': 'exame', 'id': '30070288'}]",,,,
1188601862779555842,1188601862779555842,2019-10-27 20:42:21 -03,2019-10-27,20:42:21,-0300,959408023646167040,brancosenulos,Brancos e Nulos,,Não se pode criar o precedente de q o desmatamento da Amazônia equivalente a 4x a cidade convive com a Verdade! Um abraço Nordeste.,pt,[],[],[],0,0,0,[],[],https://twitter.com/brancosenulos/status/1188601862779555842,False,,0,,,,,,,,[],,,,
1188578650440065030,1188213600328048655,2019-10-27 19:10:07 -03,2019-10-27,19:10:07,-0300,943264298054414337,eduarda80318192,Duda Santi,,@KAIQUEKCS1 @jacquel24783276 @MarinaSilva Veja no gráfico do INPE. O ano que Marina Silva assumiu como Ministra do Meio ambiente o desmatamento na Amazônia aumentou.. depois que pediu demissão o desmatamento na Amazônia diminuiu.,pt,[],[],[],2,0,0,[],[],https://twitter.com/Eduarda80318192/status/1188578650440065030,False,,0,,,,,,,,"[{'screen_name': 'KAIQUEKCS1', 'name': 'Kaique Carvalho🇧🇷🇧🇷', 'id': '1121610000567349248'}, {'screen_name': 'jacquel24783276', 'name': 'jacqueline campos', 'id': '1148619404353179649'}, {'screen_name': 'MarinaSilva', 'name': 'Marina Silva', 'id': '105155795'}]",,,,
1188560606519091202,1188560606519091202,2019-10-27 17:58:25 -03,2019-10-27,17:58:25,-0300,1106305028338405377,dannybondlove,Danny Bond Love,,"Lógica do Bolsonaro :   Mancha de óleo nas praias - Greenpeace   Desmatamento na Amazônia -  ONGs   Gays -  Professores de esquerda   Agora só falta ter um tiroteio no Brasil e falarem que a culpa é da @BonddDanny , que absurdo !!!",pt,[],[],[],0,1,3,[],[],https://twitter.com/dannybondlove/status/1188560606519091202,False,,0,,,,,,,,[],,,,
1188552777687031808,1188552777687031808,2019-10-27 17:27:19 -03,2019-10-27,17:27:19,-0300,843751232615387136,esuardoesuardo,🌾🥞🫖🕊,,vcs sabia q o grande vilao do desmatamento na amazonia sao as industria da carne ao molho madeira..,pt,[],[],[],0,0,2,[],[],https://twitter.com/esuardoesuardo/status/1188552777687031808,False,,0,,,,,,,,[],,,,
1188503710466527233,1188492315108790278,2019-10-27 14:12:20 -03,2019-10-27,14:12:20,-0300,848956477662535680,nishimura_gui,Guilherme 西村,,@esthercronemb Desmatamento.... principalmente relacionado a amazônia,pt,[],[],[],1,0,0,[],[],https://twitter.com/Nishimura_Gui/status/1188503710466527233,False,,0,,,,,,,,[],,,,
1188498508522897409,1188493082083385345,2019-10-27 13:51:40 -03,2019-10-27,13:51:40,-0300,710787276,cesarde_paulo,PauloCesardeAmorim,,"@RenovaMidia Sem nunca se importarem com tamanha corrupção, extração ilegal, desmatamento e ecoterrorismo agora todos querem ""cuidar""da Amazônia como se fossem donos. Está fácil quando a agenda é ideologicamente tendenciosa.",pt,[],[],[],0,1,32,[],[],https://twitter.com/cesarde_paulo/status/1188498508522897409,False,,0,,,,,,,,"[{'screen_name': 'RenovaMidia', 'name': 'RENOVA', 'id': '1388402174'}]",,,,
1188498085917409292,1188482970681774080,2019-10-27 13:49:59 -03,2019-10-27,13:49:59,-0300,1106948692702085127,ademacyaugusto,ademacyaugusto@gmail.com,,"@GleidePortela @PetralhaTimao @olulalibre @fabiagondim @fafarioss @Sil_Mergulhao @769Danilo @kabralcabral @custode_nonato @amaliafina5 com certeza! um líder que NÃO fomentaria as armas , o desmatamento da Amazônia,  NÃO seria contra o trabalhador e as instituições publicas, NÃO seria hipócrita  religioso ,é sincero pot natureza, por isso fora Bozo liberdade para  lula ...",pt,[],[],[],0,1,4,[],[],https://twitter.com/ademacyaugusto/status/1188498085917409292,False,,0,,,,,,,,"[{'screen_name': 'GleidePortela', 'name': 'Ana Rousseff 🇧🇷🚩', 'id': '2927338114'}, {'screen_name': 'PetralhaTimao', 'name': '🚩PÁTRIA LIVRE 🚩 #VoltaPT', 'id': '1170341715124920321'}, {'screen_name': 'fabiagondim', 'name': 'fabia gondim', 'id': '15292786'}, {'screen_name': 'fafarioss', 'name': 'Fátima Rios🏳️\u200d🌈♀️🚩👊', 'id': '1053019045023412224'}, {'screen_name': 'Sil_Mergulhao', 'name': '🚩🚩Silvia Mergulhão Lula Gigante 🇧🇷🇵🇹🇦🇷🇺🇸', 'id': '3178038405'}, {'screen_name': 'kabralcabral', 'name': 'Pateta', 'id': '3398991977'}, {'screen_name': 'custode_nonato', 'name': 'Nonato Custode🚩🇮🇹', 'id': '984925927770648578'}, {'screen_name': 'amaliafina5', 'name': 'Professora Amália', 'id': '721427699676352512'}]",,,,
1188479978586943488,1188479978586943488,2019-10-27 12:38:02 -03,2019-10-27,12:38:02,-0300,1138965305760374784,chicopinto8,Chico Pinto,,"Temos que amazonizar nossa perspectiva. Entender a importância desse lugar para o equilíbrio de todos. Vamos combater fogo com fogo. No lugar do fogo do desmatamento, o fogo que deve queimar na Amazônia é o fogo do Evangelho!  Sínodo da Amazônia  https://t.co/g30tCD5pZv",pt,[],[],['https://pbs.twimg.com/media/EH5UPEPXkAEQ2hf.jpg'],0,1,8,[],[],https://twitter.com/ChicoPinto8/status/1188479978586943488,False,,1,https://pbs.twimg.com/media/EH5UPEPXkAEQ2hf.jpg,,,,,,,[],,,,
1188471521947336704,1188471521947336704,2019-10-27 12:04:26 -03,2019-10-27,12:04:26,-0300,317451756,aguia_newage,Jader Figueiredo,,Impedir o desmatamento e exploração da Amazônia! - Assine a petição!  https://t.co/rxJjMO8X4e via @change_br,pt,"[{'screen_name': 'change_br', 'name': 'change.org brasil #luteemcasa', 'id': '900348469'}]",['http://chng.it/2c4qSFDN'],[],0,0,0,[],[],https://twitter.com/Aguia_NewAge/status/1188471521947336704,False,,0,,,,,,,,[],,,,
1188463595119665152,1188407377256747008,2019-10-27 11:32:56 -03,2019-10-27,11:32:56,-0300,2523587323,vanisebonna,Vanise Bonna,,@UOLNoticias Maior desmatamento registrado na Amazônia foi quando Marina era Monstra do Meio Ambiente.,pt,[],[],[],0,0,0,[],[],https://twitter.com/VaniseBonna/status/1188463595119665152,False,,0,,,,,,,,"[{'screen_name': 'UOLNoticias', 'name': 'UOL Notícias', 'id': '14594698'}]",,,,
