id,conversation_id,created_at,date,time,timezone,user_id,username,name,place,tweet,language,mentions,urls,photos,replies_count,retweets_count,likes_count,hashtags,cashtags,link,retweet,quote_url,video,thumbnail,near,geo,source,user_rt_id,user_rt,retweet_id,reply_to,retweet_date,translate,trans_src,trans_dest
1320882990457782274,1320882990457782274,2020-10-26 21:20:20 -03,2020-10-26,21:20:20,-0300,42332041,zezalulaestrela,Zeza Lula Estrela1⃣3⃣,,"Fiscais acusam militares de atrapalhar combate ao desmatamento na Amazônia  https://t.co/ivfCJcZwIa Desgoverno Bozo @jairbolsonaro não queima apenas a Amazônia, queima também recursos públicos c/militares despreparados e mal intencionados.",pt,"[{'screen_name': 'jairbolsonaro', 'name': 'jair m. bolsonaro', 'id': '128372940'}]",['https://noticias.uol.com.br/meio-ambiente/ultimas-noticias/redacao/2020/06/28/forcas-armadas-gastam-milhoes-atrapalhando-a-fiscalizacao-na-amazonia.htm?cmpid=copiaecola'],[],1,0,0,[],[],https://twitter.com/zezaLulaestrela/status/1320882990457782274,False,,0,,,,,,,,[],,,,
1320878766407569408,1320878766407569408,2020-10-26 21:03:33 -03,2020-10-26,21:03:33,-0300,1183723759,infojurid,Infojurid,,"Fundo Amazônia: especialistas dizem que desmatamento não está associado ao aumento de produtividade: Dando continuidade à audiência pública no âmbito da Ação Direta de Inconstitucionalidade por Omissão (ADO) 59, especialistas em clima,…  https://t.co/8IGN8w43nJ #infojurid #stf",pt,[],['http://dlvr.it/RkPF8G'],[],0,0,0,"['infojurid', 'stf']",[],https://twitter.com/Infojurid/status/1320878766407569408,False,,0,,,,,,,,[],,,,
1320861678771277825,1320518773271613441,2020-10-26 19:55:39 -03,2020-10-26,19:55:39,-0300,1106553008488398848,bianca_blenda,Blenda&Bianca,,"@PaulaoPatriota @VandaPereiraAg3 E ainda diz, na propaganda política,  q SP precisa de áreas  verdes e critica ""desmatamento"" da Amazônia.",pt,[],[],[],1,0,1,[],[],https://twitter.com/bianca_blenda/status/1320861678771277825,False,,0,,,,,,,,"[{'screen_name': 'PaulaoPatriota', 'name': 'Paulão,Homão Dapora🤘🇧🇷', 'id': '1288965755330011136'}, {'screen_name': 'VandaPereiraAg3', 'name': 'Vanda Pereira Aguiar', 'id': '1310259790497689600'}]",,,,
1320860897103859712,1320860897103859712,2020-10-26 19:52:32 -03,2020-10-26,19:52:32,-0300,1183723759,infojurid,Infojurid,,"Institutos avaliam situação fática do desmatamento na Amazônia: No segundo dia da audiência pública sobre o Fundo Amazônia, representantes de institutos ligados ao Meio Ambiente e à Amazônia apresentaram sua visão sobre a situação fática…  https://t.co/2UJTAFgxaw #infojurid #stf",pt,[],['http://dlvr.it/RkP6bf'],[],0,0,0,"['infojurid', 'stf']",[],https://twitter.com/Infojurid/status/1320860897103859712,False,,0,,,,,,,,[],,,,
1320857103922302984,1320733753619173379,2020-10-26 19:37:28 -03,2020-10-26,19:37:28,-0300,1090959127407407104,c4_pr_amorzinho,C4,,@Alb90001 @GamingRoom Aí depois o agronegócio brasileiro precisa abrir a Amazônia por causa dos ETs diminuindo a produção deles e a culpa do desmatamento é do Bolsonaro 🙄,pt,[],[],[],1,0,1,[],[],https://twitter.com/C4_PR_amorzinho/status/1320857103922302984,False,,0,,,,,,,,"[{'screen_name': 'Alb90001', 'name': 'Alberto Balieiro', 'id': '818724978371739648'}, {'screen_name': 'GamingRoom', 'name': 'Facínora', 'id': '96769582'}]",,,,
1320856614124093440,1320856614124093440,2020-10-26 19:35:31 -03,2020-10-26,19:35:31,-0300,20433046,portalamazonia,Portal Amazônia,,'Operação Amazônia Viva 5' fecha propriedade em Moju após flagrante de desmatamento a uma área equivalente a 250 campos de futebol  acesse:  https://t.co/IIGcjx7f3a  #PortalAmazonia #pará  https://t.co/4PMck4ZG0I,pt,[],['https://bit.ly/31KZsoB'],['https://pbs.twimg.com/media/ElSgE_CXIAE3F7h.jpg'],0,0,3,"['portalamazonia', 'pará']",[],https://twitter.com/PortalAmazonia/status/1320856614124093440,False,,1,https://pbs.twimg.com/media/ElSgE_CXIAE3F7h.jpg,,,,,,,[],,,,
1320849919922606081,1320820703843803137,2020-10-26 19:08:55 -03,2020-10-26,19:08:55,-0300,759584072,allustiza,Rita,,@Martinhosv Já arranjaram esse em 2019.   https://t.co/1TAsgztbHb Noruega suspende repasses de R$ 133 milhões para o Fundo Amazônia Recursos seriam usados para proteger a floresta e desenvolver projetos na região. Governo norueguês revelou preocupação com relatos de desmatamento no Brasil.,pt,[],['https://g1.globo.com/jornal-nacional/noticia/2019/08/15/noruega-suspende-repasses-de-r-133-milhoes-para-o-fundo-amazonia.ghtml'],[],1,0,1,[],[],https://twitter.com/allustiza/status/1320849919922606081,False,,0,,,,,,,,"[{'screen_name': 'Martinhosv', 'name': 'sérgio martinho', 'id': '439558146'}]",,,,
1320847330598363136,1320847330598363136,2020-10-26 18:58:38 -03,2020-10-26,18:58:38,-0300,1232723018448850944,realnoticia1820,Real Notícia,,Governo vai prorrogar atuação das Forças Armadas contra desmatamento na Amazônia até abril de 2021  https://t.co/Vk708wWkWl,pt,[],['https://www.realnoticia.com.br/noticia/1188/governo-vai-prorrogar-atuacao-das-forcas-armadas-contra-desmatamento-na-amazonia-ate-abril-de-2021/#.X5dGixa9kUI.twitter'],[],0,0,2,[],[],https://twitter.com/RealNoticia1820/status/1320847330598363136,False,,0,,,,,,,,[],,,,
1320842407882170369,1320842407882170369,2020-10-26 18:39:04 -03,2020-10-26,18:39:04,-0300,45953391,alessandromolon,Alessandro Molon 🇧🇷,,"A política de destruição de Bolsonaro gera prejuízos concretos ao Brasil: o Fundo Amazônia, que tem a Noruega como maior doador, está paralisado. Além disso, investidores fogem e órgãos ambientais são desmontados, gerando mais desmatamento e queimadas.  https://t.co/AC2cOVHpbt",pt,[],['https://valor.globo.com/brasil/noticia/2020/10/26/brasil-precisa-mostrar-que-desmatamento-nao-e-tolerado-diz-noruega.ghtml'],[],3,10,188,[],[],https://twitter.com/alessandromolon/status/1320842407882170369,False,,0,,,,,,,,[],,,,
1320839408824832001,1320839408824832001,2020-10-26 18:27:09 -03,2020-10-26,18:27:09,-0300,80378191,radioagenciaebc,Radioagência Nacional,,#OperacaoVerdeBrasil2 será prorrogada até abril de 2021. Objetivo é completar o ciclo de combate ao desmatamento na Amazônia  https://t.co/Nxk3Xfjvyn   📷 Warley de Andrade/TV Brasil  https://t.co/gcHw7HMFbt,pt,[],['https://bit.ly/3ovYXII'],['https://pbs.twimg.com/media/ElSQZ0AW0AIG2Zd.jpg'],0,1,3,['operacaoverdebrasil2'],[],https://twitter.com/RadioagenciaEBC/status/1320839408824832001,False,,1,https://pbs.twimg.com/media/ElSQZ0AW0AIG2Zd.jpg,,,,,,,[],,,,
1320838839951413254,1320731309011013632,2020-10-26 18:24:54 -03,2020-10-26,18:24:54,-0300,1288311912275607555,politicainteiro,Política Por Inteiro,,"Raoni Rajão, da @ufmg, destaca a importância do PPCDAm (Plano de Ação para Prevenção e Controle do Desmatamento na Amazônia Legal) como uma política de estado, não de governo  https://t.co/JzUUyPERG2",pt,"[{'screen_name': 'ufmg', 'name': 'ufmg', 'id': '54589069'}]",[],['https://pbs.twimg.com/media/ElSPhzCXYAMjXvn.jpg'],1,0,4,[],[],https://twitter.com/PoliticaInteiro/status/1320838839951413254,False,,1,https://pbs.twimg.com/media/ElSPhzCXYAMjXvn.jpg,,,,,,,[],,,,
1320828833428361217,1320828833428361217,2020-10-26 17:45:08 -03,2020-10-26,17:45:08,-0300,1135956493763846147,virtu_news,VirtùNews,,"""Acredito que parar o desmatamento é vital para o desenvolvimento econômico.” Sveinung Rotevatn, maior doador do Fundo da Amazônia no @valoreconomico    https://t.co/2hhMsSSJFI",pt,"[{'screen_name': 'valoreconomico', 'name': 'valor econômico', 'id': '32529120'}]",['https://valor.globo.com/brasil/noticia/2020/10/26/brasil-precisa-mostrar-que-desmatamento-nao-e-tolerado-diz-noruega.ghtml'],[],0,0,0,[],[],https://twitter.com/virtu_news/status/1320828833428361217,False,,0,,,,,,,,[],,,,
1320821165884059654,1320731309011013632,2020-10-26 17:14:40 -03,2020-10-26,17:14:40,-0300,1288311912275607555,politicainteiro,Política Por Inteiro,,"Representando o Grupo de Integração para Proteção da Amazônia, Edileuza de Melo Nogueira mostra classificação de pontos de desmatamento ativos detectados: 91,5% em área pública  https://t.co/ctxJtiaVqo",pt,[],[],['https://pbs.twimg.com/media/ElR_TxgXYAQl50Q.jpg'],1,0,10,[],[],https://twitter.com/PoliticaInteiro/status/1320821165884059654,False,,1,https://pbs.twimg.com/media/ElR_TxgXYAQl50Q.jpg,,,,,,,[],,,,
1320819498702823426,1320788921999998976,2020-10-26 17:08:02 -03,2020-10-26,17:08:02,-0300,1272974487089266688,ogalazed,Dz,,"@gazetadopovo Adaptação não é submissão. Adaptação é adequarmos o crescimento da Amazônia a padrões sustentáveis mas, sobretudo, SOBERANOS. A três décadas a Amazônia vem sendo estuprada por ONG e partidos políticos. NUNCA o desmatamento acabou, nem houve desenvolvimento. Progresso e Ordem. Já!",pt,[],[],[],0,0,0,[],[],https://twitter.com/ogalazed/status/1320819498702823426,False,,0,,,,,,,,"[{'screen_name': 'gazetadopovo', 'name': 'Gazeta do Povo', 'id': '15084884'}]",,,,
1320817919668924417,1320817919668924417,2020-10-26 17:01:46 -03,2020-10-26,17:01:46,-0300,47754867,congressoemfoco,Congresso em Foco,,"A manutenção de militares na #Amazônia visa auxiliar os órgãos ambientais a combater delitos ambientais, em especial desmatamento ilegal e focos de incêndio.  https://t.co/eGFtlI4vLO",pt,[],['https://bit.ly/3jueaWT'],[],2,2,2,['amazônia'],[],https://twitter.com/congressoemfoco/status/1320817919668924417,False,,0,,,,,,,,[],,,,
1320817323385737222,1320817323385737222,2020-10-26 16:59:24 -03,2020-10-26,16:59:24,-0300,1243714947525357571,gledsonlopess1,Gledson.lopess,,"A discursão sobre a vacina é desnecessária, é uma grande cortina de fumaça para: propina na bunda, Queiroz, 89mil na conta de micheque, desmatamento e incêndio no Pantanal e Amazônia",pt,[],[],[],0,0,0,[],[],https://twitter.com/gledsonlopess1/status/1320817323385737222,False,,0,,,,,,,,[],,,,
1320814846510878720,1320814846510878720,2020-10-26 16:49:33 -03,2020-10-26,16:49:33,-0300,931198298932858881,obind_unb,Observatório dos Direitos e Políticas Indigenistas,,"AMAZÔNIA NOTÍCIA E INFORMAÇÃO: Contra desmatamento, invasões e paralisação nas demarcações, candidaturas indígenas crescem 28%  https://t.co/dKsFj3jqsM",pt,[],['http://obind.eco.br/2020/10/25/amazonia-noticia-e-informacao-contra-desmatamento-invasoes-e-paralisacao-nas-demarcacoes-candidaturas-indigenas-crescem-28/'],[],0,0,1,[],[],https://twitter.com/OBIND_UnB/status/1320814846510878720,False,,0,,,,,,,,[],,,,
1320814841418887168,1320814841418887168,2020-10-26 16:49:32 -03,2020-10-26,16:49:32,-0300,575713446,marcelozelic,Marcelo Zelic,,"AMAZÔNIA NOTÍCIA E INFORMAÇÃO: Contra desmatamento, invasões e paralisação nas demarcações, candidaturas indígenas crescem 28%  https://t.co/pKG1zLrFRv",pt,[],['http://obind.eco.br/2020/10/25/amazonia-noticia-e-informacao-contra-desmatamento-invasoes-e-paralisacao-nas-demarcacoes-candidaturas-indigenas-crescem-28/'],[],0,0,0,[],[],https://twitter.com/MarceloZelic/status/1320814841418887168,False,,0,,,,,,,,[],,,,
1320808644435476480,1320731309011013632,2020-10-26 16:24:54 -03,2020-10-26,16:24:54,-0300,1288311912275607555,politicainteiro,Política Por Inteiro,,"Ainda na exposição do @Ascom_Inpa , o pesquisador Paulo Maurício Lima de Alencastro Graça mostrou novamente dados de desmatamento nas diferentes fases do PPCDAm. Esse aumento é algo que deve ser esclarecido pelos órgãos de comando e controle do desmatamento na Amazônia, disse  https://t.co/ib6Snp2BEY",pt,"[{'screen_name': 'ascom_inpa', 'name': 'ascom do inpa', 'id': '71283780'}]",[],"['https://pbs.twimg.com/media/ElRzp5wXgAsixSA.jpg', 'https://pbs.twimg.com/media/ElRzqlPXYAACvXG.jpg']",2,0,6,[],[],https://twitter.com/PoliticaInteiro/status/1320808644435476480,False,,1,https://pbs.twimg.com/media/ElRzp5wXgAsixSA.jpg,,,,,,,[],,,,
1320803930511724545,1320803930511724545,2020-10-26 16:06:11 -03,2020-10-26,16:06:11,-0300,34304424,marcelinharosa,Marcela Rosa,,"A Operação Verde Brasil 2, realizada pelo Ministério da Defesa para combater o desmatamento ilegal na Amazônia, vai ser prorrogada até abril do ano que vem, anunciou o vice-presidente Hamilton Mourão.  ##mourao #Amazônia #operacaoverdebrasil2  https://t.co/WxH0wLSGBk  https://t.co/jXzyFxi0Rz",pt,[],['https://bit.ly/3mtO9Zx'],['https://pbs.twimg.com/media/ElRwLNZXUAYIXGa.jpg'],0,0,0,"['mourao', 'amazônia', 'operacaoverdebrasil2']",[],https://twitter.com/marcelinharosa/status/1320803930511724545,False,,1,https://pbs.twimg.com/media/ElRwLNZXUAYIXGa.jpg,,,,,,,[],,,,
1320796555721453568,1320796396174397447,2020-10-26 15:36:52 -03,2020-10-26,15:36:52,-0300,3589345337,vanecosta10,A Eng. Florestal do YouTube 🌳,,"De 2008 até 2019, a Noruega contribuiu com 90% dos recursos para o Fundo da Amazônia, utilizado para combater o desmatamento no Brasil. Mas o país europeu se desentendeu com o governo do presidente Jair Bolsonaro (sem partido) no ano passado e parou de repassar os valores.",pt,[],[],[],1,0,18,[],[],https://twitter.com/vanecosta10/status/1320796555721453568,False,,0,,,,,,,,[],,,,
1320796352302010368,1319682879459381263,2020-10-26 15:36:04 -03,2020-10-26,15:36:04,-0300,68313718,stf_oficial,STF,,"Em seguida, Dr. Carlos Souza Junior, Pesquisador Sênior do @Imazon - Instituto do Homem e do Meio Ambiente da Amazônia apresenta o que as imagens de satélite revelam sobre o desmatamento da Amazônia.",pt,"[{'screen_name': 'imazon', 'name': 'imazon', 'id': '74842999'}]",[],[],7,2,15,[],[],https://twitter.com/STF_oficial/status/1320796352302010368,False,,0,,,,,,,,[],,,,
1320791322039668741,1319682879459381263,2020-10-26 15:16:04 -03,2020-10-26,15:16:04,-0300,68313718,stf_oficial,STF,,"Dr. Paulo Moutinho, Cientista Sênior e co-fundador do @IPAM_Amazonia, fala agora sobre a importância e papel do #FundoAmazônia e de como a mudança climática e o desmatamento tornam a Amazônia mais quente e mais inflamável. Ao vivo👉 https://t.co/eZnO78Lng2",pt,"[{'screen_name': 'ipam_amazonia', 'name': 'ipam_amazônia', 'id': '67302940'}]",['https://www.youtube.com/watch?v=fRz9oIAYLpg'],[],7,0,5,['fundoamazônia'],[],https://twitter.com/STF_oficial/status/1320791322039668741,False,,0,,,,,,,,[],,,,
1320790927842123776,1320731309011013632,2020-10-26 15:14:30 -03,2020-10-26,15:14:30,-0300,1288311912275607555,politicainteiro,Política Por Inteiro,,"O cientista do @IPAM_Amazonia também mostrou como cresceu – e muito – a produção de carne e soja entre 2009 e 2018 na Amazônia, sem aumento de índices de desmatamento. Ou seja, preservação ambiental e agronegócios não são opostos  https://t.co/yWsgLURf55",pt,"[{'screen_name': 'ipam_amazonia', 'name': 'ipam_amazônia', 'id': '67302940'}]",[],['https://pbs.twimg.com/media/ElRi5uvX0AEeN69.jpg'],0,0,4,[],[],https://twitter.com/PoliticaInteiro/status/1320790927842123776,False,,1,https://pbs.twimg.com/media/ElRi5uvX0AEeN69.jpg,,,,,,,[],,,,
1320790112574361602,1320790112574361602,2020-10-26 15:11:16 -03,2020-10-26,15:11:16,-0300,73024459,caiosborges,Caio Borges 🌵 包凯越,,"Qual a relação entre desmatamento, incêndios e pobreza na Amazônia? Paulo Moutinho, do @IPAM_Amazonia, desenhou para o @STF_oficial. Uma aula sobre a dinâmica da ilegalidade na região amazônica e seus efeitos negativos para o meio ambiente e a sociedade.  https://t.co/TR9Q1nNGb0",pt,"[{'screen_name': 'ipam_amazonia', 'name': 'ipam_amazônia', 'id': '67302940'}, {'screen_name': 'stf_oficial', 'name': 'stf', 'id': '68313718'}]",[],['https://pbs.twimg.com/media/ElRjm3FXEAEA750.jpg'],0,1,9,[],[],https://twitter.com/caiosborges/status/1320790112574361602,False,,1,https://pbs.twimg.com/media/ElRjm3FXEAEA750.jpg,,,,,,,[],,,,
1320789211155488769,1320731309011013632,2020-10-26 15:07:41 -03,2020-10-26,15:07:41,-0300,1288311912275607555,politicainteiro,Política Por Inteiro,,"Neste momento, Paulo Moutinho, cientista sênior e co-fundador do @IPAM_Amazonia. Ele mostra o aumento do desmatamento na Amazônia em 2019. E destaca o desmatamento em alta em áreas públicas. Ou seja ""de todos os brasileiros""  https://t.co/yiCeldjsvI",pt,"[{'screen_name': 'ipam_amazonia', 'name': 'ipam_amazônia', 'id': '67302940'}]",[],['https://pbs.twimg.com/media/ElRipG2XEAAyoTn.jpg'],2,1,9,[],[],https://twitter.com/PoliticaInteiro/status/1320789211155488769,False,,1,https://pbs.twimg.com/media/ElRipG2XEAAyoTn.jpg,,,,,,,[],,,,
1320787910459904001,1320774692895137795,2020-10-26 15:02:31 -03,2020-10-26,15:02:31,-0300,1296147777567809537,jorgeluizfortu9,JorgeMiranda,,@DiarioPE Mais uma balela essa Operação Verde Brasil 2 para despistar o investidor estrangeiro que foge de investir no Brasil por causa do desmatamento da Amazonia como o diabo foge da cruz. Não vai convencer aos estrangeiros. Convence a brasileiros mal informados.,pt,[],[],[],0,0,1,[],[],https://twitter.com/JorgeLuizFortu9/status/1320787910459904001,False,,0,,,,,,,,"[{'screen_name': 'DiarioPE', 'name': 'Diario de Pernambuco', 'id': '24237705'}]",,,,
1320787276868186112,1320787276868186112,2020-10-26 15:00:00 -03,2020-10-26,15:00:00,-0300,1312880599070314502,infovegbr,Infovegbr,,O que criadores de gado e frigoríficos fazem para evitar o desmatamento na Amazônia  https://t.co/eXEiyreidV  https://t.co/LY3wyS83z8,pt,[],['https://bit.ly/3orY7fW'],['https://pbs.twimg.com/media/ElRcR4-X0AU8OBd.png'],0,0,0,[],[],https://twitter.com/infovegbr/status/1320787276868186112,False,,1,https://pbs.twimg.com/media/ElRcR4-X0AU8OBd.png,,,,,,,[],,,,
1320785197701410818,1320731309011013632,2020-10-26 14:51:44 -03,2020-10-26,14:51:44,-0300,1288311912275607555,politicainteiro,Política Por Inteiro,,"Claudio Almeida do @INPE enfatiza a transparência do sistema PRODES e o aprimoramento do DETER, em relação ao monitoramento do desmatamento.  👁️ Vale lembrar que os dados de desmatamento monitorados pelo INPE são a base do mecanismo de pagamento por resultados do Fundo Amazônia.",pt,"[{'screen_name': 'inpe', 'name': 'indi persson', 'id': '49974679'}]",[],[],1,2,8,[],[],https://twitter.com/PoliticaInteiro/status/1320785197701410818,False,,0,,,,,,,,[],,,,
1320784972987379712,1319682879459381263,2020-10-26 14:50:51 -03,2020-10-26,14:50:51,-0300,68313718,stf_oficial,STF,,"Agora o Coordenador do Programa de Monitoramento de Biomas do @inpe_mct , Dr. Cláudio Aparecido de Almeida, apresenta os Sistemas de Monitoramento do Instituto, e qual a situação do desmatamento da Amazônia medido a partir destes sistemas",pt,"[{'screen_name': 'inpe_mct', 'name': 'inpe', 'id': '308605432'}]",[],[],9,2,9,[],[],https://twitter.com/STF_oficial/status/1320784972987379712,False,,0,,,,,,,,[],,,,
1320784967404789762,1320784967404789762,2020-10-26 14:50:49 -03,2020-10-26,14:50:49,-0300,34271853,cartamaior,Carta Maior,,"Mourão anunciou hoje (26) que a Operação Verde Brasil 2 para o combate ao desmatamento ilegal na Amazônia, iniciada em maio e com duração prevista até novembro, será prorrogada até abril/2021. A razão é a demora do governo na liberação dos recursos do Orçamento destinados a ela.",pt,[],[],[],1,2,8,[],[],https://twitter.com/cartamaior/status/1320784967404789762,False,,0,,,,,,,,[],,,,
1320783979369345025,1320783979369345025,2020-10-26 14:46:54 -03,2020-10-26,14:46:54,-0300,73024459,caiosborges,Caio Borges 🌵 包凯越,,"Acontecendo agora a audiência pública no STF sobre o Fundo Amazônia. A apresentação do Inpe mostra o pioneirismo, a efetividade e a integridade do sistema público brasileiro de monitoramento do desmatamento por satélite. Deslegitimar o sistema é atacar a soberania do país.",pt,[],[],[],1,1,16,[],[],https://twitter.com/caiosborges/status/1320783979369345025,False,,0,,,,,,,,[],,,,
1320779101574254592,1320779101574254592,2020-10-26 14:27:31 -03,2020-10-26,14:27:31,-0300,56151491,jrcristyear,cristiano,,"Quando o governo @jairbolsonaro vai entender que sem Amazônia não tem futuro, nem desenvolvimento? Com sua política antiambiental, presidente, o desmatamento e queimadas batem recordes e a imagem do país queima junto #TodosPelaAmazônia  https://t.co/QH2kLVsXMa",pt,"[{'screen_name': 'jairbolsonaro', 'name': 'jair m. bolsonaro', 'id': '128372940'}]",['https://act.gp/2Dvr6wJ'],[],0,0,1,['todospelaamazônia'],[],https://twitter.com/jrcristyear/status/1320779101574254592,False,,0,,,,,,,,[],,,,
1320777411202551808,1320777411202551808,2020-10-26 14:20:48 -03,2020-10-26,14:20:48,-0300,67150902,correio,Correio Braziliense,,"Operação Verde Brasil 2 continua até abril de 2021, avisa Mourão.  Por baixa execução orçamentária, operação contra desmatamento na Amazônia é prorrogada.  https://t.co/0o10tNFU32  https://t.co/821Uo4l89k",pt,[],['https://bit.ly/3dZfLmp'],['https://pbs.twimg.com/media/ElRYCUHWkAE6uu-.jpg'],0,1,4,[],[],https://twitter.com/correio/status/1320777411202551808,False,,1,https://pbs.twimg.com/media/ElRYCUHWkAE6uu-.jpg,,,,,,,[],,,,
1320776389319155715,1320776389319155715,2020-10-26 14:16:44 -03,2020-10-26,14:16:44,-0300,1070270400662265856,rajaophd,Raoni Rajão 🇧🇷,,Já começou o 2o dia da audiência do STF sobre o Fundo Amazônia.   Vamos apresentar às 18h a situação fática sobre a construção e desmonte das políticas de controle do desmatamento na Amazônia. @ufmg @csr_ufmg    https://t.co/RNbWpVWnik   https://t.co/UVf6ZTvoZa,pt,"[{'screen_name': 'ufmg', 'name': 'ufmg', 'id': '54589069'}, {'screen_name': 'csr_ufmg', 'name': 'centro de sensoriamento remoto', 'id': '1305592820737208331'}]","['http://www.stf.jus.br/arquivo/cms/noticiaNoticiaStf/anexo/ADO59palestrantesatualizado.pdf', 'https://www.youtube.com/watch?v=fRz9oIAYLpg']",[],1,5,38,[],[],https://twitter.com/RajaoPhD/status/1320776389319155715,False,,0,,,,,,,,[],,,,
1320775154763485188,1320768398024941570,2020-10-26 14:11:50 -03,2020-10-26,14:11:50,-0300,48798539,bentir,Marcos Bento,,"@mvsmonteiro @obernardesjr É difícil comparar desmatamento no Paraguai e no Brasil, o chaco não tem 10 %do estoque que uma a amazônia por unidade de área.",pt,[],[],[],0,0,1,[],[],https://twitter.com/bentir/status/1320775154763485188,False,,0,,,,,,,,"[{'screen_name': 'mvsmonteiro', 'name': 'Marcos Monteiro', 'id': '47591084'}, {'screen_name': 'obernardesjr', 'name': 'Osmar Bernardes Jr.', 'id': '17929500'}]",,,,
1320774692895137795,1320774692895137795,2020-10-26 14:10:00 -03,2020-10-26,14:10:00,-0300,24237705,diariope,Diario de Pernambuco,,"Operação Verde Brasil 2, planejada para combater o desmatamento ilegal na Amazônia, continua até abril de 2021, avisa Mourão  https://t.co/s8QicTTJPn  https://t.co/glmuOREGJb",pt,[],['https://bit.ly/3mimJG2'],['https://pbs.twimg.com/media/ElRTliAXEAEFGZ2.jpg'],2,0,11,[],[],https://twitter.com/DiarioPE/status/1320774692895137795,False,,1,https://pbs.twimg.com/media/ElRTliAXEAEFGZ2.jpg,,,,,,,[],,,,
1320773641517367297,1320773641517367297,2020-10-26 14:05:49 -03,2020-10-26,14:05:49,-0300,1247224536724103168,gazetasp_,Gazeta de S.Paulo,,"Operação Verde Brasil 2, realizada para combater o desmatamento ilegal e focos de incêndio na Amazônia, deve ser ser prorrogada até abril de 2021.  Leia a matéria completa ⬇  https://t.co/TA5Ky4hLuY",pt,[],['https://www.gazetasp.com.br/brasil/2020/10/1078435-mourao-diz-que-operacao-militar-na-amazonia-sera-prorrogada-ate-abril.html'],[],0,0,0,[],[],https://twitter.com/gazetasp_/status/1320773641517367297,False,,0,,,,,,,,[],,,,
1320772145501319174,1320772145501319174,2020-10-26 13:59:52 -03,2020-10-26,13:59:52,-0300,1164946894327558144,cleidevon,🍀Cleide von Wald🍀,,"💚 PRESENÇA DE MILITARES NA AMAZÔNIA SERÁ PRORROGADA ATÉ ABRIL, DIZ MOURÃO  Operação Verde Brasil visa combater desmatamento ilegal e focos de incêndio na região e tem previsão de acabar em 6 de novembro. Segundo Mourão, há recursos para nova prorrogação. #Mourãoodonodaporratoda",pt,[],[],[],0,0,0,['mourãoodonodaporratoda'],[],https://twitter.com/CleideVon/status/1320772145501319174,False,https://twitter.com/Metropoles/status/1320749530178990082,0,,,,,,,,[],,,,
1320769220699955201,1320769220699955201,2020-10-26 13:48:15 -03,2020-10-26,13:48:15,-0300,4633295777,antena1rio,Antena 1 Rio,,O governo federal vai prorrogar a presença das Forças Armadas na Amazônia Legal até abril de 2021. O anúncio foi feito hoje pelo vice-presidente Hamilton Mourão. A operação dos militares é direcionada ao combate do desmatamento ilegal e a focos de incêndio.  https://t.co/vs7MIy70R3,pt,[],[],['https://pbs.twimg.com/media/ElRQT4SW0AAH9x6.png'],1,0,0,[],[],https://twitter.com/Antena1Rio/status/1320769220699955201,False,,1,https://pbs.twimg.com/media/ElRQT4SW0AAH9x6.png,,,,,,,[],,,,
1320765896399462404,1320765896399462404,2020-10-26 13:35:03 -03,2020-10-26,13:35:03,-0300,138492825,proindio,Comissão Pró-Índio,,"Enquanto o governo Bolsonaro alega não ter dinheiro para combater a explosão do desmatamento e das queimadas, cerca de R$ 3 bilhões estão parados no Fundo Amazônia. Via @socioambiental  https://t.co/Oiys8A4bvf",pt,"[{'screen_name': 'socioambiental', 'name': 'socioambiental', 'id': '17871562'}]",['https://www.socioambiental.org/pt-br/noticias-socioambientais/dinheiro-paralisado-por-governo-bolsonaro-no-fundo-amazonia-chega-a-quase-r-3-bilhoes'],[],0,5,8,[],[],https://twitter.com/proindio/status/1320765896399462404,False,,0,,,,,,,,[],,,,
1320761859558019074,1320761859558019074,2020-10-26 13:19:00 -03,2020-10-26,13:19:00,-0300,996116239289405443,rdctvdigital,RDC TV,,Operação Verde Brasil 2 será prorrogada para abril de 2021. Ação combate o desmatamento ilegal na Amazônia. Anúncio foi feito pelo vice-presidente Hamilton Mourão. #rdctv,pt,[],[],[],0,0,0,['rdctv'],[],https://twitter.com/RDCTVdigital/status/1320761859558019074,False,,0,,,,,,,,[],,,,
