id,conversation_id,created_at,date,time,timezone,user_id,username,name,place,tweet,language,mentions,urls,photos,replies_count,retweets_count,likes_count,hashtags,cashtags,link,retweet,quote_url,video,thumbnail,near,geo,source,user_rt_id,user_rt,retweet_id,reply_to,retweet_date,translate,trans_src,trans_dest
1423131273309077508,1422546040016674819,2021-08-05 00:58:30 SA Eastern Standard Time,2021-08-05,00:58:30,-0300,109435923,lipedans,Felipe Dantas,,@RayaraFenty @Cheirasal @china_comunista Isso permite ao Inpe botar mais um satélite no espaço pra monitorar as queimadas da Amazônia ou lançar um satélite meteorológico e torna seus dados móveis mais baratos pq a Tim não vão pagar tanto pelo satélite que te permite estar agora no twitter falando sobre o que não sabe kk,pt,[],[],[],1,0,9,[],[],https://twitter.com/lipedans/status/1423131273309077508,False,,0,,,,,,,,"[{'screen_name': 'RayaraFenty', 'name': '𝒓𝒂𝒚𝒂𝒓𝒂 🏳️\u200d🌈', 'id': '4899440171'}, {'screen_name': 'Cheirasal', 'name': 'Nego Jhonson🤡🔪', 'id': '1268157358347296770'}, {'screen_name': 'china_comunista', 'name': 'China completou sua transição para o comunismo hj?', 'id': '1268626122968838147'}]",,,,
1423097848384663553,1423097848384663553,2021-08-04 22:45:41 SA Eastern Standard Time,2021-08-04,22:45:41,-0300,799278146134609920,ricardogja2020,Ricardo araujo,,"Amanhã voltam as queimadas  na Amazônia.....kkkkkkk Canalhas, ainda quero ver , Deus me ajude, um por um já cadeia, com tudo que foi desviado confiscado... é um sonho, mas eu acredito. Acabou porra..  #CPIdoTSE",pt,[],[],[],0,0,0,['cpidotse'],[],https://twitter.com/Ricardogja2020/status/1423097848384663553,False,,0,,,,,,,,[],,,,
1423065881031192578,1423065881031192578,2021-08-04 20:38:39 SA Eastern Standard Time,2021-08-04,20:38:39,-0300,136061788,mgbianconi,Bianconi,,"Acho melhor @CNNBrasil @tvglobo @g1 @folha e outras merdas da midia se fingir de tontos hj e começar o mimimi de queimadas na Amazônia, Datafolha e pesquisas, covid, olimpiada e etc...",pt,"[{'screen_name': 'cnnbrasil', 'name': 'cnn brasil', 'id': '809124436880322561'}, {'screen_name': 'tvglobo', 'name': 'tv globo em 🏠', 'id': '18219976'}, {'screen_name': 'g1', 'name': 'g1', 'id': '8802752'}, {'screen_name': 'folha', 'name': 'folha de s.paulo', 'id': '14594813'}]",[],[],0,0,1,[],[],https://twitter.com/mgbianconi/status/1423065881031192578,False,https://twitter.com/taoquei1/status/1423064061827293190,0,,,,,,,,[],,,,
1423049744394424324,1422712640963493892,2021-08-04 19:34:32 SA Eastern Standard Time,2021-08-04,19:34:32,-0300,1311367226151366658,leandro30444529,Leandro Fernandes do Rego,,"@andrearoeirap Primeiro que no Brasjl no teve ditadura, teve militarismo e hoje não se tem mais queimadas, desmatamento do que em anos anteriores. Já tivemos tempos piores, até vender a Amazônia já tentaram e ninguém nada falava, mas hoje como #amamataacabou estão desesperados noticiando fakes.",pt,[],[],[],0,0,0,['amamataacabou'],[],https://twitter.com/Leandro30444529/status/1423049744394424324,False,,0,,,,,,,,"[{'screen_name': 'andrearoeirap', 'name': 'Aroeira 🌿 #MarcoTemporalNão', 'id': '875485027177553921'}]",,,,
1423041055629275138,1423041055629275138,2021-08-04 19:00:01 SA Eastern Standard Time,2021-08-04,19:00:01,-0300,1312880599070314502,infovegbr,Infovegbr,,Amazônia registra quase 5 mil focos de queimadas em julho mesmo com decreto que proíbe o uso do fogo; veja imagens  https://t.co/SMmMuSwKnl  https://t.co/CjA7pU6oJr,pt,[],['https://glo.bo/37napih'],['https://pbs.twimg.com/media/E7-cHM4XIAQ2bzG.png'],0,0,0,[],[],https://twitter.com/infovegbr/status/1423041055629275138,False,,1,https://pbs.twimg.com/media/E7-cHM4XIAQ2bzG.png,,,,,,,[],,,,
1423035074736492544,1423035074736492544,2021-08-04 18:36:15 SA Eastern Standard Time,2021-08-04,18:36:15,-0300,125755610,rodrigomu3,rodrigo mu 🏠,,Existe relação entre as queimadas da Amazônia e a neve em Gramado?,pt,[],[],[],0,0,0,[],[],https://twitter.com/rodrigomu3/status/1423035074736492544,False,,0,,,,,,,,[],,,,
1423028582767542276,1423011385592721411,2021-08-04 18:10:27 SA Eastern Standard Time,2021-08-04,18:10:27,-0300,1407660918452928517,excelsiortzx,Excelsior! #Nando3k,,@tamakkj Tamak™_r3bol4ndo_pelas_queimadas_da_Amazônia.mp4,pt,[],[],[],0,0,0,[],[],https://twitter.com/ExcelsiorTzx/status/1423028582767542276,False,,0,,,,,,,,[],,,,
1423019103149772805,1423019103149772805,2021-08-04 17:32:47 SA Eastern Standard Time,2021-08-04,17:32:47,-0300,1164894164028416006,lolo_re,lolo fuzil 🐍,,"Nossa toda vez que eu vejo alguma reportagem falando das queimadas da Amazônia, de quantos hectares de mata que perdemos e de quantos animais que morreram me dói mto sempre choro",pt,[],[],[],0,0,0,[],[],https://twitter.com/lolo_re/status/1423019103149772805,False,,0,,,,,,,,[],,,,
1423017744669229058,1423017744669229058,2021-08-04 17:27:23 SA Eastern Standard Time,2021-08-04,17:27:23,-0300,713037612420841476,adtamazonia,Amigos da Terra - Amazônia Brasileira,,Tem episódio novo do Papo de Floresta! Entrevistamos Maria Josefa Machado Neves sobre como as queimadas impactam a vida dos pequenos produtores rurais da Amazônia. Ouça:  https://t.co/GWkUzcgFWZ  https://t.co/VTYD2cuNUB,pt,[],['https://bit.ly/PapodeFloresta'],['https://pbs.twimg.com/media/E7-S1FTXsAc5UjF.jpg'],1,0,0,[],[],https://twitter.com/adtamazonia/status/1423017744669229058,False,,1,https://pbs.twimg.com/media/E7-S1FTXsAc5UjF.jpg,,,,,,,[],,,,
1422972533184290817,1422854712093814786,2021-08-04 14:27:44 SA Eastern Standard Time,2021-08-04,14:27:44,-0300,1008858086092804096,thiago_ss4f,Vascaíno💢 #Tokyo2020 🇧🇷🇧🇷🇧🇷,,"@Advogada18 Olha, existem órgãos especificamente criados para cuidarem dessa questão de queimadas na Amazônia, as faa não podem simplesmente pegar e sair por aí fazendo o trabalho desses órgãos, eles precisam ser acionados  pelo Governo",pt,[],[],[],2,0,5,[],[],https://twitter.com/thiago_ss4f/status/1422972533184290817,False,,0,,,,,,,,"[{'screen_name': 'Advogada18', 'name': 'Trabalhadora Pobre', 'id': '1383061656897523715'}]",,,,
1422954262020120579,1422954262020120579,2021-08-04 13:15:07 SA Eastern Standard Time,2021-08-04,13:15:07,-0300,44446850,acritica,A Crítica,,"QUEIMADAS❗ A pesquisa analisou dados de uma área no sul da Amazônia durante a temporada de incêndios de 2019, entre julho e outubro #CompartilheACrítica  https://t.co/AnIZ2m9f61",pt,[],['https://bit.ly/3inz1xT'],[],0,0,4,['compartilheacrítica'],[],https://twitter.com/ACritica/status/1422954262020120579,False,,0,,,,,,,,[],,,,
1422939501714886662,1421894049980637197,2021-08-04 12:16:28 SA Eastern Standard Time,2021-08-04,12:16:28,-0300,1176803554499145728,pedro33271443,Pedro,,@GeneralMourao @funaioficial E lá vem ele com suas mentiras sobre as queimadas na Amazônia!,pt,[],[],[],0,0,0,[],[],https://twitter.com/Pedro33271443/status/1422939501714886662,False,,0,,,,,,,,"[{'screen_name': 'GeneralMourao', 'name': 'General Hamilton Mourão', 'id': '1058819604741525510'}, {'screen_name': 'funaioficial', 'name': 'Funai', 'id': '3335509756'}]",,,,
1422935366181416964,1422935366181416964,2021-08-04 12:00:02 SA Eastern Standard Time,2021-08-04,12:00:02,-0300,1149680282984964096,pv43capital,PV São Paulo,,INPE: queimadas crescem 116% na Amazônia em julho.   https://t.co/JWYucRAmw4  @veramagalhaes @EduardoJorge @obsclima @partidoverde @ClimaInfoNews @BlogLorenzetti @mbrusadin @rogerio_menezes @fabio_feldmann @XexeuTripoli,pt,"[{'screen_name': 'veramagalhaes', 'name': 'vera magalhães vacina sim💉', 'id': '19667016'}, {'screen_name': 'eduardojorge', 'name': 'eduardo jorge', 'id': '2401640120'}, {'screen_name': 'obsclima', 'name': 'observatório do clima, 19 anos', 'id': '36336107'}, {'screen_name': 'partidoverde', 'name': 'partido verde', 'id': '27736576'}, {'screen_name': 'climainfonews', 'name': 'climainfo', 'id': '74715478'}, {'screen_name': 'mbrusadin', 'name': 'maurício brusadin', 'id': '38728575'}, {'screen_name': 'rogerio_menezes', 'name': 'rogério menezes', 'id': '57687386'}, {'screen_name': 'fabio_feldmann', 'name': 'fabio feldmann', 'id': '87980454'}, {'screen_name': 'xexeutripoli', 'name': 'xexéu tripoli', 'id': '1113201036209078273'}]",['https://bit.ly/3rQLDRg'],[],0,0,0,[],[],https://twitter.com/pv43capital/status/1422935366181416964,False,,0,,,,,,,,[],,,,
1422935356685488130,1422935356685488130,2021-08-04 12:00:00 SA Eastern Standard Time,2021-08-04,12:00:00,-0300,74715478,climainfonews,ClimaInfo,,"A Amazônia registrou quase 5 mil focos de incêndio no último mês. Foram identificados 4.977 focos de calor na região em julho passado, um aumento de 116% na comparação com o número de queimadas registradas no mês anterior. É preciso AGIR!  https://t.co/0wnj0ndvo6",pt,[],['https://climainfo.org.br/2021/08/04/inpe-queimadas-crescem-116-na-amazonia-em-julho/'],[],0,5,13,[],[],https://twitter.com/ClimaInfoNews/status/1422935356685488130,False,,0,,,,,,,,[],,,,
1422935112384139269,1422935112384139269,2021-08-04 11:59:02 SA Eastern Standard Time,2021-08-04,11:59:02,-0300,116764799,tom_bike,Tom Bike,,"Plumas de fumaça de queimadas ilegais voltam a dominar os céus da Amazônia.  Nuvens em branco, fumaça em branco azulado. Floresta em verde, desmatamento em marrom.  Imagem Terra de hoje 2021-08-04 14:20:22 UTC.  #queimadas #Amazônia #desmatamento  https://t.co/dm9Zbx862i",pt,[],[],['https://pbs.twimg.com/media/E79HuOdXIBAhqIE.jpg'],1,0,5,"['queimadas', 'amazônia', 'desmatamento']",[],https://twitter.com/tom_bike/status/1422935112384139269,False,,1,https://pbs.twimg.com/media/E79HuOdXIBAhqIE.jpg,,,,,,,[],,,,
1422932258856439817,1422911149989838848,2021-08-04 11:47:41 SA Eastern Standard Time,2021-08-04,11:47:41,-0300,66869180,marcocanellas,Marco Canellas,,"@republica_ctba Ligou a metralhadora giratória, está atirando para todos os lados para ver se acerta algum. Segundo ele vai haver derramando de petróleo em larga escala, queimadas devastando a Amazônia, aumento do buraco da camada de ozônio, desaparecimento da esquerda no Brasil etc.",pt,[],[],[],0,0,1,[],[],https://twitter.com/marcocanellas/status/1422932258856439817,False,,0,,,,,,,,"[{'screen_name': 'republica_ctba', 'name': 'Republica de Curitiba', 'id': '945809862390370304'}]",,,,
1422921122996162567,1422921122996162567,2021-08-04 11:03:26 SA Eastern Standard Time,2021-08-04,11:03:26,-0300,1054687223239581696,carlaoreaca,🇧🇷Carlão Reaça,,"O maior cemitério de pneus do mundo no Kuwait em chamas. E estão se preocupando com efeito estufa, queimadas na Amazônia. Tá SERTIINHU  https://t.co/1wGRmZqF4M",pt,[],[],[],0,1,3,[],[],https://twitter.com/CarlaoReaca/status/1422921122996162567,False,,1,https://pbs.twimg.com/ext_tw_video_thumb/1422919793166979081/pu/img/VMvOEJn_ZNK9Eph_.jpg,,,,,,,[],,,,
1422912763316342785,1422912763316342785,2021-08-04 10:30:13 SA Eastern Standard Time,2021-08-04,10:30:13,-0300,127578048,cbnvale,CBN Vale do Paraíba,,"Inpe: mesmo com decreto proibindo uso do fogo, Amazônia registra quase 5 mil focos de queimadas em Julho  https://t.co/ynOPvXxYN7",pt,[],['https://www.cbnvale.com.br/inpe-mesmo-com-decreto-proibindo-uso-do-fogo-amazonia-registra-quase-5-mil-focos-de-queimadas-em-julho/'],[],0,0,0,[],[],https://twitter.com/CbnVale/status/1422912763316342785,False,,0,,,,,,,,[],,,,
1422911207925862408,1422911207925862408,2021-08-04 10:24:03 SA Eastern Standard Time,2021-08-04,10:24:03,-0300,53243190,adbrasil,Assembleia de Deus,,"🔥 Por que a #Caatinga vive explosão em número de queimadas   Nem Amazônia, nem Pantanal, nem Cerrado: o bioma brasileiro com maior crescimento no número de queimadas em 2021 até agora é a Caatinga  https://t.co/5iBW9T87eG",pt,[],['http://bbc.in/3A8CUfU'],[],0,0,6,['caatinga'],[],https://twitter.com/adbrasil/status/1422911207925862408,False,,0,,,,,,,,[],,,,
1422907393621565440,1422596131570257920,2021-08-04 10:08:53 SA Eastern Standard Time,2021-08-04,10:08:53,-0300,2165445359,alepeix,ALE,,@Pagliaccada @memeinteligente Queimadas na Amazônia - Bolsonaro - Queimada no oceano das algas   kkkkkkk humor e piadas,pt,[],[],[],0,0,0,[],[],https://twitter.com/AlePeix/status/1422907393621565440,False,,0,,,,,,,,"[{'screen_name': 'Pagliaccada', 'name': 'Mundinho amor Pagliacci', 'id': '1190790042874253318'}, {'screen_name': 'memeinteligente', 'name': 'memes inteligentes', 'id': '1173429292677685248'}]",,,,
1422893541311852551,1422893541311852551,2021-08-04 09:13:50 SA Eastern Standard Time,2021-08-04,09:13:50,-0300,34629513,zazas_,José  Mendes,,Mourão comemora queda de queimadas na Amazônia em 2021: “Luta diária”  https://t.co/h1JE27LyEh  https://t.co/WrlKAHtriE,pt,[],['https://terrabrasilnoticias.com/2021/08/mourao-comemora-queda-de-queimadas-na-amazonia-em-2021-luta-diaria/'],['https://pbs.twimg.com/media/E78iG-VXEAYSNrm.png'],0,1,1,[],[],https://twitter.com/ZazaS_/status/1422893541311852551,False,,1,https://pbs.twimg.com/media/E78iG-VXEAYSNrm.png,,,,,,,[],,,,
1422760595493900289,1422760595493900289,2021-08-04 00:25:34 SA Eastern Standard Time,2021-08-04,00:25:34,-0300,1246169436446392323,yaradepaula5,Yara de Paula,,"Triste realidade do estado no período mais seco do ano.  O famoso verão, mais uma vez de sol rachando! @mapfireproject #fire #Amazonia #acre #queimadas",pt,"[{'screen_name': 'mapfireproject', 'name': '@mapfireproject', 'id': '1227972414744735745'}]",[],[],0,1,2,"['fire', 'amazonia', 'acre', 'queimadas']",[],https://twitter.com/YaradePaula5/status/1422760595493900289,False,https://twitter.com/AltinoMachado/status/1422694062012964873,0,,,,,,,,[],,,,
1422730502801330176,1422649421863526400,2021-08-03 22:25:59 SA Eastern Standard Time,2021-08-03,22:25:59,-0300,92868205,luizrmgarcia,Luiz,,@Rkrahenbuhl @JakeSullivan46 @Cartajuanero @GloboNews @tvglobo @g1 Como está liberação pra turismo de brasileiros pros Estados Unidos?  eles tem comentado sobre queimadas Amazônia?,pt,[],[],[],0,0,0,[],[],https://twitter.com/luizrmgarcia/status/1422730502801330176,False,,0,,,,,,,,"[{'screen_name': 'Rkrahenbuhl', 'name': 'Raquel Krähenbühl', 'id': '82503870'}, {'screen_name': 'JakeSullivan46', 'name': 'Jake Sullivan', 'id': '1356782857549676544'}, {'screen_name': 'Cartajuanero', 'name': 'Juan S. Gonzalez', 'id': '13011612'}, {'screen_name': 'GloboNews', 'name': 'GloboNews', 'id': '142393421'}, {'screen_name': 'tvglobo', 'name': 'TV Globo em 🏠', 'id': '18219976'}, {'screen_name': 'g1', 'name': 'G1', 'id': '8802752'}]",,,,
1422711780153905153,1422711778526511109,2021-08-03 21:11:35 SA Eastern Standard Time,2021-08-03,21:11:35,-0300,214071193,castroenobrega,Alessandra,,"mesmo com as urnas fraudulentas, mesmo contra a resistência da esquerda e suas ideologias diabólicas, mesmo com a debandada dos aproveitadores que “surfaram na onda” dele, mesmo com derramamento de óleo nas praias do Nordeste, mesmo com as queimadas da Amazônia, continua…",pt,[],[],[],1,0,0,[],[],https://twitter.com/CastroeNobrega/status/1422711780153905153,False,,0,,,,,,,,[],,,,
1422706616319758340,1422653052541186050,2021-08-03 20:51:04 SA Eastern Standard Time,2021-08-03,20:51:04,-0300,1052446125016272896,kaoslaisa,Lai Kaos,,"@RoseliSoder ...sobre desmonte na educação, saúde, cultura, queimadas absurdas na Amazônia. Não estava falando do PT não, mas se vc quiser falar sobre 2008 e 2016, tô aqui pra ler.",pt,[],[],[],0,0,1,[],[],https://twitter.com/kaoslaisa/status/1422706616319758340,False,,0,,,,,,,,"[{'screen_name': 'RoseliSoder', 'name': 'Roseli Soder', 'id': '4886147343'}]",,,,
1422703485137690626,1422703485137690626,2021-08-03 20:38:38 SA Eastern Standard Time,2021-08-03,20:38:38,-0300,1342776958397149185,malyaii,Malya II (reserva Malya),,Mourão celebra redução das queimadas na Amazônia em julho - Renova Mídia  https://t.co/dqKgwp9bg1 via @renovamidia,pt,"[{'screen_name': 'renovamidia', 'name': 'renova', 'id': '1388402174'}]",['https://renovamidia.com.br/mourao-celebra-reducao-das-queimadas-na-amazonia-em-julho/'],[],0,0,2,[],[],https://twitter.com/MalyaIi/status/1422703485137690626,False,,0,,,,,,,,[],,,,
1422699596300570625,1422699592051789829,2021-08-03 20:23:10 SA Eastern Standard Time,2021-08-03,20:23:10,-0300,41097241,reporterb,Repórter Brasil,,"Em 2020, fomos a campo com @TheGuardian para investigar o que acontece em áreas queimadas da Amazônia: além de fazendas de gado, vimos lotes à venda. Ou seja, muito da destruição da floresta é feita por quem quer lucrar com grilagem em áreas de preservação  https://t.co/28Fmx0XAi5",pt,"[{'screen_name': 'theguardian', 'name': 'mohsin adam sharif', 'id': '25666946'}]",['https://reporterbrasil.org.br/2020/05/desmatadores-em-serie-lotes-a-venda-e-pastos-o-que-flagramos-em-areas-de-preservacao-da-amazonia/'],[],1,22,40,[],[],https://twitter.com/reporterb/status/1422699596300570625,False,,0,,,,,,,,[],,,,
1422695545588658177,1422695545588658177,2021-08-03 20:07:05 SA Eastern Standard Time,2021-08-03,20:07:05,-0300,1204301854433316866,domingosnoguei7,🚩🚩Domingos Nogueira🚩🚩,,G1: Amazônia registra quase 5 mil focos de queimadas em julho mesmo com decreto que proíbe o uso do fogo; veja imagens.  https://t.co/K6p1YbB14h  via @GoogleNews,pt,"[{'screen_name': 'googlenews', 'name': 'google news', 'id': '33584794'}]",['https://g1.globo.com/natureza/amazonia/noticia/2021/08/03/amazonia-registra-quase-5-mil-focos-de-queimadas-em-julho-mesmo-com-decreto-que-proibe-o-uso-do-fogo-veja-imagens.ghtml'],[],0,0,2,[],[],https://twitter.com/DomingosNoguei7/status/1422695545588658177,False,,0,,,,,,,,[],,,,
1422693259990679552,1422693259990679552,2021-08-03 19:58:00 SA Eastern Standard Time,2021-08-03,19:58:00,-0300,68024875,gabinardini,Gabi Nardini,,"Passando na band sobre as queimadas na Turquia. Eu fico lembrando do que aconteceu/ acontece na Amazônia. Como eu me sinto pequena nessas horas, como eu queria ajudar 😢🧿#helpTurkey",pt,[],[],[],0,1,4,['helpturkey'],[],https://twitter.com/GabiNardini/status/1422693259990679552,False,,0,,,,,,,,[],,,,
1422682427076628482,1422682427076628482,2021-08-03 19:14:57 SA Eastern Standard Time,2021-08-03,19:14:57,-0300,1148318806303027205,marcosquezado1,Delegado M Quezado,,"Mourão celebra redução das queimadas na Amazônia em julho  “Vamos prosseguir, é uma luta diária”, diz vice-presidente.   https://t.co/ZKqYh0sTv6",pt,[],['https://renovamidia.com.br/mourao-celebra-reducao-das-queimadas-na-amazonia-em-julho/'],[],0,5,25,[],[],https://twitter.com/MarcosQuezado1/status/1422682427076628482,False,,0,,,,,,,,[],,,,
1422680677540040708,1422680641448169472,2021-08-03 19:08:00 SA Eastern Standard Time,2021-08-03,19:08:00,-0300,1172592441649782784,bioinsitu,Biologia In Situ,,"5) DAMASIO, Kevin. Queimadas e desmatamento estão transformando Amazônia em fonte de carbono, diz estudo. National Geographic, 15 jul. 2021. Disponível em: &lt; https://t.co/Y6DVxoPJ6C&gt;.",pt,[],['https://www.nationalgeographicbrasil.com/meio-ambiente/2021/07/queimadas-e-desmatamento-estao-transformando-amazonia-em-fonte-de-carbono-diz-estudo'],[],0,0,1,[],[],https://twitter.com/bioinsitu/status/1422680677540040708,False,,0,,,,,,,,[],,,,
1422680668685979650,1422680641448169472,2021-08-03 19:07:58 SA Eastern Standard Time,2021-08-03,19:07:58,-0300,1172592441649782784,bioinsitu,Biologia In Situ,,#bio #biologia #biologo #biologa #biologiainsitu #podcast #divulgacaocientifica #divulgacao #cientifica #ciência #bionews #BioNewsDrops #Amazônia #desmatamento #aquecimentoglobal #clima #CO2 #carbono #queimadas #mudançasclimáticas #riosvoadores,und,[],[],[],1,0,2,"['bio', 'biologia', 'biologo', 'biologa', 'biologiainsitu', 'podcast', 'divulgacaocientifica', 'divulgacao', 'cientifica', 'ciência', 'bionews', 'bionewsdrops', 'amazônia', 'desmatamento', 'aquecimentoglobal', 'clima', 'co2', 'carbono', 'queimadas', 'mudançasclimáticas', 'riosvoadores']",[],https://twitter.com/bioinsitu/status/1422680668685979650,False,,0,,,,,,,,[],,,,
1422679892924276736,1422679892924276736,2021-08-03 19:04:53 SA Eastern Standard Time,2021-08-03,19:04:53,-0300,1553217702,alexlennine,Alex Lennine,,Amazônia registra quase 5 mil focos de queimadas em julho mesmo com decreto que proíbe o uso do fogo; veja imagens | Amazônia | G1  https://t.co/K0hqxhb08n,pt,[],['https://g1.globo.com/natureza/amazonia/noticia/2021/08/03/amazonia-registra-quase-5-mil-focos-de-queimadas-em-julho-mesmo-com-decreto-que-proibe-o-uso-do-fogo-veja-imagens.ghtml'],[],0,0,0,[],[],https://twitter.com/alexlennine/status/1422679892924276736,False,,0,,,,,,,,[],,,,
1422678668023791618,1422678668023791618,2021-08-03 19:00:01 SA Eastern Standard Time,2021-08-03,19:00:01,-0300,1388402174,renovamidia,RENOVA,,"🇧🇷 | Mourão celebra redução das queimadas na Amazônia em julho: ""vamos prosseguir, é uma luta diária"".  Saiba mais:  https://t.co/aMjv580m9G  https://t.co/E45Hiruxt8",pt,[],['https://cutt.ly/NQx9uGs'],['https://pbs.twimg.com/media/E75VBIyWYAI0Jek.jpg'],10,27,250,[],[],https://twitter.com/RenovaMidia/status/1422678668023791618,False,,1,https://pbs.twimg.com/media/E75VBIyWYAI0Jek.jpg,,,,,,,[],,,,
1422657563011817476,1422657563011817476,2021-08-03 17:36:09 SA Eastern Standard Time,2021-08-03,17:36:09,-0300,1110274574166437888,marciasalmeida,Márcia Silveira,,Mourão comemora queda de queimadas na Amazônia em 2021: “Luta diária”  https://t.co/gsRqlQDR3u,pt,[],['https://terrabrasilnoticias.com/2021/08/mourao-comemora-queda-de-queimadas-na-amazonia-em-2021-luta-diaria/'],[],0,2,3,[],[],https://twitter.com/MarciaSAlmeida/status/1422657563011817476,False,,0,,,,,,,,[],,,,
1422656762335858698,1422656762335858698,2021-08-03 17:32:58 SA Eastern Standard Time,2021-08-03,17:32:58,-0300,120751204,ppvnlima,PP🇧🇷 Deus acima de todos!,,Mourão comemora queda de queimadas na Amazônia em 2021: “Luta diária” - Terra Brasil Notícias  https://t.co/yNn11zK4JX,pt,[],['https://terrabrasilnoticias.com/2021/08/mourao-comemora-queda-de-queimadas-na-amazonia-em-2021-luta-diaria/'],[],0,0,0,[],[],https://twitter.com/PPVNLima/status/1422656762335858698,False,,0,,,,,,,,[],,,,
1422654172080525315,1422654172080525315,2021-08-03 17:22:40 SA Eastern Standard Time,2021-08-03,17:22:40,-0300,1257128216260677632,beto1967b,Beto67BH,,Mourão comemora queda de queimadas na Amazônia em 2021: “Luta diária”  https://t.co/CUwnPhIOlD,pt,[],['https://terrabrasilnoticias.com/2021/08/mourao-comemora-queda-de-queimadas-na-amazonia-em-2021-luta-diaria/'],[],0,1,3,[],[],https://twitter.com/Beto1967B/status/1422654172080525315,False,,0,,,,,,,,[],,,,
1422654098059534338,1422654098059534338,2021-08-03 17:22:23 SA Eastern Standard Time,2021-08-03,17:22:23,-0300,1131007578207604741,woiciek1,Woiciek,,Acabei de ver Mourão comemora queda de queimadas na Amazônia em 2021: “Luta diária” - Clique para ver também ☛   https://t.co/nEHtBUjote via @TerraBrasilnot,pt,"[{'screen_name': 'terrabrasilnot', 'name': 'terra brasil notícias', 'id': '1253183357711790080'}]",['https://terrabrasilnoticias.com/2021/08/mourao-comemora-queda-de-queimadas-na-amazonia-em-2021-luta-diaria/'],[],0,1,2,[],[],https://twitter.com/Woiciek1/status/1422654098059534338,False,,0,,,,,,,,[],,,,
1422650499195617284,1422650499195617284,2021-08-03 17:08:05 SA Eastern Standard Time,2021-08-03,17:08:05,-0300,1377558167136129025,stevensonsoare4,Stevenson Soares da Silva,,Acabei de ver Mourão comemora queda de queimadas na Amazônia em 2021: “Luta diária” - Clique para ver também ☛   https://t.co/PVyZxubNey via @TerraBrasilnot,pt,"[{'screen_name': 'terrabrasilnot', 'name': 'terra brasil notícias', 'id': '1253183357711790080'}]",['https://terrabrasilnoticias.com/2021/08/mourao-comemora-queda-de-queimadas-na-amazonia-em-2021-luta-diaria/'],[],0,0,0,[],[],https://twitter.com/StevensonSoare4/status/1422650499195617284,False,,0,,,,,,,,[],,,,
1422639232544296966,1422639232544296966,2021-08-03 16:23:19 SA Eastern Standard Time,2021-08-03,16:23:19,-0300,1253183357711790080,terrabrasilnot,Terra Brasil Notícias,,Mourão comemora queda de queimadas na Amazônia em 2021: “Luta diária”  https://t.co/9np0RV6kQ0,pt,[],['https://terrabrasilnoticias.com/2021/08/mourao-comemora-queda-de-queimadas-na-amazonia-em-2021-luta-diaria/'],[],5,40,175,[],[],https://twitter.com/TerraBrasilnot/status/1422639232544296966,False,,0,,,,,,,,[],,,,
1422634028205760516,1422632000419246086,2021-08-03 16:02:38 SA Eastern Standard Time,2021-08-03,16:02:38,-0300,1118629993070891008,mario_99999,Mário,,"@maylles hahahahahahahaha A Amazônia não acabará por causa de queimadas ou transformação em pasto, mas do tanto de papel usado para tanta nota de repúdio.  Já é o quê? Algo semanal, parece série antiga de TV.",pt,[],[],[],0,0,0,[],[],https://twitter.com/Mario_99999/status/1422634028205760516,False,,0,,,,,,,,"[{'screen_name': 'maylles', 'name': 'Maylles', 'id': '205677742'}]",,,,
1422633441951092738,1422633441951092738,2021-08-03 16:00:18 SA Eastern Standard Time,2021-08-03,16:00:18,-0300,138492825,proindio,Comissão Pró-Índio,,"A #Amazônia registrou 4.977 focos de #queimadas em julho, segundo dados do Inpe. Greenpeace, em sobrevoo, flagrou fogo em floresta pública sem destinação e parque nacional. Em uma das fotos, é possível ver o gado sendo colocado em área recém-queimada.  https://t.co/dHmxDkpVZm",pt,[],['https://g1.globo.com/natureza/amazonia/noticia/2021/08/03/amazonia-registra-quase-5-mil-focos-de-queimadas-em-julho-mesmo-com-decreto-que-proibe-o-uso-do-fogo-veja-imagens.ghtml'],[],2,30,64,"['amazônia', 'queimadas']",[],https://twitter.com/proindio/status/1422633441951092738,False,,0,,,,,,,,[],,,,
