id,conversation_id,created_at,date,time,timezone,user_id,username,name,place,tweet,language,mentions,urls,photos,replies_count,retweets_count,likes_count,hashtags,cashtags,link,retweet,quote_url,video,thumbnail,near,geo,source,user_rt_id,user_rt,retweet_id,reply_to,retweet_date,translate,trans_src,trans_dest
1424512755076411393,1424512755076411393,2021-08-08 20:28:01 SA Eastern Standard Time,2021-08-08,20:28:01,-0300,57030287,alanribeiro1,Alan Ribeiro ᶜʳᶠ ✊🏼✊🏽✊🏾✊🏿,,"Minha Brastemp destruiu biomas pra plantar soja pra exportação, fez queimadas na Amazônia, derrubou árvores para vender madeira e ainda faz comercial na tv dizendo q ela é Pop",pt,[],[],[],0,0,2,[],[],https://twitter.com/AlanRibeiro1/status/1424512755076411393,False,https://twitter.com/g1/status/1351099510693502986,0,,,,,,,,[],,,,
1424498551304957956,1424474573718925323,2021-08-08 19:31:35 SA Eastern Standard Time,2021-08-08,19:31:35,-0300,195133097,dbrewlles,B. Miranda 🇧🇷🙏👨‍👩‍👧‍👧,,@CNNBrasil Greta?! Dicaprio corre aqui... as girafas da Amazônia grega estão morrendo queimadas.,pt,[],[],[],0,0,0,[],[],https://twitter.com/dbrewlles/status/1424498551304957956,False,,0,,,,,,,,"[{'screen_name': 'CNNBrasil', 'name': 'CNN Brasil', 'id': '809124436880322561'}]",,,,
1424492984981143561,1424477273139425284,2021-08-08 19:09:28 SA Eastern Standard Time,2021-08-08,19:09:28,-0300,989198300132921344,nadia_patria,Pátria Amada Brasil 🇧🇷🇧🇷,,"@ToniBulhoes Poxa !! Só isso ? Nem pra ser ""um Ronaldinho dos negócios "" ....todo dia uma narrativa pra atingir o PR e essa ""carta"" do Flávio já está manjada no jogo ..tá ...depois vem as ""queimadas "" na Amazônia  e mimimimimi , né ? Pedir o contrato secreto  do Dória com a China ninguém pede",pt,[],[],[],0,0,0,[],[],https://twitter.com/nadia_patria/status/1424492984981143561,False,,0,,,,,,,,"[{'screen_name': 'ToniBulhoes', 'name': 'Toni Bulhoes', 'id': '32970721'}]",,,,
1424491406794559489,1351099510693502986,2021-08-08 19:03:11 SA Eastern Standard Time,2021-08-08,19:03:11,-0300,1376649525742424067,nassinh4,Azealia Banks no mosteiro budista no Nepal,,"@g1 A minha não está promovendo queimadas quilométricas na Amazônia, não está causando a falta de água em vários pontos do mundo, não está causando pressão na terra e causando infertilidade nela, mas é mais fácil colocar a culpa no trabalhador por ter geladeira e ar condicionado né!?",pt,[],[],[],0,0,0,[],[],https://twitter.com/nassinh4/status/1424491406794559489,False,,0,,,,,,,,"[{'screen_name': 'g1', 'name': 'G1', 'id': '8802752'}]",,,,
1424487018265026565,1424481911041400833,2021-08-08 18:45:45 SA Eastern Standard Time,2021-08-08,18:45:45,-0300,1238909481418985472,apolo91177,Apolo 911,,"@GloboNews Cadê as fotos de girafas, elefantes, zebras etc correndo das chamas, Mácron chamando, "" nossa Califórnia ""  e Greta maluca vociferando, o greem peace berrando o caos climático advindo das queimadas.. Não, não haverá nada..pois o olho deles está na amazônia ....",pt,[],[],[],0,0,1,[],[],https://twitter.com/Apolo91177/status/1424487018265026565,False,,0,,,,,,,,"[{'screen_name': 'GloboNews', 'name': 'GloboNews', 'id': '142393421'}]",,,,
1424471151078776832,1424457891646427138,2021-08-08 17:42:42 SA Eastern Standard Time,2021-08-08,17:42:42,-0300,1372685128493830150,somosmayday,Mayday!,,"@Contextogeo O idiota vive num país onde o dia virou noite às 3 da tarde por causa das queimadas no Pantanal e na Amazônia e ainda fala que o Brasil é o país que mais preserva o meio ambiente... Olha, tem horas que eu acho que essa gente precisa levar surra com gato morto até o gato miar!",pt,[],[],[],0,0,3,[],[],https://twitter.com/SomosMayday/status/1424471151078776832,False,,0,,,,,,,,"[{'screen_name': 'Contextogeo', 'name': 'Contexto Geopolítico', 'id': '959276656606068739'}]",,,,
1424455293514272771,1424455293514272771,2021-08-08 16:39:41 SA Eastern Standard Time,2021-08-08,16:39:41,-0300,1235416973875597313,lucas_pasion,Lucas Pasion 🏳️‍🌈 🌙,,Oq causa o aquecimento global?  (    ) Queimadas na Amazônia (    ) CO2 das indústrias ( X ) Sua Brastemp,pt,[],[],[],1,0,0,[],[],https://twitter.com/lucas_pasion/status/1424455293514272771,False,https://twitter.com/g1/status/1351099510693502986,0,,,,,,,,[],,,,
1424409064507944964,1424409064507944964,2021-08-08 13:35:59 SA Eastern Standard Time,2021-08-08,13:35:59,-0300,722014722061660160,reisjnreis,Jose Reis,,"Também tem uma tal de Califórnia virando cinzas e cidades inteiras queimadas, o mesmo na Turquia, Grécia e sul da Itália! Porquê você só fala da Amazônia Eliane? E desta vez são áreas muito menores felizmente !",pt,[],[],[],0,1,2,[],[],https://twitter.com/Reisjnreis/status/1424409064507944964,False,https://twitter.com/ECantanhede/status/1424400415051898885,0,,,,,,,,[],,,,
1424337978177073153,1424337978177073153,2021-08-08 08:53:31 SA Eastern Standard Time,2021-08-08,08:53:31,-0300,1396219758593335298,franfranco38,Fran SDV #Bolsonaro2022🇧🇷🇮🇱,,"Imagens dos incêndios na região da Sicília, Itália e Marmaris, Turquia.  Cadê #LeonardoDiCaprio e #gretathunberg?! Cadê todos os #ambientalistas que reclamaram das queimadas na #amazonia?  Seletivos vocês hein!  https://t.co/E3M9d0rpq9",pt,[],[],"['https://pbs.twimg.com/media/E8RDPoBXEAQbjNU.jpg', 'https://pbs.twimg.com/media/E8RDQ7NXsAUJdPh.jpg']",0,0,1,"['leonardodicaprio', 'gretathunberg', 'ambientalistas', 'amazonia']",[],https://twitter.com/Franfranco38/status/1424337978177073153,False,,1,https://pbs.twimg.com/media/E8RDPoBXEAQbjNU.jpg,,,,,,,[],,,,
1424322332680654851,1424322332680654851,2021-08-08 07:51:21 SA Eastern Standard Time,2021-08-08,07:51:21,-0300,1412048145979150342,altairdamas,Altair Damas,,Cadê está pirralha nojenta ? Avisem a ela sobre as queimadas no mundo inteiro  Ou Será  que ela só conhece a Amazônia?,pt,[],[],[],0,0,1,[],[],https://twitter.com/AltairDamas/status/1424322332680654851,False,https://twitter.com/salvadoredapatr/status/1424243708887769091,0,,,,,,,,[],,,,
1424316250939871234,1424303870281408515,2021-08-08 07:27:11 SA Eastern Standard Time,2021-08-08,07:27:11,-0300,3129518080,neiice2013,Nei Cavaleiro,,"@bbcbrasil A mudança climática ocorreu evidentemente após o início das queimadas da Amazônia segundo a Greta e o Macron que viram pessoalmente a situação, trágico mas verdadeiro esse relato  https://t.co/yOWoAmUIzE",pt,[],[],['https://pbs.twimg.com/tweet_video_thumb/E8QwE4fXIAMdBp6.jpg'],0,0,0,[],[],https://twitter.com/neiice2013/status/1424316250939871234,False,,1,https://pbs.twimg.com/tweet_video_thumb/E8QwE4fXIAMdBp6.jpg,,,,,,,"[{'screen_name': 'bbcbrasil', 'name': 'BBC News Brasil', 'id': '790680'}]",,,,
1424289657748078593,1424289657748078593,2021-08-08 05:41:31 SA Eastern Standard Time,2021-08-08,05:41:31,-0300,2308451519,taly_chann,Canceladah,,"Imagina agora como nossos povos indígenas se sentiram  Como os animais do Pantanal, cerrado, mata atlantica e amazônia se sentem/sentiram nessas queimadas",pt,[],[],[],0,0,0,[],[],https://twitter.com/taly_chann/status/1424289657748078593,False,https://twitter.com/__CarmenLopez/status/1423917635088097282,0,,,,,,,,[],,,,
1424222940510437379,1424222940510437379,2021-08-08 01:16:24 SA Eastern Standard Time,2021-08-08,01:16:24,-0300,1414126892584742914,s0ualiada,Aliada 🇧🇷 ▄︻┻┳═一🔥,,"Huuuummmm, só as queimadas da Amazônia, que afetam o meio ambiente???  https://t.co/pnuQEFbjCW",pt,[],[],['https://pbs.twimg.com/media/E8PbNp4WUAUqUjp.jpg'],0,0,5,[],[],https://twitter.com/S0uAliada/status/1424222940510437379,False,,1,https://pbs.twimg.com/media/E8PbNp4WUAUqUjp.jpg,,,,,,,[],,,,
1424173686073004037,1424173686073004037,2021-08-07 22:00:41 SA Eastern Standard Time,2021-08-07,22:00:41,-0300,1219818153091440641,gikaksar,"Lado Esquerdo, Lado Forte! 🚩✊🏽✊🏿✊🏼",,"Salles, facilitou queimadas na Amazônia e Pantanal. Salles, disse ""Isso de patrimônio da humanidade é uma bobagem"" Salles pede demissão, nada aconteceu Galo, trabalhar informal incendiou estátua de Borba Gato um estuprador e genocida. Quem tá preso?",pt,[],[],[],0,1,1,[],[],https://twitter.com/GikaKsar/status/1424173686073004037,False,https://twitter.com/galodeluta/status/1424067067221839875,0,,,,,,,,[],,,,
1424146641922183169,1424146641922183169,2021-08-07 20:13:13 SA Eastern Standard Time,2021-08-07,20:13:13,-0300,27978994,_thony,Anthony Charles,,Kd a malta reclamando das queimadas na amazónia bossonaro tb passou por estes lugares tacando fogo ?,pt,[],[],[],0,0,0,[],[],https://twitter.com/_thony/status/1424146641922183169,False,https://twitter.com/DLIBYHLUV/status/1423642568013885442,0,,,,,,,,[],,,,
1424136581028401161,1424136581028401161,2021-08-07 19:33:14 SA Eastern Standard Time,2021-08-07,19:33:14,-0300,4026766343,krekre_isa,eh a isadora ora 1/2,,"Sim sim lindo, as queimadas na amazonia sao causadas por alienígenas e a Igreja somos nós, isso mesmo concordo",pt,[],[],[],1,0,9,[],[],https://twitter.com/krekre_isa/status/1424136581028401161,False,,0,,,,,,,,[],,,,
1424135244878389250,1424106306173120519,2021-08-07 19:27:56 SA Eastern Standard Time,2021-08-07,19:27:56,-0300,1346598004795572232,atentus3,Atentus,,"@ligiagambol O Macron, está preocupado é com as QUEIMADAS na nossa AMAZÔNIA.",pt,[],[],[],1,1,1,[],[],https://twitter.com/Atentus3/status/1424135244878389250,False,,0,,,,,,,,"[{'screen_name': 'ligiagambol', 'name': '🇧🇷Ligia🇧🇷Dia 18/09 não ao passaporte sanitário', 'id': '1242252292960772107'}]",,,,
1424127180481650693,1424038087471083523,2021-08-07 18:55:53 SA Eastern Standard Time,2021-08-07,18:55:53,-0300,1397488845617250305,laffurr2,Laura,,"@BobJeffRoadKing Vergonha desse verme que deixou milhares morrer de covid por negociar vacinas, em conchavo com madeireiros e agro, permitiu as queimadas na Amazônia, Pantanal, permitiu o uso de venenos proibidos na lavoura, usa do dinheiro em promoção como nestas motociatas. #ForaBolsonaro",pt,[],[],[],0,0,1,['forabolsonaro'],[],https://twitter.com/laffurr2/status/1424127180481650693,False,,0,,,,,,,,[],,,,
1424081411296878593,1424050715840942080,2021-08-07 15:54:01 SA Eastern Standard Time,2021-08-07,15:54:01,-0300,1339413225172033536,alithero,unwillingness,,@PedroRPAranha @folha Levar a sério oq seu animal? Vc ta tentando ironizar quem culpou o Bolsonaro pelas queimadas na amazonia q foram ocasionadas pelo fator humano comparando com queimadas q estão ocorrendo por causa de onda de calor  o único imbecil aqui é vc.,pt,[],[],[],0,0,0,[],[],https://twitter.com/alithero/status/1424081411296878593,False,,0,,,,,,,,"[{'screen_name': 'PedroRPAranha', 'name': 'Pedro Aranha', 'id': '936982708126928896'}, {'screen_name': 'folha', 'name': 'Folha de S.Paulo', 'id': '14594813'}]",,,,
1424078274460798981,1424078271487033346,2021-08-07 15:41:33 SA Eastern Standard Time,2021-08-07,15:41:33,-0300,2891297708,eduruaro1,Amon 🦜🦥,,"- O aumento da temperatura aumenta o desgelo a camada e permafrost que contém muito CO2, somente aprofundando a crise climática.  - o aumento cria queimadas naturais, a queimadas natural da Amazônia em 2010 liberou mais CO2 que a produção anual da China, a maior produtora de CO2.",pt,[],[],[],1,0,8,[],[],https://twitter.com/eduruaro1/status/1424078274460798981,False,,0,,,,,,,,[],,,,
1424075014836473856,1423731100568936457,2021-08-07 15:28:36 SA Eastern Standard Time,2021-08-07,15:28:36,-0300,45138473,cris_inoue,Cristina Inoue,,"@baraodurivotril @sennalives80 @jdoriajr Queimadas na Amazônia e Pantanal, comprou tratores e distribuiu a aliados, e está sendo responsabilizado pelas mais meio milhão de óbitos pela covid 19. Obrigada, meu caro, por lembrar da ISONOMIA.",pt,[],[],[],0,0,1,[],[],https://twitter.com/cris_inoue/status/1424075014836473856,False,,0,,,,,,,,"[{'screen_name': 'baraodurivotril', 'name': 'barão D’ Rivotril', 'id': '1346868830572859392'}, {'screen_name': 'sennalives80', 'name': 'Jim Schrute', 'id': '194799031'}, {'screen_name': 'jdoriajr', 'name': 'João Doria', 'id': '64706049'}]",,,,
1424073055421308933,1424073055421308933,2021-08-07 15:20:49 SA Eastern Standard Time,2021-08-07,15:20:49,-0300,224669172,ccmathey,celestiau,,@mfriasoficial me falaram q vc ta cotado como ministro do ambiente?? eh pra da continuidade ao projeto queimadas já?? primeiro a cinemateca dps a amazonia  #soscinematecabrasileira #soscinemabrasileiro  #TécnicosPreservamAcervos #IncêndiosPodemSerEvitados #cinematecabrasileira,pt,[],[],[],0,0,0,"['soscinematecabrasileira', 'soscinemabrasileiro', 'técnicospreservamacervos', 'incêndiospodemserevitados', 'cinematecabrasileira']",[],https://twitter.com/ccmathey/status/1424073055421308933,False,,0,,,,,,,,[],,,,
1424066430136369156,1423988938809749515,2021-08-07 14:54:29 SA Eastern Standard Time,2021-08-07,14:54:29,-0300,16572061,raven70,raven70,,"@joaoslf @vanecosta10 Vamos pelo mesmo caminho. O Sul e Sudeste seguem ignorando as queimadas e grilagens na Amazônia e no cerrado, como se isso não nos afetasse.",pt,[],[],[],0,4,65,[],[],https://twitter.com/raven70/status/1424066430136369156,False,,0,,,,,,,,"[{'screen_name': 'joaoslf', 'name': 'joaoslf', 'id': '1186798395832307712'}, {'screen_name': 'vanecosta10', 'name': 'A Eng. Florestal do YouTube 🌳', 'id': '3589345337'}]",,,,
1424063008817487877,1423954817005891596,2021-08-07 14:40:53 SA Eastern Standard Time,2021-08-07,14:40:53,-0300,1314304035088982016,poblanrj,Poblan,,"@_zevagner @safbf Você também fica revoltado com as queimadas na Amazônia, e a venda ilegal de madeira promovida pelo sr. Salles?",pt,[],[],[],0,0,1,[],[],https://twitter.com/poblanrj/status/1424063008817487877,False,,0,,,,,,,,"[{'screen_name': '_zevagner', 'name': 'José Vagner', 'id': '1366881191098466307'}, {'screen_name': 'safbf', 'name': 'Sabrina Fernandes', 'id': '735567688303575042'}]",,,,
1424036770019258374,1424035923629645825,2021-08-07 12:56:37 SA Eastern Standard Time,2021-08-07,12:56:37,-0300,1372063941610835968,anti_duhring,brady comunista,,@negreiroscoach Acaba o ministério do meio ambiente e as árvores queimadas crescem na Amazônia,pt,[],[],[],1,0,1,[],[],https://twitter.com/anti_duhring/status/1424036770019258374,False,,0,,,,,,,,"[{'screen_name': 'negreiroscoach', 'name': 'Raphael Negreiros', 'id': '1086672378'}]",,,,
1424033409517686787,1424033391884832774,2021-08-07 12:43:16 SA Eastern Standard Time,2021-08-07,12:43:16,-0300,1422924122745671681,agroefogo,Agro é Fogo,,"Ouvimos comunidades tradicionais da Amazônia, do Cerrado e do Pantanal e reunimos material de especialistas que explicam direitinho a diferença entre as queimadas criminosas e o uso do fogo feito de maneira tradicional. 👩‍🌾🧑‍🌾Aqui, apresentamos como funcionam as roças itinerantes +  https://t.co/rAQO5svTOH",pt,[],[],['https://pbs.twimg.com/media/E8MoxAjXoAYECsI.jpg'],1,1,0,[],[],https://twitter.com/AgroeFogo/status/1424033409517686787,False,,1,https://pbs.twimg.com/media/E8MoxAjXoAYECsI.jpg,,,,,,,[],,,,
1424002978567147520,1424002976373485570,2021-08-07 10:42:21 SA Eastern Standard Time,2021-08-07,10:42:21,-0300,998360098723557376,mahripaula,Indignada✨,,"O fato de estar acontecendo incêndios alarmantes para o lado da Europa, não significa que ano passado o Ricardo Salles NÃO LIBEROU DESMATAMENTO ILEGAL NA AMAZÔNIA.E que aquelas queimadas não tem nada a ver com o governo Bolsonaro.",pt,[],[],[],0,0,2,[],[],https://twitter.com/mahripaula/status/1424002978567147520,False,,0,,,,,,,,[],,,,
1423998170040868868,1423998170040868868,2021-08-07 10:23:15 SA Eastern Standard Time,2021-08-07,10:23:15,-0300,1410698378191818759,gessaufrn,GESSA - UFRN,,"Nem Amazônia, nem Pantanal, nem Cerrado: o bioma brasileiro com maior crescimento no número de queimadas em 2021 até agora é a #Caatinga // Neither the Amazon, nor the Pantanal, nor the Cerrado: the Brazilian biome with the greatest growth of fires in 2021 so far is the Caatinga",pt,[],[],[],0,0,0,['caatinga'],[],https://twitter.com/GessaUfrn/status/1423998170040868868,False,https://twitter.com/bbcbrasil/status/1422540510355411009,0,,,,,,,,[],,,,
1423852754070642689,1423852754070642689,2021-08-07 00:45:25 SA Eastern Standard Time,2021-08-07,00:45:25,-0300,1386136717766402049,ygorbook,Ygor 📗: A menina que roubava livros ☔,,"É desprezível a maneira como este nosso atual governo trata as queimadas na Amazônia. Nós, como cidadãos, devemos refletir sobre este atual governo. Devemos refletir sobre o que nós estamos fazendo. Estamos de braços cruzados? Estamos ajudando?",pt,[],[],[],0,0,0,[],[],https://twitter.com/YgorBook/status/1423852754070642689,False,,0,,,,,,,,[],,,,
1423850848422084608,1423850848422084608,2021-08-07 00:37:50 SA Eastern Standard Time,2021-08-07,00:37:50,-0300,1386136717766402049,ygorbook,Ygor 📗: A menina que roubava livros ☔,,"A Amazônia está tendo uma das piores queimadas desde 2015. Alguém deve pôr um fim nisto. Animais estão a morrer, florestas estão a serem queimadas. Mesmo assim, o governo fecha os seus olhos diante de tal situação.",pt,[],[],[],0,1,2,[],[],https://twitter.com/YgorBook/status/1423850848422084608,False,,0,,,,,,,,[],,,,
1423832470978433026,1423832470978433026,2021-08-06 23:24:49 SA Eastern Standard Time,2021-08-06,23:24:49,-0300,137556807,junhoprs,Junho,,Mas e o rolê que eu colei e apareceram uns gringos que tão filmando um curta sobre as queimadas na Amazônia,pt,[],[],[],0,0,0,[],[],https://twitter.com/junhoprs/status/1423832470978433026,False,,0,,,,,,,,[],,,,
1423826021749493762,1423609896625442822,2021-08-06 22:59:11 SA Eastern Standard Time,2021-08-06,22:59:11,-0300,833820961,l_dubinski,Lucas 🇧🇷,,"@ClodAraujo @LuhMegi @disconhecidx @Olhar_Olimpico Pelo jeito você não entende a diferença básica entre um colete a prova de balas e de uma vacina. Deve achar que pra resolver o problema de queimadas na Amazônia é só derrubar as árvores, ai não tem mais o que queimar.",pt,[],[],[],1,0,3,[],[],https://twitter.com/l_Dubinski/status/1423826021749493762,False,,0,,,,,,,,"[{'screen_name': 'ClodAraujo', 'name': 'Araujo', 'id': '1347051717523857408'}, {'screen_name': 'LuhMegi', 'name': 'Lucy 😷💉', 'id': '487062791'}, {'screen_name': 'disconhecidx', 'name': 'disconhecidx', 'id': '1125387349926535169'}, {'screen_name': 'Olhar_Olimpico', 'name': 'Demétrio Vecchioli', 'id': '1268325895'}]",,,,
1423824536051531777,1423823840266829826,2021-08-06 22:53:17 SA Eastern Standard Time,2021-08-06,22:53:17,-0300,1942587636,dezprasnove,Verlören 🇧🇷 🇩🇪,,@rodartgabriela O incêndio nos Estados Unidos que já duram 2 meses já queimou quase mesma quantidade de queimadas da Amazônia NO ANO INTEIRO. Mas nisso não tem Di Caprio nem Greta,pt,[],[],[],0,1,5,[],[],https://twitter.com/dezprasnove/status/1423824536051531777,False,,0,,,,,,,,"[{'screen_name': 'rodartgabriela', 'name': 'Gabriela Rodart 🇧🇷🇻🇦', 'id': '1194344638087344128'}]",,,,
1423801575764643845,1423801575764643845,2021-08-06 21:22:03 SA Eastern Standard Time,2021-08-06,21:22:03,-0300,1394298200715038724,ouzak53442926,Ouzak,,O segundo maior erro é  matar a amazonia co. Queimadas#jornaldacultura,pt,[],[],[],0,0,0,[],[],https://twitter.com/Ouzak53442926/status/1423801575764643845,False,,0,,,,,,,,[],,,,
1423799191260831746,1423799191260831746,2021-08-06 21:12:34 SA Eastern Standard Time,2021-08-06,21:12:34,-0300,1050121324436307970,contaratosenado,Fabiano Contarato,,"Devastação apoiada pelo governo federal. O acumulado de alertas de desmatamento em 2021 na Amazônia foi de 8.712 km², segundo o @inpe_mct. A Amazônia enfrentou o maior número de focos de queimadas em 14 anos p/ mês de junho. Não podemos aceitar esse crime.  https://t.co/4MAUHGGVm6",pt,"[{'screen_name': 'inpe_mct', 'name': 'inpe', 'id': '308605432'}]",['http://glo.bo/3xs6yen'],[],21,80,456,[],[],https://twitter.com/ContaratoSenado/status/1423799191260831746,False,,0,,,,,,,,[],,,,
1423791139971285003,1423790502802083840,2021-08-06 20:40:35 SA Eastern Standard Time,2021-08-06,20:40:35,-0300,2387134650,sitelorenzetti,Jair Lorenzetti Filho,,"A pesquisa mediu in loco os efeitos do fogo em áreas queimadas e não queimadas ao norte da região entre os rios Purus e Madeira, na Amazônia Central, em 2015, e os pesquisadores fizeram recenseamentos anuais para rastrear os fatores demográficos que determinaram a mudança de",pt,[],[],[],1,0,0,[],[],https://twitter.com/SiteLorenzetti/status/1423791139971285003,False,,0,,,,,,,,[],,,,
1423791133369544709,1423790502802083840,2021-08-06 20:40:33 SA Eastern Standard Time,2021-08-06,20:40:33,-0300,2387134650,sitelorenzetti,Jair Lorenzetti Filho,,"Em 2019, ano-alvo da pesquisa, a Amazônia registrou um dos mais altos números de queimadas, com 89.176 focos de incêndio em 12 meses, segundo o Inpe. Porém, no ano passado, houve crescimento nas notificações, com 103.161 focos, o terceiro maior número na década, atrás de 2015",pt,[],[],[],1,0,0,[],[],https://twitter.com/SiteLorenzetti/status/1423791133369544709,False,,0,,,,,,,,[],,,,
1423790930184835079,1423790930184835079,2021-08-06 20:39:45 SA Eastern Standard Time,2021-08-06,20:39:45,-0300,1276269146,capereira1952,carlos pereira,,"Alguém aí viu o macron, di Caprio e a Greta? Está pegando fogo nos EUA, Itália e Grécia, mas estes bostas não deram uma palavra, está provado que o problema não eram as queimadas na Amazônia e sim o que está em baixo dela.",pt,[],[],[],0,0,0,[],[],https://twitter.com/capereira1952/status/1423790930184835079,False,,0,,,,,,,,[],,,,
1423790506396504067,1423790502802083840,2021-08-06 20:38:04 SA Eastern Standard Time,2021-08-06,20:38:04,-0300,2387134650,sitelorenzetti,Jair Lorenzetti Filho,,"Luciana Constantino | Agência FAPESP  Entender o impacto dos danos causados por frequentes queimadas na Amazônia, a maior e mais biodiversa floresta tropical do mundo, tem sido um desafio nos últimos anos. Agora, um artigo publicado na revista Remote Sensing aponta uma",pt,[],[],[],1,0,0,[],[],https://twitter.com/SiteLorenzetti/status/1423790506396504067,False,,0,,,,,,,,[],,,,
1423761484417490946,1423761484417490946,2021-08-06 18:42:44 SA Eastern Standard Time,2021-08-06,18:42:44,-0300,1385282616065204224,sunflowervol51,Carolina 🐇🏳️‍🌈,,Apenas passando aqui pra lembrar que estamos em agosto q é um período horrível com muitas queimadas no Pantanal e na Amazônia! Ano passado nessa mesma época eu n podia abrir a janela do meu quarto pois tudo era fumaça!!! Isso está matando o nosso mundo e nós tbm,pt,[],[],[],0,0,0,[],[],https://twitter.com/sunflowervol51/status/1423761484417490946,False,https://twitter.com/DLIBYHLUV/status/1423642568013885442,0,,,,,,,,[],,,,
1423758982989111296,1423758982989111296,2021-08-06 18:32:48 SA Eastern Standard Time,2021-08-06,18:32:48,-0300,1975834622,raisaaaraujo,Raiça,,"Estou há 12 semanas fazendo uma leitura do cenário amazônico e de forma absoluta, durante todo esse tempo, eu só vejo notícias de desmatamentos e queimadas recordes na Amazônia.   O Mourão essa semana:   https://t.co/1nGscsbGAz",pt,[],['https://www.poder360.com.br/meio-ambiente/mourao-celebra-queda-de-queimadas-na-amazonia-em-2021-luta-diaria/'],[],1,0,2,[],[],https://twitter.com/raisaaaraujo/status/1423758982989111296,False,,0,,,,,,,,[],,,,
1423732856812081156,1423730356277202944,2021-08-06 16:48:59 SA Eastern Standard Time,2021-08-06,16:48:59,-0300,2363294752,felipeberchiell,Felipe Peters Berchielli,,"@fm_felipemendes @_o_demo_ @folha Não sei, faz sentido cobrar a justiça de SP por queimadas na Amazônia?",pt,[],[],[],1,0,0,[],[],https://twitter.com/FelipeBerchiell/status/1423732856812081156,False,,0,,,,,,,,"[{'screen_name': 'fm_felipemendes', 'name': 'CHAPA', 'id': '2992949974'}, {'screen_name': '_o_demo_', 'name': '🔥𝙙𝙚𝙢𝙤™🔥', 'id': '3931855841'}, {'screen_name': 'folha', 'name': 'Folha de S.Paulo', 'id': '14594813'}]",,,,
1423729310918135816,1423724536252403718,2021-08-06 16:34:53 SA Eastern Standard Time,2021-08-06,16:34:53,-0300,1321918354836344837,minioninvestid1,Rock Against Minions,,@jordanfarialima Depois dizem que ele não se preocupa com as queimadas na Amazônia !!!!,pt,[],[],[],0,0,0,[],[],https://twitter.com/MinionInvestid1/status/1423729310918135816,False,,0,,,,,,,,"[{'screen_name': 'jordanfarialima', 'name': 'Jordan Lima', 'id': '1325224754865975296'}]",,,,
1423720596165304324,1423719622898036741,2021-08-06 16:00:16 SA Eastern Standard Time,2021-08-06,16:00:16,-0300,1264409724734386176,a58864853,A🆘😷,,@yanpedrokm E nesse caso a machadinha também serve de referência ao desmatamento na Amazônia às queimadas! Sem as queimadas não precisaríamos de mais bombeiros!  Faz sentido,pt,[],[],[],0,0,2,[],[],https://twitter.com/A58864853/status/1423720596165304324,False,,0,,,,,,,,"[{'screen_name': 'yanpedrokm', 'name': 'yan pedro', 'id': '174717900'}]",,,,
1423713697231478785,1423713697231478785,2021-08-06 15:32:51 SA Eastern Standard Time,2021-08-06,15:32:51,-0300,1276331578818539531,paulinhojn,É o Fim da Picada,,"O Problema é que agora nossas Girafas estão morrendo queimadas na Amazonia. Nossas estatais que davam lucros Bilionários para o povo estão privatizando, e por fim, para ficar na História da Humanidade, Passamos por uma Pandemia onde o ""Virus"" Não matou Ninguém !",pt,[],[],[],0,0,0,[],[],https://twitter.com/PaulinhoJn/status/1423713697231478785,False,https://twitter.com/lucaspolese/status/1423696328522145795,0,,,,,,,,[],,,,
