id,conversation_id,created_at,date,time,timezone,user_id,username,name,place,tweet,language,mentions,urls,photos,replies_count,retweets_count,likes_count,hashtags,cashtags,link,retweet,quote_url,video,thumbnail,near,geo,source,user_rt_id,user_rt,retweet_id,reply_to,retweet_date,translate,trans_src,trans_dest
1371833260595118098,1371833260595118098,2021-03-16 11:38:31 -03,2021-03-16,11:38:31,-0300,74842999,imazon,Imazon,,"Amazônia perdeu 179 km² de floresta para o desmatamento em fevereiro de 2021. Os dados, monitorados pelo Imazon, representam um aumento de 74% em relação ao mesmo período do ano passado.  https://t.co/Nry1LuUW3u  #Amazonia #Imazon #SAD #desmatamento #degradacao #meioambiente  https://t.co/YCu4veBleQ",pt,[],['http://bit.ly/sad-fev-2021'],"['https://pbs.twimg.com/media/Ewm7DrJXAAACkAw.jpg', 'https://pbs.twimg.com/media/Ewm7EhPWUAA4M4g.jpg', 'https://pbs.twimg.com/media/Ewm7FFKWQAURycD.jpg']",3,6,13,"['amazonia', 'imazon', 'sad', 'desmatamento', 'degradacao', 'meioambiente']",[],https://twitter.com/Imazon/status/1371833260595118098,False,,1,https://pbs.twimg.com/media/Ewm7DrJXAAACkAw.jpg,,,,,,,[],,,,
1371824707062874113,1371824707062874113,2021-03-16 11:04:32 -03,2021-03-16,11:04:32,-0300,557051132,pqpcarolinny,ca🌙,,"virei pro meu chefe e falei: aproveitando que você é meu chefe, você pode assinar umas petições contra o desmatamento da Amazônia e à favor de suporte para mãe do Miguel?",pt,[],[],[],0,0,0,[],[],https://twitter.com/pqpcarolinny/status/1371824707062874113,False,,0,,,,,,,,[],,,,
1371789501371195393,1371789501371195393,2021-03-16 08:44:38 -03,2021-03-16,08:44:38,-0300,117425043,acrisiosena,Acrísio Sena,,"Em 2019, o Sistema de Estimativas de Emissões e Remoções de Gases de Efeito Estufa (SEEG) apresentou estimativas de quanto o Brasil emitiu até 2018 e, mais uma vez, quase metade das emissões são provenientes do setor ligado ao desmatamento na Amazônia e Cerrado.  https://t.co/h3nl9e76xt",pt,[],[],['https://pbs.twimg.com/media/EwmTRqjXIAM5mmY.jpg'],1,0,0,[],[],https://twitter.com/acrisiosena/status/1371789501371195393,False,,1,https://pbs.twimg.com/media/EwmTRqjXIAM5mmY.jpg,,,,,,,[],,,,
1371682212979019777,1371682212979019777,2021-03-16 01:38:18 -03,2021-03-16,01:38:18,-0300,822822579325009924,brina_pros,vira voto,,"me empolguei e falei de luta de classes, ditadura e desmatamento da Amazônia em uma só msg, ou ela se apaixona ou me acha doida e nunca mais fala comigo",pt,[],[],[],3,0,8,[],[],https://twitter.com/brina_pros/status/1371682212979019777,False,,0,,,,,,,,[],,,,
1371675979450478592,1371675979450478592,2021-03-16 01:13:32 -03,2021-03-16,01:13:32,-0300,66018347,harumetashiro,haru,,"“ Não sei aonde você quer chegar com o que você posta sobre veganismo “   O principal motivo do desmatamento da mata Atlântica, do serrado da catinga e agora da Amazônia é a agropecuária.",pt,[],[],[],0,0,0,[],[],https://twitter.com/harumetashiro/status/1371675979450478592,False,,0,,,,,,,,[],,,,
1371666914913701893,1371095701074104321,2021-03-16 00:37:31 -03,2021-03-16,00:37:31,-0300,870835002837225473,alezera_sousa,Alezera Sousa,,"@GeneralMourao O combate ao desmatamento na Amazônia é igual ao combate ao Coronavirus! Estamos perdendo de 270.000 a zero! Mais uma prova que administração militar não serve e não presta. Se fosse boa, EUA, Inglaterra, Alemanha, Japão seriam todos governados por militares.🤷🏻‍♂️🤷🏻‍♂️",pt,[],[],[],0,0,0,[],[],https://twitter.com/alezera_sousa/status/1371666914913701893,False,,0,,,,,,,,"[{'screen_name': 'GeneralMourao', 'name': 'General Hamilton Mourão', 'id': '1058819604741525510'}]",,,,
1371664337178402816,1371484340895502337,2021-03-16 00:27:16 -03,2021-03-16,00:27:16,-0300,69084486,farenzenahenri,Henrique Farenzena,,"@folha ☝️Olá tenho uma pergunta. Se o desmatamento da Amazônia foi o maior em 12 anos, porque no ano de 2008 quando o PT Governava que foi um ano ainda mais crítico para Amazônia nenhum meio de comunicação estava preocupado em noticiar? Desde já agradeço",pt,[],[],[],0,0,0,[],[],https://twitter.com/FarenzenaHenri/status/1371664337178402816,False,,0,,,,,,,,"[{'screen_name': 'folha', 'name': 'Folha de S.Paulo', 'id': '14594813'}]",,,,
1371662214478884864,1371660497909641222,2021-03-16 00:18:50 -03,2021-03-16,00:18:50,-0300,538659930,anagod0y,ana,,"e vale lembrar que enquanto a Marina foi Ministra do Meio Ambiente, durante o governo do Lula, de 2003 a 2008, foi o período em que foi registrada uma das maiores quedas no desmatamento da Amazônia.  Beijos e boa noite, @MarinaSilva te adoro 🤍🌱",pt,"[{'screen_name': 'marinasilva', 'name': 'marina silva', 'id': '105155795'}]",[],[],0,1,9,[],[],https://twitter.com/anagod0y/status/1371662214478884864,False,,0,,,,,,,,[],,,,
1371658392008323074,1371658392008323074,2021-03-16 00:03:39 -03,2021-03-16,00:03:39,-0300,2879711974,wendellsiqueirx,wendell,,"quem é carla diaz?  para o cego, a escuridão  para o faminto, a fome para o feio, o espelho para o oceano,a poluição  para a amazônia, o desmatamento para o pantanal, as queimadas",pt,[],[],[],0,0,0,[],[],https://twitter.com/wendellsiqueirx/status/1371658392008323074,False,,0,,,,,,,,[],,,,
1371657915074019333,1371657915074019333,2021-03-16 00:01:45 -03,2021-03-16,00:01:45,-0300,1339365085907709953,dontbiame,david,,"quem é carla diaz?  para o cego, a escuridão  para o faminto, a fome para o feio, o espelho para o oceano,a poluição  para a amazônia, o desmatamento para o pantanal, as queimadas",pt,[],[],[],1,0,3,[],[],https://twitter.com/dontbIame/status/1371657915074019333,False,,0,,,,,,,,[],,,,
1371657627680276480,1371657627680276480,2021-03-16 00:00:37 -03,2021-03-16,00:00:37,-0300,2577104042,yourstefani,️️ؘ,,"quem é carla diaz?  para o cego, a escuridão  para o faminto, a fome para o feio, o espelho para o oceano,a poluição  para a amazônia, o desmatamento para o pantanal, as queimadas",pt,[],[],[],1,0,1,[],[],https://twitter.com/yourstefani/status/1371657627680276480,False,,0,,,,,,,,[],,,,
1371651801422893060,1371606721341353987,2021-03-15 23:37:28 -03,2021-03-15,23:37:28,-0300,169181717,otaviogrecco,otaviomgrecco,,"@gabilotta @DaniloThomaz88 @felipeneto ...lembra logo no começo do mandato, que os caras do satélite da Amazônia alertaram sobre desmatamento e incêndios? Foi varrido pra fora. Aquilo era um aperitivo",pt,[],[],[],1,0,2,[],[],https://twitter.com/otaviogrecco/status/1371651801422893060,False,,0,,,,,,,,"[{'screen_name': 'gabilotta', 'name': 'Gabriela Lotta #TodosPelasVacinas!', 'id': '101603995'}, {'screen_name': 'DaniloThomaz88', 'name': 'Danilo Thomaz', 'id': '1191482879701848064'}, {'screen_name': 'felipeneto', 'name': 'Felipe Neto', 'id': '14128609'}]",,,,
1371612956937617408,1371612956937617408,2021-03-15 21:03:06 -03,2021-03-15,21:03:06,-0300,1190370129953079297,luiswilke3,LUIS 🇧🇷🇺🇸💪🏻🤘🎼🥁,,Desmatamento na Amazônia tem queda de 34% em fevereiro - RENOVA Mídia #Cnnbrasil  https://t.co/Cuo1xbdN4k,pt,[],['https://renovamidia.com.br/desmatamento-na-amazonia-tem-queda-de-34-em-fevereiro/'],[],0,0,0,['cnnbrasil'],[],https://twitter.com/LUISWILKE3/status/1371612956937617408,False,,0,,,,,,,,[],,,,
1371605901291966467,1371605897450037248,2021-03-15 20:35:04 -03,2021-03-15,20:35:04,-0300,1536346855,escoladedados,Escola de Dados,,Os participantes do curso 'Jornalismo de dados ambientais: no rastro do desmatamento da Amazônia' poderão interagir em tempo real e tirar dúvidas por meio de um chat exclusivo.  https://t.co/bYLwGc2cHC,pt,[],['https://escoladedados.org/courses/jornalismo-de-dados-ambientais/'],[],1,0,1,[],[],https://twitter.com/EscolaDeDados/status/1371605901291966467,False,,0,,,,,,,,[],,,,
1371605900092379144,1371605897450037248,2021-03-15 20:35:04 -03,2021-03-15,20:35:04,-0300,1536346855,escoladedados,Escola de Dados,,"O curso 'Jornalismo de dados ambientais: no rastro do desmatamento da Amazônia' será formado por videoaulas e aulas ao vivo com especialistas, contabilizando 12 horas ao longo de 4 semanas.  https://t.co/Gg313eQkrQ",pt,[],['https://escoladedados.org/2021/03/jornalismo-de-dados-ambientais-no-rastro-do-desmatamento-da-amazonia/'],[],1,1,1,[],[],https://twitter.com/EscolaDeDados/status/1371605900092379144,False,,0,,,,,,,,[],,,,
1371605897450037248,1371605897450037248,2021-03-15 20:35:03 -03,2021-03-15,20:35:03,-0300,1536346855,escoladedados,Escola de Dados,,"O curso 'Jornalismo de dados ambientais: no rastro do desmatamento da Amazônia' capacitará comunicadores, a conduzirem robustas investigações jornalísticas baseadas em dados ambientais para cobertura de queimadas e desmatamento na Amazônia.  https://t.co/bYLwGc2cHC  https://t.co/2rTSdtUGS8",pt,[],['https://escoladedados.org/courses/jornalismo-de-dados-ambientais/'],['https://pbs.twimg.com/media/EwjrqeMWEAMnnja.png'],1,4,15,[],[],https://twitter.com/EscolaDeDados/status/1371605897450037248,False,,1,https://pbs.twimg.com/media/EwjrqeMWEAMnnja.png,,,,,,,[],,,,
1371588904193757188,1314618772473421824,2021-03-15 19:27:32 -03,2021-03-15,19:27:32,-0300,1363164864974376962,valdenirserafin,Valdenir Serafin,,"@_AmandaKlein Sobre o desmatamento, primeiro vc deveria ir até o local para  entender um pouco do assunto, pois vc só fala o que a mídia porca e comunista escreve, aprenda que a Amazônia não é o pulmão do mundo e sim o ar condicionado e que as árvores mais velhas estão emitindo gás carbônico",pt,[],[],[],0,0,0,[],[],https://twitter.com/ValdenirSerafin/status/1371588904193757188,False,,0,,,,,,,,"[{'screen_name': '_AmandaKlein', 'name': 'Amanda Klein', 'id': '417216391'}]",,,,
1371582295078023169,1371582295078023169,2021-03-15 19:01:16 -03,2021-03-15,19:01:16,-0300,90444787,ongfase,FASE - Solidariedade e Educação,,80% do desmatamento da Amazônia está  diretamente  conectado à carne bovina 🐄 - e o acordo comercial UE-Mercosul aumentaria dramaticamente as importações de carne bovina dos países amazônicos.  #StopEUMercosur,pt,[],[],[],0,0,1,['stopeumercosur'],[],https://twitter.com/ONGFase/status/1371582295078023169,False,,0,,,,,,,,[],,,,
1371567136213245959,1371567136213245959,2021-03-15 18:01:02 -03,2021-03-15,18:01:02,-0300,3077803149,tanquindaheejin,músculo reto abdominal de ha sooyoung,,Meu deus mais desmatamento redondezas de konoha pior que Amazônia,pt,[],[],[],0,0,1,[],[],https://twitter.com/tanquindaheejin/status/1371567136213245959,False,,0,,,,,,,,[],,,,
1371562051580141571,1371562051580141571,2021-03-15 17:40:50 -03,2021-03-15,17:40:50,-0300,90444787,ongfase,FASE - Solidariedade e Educação,,"Tanto 2019 quanto 2020 testemunharam incêndios recordes na Amazônia brasileira - em grande parte impulsionados pelo desmatamento ilegal e grilagem de terras.  Se não quisermos incentivar ainda mais a destruição da Amazônia, precisamos  #StopEUMercosur",pt,[],[],[],0,0,0,['stopeumercosur'],[],https://twitter.com/ONGFase/status/1371562051580141571,False,,0,,,,,,,,[],,,,
1371561488834527240,1371561488834527240,2021-03-15 17:38:35 -03,2021-03-15,17:38:35,-0300,1275868561911812096,patriota7m,MartinsPatriota7,,Desmatamento na Amazônia tem queda de 34% em fevereiro - RENOVA Mídia  https://t.co/P7vZCs29aF via @renovamidia,pt,"[{'screen_name': 'renovamidia', 'name': 'renova', 'id': '1388402174'}]",['https://renovamidia.com.br/desmatamento-na-amazonia-tem-queda-de-34-em-fevereiro/'],[],0,1,3,[],[],https://twitter.com/Patriota7M/status/1371561488834527240,False,,0,,,,,,,,[],,,,
1371557115135983616,1371557115135983616,2021-03-15 17:21:13 -03,2021-03-15,17:21:13,-0300,90444787,ongfase,FASE - Solidariedade e Educação,,"20% da soja e 17% das exportações de carne bovina para a UE das regiões do Cerrado e Amazónia do Brasil estão ligados ao desmatamento ilegal, conhecidos por estarem levando a cabo a grilagem de terras, violência contra povos indígenas e trabalho escravo.  #StopEUMercosur",pt,[],[],[],0,0,1,['stopeumercosur'],[],https://twitter.com/ONGFase/status/1371557115135983616,False,,0,,,,,,,,[],,,,
1371552091550969860,1371552091550969860,2021-03-15 17:01:15 -03,2021-03-15,17:01:15,-0300,90444787,ongfase,FASE - Solidariedade e Educação,,"""Em uma nova pesquisa, 75% dos entrevistados em 12 países europeus dizem que o acordo UE-Mercosul não deve ser ratificado se o Brasil de Bolsonaro não acabar com o desmatamento na Amazônia.  Não vai - e o acordo proposto iria acelerá-lo.  #StopEUMercosur",pt,[],[],[],0,0,0,['stopeumercosur'],[],https://twitter.com/ONGFase/status/1371552091550969860,False,,0,,,,,,,,[],,,,
1371547862643970055,1371547862643970055,2021-03-15 16:44:27 -03,2021-03-15,16:44:27,-0300,139554243,cuidandodosrios,FONASC.CBH,,"A Articulação Pantanal, Cerrado e Amazônia é uma coalizão ampla com o objetivo de fortalecer o campo popular na incidência de disputa de narrativas sobre as razões dos incêndios e desmatamento.   Leia mais aqui:  https://t.co/NbcsD4dauC  #FONASCCBH #CuidandoDosRios #Pantanal",pt,[],['http://fonasc-cbh.org.br/?p=23718'],[],0,0,0,"['fonasccbh', 'cuidandodosrios', 'pantanal']",[],https://twitter.com/cuidandodosrios/status/1371547862643970055,False,,0,,,,,,,,[],,,,
1371540172890849293,1371540172890849293,2021-03-15 16:13:53 -03,2021-03-15,16:13:53,-0300,6135602,dw_brasil,DW Brasil,,"Em entrevista à DW Brasil, Nestor Forster, representante do Brasil em Washington, critica dossiê entregue por ONGs ao presidente americano e diz que países discutem projetos para combater desmatamento na Amazônia.   https://t.co/hI7eYBcRIJ",pt,[],['https://www.dw.com/pt-br/biden-mudou-estilo-na-rela%C3%A7%C3%A3o-com-o-brasil-diz-embaixador-nos-eua/a-56880007'],[],0,1,19,[],[],https://twitter.com/dw_brasil/status/1371540172890849293,False,,0,,,,,,,,[],,,,
1371539309421989888,1371539309421989888,2021-03-15 16:10:27 -03,2021-03-15,16:10:27,-0300,1586388810,dnepstad1,Dan Nepstad,,De onde vc tirou isto?  Voltando para o ponto: temos que tomar muito cuidado em lancar graficos isolados na midia social. Há uma longa historia de graficos associando eventos ou fatores individuais com tendencias no desmatamento da Amazonia. Atrapalha.,pt,[],[],[],1,0,1,[],[],https://twitter.com/dnepstad1/status/1371539309421989888,False,https://twitter.com/RajaoPhD/status/1371524985823629314,0,,,,,,,,[],,,,
1371539193017606144,1371539193017606144,2021-03-15 16:10:00 -03,2021-03-15,16:10:00,-0300,383359690,umagotanooceano,Uma Gota no Oceano,,Dados foram usados pelo governo em sua defesa no STF na ação que cobra a retomada de um Plano de Prevenção e Controle do Desmatamento na Amazônia.   https://t.co/1ruXahkrfT,pt,[],['https://bit.ly/3rQ2uTp'],[],0,0,0,[],[],https://twitter.com/UmaGotaNoOceano/status/1371539193017606144,False,,0,,,,,,,,[],,,,
1371521970387439618,1371521962044964864,2021-03-15 15:01:34 -03,2021-03-15,15:01:34,-0300,1158389772920020993,secomvc,SecomVc,,"A diminuição é resultado da atuação ininterrupta das Forças Armadas, das agências ambientais e dos órgãos de segurança pública no combate ao desmatamento e a ilícitos ambientais na Amazônia Legal.",pt,[],[],[],1,56,303,[],[],https://twitter.com/secomvc/status/1371521970387439618,False,,0,,,,,,,,[],,,,
1371521962044964864,1371521962044964864,2021-03-15 15:01:32 -03,2021-03-15,15:01:32,-0300,1158389772920020993,secomvc,SecomVc,,"A Operação Verde Brasil 2 segue apresentando resultados expressivos no combate ao desmatamento na Amazônia. Em fevereiro, os avisos na região apresentaram queda de 34% em comparação com o mesmo mês do ano passado. Nos últimos sete meses, a redução acumulada chegou a 21%.  https://t.co/uThb7RKa8m",pt,[],[],['https://pbs.twimg.com/media/Ewif4DRW8AAfvE_.jpg'],25,273,997,[],[],https://twitter.com/secomvc/status/1371521962044964864,False,,1,https://pbs.twimg.com/media/Ewif4DRW8AAfvE_.jpg,,,,,,,[],,,,
1371519960539877387,1371519960539877387,2021-03-15 14:53:34 -03,2021-03-15,14:53:34,-0300,964192622838509571,naclaraan,anna 🎗,,O meu maior orgulho de hoje foi o Green Peace me ligando e me agradecendo por ter assinado um abaixo-assinado contra o desmatamento da Amazônia e falando que fecharam 5 madeireiras ilegais! 💚,pt,[],[],[],0,0,1,[],[],https://twitter.com/naclaraan/status/1371519960539877387,False,,0,,,,,,,,[],,,,
1371518218272145409,1371518218272145409,2021-03-15 14:46:39 -03,2021-03-15,14:46:39,-0300,1221218015791984640,sergiocampelo_,Sergio Campelo,,"“Conter o desmatamento na Amazônia é uma necessidade, em conjunto com a redução da construção de barragens e aumento do reflorestamento. Seguir devastando a floresta nas taxas atuais parece certamente piorar o aquecimento no mundo inteiro”. Via @natgeobrasil",pt,"[{'screen_name': 'natgeobrasil', 'name': 'national geographic', 'id': '28589824'}]",[],[],0,2,2,[],[],https://twitter.com/sergiocampelo_/status/1371518218272145409,False,https://twitter.com/matthewshirts/status/1371515401264304130,0,,,,,,,,[],,,,
1371510316182409220,1371510316182409220,2021-03-15 14:15:15 -03,2021-03-15,14:15:15,-0300,18030118,ijnetportugues,IJNet em Português,,Aprenda como usar jornalismo de dados para rastrear o desmatamento na Amazônia neste curso online #gratuito da @EscolaDeDados com apoio da @earthjournalism. Dois participantes ganharão bolsas de reportagem de R$8 mil.  https://t.co/UIuGczwHxf  https://t.co/7Ud91leHnr,pt,"[{'screen_name': 'escoladedados', 'name': 'escola de dados', 'id': '1536346855'}, {'screen_name': 'earthjournalism', 'name': 'earth journalism network', 'id': '74903828'}]",['http://ow.ly/h42T50DXiYK'],['https://pbs.twimg.com/media/EwiVXVWWYAUfyUw.png'],0,0,9,['gratuito'],[],https://twitter.com/IJNetPortugues/status/1371510316182409220,False,,1,https://pbs.twimg.com/media/EwiVXVWWYAUfyUw.png,,,,,,,[],,,,
1371505678053994499,1371463198046629888,2021-03-15 13:56:49 -03,2021-03-15,13:56:49,-0300,261211302,de2011vargas,Adelcio Vargas 🇦🇷🇨🇦🇵🇹🇫🇷🇺🇳🏴🚩,,"@jurubebanoh @Hugojundiai @willoferreira @VEJA @radaronline Vc já parou pra pensar no que vc disse? Se são competentes como vc diz e estão vigiando a Amazônia, pq a região registra desmatamento e queimadas recordes? Os ""competentes"" não fizeram nada pra coibir? Ou vc está querendo dizer que eles eram cúmplices?",pt,[],[],[],1,0,0,[],[],https://twitter.com/De2011vargas/status/1371505678053994499,False,,0,,,,,,,,"[{'screen_name': 'jurubebanoh', 'name': 'Arthur Lopes Teixeira', 'id': '845403721181880323'}, {'screen_name': 'Hugojundiai', 'name': 'Hugo Neto', 'id': '79447379'}, {'screen_name': 'willoferreira', 'name': 'Will Ferreira (de 🏠)', 'id': '44156404'}, {'screen_name': 'VEJA', 'name': 'VEJA', 'id': '17715048'}, {'screen_name': 'radaronline', 'name': 'Radar', 'id': '28407958'}]",,,,
1371492292431863811,1371492292431863811,2021-03-15 13:03:38 -03,2021-03-15,13:03:38,-0300,1110274574166437888,marciasalmeida,Márcia Silveira,,Desmatamento na Amazônia tem queda de 34% em fevereiro - RENOVA Mídia  https://t.co/zILjBwzpCc via @renovamidia,pt,"[{'screen_name': 'renovamidia', 'name': 'renova', 'id': '1388402174'}]",['https://renovamidia.com.br/desmatamento-na-amazonia-tem-queda-de-34-em-fevereiro/'],[],1,4,6,[],[],https://twitter.com/MarciaSAlmeida/status/1371492292431863811,False,,0,,,,,,,,[],,,,
1371484357421113347,1371484357421113347,2021-03-15 12:32:06 -03,2021-03-15,12:32:06,-0300,41893418,dinisil,DiniSil,,Desmatamento na Amazônia tem queda de 34% em fevereiro - RENOVA Mídia  https://t.co/ShkW2zRsIk,pt,[],['https://renovamidia.com.br/desmatamento-na-amazonia-tem-queda-de-34-em-fevereiro/'],[],0,0,0,[],[],https://twitter.com/DiniSil/status/1371484357421113347,False,,0,,,,,,,,[],,,,
1371484238634160133,1371484238634160133,2021-03-15 12:31:38 -03,2021-03-15,12:31:38,-0300,1586388810,dnepstad1,Dan Nepstad,,Eh muito importante distinguir entre correlação e causalidade--especialmente em sistemas complexos como desmatamento na Amazonia.  Este grafico eh uma correlação--falta mostrar causalidade @RajaoPhD,pt,"[{'screen_name': 'rajaophd', 'name': 'raoni rajão 🇧🇷', 'id': '1070270400662265856'}]",[],[],2,0,3,[],[],https://twitter.com/dnepstad1/status/1371484238634160133,False,https://twitter.com/RajaoPhD/status/1371058707270877186,0,,,,,,,,[],,,,
1371483304269115397,1371483304269115397,2021-03-15 12:27:55 -03,2021-03-15,12:27:55,-0300,1004415776101715969,amigosterrabr,Amigxs da Terra Brasil,,"80% do desmatamento da Amazônia está diretamente ligado à pecuária bovina.  O acordo #UEMercosul aumentará as importações de carne brasileira e, com isso, a destruição da floresta e a violação de direitos dos povos tradicionais.   Por isso dizemos: #StopEUMercosur #StopUEMercosul",pt,[],[],[],0,1,6,"['uemercosul', 'stopeumercosur', 'stopuemercosul']",[],https://twitter.com/amigosterrabr/status/1371483304269115397,False,,0,,,,,,,,[],,,,
1371481816872456194,1371481816872456194,2021-03-15 12:22:00 -03,2021-03-15,12:22:00,-0300,563149212,prmiguelcirilo,Miguel Cirilo 🇧🇷🇧🇷#Deus acima de tudo!,,Desmatamento na Amazônia tem queda de 34% em fevereiro  Mais a globo diz que foi pelo motivo das chuvas no local.  Difícil admitir o bom trabalho do ministro do meio ambiente @rsallesmma e do presidente  Bolsonaro.,pt,"[{'screen_name': 'rsallesmma', 'name': 'ricardo salles', 'id': '971822131024748545'}]",[],[],0,0,0,[],[],https://twitter.com/prmiguelcirilo/status/1371481816872456194,False,,0,,,,,,,,[],,,,
1371478890745581574,1371478890745581574,2021-03-15 12:10:23 -03,2021-03-15,12:10:23,-0300,1067743649151283200,marcos_antcost,Marco Antonio🇧🇷🇺🇸🇵🇹🇳🇱🇵🇱🇯🇵,,Desmatamento na Amazônia tem queda de 34% em fevereiro.   A DISGRETA e o Cornon🇫🇷 não se manifestam ?   https://t.co/wPMMLyrTQU,pt,[],['https://renovamidia.com.br/desmatamento-na-amazonia-tem-queda-de-34-em-fevereiro/'],[],1,24,57,[],[],https://twitter.com/marcos_AntCost/status/1371478890745581574,False,,0,,,,,,,,[],,,,
1371478134030225411,1371478134030225411,2021-03-15 12:07:22 -03,2021-03-15,12:07:22,-0300,979468154488442882,denise47613384,denise,,Desmatamento na Amazônia tem queda de 34% em fevereiro - RENOVA Mídia  Não veremos essa notícia na mídia podre. Parabéns ⁦@rsallesmma⁩   https://t.co/g7MdzK7kxN,pt,"[{'screen_name': 'rsallesmma', 'name': 'ricardo salles', 'id': '971822131024748545'}]",['https://renovamidia.com.br/desmatamento-na-amazonia-tem-queda-de-34-em-fevereiro/'],[],0,6,21,[],[],https://twitter.com/denise47613384/status/1371478134030225411,False,,0,,,,,,,,[],,,,
1371472327377051652,1371472327377051652,2021-03-15 11:44:18 -03,2021-03-15,11:44:18,-0300,3048589487,herminioaneto,Hermínio Almeida,,Desmatamento na Amazônia tem queda de 34% em fevereiro  https://t.co/hY2H91wST6,pt,[],['https://renovamidia.com.br/desmatamento-na-amazonia-tem-queda-de-34-em-fevereiro/'],[],0,0,1,[],[],https://twitter.com/herminioaneto/status/1371472327377051652,False,,0,,,,,,,,[],,,,
1371471749754290178,1371471749754290178,2021-03-15 11:42:00 -03,2021-03-15,11:42:00,-0300,952305403769081856,vejaissob,Antonio Rodrigues,,Desmatamento na Amazônia tem queda de 34% em fevereiro – RENOVA Mídia  https://t.co/HMK5G4KSi2,pt,[],['http://dissovocesabia.com/2021/03/15/desmatamento-na-amazonia-tem-queda-de-34-em-fevereiro-renova-midia/'],[],0,0,0,[],[],https://twitter.com/vejaissob/status/1371471749754290178,False,,0,,,,,,,,[],,,,
1371471441972051969,1371452448502611969,2021-03-15 11:40:47 -03,2021-03-15,11:40:47,-0300,1367538914815332354,anamore85150114,ANPEKLA,,@BlogdoNoblat Gestor bom é o Pazuelo @GeneralMourao ??? Ou você mesmo? Até agora só vejo militar mamando na teta. Você acha que foi um bom gestor e diminuiu o desmatamento na Amazônia?,pt,"[{'screen_name': 'generalmourao', 'name': 'general hamilton mourão', 'id': '1058819604741525510'}]",[],[],0,0,0,[],[],https://twitter.com/AnaMore85150114/status/1371471441972051969,False,,0,,,,,,,,"[{'screen_name': 'BlogdoNoblat', 'name': 'Blog do Noblat', 'id': '16794066'}]",,,,
1371470314144694272,1371470314144694272,2021-03-15 11:36:18 -03,2021-03-15,11:36:18,-0300,17752026,roxmo,Roger Rocha Moreira,,Desmatamento na Amazônia tem queda de 34% em fevereiro - RENOVA Mídia  https://t.co/XN1N6n3td3 via @renovamidia,pt,"[{'screen_name': 'renovamidia', 'name': 'renova', 'id': '1388402174'}]",['https://renovamidia.com.br/desmatamento-na-amazonia-tem-queda-de-34-em-fevereiro/'],[],47,711,2950,[],[],https://twitter.com/roxmo/status/1371470314144694272,False,,0,,,,,,,,[],,,,
1371465708874399746,1371465708874399746,2021-03-15 11:18:00 -03,2021-03-15,11:18:00,-0300,1245063763923009538,conaquilombos,Conaq,,"80% do desmatamento da Amazônia está  diretamente conectado à carne bovina 🐄 - e o acordo comercial UE-Mercosul aumentaria dramaticamente as importações de carne bovina dos países amazônicos.  #StopEUMercosur  https://t.co/A15XYMJVWj""  https://t.co/T3Mm5WWAil",pt,[],['https://stopeumercosur.org/#coalition-statement'],['https://pbs.twimg.com/media/EwhiyXbWgAASGen.jpg'],0,0,5,['stopeumercosur'],[],https://twitter.com/conaquilombos/status/1371465708874399746,False,,1,https://pbs.twimg.com/media/EwhiyXbWgAASGen.jpg,,,,,,,[],,,,
1371463996423954432,1371463996423954432,2021-03-15 11:11:11 -03,2021-03-15,11:11:11,-0300,1033109042191847424,jambock67,George S Patton 🇧🇷🇧🇷🇧🇷🇧🇷,,Desmatamento na Amazônia tem queda de 34% em fevereiro.  https://t.co/9fJh97enZs,pt,[],['https://renovamidia.com.br/desmatamento-na-amazonia-tem-queda-de-34-em-fevereiro/'],[],0,6,18,[],[],https://twitter.com/Jambock67/status/1371463996423954432,False,,0,,,,,,,,[],,,,
