id,conversation_id,created_at,date,time,timezone,user_id,username,name,place,tweet,language,mentions,urls,photos,replies_count,retweets_count,likes_count,hashtags,cashtags,link,retweet,quote_url,video,thumbnail,near,geo,source,user_rt_id,user_rt,retweet_id,reply_to,retweet_date,translate,trans_src,trans_dest
1365775988194484225,1365775988194484225,2021-02-27 18:29:05 SA Eastern Standard Time,2021-02-27,18:29:05,-0300,67934324,oliveira_oj,Oliveira 🔰,,"Se é pra monitorar queimadas na Amazônia pro governo Bozo, esse satélite certamente é míope.... 🤣🤣🤣🤣🤣",pt,[],[],[],0,1,4,[],[],https://twitter.com/Oliveira_OJ/status/1365775988194484225,False,https://twitter.com/jairbolsonaro/status/1365745194361118720,0,,,,,,,,[],,,,
1365763976462807042,1365745194361118720,2021-02-27 17:41:21 SA Eastern Standard Time,2021-02-27,17:41:21,-0300,1135974928241569793,palmeirasalway,Nardão,,"@jairbolsonaro @mctic @Astro_Pontes Para ver se realmente as queimadas , as invasões , o desmatamento , o garimpo ilegal , estão mesmo acontecendo da forma que o governo quer , acabar de vez com a Amazônia.  Falando em ciência : cadê as VACINAS seu tosco.",pt,[],[],[],0,0,0,[],[],https://twitter.com/Palmeirasalway/status/1365763976462807042,False,,0,,,,,,,,"[{'screen_name': 'jairbolsonaro', 'name': 'Jair M. Bolsonaro', 'id': '128372940'}, {'screen_name': 'Astro_Pontes', 'name': 'Marcos Pontes', 'id': '93339429'}]",,,,
1365758787026567177,1365758787026567177,2021-02-27 17:20:44 SA Eastern Standard Time,2021-02-27,17:20:44,-0300,145403337,ciprianypatriot,Cipriany🇧🇷 Patriota 🇧🇷,,Ninguém fala mais nas queimadas da Amazônia! #BolsoLenda,pt,[],[],[],1,0,2,['bolsolenda'],[],https://twitter.com/CiprianyPatriot/status/1365758787026567177,False,https://twitter.com/lu_cssa/status/1365758402912268291,0,,,,,,,,[],,,,
1365673613383327746,1365673613383327746,2021-02-27 11:42:17 SA Eastern Standard Time,2021-02-27,11:42:17,-0300,56687416,resparta,"Ricardo E. / 587797 😢, 💉🐊😊 #ForaBozo",,"Queimadas aumentando e infrações caindo... e o anti-ministro diz que o governo fez a parte dele, ou seja, confessa que para esse governo não interessa perseguir criminosos e proteger a Amazônia",pt,[],[],[],0,0,1,[],[],https://twitter.com/resparta/status/1365673613383327746,False,https://twitter.com/fakebookeco/status/1360002676461887490,0,,,,,,,,[],,,,
1365665005866221569,1365665005866221569,2021-02-27 11:08:04 SA Eastern Standard Time,2021-02-27,11:08:04,-0300,954803978679832578,korsakovisk,Sheza,,Campanha cobra países e empresas a pararem de financiar Bolsonaro por queimadas na Amazônia   https://t.co/LuLmfzPvfG,pt,[],['https://climainfo.org.br/2020/09/03/campanha-cobra-paises-e-empresas-a-pararem-de-financiar-bolsonaro-por-queimadas-na-amazonia/'],[],0,0,0,[],[],https://twitter.com/Korsakovisk/status/1365665005866221569,False,,0,,,,,,,,[],,,,
1365663941729411075,1365663941729411075,2021-02-27 11:03:51 SA Eastern Standard Time,2021-02-27,11:03:51,-0300,1107604472,carolineccacela,Cᴀʀᴏʟɪɴᴇ #SOSPantanal,,"O Alecrim Dourado não ver as queimadas no Estado dele, acha que Amazônia é só Manaus, acredita que as notícias sobre o desmatamento é uma conspiração comunista da Globo  Ô Alecrim, sai da tua bolha da ignorância e estuda mais o bioma onde tu mora  https://t.co/vok9Qhn4vm",pt,[],[],"['https://pbs.twimg.com/media/EvPQGDBXAAQMMkZ.jpg', 'https://pbs.twimg.com/media/EvPQGriWgAA6-KN.jpg']",0,0,0,[],[],https://twitter.com/CarolineCCacela/status/1365663941729411075,False,,1,https://pbs.twimg.com/media/EvPQGDBXAAQMMkZ.jpg,,,,,,,[],,,,
1365496587418492928,1365487302101852164,2021-02-26 23:58:50 SA Eastern Standard Time,2021-02-26,23:58:50,-0300,1292290479401377794,kashiiiv,Kashiiiv(Futuro Vtuber Samurai),,"@mill01875539 @rodateto ·Foi contra a democracia ·Sabia da falta de oxigênio em Manaus ·Não fez nada em relação a covid no Brasil, tiveram que fazer por ele ·Não ligou pra as queimadas na Amazônia e de Mato Grosso ·Se mostrou um homem genocida desumano Puta melhor presidente de todos os tempos!",pt,[],[],[],2,0,2,[],[],https://twitter.com/kashiiiv/status/1365496587418492928,False,,0,,,,,,,,"[{'screen_name': 'mill01875539', 'name': 'Malo', 'id': '1327228905359634434'}, {'screen_name': 'rodateto', 'name': 'rodateto sem pantim', 'id': '132331764'}]",,,,
1365469473948459010,1365417051414741002,2021-02-26 22:11:06 SA Eastern Standard Time,2021-02-26,22:11:06,-0300,1271525344324071430,brunoogoja,Goja,,"@silviogrimaldo O @fabiowoficial já deveria ter sido mandado embora faz tempo , só está no governo pois é puxa saco do Bolsonaro , a Secom no comando dele só deixava as narrativas contra o PR crescer , na época das queimadas na Amazônia ele não fez nada para derrubar as narrativas.",pt,"[{'screen_name': 'fabiowoficial', 'name': 'fabio wajngarten', 'id': '1109269570999775232'}]",[],[],0,0,0,[],[],https://twitter.com/BrunooGoja/status/1365469473948459010,False,,0,,,,,,,,"[{'screen_name': 'silviogrimaldo', 'name': 'Silvio Grimaldo', 'id': '15918946'}]",,,,
1365466591069093889,1365465968089169927,2021-02-26 21:59:39 SA Eastern Standard Time,2021-02-26,21:59:39,-0300,1248092646452670465,rafael87030471,Enquanto durar 3..2..1,,@leandroruschel é melhor n perguntar muito.... se não eles vão começar a falar que o brasil está ameaçando o mundo com a cepa da amazônia .....e relacionar essa pandemia tb com as queimadas e mortes de girafas indefesas.,pt,[],[],[],2,4,12,[],[],https://twitter.com/Rafael87030471/status/1365466591069093889,False,,0,,,,,,,,"[{'screen_name': 'leandroruschel', 'name': 'Leandro Ruschel 🇧🇷🇺🇸🇮🇹🇩🇪', 'id': '174818242'}]",,,,
1365407702323785728,1365398908835221504,2021-02-26 18:05:38 SA Eastern Standard Time,2021-02-26,18:05:38,-0300,336072544,djwerson,REBOLATIVISTA VACINADO,,"@CNNBrasil Vem aí: ""Não existe desmatamento nem queimadas na Amazônia, nosso novo satélite imparcial e sem ideologia confirma isso.""",pt,[],[],[],0,0,1,[],[],https://twitter.com/DjWerson/status/1365407702323785728,False,,0,,,,,,,,"[{'screen_name': 'CNNBrasil', 'name': 'CNN Brasil', 'id': '809124436880322561'}]",,,,
1365402421091045380,1365401091538620416,2021-02-26 17:44:39 SA Eastern Standard Time,2021-02-26,17:44:39,-0300,541156738,mariluparreiras,#LulaRousseff #ComLulaEm2022,,"… A próxima pandemia já será consequência dos desmatamentos e queimadas ilegais da Amazônia e do Pantanal, que aconteceram enquanto a boiada do desgoverno MALDITO genocida, foi passando pelas medidas do Ricardo Salles.",pt,[],[],[],0,0,0,[],[],https://twitter.com/MariluParreiras/status/1365402421091045380,False,,0,,,,,,,,[],,,,
1365401986011697161,1365401986011697161,2021-02-26 17:42:56 SA Eastern Standard Time,2021-02-26,17:42:56,-0300,46576649,joaovillaverde,João Villaverde,,"253 mil mortos. Hospitais entupidos, de novo, país afora. Não bastasse a sabotagem da vacinação, Bolsonaro agora combate até máscaras. Estimula queimadas na Amazônia. Tem a PGR nas mãos, além do aliado Lira na Câmara.  Mas fiquem tranquilos, talvez a Eletrobras seja privatizada.",pt,[],[],[],2,66,339,[],[],https://twitter.com/joaovillaverde/status/1365401986011697161,False,,0,,,,,,,,[],,,,
1365368535967559683,1365368535967559683,2021-02-26 15:30:00 SA Eastern Standard Time,2021-02-26,15:30:00,-0300,1312880599070314502,infovegbr,Infovegbr,,Amazônia e queimadas: como estão as negociações ambientais entre Brasil e EUA  https://t.co/nq5KNOk4Cc  https://t.co/j6jy5vF3jL,pt,[],['https://bit.ly/37Ran30'],['https://pbs.twimg.com/media/EvK9w62WYA0ukPU.png'],0,0,1,[],[],https://twitter.com/infovegbr/status/1365368535967559683,False,,1,https://pbs.twimg.com/media/EvK9w62WYA0ukPU.png,,,,,,,[],,,,
1365347824804761602,1365347824804761602,2021-02-26 14:07:43 SA Eastern Standard Time,2021-02-26,14:07:43,-0300,14655053,nat_apple,aqui está o seu lembrete...,,Esse documentário mostra o motivo das queimadas na Amazônia   https://t.co/aAGps83fYB,pt,[],['https://youtu.be/QpTMqTo_ycc'],[],0,0,0,[],[],https://twitter.com/nat_apple/status/1365347824804761602,False,,0,,,,,,,,[],,,,
1365330187727036419,1365330185088864256,2021-02-26 12:57:38 SA Eastern Standard Time,2021-02-26,12:57:38,-0300,62501888,jaqueswagner,Jaques Wagner,,A outra destina recursos para capacitar e contratar brigadas de incêndio. Precisamos atuar para reduzir as queimadas e seus impactos. São ações importantes para que consigamos combater toda essa degradação e depredação que vem acontecendo na #Amazônia.,pt,[],[],[],7,6,41,['amazônia'],[],https://twitter.com/jaqueswagner/status/1365330187727036419,False,,0,,,,,,,,[],,,,
1365286541803859969,1365286540511952905,2021-02-26 10:04:12 SA Eastern Standard Time,2021-02-26,10:04:12,-0300,999083776495030272,realaletx,Ale Teixeira⛩ 和平 卍 MOD MINIMANIA,,"Mas eu sempre me lembro daquela frase do Meruem ""vocês querem piedade, mas nunca tiveram piedade pela vida de um animal"" Eu penso nisso na nossa situação atual, os governantes não tem piedade de um animal nas queimadas da Amazônia, pq não fere eles, acha que vai ter de nós?",pt,[],[],[],0,0,0,[],[],https://twitter.com/RealAleTX/status/1365286541803859969,False,,0,,,,,,,,[],,,,
1365278466728484865,1365278466728484865,2021-02-26 09:32:06 SA Eastern Standard Time,2021-02-26,09:32:06,-0300,1253848351457644545,esecicise,alicecília,,salles é de longe o ministro mais inteligente e eficiente desse governo e faz ano que não vejo o nomezinho dele em noticia. mesmo as queimadas não levavam o nome dele. 2022 nao vai ter amazonia e geral vai ta se perguntando o q rolou,pt,[],[],[],1,0,17,[],[],https://twitter.com/esecicise/status/1365278466728484865,False,,0,,,,,,,,[],,,,
1365081935781978117,1364935898224349186,2021-02-25 20:31:10 SA Eastern Standard Time,2021-02-25,20:31:10,-0300,86981832,bispaedna,Edna Castilho,,"@MinLuizRamos Realmente, está transformando a amazônia com queimadas, reformas trabalhistas prejudicando o trabalhador e transformando o Brasil em cemitério com 250 mil mortes e o Presidente fazendo uma live falando mal das  máscaras  e 1.582 pessoas morreram só hoje, isto é vitória?",pt,[],[],[],0,0,0,[],[],https://twitter.com/BispaEdna/status/1365081935781978117,False,,0,,,,,,,,"[{'screen_name': 'MinLuizRamos', 'name': 'Ministro Luiz Ramos', 'id': '461059358'}]",,,,
1365073305011703809,1365073305011703809,2021-02-25 19:56:52 SA Eastern Standard Time,2021-02-25,19:56:52,-0300,1188451858542743552,vih_rios,Vi(sh),,"Toda vez eu saio da aula de inglês encabulada Como raios eu saí do “verb to be” pra um diálogo totalmente em inglês, sobre as queimadas na Amazônia com um professor da Califórnia ???",pt,[],[],[],2,0,14,[],[],https://twitter.com/vih_rios/status/1365073305011703809,False,,0,,,,,,,,[],,,,
1365029545146011652,1365029545146011652,2021-02-25 17:02:59 SA Eastern Standard Time,2021-02-25,17:02:59,-0300,1006202359163314178,bmjconsultoria,BMJ,,#BMJNaMídia: As queimadas e o desmatamento na #Amazônia são pontos que enfraquecem a reputação ambiental do Brasil. Países do #AcordodeParis demonstraram a intenção de ajudar. Confira a análise de nossa Gerente Verônica Prates para o @GazetadoPovo:  https://t.co/4q8Bt599pc,pt,"[{'screen_name': 'gazetadopovo', 'name': 'gazeta do povo', 'id': '15084884'}]",['https://bit.ly/37Lb7q8'],[],0,0,3,"['bmjnamídia', 'amazônia', 'acordodeparis']",[],https://twitter.com/BMJconsultoria/status/1365029545146011652,False,,0,,,,,,,,[],,,,
1365026321470996482,1364928989580713988,2021-02-25 16:50:10 SA Eastern Standard Time,2021-02-25,16:50:10,-0300,1325475476845031424,cirorodrigo6,Ciro Rodrigo,,"@FeliipeLopess @fabioyabu Ele disse isso quando questionaram o aumento das queimadas na Amazônia, lembra? ""É só comer menos e cagar um dia sim e outro não"".",pt,[],[],[],0,0,0,[],[],https://twitter.com/CiroRodrigo6/status/1365026321470996482,False,,0,,,,,,,,"[{'screen_name': 'FeliipeLopess', 'name': 'Felipe Lopes Oliveira', 'id': '62957240'}, {'screen_name': 'fabioyabu', 'name': 'Fábio Yabu', 'id': '8334342'}]",,,,
1364994612390199299,1364974784522641409,2021-02-25 14:44:10 SA Eastern Standard Time,2021-02-25,14:44:10,-0300,744200591027605504,gsm2016soares,Gustavo Soares🥊,,"@rafaelbboa Eu acho pior é que as queimadas na Amazônia do governo Bolsonaro aqueceu o clima do mundo. Depois ele mandou parar as queimadas e a Europa, Ásia e América congelaram. O Bolsonaro não tem jeito sempre tomando medidas erradas.😂",pt,[],[],[],0,0,0,[],[],https://twitter.com/Gsm2016Soares/status/1364994612390199299,False,,0,,,,,,,,"[{'screen_name': 'rafaelbboa', 'name': 'Rafael Balboa 🥊', 'id': '2159646294'}]",,,,
1364968200417509396,1339387482262171649,2021-02-25 12:59:13 SA Eastern Standard Time,2021-02-25,12:59:13,-0300,337846494,jrnetojos,JOSÉ RIBEIRO,,"@AdvogadosOacb @JoaoAlbertoAdv @GeraldoBARRAL @SrgioHenriqueA4 Será que ainda sorriem tanto assim? Depois do fogo na Amazônia e no Pantanal, com 70% a mais em queimadas e com o Ibama sucateado?",pt,[],[],[],1,0,2,[],[],https://twitter.com/JrnetoJos/status/1364968200417509396,False,,0,,,,,,,,"[{'screen_name': 'AdvogadosOacb', 'name': 'OACB Ordem dos Advogados Conservadores do Brasil', 'id': '1246220326079467520'}, {'screen_name': 'GeraldoBARRAL', 'name': 'G Barral', 'id': '136316753'}, {'screen_name': 'SrgioHenriqueA4', 'name': 'Sérgio Henrique', 'id': '941907335693459458'}]",,,,
1364965718370967560,1364965718370967560,2021-02-25 12:49:21 SA Eastern Standard Time,2021-02-25,12:49:21,-0300,42873922,rodrigopiresac,Rodrigo Pires🇧🇷,,O Acre vive sua maior crise humanitária é noticiada globalmente e não vejo nada de ajuda dos mesmos interessados na Amazônia de sempre @JoeBiden e @EmmanuelMacron. Salvem a Amazônia! Mandem vacinas! Mantimentos! Dinheiro! Agora não tem queimadas!  #SOSAcre  #acre #Brasil #eua  https://t.co/M0L32g3uEO,pt,"[{'screen_name': 'joebiden', 'name': 'joe biden', 'id': '939091'}, {'screen_name': 'emmanuelmacron', 'name': 'emmanuel macron', 'id': '1976143068'}]",[],['https://pbs.twimg.com/media/EvFVE0gWYAMnKVp.jpg'],5,2,13,"['sosacre', 'acre', 'brasil', 'eua']",[],https://twitter.com/rodrigopiresac/status/1364965718370967560,False,,1,https://pbs.twimg.com/media/EvFVE0gWYAMnKVp.jpg,,,,,,,[],,,,
1364934195525615617,1364934195525615617,2021-02-25 10:44:06 SA Eastern Standard Time,2021-02-25,10:44:06,-0300,631688271,diasdougfotos,douglas dias,,MEIO AMBIENTE.  ESTADOS UNIDOS X BRASIL. #MeioAmbiente #Amazônia #FlorestaAmazonica #Forest #Amazonrainforest Amazônia e queimadas: como estão as negociações ambientais entre Brasil e EUA  https://t.co/5sQHsmQBr9,pt,[],['https://www.gazetadopovo.com.br/republica/amazonia-brasil-eua-negociacoes-area-ambiental/'],[],0,0,0,"['meioambiente', 'amazônia', 'florestaamazonica', 'forest', 'amazonrainforest']",[],https://twitter.com/DiasDougfotos/status/1364934195525615617,False,,0,,,,,,,,[],,,,
1364933758688911368,1269296093059309569,2021-02-25 10:42:21 SA Eastern Standard Time,2021-02-25,10:42:21,-0300,1106335938844782593,marcospetry5,Marcos Petry 🇧🇷,,"@Gabrielbibobi @selenasreign @stormystic .... a maior parte da nossa pecuária nem fica na Amazônia, quem financia desmatamento são os mesmo paises que nos acusam, aliás ,  gados evitam queimadas como a que ocorreu no pantanal.",pt,[],[],[],0,0,0,[],[],https://twitter.com/MarcosPetry5/status/1364933758688911368,False,,0,,,,,,,,"[{'screen_name': 'Gabrielbibobi', 'name': 'gabe morto', 'id': '1010391484233809920'}, {'screen_name': 'selenasreign', 'name': 'lexie', 'id': '842156503'}, {'screen_name': 'stormystic', 'name': 'letícia VACINADA', 'id': '4529359342'}]",,,,
1364924099517104130,1364923597698052097,2021-02-25 10:03:59 SA Eastern Standard Time,2021-02-25,10:03:59,-0300,1234461766815551488,wandersonpedra2,wandersonpedras,,@cirogomes Volta para as queimadas na Amazônia. Da mais resultado,pt,[],[],[],0,0,0,[],[],https://twitter.com/wandersonpedra2/status/1364924099517104130,False,,0,,,,,,,,"[{'screen_name': 'cirogomes', 'name': 'Ciro Gomes', 'id': '33374761'}]",,,,
1364915542465863681,1364915542465863681,2021-02-25 09:29:58 SA Eastern Standard Time,2021-02-25,09:29:58,-0300,1317068528051257344,samynvs,samyra,,"Eu parei de comer carne, quando estava assistindo jornal e as notícias eram sobre as queimadas na Amazônia. Eu estava assistindo jornal e comendo um belo pedaço de bife. Olhei pra mim e pensei, como eu posso reclamar do desmatamento se eu financio ele? Bom dia!",pt,[],[],[],0,0,1,[],[],https://twitter.com/samynvs/status/1364915542465863681,False,,0,,,,,,,,[],,,,
1364879958884155393,1364611120846225408,2021-02-25 07:08:35 SA Eastern Standard Time,2021-02-25,07:08:35,-0300,568485507,renatoefsousa,Renato Sousa,,@CarlaZambelli38 Realmente agora vamos decolar! Imagino que deva ser uma criação dos últimos dois anos deste governo! Finalmente vamos saber a verdade sobre as queimadas da Amazônia! #Ironia,pt,[],[],[],0,0,0,['ironia'],[],https://twitter.com/renatoefsousa/status/1364879958884155393,False,,0,,,,,,,,"[{'screen_name': 'CarlaZambelli38', 'name': 'Carla Zambelli', 'id': '975127727501185025'}]",,,,
1364788301178224644,1364786316148408320,2021-02-25 01:04:22 SA Eastern Standard Time,2021-02-25,01:04:22,-0300,2911278652,detailsmessi,vinícius,,"@tchatchelo na verdade no ano todo amg. brumadinho, incêndio no alojamento do flamengo, suzano, queimadas na amazônia, o óleo no litoral, a morte do gugu... foi bem pesado em acontecimentos",pt,[],[],[],1,0,1,[],[],https://twitter.com/detailsmessi/status/1364788301178224644,False,,0,,,,,,,,"[{'screen_name': 'tchatchelo', 'name': 'marcelo', 'id': '1332586754'}]",,,,
1364766822537510915,1364766822537510915,2021-02-24 23:39:01 SA Eastern Standard Time,2021-02-24,23:39:01,-0300,90711240,gilmardarosa,Gilmar da Rosa 🇧🇷🇺🇾🇨🇭🇦🇷🇵🇸,,A Amazônia e o Mato Grosso foram os Estados mais desmatados e onde aconteceram as maiores queimadas no Brasil. Também foram os maiores produtores de soja. Entenderam a lógica disso @FAO @FAOBrasil @ONUBrasil @STF_oficial ahh @Europarl_PT vcs compram incêndios e desmantelamento,pt,"[{'screen_name': 'fao', 'name': 'fao', 'id': '19649135'}, {'screen_name': 'faobrasil', 'name': 'fao brasil', 'id': '748207086824210433'}, {'screen_name': 'onubrasil', 'name': 'onu brasil', 'id': '57763444'}, {'screen_name': 'stf_oficial', 'name': 'stf', 'id': '68313718'}, {'screen_name': 'europarl_pt', 'name': 'parlamento europeu em portugal', 'id': '40872043'}]",[],[],0,4,4,[],[],https://twitter.com/gilmardarosa/status/1364766822537510915,False,,0,,,,,,,,[],,,,
1364730536497999875,1364730071366447104,2021-02-24 21:14:50 SA Eastern Standard Time,2021-02-24,21:14:50,-0300,1271034704146370560,rhsmarks,Rafael Marques /✠/❎ Genocida é quem defende aborto,,"@CCaixista @Thiago08478647 @dan_vitti @Sh4d0wDr4g0w @GustavoTk04 Pois eh, se a Amazônia fosse toda de erva eles não se importaria com as queimadas.",pt,[],[],[],2,0,5,[],[],https://twitter.com/RHSMarks/status/1364730536497999875,False,,0,,,,,,,,"[{'screen_name': 'CCaixista', 'name': '🇧🇷Coringa🎮Caixista🎮Opressor🇧🇷', 'id': '1358917082939871236'}, {'screen_name': 'Thiago08478647', 'name': 'Thiago ☢❎ #XMG', 'id': '1354070452407332866'}, {'screen_name': 'dan_vitti', 'name': 'Allan Danilo Vitti', 'id': '1316186256750055424'}, {'screen_name': 'Sh4d0wDr4g0w', 'name': '𝕬𝖗𝖙𝖍𝖚𝖗 𝕯𝖚𝖒𝖆𝖙 🇩🇪', 'id': '931583922005331970'}]",,,,
1364690383494594578,1364690383494594578,2021-02-24 18:35:16 SA Eastern Standard Time,2021-02-24,18:35:16,-0300,1256713808262893568,spin_cast,Spincast,,"O UNIVERSO INEXPLORADO DA AMAZÔNIA  O que sabemos da nossa floresta ainda é muito limitado aos clichês. Relacionamos a Amazônia à floresta, à biodiversidade e mais recentemente, às queimadas. São assuntos de extrema relevância, obviamente, mas ainda há muito mais para explorar.  https://t.co/7RTp87RxvJ",pt,[],[],['https://pbs.twimg.com/media/EvBaXs9WYAYnB7a.jpg'],1,0,1,[],[],https://twitter.com/spin_cast/status/1364690383494594578,False,,1,https://pbs.twimg.com/media/EvBaXs9WYAYnB7a.jpg,,,,,,,[],,,,
1364630026822574087,1364340645062733832,2021-02-24 14:35:26 SA Eastern Standard Time,2021-02-24,14:35:26,-0300,869966153459879941,fabianisouza7,Fabiani souza,,"@felipeezy Conheço POC’S da nossa City precisando , mais queimadas que as  matas da Amazônia.",pt,[],[],[],0,0,0,[],[],https://twitter.com/Fabianisouza7/status/1364630026822574087,False,,0,,,,,,,,"[{'screen_name': 'felipeezy', 'name': 'Felipe Rosa', 'id': '30327152'}]",,,,
1364626943199567874,1364626943199567874,2021-02-24 14:23:11 SA Eastern Standard Time,2021-02-24,14:23:11,-0300,34629513,zazas_,José  Mendes,,Amazônia e queimadas: como estão as negociações ambientais entre Brasil e EUA  https://t.co/jP8BmYOYz0  https://t.co/iIhBpo8qNq,pt,[],['https://rota2014.blogspot.com/2021/02/amazonia-e-queimadas-como-estao-as.html'],['https://pbs.twimg.com/media/EvAg8jSWYAAZYMu.png'],0,0,0,[],[],https://twitter.com/ZazaS_/status/1364626943199567874,False,,1,https://pbs.twimg.com/media/EvAg8jSWYAAZYMu.png,,,,,,,[],,,,
1364620326454312969,1364620326454312969,2021-02-24 13:56:53 SA Eastern Standard Time,2021-02-24,13:56:53,-0300,66220255,deicideuh,Tiago Moreira,,"Apoiam o governo das queimadas, garimpeiros, fim do Fundo Amazônia e sucateamento do IBAMA, queriam que a imagem fosse boa?",pt,[],[],[],0,0,2,[],[],https://twitter.com/DeicideUH/status/1364620326454312969,False,https://twitter.com/Globo_Rural/status/1364619227416657926,0,,,,,,,,[],,,,
1364617557366493184,1364617557366493184,2021-02-24 13:45:53 SA Eastern Standard Time,2021-02-24,13:45:53,-0300,74247205,josetomazfilho,Tomaz,,#BolsonaroTemRazao Amazônia e queimadas: como estão as negociações ambientais entre Brasil e EUA  https://t.co/rDRtecbQbD,pt,[],['https://rota2014.blogspot.com/2021/02/amazonia-e-queimadas-como-estao-as.html?spref=tw'],[],0,1,1,['bolsonarotemrazao'],[],https://twitter.com/josetomazfilho/status/1364617557366493184,False,,0,,,,,,,,[],,,,
1364590415278608389,1364590415278608389,2021-02-24 11:58:02 SA Eastern Standard Time,2021-02-24,11:58:02,-0300,15084884,gazetadopovo,Gazeta do Povo,,Amazônia e queimadas: como estão as negociações ambientais entre Brasil e EUA  https://t.co/0uOaV8wbAq,pt,[],['https://www.gazetadopovo.com.br/republica/amazonia-brasil-eua-negociacoes-area-ambiental/?utm_source=twitter&utm_medium=midia-social&utm_campaign=gazeta-do-povo'],[],2,2,14,[],[],https://twitter.com/gazetadopovo/status/1364590415278608389,False,,0,,,,,,,,[],,,,
1364578536758013952,1364578536758013952,2021-02-24 11:10:50 SA Eastern Standard Time,2021-02-24,11:10:50,-0300,1187571849561030656,portalamz,Portal AMZ!,,Reunião de Wilson Lima com Hamilton Mourão busca alinhar ações de combate às queimadas e ao desmatamento na Amazônia Legal  https://t.co/FESAyUabUo,pt,[],['https://www.portalamz.com.br/reuniao-de-wilson-lima-com-hamilton-mourao-busca-alinhar-acoes-de-combate-as-queimadas-e-ao-desmatamento-na-amazonia-legal/'],[],0,0,0,[],[],https://twitter.com/PortalAmz/status/1364578536758013952,False,,0,,,,,,,,[],,,,
1364568123152740357,1364309556747259904,2021-02-24 10:29:27 SA Eastern Standard Time,2021-02-24,10:29:27,-0300,50711276,governoto,Governo do Tocantins,,"“Aeronaves adequadas para o combate às queimadas e manutenção do Tocantins na Operação Verde Brasil 2, que visa combater crimes ambientais e focos de incêndio na Amazônia Legal”. Essa foi a principal reivindicação do vice-governador @wanderlei2018.CONFIRA:  https://t.co/4LmSRMPqSs  https://t.co/kdSvn2aZ2x",pt,"[{'screen_name': 'wanderlei2018', 'name': 'wanderlei barbosa', 'id': '2799977288'}]",['https://bit.ly/2ZILWAp'],['https://pbs.twimg.com/media/Eu_rVSrWYAEjxi_.jpg'],0,0,1,[],[],https://twitter.com/governoTO/status/1364568123152740357,False,,1,https://pbs.twimg.com/media/Eu_rVSrWYAEjxi_.jpg,,,,,,,[],,,,
1364561214790107136,1364561214790107136,2021-02-24 10:02:00 SA Eastern Standard Time,2021-02-24,10:02:00,-0300,74528723,_vin0,DOPPELGANGER,,por ser aliado do trump os investidores já peidavam pra muzenga AI VEIO O LACRON E AS QUEIMADAS DA AMAZONIA e adivinha oq tavam falando CONTA OUTRA QUALQUER COISA É MOTIVO PRA INVESTIDORES DE MAMMON FUDEREM O BRASIL,pt,[],[],[],0,0,2,[],[],https://twitter.com/_vin0/status/1364561214790107136,False,https://twitter.com/danielcarvalho_/status/1364531498171400194,0,,,,,,,,[],,,,
1364405633760559109,1364404875044532227,2021-02-23 23:43:47 SA Eastern Standard Time,2021-02-23,23:43:47,-0300,1158762853236649984,buubblinee,Torizinha🌻꧇ໍ҉꙰҉꙰҉,,@jeonlouies Tiveram queimadas tipo a amazonia sabe,pt,[],[],[],0,0,0,[],[],https://twitter.com/buubblinee/status/1364405633760559109,False,,0,,,,,,,,"[{'screen_name': 'jeonlouies', 'name': 'lovely hyacinth', 'id': '4704515798'}]",,,,
1364259399066398722,1364258124631269379,2021-02-23 14:02:42 SA Eastern Standard Time,2021-02-23,14:02:42,-0300,1105137475863957507,marcosrosadasi8,🌪️Marcos Rosa🌪️🇧🇷,,@carlosjordy Alguns acham que o vírus não surgiu na China e que ele só apareceu por causa das queimadas na Amazônia e por causa do derretimento das placas glaciais!,pt,[],[],[],0,0,0,[],[],https://twitter.com/MarcosRosadaSi8/status/1364259399066398722,False,,0,,,,,,,,"[{'screen_name': 'carlosjordy', 'name': 'Carlos Jordy', 'id': '82271629'}]",,,,
